,Subreddit,Title,Epoch Time,Date,Comments,Awards,Upvotes,Downvotes,Upvote Ratio,Comment/Upvote Ratio
300,activism,"For the Student Debt Movement, Jubilee Is an Old Idea Made New",1585439909.0,"03/28/2020, 23:58:29",0,0,11,0.9585891651012819,0.92,0.0
301,activism,Iran: ArashSadeghi serves 19 years in prison for his human rights activism. Today is his 1360 day in prison. He is very ill and needs urgently our support. Please sign &amp; share the petition. Take action to FreeArash SaveArash,1583945406.0,"03/11/2020, 16:50:06",0,0,10,2.61291419186316,0.79,0.0
302,activism,"""Your Beliefs are Worthless, Unless They're Converted into Action."" - Justin King (aka Beau of the Fifth Column - @BeauTFC)",1577775480.0,"12/31/2019, 06:58:00",0,0,12,1.6711683613935548,0.88,0.0
303,activism,"We all know that people’s heads explode when high profile athletes nowadays support a socioeconomic or political cause, so how do you think people would react to the Black Power salute Tommie Smith and John Carlos did at the 68 Olympics if it happened now?",1574989552.0,"11/29/2019, 01:05:52",1,0,13,-0.011689021565281621,1.0,0.07692307692307693
304,activism,Humans deserve to have access to energy sources that are both clean and renewable to allow for a modernized life.,1603597766.0,"10/25/2020, 03:49:26",0,0,11,1.5305996733993865,0.88,0.0
305,activism,March to Protect the Integrity of Democracy,1603400083.0,"10/22/2020, 20:54:43",0,0,10,2.2547866642502576,0.82,0.0
306,activism,Glitter Political: MJ Hegar is a mama bear on a mission to unseat U.S. Sen. John Cornyn,1602799396.0,"10/15/2020, 22:03:16",0,0,10,2.1316877625296105,0.82,0.0
307,activism,elites deprive healthcare because they think your are worthless,1601826209.0,"10/04/2020, 15:43:29",1,0,12,2.3888252633338,0.83,0.08333333333333333
308,activism,Republican Senator pisses on cancer patient,1599689143.0,"09/09/2020, 22:05:43",0,0,10,1.6621577220802966,0.86,0.0
309,activism,A Legal Breakdown of the Kenosha Shooter,1599341213.0,"09/05/2020, 21:26:53",0,0,12,0.8939147668796217,0.93,0.0
310,activism,"Trump EPA’s Rollback of Toxic Waste Environmental Regulations, Explained",1599181884.0,"09/04/2020, 01:11:24",1,0,11,0.0861058548678848,0.99,0.09090909090909091
311,activism,8/22 BLM Silent Protest Photos,1598198305.0,"08/23/2020, 15:58:25",0,0,12,-0.05656801170902881,1.0,0.0
312,activism,Human rights violations in Zimbabwe spur #zimbabweanlivesmatter movement,1597441557.0,"08/14/2020, 21:45:57",0,0,10,0.900641087570925,0.92,0.0
313,activism,Forgive me for my ignorance but why is Shaun King controversial?,1597185280.0,"08/11/2020, 22:34:40",3,0,11,-0.02602521314708106,1.0,0.2727272727272727
314,activism,China's Re-education Camps and Forced Labor,1596662183.0,"08/05/2020, 21:16:23",0,0,11,1.6582348995584741,0.87,0.0
315,activism,they both just take land that oppressed people developed and turn it for a profit,1595627544.0,"07/24/2020, 21:52:24",2,0,11,1.6191349326852809,0.87,0.18181818181818182
316,activism,Tulsa Massacre in our history books,1594211047.0,"07/08/2020, 12:24:07",0,0,10,0.8652993027256812,0.92,0.0
317,activism,Help stop the US government from deploying troops against its own citizens! Sign this petition!,1591377330.0,"06/05/2020, 17:15:30",4,0,9,2.1637764323972846,0.81,0.4444444444444444
318,activism,Why not use riot shields?,1590893446.0,"05/31/2020, 02:50:46",0,0,10,0.8749814852988873,0.92,0.0
319,activism,"George Floyd: Racism Hasn't Increased, It's Being Filmed",1590876055.0,"05/30/2020, 22:00:55",0,0,12,1.6623914080799498,0.88,0.0
320,activism,BREAKING: Minneapolis Public Schools board members have written a resolution terminating the school district's contract with the Minneapolis Police Department. The University of Minnesota was the first public institution to cut ties with MPD after the killing of George Floyd.,1590804502.0,"05/30/2020, 02:08:22",1,0,11,0.07593070620720077,0.99,0.09090909090909091
321,activism,Waiting for my arrest,1590673952.0,"05/28/2020, 13:52:32",1,0,12,0.8991601232851494,0.93,0.08333333333333333
322,activism,Need Advise: Ways in which we can encourage citizens to question their govt,1588921875.0,"05/08/2020, 07:11:15",2,0,11,0.823239677429159,0.93,0.18181818181818182
323,activism,u/icesir &amp; u/derilect uncover 2 potential advertising firms responsible for the nationwide astroturfing campaign encouraging US citizens to protest quarantine.,1587340683.0,"04/19/2020, 23:58:03",0,0,10,2.7844449299514817,0.78,0.0
324,activism,Trump is preparing the ground for a totalitarian dictatorship — but we can stop him. We can beat this lying bastard if we get angry and stay angry — thousands of bodies should be reason enough,1586009809.0,"04/04/2020, 14:16:49",0,0,10,3.319445548338651,0.75,0.0
325,activism,At least the republican party is acknowledging my whistle blower e-mail account. If I could only get the senators to do the same. Notice the destination e-mail address.,1585577103.0,"03/30/2020, 14:05:03",0,0,11,1.7045142677151333,0.87,0.0
326,activism,I have a new subreddit for a more focused bit of activisim,1583458524.0,"03/06/2020, 01:35:24",0,0,11,0.9796090689687631,0.92,0.0
327,activism,Looking to interview activists and advocates on my podcast!,1576803098.0,"12/20/2019, 00:51:38",2,0,11,0.9194692538523235,0.92,0.18181818181818182
328,activism,Impeach Boris too!,1576760754.0,"12/19/2019, 13:05:54",1,0,11,1.6403836479568898,0.87,0.09090909090909091
329,activism,What we can Learn From the Continuous Protests in Algeria - The New Voice,1576622288.0,"12/17/2019, 22:38:08",0,0,11,0.9269731431254868,0.92,0.0
330,activism,Here Are My Monthly Contributions. (It's better than traditional investing),1573534872.0,"11/12/2019, 05:01:12",15,0,12,0.9694717028134647,0.93,1.25
331,activism,bONK,1603994110.0,"10/29/2020, 17:55:10",2,0,11,2.3690421997528066,0.82,0.18181818181818182
332,activism,Trump campaign spokesperson says parents of separated children don't want them back,1603483776.0,"10/23/2020, 20:09:36",2,0,10,1.5660967126898644,0.86,0.2
333,activism,Learn about Digital Activism,1600359691.0,"09/17/2020, 16:21:31",2,0,11,0.040648166771827476,1.0,0.18181818181818182
334,activism,"Find out which ways we each play a part in building a better society, and how you can find your part!",1597429925.0,"08/14/2020, 18:32:05",0,0,9,0.8195812414328358,0.92,0.0
335,activism,"Amid Covid-19 pandemic, immigrant children and parents must be released from detention -- together",1596747411.0,"08/06/2020, 20:56:51",0,0,11,0.9089093633329703,0.92,0.0
336,activism,Local Anarchist Trash Aurora Courthouse After Attack On Protest for Elijah Mcclain,1595866834.0,"07/27/2020, 16:20:34",0,0,10,0.8367428176117979,0.92,0.0
337,activism,"I made a petition for Sean Worsley, if the President can let off Roger Stone he can do this for a veteran.",1594830214.0,"07/15/2020, 16:23:34",0,0,10,0.009202155091740494,1.0,0.0
338,activism,problems within the social justice movement,1593176576.0,"06/26/2020, 13:02:56",4,0,10,0.04539753276356784,1.0,0.4
339,activism,Families separated by new Trump visa order frantic for answers,1593033829.0,"06/24/2020, 21:23:49",0,0,9,2.113207056896668,0.81,0.0
340,activism,"Someone help me please, Report him. This man said that hanging N*****s is his favorite thing to do in his hometown! I already reported him. I attempted to record/clip his voice but the audio didn't work. I'm upset that names like this are still up after activation's pledge against racism.",1592853867.0,"06/22/2020, 19:24:27",2,0,10,2.1868901457135603,0.82,0.2
341,activism,Turns out we are very good at boycotting things. Let's put the power in good use. Somebody make a list.,1592406432.0,"06/17/2020, 15:07:12",5,0,12,0.9155380754133713,0.93,0.4166666666666667
342,activism,Paint bombs blind riot cops and slicken their gear.,1591012917.0,"06/01/2020, 12:01:57",2,0,9,2.1723168575278518,0.81,0.2222222222222222
343,activism,"Family separation is back for migrants at the U.S./Mexican border, say advocates",1589838389.0,"05/18/2020, 21:46:29",0,0,10,-0.014736270518476147,1.0,0.0
344,activism,YouTube is deleting anti CCP (Chinese Communist party) comments automatically within 15 seconds.,1589809771.0,"05/18/2020, 13:49:31",0,0,9,1.5896563279635476,0.85,0.0
345,activism,Debating US Senate Candidate Mark Pukita (R-OH)!,1587942146.0,"04/26/2020, 23:02:26",0,0,8,3.1857820123647347,0.72,0.0
346,activism,Proposed new subreddit: /r/ewriseup,1587253507.0,"04/18/2020, 23:45:07",0,0,9,0.7860014616231457,0.92,0.0
347,activism,12 million elderly or disabled Americans rely on food stamps. COVID-19 risk prevents them from accessing grocery stores to use their food stamps. Sign this petition urging Congress to expand online food stamps nationwide.,1585452778.0,"03/29/2020, 03:32:58",1,0,10,0.02343380701163511,1.0,0.1
348,activism,Creative Activism,1584000823.0,"03/12/2020, 08:13:43",3,0,9,1.549682917599295,0.85,0.3333333333333333
349,activism,I had an idea,1583099699.0,"03/01/2020, 21:54:59",5,0,9,2.141134984333126,0.81,0.5555555555555556
350,activism,"I want to start using my YouTube channel, and was thinking of basing it off of activism and peace. What should my first topic be?",1581195134.0,"02/08/2020, 20:52:14",2,0,10,-0.004328195488350062,1.0,0.2
351,activism,Activist and Fandom Survey,1578767314.0,"01/11/2020, 18:28:34",2,0,10,0.01935427102973719,1.0,0.2
352,activism,Can I legally send a fax to a political office discouraging people from supporting the candidate they work for?,1576526370.0,"12/16/2019, 19:59:30",13,0,10,0.8398791514869508,0.92,1.3
353,activism,How I stay hopeful in a broken world: Words from a conservation biologist.,1576264093.0,"12/13/2019, 19:08:13",1,0,9,2.07433554273903,0.81,0.1111111111111111
354,activism,What's up with the What's App Protests: Lebanon - The New Voice,1574431901.0,"11/22/2019, 14:11:41",0,0,10,0.01058890360744158,1.0,0.0
355,activism,Oatly is advocating for awareness of carbon emissions in food products. Go sign their petition,1573272780.0,"11/09/2019, 04:13:00",0,0,10,0.9085931999541579,0.92,0.0
356,activism,How do i spread awareness on an issue,1572897650.0,"11/04/2019, 20:00:50",1,0,10,-0.0012681308745428055,1.0,0.1
357,activism,Calculated Cruelty. Shame on the Environment Polluting Agency (cross post from r/ExtinctionRebellion),1604157102.0,"10/31/2020, 15:11:42",2,0,9,1.609427149545743,0.85,0.2222222222222222
358,activism,URGENT: Need to Interview Activist for my Socio-Economic class,1603452826.0,"10/23/2020, 11:33:46",9,0,10,-0.0009198288350145134,1.0,0.9
359,activism,Democrats must go ALL IN on free speech,1603160610.0,"10/20/2020, 02:23:30",1,0,10,0.045618828229590846,1.0,0.1
360,activism,Ethical chemists against big pharma?,1601751124.0,"10/03/2020, 18:52:04",0,0,10,-0.03976876199295987,1.0,0.0
361,activism,The Terror Tactics of the Republican Party,1601041156.0,"09/25/2020, 13:39:16",0,0,9,1.5727877163553021,0.85,0.0
362,activism,"Sign Petition to start a Youth Advisory Council in City of Victorville, CA",1598942259.0,"09/01/2020, 06:37:39",0,0,9,0.8433956300196606,0.91,0.0
363,activism,Human Trafficking - Moral Panic?,1597116252.0,"08/11/2020, 03:24:12",4,0,8,1.5152137617603145,0.84,0.5
364,activism,"My Morning Jacket's Jim James: ""Our current president is a master of divide and conquer. We aren't each other's enemies.""",1596723726.0,"08/06/2020, 14:22:06",0,0,9,1.6844864308681569,0.84,0.0
365,activism,Everyday Americans turn against Trump during pandemic,1594493886.0,"07/11/2020, 18:58:06",2,0,8,1.9387536437812098,0.8,0.25
366,activism,Press Release: U.S. Court ruling that children of asylum-seekers must be released from detention lacks necessary provisions for parents; risks further family separation,1593724313.0,"07/02/2020, 21:11:53",0,0,10,0.8980137421580014,0.92,0.0
367,activism,NextGen Florida Activist Program Application,1593528936.0,"06/30/2020, 14:55:36",2,0,8,1.496925786745397,0.84,0.25
368,activism,Conservative Companion: Debunking Tucker Carlson's Propaganda,1593344228.0,"06/28/2020, 11:37:08",0,0,9,1.5839303982968413,0.85,0.0
369,activism,Debunking Every Anti-Communist Argument Ever,1592056320.0,"06/13/2020, 13:52:00",0,0,10,1.6654976748811574,0.86,0.0
370,activism,Banks Are Fueling Climate Change By Funding The Fossil Fuel Industry. Watch Below To Learn More About Climate Justice:,1591892558.0,"06/11/2020, 16:22:38",1,0,9,1.5586635279383714,0.85,0.1111111111111111
371,activism,I Made A Black Lives Matter Website,1591760125.0,"06/10/2020, 03:35:25",4,0,7,1.4201875085167401,0.83,0.5714285714285714
372,activism,"Let's boycott Amazon, Apple, and Google in support of Black Lives Matter. Maybe the people in power will listen to the three most powerful companies on Earth",1591360214.0,"06/05/2020, 12:30:14",3,0,8,2.707602030679789,0.75,0.375
373,activism,Masked men attack refugee dinghy off the coast of Greece as coastguard fails to launch rescue: Human rights activists warn of increase in Greek coastguard’s illegal ‘pushbacks’ of refugees to Turkey,1591284746.0,"06/04/2020, 15:32:26",0,0,8,1.5016677184517615,0.84,0.0
374,activism,Democratic lawmakers request information on reports of family separation in detention,1590182012.0,"05/22/2020, 21:13:32",0,0,9,0.9248491204763063,0.91,0.0
375,activism,I dug around a bit and made a video: Esportswashing by Saudi Arabia - how the kingdom is employing Esports and the Covid-19 crisis as a public relations strategy to help distract from its ongoing human rights abuses and the Yemen crisis,1589893733.0,"05/19/2020, 13:08:53",0,0,11,1.7202578981109546,0.86,0.0
376,activism,Change the law. Now.,1589307025.0,"05/12/2020, 18:10:25",0,0,9,0.8811232375163716,0.91,0.0
377,activism,"Amazon’s Antitrust Problem and the Congressional Investigation, Explained",1588541980.0,"05/03/2020, 21:39:40",0,0,9,0.8698972661520408,0.91,0.0
378,activism,REAL Activism in the 21st Century | The Zeitgeist Movement,1587913690.0,"04/26/2020, 15:08:10",3,0,10,3.3043507027840935,0.75,0.3
379,activism,How can I help during quarantine?,1587750244.0,"04/24/2020, 17:44:04",4,0,9,0.04492306631530241,1.0,0.4444444444444444
380,activism,Can you all help me publicize a project on reddit?,1584538205.0,"03/18/2020, 13:30:05",0,0,9,0.7965521826854953,0.92,0.0
381,activism,105 Freeway Signs from Across the West,1582589159.0,"02/25/2020, 00:05:59",0,0,9,0.028340357658230175,1.0,0.0
382,activism,this browser cleans up 1 bottle in the ocean for every 5 searches,1582094365.0,"02/19/2020, 06:39:25",0,0,8,2.098746303430991,0.79,0.0
383,activism,EXPLOITATION OF BLACK PPL IN THE MUSIC INDUSTRY,1580752221.0,"02/03/2020, 17:50:21",1,0,9,1.6102178226929738,0.85,0.1111111111111111
384,activism,MDOC Inmates Held In Unit 32 Reflect Over 100 Years Of Abuse At Parchman,1578621894.0,"01/10/2020, 02:04:54",0,0,9,0.9180019457809063,0.91,0.0
385,activism,Make a resolution to build your civic habits,1577898661.0,"01/01/2020, 17:11:01",0,0,10,0.007224789070441773,1.0,0.0
386,activism,"9 Justices, 30 Minutes: Our Lawyer’s Big Moment at the Supreme Court",1576987970.0,"12/22/2019, 04:12:50",0,0,8,0.8331367076455738,0.91,0.0
387,activism,Former Antifa-activist talks about what it's like for antifascist activists in the US prison system,1576864498.0,"12/20/2019, 17:54:58",0,0,9,0.8802440650061101,0.91,0.0
388,activism,You can't make this shit up,1575119584.0,"11/30/2019, 13:13:04",0,0,10,-0.033496447171094346,1.0,0.0
389,activism,Bougainville Explained: How the world’s newest country might bloom out of protests against a copper mine,1574454339.0,"11/22/2019, 20:25:39",0,0,9,0.7832130995717321,0.92,0.0
390,activism,"The nonprofit sector isn't where real activism happens, FYI",1574364424.0,"11/21/2019, 19:27:04",0,0,9,0.767239722899351,0.92,0.0
391,activism,Opinion: Is this the Beginning of the End? - The New Voice,1573847548.0,"11/15/2019, 19:52:28",0,0,9,0.03403610169337057,1.0,0.0
392,activism,My Daughter's Elementary School Fights for Light,1572885070.0,"11/04/2019, 16:31:10",3,0,10,1.5323271975869428,0.87,0.3
393,activism,Exclusive: Pope criticizes Trump administration policy on migrant family separation,1603894518.0,"10/28/2020, 14:15:18",0,0,8,0.9051714847008476,0.9,0.0
394,activism,Activists launch mission to support refugees crossing the English Channel: Channel Rescue aims to safely monitor and document arrivals and to provide compassionate care and refuge to those arriving on Kent’s shore,1602613381.0,"10/13/2020, 18:23:01",0,0,8,0.9043015746740117,0.9,0.0
395,activism,Defund and Re-organize the police. Change the narrative.,1602162448.0,"10/08/2020, 13:07:28",0,0,9,0.9421718843051146,0.91,0.0
396,activism,Passion for a better world will drive us forward,1600031199.0,"09/13/2020, 21:06:39",0,0,8,0.00578020885559738,1.0,0.0
397,activism,"Song about #BLM and refugee rights by Australian immigrant, First Nations, refugee and non-binary artists",1599893479.0,"09/12/2020, 06:51:19",0,0,9,0.8887860816714159,0.91,0.0
398,activism,Knowledgeable activist help please 😬,1599060508.0,"09/02/2020, 15:28:28",5,0,9,0.004518597937758884,1.0,0.5555555555555556
399,activism,Please help support the struggling workers and businesses in the Events Industry by supporting the #RedAlertRESTART in North America,1598927124.0,"09/01/2020, 02:25:24",0,0,8,-0.00523642070236896,1.0,0.0
400,activism,"Far right using coronavirus as excuse to attack Asians, say police",1598755077.0,"08/30/2020, 02:37:57",0,0,8,0.919442697807785,0.9,0.0
401,activism,New Train of Thought - Do I Still Have a Soul?,1598469968.0,"08/26/2020, 19:26:08",11,0,8,0.9335991419467735,0.9,1.375
402,activism,"Seeking refuge in US, children fleeing danger are expelled",1597689430.0,"08/17/2020, 18:37:10",0,0,8,0.0028781432325590828,1.0,0.0
403,activism,Protect peaceful protesters in Belarus - Petition,1597334881.0,"08/13/2020, 16:08:01",0,0,9,-0.0005308056305395326,1.0,0.0
404,activism,Call to action as the negotiations for relief packaged have broken down (as of 8/12),1597275528.0,"08/12/2020, 23:38:48",1,0,8,0.01254434386592429,1.0,0.125
405,activism,We are a nonprofit that wants to raise awareness for grassroots or under-covered social initiatives. We also provide a host of classes and services for people who donate to their favorite charities! Please check us out as we try to build a more compassionate world!,1597037968.0,"08/10/2020, 05:39:28",0,0,9,0.8422627512971808,0.91,0.0
406,activism,Republicans think all Democrats are communists,1596995728.0,"08/09/2020, 17:55:28",2,0,8,0.904289896107942,0.9,0.25
407,activism,Palestine Has Been Removed From World Maps,1594892770.0,"07/16/2020, 09:46:10",5,0,8,1.667756943743825,0.83,0.625
408,activism,lets acknowledge the real people who built this country,1594504320.0,"07/11/2020, 21:52:00",3,0,8,1.5860855379719467,0.83,0.375
409,activism,4 Severely Ill Migrant Toddlers Hospitalized After Lawyers Visit Border Patrol Facility,1592860410.0,"06/22/2020, 21:13:30",0,0,8,1.473916100939407,0.84,0.0
410,activism,"During this current movement, How do you respond to a low-income veteran who is mad (jealous?) of the activism for BLM, but no fervor for veterans (or other injustices?) {his post here}",1591988211.0,"06/12/2020, 18:56:51",11,0,9,1.6733510307810153,0.84,1.2222222222222223
411,activism,Donate for a BLM mask,1591854763.0,"06/11/2020, 05:52:43",0,0,8,0.845347602905651,0.9,0.0
412,activism,Not participating in social media activism does not automatically make you a part of the problem.,1591539071.0,"06/07/2020, 14:11:11",0,0,9,0.008115079602378117,1.0,0.0
413,activism,If You Can't Protest...,1591314081.0,"06/04/2020, 23:41:21",1,0,8,1.5700323609076925,0.84,0.125
414,activism,Denver Protests May 29th,1590869938.0,"05/30/2020, 20:18:58",0,0,8,0.03490949688207223,1.0,0.0
415,activism,Chump must go!! Republicans and Democrats ally with terrorists. And you vote them!,1590534719.0,"05/26/2020, 23:11:59",4,0,9,2.9019942656435926,0.76,0.4444444444444444
416,activism,"10th anniversary of Israeli Attack on The Mavi Marmara (Gaza Freedom Flotilla) live online discussion 2020 May 30th with filmmaker Iara Lee whose crew smuggled out assault footage, author Dr. Norman Finkelstein and ship survivors",1590250618.0,"05/23/2020, 16:16:58",0,0,7,0.7606120750097576,0.9,0.0
417,activism,"Former Bernie Senior Advisor Nina Turner: We don't need a task force, we need Medicare for All",1589819982.0,"05/18/2020, 16:39:42",0,0,8,1.6909870079562488,0.83,0.0
418,activism,Leaked Border Patrol Memo Tells Agents to Send Migrants Back Immediately — Ignoring Asylum Law,1589491789.0,"05/14/2020, 21:29:49",0,0,7,1.5005581671677177,0.82,0.0
419,activism,"This year, you can be proud when you cast your vote! you dont have to vote for a demented rapist, you can vote for a demented rapist instead. change is overrated and unAmerican!",1588453485.0,"05/02/2020, 21:04:45",9,0,10,3.031581626179781,0.77,0.9
420,activism,"We might be confined, we can still have our voices heard. May Day actions.",1588096073.0,"04/28/2020, 17:47:53",0,0,8,0.8761916798703275,0.9,0.0
421,activism,Live interactive map to keep you safe during activism gatherings,1588065831.0,"04/28/2020, 09:23:51",4,0,8,2.4449584908306967,0.77,0.5
422,activism,Seeking content contributors for new internet radio station revolution101.live,1587431267.0,"04/21/2020, 01:07:47",5,0,7,1.5401269862933606,0.82,0.7142857142857143
423,activism,Just saying.,1587402456.0,"04/20/2020, 17:07:36",2,0,9,2.910699697287292,0.76,0.2222222222222222
424,activism,"Biden molests Tara Reade, Media and Bernie silent",1585548107.0,"03/30/2020, 06:01:47",0,0,8,3.448797221201689,0.7,0.0
425,activism,I live in Maryland looking for ways to help out,1584130865.0,"03/13/2020, 20:21:05",2,0,9,0.031575751698692756,1.0,0.2222222222222222
426,activism,A Canadian Energy Company Bought an Oregon Sheriff’s Unit,1581626972.0,"02/13/2020, 20:49:32",0,0,7,0.7610150959976556,0.9,0.0
427,activism,Looking for information about Greek/Macedonian/Balkan activism!,1580886253.0,"02/05/2020, 07:04:13",4,0,8,0.006262829977204731,1.0,0.5
428,activism,Elizabeth Cochran's Activist Journalism --- @BeauTFC --- Patreon.com/TheFifthColumn,1579998966.0,"01/26/2020, 00:36:06",0,0,8,-0.0009566946781891517,1.0,0.0
429,activism,Congress Takes on Robocalls and Spoofed Phone Numbers,1575487156.0,"12/04/2019, 19:19:16",0,0,7,0.7425656204145996,0.9,0.0
430,activism,"Iran’s Protests Explained: Iraq, Lebanon, and Iran’s Fight Against Tehran",1574736787.0,"11/26/2019, 02:53:07",0,0,8,0.7567607910306844,0.91,0.0
431,activism,Solidarity to the Polish demonstrations. My support is in this drawing of mine.,1603853036.0,"10/28/2020, 02:43:56",0,0,6,1.3963338751340295,0.81,0.0
432,activism,I'm fed up and I want to be a part of the change. How do I begin?,1602304172.0,"10/10/2020, 04:29:32",13,0,7,0.8245436297193827,0.89,1.8571428571428572
433,activism,Richard D. Wolff Lecture on Worker Coops: Theory and Practice of 21st Ce...,1602296306.0,"10/10/2020, 02:18:26",0,0,7,1.5442991996270763,0.82,0.0
434,activism,Feeling… A Lot? Here’s Some Ways You Can Get Politically Involved,1602125246.0,"10/08/2020, 02:47:26",0,0,7,0.011986067688400048,1.0,0.0
435,activism,"‘We Need to Take Away Children,’ No Matter How Young, Justice Dept. Officials Said",1602028531.0,"10/06/2020, 23:55:31",2,0,7,1.5042370322704866,0.82,0.2857142857142857
436,activism,"If we invest in society now, we still have a chance as a species to thrive.",1600446717.0,"09/18/2020, 16:31:57",0,0,5,1.7358518028087406,0.74,0.0
437,activism,What Does it Mean to Give Reparations? | Nikole Hannah-Jones,1600184586.0,"09/15/2020, 15:43:06",2,0,8,1.6080573143172625,0.83,0.25
438,activism,Transfer of Iranian death row prisoner to unknown location sparks fears of early execution,1599316453.0,"09/05/2020, 14:34:13",0,0,6,1.36382407490657,0.81,0.0
439,activism,"ICE Expels Migrant Children Without Trial, Making Them ‘Impossible To Find’",1597531610.0,"08/15/2020, 22:46:50",4,0,8,0.8369274113476362,0.91,0.5
440,activism,Our stories and Our dreams. Narrative is in Bengali language.,1597511662.0,"08/15/2020, 17:14:22",0,0,9,0.8461230738602374,0.91,0.0
441,activism,Was the Media Biased in its Coverage of Covid-19 Outbreaks in Red and Blue States?,1597259122.0,"08/12/2020, 19:05:22",2,0,7,1.468587719038073,0.83,0.2857142857142857
442,activism,The situation for LGBT+ people in Poland,1597012948.0,"08/09/2020, 22:42:28",0,0,7,1.4938163141284893,0.82,0.0
443,activism,Donald Trump calls to delay the election,1596240946.0,"08/01/2020, 00:15:46",0,0,7,1.4988138893773844,0.82,0.0
444,activism,Grim Report Shows How Many Environmental Activists Were Killed Last Year,1595984119.0,"07/29/2020, 00:55:19",0,0,7,-0.009747174951129978,1.0,0.0
445,activism,all senate republicans can drink piss,1595607018.0,"07/24/2020, 16:10:18",3,0,7,1.9181058089213394,0.78,0.42857142857142855
446,activism,Migrant Mother Given A Choice: Leave Her Newborn In U.S. Or Return To Mexico Together,1595268667.0,"07/20/2020, 18:11:07",0,0,7,0.8523200356298606,0.89,0.0
447,activism,"Let's talk about the ""Helpful Honda People'",1593783422.0,"07/03/2020, 13:37:02",0,0,7,-0.00024373190778614884,1.0,0.0
448,activism,Asking People to Call Their Politician,1593092879.0,"06/25/2020, 13:47:59",3,0,6,0.7952605055551025,0.88,0.5
449,activism,Powerful white person is publishing a book which steals the same title and topic of another book by a Latinx author,1592332011.0,"06/16/2020, 18:26:51",1,0,6,1.374138292588336,0.81,0.16666666666666666
450,activism,Light in the dark,1591304360.0,"06/04/2020, 20:59:20",0,0,7,0.02900215129998429,1.0,0.0
451,activism,Not all American Soldiers are moral or patriotic,1590040751.0,"05/21/2020, 05:59:11",18,0,7,1.5460343389454696,0.82,2.5714285714285716
452,activism,OUSTING Debbie Wasserman Schultz! How Progressive Jen Perelman Is Going To Do It,1589716981.0,"05/17/2020, 12:03:01",0,0,7,0.01761405532463023,1.0,0.0
453,activism,Climate in Crisis: Virtual Event for Teens to learn about Climate Justice.,1589347116.0,"05/13/2020, 05:18:36",0,0,7,0.022496409548758756,1.0,0.0
