,Subreddit,Title,Epoch Time,Date,Comments,Awards,Upvotes,Downvotes,Upvote Ratio,Comment/Upvote Ratio
454,activism,I sat through a neoliberal AMA so you didn't have to. And I noticed something interesting.,1589141137.0,"05/10/2020, 20:05:37",0,0,9,3.6715535223418083,0.71,0.0
455,activism,Competition is Unproductive &amp; Dangerous | No Such Thing as Healthy Compe...,1587927533.0,"04/26/2020, 18:58:53",0,0,7,3.9211756903511183,0.64,0.0
456,activism,"Earth Day Live: a three-day livestream for climate action, ft. Questlove, Al Gore, AOC, youth climate activists, Jason Mraz, Joaquin Phoenix, and more",1587556205.0,"04/22/2020, 11:50:05",0,0,8,0.0323391275193643,1.0,0.0
457,activism,"Please share this, if we don’t who will? We need to stand up against bullying once and for all! This is an email I tried to send to google.",1584909003.0,"03/22/2020, 20:30:03",0,0,8,2.271058487764609,0.78,0.0
458,activism,Want to do something good during your coronavirus quarantine? Do mutual aid,1584672130.0,"03/20/2020, 02:42:10",1,0,7,-0.027759106398240974,1.0,0.14285714285714285
459,activism,We are looking for ideas for new topics/tools/courses that activists can use to improve their digital security skills in their day-to-day work to expand the dig.sec. courses that are available on the Totem platform. What would you prefer we develop next?,1582872812.0,"02/28/2020, 06:53:32",3,0,7,1.5283434406780323,0.82,0.42857142857142855
460,activism,"""Strategies For Union Avoidance"" with Scott Sheets",1582469587.0,"02/23/2020, 14:53:07",0,0,8,0.027827515087015087,1.0,0.0
461,activism,America’s New Drinking Problem? The Trump Administration Rolls Back the Clean Water Act,1579895179.0,"01/24/2020, 19:46:19",0,0,7,-0.033727675060719164,1.0,0.0
462,activism,"Want to share your knowledge, help other young people make a difference and meet changemakers from all over the world?",1578561917.0,"01/09/2020, 09:25:17",0,0,7,0.8882769065088585,0.89,0.0
463,activism,Are we gonna frickin do something or what -- Non-Compete on Our Current Situation &amp; the Climate Crisis,1578248730.0,"01/05/2020, 18:25:30",0,0,7,0.005082110926637462,1.0,0.0
464,activism,Food Cooperative in UK,1578068106.0,"01/03/2020, 16:15:06",0,0,7,0.7813110998378168,0.9,0.0
465,activism,Can I win a seat in Senate or House even though I'm under 25?,1576703864.0,"12/18/2019, 21:17:44",2,0,7,2.0028599791533974,0.78,0.2857142857142857
466,activism,Nigerian Journalist and Human Rights Activist Jailed and Detained: The Increasing Assault on the Press - The New Voice,1576335743.0,"12/14/2019, 15:02:23",0,0,7,1.5448260240387288,0.82,0.0
467,activism,How can you help Hong Kong protests from abroad #StandwithHongKong,1574030912.0,"11/17/2019, 22:48:32",0,0,7,0.8712176970527503,0.89,0.0
468,activism,Raytheon Sinks After Disclosing U.S. Probe of Defense Books - Activism Works,1603983440.0,"10/29/2020, 14:57:20",1,0,7,0.862759944606311,0.89,0.14285714285714285
469,activism,"YouTube monetizes videos of fake animal rescues that really abuse, torture and even kill animals, puppies, cats. What you can do: please write companies that advertise on YouTube and make them aware of this with a short text and link to Nick Crowley's video",1600764885.0,"09/22/2020, 08:54:45",1,0,6,2.307766323639271e-05,1.0,0.16666666666666666
470,activism,A Government facility is abusing and killing cats. Let's put a stop to this!,1599764385.0,"09/10/2020, 18:59:45",0,0,6,1.4879039980779671,0.8,0.0
471,activism,Voting is activism!,1598995081.0,"09/01/2020, 21:18:01",0,0,7,0.025902397253270593,1.0,0.0
472,activism,‘The EU doesn’t have to shoot refugees; the sea will do the dirty work for it’: NEESKE BECKMANN tells The Civil Fleet what she and the Moonbird reconnaissance plane witnessed when Europe ignored the Louise Michel’s plea for help,1598898626.0,"08/31/2020, 18:30:26",0,0,7,0.03368033857007813,1.0,0.0
473,activism,Do we do enough about human trafficking?,1598716997.0,"08/29/2020, 16:03:17",0,0,6,0.8337051916761524,0.88,0.0
474,activism,Has anyone experienced burnout?,1598026398.0,"08/21/2020, 16:13:18",4,0,5,0.8348020827861236,0.86,0.8
475,activism,Seeking fellow environment activist's,1597900425.0,"08/20/2020, 05:13:45",0,0,6,0.0033952690104728234,1.0,0.0
476,activism,Guide to Taking Action in the 2020 Election,1597686123.0,"08/17/2020, 17:42:03",0,0,6,-0.008330965845098959,1.0,0.0
477,activism,Should you vote for Biden in a safe state?,1597375220.0,"08/14/2020, 03:20:20",7,0,6,1.9600705497608644,0.75,1.1666666666666667
478,activism,Simple low cost device to stop terrorist car attacks!,1595668959.0,"07/25/2020, 09:22:39",0,0,6,0.8557910627174259,0.88,0.0
479,activism,Trump Administration is illegally destroying Native American Burial Sites and The Kumeyaay people are actively protesting now to shut down the work. They really need their voices amplified,1595027639.0,"07/17/2020, 23:13:59",0,0,6,0.0019029562161012592,1.0,0.0
480,activism,tfw there are more frauds in congress than in the ballot box,1594748008.0,"07/14/2020, 17:33:28",0,0,5,0.8302292064191228,0.86,0.0
481,activism,Why Donald Trump has become the biggest divider in politics today,1594469259.0,"07/11/2020, 12:07:39",0,0,6,0.836871895911302,0.88,0.0
482,activism,Bullying PPT,1593886246.0,"07/04/2020, 18:10:46",6,0,7,0.0068556709988172315,1.0,0.8571428571428571
483,activism,The Right Doesn't Really Care About Your Rights,1593866584.0,"07/04/2020, 12:43:04",0,0,6,2.4759151729726927,0.71,0.0
484,activism,Huge Activism NPO looking for applicants + PVSA Award Info,1593556176.0,"06/30/2020, 22:29:36",0,0,6,0.7797880056691877,0.88,0.0
485,activism,Jordan Peterson gets KNOCKED OUT on Social Activism,1593368985.0,"06/28/2020, 18:29:45",3,0,4,2.5864626999992417,0.61,0.75
486,activism,Revolt,1592923948.0,"06/23/2020, 14:52:28",2,0,4,1.6001807689938294,0.71,0.5
487,activism,How to get into PRANK activism (like what the k-pop kids did at Tulsa this weekend)??,1592770636.0,"06/21/2020, 20:17:16",2,0,6,1.9986777344863187,0.75,0.3333333333333333
488,activism,Did You Know Climate Talks Often Times Are Sponsored By Oil And Gas Companies? We Must Stop This Hypocrisy:,1592239420.0,"06/15/2020, 16:43:40",0,0,6,0.8314696024586112,0.88,0.0
489,activism,How do you safely protest right now in big cities?,1592172485.0,"06/14/2020, 22:08:05",9,0,6,0.07373754590785975,0.99,1.5
490,activism,I’m organizing an artist led protest zine- to fund protestors! The @ is on Instagram. Big focus on black art but anyone can join,1592070761.0,"06/13/2020, 17:52:41",3,0,6,1.4836532615925595,0.8,0.5
491,activism,Social Media is Killing Free Speech | Big Tech Censorship,1592054984.0,"06/13/2020, 13:29:44",0,0,5,1.4466892925579273,0.78,0.0
492,activism,Like Water: A community of developers to help Black Lives Matter,1591486937.0,"06/06/2020, 23:42:17",0,0,6,-0.022901878984876944,1.0,0.0
493,activism,"""Horrific. Killed in America for exercising her 1st amendment rights. Rest In Peace. """,1591390749.0,"06/05/2020, 20:59:09",0,0,5,0.8013162858015077,0.86,0.0
494,activism,"""The police in Hong Kong never arrested a correspondent. The police in HOng Kong never killed anyone. China's leaders never called for protesters to be shot. They never deployed the military. The Minneapolis situation really exposes how one sided coverage of Hong Kong has been.""",1591131187.0,"06/02/2020, 20:53:07",3,0,5,3.234317323051542,0.61,0.6
495,activism,"Russian violent homophobic group Pila (""Saw""), who death threatened Russian LGBT+ rights activist Yulia Tsvetkova, is the same who killed another brave fighter last year, Yelena Grigoryeva. Support Yulia, support freedom of speech, expression, love.",1590865675.0,"05/30/2020, 19:07:55",0,0,6,-0.014108289141836039,1.0,0.0
496,activism,Atlanta has deployed a child militia at Lenox Mall fitted with riot shields and batons. What the actual fuck is going on?,1590830528.0,"05/30/2020, 09:22:08",3,0,7,1.4997408874673557,0.82,0.42857142857142855
497,activism,"food, not bombs",1590543267.0,"05/27/2020, 01:34:27",1,0,5,0.8338169501158337,0.86,0.2
498,activism,A journey of a black activist living in Africa,1589636529.0,"05/16/2020, 13:42:09",0,0,6,1.5139995759128713,0.8,0.0
499,activism,Only We Can Undermine Our Own Democracy,1588775391.0,"05/06/2020, 14:29:51",0,0,7,-0.03455101949229711,1.0,0.0
500,activism,Time to Replace Pelosi with SHAHID!! November 3rd!,1588332721.0,"05/01/2020, 11:32:01",0,0,7,0.8250747637419922,0.89,0.0
501,activism,PeaceWithPlastic Zoom every Wednesday at 10am Eastern. Join Us.,1587998104.0,"04/27/2020, 14:35:04",0,0,6,2.6246299444031624,0.7,0.0
502,activism,Jacque Fresco explaining his designs to me | The Venus Project - Buildin...,1587922443.0,"04/26/2020, 17:34:03",0,0,7,3.7983122717369096,0.65,0.0
503,activism,#HowWeReopen - help spread information about the scientific plan that will keep both deaths and economic costs at a minimum,1587817028.0,"04/25/2020, 12:17:08",0,0,7,0.8788991349351525,0.89,0.0
504,activism,The Democrat Deception,1587478396.0,"04/21/2020, 14:13:16",6,0,7,3.223850630656571,0.68,0.8571428571428571
505,activism,socialism vs capitalism,1586111598.0,"04/05/2020, 18:33:18",0,0,6,1.5286995243121506,0.8,0.0
506,activism,What Bernie should have done in the primary,1585175141.0,"03/25/2020, 22:25:41",0,0,7,0.9502720502304243,0.88,0.0
507,activism,/r/LocalTourism : not enough of one lifetime to know your own land,1584412277.0,"03/17/2020, 02:31:17",1,0,7,-0.02661266361566117,1.0,0.14285714285714285
508,activism,"Hi guys, activist-musician here, writing songs about social issues. I wrote a song about spreading love,peace,unity and positiveness.",1584359970.0,"03/16/2020, 11:59:30",1,0,6,0.8521988395093301,0.88,0.16666666666666666
509,activism,Network of activists,1584295364.0,"03/15/2020, 18:02:44",9,0,5,1.388352870208914,0.78,1.8
510,activism,Letter Writing Campaign,1581459121.0,"02/11/2020, 22:12:01",4,0,7,0.02425355382492622,1.0,0.5714285714285714
511,activism,Fighting for indigenous communities in Central America,1581310144.0,"02/10/2020, 04:49:04",0,0,6,0.823101012768702,0.88,0.0
512,activism,STOP FOREIGN COMPANIES PROFITING OFF DESTROYING DELICATE ECOSYSTEM BEFORE IT IS TO LATE #NO FISH FARMS IN OUR OCEAN!,1579203695.0,"01/16/2020, 19:41:35",1,0,5,0.8437435300365959,0.86,0.2
513,activism,Public Comment Period for Trump’s Latest Environmental Policy; Rolling Back the National Environmental Policy Act,1578950134.0,"01/13/2020, 21:15:34",0,0,6,1.484547935270383,0.8,0.0
514,activism,It’s amazing what our younger generation is capable of,1578894917.0,"01/13/2020, 05:55:17",0,0,6,0.8534117929245495,0.88,0.0
515,activism,How to start a Community Kitchen.,1578662826.0,"01/10/2020, 13:27:06",0,0,7,-0.02011471438591972,1.0,0.0
516,activism,What a world without cancel culture could look like | Deanna Van Buren,1578148515.0,"01/04/2020, 14:35:15",0,0,6,1.9973115224909659,0.75,0.0
517,activism,"Charles Booker on Hinting to Challenge McConnell, Platforms, and Early Life - The New Voice",1576800885.0,"12/20/2019, 00:14:45",0,0,6,0.00730964897887354,1.0,0.0
518,activism,"All the 2020 Congressional candidates who back the Green New Deal 🌎, reject corporate cash [*fully updated map*] — spread the word about these folks!",1575149141.0,"11/30/2019, 21:25:41",1,0,4,1.2437854881255461,0.76,0.25
519,activism,Becoming an activist while in debt? Amidst other concerns ...,1573954971.0,"11/17/2019, 01:42:51",9,0,5,1.7700288562891515,0.74,1.8
520,activism,'This is not a heartwarming story. It's a tragedy.' | Texas migrant sponsor speaks out on family separation,1603831455.0,"10/27/2020, 20:44:15",0,0,5,0.016764670435937212,1.0,0.0
521,activism,Votemigo - Last Stride to Help Increase Voter Turnout!,1603242333.0,"10/21/2020, 01:05:33",0,0,5,-0.022369946520827355,1.0,0.0
522,activism,New mural is hot topic in McAllen,1603138176.0,"10/19/2020, 20:09:36",0,0,5,0.8243574534697782,0.86,0.0
523,activism,Check out this video of a GOP Official in Germany Claiming Genetics Play a Role in Black Crime Rates,1602773271.0,"10/15/2020, 14:47:51",0,0,5,0.8175576049141728,0.86,0.0
524,activism,The American regime,1602165788.0,"10/08/2020, 14:03:08",2,0,5,0.7820941011529792,0.86,0.4
525,activism,Comrade Bea Lumpkin is making the rounds on social media everywhere. They neglect to mention she's a CPUSA member who is participating in the united front against fascism,1602083215.0,"10/07/2020, 15:06:55",0,0,5,1.3780942394924738,0.78,0.0
526,activism,Systems Thinking for Social Change,1602030738.0,"10/07/2020, 00:32:18",0,0,6,0.01914033151380412,1.0,0.0
527,activism,"Sign up for GOTV Shifts. ""We've individually identified 2 million environmentalists who have never voted before across 12 states. We know what messaging works best to turn them into first-time voters, but we need your help to reach them.""",1602003259.0,"10/06/2020, 16:54:19",0,0,6,0.8726580527030867,0.87,0.0
528,activism,Testing a novel open source recorder app meant to prevent information loss in extreme situations,1601910097.0,"10/05/2020, 15:01:37",0,0,4,0.7719601509434417,0.84,0.0
529,activism,You can restore someone's ability to vote,1601615447.0,"10/02/2020, 05:10:47",0,0,4,1.3277830131760915,0.75,0.0
530,activism,"Philly Activists Reclaim 50 Vacant Houses, Creating a Model for Organizing as Mass Evictions Loom",1601401267.0,"09/29/2020, 17:41:07",0,0,5,0.020079733606450212,1.0,0.0
531,activism,Opportunity for to help create change!,1600908573.0,"09/24/2020, 00:49:33",1,0,5,0.00044747108075693376,1.0,0.2
532,activism,"An article about the ideology of fascism, how it might harm society and how fascism is present in our society and how it originated. All in a 4-5 page brief explanation.",1600315282.0,"09/17/2020, 04:01:22",0,0,5,-0.0013685736441164664,1.0,0.0
533,activism,Malta and Italy refuse doctor’s call to evacuate pregnant women from refugee rescue ship: Europe keeps the 278 people on board the Open Arms at sea without help for seven days,1600249769.0,"09/16/2020, 09:49:29",0,0,4,1.3605150842811478,0.75,0.0
534,activism,Why aren’t we learning more and investing a bit of thought and consideration in voting for the Green Party this election?,1598655033.0,"08/28/2020, 22:50:33",9,0,6,-0.020094367439272176,1.0,1.5
535,activism,"Child Separations at the Border Were an Intentional Outcome, Report Says",1598474930.0,"08/26/2020, 20:48:50",0,0,4,0.7468113414563327,0.84,0.0
536,activism,"Councilman Peláez to Host Town Hall on City’s Homelessness Response — San Antonio Sentinel - News, Politics, Business, Lifestyle",1598337971.0,"08/25/2020, 06:46:11",0,0,5,0.7876031251226481,0.86,0.0
537,activism,Justice for a Black man who is another victim of police brutality,1596571855.0,"08/04/2020, 20:10:55",0,0,5,-0.01026846480166732,1.0,0.0
538,activism,Protestors in Portland should move their protests half a mile so that the waste of money and stupidity of the DHS assholes can be highlighted by their protecting buildings from no one.,1595983244.0,"07/29/2020, 00:40:44",1,0,5,1.4123797986121343,0.78,0.2
539,activism,it just happened by chance that black businesses got significantly less money from PPP than white businesses,1595698365.0,"07/25/2020, 17:32:45",0,0,5,0.019435433897461607,1.0,0.0
540,activism,no hold on... hes got a point,1594661956.0,"07/13/2020, 17:39:16",0,0,6,0.0088331373840278,1.0,0.0
541,activism,Border Patrol Makes New Mother Choose Between Family Separation Or Return To Mexico,1594415617.0,"07/10/2020, 21:13:37",0,0,5,0.8443379944082903,0.86,0.0
542,activism,Colin Kaepernick,1594122648.0,"07/07/2020, 11:50:48",0,0,5,1.3814207703292025,0.78,0.0
543,activism,[#JoeRoganForForegen] Reminding you of our plans for a social media campaign asking Joe Rogan to donate to Foregen.,1593915807.0,"07/05/2020, 02:23:27",1,0,5,0.014617900811550122,1.0,0.2
544,activism,"China’s New Hong Kong National Security Law, Explained",1593726817.0,"07/02/2020, 21:53:37",0,0,5,0.8189354696408806,0.86,0.0
545,activism,Disabled activist seeks help calling out Honda,1593585359.0,"07/01/2020, 06:35:59",5,1,4,1.3617841671518818,0.75,1.25
546,activism,A Call to Action,1593157674.0,"06/26/2020, 07:47:54",1,0,5,1.3814143174299103,0.78,0.2
547,activism,Creating a group to dismantle the system,1592943738.0,"06/23/2020, 20:22:18",2,0,5,0.004152335799505913,1.0,0.4
548,activism,Seeking advice on how to do more.,1592667931.0,"06/20/2020, 15:45:31",4,0,3,1.140640220376337,0.72,1.3333333333333333
549,activism,"Woes of the modern Pharisees: Using the law to oppress, not uplift",1592320322.0,"06/16/2020, 15:12:02",0,0,5,1.3482044275948164,0.79,0.0
550,activism,An American Trucker And Australian Boilermaker: Live Co Host Study and Discussion of William Z. Foster's History of the Three Internationals (Dust James and David Fox). Live from Dust James' YouTube. June 13 2020 8 PM US Eastern Standard Time (June 14th 10 AM AUS EST),1591877813.0,"06/11/2020, 12:16:53",0,0,5,0.004629580620320262,1.0,0.0
551,activism,Representation in art 🖤,1591149582.0,"06/03/2020, 01:59:42",0,0,5,0.8478237463583973,0.86,0.0
552,activism,What happened in DC between 1AM and 6AM 6/1/2020?,1591014383.0,"06/01/2020, 12:26:23",3,0,5,0.7868611641687702,0.86,0.6
553,activism,"""When you see NYPD with unlimited vans, bullets, and tear gas don’t forgot we needed a gofundme to get masks for our hospital""",1590947042.0,"05/31/2020, 17:44:02",0,0,5,0.7887390030490629,0.86,0.0
554,activism,"‘When the looting starts, the shooting starts’: Trump revives segregationist war cry",1590785173.0,"05/29/2020, 20:46:13",0,0,6,-0.0017971934323828265,1.0,0.0
555,activism,ban big pharma! Free healthcare and medicine for all! it is a constitutional right! see the 9th amendment and the preamble of the constitution. this is not just extortion --it is cruel! It is evil!,1590512310.0,"05/26/2020, 16:58:30",1,0,5,1.3211649956777034,0.79,0.2
556,activism,"Hundreds of migrant children, teens deported under pandemic border policy: report",1590420651.0,"05/25/2020, 15:30:51",0,0,5,1.4423938464871595,0.78,0.0
557,activism,"Change the Human Value System, Change the World",1590357135.0,"05/24/2020, 21:52:15",1,0,7,0.09687510708011082,0.99,0.14285714285714285
558,activism,How the Indian communist-run state of Kerala successfully fought Coronavirus outbreak,1590087544.0,"05/21/2020, 18:59:04",0,0,6,0.004155691335602896,1.0,0.0
559,activism,my opinion what needs to happen,1589565809.0,"05/15/2020, 18:03:29",7,0,4,1.3440661622573034,0.75,1.75
560,activism,Florida unemployment in our capitalist system--under Republican Party control,1589341239.0,"05/13/2020, 03:40:39",2,0,5,0.7859423820041664,0.86,0.4
561,activism,You Can Be More Than You Are. A take on purpose in times of existential global crises.,1589285541.0,"05/12/2020, 12:12:21",0,0,5,0.0014557992788617469,1.0,0.0
562,activism,"Virtual May Day rally Friday includes Iowa union presidents, college student union, city councilman, and more",1588299779.0,"05/01/2020, 02:22:59",0,0,5,-0.005503429907027346,1.0,0.0
563,activism,Culture Jamming - Hijacking Corporate Symbols,1588023747.0,"04/27/2020, 21:42:27",0,0,5,1.2907546264905392,0.79,0.0
564,activism,Young Documentarian Looking For Help!,1587667881.0,"04/23/2020, 18:51:21",0,0,3,1.1569954552068573,0.72,0.0
565,activism,Got questions? Want to learn tactics for organizing fellow tenants? Need resources? The Philadelphia Tenants Union is Hosting a teach-in Zoom call today!,1587649917.0,"04/23/2020, 13:51:57",0,0,5,0.8344860805913994,0.86,0.0
566,activism,Trump’s EPA Scraps Mercury Emissions Rules,1587248088.0,"04/18/2020, 22:14:48",0,0,5,-0.00011784323172214783,1.0,0.0
567,activism,Seven senators join Iowa Republican Grassley in bipartisan demand for full story of Trump’s firing of intelligence-community watchdog,1586636914.0,"04/11/2020, 20:28:34",1,0,5,0.8221469494740106,0.86,0.2
568,activism,Twitter censorship locked out of my account. For going after fake ass QAnon,1585965249.0,"04/04/2020, 01:54:09",3,0,5,2.7461876359988304,0.65,0.6
569,activism,Pleas report these map accounts in the description,1585602310.0,"03/30/2020, 21:05:10",2,0,5,0.8432448460993136,0.86,0.4
570,activism,A Litany for Survival in Pandemic Times - after Audre Lorde,1585592896.0,"03/30/2020, 18:28:16",0,0,5,0.8301785090012226,0.86,0.0
571,activism,Dear Reddit Creators - thank you for this platform,1585000976.0,"03/23/2020, 22:02:56",0,0,3,1.4482974421742183,0.67,0.0
572,activism,Surveilling FISA: The Congressional FISA Renewal Debate Explained,1584311468.0,"03/15/2020, 22:31:08",0,0,5,0.0030669521332473693,1.0,0.0
573,activism,How to be a More Sustainable Human | My Tips...Be 'Bout Dat Life,1583704302.0,"03/08/2020, 21:51:42",0,0,4,0.7876108296906263,0.84,0.0
574,activism,is there activism in Russia or is it all shut down?,1583633755.0,"03/08/2020, 02:15:55",1,0,5,-0.01576154823706588,1.0,0.2
575,activism,How do activists live day to day lives if all their time is spent protesting?,1583405724.0,"03/05/2020, 10:55:24",7,0,5,2.6623777040109937,0.65,1.4
576,activism,PSYOPS used on Americans,1582831750.0,"02/27/2020, 19:29:10",0,0,5,1.8121901929181545,0.73,0.0
577,activism,sub contractor you do not have my permission to film me second contracto...,1582218427.0,"02/20/2020, 17:07:07",0,0,5,0.07022468642421043,0.99,0.0
578,activism,Traffic Means Protest,1581610816.0,"02/13/2020, 16:20:16",0,0,4,0.774935473557453,0.84,0.0
579,activism,Making activism art has me a little frustrated.,1580323336.0,"01/29/2020, 18:42:16",0,0,6,-0.018235809958583538,1.0,0.0
580,activism,Greta Thunberg Responds to Criticisms from Trump and Mnuchin - The Hill,1579910486.0,"01/25/2020, 00:01:26",0,0,5,0.8151600314496399,0.86,0.0
581,activism,CodePink.org Organizing Against the Iranian Sanctions,1579828462.0,"01/24/2020, 01:14:22",0,0,4,1.7329155879550253,0.7,0.0
582,activism,Non-Violent Protesters Arrested at MLK Day Ceremony,1579763662.0,"01/23/2020, 07:14:22",0,0,5,1.8400909044835876,0.73,0.0
583,activism,Squatting in Brighton,1579033026.0,"01/14/2020, 20:17:06",0,0,6,-0.02746917803583404,1.0,0.0
584,activism,"Democratic Debate Night Seven: A Much Smaller, Less Diverse Stage - The New Voice",1579017452.0,"01/14/2020, 15:57:32",0,0,5,0.06369883464649728,0.99,0.0
585,activism,Macron Scraps Proposal to Raise Retirement Age in France,1578915586.0,"01/13/2020, 11:39:46",0,0,5,0.8084248693977676,0.86,0.0
586,activism,Breaking: Kentucky State Representative Charles Booker Announces Senate Run - The New Voice,1578254623.0,"01/05/2020, 20:03:43",0,0,4,0.760915300783771,0.84,0.0
587,activism,R/Antimlm Activism,1577728022.0,"12/30/2019, 17:47:02",0,0,6,0.0008849938335515617,1.0,0.0
588,activism,Is homeless Vlogging a thing? I want to try it..,1574048721.0,"11/18/2019, 03:45:21",10,0,4,1.696047866676837,0.7,2.5
589,activism,A Podcast Series for New Organisers!,1573327971.0,"11/09/2019, 19:32:51",0,0,7,0.9078899767724966,0.89,0.0
590,activism,Protect The Oil: Trump’s New Syria Strategy,1573271525.0,"11/09/2019, 03:52:05",0,0,5,0.05272460240389609,0.99,0.0
591,activism,Number of Women Alleging Misconduct by ICE Gynecologist Nearly Triples,1604086157.0,"10/30/2020, 19:29:17",0,0,5,-0.0173147095197983,1.0,0.0
592,activism,The Fake Court,1603812354.0,"10/27/2020, 15:25:54",0,0,3,1.4649159384727826,0.67,0.0
593,activism,Platform for Change,1602867392.0,"10/16/2020, 16:56:32",0,0,4,-0.007656943325618393,1.0,0.0
594,activism,Mindfulness/Spirituality &amp; Activism (Psychology Workshop),1602599770.0,"10/13/2020, 14:36:10",0,0,4,0.8050104257667314,0.83,0.0
595,activism,Starting an activism Instagram Account.,1602520665.0,"10/12/2020, 16:37:45",4,0,5,0.010662116422842871,1.0,0.8
596,activism,Vote,1602166377.0,"10/08/2020, 14:12:57",0,0,3,1.4603665538729365,0.67,0.0
597,activism,COVID-19 isn’t an excuse to be racist,1602103129.0,"10/07/2020, 20:38:49",0,0,4,1.2355697464055817,0.76,0.0
598,activism,relief,1601883055.0,"10/05/2020, 07:30:55",0,0,3,1.1715663559933542,0.72,0.0
599,activism,if the rich dont pay taxes--the working class have to. is that right?,1601676860.0,"10/02/2020, 22:14:20",1,0,5,0.0023287817465078575,1.0,0.2
600,activism,ICE ordered to reduce population at Adelanto immigrant detention center hit by COVID-19,1601585760.0,"10/01/2020, 20:56:00",0,0,6,1.4599669346703399,0.8,0.0
601,activism,Finally Deepfake videos being used to seed change,1600967863.0,"09/24/2020, 17:17:43",1,0,5,0.8095210783972462,0.86,0.2
602,activism,Digital 0asis,1600928748.0,"09/24/2020, 06:25:48",2,0,3,0.6933924484088676,0.81,0.6666666666666666
603,activism,"Dreams , life , stories and democracy. Narrative is in Bengali language.",1600803247.0,"09/22/2020, 19:34:07",0,0,5,0.9123042881478982,0.85,0.0
604,activism,I Can't Breathe mural in Madrid,1600351559.0,"09/17/2020, 14:05:59",0,0,3,1.5077312808302779,0.67,0.0
605,activism,Promoting myself to help save the kitties,1600172290.0,"09/15/2020, 12:18:10",0,0,5,-0.023441539981174486,1.0,0.0
606,activism,"Our voice , dreams and democracy. Narrative is in Bengali language.",1599239108.0,"09/04/2020, 17:05:08",0,0,4,-0.013635586201335759,1.0,0.0
607,activism,"Malta’s three-week punishment of a merchant vessel could discourage refugee rescues, activists warn: Alarm Phone brands the stand-off, the longest before a European harbour, as ‘yet another low point in Europe’s disastrous actions in the Mediterranean’",1598551933.0,"08/27/2020, 18:12:13",0,0,4,-0.016343638611785227,1.0,0.0
608,activism,"Cafecito with Azul Barrientos: Searching for the Limit — San Antonio Sentinel - News, Politics, Business, Lifestyle",1598168311.0,"08/23/2020, 07:38:31",0,0,4,0.005259800971006534,1.0,0.0
609,activism,Help Create Tools to Help Activism,1598028899.0,"08/21/2020, 16:54:59",5,0,4,-0.003394166645565022,1.0,1.25
610,activism,Every language and birds should fly to their own sky.,1597216223.0,"08/12/2020, 07:10:23",0,0,5,0.02233880221410267,1.0,0.0
611,activism,Protest Save The Children !,1596530659.0,"08/04/2020, 08:44:19",0,0,5,1.3826899720879853,0.78,0.0
