,Subreddit,Title,Epoch Time,Date,Comments,Awards,Upvotes,Downvotes,Upvote Ratio,Comment/Upvote Ratio
612,activism,"Story of space , politics and our journey twoards we shall over come. Narrative is in bengali language.",1596436278.0,"08/03/2020, 06:31:18",0,0,3,1.1427765050431544,0.72,0.0
613,activism,Stop Colonization in Kauai,1596387927.0,"08/02/2020, 17:05:27",2,0,4,-0.019447021914373863,1.0,0.5
614,activism,Justice for Brody!,1596161970.0,"07/31/2020, 02:19:30",1,0,3,1.4399596641679802,0.68,0.3333333333333333
615,activism,Get Amazon To Offer Plastic-Free Packaging,1596156319.0,"07/31/2020, 00:45:19",0,0,3,0.72421753644405,0.81,0.0
616,activism,Free children's book for tiny activists all about voting!,1596146166.0,"07/30/2020, 21:56:06",0,0,5,-0.01285499754070063,1.0,0.0
617,activism,No Paper Trail: Migrant Children Secretly Held in Hampton Inn Hotels Before Expulsion from U.S.,1596034653.0,"07/29/2020, 14:57:33",1,0,4,1.325481020894535,0.75,0.25
618,activism,[Hip Hop] J0307 - This Moment (This is my musical activism. Stay strong everyone! ✊🏻) I also have a specific Black Lives Matter Track on my soundcloud,1595995599.0,"07/29/2020, 04:06:39",1,0,5,-0.014396006148433393,1.0,0.2
619,activism,How to Think Like a Vietnamese Communist: An Intro to Dialectical Materialism!,1595355237.0,"07/21/2020, 18:13:57",0,0,3,0.6979049606005394,0.81,0.0
620,activism,"Che Guevara journey , story , and Quest of our freedom . narrative is in Bengali language .",1595168619.0,"07/19/2020, 14:23:39",0,0,4,1.7373238570775973,0.7,0.0
621,activism,updated Ms. Angelou for the millennial debt crisis,1595022721.0,"07/17/2020, 21:52:01",1,0,4,0.016261445474596847,1.0,0.25
622,activism,like how are we supposed to pay the banks when theyre the ones taking our stimulus??,1594849976.0,"07/15/2020, 21:52:56",0,0,5,1.4951676583947746,0.77,0.0
623,activism,[#JoeRoganForForegen] Final reminder of our social media campaign/event asking Joe Rogan to donate and bring awareness to Foregen. Happening tomorrow so please get involved!,1594753521.0,"07/14/2020, 19:05:21",1,0,4,1.3131359120286525,0.75,0.25
624,activism,kitty said no bosses no rulers,1594747971.0,"07/14/2020, 17:32:51",0,0,4,0.008080902549163937,1.0,0.0
625,activism,Join Laverne Cox for a chat on the importance of Activism!!,1594740984.0,"07/14/2020, 15:36:24",1,0,3,0.7135476994470284,0.81,0.3333333333333333
626,activism,"A FAMILY SEPARATED BETWEEN EL SALVADOR AND THE U.S., FIRST BLOCKED BY TRUMP AND THEN CORONAVIRUS",1594674011.0,"07/13/2020, 21:00:11",0,0,4,-0.014001755310583786,1.0,0.0
627,activism,"Not Hard ,we did a beautiful world and democracy for all . narrative in Bengali language with basic subtitles English .",1594458574.0,"07/11/2020, 09:09:34",0,0,3,0.6988298461017655,0.81,0.0
628,activism,Where to begin giving myself to others?,1594244646.0,"07/08/2020, 21:44:06",2,0,4,-0.01972086675575424,1.0,0.5
629,activism,Activist Training: How to Reach Young Voters with NextGen Florida,1594140994.0,"07/07/2020, 16:56:34",0,0,4,0.809784271959793,0.83,0.0
630,activism,Is non-political activism a thing?,1594117061.0,"07/07/2020, 10:17:41",4,0,4,0.8409276211067969,0.83,1.0
631,activism,Why don't more people call their elected officials?,1594064248.0,"07/06/2020, 19:37:28",3,0,4,0.7476681968327918,0.84,0.75
632,activism,How do you prioritise problems?,1593825929.0,"07/04/2020, 01:25:29",2,0,5,-0.005202000578910848,1.0,0.4
633,activism,Vote for Your Health: https://www.uniguide.com/trump-epa-pfas-chemicals-cancer-reproductive-toxicity/,1593807219.0,"07/03/2020, 20:13:39",0,0,4,0.7481505599552776,0.84,0.0
634,activism,Getting trump off twitter,1593660678.0,"07/02/2020, 03:31:18",4,0,5,1.402653287132953,0.78,0.8
635,activism,Confused on how to present myself,1593512215.0,"06/30/2020, 10:16:55",4,0,5,0.8378569996910876,0.86,0.8
636,activism,"Petition to remove ""colonist"" mascot",1593389406.0,"06/29/2020, 00:10:06",2,0,3,1.153390544089735,0.72,0.6666666666666666
637,activism,One of the co-sponsors of the Green New Deal is losing his primary!,1593194214.0,"06/26/2020, 17:56:54",1,0,5,0.8018983837016469,0.86,0.2
638,activism,Confronting National Crisis Through a Psychological Lens,1593010777.0,"06/24/2020, 14:59:37",0,0,5,0.8440377682944886,0.86,0.0
639,activism,"The indigenous people of Sapmi (Sweden, Norway, Finland, and Russia) could use some help!",1592851501.0,"06/22/2020, 18:45:01",0,0,3,0.7303814442502774,0.8,0.0
640,activism,Trump Is Looking To Threaten Our Largest Forest Once Again Choosing Economy Over Environment:,1592834759.0,"06/22/2020, 14:05:59",0,0,4,0.7634121099139088,0.84,0.0
641,activism,Leaked documents reveal right-wing oligarch plot to overthrow Mexico's AMLO | The Grayzone,1592731542.0,"06/21/2020, 09:25:42",0,0,5,0.020358117420309796,1.0,0.0
642,activism,"Black Lives Matter Movement 101: Truth, History, Facts, Meaning &amp; Message",1592587183.0,"06/19/2020, 17:19:43",0,0,3,1.1527217175542264,0.72,0.0
643,activism,Why the American Prison System is Antithetical to Democracy,1592405438.0,"06/17/2020, 14:50:38",0,0,2,0.9634255000168488,0.67,0.0
644,activism,What are some good keywords to use when searching for activism jobs?,1592358624.0,"06/17/2020, 01:50:24",6,0,5,0.8159199737453937,0.86,1.2
645,activism,How to get people involved?,1592349377.0,"06/16/2020, 23:16:17",2,0,5,0.0012443648446076594,1.0,0.4
646,activism,SHREDDING new PragerU Propaganda,1592250886.0,"06/15/2020, 19:54:46",0,0,5,1.4200594894146397,0.78,0.0
647,activism,"Residents of Amarillo, Tx painted Cadillac Ranch in honor of the BLM movement ❤",1591537134.0,"06/07/2020, 13:38:54",0,0,3,1.166848217289565,0.72,0.0
648,activism,A post I made in r/police about the reality of systemic racism within the police force. This community is predominantly police and have downvoted me relentlessly but still was able to keep positive karma,1591524538.0,"06/07/2020, 10:08:58",1,0,5,1.40828923609382,0.78,0.2
649,activism,Be the light,1591435394.0,"06/06/2020, 09:23:14",0,0,4,0.7904994714309028,0.83,0.0
650,activism,"hey, im an indie dev wondering about a game idea",1591398925.0,"06/05/2020, 23:15:25",0,0,4,1.263908232989464,0.76,0.0
651,activism,"To mobilize outrage over George Floyd’s killing, look to lessons of social movements past",1591390563.0,"06/05/2020, 20:56:03",0,0,3,0.7105020580519086,0.81,0.0
652,activism,"Weird to think that in the future, when people talk about ""the civil rights movement"", they might be talking about now (assuming this continues as it should), not the '50-60's.",1591303672.0,"06/04/2020, 20:47:52",0,0,4,-0.010456832611894562,1.0,0.0
653,activism,Hong Kong Protests Vs. George Floyd Protests,1591198033.0,"06/03/2020, 15:27:13",0,0,5,-0.018741224141169077,1.0,0.0
654,activism,"""George Floyd Protest Interview with WFDY President - Join us for a conversation with Aritz Rodriguez Galan, President of the World Federation of Democratic Youth, for a conversation on the international anti-fascist youth's response to the COVID-19 pandemic and George Floyd Protests.""",1591191066.0,"06/03/2020, 13:31:06",0,0,4,0.008253836499699574,1.0,0.0
655,activism,Mace unlawful unless used in self defense as read on KCPD's own mace cans,1591084415.0,"06/02/2020, 07:53:35",0,0,5,0.8102669403383498,0.86,0.0
656,activism,Beijing: The human rights of minorities in the U.S. must be guaranteed,1591046572.0,"06/01/2020, 21:22:52",10,0,4,1.32067893437552,0.75,2.5
657,activism,Police lined up against protestors in Denver CO. 5.30.2020,1590952891.0,"05/31/2020, 19:21:31",0,0,4,0.8269447739248648,0.83,0.0
658,activism,Hey would someone help me with identifying the phone numbers or contact info of key individuals for arraigning a sit down for deescalation in America right now.,1590942325.0,"05/31/2020, 16:25:25",0,0,5,1.4235684645926714,0.78,0.0
659,activism,Why Flag Burning does not offend me,1590866612.0,"05/30/2020, 19:23:32",2,0,4,0.7342518503348963,0.84,0.5
660,activism,I wrote an article about how non black peoples can be better allies during this time,1590825669.0,"05/30/2020, 08:01:09",0,0,3,1.1923980285633045,0.72,0.0
661,activism,"Are you in the New Orleans area? If you can’t make it, but wish to support, you can CashApp $KenLeb for supplies. We’re stocking up on food, water, masks, first aid, etc. SC: kennedykati to keep up with where the donation money is going.",1590793211.0,"05/29/2020, 23:00:11",0,0,4,-0.0178733889898961,1.0,0.0
662,activism,Opinion: COVID-19 Highlights Problems Social Democrats Fought for Years - The New Voice,1590630466.0,"05/28/2020, 01:47:46",0,0,4,1.3312367422511322,0.75,0.0
663,activism,Tenant Organizing Toolkit,1590398505.0,"05/25/2020, 09:21:45",0,0,2,1.1615762192235852,0.63,0.0
664,activism,Roger Waters (Pink Floyd) performs for May Day under Covid-19 Lockdown,1590318413.0,"05/24/2020, 11:06:53",0,0,3,0.6897829611638713,0.81,0.0
665,activism,Examples of successful campaigns/movements for sustainable farming in communities?,1590122581.0,"05/22/2020, 04:43:01",0,0,3,0.6839399478777852,0.81,0.0
666,activism,Here's the story of how the far-right and Italian spooks spied on the crew of an NGO refugee rescue ship and attempted to portray them as criminals,1590004626.0,"05/20/2020, 19:57:06",0,0,4,0.833894274002879,0.83,0.0
667,activism,The Trump administration is rushing deportations of migrant children during coronavirus,1589923997.0,"05/19/2020, 21:33:17",0,0,2,1.3554500152805065,0.6,0.0
668,activism,An “Illiberal Democracy” if Trump Wins Again,1589590384.0,"05/16/2020, 00:53:04",0,0,3,0.7091441838518491,0.81,0.0
669,activism,Technology (drone and html) for activism (Autodesk supports coal),1589466001.0,"05/14/2020, 14:20:01",0,0,4,0.7861531106361968,0.84,0.0
670,activism,"John Denver's songs very relevant to this time, please listen and share.",1588986382.0,"05/09/2020, 01:06:22",0,0,5,-0.010294737115274621,1.0,0.0
671,activism,Joe Biden is LYING about Tara Reade Accusation,1588394801.0,"05/02/2020, 04:46:41",0,0,4,1.6782140596459625,0.7,0.0
672,activism,Join us to make the education system better!,1588187426.0,"04/29/2020, 19:10:26",0,0,4,0.8112514105221029,0.83,0.0
673,activism,Created a sub against anti lockdown protests today. With a secondary goal of documenting them,1588083675.0,"04/28/2020, 14:21:15",1,0,2,1.3546375318311368,0.6,0.5
674,activism,"...Our voices are pushed down—for many of us it’s temporary, but for billions it’s reality",1588059526.0,"04/28/2020, 07:38:46",0,0,5,0.8236777351934359,0.86,0.0
675,activism,Activists for Cane Toads,1587957617.0,"04/27/2020, 03:20:17",0,0,5,3.0127664224884683,0.62,0.0
676,activism,"A Lesson to Remember: Ignaz Semmelweis, the Persecuted ""Savior of Mothers""",1587854747.0,"04/25/2020, 22:45:47",0,0,3,1.5109062956250572,0.67,0.0
677,activism,Defamation - ADL bullying Ukraine into downplaying the Holodomor as serious as the Holocaust,1587851280.0,"04/25/2020, 21:48:00",0,0,4,2.7912678206660244,0.59,0.0
678,activism,How To Start A Successful Strike During Crisis. w/Jane McAlevey,1587764716.0,"04/24/2020, 21:45:16",0,0,4,1.2362926285568268,0.76,0.0
679,activism,"Massive Flash floods have ravaged the capital of Yemen. In the first video the person recording is heard saying there is a woman stuck in the car, as bystanders rush in the raging waters to save her. Entire Markets, Shops and Properties were destroyed before the waters subsided.",1586986174.0,"04/15/2020, 21:29:34",2,0,4,-0.001498886354497575,1.0,0.5
680,activism,"Its about biden, not us.",1586973969.0,"04/15/2020, 18:06:09",3,0,3,0.766651451248332,0.8,1.0
681,activism,Amnesty researcher prompts Hamas to arrest peace activist,1586842457.0,"04/14/2020, 05:34:17",1,0,5,-0.024198637229743802,1.0,0.2
682,activism,"Youth Media Academy Summer 2020: Get Paid to Develop Skills In Documentary Film, Journalism, and Media",1586549102.0,"04/10/2020, 20:05:02",0,0,3,0.6944503338634678,0.81,0.0
683,activism,How are people keeping activist work going during the lockdown?,1586001615.0,"04/04/2020, 12:00:15",0,0,4,-0.005797146068092118,1.0,0.0
684,activism,"Nickelodeon partnered with Autism $peaks recently. While im sure this was done with no ill intent, i made a petition with the goal of ending that partnership because many autistic people consider Autism Speaks to be a hate group, they arent helping autists, and are most definitely not a charity.",1585998964.0,"04/04/2020, 11:16:04",3,0,3,1.179736160983028,0.72,1.0
685,activism,"It's time for a revolution, take a listen!",1585416662.0,"03/28/2020, 17:31:02",2,0,3,1.1901481259948419,0.72,0.6666666666666666
686,activism,Activism Opportunity - UK,1585315586.0,"03/27/2020, 13:26:26",0,0,5,0.014822881113315312,1.0,0.0
687,activism,Over 100 activists arrested in Moscow,1584647022.0,"03/19/2020, 19:43:42",0,0,4,0.03552467055583186,0.99,0.0
688,activism,"This world is too chaotic, I'm a musician trying to fight it with my music. Please help me spread my message",1583957677.0,"03/11/2020, 20:14:37",0,0,4,1.698284260490837,0.7,0.0
689,activism,Jane McAlevey on Organizing for Power In The Trump Era,1583424981.0,"03/05/2020, 16:16:21",1,0,5,0.8385446531039813,0.86,0.2
690,activism,Momentum Activist Training : Introduction to Dominant Traditions,1583274265.0,"03/03/2020, 22:24:25",2,0,4,0.7791076508926675,0.84,0.5
691,activism,Opioid Side Effects No One Talks About,1582733193.0,"02/26/2020, 16:06:33",2,0,4,0.0074313232879603675,1.0,0.5
692,activism,Exploratory Interest in 2020 Social Protest,1581592307.0,"02/13/2020, 11:11:47",0,0,4,0.8187366154363156,0.83,0.0
693,activism,Jane McAlevey on actual actual actual organizing,1581133001.0,"02/08/2020, 03:36:41",0,0,4,0.01633122026388456,1.0,0.0
694,activism,"Watch ""Awaxaawippíia,"" a short film about what the Crazy Mountains mean to the Apsáalooke (Crow) and why the Forest Service needs to protect the range",1580875609.0,"02/05/2020, 04:06:49",0,0,4,-0.018812076132462163,1.0,0.0
695,activism,Jane McAlevey on Deep Organizing,1580826362.0,"02/04/2020, 14:26:02",0,0,3,1.17406620958658,0.72,0.0
696,activism,HELP NEEDED w Restorative Justice &amp; inter-community conflict,1580594915.0,"02/01/2020, 22:08:35",2,0,3,0.6997609101745907,0.81,0.6666666666666666
697,activism,Help Needed,1580519044.0,"02/01/2020, 01:04:04",5,0,5,0.8072113657752968,0.86,1.0
698,activism,Extinction Rebellion Graffiti,1580078518.0,"01/26/2020, 22:41:58",0,0,3,1.4937343788015642,0.67,0.0
699,activism,Opinion: The War At Home - The New Voice,1579807024.0,"01/23/2020, 19:17:04",0,0,2,0.9975423903823057,0.67,0.0
700,activism,How Bangladesh's Youth Protests Held Their Government Accountable - The New Voice,1579624848.0,"01/21/2020, 16:40:48",0,0,4,-0.001586536045238951,1.0,0.0
701,activism,Do We Need a Spiritual Revolution?,1579359642.0,"01/18/2020, 15:00:42",0,0,4,0.8196720510599125,0.83,0.0
702,activism,"Military Style Raid on Homeless, Oakland, CA",1579044341.0,"01/14/2020, 23:25:41",0,0,3,0.7145220781391246,0.81,0.0
703,activism,Activist News Page on Facebook. Revolutionary News.,1578847223.0,"01/12/2020, 16:40:23",0,0,4,1.3037922142593095,0.75,0.0
704,activism,Talking to the Stranger Sandra Bland [Malcolm Gladwell Book Review],1578523300.0,"01/08/2020, 22:41:40",0,0,3,0.683478975938089,0.81,0.0
705,activism,Hold Coca Cola accountable for complicity in Uyghur genocide: Sign the Petition,1578263400.0,"01/05/2020, 22:30:00",0,0,4,0.0054735944927326585,1.0,0.0
706,activism,"Opinion: Teens to the Tally, the Importance of Voting - The New Voice",1576521819.0,"12/16/2019, 18:43:39",0,0,5,1.3844315343010436,0.78,0.0
707,activism,This morning Good Morning America had a segment on Greta Thunberg winning Time's Person of the Year. Then the hosts spent 80% of the segment praising their boss ABC/Disney CEO Bob Iger.,1576119941.0,"12/12/2019, 03:05:41",0,0,4,0.8227799905770921,0.83,0.0
708,activism,How do I teach a method of improving inclusivity to my peers without seeming like I have a Messiah Complex?,1575342646.0,"12/03/2019, 03:10:46",2,0,3,0.6931090006687413,0.81,0.6666666666666666
709,activism,Mail My Voice - Make Yourself Heard,1574694858.0,"11/25/2019, 15:14:18",0,0,3,1.1785203429743065,0.72,0.0
710,activism,"""A New Hope"" Let Down Many: Indonesian Protests Explained - The New Voice",1573494485.0,"11/11/2019, 17:48:05",0,0,4,1.6180630907560394,0.71,0.0
711,activism,Sign up for GOTV Shifts. It's not too late to reach first time environmental voters.,1604234281.0,"11/01/2020, 12:38:01",0,0,3,0.007688533841937684,1.0,0.0
712,activism,"Interview with Chilean activist about the referendum, the long struggle to get to this moment, and what the future of democracy in Chile looks like",1604190759.0,"11/01/2020, 00:32:39",0,0,3,0.006876901565165294,1.0,0.0
713,activism,Humans will always be more prosperous as a species if we are all educated equally! Read more on our thoughts on how we get there.,1604077430.0,"10/30/2020, 17:03:50",0,0,3,0.005196764101145668,1.0,0.0
714,activism,"Biden if elected will form task force to reunite 545 separated immigrant children with family, campaign says",1603999435.0,"10/29/2020, 19:23:55",6,0,4,1.3575422446606238,0.75,1.5
715,activism,Adam Christensen is a progressive running in Florida’s 3rd district on issues like Medicare For All and the Green New Deal,1603897204.0,"10/28/2020, 15:00:04",0,0,2,0.9691445078700207,0.67,0.0
716,activism,I'm so inspired by the Brandalism community in the UK that manipulates billboards to mock corporate messaging. Epic,1603815463.0,"10/27/2020, 16:17:43",0,0,3,-0.002080482632829561,1.0,0.0
717,activism,the US is now a radical police state of terror--the coming war!,1603814598.0,"10/27/2020, 16:03:18",0,0,3,0.011585264873873236,1.0,0.0
718,activism,An American in a Nutshell,1602680973.0,"10/14/2020, 13:09:33",0,0,2,0.9690840972737318,0.67,0.0
719,activism,recap of protests that took place all over the US last week,1602635668.0,"10/14/2020, 00:34:28",0,0,3,0.008070780817274414,1.0,0.0
720,activism,"When I was in high school I thought baja sweaters (stoner sweaters) were cool. So I bought one, I thought it looked beachy and comfy. even though I haven’t worn it in forever, I think everyone should respect each other’s cultures. is this considered cultural appropriation? if so, id give it away.",1602449254.0,"10/11/2020, 20:47:34",22,0,3,1.6681273272017956,0.64,7.333333333333333
721,activism,Kick starter or Social media,1602261972.0,"10/09/2020, 16:46:12",0,0,4,0.7916196797380284,0.83,0.0
722,activism,Litterature about practicing activism,1602246102.0,"10/09/2020, 12:21:42",0,0,3,-0.01241746670091226,1.0,0.0
723,activism,capitalism gives us poor health,1601940835.0,"10/05/2020, 23:33:55",0,0,3,-0.006905329097928181,1.0,0.0
724,activism,Why do Americans insist on voting for the 1%?,1601882444.0,"10/05/2020, 07:20:44",1,0,3,0.7683974111324452,0.8,0.3333333333333333
725,activism,Have you heard about #RESTART?,1601580268.0,"10/01/2020, 19:24:28",0,0,3,0.7106969404219696,0.81,0.0
726,activism,Does anyone have any idea how to connect with filmmakers or youtubers to make some videos?,1601318051.0,"09/28/2020, 18:34:11",3,0,3,0.007430847764589021,1.0,1.0
727,activism,"The entertainment studio is also prepping a documentary feature, 'Flowers of the Desert: Stories from the Red Note'",1600896548.0,"09/23/2020, 21:29:08",0,0,3,-0.013279088744382772,1.0,0.0
728,activism,Europe’s criminalisation of NGO refugee rescuers reaches ‘another peak’ after fifth ship detained in Italy: Sea Watch says blockade is ‘politically motivated’ and aimed at stopping ‘rescue operations in the central Mediterranean’,1600623921.0,"09/20/2020, 17:45:21",0,0,3,-0.01233431924131212,1.0,0.0
729,activism,The Jimmy Dore Show Podcast,1600448832.0,"09/18/2020, 17:07:12",0,0,3,0.001889214863805666,1.0,0.0
730,activism,Plan to dismantle white supremacy (in US),1599846958.0,"09/11/2020, 17:55:58",1,0,3,-0.014554715430584508,1.0,0.3333333333333333
731,activism,Strike!,1599707853.0,"09/10/2020, 03:17:33",0,0,3,-0.0010635977924273732,1.0,0.0
732,activism,"Peaceful protect the children protest in London on Saturday 05/09/20 shut down by police, while extinction rebellion protest allowed to carry on, selective policing? - videos and evidence in the text",1599512119.0,"09/07/2020, 20:55:19",0,0,3,2.332117347214605,0.56,0.0
733,activism,TIER LIST for Biden's Policies,1599416344.0,"09/06/2020, 18:19:04",0,0,2,1.184520445040147,0.63,0.0
734,activism,"Nasrin Sotoudeh⁩, human rights lawyer, has been on indefinite hunger strike for 19 days in Evin prison, Iran. Her health is deteriorating and blood pressure is unstable. It is time to free Nasrin Sotoudeh",1598749958.0,"08/30/2020, 01:12:38",0,0,2,0.9761904380124311,0.67,0.0
735,activism,Is anyone interested in an app dedicated to only activism?,1598738919.0,"08/29/2020, 22:08:39",0,0,3,0.011535207850247087,1.0,0.0
736,activism,March to dc,1598633972.0,"08/28/2020, 16:59:32",0,0,3,-0.003332153061532228,1.0,0.0
737,activism,Global Protest: Stop genocide of Uyghurs,1598391907.0,"08/25/2020, 21:45:07",0,0,3,-0.00603333037008591,1.0,0.0
738,activism,Cruelty and Unsanitary Conditions Exposed,1598369429.0,"08/25/2020, 15:30:29",0,0,3,0.7618638194508169,0.8,0.0
739,activism,"Join my new subreddit that celebrates free speech and call out those who are censoring people! Some don’t realise how far we can go with the ability to talk our minds. Not everything is heavy/political, I’d like to branch out to see if we could tackle the issue of comedy, but we shall see! Thanks x",1598138985.0,"08/22/2020, 23:29:45",1,0,3,1.7092749367248992,0.64,0.3333333333333333
740,activism,"No more fences , we need clear sky and politics of enlightment. Narrative in English language.",1598009893.0,"08/21/2020, 11:38:13",0,0,3,0.011302784629494855,1.0,0.0
741,activism,A new platform for activism!,1597871424.0,"08/19/2020, 21:10:24",0,0,3,1.4805055805602567,0.67,0.0
742,activism,Grassroots global activism organization,1597600149.0,"08/16/2020, 17:49:09",0,0,3,0.0058940311326405315,1.0,0.0
743,activism,Why Did Garret Foster Die? – and why it split a community in two,1597538118.0,"08/16/2020, 00:35:18",1,0,3,-0.011175797021509393,1.0,0.3333333333333333
744,activism,ICE Resisted Coronavirus Testing to Avoid Releasing Detainees,1597531796.0,"08/15/2020, 22:49:56",0,0,3,-0.012104852103083097,1.0,0.0
745,activism,"Bootsy Collins on Togetherness, Tragedies, and How We're Missing the ""Hippie Side of Things""",1597264312.0,"08/12/2020, 20:31:52",0,0,3,-0.011267555454679279,1.0,0.0
746,activism,Empty Tent Camps?,1596568031.0,"08/04/2020, 19:07:11",0,0,3,-0.0015373683850299358,1.0,0.0
747,activism,Embedded Lessons of Historical Importance - how an honest account of history can benefit society.,1596215221.0,"07/31/2020, 17:07:01",0,0,3,-0.00909228140899021,1.0,0.0
748,activism,The reluctant activist.,1596211816.0,"07/31/2020, 16:10:16",2,0,3,0.003612988466820344,1.0,0.6666666666666666
749,activism,24 and That 70s Show actress discusses true activism,1596025676.0,"07/29/2020, 12:27:56",0,0,3,0.01445272263693953,1.0,0.0
750,activism,Help Us Expose The Abusive &amp; Neglectful Troubled Teen Industry &amp; Save Teens From Abuse!,1595372906.0,"07/21/2020, 23:08:26",3,0,3,0.7245688395452468,0.81,1.0
751,activism,Azerbaijan is attacking Armenia! More info.,1594939797.0,"07/16/2020, 22:49:57",0,0,3,0.00812479458083537,1.0,0.0
752,activism,7 reasons i oppose the execution of daniel lewis lee,1594875303.0,"07/16/2020, 04:55:03",0,0,3,-0.01443491619449988,1.0,0.0
753,activism,Replace Statues of Confederate Generals with Statues of Famous African-Americans,1594676834.0,"07/13/2020, 21:47:14",0,0,3,0.006842722256183098,1.0,0.0
754,activism,Lets Support the Navajo Nation,1594514503.0,"07/12/2020, 00:41:43",0,0,3,-0.010649627726835309,1.0,0.0
755,activism,Trader Joe’s: Remove Racist Packaging From Your Products,1594321420.0,"07/09/2020, 19:03:40",1,0,3,0.011599112055293404,1.0,0.3333333333333333
756,activism,"Our frontline workers need hazard pay! Trader Joe's pretends to be ""your neighborhood grocery store"", but they are just like any other big corporation: exploiting their workers during the pandemic, refusing hazard pay, cutting hours, and squashing unionizing activities.",1594247673.0,"07/08/2020, 22:34:33",0,0,3,-0.013892919441740759,1.0,0.0
757,activism,Tracing the Abolition of Slavery to Today's Mass Incarceration,1594133415.0,"07/07/2020, 14:50:15",0,0,3,0.7166420737251005,0.81,0.0
758,activism,Books on political organising?,1594113335.0,"07/07/2020, 09:15:35",1,0,3,0.01411105845753502,1.0,0.3333333333333333
759,activism,"Gettysburg, Pennsylvania Black Lives Matter Protest! We need your help!",1594079995.0,"07/06/2020, 23:59:55",0,0,3,-0.0013920225017827192,1.0,0.0
760,activism,Help Us Legalize MDMA-Assisted Psychotherapy! (MAPS $10MM Capstone Challenge),1593693784.0,"07/02/2020, 12:43:04",0,0,2,1.1924509582845917,0.63,0.0
761,activism,why libertarians should ally with the left,1593567306.0,"07/01/2020, 01:35:06",8,0,3,1.5110763644896226,0.67,2.6666666666666665
762,activism,need help,1593367140.0,"06/28/2020, 17:59:00",2,0,4,0.7994662610126815,0.83,0.5
763,activism,Anarchist rebel BLM flag,1593240732.0,"06/27/2020, 06:52:12",0,0,3,0.7389269544581967,0.8,0.0
764,activism,"US bankers stole $7 trillion during COVID-19 lockdown, destroyed small businesses",1592844632.0,"06/22/2020, 16:50:32",0,0,3,1.1428211240588242,0.72,0.0
765,activism,"UN Debate Racism in USA, US officials disapprove",1592514862.0,"06/18/2020, 21:14:22",0,0,2,1.0056575284866591,0.67,0.0
766,activism,Fight for justice in 30 seconds,1592425897.0,"06/17/2020, 20:31:37",1,0,3,0.7152429240088645,0.81,0.3333333333333333
767,activism,I need your help,1592391999.0,"06/17/2020, 11:06:39",4,0,3,1.5005358644181506,0.67,1.3333333333333333
768,activism,BLM designs for stickers and more (mine is the red heart with the signs),1592195395.0,"06/15/2020, 04:29:55",1,0,3,1.224415455568245,0.71,0.3333333333333333
