,Subreddit,Title,Epoch Time,Date,Comments,Awards,Upvotes,Downvotes,Upvote Ratio,Comment/Upvote Ratio
0,activism,"seriously, and during covid the shipping isnt even 2 day",1598374188.0,"08/25/2020, 16:49:48",3,0,96,0.5824320344764828,0.99,0.03125
1,activism,We need to end this insanity that doesnt even let us enjoy our lives.,1578669958.0,"01/10/2020, 15:25:58",0,0,88,2.932374805133321,0.97,0.0
2,activism,Our govt has became to greedy the US Constitution says we can take control over our govt if tyranny happens well it's happening now I think it's time to take control. Follow my Instagram @youneedtruth,1585473501.0,"03/29/2020, 09:18:21",5,0,77,4.359726095388865,0.95,0.06493506493506493
3,activism,Justice in UK,1583661214.0,"03/08/2020, 09:53:34",1,0,73,10.243301728244546,0.88,0.0136986301369863
4,activism,hard to swallow!,1592270007.0,"06/16/2020, 01:13:27",3,0,68,3.447694169064647,0.95,0.04411764705882353
5,activism,😔,1601471858.0,"09/30/2020, 13:17:38",1,0,68,4.67211016113184,0.94,0.014705882352941176
6,activism,This is seriously messed and needs to be taken down,1600620849.0,"09/20/2020, 16:54:09",14,0,70,6.1285842989656345,0.92,0.2
7,activism,"We are in danger, fight for your rights, Poland 🇵🇱 2020. This is history.",1604336081.0,"11/02/2020, 16:54:41",1,0,81,1.3114840969039676,0.98,0.012345679012345678
8,activism,"Hi everyone, I’m a Student at Texas Tech University and one of my friends is in the Org where a member literally made a video calling black people “Niggers” and literally saying “Black People suck” The university has failed to take appropriate action. We are trying to circulate the video he made.",1577256293.0,"12/25/2019, 06:44:53",41,0,65,5.139769461501004,0.93,0.6307692307692307
9,activism,"wait a second, THIS IS THE BAD PLACE",1598218156.0,"08/23/2020, 21:29:16",0,0,60,4.3901061152236736,0.93,0.0
10,activism,[truth and lies],1577750537.0,"12/31/2019, 00:02:17",1,0,63,1.7750641957374995,0.97,0.015873015873015872
11,activism,NRA Accidentally Forgets To Rise Up Against Tyrannical Government,1591531034.0,"06/07/2020, 11:57:14",0,0,59,5.855181644222924,0.91,0.0
12,activism,"man runs around ""looking like someone who committed a robbery"" to prove that Ahmaud Arbery's murder was unjustified",1596109253.0,"07/30/2020, 11:40:53",3,0,58,1.856121669602345,0.97,0.05172413793103448
13,activism,Always keeping the mask!,1590338397.0,"05/24/2020, 16:39:57",1,0,59,2.4140166565943417,0.96,0.01694915254237288
14,activism,"Greta Thunberg: ""Times""-Magazines ""Person of the Year 2019""",1576074618.0,"12/11/2019, 14:30:18",19,0,57,6.929489256817369,0.89,0.3333333333333333
15,activism,As a Canadian I am deeply disturbed by people advocating for the re-introduction of residential schools. I can't stand racism...,1603039271.0,"10/18/2020, 16:41:11",2,0,53,0.9913889279114727,0.98,0.03773584905660377
16,activism,🤷🏾‍♂️,1591699807.0,"06/09/2020, 10:50:07",0,0,55,1.5297923869274115,0.97,0.0
17,activism,"Get Netflix to remove Cuties, film sexualizing children",1597880923.0,"08/19/2020, 23:48:43",14,0,49,7.8137542294044025,0.86,0.2857142857142857
18,activism,because some people act different with the cameras turned off,1595007155.0,"07/17/2020, 17:32:35",6,0,50,3.880510064500193,0.93,0.12
19,activism,What can/should we do about the genocidal hysterectomies that have occurred in Georgia’s ICE detention center?,1600264937.0,"09/16/2020, 14:02:17",9,0,51,2.4521234779258023,0.95,0.17647058823529413
20,activism,Time for Truth.,1577831357.0,"12/31/2019, 22:29:17",3,0,53,4.583737777202131,0.92,0.05660377358490566
21,activism,"After a Year of Investigation, the Border Patrol Has Little to Say About Agents’ Misogynistic and Racist Facebook Group",1597612903.0,"08/16/2020, 21:21:43",0,0,48,0.8324504500711853,0.98,0.0
22,activism,Dairy cow comforts activist capturing her suffering who became overwhelmed with emotion 💔,1594654155.0,"07/13/2020, 15:29:15",6,0,49,1.951610944408543,0.96,0.12244897959183673
23,activism,fuck nestle,1604048221.0,"10/30/2020, 08:57:01",2,1,49,1.0983702092937477,0.98,0.04081632653061224
24,activism,"In the past two days we have lost 40% of our remaining Canadian Arctic ice. I always thought this would be the point the human race kicked into gear, but here we are... most people haven’t even heard about it.",1596851067.0,"08/08/2020, 01:44:27",8,0,47,1.0032636421789292,0.98,0.1702127659574468
25,activism,Figured y'all should see this,1584467489.0,"03/17/2020, 17:51:29",2,0,45,2.4848483085046382,0.95,0.044444444444444446
26,activism,"The late Aaron Swartz, internet activist, computer programmer and co-founder of Reddit, discusses the importance of organizations like Wikileaks for whistle blowers and journalists",1582013590.0,"02/18/2020, 08:13:10",3,0,47,0.736667527439792,0.98,0.06382978723404255
27,activism,Legit Donation Platforms,1596905214.0,"08/08/2020, 16:46:54",4,0,46,3.6679629438530483,0.93,0.08695652173913043
28,activism,Corporate targets are people,1573110104.0,"11/07/2019, 07:01:44",3,0,45,3.8657959176934398,0.92,0.06666666666666667
29,activism,If you'd like to share my illustration please go ahead. I drew this without my signature as I want no promotion from it.,1591015303.0,"06/01/2020, 12:41:43",2,0,47,5.754941651584637,0.89,0.0425531914893617
30,activism,IAMA (F17) Youth Activist in Colorado who just passed HB20-1131 through the House! Here is my rally speech.,1581314419.0,"02/10/2020, 06:00:19",0,0,46,2.702832059302658,0.94,0.0
31,activism,Do it the safe way to have your voice heard!,1597540064.0,"08/16/2020, 01:07:44",0,1,44,2.6112928473481887,0.94,0.0
32,activism,convict 9653 for president,1586543820.0,"04/10/2020, 18:37:00",0,0,42,2.6596236832351394,0.94,0.0
33,activism,Creative Activism...,1577369794.0,"12/26/2019, 14:16:34",1,0,46,0.8021652184278665,0.98,0.021739130434782608
34,activism,"Instacart’s Gig Workers Are Planning a Massive, Nationwide Strike",1585330101.0,"03/27/2020, 17:28:21",0,0,44,1.0341649073724568,0.98,0.0
35,activism,"A protester holds a sign at a Gay Rights Demonstration, 1970",1580279415.0,"01/29/2020, 06:30:15",0,0,46,1.2988379653058217,0.97,0.0
36,activism,Check your voter registration status. I was removed from the roll even though I'm an active voter.,1596156352.0,"07/31/2020, 00:45:52",3,0,41,2.2528601437024633,0.95,0.07317073170731707
37,activism,4 Severely Ill Migrant Toddlers Hospitalized After Lawyers Visit Border Patrol Facility,1588195960.0,"04/29/2020, 21:32:40",0,0,40,2.358689317512855,0.94,0.0
38,activism,Mutual Aid in action. Today a comrade and I made over 150 safer injection drug use and wound care kits for distribution in our neighborhood. Folks in our area haven't had access to safe supplies for weeks.,1586636995.0,"04/11/2020, 20:29:55",2,0,41,2.76486900314476,0.94,0.04878048780487805
39,activism,#FactsMatter,1586390990.0,"04/09/2020, 00:09:50",1,0,41,1.8896677769894765,0.96,0.024390243902439025
40,activism,"'Revolt' stencil in Aachen, Germany, portraying a frontline archer from the HK protests",1599569946.0,"09/08/2020, 12:59:06",0,0,41,2.485002093985983,0.94,0.0
41,activism,Antwerp authorities have removed a statue of colonial Belgian King Leopold II after the weekend’s BlackLivesMatter protest. The campaign to remove all of them continues.,1591774452.0,"06/10/2020, 07:34:12",1,0,37,2.185840536958942,0.94,0.02702702702702703
42,activism,"Feel free to share. Credit: TIME Magazine, May 11 2015 | Edited myself; no credit needed for this",1591086516.0,"06/02/2020, 08:28:36",1,0,37,3.8369746686334025,0.91,0.02702702702702703
43,activism,This is activism right?....,1601374875.0,"09/29/2020, 10:21:15",4,0,39,0.8279258078553298,0.98,0.10256410256410256
44,activism,This could be a historic event and send a real message of unity and solidarity. If we could all share this and make it possible the message would be very very loud.,1591242964.0,"06/04/2020, 03:56:04",0,0,39,0.6249417576027696,0.98,0.0
45,activism,To the 3 people that are going to see this,1599601649.0,"09/08/2020, 21:47:29",3,0,39,0.05910087847301071,1.0,0.07692307692307693
46,activism,a damn shame...,1595686497.0,"07/25/2020, 14:14:57",1,0,38,0.6741018796049332,0.98,0.02631578947368421
47,activism,Coronavirus has temporarily reduced China’s CO2 emissions by a quarter,1582402880.0,"02/22/2020, 20:21:20",3,0,36,5.459077120671317,0.87,0.08333333333333333
48,activism,2020 people are getting the right idea,1595776647.0,"07/26/2020, 15:17:27",3,0,38,2.3884023653422233,0.94,0.07894736842105263
49,activism,looks like our government is using the DENNIS system,1594763536.0,"07/14/2020, 21:52:16",0,0,37,0.02176327757764085,1.0,0.0
50,activism,Over 50 car ramming attacks on BLM protesters have been recorded since May. This is a serious terror threat across the US and I haven't heard a single official talk about how they are trying to stop it,1594303610.0,"07/09/2020, 14:06:50",5,0,38,1.0322721895233826,0.97,0.13157894736842105
51,activism,like biden,1587072809.0,"04/16/2020, 21:33:29",3,0,38,12.42702753648014,0.75,0.07894736842105263
52,activism,"We are not replaceable, we are essential.",1585168500.0,"03/25/2020, 20:35:00",5,0,37,1.1343842214256625,0.97,0.13513513513513514
53,activism,Recycle,1580202395.0,"01/28/2020, 09:06:35",4,0,37,2.6245762941889907,0.93,0.10810810810810811
54,activism,WILL break your heart. Then do something.,1598591086.0,"08/28/2020, 05:04:46",0,0,36,0.954110243356844,0.97,0.0
55,activism,This man is a true American. Class act.,1590813993.0,"05/30/2020, 04:46:33",3,0,36,2.5596058307561194,0.93,0.08333333333333333
56,activism,How to deal with manipulative men in activist circles,1582279169.0,"02/21/2020, 09:59:29",8,0,36,4.398446635751732,0.89,0.2222222222222222
57,activism,Activists Turn Facial Recognition Tools Against the Police,1603340932.0,"10/22/2020, 04:28:52",0,1,35,0.9108926046181907,0.97,0.0
58,activism,"RBG Dies, STOP TRUMP's PICK NOW",1600477472.0,"09/19/2020, 01:04:32",0,0,34,6.6559733044583425,0.84,0.0
59,activism,"Sharing an almost $300,000 education on woodworking from a high class university because the USA doesn't realize yet that everyone should have access to free learning at any level!",1598727401.0,"08/29/2020, 18:56:41",0,0,35,1.1587341813507166,0.97,0.0
60,activism,An ICE Nurse Revealed That A Georgia Detention Center Is Performing Mass Hysterectomies,1600182315.0,"09/15/2020, 15:05:15",5,0,36,1.0535962880615344,0.97,0.1388888888888889
61,activism,"Judge orders US to stop detaining migrant children in Texas, Arizona Hampton Inn &amp; Suites hotels",1600116189.0,"09/14/2020, 20:43:09",0,0,33,2.990090104828326,0.92,0.0
62,activism,Ending oil revolution by promoting this,1589875725.0,"05/19/2020, 08:08:45",3,0,36,2.595224907156286,0.93,0.08333333333333333
63,activism,Any Human Power can be Resisted &amp; Changed by Human Beings,1579703718.0,"01/22/2020, 14:35:18",0,0,34,0.9716112718780963,0.97,0.0
64,activism,Immigrant Children Illegally Detained by ICE in Texas Hotel,1596389594.0,"08/02/2020, 17:33:14",1,0,36,1.1156292329610622,0.97,0.027777777777777776
65,activism,Bernie's Dream: Strong Third Party Movement in the United States,1588470562.0,"05/03/2020, 01:49:22",6,0,33,1.1400592135182919,0.97,0.18181818181818182
66,activism,Tell Chase Bank To Stop Funding Fossil Fuels,1582148535.0,"02/19/2020, 21:42:15",0,0,31,3.167159882241755,0.91,0.0
67,activism,The school system is failing us,1575141295.0,"11/30/2019, 19:14:55",2,0,32,2.857473678101911,0.92,0.0625
68,activism,Earning a living,1601940893.0,"10/05/2020, 23:34:53",1,0,32,4.860852710187338,0.87,0.03125
69,activism,CORI BUSH WINS MISSOURI PRIMARY,1596609204.0,"08/05/2020, 06:33:24",2,0,34,1.969076226205594,0.95,0.058823529411764705
70,activism,hey. yeah? you ever wonder why people dont vote?,1594575160.0,"07/12/2020, 17:32:40",2,0,32,1.0765316949100452,0.97,0.0625
71,activism,"Black Lives Matter, everywhere!",1590751802.0,"05/29/2020, 11:30:02",10,0,31,4.078628680412514,0.88,0.3225806451612903
72,activism,"Joe Rogan (Podcast Site) ""It is time to overturn our governemnt...this is the moment for heads on pikes""",1586220636.0,"04/07/2020, 00:50:36",9,0,35,4.703326755447193,0.88,0.2571428571428571
73,activism,"Over 100,000 have been tortured or abused in custody, and thousands have died from torture in custody. In June 2019, a London-based independent tribunal concluded Falun Gong practitioners have been, and continue to be, killed for their organs “on a significant scale.”",1586000403.0,"04/04/2020, 11:40:03",0,0,31,2.603441698010748,0.92,0.0
74,activism,"Dr. Mona Hanna-Attisha, hero of the Flint Water Crisis, discusses the importance of whistle-blowers and activists, the connection between racist and anti-democratic policies and the crisis, and why Flint Water Crisis remains as relevant as ever",1599920159.0,"09/12/2020, 14:15:59",0,0,32,0.7876960229294596,0.98,0.0
75,activism,"ICE guards ‘systematically’ sexually assault detainees in an El Paso detention center, lawyers say",1598646314.0,"08/28/2020, 20:25:14",0,0,33,1.164160681465539,0.97,0.0
76,activism,marsha p johnson was the first one to say damn its brick outside,1594158785.0,"07/07/2020, 21:53:05",1,0,32,1.1024644893564925,0.97,0.03125
77,activism,Anyone wanna sign a petition to tear down this statue of Andrew Jackson in front of the White House? I’m from Tennessee and don’t want to see him honored any longer.,1592252258.0,"06/15/2020, 20:17:38",4,0,27,4.621847905608277,0.85,0.14814814814814814
78,activism,Outside Lindsey Graham's office,1579930342.0,"01/25/2020, 05:32:22",0,0,32,1.0490676918787472,0.97,0.0
79,activism,"In 1938, L.A. Kindergarten teacher Helen Hulick went to jail for wearing pants in a courtroom. She was a witness scheduled to testify against two men. When she arrived in slacks, her testimony was rescheduled; the Judge ordered her to go home and return in a dress. She refused, noting inequality.",1573986880.0,"11/17/2019, 10:34:40",4,0,33,1.0314824227877892,0.97,0.12121212121212122
80,activism,Help Support the USPS!,1597764951.0,"08/18/2020, 15:35:51",1,0,31,0.8264327447749871,0.97,0.03225806451612903
81,activism,Ecosia - the ecological alternative to Google,1593803651.0,"07/03/2020, 19:14:11",7,0,30,0.03455490260247274,1.0,0.23333333333333334
82,activism,"Canada is about to pass a bill that would make it illegal to report, photograph, or otherwise expose animal abuse on factory farms. We already know what these animals endure but this silences even the worst cases of torture and abuse. Can you please sign the petition?",1591905079.0,"06/11/2020, 19:51:19",1,0,32,2.176415624833595,0.94,0.03125
83,activism,A message from Nova Scotia,1591476911.0,"06/06/2020, 20:55:11",1,0,29,1.9119689695698767,0.94,0.034482758620689655
84,activism,Shit paper,1587484854.0,"04/21/2020, 16:00:54",1,0,30,2.4428078579664856,0.92,0.03333333333333333
85,activism,URGENT: Sign this petition to decarcerate prisons during the outbreak of COVID-19,1584629124.0,"03/19/2020, 14:45:24",1,0,30,3.7555006506090933,0.89,0.03333333333333333
86,activism,So did everyone just forget the Amazon rainforest is burning?,1574108729.0,"11/18/2019, 20:25:29",16,0,31,0.01732820016313852,1.0,0.5161290322580645
87,activism,ICE Hysterectomy Doctor Wasn’t Even a Board-Certified OB-GYN,1600981176.0,"09/24/2020, 20:59:36",0,0,30,0.854688442620251,0.97,0.0
88,activism,Don't forget to give credit to one who made this possible!,1595383297.0,"07/22/2020, 02:01:37",8,0,28,5.279506793158099,0.84,0.2857142857142857
89,activism,My daughter raising her fist in solidarity as we left the justice for Breonna Taylor rally.,1591445670.0,"06/06/2020, 12:14:30",0,0,30,7.361850324288319,0.8,0.0
90,activism,Tiger king f**ked me up,1587183614.0,"04/18/2020, 04:20:14",3,0,30,0.8663736814536378,0.97,0.1
91,activism,Walmart essential employees not provided essential needs,1585539286.0,"03/30/2020, 03:34:46",0,0,29,-0.07883884069434188,1.0,0.0
92,activism,preach,1579574021.0,"01/21/2020, 02:33:41",2,0,29,0.09156595827807479,1.0,0.06896551724137931
93,activism,My first Cease and Desist from the DoD Inspector General,1579196583.0,"01/16/2020, 17:43:03",7,0,30,2.043385180955447,0.94,0.23333333333333334
94,activism,KEEP FIGHTING,1592959481.0,"06/24/2020, 00:44:41",0,0,29,1.6894026554249244,0.94,0.0
95,activism,Warning friends getting hurt!,1591360898.0,"06/05/2020, 12:41:38",0,0,27,5.334368589843862,0.84,0.0
96,activism,Made this in Animal Crossing New Horizons,1591295419.0,"06/04/2020, 18:30:19",2,0,28,1.6356917169965364,0.94,0.07142857142857142
97,activism,3 Things White People Can Do Right Now to Fight Racism,1590791895.0,"05/29/2020, 22:38:15",1,0,28,2.3663149211246335,0.92,0.03571428571428571
98,activism,How Does A Broke Person Take Part In Various Movements,1583163294.0,"03/02/2020, 15:34:54",15,0,26,2.348323475075855,0.92,0.5769230769230769
99,activism,ooooh legitimate elections,1604068903.0,"10/30/2020, 14:41:43",1,0,28,1.7132236953687148,0.94,0.03571428571428571
100,activism,The Wall Of Peace,1600848791.0,"09/23/2020, 08:13:11",0,0,26,3.724383077903987,0.87,0.0
101,activism,We cannot tear immigrant children from families during COVID-19,1599420810.0,"09/06/2020, 19:33:30",0,0,27,0.7676315553089772,0.97,0.0
102,activism,"*sigh* where there's a will to suppress votes, there's a way",1594402367.0,"07/10/2020, 17:32:47",0,0,28,0.6674953107735888,0.98,0.0
103,activism,"""This is Rahul. Rahul saved 62 DC protestors who were trapped for hours on his block by police. He allowed them to stay all night, fed them, gave them water, charged their phones, and most importantly kept them safe. This was no party, the police through pepper spray canisters""",1591196782.0,"06/03/2020, 15:06:22",1,0,26,0.902595813887821,0.97,0.038461538461538464
104,activism,"Turning point: Trump threatens military rule, turns country toward fascism",1591130380.0,"06/02/2020, 20:39:40",2,0,26,2.458629816860931,0.91,0.07692307692307693
105,activism,Democrats’ Big Coronavirus Idea Is to Subsidize Health Insurers,1586974135.0,"04/15/2020, 18:08:55",2,0,26,2.944784933048741,0.9,0.07692307692307693
106,activism,I want to defeat EARN IT S.3398,1584721255.0,"03/20/2020, 16:20:55",1,0,27,0.06883633038495063,1.0,0.037037037037037035
107,activism,Save the Bees!,1582754099.0,"02/26/2020, 21:54:59",1,0,28,5.914843794088128,0.83,0.03571428571428571
108,activism,"Hello, u/fullbloodedwhitemale. This One's for You.",1579661360.0,"01/22/2020, 02:49:20",4,0,28,1.914282561266166,0.94,0.14285714285714285
109,activism,Tell the Senate: Keep Amy Coney Barrett off the Supreme Court. We must be active and protect Roe V Wade,1602277972.0,"10/09/2020, 21:12:52",2,0,26,1.13985119534928,0.96,0.07692307692307693
110,activism,"We Must Protect Expectant Mothers in Immigrant Detention Centers, Now More Than Ever",1588861233.0,"05/07/2020, 14:20:33",8,0,26,1.0413420839352199,0.96,0.3076923076923077
111,activism,COVID-19 Exposing the Frailty of Capitalism | 5 Key Takeaways,1588382884.0,"05/02/2020, 01:28:04",0,0,24,2.0093455600290646,0.92,0.0
112,activism,Noam Chomsky: Trump Blaming WHO for COVID-19 Deaths Is Dictator-Like Behavior,1587235110.0,"04/18/2020, 18:38:30",0,0,27,4.092379864728251,0.87,0.0
113,activism,The Biggest Barrier to Collective Action Is Hopelessness,1582555308.0,"02/24/2020, 14:41:48",1,0,26,1.6752638403620885,0.94,0.038461538461538464
114,activism,"The Australian Fires have released 2/3rds of our nation's yearly Co2 emissions, and our Prime Minister still refuses to do anything about Climate Change. This is my open letter to him.",1578219232.0,"01/05/2020, 10:13:52",0,0,27,-0.009887824743749718,1.0,0.0
115,activism,Lebanese Talent fighting tear gas!,1576415035.0,"12/15/2019, 13:03:55",0,0,26,1.0617468780564145,0.96,0.0
116,activism,"Opinion: Kentuckians, it's Time to Ditch Mitch - The New Voice",1576336786.0,"12/14/2019, 15:19:46",0,0,28,1.9362344362927573,0.94,0.0
117,activism,ICE And The History Of Forced Sterilization In America | 1A,1600719713.0,"09/21/2020, 20:21:53",1,0,25,-0.09317450704847374,1.0,0.04
118,activism,"Trump cabinet officials voted in 2018 White House meeting to separate migrant children, say officials",1597956375.0,"08/20/2020, 20:46:15",1,0,25,2.1646967604228777,0.92,0.04
119,activism,"The far right murders, Antifa doesn't",1596691113.0,"08/06/2020, 05:18:33",6,0,24,4.99742036597527,0.83,0.25
120,activism,It's time to federally legalize marijuana. Will you please sign and share this white house petition?,1596337272.0,"08/02/2020, 03:01:12",1,0,23,4.071534019888613,0.85,0.043478260869565216
121,activism,*pearl voice* I want my money!,1595093553.0,"07/18/2020, 17:32:33",0,0,23,2.823564624277765,0.89,0.0
122,activism,"I just sent the Director of the DoD hotline a copy of the book ""The Emperor's New Clothes."" My prayer is that it will motivate the Director to do his job.",1584573769.0,"03/18/2020, 23:22:49",5,0,26,1.9326644752363826,0.93,0.19230769230769232
123,activism,Best legal advice ever,1581020275.0,"02/06/2020, 20:17:55",3,0,24,0.826098782436862,0.97,0.125
124,activism,Wow what a comeback,1580380124.0,"01/30/2020, 10:28:44",0,0,23,1.5827621285411588,0.94,0.0
125,activism,"Learn about Arsames and the Islamic Revolutionary Court. Support, read, share.",1597705603.0,"08/17/2020, 23:06:43",0,0,23,0.7373896847790284,0.97,0.0
126,activism,bout to thanos snap the shit out of my state rep just watch,1594229559.0,"07/08/2020, 17:32:39",1,0,24,3.060841183557752,0.89,0.041666666666666664
127,activism,Finally!!!,1594045970.0,"07/06/2020, 14:32:50",0,0,24,-0.05831404900595061,1.0,0.0
128,activism,"Please support Mika Gadsden as she helps neutralize the threat of white supremacists who are trying to slander the companies owned women and people of color in Charleston, SC.",1589238836.0,"05/11/2020, 23:13:56",8,0,24,4.3488282626382,0.85,0.3333333333333333
129,activism,"Can we make Karen volunteers for workers rights or those in danger a thing? Help me get a hashtag out, #VolunteerKaren #KarenForYourSafety #IllBeYourKaren",1585448880.0,"03/29/2020, 02:28:00",1,0,23,3.818538785345602,0.86,0.043478260869565216
130,activism,How Black Americans Fought for Our Democracy,1581521583.0,"02/12/2020, 15:33:03",1,0,25,0.9075190051004896,0.96,0.04
131,activism,Football fans in Chile are uniting and fighting back against police violence after riot police killed a fan of the Colo-Colo football club last week.,1580735253.0,"02/03/2020, 13:07:33",6,0,24,1.2676515557174497,0.95,0.25
132,activism,I want to try and make piracy legal or copyright laws far more relaxed than they are worldwide. How can I get about trying to achieve this?,1573580712.0,"11/12/2019, 17:45:12",9,0,25,1.6206335915087031,0.94,0.36
133,activism,Breastfeeding Immigrant Moms Were Separated From Babies Under Trump Admin,1602534539.0,"10/12/2020, 20:28:59",1,0,23,1.692755549677564,0.93,0.043478260869565216
134,activism,Weed's cool. The racist criminal justice system in the U.S. is not.,1602191717.0,"10/08/2020, 21:15:17",0,0,22,1.7214661634316002,0.93,0.0
135,activism,Refugee support workers on Lesbos warn of ‘chaos’ on the island as riot police are sent in: Greek cops reportedly tear gas homeless kids as fascist groups attempt to disrupt NGO workers from helping the desperate migrants,1599847191.0,"09/11/2020, 17:59:51",3,0,23,1.6099231253704431,0.93,0.13043478260869565
136,activism,"Judge orders ICE to free migrant children from family detention during coronavirus pandemic, report says",1593233075.0,"06/27/2020, 04:44:35",1,0,23,1.6106460992159946,0.93,0.043478260869565216
137,activism,Workers Forming Unions Explodes,1588959530.0,"05/08/2020, 17:38:50",0,0,21,1.4570952571634201,0.94,0.0
138,activism,"Coronavirus may be spreading Unseen in Yemen, Syria and Libya.",1586714763.0,"04/12/2020, 18:06:03",0,0,24,0.9203412580074293,0.96,0.0
139,activism,"During COVID pandemics, Moscow protests from homes against the construction of a highway over 60,000 tonnes of radioactive waste",1584876139.0,"03/22/2020, 11:22:19",1,0,24,2.3081423416922497,0.91,0.041666666666666664
140,activism,How to effectively launch into environmental activism,1581171352.0,"02/08/2020, 14:15:52",2,0,22,1.7550519500490402,0.93,0.09090909090909091
141,activism,Clever use of an old song on protest sign,1579841948.0,"01/24/2020, 04:59:08",0,0,23,2.535501783862262,0.9,0.0
142,activism,.. so many people in chains,1577325276.0,"12/26/2019, 01:54:36",0,0,25,2.153860712167436,0.92,0.0
143,activism,"Calling Him Only 2020 Candidate Whose Plan 'Can Save Our Planet,' US Youth Climate Strike Leaders Endorse Bernie Sanders for President",1575836490.0,"12/08/2019, 20:21:30",0,0,22,4.617163370214691,0.83,0.0
144,activism,Protests across the US this week! It is right to rebel! We will not be silent!,1603749739.0,"10/26/2020, 22:02:19",2,0,22,0.021411250465195764,1.0,0.09090909090909091
145,activism,"Tapes reveal Melania Trump appearing to downplay child separation policy, bemoaning Christmas decorations",1601672677.0,"10/02/2020, 21:04:37",2,0,22,0.881931599724286,0.96,0.09090909090909091
146,activism,Child Trafficking &amp; the Shame of a President,1598283305.0,"08/24/2020, 15:35:05",2,0,22,0.9416404407010965,0.96,0.09090909090909091
147,activism,"Mask mandates would save tens of thousands of lives. Just as COVID has indicted American culture, it has indicted American activist/peace and justice activism culture.",1596753669.0,"08/06/2020, 22:41:09",5,0,23,1.6673858656002487,0.93,0.21739130434782608
148,activism,Rename the Von Braun Center. Wernher von Braun was a member of the Nazi Party and an SS officer.,1596556181.0,"08/04/2020, 15:49:41",3,0,23,2.5691638799106293,0.9,0.13043478260869565
149,activism,hey i just came across a podcast that a 12 year old made about activism and standing up for others it melted my heard and gave me hope in this world if you want to hear it hear is the link,1596297496.0,"08/01/2020, 15:58:16",0,0,20,2.8631152658792445,0.87,0.0
