,Subreddit,Title,Epoch Time,Date,Comments,Awards,Upvotes,Downvotes,Upvote Ratio,Comment/Upvote Ratio
0,feminism,Breonna Taylor was shot and killed in her SLEEP months ago and the officers are still on the job! George Floyd’s murderer was arrested and charged within days. Are black women going to get justice too? We have to focus our attention and efforts on this now. Where are the feminists at on this case?!,1591199560.0,"06/03/2020, 15:52:40",105,0,3960,219.2405019151065,0.95,0.026515151515151516
1,feminism,Kat Dennings on the recent controversy over Chris Evans' leaked photos,1600253145.0,"09/16/2020, 10:45:45",62,2,3750,218.50706426184388,0.94,0.016533333333333334
2,feminism,This is one way you can be an ally 👏,1575204950.0,"12/01/2019, 12:55:50",116,0,3703,153.40735666821502,0.96,0.03132595193086687
3,feminism,Happy 87th Birthday to the legendary RBG,1584296280.0,"03/15/2020, 18:18:00",64,0,3603,262.8793010667573,0.93,0.017762975298362477
4,feminism,They were asking for it,1594312808.0,"07/09/2020, 16:40:08",69,1,3322,205.41990357970053,0.94,0.020770620108368453
5,feminism,I Believe You,1585586300.0,"03/30/2020, 16:38:20",88,0,3248,145.8353387048801,0.96,0.027093596059113302
6,feminism,💖,1602375189.0,"10/11/2020, 00:13:09",92,4,3242,49.405642849966625,0.98,0.0283775447254781
7,feminism,"As your kids start school again, tell them about Ruby Bridges 👏",1575878365.0,"12/09/2019, 07:59:25",56,0,3183,53.89475525323587,0.98,0.017593465284322967
8,feminism,A privileged female rape cheerleader,1581178112.0,"02/08/2020, 16:08:32",95,0,3151,140.4222557714579,0.96,0.030149158997143762
9,feminism,"The link between guns, police and violence against women in America",1579703637.0,"01/22/2020, 14:33:57",154,0,3140,237.25934114050642,0.93,0.04904458598726115
10,feminism,The enemy of feminism isn't men,1582613230.0,"02/25/2020, 06:47:10",138,0,3127,89.29939116987998,0.97,0.044131755676367124
11,feminism,Two Brazilian women scientists sequenced the genome of the coronavirus in record time -- just 2 days after the 1st case appeared in Brazil. They used experience &amp; technology from their studies of the Zika virus to make it happen.,1585162710.0,"03/25/2020, 18:58:30",44,0,3115,146.3333897497546,0.96,0.014125200642054575
12,feminism,This belongs here.,1591805982.0,"06/10/2020, 16:19:42",76,0,3059,233.60381883335367,0.93,0.024844720496894408
13,feminism,The accuracy hurts,1573884465.0,"11/16/2019, 06:07:45",350,0,2935,527.8076191966038,0.85,0.11925042589437819
14,feminism,A common misconception...,1588200425.0,"04/29/2020, 22:47:05",145,0,2884,103.95757126302988,0.97,0.05027739251040222
15,feminism,When random online males suffer from correctile dysfunction ...,1579007048.0,"01/14/2020, 13:04:08",140,0,2835,205.07150229826357,0.93,0.04938271604938271
16,feminism,Just a reminder,1579487730.0,"01/20/2020, 02:35:30",95,0,2796,114.86656055794765,0.96,0.033977110157367665
17,feminism,"it’s in a book, just take a look, drake’s a creeper",1575488164.0,"12/04/2019, 19:36:04",76,0,2781,100.86392442490205,0.97,0.027328299172959366
18,feminism,"I believe in having the right to choose for yourself, plain and simple ❤️",1603456367.0,"10/23/2020, 12:32:47",77,6,2781,64.52146119323152,0.98,0.027687882056814096
19,feminism,Transmisogyny,1580311164.0,"01/29/2020, 15:19:24",94,0,2726,214.51986114009605,0.93,0.034482758620689655
20,feminism,Physical respect is a right.,1601625124.0,"10/02/2020, 07:52:04",25,6,2705,51.47245172370822,0.98,0.009242144177449169
21,feminism,Some words from Maisie Williams,1601877434.0,"10/05/2020, 05:57:14",89,0,2647,144.27088539912347,0.95,0.03362296939931998
22,feminism,Husband Stitch -- a form of genital mutilation perpetuated (by males) against women.,1578747342.0,"01/11/2020, 12:55:42",280,0,2632,97.3064526896128,0.96,0.10638297872340426
23,feminism,"This shouldn’t just be limited to reporting about Jerry Epstein, but should apply to all reporting on this topic.",1596277617.0,"08/01/2020, 10:26:57",56,0,2598,36.67726206599855,0.99,0.02155504234026174
24,feminism,a sign at a Pakistani women's rights protest,1600884726.0,"09/23/2020, 18:12:06",25,6,2608,42.4123293403577,0.98,0.009585889570552147
25,feminism,Women NEVER liked the harassment.,1581765791.0,"02/15/2020, 11:23:11",21,0,2584,77.18086233388613,0.97,0.008126934984520124
26,feminism,An important reminder,1573479199.0,"11/11/2019, 13:33:19",52,0,2555,93.65189090882677,0.96,0.020352250489236792
27,feminism,I wonder why....,1597515611.0,"08/15/2020, 18:20:11",49,0,2457,105.95758153654015,0.96,0.019943019943019943
28,feminism,This is allyship ❤️,1600178665.0,"09/15/2020, 14:04:25",30,3,2457,45.2786189411263,0.98,0.01221001221001221
29,feminism,Truth,1601289555.0,"09/28/2020, 10:39:15",75,2,2436,120.919575083783,0.95,0.03078817733990148
30,feminism,Fuck the patriarchy,1600657089.0,"09/21/2020, 02:58:09",39,2,2420,75.20691282023245,0.97,0.016115702479338842
31,feminism,🤯,1599674012.0,"09/09/2020, 17:53:32",51,4,2412,74.33863531786346,0.97,0.021144278606965175
32,feminism,The Finnish Government giving an update on Coronavirus measures.,1584372558.0,"03/16/2020, 15:29:18",178,0,2400,192.5352528014264,0.93,0.07416666666666667
33,feminism,"Yemeni artist Boushra Almutawakel, 'What if', 2008",1596989567.0,"08/09/2020, 16:12:47",100,0,2384,73.21363971515984,0.97,0.04194630872483222
34,feminism,This has been an issue for too long.,1601565222.0,"10/01/2020, 15:13:42",72,2,2378,62.22472944260562,0.97,0.030277544154751892
35,feminism,"Repost, sorry if it's been here before!",1595903261.0,"07/28/2020, 02:27:41",34,0,2351,54.109455963905475,0.98,0.01446193109315185
36,feminism,On blood,1584946250.0,"03/23/2020, 06:50:50",65,0,2351,127.83016485130247,0.95,0.027647809442790303
37,feminism,"For The First Time In History, Girls Won All Five Top Prizes at the Broadcom Masters STEM Competition",1573029610.0,"11/06/2019, 08:40:10",147,0,2348,181.92537254065337,0.93,0.06260647359454855
38,feminism,In a nutshell.....,1573614362.0,"11/13/2019, 03:06:02",71,0,2342,159.39775539011907,0.94,0.03031596925704526
39,feminism,"A fantastic skilled team of 3 women scientists -- Annalisa Bergna, Arianna Gabrieli and Alessia Lai -- have isolated the Italian strain of Coronavirus and none of them even have tenure.",1584891193.0,"03/22/2020, 15:33:13",18,0,2306,124.76117573428292,0.95,0.007805724197745013
40,feminism,That,1574132716.0,"11/19/2019, 03:05:16",99,0,2302,105.47122076333562,0.96,0.04300608166811468
41,feminism,A woman who is not on the side of women... how fucked up.,1603327779.0,"10/22/2020, 00:49:39",76,2,2314,65.84159858354815,0.97,0.032843560933448576
42,feminism,"All the talk of ""disrespect"" and ""reputation"" is nothing but a smokescreen. They simply do not want women talking about rape. They want to continue the culture of silence.",1580225487.0,"01/28/2020, 15:31:27",104,1,2290,157.3376084616566,0.94,0.045414847161572056
43,feminism,One story out of too many like it.,1591507731.0,"06/07/2020, 05:28:51",32,0,2290,33.19991799332183,0.99,0.013973799126637555
44,feminism,Double standards,1579625746.0,"01/21/2020, 16:55:46",148,0,2260,176.72221411811324,0.93,0.06548672566371681
45,feminism,When someone asks me If I'm a feminist I'm showing them this,1599802293.0,"09/11/2020, 05:31:33",43,14,2261,80.29610690457002,0.97,0.01901813356921716
46,feminism,"It's not us, it's you.",1580482852.0,"01/31/2020, 15:00:52",40,0,2258,131.3188094169118,0.95,0.01771479185119575
47,feminism,"Scientific Sexism: First accurate description of clitoris is just 22 years old. Around 90% of the clitoris’s bulk lies beneath the surface. Beneath the surface, it was 10 times the size most people thought it was &amp; boasted 2 to 3 times as many nerve endings as the penis.",1591026453.0,"06/01/2020, 15:47:33",61,0,2249,92.2244130695608,0.96,0.02712316585148955
48,feminism,"1 in 3 women worldwide have been victims of violence. 38% of all murdered women, are murdered by their partners. 700 million women alive today got married under the age of 18. (London School of Hygiene &amp; Tropical Medicine, 2013)",1589962908.0,"05/20/2020, 08:21:48",115,2,2249,149.03923011962434,0.94,0.05113383726100489
49,feminism,"When Anna said she was raped by two on-duty cops, she thought it would be a simple case. She had no idea she lived in one of 35 states where officers can claim a detainee consented.",1591095822.0,"06/02/2020, 11:03:42",55,0,2244,36.06258803753781,0.98,0.024509803921568627
50,feminism,It's unnerving tbh.,1602451342.0,"10/11/2020, 21:22:22",188,3,2244,122.20191369641725,0.95,0.08377896613190731
51,feminism,Sometimes it just isn't worth the effort,1595170629.0,"07/19/2020, 14:57:09",65,1,2235,161.70578186382772,0.93,0.029082774049217
52,feminism,Truth,1601737453.0,"10/03/2020, 15:04:13",62,2,2239,121.68076508696231,0.95,0.027690933452434122
53,feminism,"""...the six videos of my rape stayed up on PornHub for over 6 months, while I begged them daily to remove them? &amp; that more &amp; more ads kept popping up, meaning they were increasingly monetized as the view count rose, ending up with combined totals in the millions...""",1589569775.0,"05/15/2020, 19:09:35",141,1,2218,101.38780161194063,0.96,0.06357078449053201
54,feminism,This is how deeply ingrained misogyny is in society,1597816851.0,"08/19/2020, 06:00:51",64,0,2170,84.82805725079561,0.96,0.029493087557603687
55,feminism,"REDO: Amen! (Sorry I cross-posted from a gross sub, please see comments)",1575969248.0,"12/10/2019, 09:14:08",91,0,2175,162.69928188410404,0.93,0.04183908045977011
56,feminism,Just saw this on another subreddit and it made me so happy,1602187430.0,"10/08/2020, 20:03:50",67,3,2176,59.255352111271804,0.97,0.03079044117647059
57,feminism,"Just dropping by this sub really quick to remind you all that Virginia Roberts Giuffre is taking the elites head on, as well as many other survivors of human sex trafficking. JUSTICE FOR ALL VICTIMS! Such a strong woman!",1596563243.0,"08/04/2020, 17:47:23",29,0,2137,40.86067148774919,0.98,0.01357042583060365
58,feminism,Sorry this is to long. Originally posted on r/wholesomememes,1584126269.0,"03/13/2020, 19:04:29",99,2,2131,107.40630962286787,0.95,0.04645706241201314
59,feminism,"""Menstruation is the only blood that is not born from violence, yet it's the one that disgusts you the most.""",1603664087.0,"10/25/2020, 22:14:47",68,3,2132,80.03111955438544,0.96,0.03189493433395872
60,feminism,Rightly said 👏👏👏,1595524313.0,"07/23/2020, 17:11:53",30,0,2121,49.41362699518095,0.98,0.014144271570014143
61,feminism,I saw this and thought it belonged here,1588829501.0,"05/07/2020, 05:31:41",115,0,2109,57.82608813424986,0.97,0.054528212422949265
62,feminism,I’ve never heard this explained so succinctly (credit fuck_patriarchy on Instagram),1604329620.0,"11/02/2020, 15:07:00",45,0,2218,61.67401998099285,0.97,0.02028854824165915
63,feminism,"Kendra Harrison the moment she realized she just ran 12.20 seconds in the 100 meter hurdles, destroying a 28 year old world record",1598891571.0,"08/31/2020, 16:32:51",23,0,2062,36.11179390847883,0.98,0.011154219204655674
64,feminism,"Could it be that it's the official name of the crime in the US (just like Australia)? If yes, then Journalists should not be paraphrasing misogynistic+outdated legal terminology to suit our sensibilities, but Politicians should be transforming &amp; updating the law.",1596309799.0,"08/01/2020, 19:23:19",22,0,2064,26.8049458326268,0.99,0.01065891472868217
65,feminism,A Mighty Girl message,1576309774.0,"12/14/2019, 07:49:34",98,0,2055,101.2662933904794,0.95,0.047688564476885645
66,feminism,Truth,1603799586.0,"10/27/2020, 11:53:06",179,0,2016,110.2333735754546,0.95,0.08878968253968254
67,feminism,This whole thread is gold,1576606564.0,"12/17/2019, 18:16:04",35,0,2003,64.3918527101091,0.97,0.017473789316025962
68,feminism,"Female students protesting “No pants to school” rule in Brooklyn, 1945",1601101213.0,"09/26/2020, 06:20:13",57,1,1989,20.45471043063435,0.99,0.02865761689291101
69,feminism,Praising men for basic human decency empowers benevolent sexism.,1578404029.0,"01/07/2020, 13:33:49",140,0,1990,184.74394631188352,0.92,0.07035175879396985
70,feminism,"Well, I mean, when you put it like that, it's like sex education in the US is rather lacking...",1592412556.0,"06/17/2020, 16:49:16",41,0,1977,79.82234912524427,0.96,0.020738492665655032
71,feminism,"Meet Dr Gladys West, one of the inventors of GPS tchnology! 🔥❤",1577047589.0,"12/22/2019, 20:46:29",60,0,1968,138.79558678812828,0.93,0.03048780487804878
72,feminism,No one is ever “asking” for it.,1578275373.0,"01/06/2020, 01:49:33",97,0,1962,113.79369885687083,0.95,0.04943934760448522
73,feminism,"no way, no how",1602599853.0,"10/13/2020, 14:37:33",42,0,1962,65.88206820561163,0.97,0.021406727828746176
74,feminism,Centuries!,1579580869.0,"01/21/2020, 04:27:49",108,0,1965,115.7197074579426,0.94,0.0549618320610687
75,feminism,Feminism is Intersectional - An Annotated Unpacking of the Invisible Knapsack,1590771121.0,"05/29/2020, 16:52:01",35,0,1940,92.12754737639398,0.95,0.01804123711340206
76,feminism,Protests against Abortion ban - Warsaw,1604226803.0,"11/01/2020, 10:33:23",27,3,1950,15.742045671521282,0.99,0.013846153846153847
77,feminism,This speaks for all us ladies,1581575643.0,"02/13/2020, 06:34:03",127,4,1917,229.0555082220303,0.89,0.06624934793948878
78,feminism,Practice makes perfect,1574292719.0,"11/20/2019, 23:31:59",136,0,1907,187.00943042360632,0.91,0.0713162034609334
79,feminism,Friendly reminder,1575324331.0,"12/02/2019, 22:05:31",82,0,1893,47.95241229238718,0.98,0.04331748547279451
80,feminism,Sometimes I wanna yell at so many people around me...,1601793791.0,"10/04/2020, 06:43:11",46,1,1893,73.26219034520432,0.96,0.024300052826201797
81,feminism,💜🤍💚,1590600177.0,"05/27/2020, 17:22:57",58,0,1881,56.748739888085765,0.97,0.03083466241360978
82,feminism,"On International Women’s day, Ethiopian Airlines had a 100% female controlled flight; women pilots, air traffic control, stewardesses, etc. This is a big step for Ethiopian culture in the right direction.",1583779340.0,"03/09/2020, 18:42:20",54,0,1849,40.922821967354366,0.98,0.029204975662520283
83,feminism,On Feminism and Marriage,1577978221.0,"01/02/2020, 15:17:01",53,0,1816,96.55116381512448,0.95,0.02918502202643172
84,feminism,Period cramps can hurt way more than a heart attack,1594820175.0,"07/15/2020, 13:36:15",103,0,1816,97.15663060990255,0.95,0.05671806167400881
85,feminism,"In Japan, regardless of job, most women have to wear heels. However, their male counterparts can choose what they wear. More than 18,000 women signed the petition and all of this was happening less than 10 months ago.",1584744649.0,"03/20/2020, 22:50:49",42,0,1805,13.821419654538659,0.99,0.02326869806094183
86,feminism,College track star warned police about her ex-boyfriend 6 times in the 10 days before he killed her,1591436334.0,"06/06/2020, 09:38:54",32,0,1799,26.361190896784137,0.99,0.017787659811006114
87,feminism,We will never submit.,1598244307.0,"08/24/2020, 04:45:07",17,2,1799,63.21185352142902,0.97,0.009449694274596998
88,feminism,Women don’t have to want kids!,1588084898.0,"04/28/2020, 14:41:38",110,0,1770,106.36049667037537,0.94,0.062146892655367235
89,feminism,"Please consider signing this petition to reopen LaVena Johnson’s case. She was found shot to death inside a burning tent with a broken nose, black eyes, broken teeth and acid burns on her genitals in July 2005, on Balad Military Base in Iraq. It was ruled suicide. She was 19 years old. - change.org",1592859415.0,"06/22/2020, 20:56:55",36,0,1774,26.02972082415272,0.99,0.020293122886133032
90,feminism,Feminism is Sexy,1586778705.0,"04/13/2020, 11:51:45",52,0,1770,100.53807382820173,0.95,0.02937853107344633
91,feminism,Intersex women are women,1598021030.0,"08/21/2020, 14:43:50",88,0,1758,155.4487952882755,0.92,0.05005688282138794
92,feminism,Abortion is love for my future,1582920462.0,"02/28/2020, 20:07:42",95,0,1765,206.0303157630624,0.9,0.053824362606232294
93,feminism,Three women protest in Germany that three women are being killed by a man every day in Turkey,1597951300.0,"08/20/2020, 19:21:40",47,0,1751,72.33471737283776,0.96,0.026841804683038265
94,feminism,I found this in the girls toilets at the university I go to in Edinburgh,1580601289.0,"02/01/2020, 23:54:49",55,0,1753,19.97330576932086,0.99,0.03137478608100399
95,feminism,"This story is always presented as ""the youngest mother"" but in reality, this is a case of 5 year old rape victim who had to undergo pregnancy &amp; child birth. Her rapist was never identified. The is a case of rape, abuse, torture and degradation.",1600326028.0,"09/17/2020, 07:00:28",119,2,1735,32.72985763543011,0.98,0.0685878962536023
96,feminism,Intersex women are women,1583694477.0,"03/08/2020, 19:07:57",39,0,1727,95.68908674275622,0.95,0.0225825130283729
97,feminism,"[Trigger Warning] An estimated 7,000 Yazidi women and girls, some as young as nine, were enslaved and held in sexual slavery in Iraq and Syria. 3000 are still missing. The credit of the painting goes to the Yazidi painter Narin Ismail.",1591572990.0,"06/07/2020, 23:36:30",57,0,1718,37.21494991991858,0.98,0.03317811408614668
98,feminism,Bathroom laws don't change anything.,1577995221.0,"01/02/2020, 20:00:21",46,0,1717,71.29022618578142,0.96,0.026790914385556204
99,feminism,Salami pp,1573306814.0,"11/09/2019, 13:40:14",59,0,1717,95.28901795127263,0.95,0.0343622597553873
100,feminism,That,1578587277.0,"01/09/2020, 16:27:57",78,0,1713,171.21807621566495,0.91,0.04553415061295972
101,feminism,Powerful/famous men who are popular will never be held accountable for their actions because their fans can’t handle them being anything short of a God.,1580371377.0,"01/30/2020, 08:02:57",111,0,1714,112.74404150611531,0.94,0.0647607934655776
102,feminism,JUST TO BE CLEAR,1602174381.0,"10/08/2020, 16:26:21",17,1,1705,36.52804923236795,0.98,0.00997067448680352
103,feminism,Women created their own language,1591972008.0,"06/12/2020, 14:26:48",47,0,1703,42.74833554103702,0.98,0.02759835584263065
104,feminism,Solidarity with the Polish Women’s Strike,1603951376.0,"10/29/2020, 06:02:56",10,1,1711,59.992768604896355,0.97,0.0058445353594389245
105,feminism,A feminist guide to life.,1595602526.0,"07/24/2020, 14:55:26",47,0,1702,31.97876078133072,0.98,0.027614571092831962
106,feminism,This needed to be shared,1581690600.0,"02/14/2020, 14:30:00",217,0,1677,161.19526691911324,0.91,0.12939773404889685
107,feminism,"""If I don't get pants, nobody gets pants"" 😁",1577441907.0,"12/27/2019, 10:18:27",138,0,1674,84.46214880309299,0.95,0.08243727598566308
108,feminism,"Feminism: meanwhile capitalists trying to sell light weight boot, cam that be called burgeois scam",1601469175.0,"09/30/2020, 12:32:55",60,5,1673,125.80917767900178,0.93,0.03586371787208607
109,feminism,A handy dress guide for women over 30,1581871641.0,"02/16/2020, 16:47:21",48,0,1655,54.826901822317495,0.97,0.029003021148036254
110,feminism,"""Flossie Wong-Staal, a molecular virologist most famous for co-discovering and first cloning the human immunodeficiency virus (HIV) that causes AIDS, died July 8 of complications from pneumonia in La Jolla, California, at age 73.""",1595327831.0,"07/21/2020, 10:37:11",17,0,1663,8.496930785375298,0.99,0.010222489476849068
111,feminism,Intersectional feminism,1596016440.0,"07/29/2020, 09:54:00",60,0,1653,111.40733426722272,0.94,0.036297640653357534
112,feminism,Hello everyone :) i made a drawing today and thought it really suits this subreddit... Have a wonderful day!,1591640562.0,"06/08/2020, 18:22:42",85,0,1646,133.99351322501616,0.92,0.05164034021871203
113,feminism,"Women &amp; girls are culturally groomed to accept rape, violence &amp; sexual degradation as sex, romance and love via porn, romance &amp; erotic literature, movies, video games etc. In 58% of countries, men can rape their wives with impunity. Majority of Indian women &amp; 25 % of Britons support marital rape.",1590094452.0,"05/21/2020, 20:54:12",136,0,1635,115.44181889781112,0.93,0.08318042813455657
114,feminism,"A migrant woman worker in Bihar (India) was repeatedly raped by the doctor of the isolation ward where she was being kept &amp; tested for the Covid 19 virus. She tested negative, but later died of excessive bleeding due to the sexual assault. The victim was 25 year old.",1589110583.0,"05/10/2020, 11:36:23",62,0,1626,48.85064204058608,0.97,0.038130381303813035
115,feminism,Thoughts? Because this gave me chills,1600990318.0,"09/24/2020, 23:31:58",84,0,1619,83.53464695517778,0.95,0.05188387893761581
116,feminism,Just dropping this here,1594132257.0,"07/07/2020, 14:30:57",30,0,1613,113.40692901459306,0.93,0.018598884066955982
117,feminism,A small bit of our history and our progress,1593697891.0,"07/02/2020, 13:51:31",28,0,1611,11.176035142683077,0.99,0.01738050900062073
118,feminism,I laughed out loud at this. And then I felt bad.,1581347166.0,"02/10/2020, 15:06:06",18,0,1594,78.618433169828,0.95,0.011292346298619825
119,feminism,"The girl is 13. Her rapist ""lover"" 35. Her father kills the child to preserve his ""honour"". Rapist &amp; Murderer father won’t suffer any consequence. Meanwhile Islamic Republic state media is busy photoshopping her head covering -- they simply replace it with far more modest version.",1590693182.0,"05/28/2020, 19:13:02",71,0,1580,16.28530269747057,0.99,0.04493670886075949
120,feminism,"If people are to follow the advice of rape trade apologists -- ""listen to sex workers "", fewer people would publicly bat for the industry. So, I don't know why on Earth these apologists keep delivering this particular advice. (Part 2)",1595244083.0,"07/20/2020, 11:21:23",141,0,1583,116.41039481177631,0.93,0.0890713834491472
121,feminism,99% of Women Do Not Regret Their Abortion,1579102619.0,"01/15/2020, 15:36:59",76,0,1581,78.0923756893983,0.95,0.0480708412397217
122,feminism,Queens do what queens gotta do 👑✨,1586537767.0,"04/10/2020, 16:56:07",290,1,1568,253.88381554857847,0.86,0.18494897959183673
123,feminism,Proceed!,1580762699.0,"02/03/2020, 20:44:59",25,0,1566,56.332805258812414,0.97,0.015964240102171137
124,feminism,I just realized Americans have to choose between 2 alleged rapists/sexual assaulters for President on the 100th anniversary of women being allowed to vote,1592103627.0,"06/14/2020, 03:00:27",114,0,1568,87.97934327319149,0.95,0.07270408163265306
125,feminism,Always follow your dreams,1599081169.0,"09/02/2020, 21:12:49",19,3,1559,39.70710364905199,0.98,0.012187299550994226
126,feminism,Think of the most vulnerable person you know and vote for them 👇,1578703629.0,"01/11/2020, 00:47:09",41,0,1535,70.57441899270725,0.96,0.026710097719869708
127,feminism,This ia so important and should be common knowledge!!,1599142757.0,"09/03/2020, 14:19:17",122,5,1531,94.34325122439282,0.94,0.07968647942521227
128,feminism,Everyday sexism: The Wayfair Edition,1597754142.0,"08/18/2020, 12:35:42",57,0,1524,71.77987314052166,0.96,0.03740157480314961
129,feminism,"She identified what became known as the first human coronavirus, but her paper to a peer-reviewed journal was rejected ""because the referees said the images she produced were just bad pictures of influenza virus particles"". She also helped take novel pictures of the HIV virus in the late 1980s.",1587226899.0,"04/18/2020, 16:21:39",10,0,1528,32.18053291723777,0.98,0.006544502617801047
130,feminism,"One of the most recognized and famous kiss ever known, was sexual assault.",1595201453.0,"07/19/2020, 23:30:53",55,0,1520,66.43691326845283,0.96,0.03618421052631579
131,feminism,That. Example: Women who cry are considered irrational by heteropatriarchal standards but men who demonstrate an extremely unnecessary burst of anger are not.,1591879702.0,"06/11/2020, 12:48:22",52,0,1513,75.0014569417524,0.95,0.034368803701255786
132,feminism,Bedtime blessings,1586247606.0,"04/07/2020, 08:20:06",44,0,1510,172.50281697120704,0.9,0.02913907284768212
133,feminism,Makes you think,1574082316.0,"11/18/2019, 13:05:16",177,0,1504,312.4382209584262,0.83,0.11768617021276596
134,feminism,"Fixed it - Prince Andrew Raped a Child, Recently Released Court Documents Claim",1596241600.0,"08/01/2020, 00:26:40",75,1,1502,30.13710226827243,0.98,0.049933422103861515
135,feminism,My body ✊,1586104100.0,"04/05/2020, 16:28:20",25,0,1505,70.17256062602473,0.96,0.016611295681063124
136,feminism,Female bots are more likely to be harassed than male bots.,1584210789.0,"03/14/2020, 18:33:09",52,0,1492,83.00201919598089,0.95,0.03485254691689008
137,feminism,"Joe Biden said that Roe v. Wade went ""too far""",1583435558.0,"03/05/2020, 19:12:38",49,0,1488,114.66383201305098,0.93,0.03293010752688172
138,feminism,"Remembering pregnant teen Claudette Colvin today, who refused to get up off the bus 9 months before Rosa Parks did the same. On this day, March 2. Civil rights leaders avoided taking up her case due to her pregnancy from statutory rape, dark skin and working class background, fearing public opinion.",1583233664.0,"03/03/2020, 11:07:44",15,0,1482,40.03367099675347,0.97,0.010121457489878543
139,feminism,Things like that end up as amateur porn.,1593291761.0,"06/27/2020, 21:02:41",116,0,1469,61.555333287775056,0.96,0.07896528250510551
140,feminism,This will always give me goosebumps,1595952892.0,"07/28/2020, 16:14:52",44,0,1465,70.85296408418048,0.95,0.030034129692832763
141,feminism,Tampon users should stop shaming pad users,1583955769.0,"03/11/2020, 19:42:49",111,0,1469,34.3244683244925,0.98,0.07556160653505786
142,feminism,Drew this responding to making excuse for sexual predators. It’s not the fault of clothing choices.,1603564015.0,"10/24/2020, 18:26:55",47,0,1465,57.08748374767879,0.96,0.032081911262798635
143,feminism,Rape Culture,1600432425.0,"09/18/2020, 12:33:45",61,5,1463,83.70712054579758,0.95,0.041695146958304855
