,Subreddit,Title,Epoch Time,Date,Comments,Awards,Upvotes,Downvotes,Upvote Ratio,Comment/Upvote Ratio
267,feminism,"Norman, OK Police have acknowledged that an officer doxxed the city council member. But they say her address is ""public information"" &amp; are refusing to even discipline the officer, much less fire him. They also claim that the rape victim suffered ""minor injuries"".",1593974030.0,"07/05/2020, 18:33:50",29,0,999,17.219643560068448,0.98,0.02902902902902903
268,feminism,At least 66% of transgender women experience sexual assault in their life time. Do not let our fellows sisters be forgotten.,1599758376.0,"09/10/2020, 17:19:36",37,0,998,81.66745695433224,0.92,0.03707414829659319
269,feminism,Abortion Right = Human Right,1583046892.0,"03/01/2020, 07:14:52",112,0,1000,86.76171298649479,0.92,0.112
270,feminism,"Approximately 3.8 million girls suffer ""breast ironing” which is practiced in Chad, Guinea Bissau, Togo, &amp; Benin. It's most common in Cameroon, where nearly a quarter of girls &amp; women have had their breasts “ironed.” There are as many as 1,000 girl victims in the UK.",1573926342.0,"11/16/2019, 17:45:42",42,0,994,9.82573918251046,0.99,0.04225352112676056
271,feminism,Hardly working or working hard?,1588178829.0,"04/29/2020, 16:47:09",27,0,983,48.151447087035876,0.95,0.027466937945066123
272,feminism,"Chris Pratt's Costars Are Defending Him After He Was Called The Worst Hollywood Chris And People Have Many Thoughts - “Where was this energy when Brie Larson was massively harassed for months just for advocating for diversity in the industry?""",1603291005.0,"10/21/2020, 14:36:45",86,1,988,63.0843639792613,0.94,0.08704453441295547
273,feminism,"Three black women -- Patrisse Cullors, Opal Tometi &amp; Alicia Garza founded the #BlackLivesMatter organization. Yet black female victims of police brutality often remain in the shadows of the better-known male victim &amp; don't even attract global outrage. Chrystul Kizer has been imprisoned for 2 years.",1598949175.0,"09/01/2020, 08:32:55",32,0,983,42.61137792187196,0.96,0.03255340793489318
274,feminism,Mind. Your. Fucking. Business.,1603244547.0,"10/21/2020, 01:42:27",60,0,984,40.295989009036475,0.96,0.06097560975609756
275,feminism,"To end transmisogyny, we must destroy this phallocentric notion of gender (completely) and sex (partially).",1577196850.0,"12/24/2019, 14:14:10",99,0,973,127.14035256166017,0.88,0.10174717368961973
276,feminism,Instagram is banning all content promoting LGBT conversion therapy,1594391885.0,"07/10/2020, 14:38:05",7,0,976,22.4428537664204,0.98,0.007172131147540984
277,feminism,Many more like this that aren’t as obvious,1597284035.0,"08/13/2020, 02:00:35",11,0,975,22.331324971875347,0.98,0.011282051282051283
278,feminism,Takes off Muslim dress to dress differently. Gets pelted with mean comments (xpost r/exmuslim),1575787724.0,"12/08/2019, 06:48:44",87,0,974,37.85930903537519,0.96,0.08932238193018481
279,feminism,The rape case against Ronaldo is still very Much Open in Federal court as the victim has elected to pursue the litigation in federal court. There are also plenty of evidences that make the case crystal clear.,1594950336.0,"07/17/2020, 01:45:36",43,0,971,77.22106837336423,0.93,0.044284243048403706
280,feminism,"Vaginismus, Vulvadonya, Endometriosis and candidiasis",1584041230.0,"03/12/2020, 19:27:10",29,0,961,29.02503787392493,0.97,0.030176899063475548
281,feminism,"Globally, Women’s subordination (Unpaid Labor) is Worth $10,900,000,000,000. ""India has the largest gap: Women there spend almost six hours a day managing the home; Indian men spend a paltry 52 minutes. The smallest divides are found in Sweden, Denmark and Norway."" Link in the comment section.",1588977248.0,"05/08/2020, 22:34:08",92,0,964,71.87871691895316,0.93,0.0954356846473029
282,feminism,The woman who fought for women’s rights to drive in Saudi is on a hunger strike in prison,1604147294.0,"10/31/2020, 12:28:14",19,1,970,5.329277818912487,0.99,0.01958762886597938
283,feminism,"OnlyFans was founded in 2016 by the Hertfordshire-based British entrepreneur Timothy Stokely, 37 who takes a 20 % cut from women's income. Women are reporting harrassment &amp; being pushed to take more &amp; more extreme images of themselves.",1597620880.0,"08/16/2020, 23:34:40",145,0,958,113.21002129765748,0.89,0.151356993736952
284,feminism,"The time taken to retract this misogynistic study is the average time it takes to be diagnosed with endometriosis.“That paper is a really good example of what happens when we do research about women but not for them. And that’s partly a reflection of the patriarchal society that we live in"".",1596722562.0,"08/06/2020, 14:02:42",67,0,956,36.2554651794203,0.96,0.0700836820083682
285,feminism,Petition: Make LGBT conversion therapy illegal in the UK,1590171426.0,"05/22/2020, 18:17:06",34,0,952,42.17662959165864,0.96,0.03571428571428571
286,feminism,"Sorry if this is a repost, but saw this and thought it was too cute and neat not to share :)",1580086050.0,"01/27/2020, 00:47:30",55,0,947,43.64676394211665,0.96,0.05807814149947202
287,feminism,"Her sobriquet name is Jianhu Nüxia which,when translated literally into English, means ""Woman Knight of Mirror Lake"". Qiu was executed after a failed uprising against the Qing dynasty, and she is considered a national heroine in China; a martyr of republicanism and feminism.",1577871963.0,"01/01/2020, 09:46:03",12,0,953,31.958352950822814,0.97,0.012591815320041973
288,feminism,"I’m really not cool with porn anymore, and I feel like this makes me a lone crazy woman. Anyone else feeling this way?",1589800930.0,"05/18/2020, 11:22:10",160,0,953,71.47738575498374,0.93,0.16789087093389296
289,feminism,"March is Endometriosis awareness month. It's a chronic, systemic inflammatory disease that does not have a cure. It affects 180 million women globally, yet its one of the least researched/funded conditions. Can also impact a woman's sexuality, social &amp; professional life to a significant extent.",1583751847.0,"03/09/2020, 11:04:07",28,0,950,21.957523229559797,0.98,0.029473684210526315
290,feminism,"It's not funny to say sexual things to a customer service worker and it's a ""prank"" is not a valid excuse.",1592747892.0,"06/21/2020, 13:58:12",50,0,944,31.390162767463266,0.97,0.05296610169491525
291,feminism,Violence against Women in India,1575076437.0,"11/30/2019, 01:13:57",57,0,943,23.20772557825785,0.98,0.060445387062566275
292,feminism,"Reddit just banned &amp; quarantined some major misogynistic subreddits, including pornographic ones. But major pedophilic &amp; transmisogynistic pornographic subreddits remain unbanned.",1594514436.0,"07/12/2020, 00:40:36",117,0,943,54.48483317566638,0.95,0.12407211028632026
293,feminism,"""Historically there haven't been more great women scientists because most women are hardwired to be intellectually inferior""...Well how many of these names you automatically thought belong to a male scientist?",1594442637.0,"07/11/2020, 04:43:57",42,0,943,30.45884401972114,0.97,0.044538706256627786
294,feminism,Imagine...,1583987920.0,"03/12/2020, 04:38:40",97,0,945,55.51171596343829,0.94,0.10264550264550265
295,feminism,When religion meets misogyny.,1574251486.0,"11/20/2019, 12:04:46",59,0,942,40.14437031215357,0.96,0.06263269639065817
296,feminism,Women in Science,1574846798.0,"11/27/2019, 09:26:38",16,0,934,52.92049991101271,0.95,0.017130620985010708
297,feminism,"There's a medically unnecessary legal multimillion dollar female genital cosmetic-surgery(FGCS) industry. Anatomically,there's little difference between FGM &amp; many/most of the FGCS. FGCS &gt;&gt; male circumcision. Yet people skip right over that fact &amp; compare it with male circumcision. I wonder why!",1586684267.0,"04/12/2020, 09:37:47",101,0,929,84.68030234185846,0.92,0.10871905274488698
298,feminism,A little illustration I whipped up.,1593055544.0,"06/25/2020, 03:25:44",60,0,928,65.35697897026535,0.93,0.06465517241379311
299,feminism,"""Stats NZ for 2019 shows 65% of female prisoners were Maori and this rose to 68% for women who were sentenced to periods of imprisonment.""",1588788520.0,"05/06/2020, 18:08:40",50,0,922,48.73772275500903,0.95,0.05422993492407809
300,feminism,Sexual assault &amp; harassment are never okay. This tweet by the NYT (now deleted) speaks volumes about their moral depravity,1586786652.0,"04/13/2020, 14:04:12",42,0,918,72.08723089383147,0.93,0.0457516339869281
301,feminism,"Sharing my friend’s words for anyone else struggling to find hope... Don’t give up. “These f****s are humans too— fragile, scared, mortal.”",1600616298.0,"09/20/2020, 15:38:18",23,4,921,28.54317250101883,0.97,0.0249728555917481
302,feminism,Misogyny in India,1575288393.0,"12/02/2019, 12:06:33",24,0,909,42.10683514802179,0.96,0.026402640264026403
303,feminism,Sudan to outlaw female genital mutilation | The Guardian,1588418396.0,"05/02/2020, 11:19:56",11,0,911,10.563814401767331,0.99,0.012074643249176729
304,feminism,"""Lady chips are 'easy to carry in a purse.' Because ladies mustn't ever be seen buying or carrying snacks for themselves. Only for men and children. There are some things decent women keep private - like eating"".",1575809259.0,"12/08/2019, 12:47:39",36,0,907,39.36735279403683,0.96,0.03969128996692393
305,feminism,"Don't leave us alone, please. Human rights are violated in my country again and again. But this isn't only about Poland, it's about all women, because it won't stop here. So spread these news, please, if we'll receive at least psychological support we would be really grateful",1603407626.0,"10/22/2020, 23:00:26",37,0,909,18.879761402256236,0.98,0.0407040704070407
306,feminism,Misogyny and Lesbophobia in LGBT communities,1604061171.0,"10/30/2020, 12:32:51",55,2,911,66.75151257109849,0.93,0.06037321624588365
307,feminism,"For all of the “look at what she was wearing, she was asking for it” people. 😂",1603894407.0,"10/28/2020, 14:13:27",32,6,900,25.581631814983893,0.97,0.035555555555555556
308,feminism,"""Rough Sex gone Wrong"" defense: 45% of the time, this claim in a homicide defence results in a lesser charge of manslaughter, a lighter sentence,/the death not being treated as a crime at all. &amp; in the last 5 years, it's worse, with 50% success in ""sex game"" claims.",1574939561.0,"11/28/2019, 11:12:41",39,0,897,33.74278697816703,0.96,0.043478260869565216
309,feminism,Lesbophobia and Pornography,1602297096.0,"10/10/2020, 02:31:36",105,0,891,84.01826355701417,0.91,0.11784511784511785
310,feminism,"""6/BDSM is now a strategic defense for men in the way that 'provocation' has previously been. And to see it increasingly being used, and working, over the last few years is hugely troubling. 7/There is nothing a woman can do to cause a man to kill her""",1574363279.0,"11/21/2019, 19:07:59",80,0,882,49.248473331342325,0.95,0.09070294784580499
311,feminism,Handling the truth,1586686234.0,"04/12/2020, 10:10:34",18,0,879,33.72583617928899,0.96,0.020477815699658702
312,feminism,Don't be confused.,1578769029.0,"01/11/2020, 18:57:09",38,0,880,63.6317561829153,0.93,0.04318181818181818
313,feminism,A reminder that TERFs aren't feminists and they don't stand for what we stand for,1579310684.0,"01/18/2020, 01:24:44",157,1,880,189.23521991166012,0.82,0.1784090909090909
314,feminism,These women challenged a centuries old 'humiliating' tradition - and won. Afghan women's names now to be included on their legal documentation!,1600566820.0,"09/20/2020, 01:53:40",24,1,869,10.375105511301285,0.99,0.02761795166858458
315,feminism,"During the Plague in Europe, men took the opportunity to take away women's legal rights and status. We should beware the same happens to us. They're trying!",1587395124.0,"04/20/2020, 15:05:24",69,0,867,71.44448163169773,0.92,0.07958477508650519
316,feminism,"The new ‘gag laws’ have been described as a “major victory” for convicted rapists, as their victims are now “muzzled” and prohibited from self-identifying in publications – including media and autobiographies – regardless of their wish.",1598460084.0,"08/26/2020, 16:41:24",39,0,863,20.123771270857333,0.98,0.04519119351100811
317,feminism,COVID-19 and Christian Misogyny,1588159051.0,"04/29/2020, 11:17:31",25,0,857,41.47510718162323,0.95,0.029171528588098017
318,feminism,I've just attended a conference at the University of Fribourg. Chimamanda Ngozi Adichie was invited to speak. She is a remarkable woman.,1573847241.0,"11/15/2019, 19:47:21",31,0,860,41.2049217591682,0.95,0.03604651162790698
319,feminism,"Neruda was a RAPIST: After the woman ignored his advances, Neruda says he took “a strong grip on her wrist” &amp; led her to his bedroom. “The encounter was like that of a man and a statue. She kept her eyes wide open all the while, completely unresponsive,” he recalled. “She was right to despise me.”",1585685247.0,"03/31/2020, 20:07:27",30,1,864,13.970828340638832,0.98,0.034722222222222224
320,feminism,Women in Science,1580830950.0,"02/04/2020, 15:42:30",12,0,856,23.89341087168998,0.97,0.014018691588785047
321,feminism,New Zealand supermarket chain becomes first to use 'period' label on menstrual products | New Zealand,1593188107.0,"06/26/2020, 16:15:07",16,0,852,16.29256049076173,0.98,0.018779342723004695
322,feminism,Justice Ruth Bader Ginsburg Dies at 87,1600473135.0,"09/18/2020, 23:52:15",82,4,850,15.758931559235862,0.98,0.09647058823529411
323,feminism,"Women scientists have a 19.5% higher risk of leaving academia *every year*, which gives male authors a major cumulative advantage over time.The dropout gap persists at similar rates throughout scientific careers. To reduce the gap, the emphasis should be on providing sustainable career for women.",1585539750.0,"03/30/2020, 03:42:30",16,0,846,73.78660034534937,0.92,0.018912529550827423
324,feminism,She is recognized as the first woman to have completed a voyage of circumnavigation of the globe.,1577587764.0,"12/29/2019, 02:49:24",17,1,845,35.08616101266318,0.96,0.020118343195266272
325,feminism,"During the 1971 Bangladesh war for independence, members of the Pakistani military &amp; Razakar rapedbetween 200,000 &amp; 400,000 Bangladeshi women &amp; girls in a systematic campaign of genocidal rape to terrorise both the Bengali-speaking Muslim majority &amp; the Hindu minority of Bangladesh.",1583141389.0,"03/02/2020, 09:29:49",28,0,839,29.292084267806672,0.97,0.033373063170441
326,feminism,Kobe Bryant confessed to rape. That's part of his story.,1580200181.0,"01/28/2020, 08:29:41",271,0,834,119.17495768598349,0.87,0.3249400479616307
327,feminism,Feminism will be everywhere,1578256865.0,"01/05/2020, 20:41:05",26,0,843,88.03375742017988,0.91,0.03084223013048636
328,feminism,"They are few of the 100s of women &amp; girls kidnapped by armed groups there since 2018. The governor in Turkey-occupied Afrin refuses to disclose the status of the kidnapped women, further confirming that the kidnapping of Kurdish women is carried out with the knowledge &amp; supervision of the Turkey.",1591275949.0,"06/04/2020, 13:05:49",14,0,832,29.750055526011806,0.97,0.016826923076923076
329,feminism,"""He would explain to me that some people were born whores, and that I was one, and I was a slut, and nobody’d want me but him, and the best thing I could do was just learn to be a good whore."" ""It took me 10 years to come to grips with the fact I was actually a victim of trafficking.”--Cyntoia Brown",1586329132.0,"04/08/2020, 06:58:52",84,0,837,61.700518267069924,0.93,0.1003584229390681
330,feminism,"Brussels, Belgium. 🇧🇪 Thousands of people marched in the streets of Belgium to demand end to violence against women. The red shoes symbolize women killed by violence.",1574709763.0,"11/25/2019, 19:22:43",8,0,832,37.279351476529314,0.96,0.009615384615384616
331,feminism,"Women in Mathematics: Agnesi’s best-known work, Instituzioni analitiche ad uso della gioventù italiana provided a remarkably comprehensive &amp; systematic treatment of algebra &amp; analysis, including such relatively new developments as integral &amp; differential calculus.",1590018707.0,"05/20/2020, 23:51:47",9,0,829,23.51781721346697,0.97,0.010856453558504222
332,feminism,"Misogynoir in Medicine: ""The ‘Mississippi Appendectomy’, was the medical practice that provided involuntary sterilization to poor, black, women who were deemed unfit to reproduce"".",1599621810.0,"09/09/2020, 03:23:30",38,1,829,17.579277620656626,0.98,0.045838359469240045
333,feminism,"These same men would then derail feminist discussion by saying: if women want to have abortion right, men must be allowed to violate children's rights (terminate their parental responsibility).",1604222183.0,"11/01/2020, 09:16:23",87,0,834,51.98669190584326,0.94,0.10431654676258993
334,feminism,US States are starting to ban so-called virginity tests. Good! Your hymen CANNOT tell anyone if you’re a virgin! There are pregnant women with intact hymens! Spread the word!,1576468718.0,"12/16/2019, 03:58:38",30,0,817,32.13154401213433,0.96,0.03671970624235006
335,feminism,"Gladys Mae West contributed to the mathematical modeling of the shape of the Earth, &amp; her work on the development of the satellite geodesy models that were eventually incorporated into the GPS &amp; on an astronomical study that proved the regularity of Pluto’s motion relative to Neptune.",1574506766.0,"11/23/2019, 10:59:26",10,0,824,36.18542700349644,0.96,0.012135922330097087
336,feminism,There's no right or fixed way to be a women or a man. Intersex women are women.,1588324017.0,"05/01/2020, 09:06:57",51,0,822,56.278117382852315,0.94,0.06204379562043796
337,feminism,"Why Feminism in the 2020s needs to be uncomfortable: ""There’s a concern from some women that we will alienate straight men because they’re not quite sure how to behave with women right now. They’re uncomfortable. 2020 feminism needs to get comfortable with discomfort.""",1579185601.0,"01/16/2020, 14:40:01",94,0,821,72.06639072696555,0.92,0.11449451887941535
338,feminism,"Hubby always wanted to add “and son” to his business name. Our son went in another direction. He proudly says “And Daughter” now. One of my favorite Aww moments, a work van selfie.",1577479355.0,"12/27/2019, 20:42:35",17,0,816,13.20570566774802,0.98,0.020833333333333332
339,feminism,"I wonder why we hear about 'carceral feminism' so much but never 'carceral anti-racism'/'carceral labor movement'. Anarchist dudes who do nothing to fight patriarchal male violence, berate them for seeking out the only aid that exists &amp; how many of you bros support restorative justice for fascists?",1596209231.0,"07/31/2020, 15:27:11",56,0,817,74.32199912552608,0.92,0.06854345165238677
340,feminism,"In the Era of #MeToo how can we tolerate, let alone support, Joe Biden for President!?",1581034899.0,"02/07/2020, 00:21:39",101,0,817,97.39402839658555,0.89,0.12362301101591187
341,feminism,The mythical idea that women give something away when they have sex is the backbone of heteropatriarchal male domination.,1576164560.0,"12/12/2019, 15:29:20",219,1,814,155.68327640077223,0.84,0.269041769041769
342,feminism,'Misogyny Simply Doesn't Exist' Starterpack- Singapore edition,1602858757.0,"10/16/2020, 14:32:37",36,1,809,56.54395095527752,0.93,0.04449938195302843
343,feminism,"Man who normalized a sex essentialist approach to studying autism &amp; whose 'Extreme Male Brain' theory of autism is directly responsible for the failures to identify autistic women &amp; girls causing significant psychological harm, also appears to have missed the point of scientific sexism :-).",1596622945.0,"08/05/2020, 10:22:25",27,0,802,31.273105322541937,0.96,0.03366583541147132
344,feminism,"3 MILLION views for this misogynistic filth on Pornhub. Guess what? This video was produced by another subsidiary of the Mindgeek monopoly too! Mindgeek make this exploitation/rape fantasy for misogynists to jerk off to, then promote it on their biggest website (Pornhub)! SCUM!!",1594664065.0,"07/13/2020, 18:14:25",142,0,801,98.79975306148879,0.89,0.1772784019975031
345,feminism,"Judges: Texas, Ohio cannot stop abortion access",1585664350.0,"03/31/2020, 14:19:10",9,0,796,17.417238440379037,0.98,0.011306532663316583
346,feminism,A feminist puzzle I did this week!,1592965738.0,"06/24/2020, 02:28:58",67,0,791,69.91199084399261,0.92,0.08470290771175727
347,feminism,"Jewish Misogyny: ""According to the suit, several flight attendants told Wolfson during the flight that women were often asked to switch seats in order to accommodate ultra-Orthodox men."" Women shouldn't be forced to appease religious fundamentalist misogynists.",1599044051.0,"09/02/2020, 10:54:11",76,0,789,23.671093922771888,0.97,0.09632446134347275
348,feminism,"I've definitely been told ""god you get so offended!"" or ""why can't you take a joke?"" No.. I just won't laugh along to sexist jokes anymore",1581103065.0,"02/07/2020, 19:17:45",83,0,784,48.5896699434021,0.94,0.10586734693877552
349,feminism,Pretty much their arguments,1595510116.0,"07/23/2020, 13:15:16",428,2,782,516.7118975091082,0.6,0.5473145780051151
350,feminism,"Women in Physics: Helen Quinn, particle physicist, a fellow &amp; former president of the American Physical Society. Awards: Dirac Medal of the ICTP, Sakurai Prize, Oskar Klein Memorial Lecture, Compton medal, Benjamin Franklin Medal.",1589903618.0,"05/19/2020, 15:53:38",6,0,782,27.152368156372972,0.97,0.0076726342710997444
351,feminism,We need to teach the achievements of women in schools,1589409565.0,"05/13/2020, 22:39:25",81,0,780,67.74425167579295,0.92,0.10384615384615385
352,feminism,"Neuroscientist Emily Jacobs is awarded a $5M NIH grant to advance women’s health through brain imaging. This will allow her team to establish the effects of ovarian hormone depletion on the body, teasing apart the effects of hormone suppression from the natural course of chronological aging.",1592261593.0,"06/15/2020, 22:53:13",4,0,776,12.628398788850404,0.98,0.005154639175257732
353,feminism,Radical feminists started advocating for nonbinary pronouns from the early 1970s.,1592218246.0,"06/15/2020, 10:50:46",35,0,768,63.35755710609476,0.92,0.045572916666666664
354,feminism,"Oh no, a future where a woman enjoys the life she choose?!",1576415764.0,"12/15/2019, 13:16:04",69,0,770,28.44551555962471,0.96,0.08961038961038961
355,feminism,"What would a world without women look like? On March 9, Mexico may find out — Women across the country are being urged to skip work next Monday, stay off the streets and purchase nothing for 24 hours after a recent rash in femicides.",1583439653.0,"03/05/2020, 20:20:53",38,0,760,34.08627837702477,0.96,0.05
356,feminism,"Sometimes I wonder why people find a woman’s leg hair disgusting, yet a man’s leg hair normal. But, then I remember even I shave my legs.",1584823401.0,"03/21/2020, 20:43:21",158,0,759,43.44823397459322,0.95,0.20816864295125165
357,feminism,Sexism in anarchist movement,1596870178.0,"08/08/2020, 07:02:58",22,0,756,58.390338340046696,0.93,0.0291005291005291
358,feminism,Porn and Rape Culture,1576072921.0,"12/11/2019, 14:02:01",101,0,751,54.44973603323376,0.93,0.13448735019973368
359,feminism,Mexican women call for a national strike after a series of brutal femicides,1582307455.0,"02/21/2020, 17:50:55",14,0,751,15.726201334764255,0.98,0.018641810918774968
360,feminism,"""When black people are talked about the focus tends to be on black men; and when women are talked about the focus tends to be on white women."" -- bell hooks. Intersectional feminism was originally (and is still) meant to end that dynamic.",1600732611.0,"09/21/2020, 23:56:51",9,0,748,32.547760185419975,0.96,0.012032085561497326
361,feminism,"Maha al-Mutairi is a 39-year-old Kuwaiti transgender woman. The ""police had raped her and beat her senseless while she was detained in a male prison for seven months in 2019, for “imitating the opposite sex.”""",1594860432.0,"07/16/2020, 00:47:12",29,0,746,27.91946794435512,0.96,0.0388739946380697
362,feminism,"As opposed to the idea that men are abusive because they are traumatized, mentally ill, victims of poverty &amp; hierarchy ( by that logic, women should batter men more); they are abusive because it provides social privileges &amp; therapy only provides different techniques of power over women",1598784644.0,"08/30/2020, 10:50:44",63,0,747,92.72141429297676,0.89,0.08433734939759036
363,feminism,"""I decided blacks shouldn't have to experience the difficulties I had faced, so I decided to open a flying school and teach other black women to fly."" Bessie Coleman (620 × 497)",1596943054.0,"08/09/2020, 03:17:34",6,0,747,17.4554024891994,0.98,0.008032128514056224
364,feminism,"Rep. Louie Gohmert, who believes women should be forced to carry unwanted pregnancies to term, is suddenly all about (his) freedom of choice.",1596394339.0,"08/02/2020, 18:52:19",22,0,745,11.903242336943322,0.98,0.02953020134228188
365,feminism,Misogyny in India: Usha sewing machine ad (1980-81) providing mothers with grooming tips -- how can a mother groom her daughter to become a devoted house slave.,1588701929.0,"05/05/2020, 18:05:29",44,0,738,78.75109966002299,0.9,0.05962059620596206
366,feminism,"Happy Intl Women's Day Sunday! Original art about the Uprising of the 20,000. Keep Rising!",1583612921.0,"03/07/2020, 20:28:41",6,0,741,19.655347335471106,0.97,0.008097165991902834
367,feminism,"Zomato, a food delivery service based in India, has introduced ""Period leave"" for its employees, both women and transgender people. Commendable initiative.",1597221454.0,"08/12/2020, 08:37:34",31,0,736,31.9868966860696,0.96,0.042119565217391304
368,feminism,"Iranian girl, 13, beheaded by father in ‘honor killing’ as she slept",1590660487.0,"05/28/2020, 10:08:07",46,0,733,4.711581902894977,0.99,0.06275579809004093
