,Subreddit,Title,Epoch Time,Date,Comments,Awards,Upvotes,Downvotes,Upvote Ratio,Comment/Upvote Ratio
724,feminism,Can we just talk about what a fucking bombshell this book is?,1592487889.0,"06/18/2020, 13:44:49",32,0,120,16.2279032190618,0.88,0.26666666666666666
725,feminism,A detailed guide on consent because it’s never taught enough :),1598272536.0,"08/24/2020, 12:35:36",35,0,123,8.108332984603834,0.94,0.2845528455284553
726,feminism,The last line cuts deep.,1578940434.0,"01/13/2020, 18:33:54",24,0,121,9.938117631857097,0.92,0.19834710743801653
727,feminism,Preach,1586308573.0,"04/08/2020, 01:16:13",16,0,120,28.435700907504184,0.81,0.13333333333333333
728,feminism,"Naari Jamhoori Mahaz Sindh organized its first one-day feminist school on 21 December 2019, at Nasirabad.",1577008399.0,"12/22/2019, 09:53:19",1,0,118,36.29497944145618,0.76,0.00847457627118644
729,feminism,"Imperfect men have been empowered and permitted to run the world since the beginning of time, it's time for imperfect women to grant themselves permission to join them. 👏",1575132507.0,"11/30/2019, 16:48:27",18,0,123,11.535269627033841,0.91,0.14634146341463414
730,feminism,"Why society says it's okay for girls to have a ""tomboy"" phase, but boys would be ridiculed.",1600924136.0,"09/24/2020, 05:08:56",6,1,119,5.869781794308253,0.95,0.05042016806722689
731,feminism,Is anyone else tired of the whole “be kind anger doesn’t solve anything” by cis men,1598480602.0,"08/26/2020, 22:23:22",41,0,123,18.761186730395366,0.87,0.3333333333333333
732,feminism,WNBA has been leading for years,1598643060.0,"08/28/2020, 19:31:00",16,0,120,17.480111395311724,0.87,0.13333333333333333
733,feminism,"Missouri has ruined my childhood, here's why",1579272372.0,"01/17/2020, 14:46:12",30,0,120,21.36819252187459,0.85,0.25
734,feminism,I'm just so tired of these things just happening smh actually disgusted by this,1575263645.0,"12/02/2019, 05:14:05",9,0,120,10.57948979899922,0.92,0.075
735,feminism,J.K. Rowling comes out as a TERF,1577043253.0,"12/22/2019, 19:34:13",125,0,117,47.75430670777041,0.71,1.0683760683760684
736,feminism,Female magicians are being rated worse by audience despite showing same tricks as male magicians,1583512758.0,"03/06/2020, 16:39:18",12,0,118,18.974359261576524,0.86,0.1016949152542373
737,feminism,"Trans women who don't experience GD or hate their assigned sex, are women and their experiences matter.",1591960850.0,"06/12/2020, 11:20:50",18,0,116,28.159971118823165,0.8,0.15517241379310345
738,feminism,Sport and Gender,1578058977.0,"01/03/2020, 13:42:57",24,0,116,21.131461206893533,0.85,0.20689655172413793
739,feminism,Brock Turner Committed Sexual Assault at My Fraternity’s Party—Our Culture Became More Feminist Immediately.,1601123601.0,"09/26/2020, 12:33:21",11,0,113,17.501256127614397,0.87,0.09734513274336283
740,feminism,Japanese Women Demand Right to Wear Glasses at Work,1573311650.0,"11/09/2019, 15:00:50",11,0,112,4.274466417313022,0.96,0.09821428571428571
741,feminism,Joke will always be on you,1576517679.0,"12/16/2019, 17:34:39",4,0,111,4.04917975229327,0.96,0.036036036036036036
742,feminism,Black Women Have Never Had The Privilege Of Rage | HuffPost,1575820108.0,"12/08/2019, 15:48:28",5,0,109,12.566196212838946,0.9,0.045871559633027525
743,feminism,The difference is not really hard to grasp,1598469188.0,"08/26/2020, 19:13:08",14,0,107,14.414040783748106,0.88,0.1308411214953271
744,feminism,"Meet Xanthippe, the Insufferable Wife of Socrates",1589659995.0,"05/16/2020, 20:13:15",11,0,110,7.542926051852362,0.94,0.1
745,feminism,New Evidence Supporting Credibility of Tara Reade's Allegation Against Joe Biden Emerges,1588157424.0,"04/29/2020, 10:50:24",43,0,107,16.083147239811723,0.87,0.40186915887850466
746,feminism,Let’s help defend abortion by supporting Planned Parenthood,1577660009.0,"12/29/2019, 22:53:29",77,0,105,32.0739708978069,0.77,0.7333333333333333
747,feminism,Why we need Planned Parenthood,1573852258.0,"11/15/2019, 21:10:58",8,0,109,5.07284344070321,0.96,0.07339449541284404
748,feminism,STOP MAKING EXCUSES FOR SEXUAL ASSAULT.,1579457163.0,"01/19/2020, 18:06:03",21,0,107,21.259255209388044,0.83,0.19626168224299065
749,feminism,"MLB has its 1st female coach, comments made are gross.",1579281279.0,"01/17/2020, 17:14:39",24,0,109,24.013009099283863,0.82,0.22018348623853212
750,feminism,Cishet male ally talking over trans women to tell them that sexualized transmisogyny (perpetuated by porn industry &amp; other media) that directly contributes to their systematic persecution is true acceptance. Transmisogyny is okay as long as males are permitted to make it sound like progressive.,1603360042.0,"10/22/2020, 09:47:22",7,0,105,12.79664751073095,0.89,0.06666666666666667
751,feminism,I painted this portrait of Malala Yousafzai,1598779924.0,"08/30/2020, 09:32:04",6,0,105,6.399715015878954,0.94,0.05714285714285714
752,feminism,I’m a 37-Year-Old Mom &amp; I Spent Seven Days Online as an 11-Year-Old Girl. Here’s What I Learned.,1577182630.0,"12/24/2019, 10:17:10",12,1,105,6.2234606300002895,0.94,0.11428571428571428
753,feminism,"In Coronavirus Crackdown, Ohio Orders Clinics to Stop Abortions",1585055724.0,"03/24/2020, 13:15:24",10,0,104,8.654350865974635,0.92,0.09615384615384616
754,feminism,Oscars’ Corporate ‘Feminism’ Isn’t Empowering — It’s Condescending,1581435977.0,"02/11/2020, 15:46:17",5,0,105,13.81358437129002,0.88,0.047619047619047616
755,feminism,The Choreographer Fighting Gender Inequality Through Dance | The Eleonora Fae Story,1597038574.0,"08/10/2020, 05:49:34",2,0,105,11.377735252188998,0.9,0.01904761904761905
756,feminism,Poland to withdraw from treaty on violence against women,1595755145.0,"07/26/2020, 09:19:05",13,0,102,4.183291236392364,0.96,0.12745098039215685
757,feminism,Japanese store 'rethinks' badges for staff on periods,1575007562.0,"11/29/2019, 06:06:02",6,0,102,6.597738055191584,0.94,0.058823529411764705
758,feminism,Irish government vote to seal abuse files for 30 years,1603543155.0,"10/24/2020, 12:39:15",7,0,103,4.24751729431766,0.96,0.06796116504854369
759,feminism,"Feminists in Nigeria are rallying to #EndSARS , a law enforcement organisation that frequently rapes, assaults and extorts Nigerian citizens.",1603047618.0,"10/18/2020, 19:00:18",1,0,103,2.1326701787283184,0.98,0.009708737864077669
760,feminism,It’s Time For Change,1595255669.0,"07/20/2020, 14:34:29",5,0,103,8.113901436680976,0.93,0.04854368932038835
761,feminism,r/MensRights compares fashion criticism to reproductive rights,1595252540.0,"07/20/2020, 13:42:20",19,0,105,25.921467052329405,0.8,0.18095238095238095
762,feminism,How to ‘Karen’ Correctly - Use That Privilege to Support and Stand Against All Bigotry and Speak Truth to Power,1590776619.0,"05/29/2020, 18:23:39",7,0,104,12.401392153809965,0.89,0.0673076923076923
763,feminism,Everyday Sexism - Laura Bates: what to read next?,1590270207.0,"05/23/2020, 21:43:27",32,0,104,17.85370836001897,0.85,0.3076923076923077
764,feminism,How Is Evolutionary Theory Used To Justify Misogyny? | Feminism In India,1583392869.0,"03/05/2020, 07:21:09",3,0,103,19.33693153909485,0.84,0.02912621359223301
765,feminism,An unapologetic Taylor Swift.,1580835643.0,"02/04/2020, 17:00:43",8,0,103,20.937163223771307,0.83,0.07766990291262135
766,feminism,Today I orgasmed for the first time during sex thanks to this sub,1602555092.0,"10/13/2020, 02:11:32",7,0,104,9.24805278004257,0.92,0.0673076923076923
767,feminism,"This is always going to be my favorite defense against anyone who thinks clothes are distracting to boys, I will scream at them that I’m gay (I am) and I’m handling the girls locker room better than they handle seeing a shoulder",1591979665.0,"06/12/2020, 16:34:25",17,0,100,7.844079441296131,0.93,0.17
768,feminism,Joe Biden can't be the nominee #TimesUp,1585158686.0,"03/25/2020, 17:51:26",56,0,98,14.606119465645534,0.87,0.5714285714285714
769,feminism,"Celebrating women who push boundaries: interviews with 16 Chinese female artists, entrepeneurs, writers, scientists and athletes: Li Jingmei, Sissi Chao, Jill Tang, Xing Danwen, Shirley Ying Han, Echo He, Xia Jia, Xue Mo, Meng Du, PeiJu Chien-Pott, Jiayu Liu, Qu Lan, Tiffany Chan, Xiong Jingnan, Gia",1584789152.0,"03/21/2020, 11:12:32",0,0,100,9.701121859364676,0.91,0.0
770,feminism,"PERIOD is not disgusting, PERIOD is not a problem, PERIOD is the process of life, and PMS is no joke, especially for some women! And the more we talk about PMS, the better we'll know about it, and thus be able to create better cope-up solutions.",1578473035.0,"01/08/2020, 08:43:55",7,0,101,9.579579718175765,0.91,0.06930693069306931
771,feminism,'I don't want to die': Middle East women are still waiting for the elimination of violence on IDEVAW,1574707734.0,"11/25/2019, 18:48:54",3,0,102,4.921918503075091,0.95,0.029411764705882353
772,feminism,Iranian girl takes off her compulsory hijab and protests against mandatory dress code for women.,1598045482.0,"08/21/2020, 21:31:22",10,0,103,2.603090242249152,0.98,0.0970873786407767
773,feminism,Just let us be :(,1579722741.0,"01/22/2020, 19:52:21",88,0,104,28.687130553784016,0.78,0.8461538461538461
774,feminism,"Urgent Message from Bolivia: Nov 15th, They Are Killing Us! Let the World Know, There is No Press Here",1573867650.0,"11/16/2019, 01:27:30",7,0,102,4.950714136029802,0.95,0.06862745098039216
775,feminism,The girls and women fighting to stop child marriage – photo essay,1599211815.0,"09/04/2020, 09:30:15",0,1,98,0.8269632218756158,0.99,0.0
776,feminism,"Trigger Warning: Violence. A 30 year old woman dead after having her head smashed by her father in Amman, Jordan. Bloody and unmoved, her father smoked and drank tea afterwards.",1595086402.0,"07/18/2020, 15:33:22",2,0,100,3.363071782138917,0.97,0.02
777,feminism,Misogyny of pseudo-socialist/semi-leftist party of USA (part 2),1573794600.0,"11/15/2019, 05:10:00",23,0,97,14.402549995664572,0.87,0.23711340206185566
778,feminism,"""There is no need for feminism in the west anymore"" - let's discuss",1599894181.0,"09/12/2020, 07:03:01",32,1,96,10.465606534364184,0.9,0.3333333333333333
779,feminism,Anarcha-Feminists took over a government building in Mexico City in solidarity with abused women the government failed to protect. Using it as a shelter.,1599630515.0,"09/09/2020, 05:48:35",2,0,95,7.386333712142616,0.93,0.021052631578947368
780,feminism,Say Her Name,1591205520.0,"06/03/2020, 17:32:00",22,0,100,11.133557902911107,0.9,0.22
781,feminism,Outrage in Pakistan after feminism panel includes no women,1574452898.0,"11/22/2019, 20:01:38",2,0,96,5.3045440804425965,0.95,0.020833333333333332
782,feminism,“Mr. Vice President I’m speaking. I’m speaking. Kay?”,1602128142.0,"10/08/2020, 03:35:42",10,0,95,15.739390764451855,0.86,0.10526315789473684
783,feminism,"Zomato Begins ""Period Leave"" For Employees",1596962457.0,"08/09/2020, 08:40:57",4,0,95,13.567703749305494,0.88,0.042105263157894736
784,feminism,[Trigger Warning+revenge porn+honour killing] Man lured+manipulated 3 minor girls into getting sexually intimate &amp; then deliberately made a non-consensual soft-core amateur porn video. Video goes viral. Paternal cousin brother kills 2 of these minor victims in a brutal manner (Pakistan).,1589834740.0,"05/18/2020, 20:45:40",12,0,96,16.935124094407158,0.85,0.125
785,feminism,This was in a children's bible stories book I was given when I was a little girl.,1585345361.0,"03/27/2020, 21:42:41",18,0,95,3.922483740773515,0.96,0.18947368421052632
786,feminism,Friendship Is Not A Consolation Prize,1575661003.0,"12/06/2019, 19:36:43",4,0,96,8.163754521108473,0.92,0.041666666666666664
787,feminism,Women in poland fighting for their rights,1604340865.0,"11/02/2020, 18:14:25",10,0,142,10.355629089912412,0.93,0.07042253521126761
788,feminism,"Hidden women of history: Enheduanna, princess, priestess and the world's first known author",1583084323.0,"03/01/2020, 17:38:43",4,0,94,9.5660927772539,0.91,0.0425531914893617
789,feminism,Who benefits?,1574093237.0,"11/18/2019, 16:07:17",16,0,93,25.482421763947954,0.78,0.17204301075268819
790,feminism,What Are the Reasons That Domestic Violence Victims Recant?,1593287070.0,"06/27/2020, 19:44:30",13,0,95,9.243064178819651,0.91,0.1368421052631579
791,feminism,Calling out fake male feminists,1588475717.0,"05/03/2020, 03:15:17",45,0,89,13.631667923375758,0.87,0.5056179775280899
792,feminism,Reddit Hates Women.,1595330730.0,"07/21/2020, 11:25:30",32,0,94,17.571228834869473,0.84,0.3404255319148936
793,feminism,Say her name: Emerald Black is a black woman who was dragged out of a car with her boyfriend for NO REASON and beaten by police. After alerting them she was pregnant (as well as being visibly so) police stomped on her stomach and forced her to miscarry.,1591266464.0,"06/04/2020, 10:27:44",10,0,94,2.455064529320552,0.97,0.10638297872340426
794,feminism,"A 10 year old rape victim who was born with a hole in her heart, had to undergo pregnancy &amp; give birth: ""The child has still not been told about her pregnancy. She has been told that she has a big stone in her stomach and the bulge is because of that.""",1589772323.0,"05/18/2020, 03:25:23",15,0,93,12.79222806732875,0.88,0.16129032258064516
795,feminism,Schrödinger’s Woman,1580938899.0,"02/05/2020, 21:41:39",5,0,91,8.328059983328231,0.92,0.054945054945054944
796,feminism,Saw this posting today on Ziprecruiter. “Women don’t do well here.”,1576709058.0,"12/18/2019, 22:44:18",19,0,91,7.177660906380822,0.93,0.2087912087912088
797,feminism,Reddit should stop enabling non-consensual porn and male violence against women and girls.,1590781455.0,"05/29/2020, 19:44:15",22,0,91,9.17374773549139,0.91,0.24175824175824176
798,feminism,Am I the only one who has a problem with rap?,1584531860.0,"03/18/2020, 11:44:20",98,0,89,45.93159161263904,0.66,1.101123595505618
799,feminism,How women’s role in Belarus protests captured global media attention,1598694498.0,"08/29/2020, 09:48:18",0,0,91,4.644186704622541,0.95,0.0
800,feminism,US anti-abortion groups received millions in federal Covid-19 aid,1594202588.0,"07/08/2020, 10:03:08",3,0,94,8.05923077474138,0.92,0.031914893617021274
801,feminism,'We still have a problem with female authority': how politics sets a trap for American women,1583500872.0,"03/06/2020, 13:21:12",16,0,91,13.013500104545358,0.87,0.17582417582417584
802,feminism,That manly sashay.,1581523064.0,"02/12/2020, 15:57:44",8,0,90,7.826610273363372,0.92,0.08888888888888889
803,feminism,Apply for the jobs ladies!,1572897487.0,"11/04/2019, 19:58:07",14,0,89,15.886551557850083,0.85,0.15730337078651685
804,feminism,Consent Isn't Always Sexual,1600371879.0,"09/17/2020, 19:44:39",9,1,90,7.828079505055342,0.92,0.1
805,feminism,International Women’s Day: 5 feminists on the future of feminism,1584099223.0,"03/13/2020, 11:33:43",3,0,89,9.874933455137253,0.9,0.033707865168539325
806,feminism,Constant mansplaining at work,1597685303.0,"08/17/2020, 17:28:23",36,0,84,20.03292530619251,0.81,0.42857142857142855
807,feminism,"Long time member here, never felt the urge to post anything, but this repulsed me. ID Magazine (huge) have written an article on how to become a camgirl. The first line is ""School is out"". This is normalising it for impressionable young girls. Am I being an old fuddy duddy?",1595440050.0,"07/22/2020, 17:47:30",13,0,90,9.339579342099313,0.91,0.14444444444444443
808,feminism,Iraqi feminism,1575905525.0,"12/09/2019, 15:32:05",6,0,89,5.816503007284652,0.94,0.06741573033707865
809,feminism,that’s the tea,1573034790.0,"11/06/2019, 10:06:30",19,0,85,23.04104861599977,0.79,0.2235294117647059
810,feminism,Pretty good point,1595348679.0,"07/21/2020, 16:24:39",21,0,88,13.948461731335954,0.86,0.23863636363636365
811,feminism,On this day 57 years ago (16th June 1963) Soviet cosmonaut Valentina V. Tereshkova became the first woman to travel in space,1592340326.0,"06/16/2020, 20:45:26",4,0,87,5.9301525423110775,0.94,0.04597701149425287
812,feminism,onlyfans and social media nudes are NOT EMPOWERIN!,1589072258.0,"05/10/2020, 00:57:38",17,0,87,5.09614768902135,0.94,0.19540229885057472
813,feminism,"Michigan Governor and self described ""feminist"" Gretchen Whitmer says she believes Biden on sexual assault allegation",1588605365.0,"05/04/2020, 15:16:05",29,0,88,21.087435424372913,0.81,0.32954545454545453
814,feminism,All Alone in Their White Girl Pain -- Writer Hip to Waste deconstructs the Tumblr aesthetic,1596375124.0,"08/02/2020, 13:32:04",12,0,88,13.45264629581574,0.87,0.13636363636363635
815,feminism,How can I explain to men in my life that it’s inappropriate to constantly be judging women on their appearance?,1592807129.0,"06/22/2020, 06:25:29",32,0,86,13.516326516056509,0.86,0.37209302325581395
816,feminism,My boyfriend and I fought over side boob.,1580917748.0,"02/05/2020, 15:49:08",39,0,87,22.825478787419883,0.79,0.4482758620689655
817,feminism,I support women supporting women,1578714203.0,"01/11/2020, 03:43:23",10,0,83,12.054987488858401,0.87,0.12048192771084337
818,feminism,Teach men how to control themselves not women how to dress. I’m a boy but this makes me so furious.,1600276301.0,"09/16/2020, 17:11:41",30,0,84,5.920945750589851,0.93,0.35714285714285715
819,feminism,Say it louder for those in the back:,1573992918.0,"11/17/2019, 12:15:18",34,0,84,19.037535174924983,0.82,0.40476190476190477
820,feminism,"More than 70% of the movie critics in 2017 were white males, around 20% were women and only 4% WOC on Rotten Tomatoes",1600881810.0,"09/23/2020, 17:23:30",16,0,84,11.478851317721848,0.88,0.19047619047619047
821,feminism,Britney Spears was Constantly Slut Shamed In Interviews and the Media...And Because of That Today's Female Popstars Don't Have to Be,1595358053.0,"07/21/2020, 19:00:53",12,0,81,7.696723085896181,0.91,0.14814814814814814
822,feminism,Unpopular opinion: WAP is not in line with the feminist movement,1601846942.0,"10/04/2020, 21:29:02",81,0,82,14.562227251291816,0.85,0.9878048780487805
823,feminism,"I was today years old when I realized that typically when people get married, at the end of the ceremony, it's said, ""I now pronounce you man and wife."" And if you switch it around, ""I now pronounce you woman and husband."" It sounds so funny and out of place.",1601650641.0,"10/02/2020, 14:57:21",35,0,82,9.04136569657851,0.9,0.4268292682926829
824,feminism,Only 23.6% of women aged 15 &amp; above are in workforce. Women are more likely to be sexually repressed &amp; subjected to GBV. And this ecofascist former judge of SC who can't connect the dot between reproductive coercion &amp; population has the audacity...shouldn't women commit more rape by his 'logic'?,1601627215.0,"10/02/2020, 08:26:55",16,0,78,9.008990792151991,0.9,0.20512820512820512
825,feminism,"""The harms of prostitution are so profoundly linked to gender, class, and racial inequality that the prostitution industry is one of the world’s most extreme systems of discrimination."" Mickey Meiji is a survivor from prostitution now dedicating her life to helping other women in the same situation",1599603155.0,"09/08/2020, 22:12:35",2,0,80,9.006906231569673,0.9,0.025
826,feminism,"Majority of women support trans people's right to self-identify despite relentless transphobia, eye-opening polling finds",1594305240.0,"07/09/2020, 14:34:00",6,0,79,10.187104420883415,0.89,0.0759493670886076
827,feminism,Every cloud...,1587027699.0,"04/16/2020, 09:01:39",19,0,82,15.604974103957943,0.84,0.23170731707317074
828,feminism,Let's build eachother up and promote love above hate!,1578429004.0,"01/07/2020, 20:30:04",7,0,79,8.073706761968069,0.91,0.08860759493670886
829,feminism,"No dating, no sex, no marriage, no kids: South Korea's growing feminist movement",1575727068.0,"12/07/2019, 13:57:48",19,0,76,9.398579734017119,0.89,0.25
830,feminism,I love other girls! :),1575647502.0,"12/06/2019, 15:51:42",6,0,82,6.062689951356717,0.93,0.07317073170731707
831,feminism,"Laws providing women in porn these rights were written by Dworkin &amp; MacKinnon in the 80s, only to be attacked by the right wing &amp; ""sex-positive feminists"", &amp; struck down on grounds of ""free speech"". Today, the ACLU also claims that banning deepfakes &amp; revenge porn is contrary to free speech.",1598639989.0,"08/28/2020, 18:39:49",9,0,83,10.59759526553124,0.89,0.10843373493975904
832,feminism,"This new Netflix show promotes sexualization of children as thinly veiled ""liberation"" from parents for pedophiles around the world to see.",1597895194.0,"08/20/2020, 03:46:34",50,0,78,12.853545658567413,0.86,0.6410256410256411
833,feminism,Gender study finds 90% of people are biased against women,1595219782.0,"07/20/2020, 04:36:22",5,0,80,10.32409679380467,0.89,0.0625
834,feminism,Sex traffickers left thousands of women to starve during Italy lockdown - Gangs abandoned trafficked Nigerian women without access to food or funds amid coronavirus pandemic,1594393799.0,"07/10/2020, 15:09:59",1,0,81,5.325505582061879,0.94,0.012345679012345678
835,feminism,"Instead of shaming girls for their bodies, teach boys.",1573858036.0,"11/15/2019, 22:47:16",38,0,81,22.83628413128332,0.78,0.4691358024691358
836,feminism,Thought provoking perspective,1600892190.0,"09/23/2020, 20:16:30",25,1,79,7.425112691013737,0.91,0.31645569620253167
837,feminism,Pakistani Girls Are Murdered By Relatives for Appearing in Video With a Boy,1589857297.0,"05/19/2020, 03:01:37",5,0,79,9.952075834046255,0.89,0.06329113924050633
838,feminism,Petition against Pornhub for supporting human trafficking,1589156847.0,"05/11/2020, 00:27:27",23,0,74,25.146143763674687,0.75,0.3108108108108108
839,feminism,"Completely shut down, goodness me.",1581174889.0,"02/08/2020, 15:14:49",6,0,78,8.26950508709109,0.9,0.07692307692307693
840,feminism,"I'm making everyone a ""she"" for a week.",1594565662.0,"07/12/2020, 14:54:22",16,0,77,14.280766964979065,0.84,0.2077922077922078
841,feminism,Deleted ever picture of me in a hijab from my social media accounts. In preparation for finally leaving my abusive family (and by extension Islam) (xpost r/exmuslim),1577168769.0,"12/24/2019, 06:26:09",3,0,78,1.7465400553851111,0.98,0.038461538461538464
842,feminism,His behavior spoke for him,1602173531.0,"10/08/2020, 16:12:11",10,0,74,13.070942034390512,0.85,0.13513513513513514
843,feminism,"French prominent actress and sexual assault survivor Adele Haenel rose in protest yesterday after Roman Polanski won a César (French Oscar), shouting ""Shame"". Last November, she spoke out in an eloquent, moving and deeply political interview to Mediapart : English subtitles available.",1582963209.0,"02/29/2020, 08:00:09",2,0,77,15.392034874863128,0.83,0.025974025974025976
844,feminism,"Did you have your daily cup of rage today? ""Twitch steamer saves stranger from being harassed"" (xpost /r/HumansBeingBros)",1599397350.0,"09/06/2020, 13:02:30",7,0,75,8.771768738292963,0.9,0.09333333333333334
845,feminism,HOT TAKE: Pornography is the most overlooked manifestation of patriarchy,1594001284.0,"07/06/2020, 02:08:04",33,0,73,13.450410901065126,0.84,0.4520547945205479
846,feminism,"Rape Club: Japan's most controversial college society (2004) Rape Club, 2004: Japan's attitude towards women is under the spotlight following revelations that students at an elite university ran a 'rape club' dedicated to planning gang rapes.",1585857623.0,"04/02/2020, 20:00:23",6,0,71,5.561357602445156,0.93,0.08450704225352113
847,feminism,Transgender woman murdered after using women's restroom in Puerto Rico,1582753602.0,"02/26/2020, 21:46:42",6,0,76,9.995736504610463,0.88,0.07894736842105263
848,feminism,“It’s rare to not be able to find a talented woman who can at least be a candidate for a job” - Tech President on her hiring practices,1576761944.0,"12/19/2019, 13:25:44",1,0,72,6.835945620011316,0.91,0.013888888888888888
849,feminism,I have a new hero,1576526824.0,"12/16/2019, 20:07:04",25,0,73,12.97171539450666,0.85,0.3424657534246575
850,feminism,Trump's pitch to women on coronavirus recovery: 'We're getting your husbands back to work',1603834326.0,"10/27/2020, 21:32:06",8,0,74,8.036074511781152,0.9,0.10810810810810811
851,feminism,"Abortions made in unsafe conditions cause the injuries and disabilities of 7'000.000 women and girls around the world, every year. 22,000 of them will die.",1603218952.0,"10/20/2020, 18:35:52",2,0,73,3.979525252124887,0.95,0.0273972602739726
852,feminism,Wedding tradition double standard.,1600789922.0,"09/22/2020, 15:52:02",21,0,72,1.8695960322090457,0.97,0.2916666666666667
853,feminism,How to ask co workers to stop calling me “beautiful” or “gorgeous in place of my name,1595686378.0,"07/25/2020, 14:12:58",35,0,70,5.0711922776633855,0.93,0.5
854,feminism,"if there is an offer there is a demand, how can it be so difficult to catch so many abusers?",1595577084.0,"07/24/2020, 07:51:24",15,0,72,12.211447003727685,0.85,0.20833333333333334
855,feminism,Kalima DeSuze’s Black Feminist Reading List Is the Resource We Need Right Now,1591313968.0,"06/04/2020, 23:39:28",0,0,71,6.235995588665332,0.92,0.0
856,feminism,💜💚🤍,1589408349.0,"05/13/2020, 22:19:09",11,0,72,4.706762734626125,0.94,0.1527777777777778
857,feminism,"Colonialism, Imperialism and Prostitution",1575059300.0,"11/29/2019, 20:28:20",5,0,72,7.171945030796593,0.91,0.06944444444444445
858,feminism,"Huh, can you imagine?",1574401445.0,"11/22/2019, 05:44:05",11,0,72,10.539415070041088,0.87,0.1527777777777778
859,feminism,"Why ""Late-Term Abortion"" Should Be Legal, Accessible, and Safe (Debunking Myths About Late Abortions)",1602673722.0,"10/14/2020, 11:08:42",9,0,71,14.749371838834264,0.83,0.1267605633802817
860,feminism,This happened to me sooo many times.,1588269226.0,"04/30/2020, 17:53:46",12,0,73,13.905425852890914,0.84,0.1643835616438356
861,feminism,me rn,1577289102.0,"12/25/2019, 15:51:42",65,1,73,42.829323118661236,0.63,0.8904109589041096
