,Subreddit,Title,Epoch Time,Date,Comments,Awards,Upvotes,Downvotes,Upvote Ratio,Comment/Upvote Ratio
479,feminism,This has been a PSA. That is all.,1599659532.0,"09/09/2020, 13:52:12",29,1,495,20.084407022085884,0.96,0.05858585858585859
480,feminism,"Scott Pemberton, the US marine who heinously murdered Jennifer Laude, a Filipina trans woman, was set free by PH court &amp; was granted absolute pardon by Philippines president Rodrigo Duterte. The woman was murdered because she was a trans woman. Thus making it a case of femicide.",1599518640.0,"09/07/2020, 22:44:00",39,0,499,36.83436245898383,0.93,0.0781563126252505
481,feminism,In Czech Republic we have an organization to teach students* (and people at all) about consent and they are awesome!,1574332206.0,"11/21/2019, 10:30:06",30,0,491,24.797270791882852,0.95,0.06109979633401222
482,feminism,Should boobs be censored??,1589474503.0,"05/14/2020, 16:41:43",177,0,492,51.305193146266674,0.91,0.3597560975609756
483,feminism,"3rd August is the 6th anniversary of the Yazidi genocide. The international community was silent as women &amp; children were subjected to brutal violence &amp; destruction. 4,800 Yazidi women &amp; children had been captured. 2,800+ Yazidi women &amp; girls remain in ISIS captivity after being sold as sex slaves.",1596514010.0,"08/04/2020, 04:06:50",11,0,490,12.054245496100918,0.98,0.022448979591836733
484,feminism,Women in Science,1597428768.0,"08/14/2020, 18:12:48",9,0,482,10.820816478087295,0.98,0.01867219917012448
485,feminism,Anniversary Day: A misogynist killed these women because they dared to study engineering despite being females.,1575677923.0,"12/07/2019, 00:18:43",14,0,476,11.039463834329979,0.98,0.029411764705882353
486,feminism,"They have also protested the 'Marry-your-rapist' bill. The majority of women’s rights sections in municipalities &amp; civil society organisations focusing on women’s rights have been shut down by the state in Turkey’s Kurdish-majority southeast since 2016, limiting the fight against gendered violence.",1590584150.0,"05/27/2020, 12:55:50",7,0,479,20.124702409435372,0.96,0.014613778705636743
487,feminism,I was sexually harassed and scared for my life,1600035110.0,"09/13/2020, 22:11:50",52,1,478,14.773744594914092,0.97,0.1087866108786611
488,feminism,Mike Bloomberg Accused of Workplace Sexual Harassment,1581970702.0,"02/17/2020, 20:18:22",22,0,469,19.036452464437275,0.96,0.046908315565031986
489,feminism,Reminder that polygamy =/= polyamory and polygamy in Burkina Faso was essentially men owning multiple slave wives. Polygamy has always been used as a patriarchal tool of oppression &amp; control by men over women. Western manarchists have no right to judge sankara taking on institutionalized misogyny.,1594066503.0,"07/06/2020, 20:15:03",12,0,469,36.67359897125078,0.93,0.0255863539445629
490,feminism,Far-right stealing pro-choice vocabulary to protest lockdown,1587491199.0,"04/21/2020, 17:46:39",34,0,466,31.396636641011185,0.94,0.07296137339055794
491,feminism,"Öcalan says that sexism is one of the main ideological pillars of the nation-state. Sexism endows men in the nation-state with power by turning women into sex objects and commodities (e.g. through the rape industry), in addition to women producing offspring and doing unpaid labor.",1597132192.0,"08/11/2020, 07:49:52",49,1,456,39.088995434279695,0.92,0.1074561403508772
492,feminism,I’m sick and tired of how society has just accepted men will harass women,1582260713.0,"02/21/2020, 04:51:53",90,0,462,73.49700832594385,0.86,0.19480519480519481
493,feminism,Free period products to be available in schools and colleges in England,1579419302.0,"01/19/2020, 07:35:02",18,0,459,16.93030897472471,0.96,0.0392156862745098
494,feminism,'Friend' gets pissy when I don't appreciate a rape joke,1597667455.0,"08/17/2020, 12:30:55",54,0,455,36.061994143896015,0.93,0.11868131868131868
495,feminism,NYPD cop seen tossing protester to ground in video under investigation,1590892252.0,"05/31/2020, 02:30:52",14,0,450,16.873976736565623,0.96,0.03111111111111111
496,feminism,"Surprisingly, Major male anarchist thinkers (except Pierre-Joseph Proudhon) strongly supported women's right. Errico Malatesta, Mikhail Bakunin(opposed patriarchy that ""subject women to the absolute domination of men""&amp;""authoritarian juridical family""),EmileArmand(pro-LGBT), Peter Kropotkin etc...",1587550859.0,"04/22/2020, 10:20:59",33,0,449,44.710198302380945,0.91,0.07349665924276169
497,feminism,"""Please refrain from using words such as p*ssy in my classroom.""",1599332852.0,"09/05/2020, 19:07:32",23,0,446,27.336668077438958,0.94,0.0515695067264574
498,feminism,"""Women are property and men value their property"" ...another attempt at using benevolent sexism to bind women.",1579127430.0,"01/15/2020, 22:30:30",37,0,437,19.92416541842141,0.96,0.08466819221967964
499,feminism,"Virginity is a product of heteropatriarchal social construction, and it has absolutely nothing to do with hymen. Virginity test is a form of medical rape.",1573095076.0,"11/07/2019, 02:51:16",47,0,437,23.951215027688875,0.95,0.10755148741418764
500,feminism,Kurdish women tortured by dogs and sexually assaulted during brutal police raid in Turkey,1593414191.0,"06/29/2020, 07:03:11",10,0,443,23.61644701053001,0.95,0.022573363431151242
501,feminism,not all men,1591335336.0,"06/05/2020, 05:35:36",73,0,435,43.89692343914459,0.91,0.167816091954023
502,feminism,"Students of Gargi College, University of Delhi come out in large numbers to protest against the mass molestation of women during the college’s annual fest. Details in comments.",1581609131.0,"02/13/2020, 15:52:11",9,0,435,8.468168513047885,0.98,0.020689655172413793
503,feminism,I keep getting sexually harassed at work and my Title IX complaints are going NOWHERE. I’m getting so fed up and frustrated,1577159763.0,"12/24/2019, 03:56:03",41,0,436,16.41682833498527,0.96,0.09403669724770643
504,feminism,New research shows women are three times more likely than men to experience both threats and acts of sexual violence and assault,1599735608.0,"09/10/2020, 11:00:08",21,0,430,7.496797619636311,0.98,0.04883720930232558
505,feminism,"Karwachauth is a Hindu misogynistic ritual which is glamorized by movies, TV shows, celebrities, &amp; vulgar politicians. There no logic behind it...None at all...how does hunger &amp; thirst on one person (woman mostly) prolong the life of another (man mostly).",1575466286.0,"12/04/2019, 13:31:26",44,0,434,22.032942052040084,0.95,0.10138248847926268
506,feminism,"Members of Turkish-backed Syrian forces have previously published videos of themselves mutilating the body of a female Kurdish fighter &amp; raping a 13-year-old girl at a refugee camp. These Turkish-backed military mercenaries are increasingly subjecting women &amp; girls to rape,abuse &amp; conjugal slavery.",1590400835.0,"05/25/2020, 10:00:35",58,0,427,27.256312888304763,0.94,0.1358313817330211
507,feminism,"I mean, don't blame it on clothes rapists",1603459821.0,"10/23/2020, 13:30:21",10,0,430,7.17425276664477,0.98,0.023255813953488372
508,feminism,Team Lioness: the Kenyan women rangers risking their lives for wildlife,1594634354.0,"07/13/2020, 09:59:14",5,0,427,17.253647443511,0.96,0.0117096018735363
509,feminism,Animals and babies are considered male by default and given he pronouns automatically.,1589038360.0,"05/09/2020, 15:32:40",137,0,429,80.91186814005295,0.84,0.31934731934731936
510,feminism,The right to our own body hair,1589518262.0,"05/15/2020, 04:51:02",122,0,427,38.57630731330954,0.92,0.2857142857142857
511,feminism,I made a free poster for Breonna Taylor,1592695169.0,"06/20/2020, 23:19:29",13,0,428,19.26546145670966,0.96,0.030373831775700934
512,feminism,Fed up of sexist men in my own house.,1590247111.0,"05/23/2020, 15:18:31",41,0,419,25.47477985520709,0.94,0.09785202863961814
513,feminism,I had to miss the funeral of a good friend because of a creepy guy.,1582274838.0,"02/21/2020, 08:47:18",24,0,419,22.666280111934725,0.95,0.057279236276849645
514,feminism,"On Indian TikTok, women are being groped and assaulted because ""it's Holi!""",1583932883.0,"03/11/2020, 13:21:23",38,0,413,21.798981379016084,0.95,0.09200968523002422
515,feminism,Northern Ireland women turning to backstreet abortions and some 'have even attempted suicide' over lack of services,1603886910.0,"10/28/2020, 12:08:30",3,1,413,9.046634764183295,0.98,0.007263922518159807
516,feminism,"This scion of popular science &amp; tech platforms has all the benefits of his class, race, and gender and doesn't bother to investigate the impact of his support of the sex trade or the gig economy apps that actively aids patriarchal colonization of women &amp; girls as a gender class.",1602937392.0,"10/17/2020, 12:23:12",105,1,414,114.21530318530165,0.78,0.2536231884057971
517,feminism,"Hindu Misogyny: The Gauhati High Court has granted divorce to a man, declaring that a woman’s refusal to wear the ritualistic sakha and sindoor demonstrates her cruelty to her husband and his family members.",1593510398.0,"06/30/2020, 09:46:38",38,0,408,30.706026986697907,0.93,0.09313725490196079
518,feminism,"We need more people like him, sadly",1581340058.0,"02/10/2020, 13:07:38",21,0,413,19.472890807905117,0.95,0.05084745762711865
519,feminism,Disgusting post being upvoted...trying not to rage,1584027948.0,"03/12/2020, 15:45:48",54,0,408,44.53081143413772,0.9,0.1323529411764706
520,feminism,"By limiting how girls are allowed to live and express themselves, the Patriarchy raises women who have turned pretence into an art form in order to survive.",1578929634.0,"01/13/2020, 15:33:54",43,0,404,29.819532441931074,0.93,0.10643564356435643
521,feminism,"grown women are not ""girl bosses"" — Ask a Manager",1574876549.0,"11/27/2019, 17:42:29",18,0,409,23.543534692814717,0.95,0.044009779951100246
522,feminism,I want to unlearn everything I know about being a woman,1576575849.0,"12/17/2019, 09:44:09",43,0,406,24.996619190612535,0.94,0.10591133004926108
523,feminism,For the first time in my life I felt discriminated..... And it was by my DAD,1580141520.0,"01/27/2020, 16:12:00",33,0,405,25.52896939765384,0.94,0.08148148148148149
524,feminism,"Sealioning (a type of trolling or harassment which consists of pursuing people with persistent requests for evidence or repeated questions, while maintaining a pretense of civility &amp; sincerity. It may take the form of ""incessant, bad-faith invitations to engage in debate"") &amp; how to deal with it.",1602586256.0,"10/13/2020, 10:50:56",17,2,405,35.67429058253856,0.92,0.04197530864197531
525,feminism,I just sold this hand painted canvas sign to raise funds for BLM charities! More info in comments.,1593901029.0,"07/04/2020, 22:17:09",14,0,405,37.10179751215168,0.92,0.0345679012345679
526,feminism,"“We don’t forgive, we don’t forget” On September 6, 2020 feminist activists broke into the office of the director of the national commission on human rights in Mexico City. The action was taken in protest against a state that does nothing to prevent the killing and rape of girls and women in Mex",1602490477.0,"10/12/2020, 08:14:37",14,0,395,9.386340775440829,0.98,0.035443037974683546
527,feminism,All-female Kenyan wildlife ranger group ‘Team Lioness’ breaks barriers in Africa,1597399139.0,"08/14/2020, 09:58:59",4,0,394,10.17297864631098,0.97,0.01015228426395939
528,feminism,"Suring her time with ISIS, Shamima Begum was in fact working with Hisba, or the “morality police” repressing local Syrian women &amp; gave a telling answer in one of her interviews when asked if she was a danger to society. ""They don't have any evidence against me doing anything dangerous,"" she replied",1598224319.0,"08/23/2020, 23:11:59",9,0,390,30.363752087271337,0.93,0.023076923076923078
529,feminism,"We are facing the 'decriminalisation of rape', warns England &amp; Wales victims' commissioner",1594719805.0,"07/14/2020, 09:43:25",30,1,385,25.817881088606555,0.94,0.07792207792207792
530,feminism,Youtuber H Bomber Man summarizes why the term “simp” has become toxic and misogynistic perfectly. Couldn’t have said it better myself,1597118591.0,"08/11/2020, 04:03:11",27,0,389,38.301081531940326,0.91,0.06940874035989718
531,feminism,Louder for the people at the back,1598034068.0,"08/21/2020, 18:21:08",15,0,383,11.078661260444562,0.97,0.0391644908616188
532,feminism,"Biden Allies calling Kamala Harris ""too ambitious"" is a racist and sexist critique. You will never hear a man be accused of being ""too ambitious.""",1596125506.0,"07/30/2020, 16:11:46",12,0,388,45.46520387450573,0.9,0.030927835051546393
533,feminism,"Catharine MacKinnon: legal definitions of rape should focus on the *presence of coercion"" by the perpetrator, not the absence of consent from the victim. (""Rape Redefined"", 2016)",1602717865.0,"10/14/2020, 23:24:25",22,0,386,5.9712945068926615,0.98,0.05699481865284974
534,feminism,"Notorious RBG, may her memory be a blessing and a revolution.",1600491838.0,"09/19/2020, 05:03:58",4,0,386,6.739136658611699,0.98,0.010362694300518135
535,feminism,"Google Ad Portal Equated “Black Girls”, Latina girls,” and “Asian Girls” with Porn. ""Google’s systems contained a racial bias that equated people of color with objectified sexualization while exempting White people from any associations whatsoever.""",1595712690.0,"07/25/2020, 21:31:30",46,0,382,25.83540679001152,0.94,0.12041884816753927
536,feminism,I quit watching pornography and wrote about it for the HuffPost :-),1590856590.0,"05/30/2020, 16:36:30",54,0,381,44.540988346242216,0.9,0.14173228346456693
537,feminism,"Sex Offenders Were Becoming Cops. After Our Stories, Alaska’s Governor Wants That To End.",1581657592.0,"02/14/2020, 05:19:52",5,0,382,10.004177822771055,0.97,0.013089005235602094
538,feminism,Claim of unequal pay by U.S. women's soccer team dismissed by judge,1588385065.0,"05/02/2020, 02:04:25",92,0,377,38.155512641906114,0.91,0.2440318302387268
539,feminism,"Transgender teen who had been missing for months, Nikki Kuhnhausen's family to speak at public vigil tonight. [1:16]",1576869052.0,"12/20/2019, 19:10:52",31,0,378,36.95463089551697,0.91,0.082010582010582
540,feminism,Director of the research center where I intern made sexist comments about a female job applicant. One of the researchers called out the sexism. The director launches in a tirade about political correctness. I cannot wait for my internship to end. I need to get out of this toxic place.,1593144854.0,"06/26/2020, 04:14:14",29,0,378,19.354666474366468,0.95,0.07671957671957672
541,feminism,"Fed up with escalating gender-based attacks and murders, Mexican women are doing a daylong national strike on March 9th #NiUnaMas",1583028036.0,"03/01/2020, 02:00:36",11,0,373,22.148168519191586,0.94,0.029490616621983913
542,feminism,'Like Ireland on steroids': Malta's abortion taboo leaves women in despair,1592071448.0,"06/13/2020, 18:04:08",10,0,373,12.021684401984203,0.97,0.02680965147453083
543,feminism,"""literal rapists, who publicly defend other rapists, direct films depicting rape, which can only be filmed by having all the violent sex acts actually done to actual women, and these films define sex and sexuality for every child who grows up on the internet.""",1588877585.0,"05/07/2020, 18:53:05",82,0,371,66.01620281789053,0.85,0.2210242587601078
544,feminism,Please join Polish women in our protest! Raise awareness! Abortion is healthcare! Women rights are human rights! (My banner says: we are granddaughters of the witches you couldn’t burn),1604101916.0,"10/30/2020, 23:51:56",16,2,370,9.587329127721375,0.97,0.043243243243243246
545,feminism,The depiction of a female character really bothered me today and I wondered if I'm just overreacting.,1594896354.0,"07/16/2020, 10:45:54",40,0,365,16.55553050823562,0.96,0.1095890410958904
546,feminism,The problem of men in Feminist Spaces,1580396046.0,"01/30/2020, 14:54:06",46,0,366,51.8479481041673,0.88,0.12568306010928962
547,feminism,"Being a provider, protector, and a leader, should not be considered the ""mark of a man"", but the mark of a grown adult.",1599852782.0,"09/11/2020, 19:33:02",17,0,364,16.465847727940456,0.96,0.046703296703296704
548,feminism,"I drew this for Nasrin Sotoudeh, a brave Iranian human rights attorney. She defended, among others, Iranian women who chose not to wear their hijab, and she was sentenced to 38 years in jail because of this. Iranian prisons are full of women who fought against Iran's sexist religious law.",1599000777.0,"09/01/2020, 22:52:57",17,0,363,12.088330358458109,0.97,0.046831955922865015
549,feminism,I am a feminist man but I find myself considering women as sex objects subconsciously and I feel guilty about it.,1599592593.0,"09/08/2020, 19:16:33",117,0,361,70.64092260163363,0.84,0.32409972299168976
550,feminism,The discouragement of women in politics,1591762471.0,"06/10/2020, 04:14:31",51,0,358,20.895095637132215,0.94,0.1424581005586592
551,feminism,Sexism on r/memes,1590326925.0,"05/24/2020, 13:28:45",112,2,364,49.78770996401556,0.88,0.3076923076923077
552,feminism,Happy Pride!,1591318217.0,"06/05/2020, 00:50:17",21,0,353,24.314676507445597,0.94,0.059490084985835696
553,feminism,I am angry and hurt and frustrated. What can I do?,1601553190.0,"10/01/2020, 11:53:10",38,2,353,10.067192098325108,0.97,0.10764872521246459
554,feminism,Federal judge says Georgia’s heartbeat abortion bill is unconstitutional,1594678720.0,"07/13/2020, 22:18:40",1,0,346,13.775845746413665,0.96,0.002890173410404624
555,feminism,"""Essentially, these deepfakes are either being used in order to fulfill some sick fantasy of a shunted lover, or a boyfriend, or just a total creepster. Or they're used as potential blackmail material.” victims could loose jobs or face domestic violence &amp; abuse or both.",1603257941.0,"10/21/2020, 05:25:41",16,1,347,17.619957894278627,0.95,0.04610951008645533
556,feminism,Women occupy headquarters of the National Human Rights Commission in Mexico City,1600002256.0,"09/13/2020, 13:04:16",5,0,348,12.418865304188103,0.97,0.014367816091954023
557,feminism,Behind every successful woman are other women who have her back.,1595220779.0,"07/20/2020, 04:52:59",5,0,345,15.027611500008277,0.96,0.014492753623188406
558,feminism,"Born on this day in 1867: Marie Curie, winner of two Nobel Prizes and the first woman to ever win a NobelPrize.",1573142528.0,"11/07/2019, 16:02:08",15,0,338,9.489990130863362,0.97,0.04437869822485207
559,feminism,Pete Buttigieg’s answer on late-term abortions during 2019 Fox town hall,1602570291.0,"10/13/2020, 06:24:51",1,1,332,4.608801698348714,0.99,0.0030120481927710845
560,feminism,“A fetus’s right to life is debatable. A woman’s is not.”,1582256812.0,"02/21/2020, 03:46:52",28,0,333,21.12921845278572,0.94,0.08408408408408409
561,feminism,Revenge porn is on the rise during lockdown,1589450957.0,"05/14/2020, 10:09:17",13,0,329,17.729742701176065,0.95,0.03951367781155015
562,feminism,"A 14 yr old girl was abducted at knifepoint &amp; then raped over a period of 12 hours by 2 white men,while a 3rd white man filmed parts of the assault. ""The titles of the videos were 'teen crying &amp; getting slapped around','teen getting destroyed','passed out teen'.One had over 400,000 likes.",1581570201.0,"02/13/2020, 05:03:21",46,0,331,29.246684583311776,0.92,0.13897280966767372
563,feminism,N. K. Jemisin Has Been Named a MacArthur Fellow and Recipient of the ’Genius’ Grant,1602017776.0,"10/06/2020, 20:56:16",8,0,325,11.53608121853506,0.97,0.024615384615384615
564,feminism,"“Using b*tch to refer to a person was — and has always been — a way of demeaning someone, specifically a woman.”",1581314714.0,"02/10/2020, 06:05:14",36,0,333,45.928074842842705,0.88,0.10810810810810811
565,feminism,"Maria Ressa, the outspoken CEO of Filipino female-led news outlet Rappler, talks about her upcoming trial, press freedom and Covid-19 restrictions in the Philippines",1586397599.0,"04/09/2020, 01:59:59",1,0,333,20.661234238853694,0.94,0.003003003003003003
566,feminism,On Men’s Refusal To Learn and How It ‘Trains’ Women,1575904134.0,"12/09/2019, 15:08:54",26,0,329,25.1472818984264,0.93,0.0790273556231003
567,feminism,"Coalminer's daughter comes out top in Afghanistan's university entrance exam — Shamsia Alizada, 18, first out of more than 170,000 students",1601076848.0,"09/25/2020, 23:34:08",8,0,327,4.839102638264023,0.99,0.024464831804281346
568,feminism,War Rugs,1581338364.0,"02/10/2020, 12:39:24",13,0,328,17.934800087446433,0.95,0.039634146341463415
569,feminism,Biology has always been used as justification for the oppression of women.,1579218082.0,"01/16/2020, 23:41:22",95,0,327,54.340205906771985,0.86,0.290519877675841
570,feminism,Why The Memeification of Breonna Taylor Is Misogynoir at Its Finest,1600099553.0,"09/14/2020, 16:05:53",11,0,327,22.546166751937903,0.94,0.03363914373088685
571,feminism,Users should be able to block subreddits. Reddit should monitor and remove comments promoting rape culture.,1594927658.0,"07/16/2020, 19:27:38",29,0,323,25.41813802782758,0.93,0.08978328173374613
572,feminism,"A cold case audit launched in 2019 in Nome, Alaska has uncovered evidence that police regularly failed to fully investigate sexual assaults, most of them involving Alaska Native women.",1576996118.0,"12/22/2019, 06:28:38",7,0,318,35.52454613827484,0.9,0.0220125786163522
573,feminism,No is No: Inside Chile’s Feminist Uprising That’s Gone Global,1584623706.0,"03/19/2020, 13:15:06",20,0,321,19.435758626413417,0.94,0.06230529595015576
574,feminism,Police Sexual Violence Is Hidden in Plain Sight | The legal right to sexual violence is part and parcel of policing. This will not end until we eliminate police discretion over women’s bodies.,1595423454.0,"07/22/2020, 13:10:54",5,0,324,12.484762445474473,0.96,0.015432098765432098
575,feminism,Disturbing 'Greta' decal bearing Alta. oilfield company logo drawing criticism,1582855890.0,"02/28/2020, 02:11:30",18,0,318,11.011965944605834,0.97,0.05660377358490566
576,feminism,Sexual violence as a weapon of war,1593574867.0,"07/01/2020, 03:41:07",10,0,317,8.443503491646538,0.97,0.031545741324921134
577,feminism,"Vile MRAs just accused Spanish feminists of spreading Covid-19 ""known to disproportionately infect and kill men easier""(MRA's language). Men are being affected more because they are more likely to have smoking+unhygienic habits, XY chromosomes, lower amounts of oestrogen, weaker immune system etc.",1585277593.0,"03/27/2020, 02:53:13",74,0,318,58.053517232017725,0.85,0.23270440251572327
578,feminism,One in 16 US women were forced into having sex for the first time,1582309292.0,"02/21/2020, 18:21:32",34,0,321,12.94791414906274,0.96,0.1059190031152648
579,feminism,Complements,1591437660.0,"06/06/2020, 10:01:00",41,0,318,24.439323536611028,0.93,0.1289308176100629
580,feminism,Christian misogyny in the USA.,1581774172.0,"02/15/2020, 13:42:52",49,0,312,25.891408824850885,0.92,0.15705128205128205
581,feminism,Ex-gymnastics coach gets 50 years in prison for sex assaults,1579913605.0,"01/25/2020, 00:53:25",11,0,306,8.882290944460067,0.97,0.03594771241830065
582,feminism,"Olga Aleksandrovna Ladyzhenskaya was a Russian mathematician who worked on partial differential equations, fluid dynamics, and the finite difference method for the Navier–Stokes equations.",1578219546.0,"01/05/2020, 10:19:06",17,0,310,21.582974895014615,0.93,0.054838709677419356
583,feminism,"Gender pay gap persists in medicine because of systemic biases, study says",1598878975.0,"08/31/2020, 13:02:55",27,0,311,31.343589716467022,0.91,0.08681672025723473
584,feminism,"Woke up to this. (Random Egyptian guy who I met online, I’m from the US and have talked to this guy all of twice and he sends me this at 8am)",1595165512.0,"07/19/2020, 13:31:52",51,0,305,15.87672839994741,0.95,0.16721311475409836
585,feminism,"BIC made a 'for her' ball pen, a pink one, specifically for women. The Amazon reviews do not disappoint!!!",1596551784.0,"08/04/2020, 14:36:24",23,0,300,16.47036471436644,0.95,0.07666666666666666
586,feminism,"""It's Just A Video"" [CW: Sexual Abuse, Self-Harm, Emotional Trauma]",1595078432.0,"07/18/2020, 13:20:32",10,0,300,16.973411055930967,0.95,0.03333333333333333
587,feminism,"UK woman is allegedly gang-raped, falls victim to revenge porn and is intimidated into withdrawing her accusation with no access to a lawyer. She's now facing one year in prison for ""false allegations"".",1578332240.0,"01/06/2020, 17:37:20",21,0,297,16.759383043203968,0.95,0.0707070707070707
588,feminism,What yall think?,1574054469.0,"11/18/2019, 05:21:09",24,0,293,30.70962936063978,0.91,0.08191126279863481
589,feminism,"Six women of awesome. Debbie Harry of Blondie, Viv Albertine of The Slits, Siouxsie Sioux of the Banshees, Chrissie Hynde of The Pretenders, Poly Styrene of X-Ray Spex and Pauline Black of The Selector. London 1980.",1597853533.0,"08/19/2020, 16:12:13",3,0,291,4.979313668361669,0.98,0.010309278350515464
590,feminism,U.S. House Approves Plan To Install ‘Every Word We Utter’ Women’s Suffrage Monument,1582893914.0,"02/28/2020, 12:45:14",2,0,291,21.094570058612987,0.93,0.006872852233676976
591,feminism,"So called studies that purport to show that women are more likely to watch lesbian porn are done by unscientific entities (e.g,Pornhub etc.) &amp; are exclusive of non-English nations. Also ""more women watch lesbian porn "" line doesn't automatically validate eroticization+fetishisation of lesbian women.",1602430096.0,"10/11/2020, 15:28:16",32,0,282,43.09684499654958,0.87,0.11347517730496454
592,feminism,Please keep Allison Bonilla’s family in your thoughts,1599291167.0,"09/05/2020, 07:32:47",4,0,286,5.255863365902542,0.98,0.013986013986013986
593,feminism,Video Appears to Show Tara Reade’s Mother Knew of Allegations Against Biden in 1993,1587852897.0,"04/25/2020, 22:14:57",22,0,288,45.58993566029454,0.86,0.0763888888888889
