,Subreddit,Title,Epoch Time,Date,Comments,Awards,Upvotes,Downvotes,Upvote Ratio,Comment/Upvote Ratio
257,GreenParty,Democratic Party leaders have no convictions and no backbone. A nationwide uprising for racial justice demands defund the police. Trump calls it the demand of ‘Radical Left Democrats.’ So Democratic leaders cave and join Trump in rejecting it.,1591895565.0,"06/11/2020, 17:12:45",7,0,123,3.994146317264935,0.97,0.056910569105691054
258,GreenParty,Sad how much hate and mean names get thrown my way when democrats hear about how I vote,1590209629.0,"05/23/2020, 04:53:49",19,0,129,4.848654161875288,0.96,0.14728682170542637
259,GreenParty,The US was already in a housing crisis before the coronavirus hit. Now housing distress is accelerating along with the spread of the crisis. Building new public housing should be an important part of the economic recovery from the coronavirus depression.,1585943523.0,"04/03/2020, 19:52:03",10,0,126,1.8055087092570972,0.99,0.07936507936507936
260,GreenParty,"Angela Walker, Green for VP, responds to the Vice Presidential debate",1602158522.0,"10/08/2020, 12:02:02",2,0,125,2.0923041635724218,0.98,0.016
261,GreenParty,Howie Hawkins 2020 Campaign Ad - We Hear You,1600691132.0,"09/21/2020, 12:25:32",12,0,123,6.4801609171879875,0.95,0.0975609756097561
262,GreenParty,It’s coming,1586623106.0,"04/11/2020, 16:38:26",4,0,122,5.368831517944599,0.96,0.03278688524590164
263,GreenParty,CNN’s Andrew Yang Reveals ALARMING INFO About Bloomberg’s Plot to Buy the Nomination,1582470004.0,"02/23/2020, 15:00:04",24,0,123,7.082870922819865,0.95,0.1951219512195122
264,GreenParty,"If you are disgusted by an election between two rapists, your feelings are valid.",1603790676.0,"10/27/2020, 09:24:36",21,0,124,12.490857363928967,0.91,0.1693548387096774
265,GreenParty,UPDATE: thanks to everyone who helped me make up my mind and help me realize I didn't need to vote for Biden,1602383020.0,"10/11/2020, 02:23:40",41,0,119,14.830950706051397,0.89,0.3445378151260504
266,GreenParty,Democrats Defeated Two Medicare for All Candidates in the Democratic Primary in Maine - Vote Green,1594833471.0,"07/15/2020, 17:17:51",29,0,117,2.871202701270846,0.98,0.24786324786324787
267,GreenParty,Trump should just resign. He should get out of the way of the public health officials who are telling us how to slow the spread of COVID-19,1586191997.0,"04/06/2020, 16:53:17",7,0,121,5.602967303881073,0.96,0.05785123966942149
268,GreenParty,Tonight we will be hosting a call for the DSA rank-and-file and other DemExiters to talk about our Left Unity Campaign to provide an independent voice for the working-class.,1590161689.0,"05/22/2020, 15:34:49",9,0,120,2.1376576600708574,0.98,0.075
269,GreenParty,"Angela Walker, candidate for Green Party nomination for Vice President",1588859912.0,"05/07/2020, 13:58:32",0,0,123,0.6960220678434865,0.99,0.0
270,GreenParty,"Green Party can stay on Pennsylvania’s ballot, judge says (Green Party of Pennsylvania, GPUS)",1599762666.0,"09/10/2020, 18:31:06",29,0,117,3.799887258981826,0.97,0.24786324786324787
271,GreenParty,"Who here likes ranked choice voting? If not, what problems do you see?",1596294438.0,"08/01/2020, 15:07:18",39,0,119,1.063105701557845,0.99,0.3277310924369748
272,GreenParty,$41 billion. 5 weeks.,1588009213.0,"04/27/2020, 17:40:13",6,0,115,2.8193905143516673,0.98,0.05217391304347826
273,GreenParty,Sandersnistas DemExiting After the Rigged “Democratic” National Convention.,1583795924.0,"03/09/2020, 23:18:44",66,0,119,15.274120953941747,0.89,0.5546218487394958
274,GreenParty,Greens are the last party on the ballot in NJ.,1603629444.0,"10/25/2020, 12:37:24",21,0,119,9.514839823521953,0.93,0.17647058823529413
275,GreenParty,"Howie Hawkins correctly calls out tonight's ""presidential debate"" as a fraud",1601421880.0,"09/29/2020, 23:24:40",12,0,121,5.300763851259546,0.96,0.09917355371900827
276,GreenParty,Identity Politics on steroids: how the liberal elites will use their favorite Obama female version to crush progressive resistance within and outside the Democratic Party,1597511488.0,"08/15/2020, 17:11:28",17,0,117,3.240259814713511,0.97,0.1452991452991453
277,GreenParty,"102 years ago Eugene Debs delivered a speech in Canton, OH that saw him arrested for violating the Espionage and Sedition Acts. In honor of his speech, Howie Hawkins, the Socialist Party’s 2020 Presidential Candidate, read some segments and provided some commentary on their relevance today.",1592322927.0,"06/16/2020, 15:55:27",4,0,119,3.6088811058993002,0.97,0.03361344537815126
278,GreenParty,Greens reiterate calls for Universal Basic Income – UK Green news round up issue 59,1589185648.0,"05/11/2020, 08:27:28",12,0,116,1.6419335878489534,0.99,0.10344827586206896
279,GreenParty,Cuba found to be the most sustainably developed country in the world,1579033168.0,"01/14/2020, 20:19:28",11,0,115,13.159532562154055,0.9,0.09565217391304348
280,GreenParty,"""Read through my tweets. I’ve always said I endorse GREEN party for 2020. I’ve also put out plenty of statements saying I am not running. I am still not running. Peace ✌️ "" - Jesse Ventura, July 28, 2020",1595958524.0,"07/28/2020, 17:48:44",8,0,115,2.025960847985175,0.98,0.06956521739130435
281,GreenParty,Did anyone else come to Green Party starting in 2016 because of Bernie?,1604189071.0,"11/01/2020, 00:04:31",53,1,127,4.708766825739474,0.96,0.41732283464566927
282,GreenParty,McConnell and the corrupt senate shove a nomination through. Trump will steal the election. Democrats in the comments blame... green party voters? Sigh... I'm tired y'all.,1603759181.0,"10/27/2020, 00:39:41",47,0,115,10.93349340127645,0.91,0.40869565217391307
283,GreenParty,"“The Hawkins-Walker campaign team is out on the streets participating in protests throughout the country. We are in this movement for the long haul. We won’t settle for cosmetic reforms. We want fundamental change in the governance, practices, and culture of policing”",1591361953.0,"06/05/2020, 12:59:13",3,0,119,1.382486089519162,0.99,0.025210084033613446
284,GreenParty,Yes.,1602882517.0,"10/16/2020, 21:08:37",9,0,116,10.042695478107063,0.92,0.07758620689655173
285,GreenParty,Rent strike now like in 1919! ✊😠🏴,1584964143.0,"03/23/2020, 11:49:03",2,0,114,3.3253258061489532,0.97,0.017543859649122806
286,GreenParty,Nancy &amp; Chuck Let Us Down. Vote Green Party. 🌻,1586909998.0,"04/15/2020, 00:19:58",7,0,113,2.1451332169288833,0.98,0.061946902654867256
287,GreenParty,Democrats are in the pocket of the fossil fuel industry,1593536038.0,"06/30/2020, 16:53:58",7,0,115,6.17435546957789,0.95,0.06086956521739131
288,GreenParty,How to shift conservative voters to the Green Party,1603359047.0,"10/22/2020, 09:30:47",7,0,114,3.558313712882608,0.97,0.06140350877192982
289,GreenParty,Are Howie Hawkins posts being shadow banned on r/progressive?,1595007314.0,"07/17/2020, 17:35:14",40,0,113,2.6826566532996026,0.98,0.35398230088495575
290,GreenParty,Cop pepper sprays a medic trying to help screaming woman,1590977034.0,"06/01/2020, 02:03:54",8,0,111,1.73349757119162,0.98,0.07207207207207207
291,GreenParty,Don’t vote for rapists,1587850764.0,"04/25/2020, 21:39:24",0,0,112,6.224474103856409,0.95,0.0
292,GreenParty,If Bernie gets cheated out of the nomination again I’m going Green,1584259770.0,"03/15/2020, 08:09:30",51,1,114,12.09040549648968,0.9,0.4473684210526316
293,GreenParty,The Green Party Should Consider Endorsing Bernie Sanders for President,1582813815.0,"02/27/2020, 14:30:15",165,0,110,7.035493003841992,0.94,1.5
294,GreenParty,"Why whenever people talk about voting third party, 95% of the time people mention the libertarians and never the green party?",1598895941.0,"08/31/2020, 17:45:41",35,0,112,1.6857161953776938,0.99,0.3125
295,GreenParty,The “Democratic” party gloat at the removal of Greens from from the ballot,1600445504.0,"09/18/2020, 16:11:44",36,0,107,5.512061908660229,0.95,0.3364485981308411
296,GreenParty,The Dumbing Down Of America Is Intentional,1599325427.0,"09/05/2020, 17:03:47",6,0,111,7.003577741410069,0.94,0.05405405405405406
297,GreenParty,"Howie Hawkins and Angela Walker, the leading candidates for the Green Party nomination for president and vice president, released the following statement today calling for community control of the police, large-scale federal spending to end poverty, and the decriminalization of drugs.",1592509029.0,"06/18/2020, 19:37:09",6,0,110,2.7662794709392813,0.98,0.05454545454545454
298,GreenParty,The First Green Senator? Lisa Savage interview,1592412347.0,"06/17/2020, 16:45:47",3,0,112,0.649959623436672,0.99,0.026785714285714284
299,GreenParty,Ask a Green Megathread - April 2020,1586196588.0,"04/06/2020, 18:09:48",238,0,108,-0.359513182644136,1.0,2.2037037037037037
300,GreenParty,"“While both parties in power always find money for war, the people’s needs for food, health care, education, living-wage jobs, incomes above poverty, affordable housing, and a real climate action program go unmet.” - Howie Hawkins",1577398833.0,"12/26/2019, 22:20:33",1,0,107,-0.02459746520509043,1.0,0.009345794392523364
301,GreenParty,Howie Hawkins 2020 Campaign Ad: Bernie was Cheated TWICE,1600993679.0,"09/25/2020, 00:27:59",7,1,110,8.2601326770191,0.93,0.06363636363636363
302,GreenParty,Why I Won’t Vote for Biden or Trump,1594581405.0,"07/12/2020, 19:16:45",24,0,108,15.25909458065233,0.88,0.2222222222222222
303,GreenParty,"With this weekend’s victories the Hawkins/Walker Campaign has now won 182 delegates, enough to clinch the Green Party nomination in the 1st round! We’re excited to bring our ecosocialist vision to the general election and fight for the life and death issues facing the working-class!",1592779246.0,"06/21/2020, 22:40:46",6,0,105,4.3342552526446525,0.96,0.05714285714285714
304,GreenParty,Homeowners standing on their own property fired at by police and national guard troops.,1590962789.0,"05/31/2020, 22:06:29",4,0,108,2.064207794792736,0.98,0.037037037037037035
305,GreenParty,Howie - Fighting For Us,1586817298.0,"04/13/2020, 22:34:58",2,0,106,2.16075741013438,0.98,0.018867924528301886
306,GreenParty,Supporting the Green Party thru social media and voting for Bernie Sanders safely thru absentee ballot during the primary will further move the DNC establishment further to the left. This will show them that we are fighting to change the corruption and greed,1586537236.0,"04/10/2020, 16:47:16",5,0,110,5.298428240395467,0.95,0.045454545454545456
307,GreenParty,"Everybody knows the GOP is trash, but Democrats get away with being trash, which is why I call them out more. Also, the Democrats occupy the space of where a real people’s party should be.",1602436616.0,"10/11/2020, 17:16:56",23,0,108,7.2651891195488645,0.94,0.21296296296296297
308,GreenParty,Lisa Savage is IN the Debates!,1598224525.0,"08/23/2020, 23:15:25",5,0,105,1.8879584248076924,0.98,0.047619047619047616
309,GreenParty,BREAKING NEWS: Howie Hawkins Presidential Twitter Account Suspended,1587094312.0,"04/17/2020, 03:31:52",15,0,105,2.6483131206423565,0.98,0.14285714285714285
310,GreenParty,"Ajamu Baraka: ""Folks we are entering a revolutionary period. The embedded class interests of the oligarchs have been exposed and politics will never be the same again in the U.S.""",1585172087.0,"03/25/2020, 21:34:47",5,0,110,3.0193975865692124,0.97,0.045454545454545456
311,GreenParty,"This guy signed a ""unity pledge"" and promised to suppport Joe Biden",1597592153.0,"08/16/2020, 15:35:53",16,0,103,11.86186470031599,0.9,0.1553398058252427
312,GreenParty,It hit 80 degrees in the Arctic this week,1590238026.0,"05/23/2020, 12:47:06",13,0,104,3.584665750091247,0.97,0.125
313,GreenParty,"Despite constituting only 5% of the world's population, Americans consume 24% of the world's energy",1585246685.0,"03/26/2020, 18:18:05",3,0,109,5.795557782453216,0.95,0.027522935779816515
314,GreenParty,"When this is all over, we need to remember it wasn’t the billionaires that saved us. It was the workers. The people who went out everyday, risking infection, to keep society afloat and us alive. The people who went to work to make ends meet because they had no other choice.",1584741352.0,"03/20/2020, 21:55:52",1,0,109,0.6395032704252657,0.99,0.009174311926605505
315,GreenParty,"Members of Congress Own Up to $93 Million in Fossil Fuel Stocks - As dire climate change projections mount, one in four members of Congress is invested in oil, gas, or coal interests",1578150497.0,"01/04/2020, 15:08:17",3,0,102,0.6270065520116361,0.99,0.029411764705882353
316,GreenParty,Biden/Harris Make it Easy to Vote for Socialism,1597340105.0,"08/13/2020, 17:35:05",10,0,105,4.759520675747083,0.96,0.09523809523809523
317,GreenParty,For the 80% of American voters who abstain,1593374009.0,"06/28/2020, 19:53:29",23,0,107,8.595274288769446,0.93,0.21495327102803738
318,GreenParty,"I hope the lack of stimulus for college kids fuck Trump over, Go Green Go",1587347311.0,"04/20/2020, 01:48:31",4,0,105,3.7157581179850183,0.97,0.0380952380952381
319,GreenParty,We have socialism for the rich.,1586897799.0,"04/14/2020, 20:56:39",4,0,105,3.6486030258865867,0.97,0.0380952380952381
320,GreenParty,"Now that Bernie Sanders is out, convince me on your candidate. I'm totally open to voting for the Green Party or DS candidate, I just don't know anything about them.",1586364287.0,"04/08/2020, 16:44:47",24,0,106,3.606871579649834,0.97,0.22641509433962265
321,GreenParty,"Angela Walker, Green Party VP Nominee, On Why She's A Socialist - Essence",1603819154.0,"10/27/2020, 17:19:14",0,0,103,1.7888726226259166,0.98,0.0
322,GreenParty,"The democrats yesterday said the problem with Trump's policies in Venezuela was his ineffectiveness in carrying out the U.S. coup in that country. They should know. Under Obama actions &amp; coups in Honduras, Egypt, Ukraine, Brazil, Syria, Libya proved their effective criminality.",1596656267.0,"08/05/2020, 19:37:47",16,0,104,5.604249825288235,0.95,0.15384615384615385
323,GreenParty,"Creating jobs is meaningless, we should invest in education, automation, universal basic income, and equality across humanity.",1592024336.0,"06/13/2020, 04:58:56",6,0,107,2.021130186609213,0.98,0.056074766355140186
324,GreenParty,The same conversation over and over,1593799989.0,"07/03/2020, 18:13:09",8,0,105,6.689348302550641,0.94,0.0761904761904762
325,GreenParty,Bernie supporter here. Just made my first donation to the cause!,1586885142.0,"04/14/2020, 17:25:42",6,0,103,4.97099909806866,0.95,0.05825242718446602
326,GreenParty,New Report Reveals Banks Funded Climate Chaos with Trillions Since Paris Climate Agreement,1584676204.0,"03/20/2020, 03:50:04",4,0,103,2.9054680972441105,0.97,0.038834951456310676
327,GreenParty,Green Party Candidate Muller Paz Challenges Incumbent Democrat In Baltimore's 12th District,1602592887.0,"10/13/2020, 12:41:27",1,0,100,2.8375024150929846,0.97,0.01
328,GreenParty,"This is just sad: Sierra Club endorses oil shill Hickenlooper, praises his environmental record, no mention of his role pushing oil and gas.",1596899638.0,"08/08/2020, 15:13:58",10,0,103,1.0450587596316296,0.99,0.0970873786407767
329,GreenParty,"Howie Hawkins on the Green New Deal, COVID-19, Israel-Palestine, and Running Mate Angela Walker - The Sanctuary for Independent Media (GPUS)",1589895241.0,"05/19/2020, 13:34:01",0,0,101,2.8830215146206797,0.97,0.0
330,GreenParty,Strategy to vote Green in 2020,1587915685.0,"04/26/2020, 15:41:25",6,0,101,8.641277408185516,0.92,0.0594059405940594
331,GreenParty,Joining the Green Party so I decided to celebrate by making a meme,1583965710.0,"03/11/2020, 22:28:30",25,0,102,11.01999217488617,0.9,0.24509803921568626
332,GreenParty,My wife and I just filled out our ballots today!,1602118478.0,"10/08/2020, 00:54:38",22,0,99,4.530986746465203,0.96,0.2222222222222222
333,GreenParty,"Leaked Bloomberg Tape: ""95% of murderers are minorities and need to be frisked and heavily policed""",1581537830.0,"02/12/2020, 20:03:50",5,0,102,3.1808158268314486,0.97,0.049019607843137254
334,GreenParty,Howie Hawkins says the Supreme Court nomination should wait until after the election,1600983980.0,"09/24/2020, 21:46:20",8,0,96,4.9358183861968,0.95,0.08333333333333333
335,GreenParty,"I don’t know who gave these elitist liberals the confidence to run around shaming people who refuse to blindly obey the “Democratic” party, but they need to be brought back down to earth.",1600088854.0,"09/14/2020, 13:07:34",21,0,99,13.066535105151914,0.88,0.21212121212121213
336,GreenParty,"Howie Hawkins, Green candidate for president - AMA",1598988709.0,"09/01/2020, 19:31:49",4,0,101,2.4299979531006244,0.98,0.039603960396039604
337,GreenParty,The Green Party will be on the right side of history. The democrats won’t. Leave the DNC.,1598449761.0,"08/26/2020, 13:49:21",7,0,101,2.5934096868765124,0.97,0.06930693069306931
338,GreenParty,DSA-backed challenger Franca Muller Paz has a shot at Baltimore's city council - The Real News Network (GPUS),1597878410.0,"08/19/2020, 23:06:50",3,0,100,1.3397225348271604,0.99,0.03
339,GreenParty,Democratic Party Dark Money Groups have spent $70k Trying to Defeat the M4A Progressive in Maine's Senate Race,1596462543.0,"08/03/2020, 13:49:03",10,0,97,1.5463968408724185,0.98,0.10309278350515463
340,GreenParty,DEMOCRATS Are Servants of the War Machine!,1595572892.0,"07/24/2020, 06:41:32",7,0,97,7.242117825124595,0.93,0.07216494845360824
341,GreenParty,U.S. Green Party Candidate | Howie Hawkins for President 2020,1593058180.0,"06/25/2020, 04:09:40",25,0,98,1.9549573189152767,0.98,0.25510204081632654
342,GreenParty,Constantly choosing the lesser of two evils is still choosing evil.,1587080346.0,"04/16/2020, 23:39:06",3,0,97,4.016812381163248,0.96,0.030927835051546393
343,GreenParty,Sign the petition to get more candidates who actually represent you in on the debates!,1596555848.0,"08/04/2020, 15:44:08",1,0,96,0.11271802698830413,1.0,0.010416666666666666
344,GreenParty,Don't miss Howie on C-SPAN Saturday morning at 8:00 AM EDT! Howie will take questions from callers between 8:00 - 8:45 AM EDT.,1594338698.0,"07/09/2020, 23:51:38",2,0,99,4.219344043915314,0.96,0.020202020202020204
345,GreenParty,"Greens surge in French local elections as Anne Hidalgo holds Paris. Socialist mayor retains capital, with Macron’s LREM losing out to the ecology party. - The Guardian",1593433764.0,"06/29/2020, 12:29:24",2,0,101,1.044240210054852,0.99,0.019801980198019802
346,GreenParty,Sanders perfectly exposes twisted establishment priorities surrounding coronavirus pandemic,1584146627.0,"03/14/2020, 00:43:47",3,0,99,3.3974328923277,0.97,0.030303030303030304
347,GreenParty,Why are there so many defeatists and Biden trolls in this subreddit?,1595632412.0,"07/24/2020, 23:13:32",69,0,100,5.1706961524081265,0.95,0.69
348,GreenParty,“Progressive” ™️,1602287953.0,"10/09/2020, 23:59:13",18,0,94,24.98284441068364,0.79,0.19148936170212766
349,GreenParty,"Ranked Choice Voting:""The Way Forward"" webinar series.",1597847620.0,"08/19/2020, 14:33:40",38,0,99,0.6267618784144702,0.99,0.3838383838383838
350,GreenParty,"We need all hands on deck for our ballot access campaign. Now that this whole “Draft Jesse” thing is concluded, it’d be nice to see all these people collecting signatures &amp; making phone calls now.",1595959319.0,"07/28/2020, 18:01:59",4,0,98,2.1755137913057894,0.98,0.04081632653061224
351,GreenParty,"""Trans women will always be part of my feminism"" - an interview with Amelia Womack - Bright Green (Green Party of England and Wales)",1594651835.0,"07/13/2020, 14:50:35",12,0,99,9.656287943143127,0.91,0.12121212121212122
352,GreenParty,"Today would have been revolutionary civil rights leader Malcolm X's 95th birthday. He always got straight to the point when it came to American misleadership, making it clear that working-class people of color were victims of the Republican and Democratic parties. Rest in power.",1589912340.0,"05/19/2020, 18:19:00",0,0,99,4.494624532437371,0.96,0.0
353,GreenParty,Green Is Something To Believe In,1587028201.0,"04/16/2020, 09:10:01",0,0,95,7.426894341950046,0.93,0.0
354,GreenParty,The GreenWave Rises,1585328185.0,"03/27/2020, 16:56:25",15,0,98,8.892560750819243,0.92,0.15306122448979592
355,GreenParty,"Socialists should support Howie Hawkins’ bid for president. Hawkins, a long time UPS worker, has a rounded-out pro-worker platform including Medicare For All, an Eco-socialist Green New Deal &amp; a robust emergency program for the pandemic.",1598028073.0,"08/21/2020, 16:41:13",5,0,93,0.5922183358700579,0.99,0.053763440860215055
356,GreenParty,"The global protests and the fight against capitalism: This is ""the response to decades of unending war, the destruction of basic democratic rights, &amp; a massive concentration of wealth in the hands of a tiny ruling elite""",1591627935.0,"06/08/2020, 14:52:15",1,0,97,2.2612167462703354,0.98,0.010309278350515464
357,GreenParty,For all the Bernie Refugees,1586379299.0,"04/08/2020, 20:54:59",12,0,95,3.4362601132020814,0.97,0.12631578947368421
358,GreenParty,Universal Basic Income this year!??!!! $1000/month for eveyone over 18!?! Please send a letter to your congressperson to support H. RES 897 (UBI for coronavirus crisis) RIGHT NOW!! Only four clicks! Work is done for you!,1584379107.0,"03/16/2020, 17:18:27",4,0,92,7.151769837669519,0.93,0.043478260869565216
359,GreenParty,"Tulsi Gabbard: ""The FBI, CIA or any other intelligence agency should immediately stop smearing presidential candidates with innuendo and vague, evidence-free assertions. That is antithetical to their role in a free democracy. The American people lose faith in our intelligence agencies.",1583093712.0,"03/01/2020, 20:15:12",12,0,92,7.676304402008029,0.92,0.13043478260869565
360,GreenParty,"Biden's ""clean"" energy proposal falls far short of what the Earth needs",1594748150.0,"07/14/2020, 17:35:50",8,0,93,1.1150502423865731,0.99,0.08602150537634409
361,GreenParty,Hello! I am a Twitch streamer and I heavily focus on politics. I am a leftist. I am looking to connect with other progressives so that we can discuss issues oftentimes overlooked by MSM (such as third party candidates). If you are interested in connecting please lmk!,1588819292.0,"05/07/2020, 02:41:32",35,0,93,11.81059882236444,0.89,0.3763440860215054
362,GreenParty,The more you know,1587833142.0,"04/25/2020, 16:45:42",5,0,93,0.9502302451773517,0.99,0.053763440860215055
363,GreenParty,Green Controlled Brighton Council are bringing in Scabs to bust a GMB strike.,1600628447.0,"09/20/2020, 19:00:47",7,0,91,6.608656904417913,0.93,0.07692307692307693
364,GreenParty,Howie Hawkins goes national - Politico,1594654607.0,"07/13/2020, 15:36:47",3,0,91,2.4733576800249466,0.97,0.03296703296703297
365,GreenParty,"Bernie Sanders 2020 Adviser Phillip Agnew on ""Dixiecrat"" Democrats Enabling George Floyd Murder",1590874436.0,"05/30/2020, 21:33:56",6,0,94,3.301930289958591,0.97,0.06382978723404255
366,GreenParty,Im tired of people thinking our vote is meaningless or a wasted vote !,1586679309.0,"04/12/2020, 08:15:09",31,0,89,6.273466749353972,0.93,0.34831460674157305
367,GreenParty,"Our task now is to nurture the solidarity of the present movement and help people understand that if we want to uproot racism, we have to uproot the capitalist system with which racism has been joined at the hip from birth.",1592575937.0,"06/19/2020, 14:12:17",8,0,91,6.492454397786574,0.93,0.08791208791208792
368,GreenParty,New interview Howie did yesterday!,1589287972.0,"05/12/2020, 12:52:52",9,0,89,2.5888906404410363,0.97,0.10112359550561797
369,GreenParty,Working people need our own party. The Democrats and Republicans are both bought and paid for by corporate interests. By standing together and fighting for our values we ensure that our voice rings clear and is not drowned out in the noise of the Democratic Party machine.,1586622423.0,"04/11/2020, 16:27:03",2,0,94,2.9403261192684056,0.97,0.02127659574468085
370,GreenParty,"""When we emerge from the Covid19 crisis we will still have a housing crisis, a health crisis, and a climate crisis, and we need a plan for those. To go into government with no plan for the country isn't particularly responsible,"" Neasa Houriga (Green Party of Ireland TD)",1585519316.0,"03/29/2020, 22:01:56",5,0,91,0.7007006997163927,0.99,0.054945054945054944
371,GreenParty,Green Party’s Muller Paz seeks to unseat Democrat Stokes in Baltimore’s only competitive City Council race - Baltimore Sun,1600954702.0,"09/24/2020, 13:38:22",2,0,89,3.7535339650904547,0.96,0.02247191011235955
372,GreenParty,UN: World could hit 1.5-degree warming threshold by 2024,1594407397.0,"07/10/2020, 18:56:37",11,0,87,2.871356250086933,0.97,0.12643678160919541
373,GreenParty,Cornel West Calls Out Bernie Sanders' Cozy Relationship With Democratic Establishment,1594232823.0,"07/08/2020, 18:27:03",16,0,87,12.373634381934707,0.88,0.1839080459770115
374,GreenParty,Howie Hawkins on the Two Party System / Why You Should Vote Green in 2020,1591738437.0,"06/09/2020, 21:33:57",2,0,86,1.3142185277154397,0.98,0.023255813953488372
375,GreenParty,1991 Bernie with really strong words of encouragement for our Green movement when talking to DSA about the Vermont Progressive Party and independent politics,1583526569.0,"03/06/2020, 20:29:29",3,0,88,1.3974113505753394,0.98,0.03409090909090909
376,GreenParty,"[Dr.Jill Stein] Americans want to know why Bloomberg was in the black book of Jeffrey Epstein, the infamous child sex trafficker who died under mysterious circumstances in an NYC jail. Why isn't the media asking this obvious question? Their silence is deafening. ‪#BlackBookBloomberg‬",1582919860.0,"02/28/2020, 19:57:40",1,0,92,6.202473543000323,0.94,0.010869565217391304
377,GreenParty,"“Voting 3rd party is a waste. If you’re voting for 3rd party, you’re voting for Trump.”",1600889328.0,"09/23/2020, 19:28:48",40,0,89,11.57950167371888,0.88,0.449438202247191
