,Subreddit,Title,Epoch Time,Date,Comments,Awards,Upvotes,Downvotes,Upvote Ratio,Comment/Upvote Ratio
0,GreenParty,Here I Come,1586362525.0,"04/08/2020, 16:15:25",147,1,966,55.518117168799336,0.95,0.15217391304347827
1,GreenParty,I'm a Bernie refugee,1586377257.0,"04/08/2020, 20:20:57",34,0,562,16.043225653958416,0.97,0.060498220640569395
2,GreenParty,This aged well.,1587055124.0,"04/16/2020, 16:38:44",22,0,549,14.692535544670022,0.97,0.04007285974499089
3,GreenParty,Fellow former Bernie Sanders supports let’s come together and change history,1586522893.0,"04/10/2020, 12:48:13",47,0,516,20.04560215649576,0.96,0.09108527131782945
4,GreenParty,When Trump wins because the DNC chose Biden,1586721749.0,"04/12/2020, 20:02:29",16,0,509,16.892219559972318,0.97,0.03143418467583497
5,GreenParty,"The Howie Hate is real, they don't want him to be mainstream",1587101472.0,"04/17/2020, 05:31:12",123,0,462,7.440214146410142,0.98,0.2662337662337662
6,GreenParty,You know the thing,1586702096.0,"04/12/2020, 14:34:56",17,0,465,24.787958591973506,0.95,0.03655913978494624
7,GreenParty,Fellow former Bernie Sanders supporters come join the Green Party,1586453868.0,"04/09/2020, 17:37:48",20,0,459,25.637474289266265,0.95,0.04357298474945534
8,GreenParty,"2 Days Until National Gary Webb Day: August 31, 2020 (Gary's Birthday); Gary Webb's ""Dark Alliance"" exposed DRUG SALES in U.S. cities by the Contras &amp; the CIA funded wars in Latin America. He was found dead from 2 bullet wounds (suicide)in 2004. Maxine Waters found that a U.S. employee ran drugs:",1598775600.0,"08/30/2020, 08:20:00",23,0,451,4.355557919546982,0.99,0.050997782705099776
9,GreenParty,The Green Party is the party of the left progressive movement and the Democratic Party is the party of the center,1586816626.0,"04/13/2020, 22:23:46",44,0,422,21.31791727743382,0.95,0.10426540284360189
10,GreenParty,Come on America stand up for what's right,1589983110.0,"05/20/2020, 13:58:30",92,0,415,7.041263371428897,0.98,0.2216867469879518
11,GreenParty,Green Party 2020 poster,1586626395.0,"04/11/2020, 17:33:15",13,0,406,7.185204353660879,0.98,0.03201970443349754
12,GreenParty,Howie has the gloves out tonight. I like the fire he is showing.,1601437997.0,"09/30/2020, 03:53:17",60,0,411,14.455953699579368,0.97,0.145985401459854
13,GreenParty,One of the best parts about being a Green...,1586884575.0,"04/14/2020, 17:16:15",13,0,388,8.763437912965912,0.98,0.03350515463917526
14,GreenParty,The American dream.,1586953468.0,"04/15/2020, 12:24:28",7,0,386,2.372752149646942,0.99,0.018134715025906734
15,GreenParty,Share widely. This is a police state.,1590925298.0,"05/31/2020, 11:41:38",17,0,382,7.4826325099535325,0.98,0.04450261780104712
16,GreenParty,Kill 2 Parties with 1 Vote,1598100884.0,"08/22/2020, 12:54:44",73,0,375,20.408143694525847,0.95,0.19466666666666665
17,GreenParty,GreenParty2020 🥳,1592624829.0,"06/20/2020, 03:47:09",55,0,370,9.901344692291161,0.97,0.14864864864864866
18,GreenParty,"Party growth in USA presidential elections, 2008 to 2016",1590474530.0,"05/26/2020, 06:28:50",29,0,370,6.7528705460273954,0.98,0.07837837837837838
19,GreenParty,Kentucky just made it harder to vote during a pandemic,1587007312.0,"04/16/2020, 03:21:52",6,0,366,4.952080323635869,0.99,0.01639344262295082
20,GreenParty,"Anybody-But-Trump is not a solution to the life-or-death crises of coronavirus, climate, inequality, nuclear weapons, and democracy. We can't count on Biden, the neoliberal hawk, to stop Trump, the racist incompetent. We need a our own voice!",1588942797.0,"05/08/2020, 12:59:57",60,0,367,24.82283060791167,0.94,0.16348773841961853
21,GreenParty,Howie Hawkins invites Bernie Sanders supporters to join their campaign to continue to fight for socialist solutions through the November election and beyond.,1586375203.0,"04/08/2020, 19:46:43",23,0,355,5.753167535563591,0.98,0.0647887323943662
22,GreenParty,I guess progressives don't want to vote for the candidate who most aligns with their beliefs,1601573114.0,"10/01/2020, 17:25:14",35,0,360,9.58296027398103,0.97,0.09722222222222222
23,GreenParty,The Democrat Deception,1587478503.0,"04/21/2020, 14:15:03",52,0,355,22.863258645553003,0.94,0.14647887323943662
24,GreenParty,Why do they feel like they own us?,1603849902.0,"10/28/2020, 01:51:42",54,0,354,19.436328721670236,0.95,0.15254237288135594
25,GreenParty,“All you have to do is listen and respect the law”,1598543091.0,"08/27/2020, 15:44:51",4,0,353,9.631861321532938,0.97,0.0113314447592068
26,GreenParty,‘Chickenshit’,1588607859.0,"05/04/2020, 15:57:39",7,0,345,8.066646671789044,0.98,0.020289855072463767
27,GreenParty,Take the green pill,1586606537.0,"04/11/2020, 12:02:17",27,0,348,14.630614036443603,0.96,0.07758620689655173
28,GreenParty,The worst part of a society manipulated by politics is to see the poor defending the rich who are responsible for their poverty.,1587905608.0,"04/26/2020, 12:53:28",19,0,338,7.459204492429251,0.98,0.05621301775147929
29,GreenParty,A vote for Biden is a vote for Trump!,1587831697.0,"04/25/2020, 16:21:37",9,0,344,27.689279062960168,0.93,0.02616279069767442
30,GreenParty,"Don’t worry guys, first we’ll elect Joe and then we’ll push him to the left. He has to go to the left when he’s president right?",1603418388.0,"10/23/2020, 01:59:48",125,0,348,47.06047068653561,0.88,0.35919540229885055
31,GreenParty,When Twitter suspends Howie’s account for “impersonation”😡,1587147479.0,"04/17/2020, 18:17:59",9,0,338,4.068591761119308,0.99,0.026627218934911243
32,GreenParty,"If not now, when?",1603496022.0,"10/23/2020, 23:33:42",23,0,341,14.271911642070393,0.96,0.06744868035190615
33,GreenParty,Lightning fast reporting.,1586782333.0,"04/13/2020, 12:52:13",5,0,341,5.621294758004751,0.98,0.01466275659824047
34,GreenParty,The green party we need,1587251774.0,"04/18/2020, 23:16:14",70,0,340,37.94474042677189,0.9,0.20588235294117646
35,GreenParty,"You don’t have to be a Green to appreciate this one, but it helps :)",1600805917.0,"09/22/2020, 20:18:37",9,0,335,7.352235972913718,0.98,0.026865671641791045
36,GreenParty,#VoteForABetterTomorrow,1588892172.0,"05/07/2020, 22:56:12",25,0,328,14.753096422500107,0.96,0.07621951219512195
37,GreenParty,Hmm smells fishy here,1590787116.0,"05/29/2020, 21:18:36",18,0,327,9.041818226009866,0.97,0.05504587155963303
38,GreenParty,The Left has no future in the Democratic Party,1590089200.0,"05/21/2020, 19:26:40",30,0,323,17.37077439041832,0.95,0.09287925696594428
39,GreenParty,I'M AN OBAMA DEMOCRAT,1586870131.0,"04/14/2020, 13:15:31",3,0,327,13.630779036675676,0.96,0.009174311926605505
40,GreenParty,"I am a former Sanders staffer. Let's go, Howie.",1586638826.0,"04/11/2020, 21:00:26",68,0,321,7.329589301888234,0.98,0.2118380062305296
41,GreenParty,No State shall make or enforce any law which shall abridge the privileges or immunities of citizens within the United States - unless they don't want to join your political party.,1598437007.0,"08/26/2020, 10:16:47",32,0,308,6.527402411719038,0.98,0.1038961038961039
42,GreenParty,Howie Hawkins is the only presidential candidate who supports an economic bill of rights which will ultimately lessen the growing wealth inequality seen in our country.,1596154873.0,"07/31/2020, 00:21:13",7,0,306,12.60007350830989,0.96,0.02287581699346405
43,GreenParty,Trying to convince people to vote Green,1589826978.0,"05/18/2020, 18:36:18",34,0,307,10.197015361321348,0.97,0.11074918566775244
44,GreenParty,"Exactly what I feel about the DNC, the old white man and the functional neoliberal Kamala!",1597206077.0,"08/12/2020, 04:21:17",9,0,307,10.955373227895336,0.97,0.029315960912052116
45,GreenParty,#2020 and every four years since I turned 18,1601036205.0,"09/25/2020, 12:16:45",19,0,308,16.975049492857636,0.95,0.06168831168831169
46,GreenParty,The Democrats have become the party of centrists,1586480385.0,"04/10/2020, 00:59:45",46,0,303,8.814143656939166,0.97,0.15181518151815182
47,GreenParty,The Senate just voted to give the FBI the power to warrentlessly search your browsing history. Bernie Sanders could have stopped it. He didn't.,1589394591.0,"05/13/2020, 18:29:51",68,0,297,33.57812613144927,0.9,0.22895622895622897
48,GreenParty,The sub hit 15.0k,1587163278.0,"04/17/2020, 22:41:18",19,0,294,5.857669409873722,0.98,0.06462585034013606
49,GreenParty,I guess Joe Biden got access to his own Twitter account,1587399248.0,"04/20/2020, 16:14:08",19,0,297,37.24855922014842,0.89,0.06397306397306397
50,GreenParty,"Solidarity with both campaigns! Howie campaign protesting the debates in Cleveland, Ohio on September 29th (link in comments)",1600455190.0,"09/18/2020, 18:53:10",37,0,284,12.478400611875657,0.96,0.13028169014084506
51,GreenParty,For too long the capitalist class and their puppets in the major parties have put profits above the working-class' needs. It's time to put workers in the White House!,1588783900.0,"05/06/2020, 16:51:40",13,0,285,2.9607031625907894,0.99,0.0456140350877193
52,GreenParty,Bernie Endorsed Biden. Still Not Voting Joe? Vote Green.,1586850545.0,"04/14/2020, 07:49:05",9,0,278,16.16886701003358,0.95,0.03237410071942446
53,GreenParty,"Biden‘s all-of-the-above energy policy is a path to climate catastrophe. The climate science is clear, its bought and paid for politicians standing in the way of real change.",1587564326.0,"04/22/2020, 14:05:26",16,0,277,5.0392021925126755,0.98,0.05776173285198556
54,GreenParty,Every discussion with a Democrat,1588793183.0,"05/06/2020, 19:26:23",2,0,271,1.8288773484393346,0.99,0.007380073800738007
55,GreenParty,"Everyone attacking her is a Democrat, let that sink in. Not a single on is a Republican",1587226771.0,"04/18/2020, 16:19:31",38,0,275,14.646188541392462,0.95,0.13818181818181818
56,GreenParty,F@#k the 2 party system! Vote Green 💚,1598734269.0,"08/29/2020, 20:51:09",7,0,270,8.83046069138544,0.97,0.025925925925925925
57,GreenParty,Redirect USA Liberal bullying energy towards the DNC,1596992027.0,"08/09/2020, 16:53:47",17,0,270,10.351249970577953,0.96,0.06296296296296296
58,GreenParty,Republican who will be voting Green,1587358206.0,"04/20/2020, 04:50:06",63,0,267,3.3596421474249496,0.99,0.23595505617977527
59,GreenParty,Where does Howie Hawkins Campaign on the issues?,1586446951.0,"04/09/2020, 15:42:31",20,0,269,5.905134797738185,0.98,0.07434944237918216
60,GreenParty,"They may have took you off the ballot here in PA, but you’ll have at least one here Howie.",1601937398.0,"10/05/2020, 22:36:38",49,0,269,28.14425928980097,0.91,0.1821561338289963
61,GreenParty,For those tired of explaining it,1599193000.0,"09/04/2020, 04:16:40",31,0,263,16.33010969685563,0.94,0.11787072243346007
62,GreenParty,Platform,1597358550.0,"08/13/2020, 22:42:30",69,0,265,5.2066550560031715,0.98,0.26037735849056604
63,GreenParty,Found this gem in a well written post,1601329358.0,"09/28/2020, 21:42:38",64,0,262,18.687039445886683,0.93,0.24427480916030533
64,GreenParty,Honk Honk,1591555853.0,"06/07/2020, 18:50:53",7,0,258,5.5850680919213005,0.98,0.027131782945736434
65,GreenParty,America is in dire need of a Green New Deal president. We can’t afford to continue to elect leaders who will make incremental to no change. Time is running short &amp;amp; radical change is needed. 🌻,1587313033.0,"04/19/2020, 16:17:13",32,0,260,10.273940886931541,0.96,0.12307692307692308
66,GreenParty,Silence Speaks Louder Than Words.,1595689938.0,"07/25/2020, 15:12:18",18,0,260,5.352254959129311,0.98,0.06923076923076923
67,GreenParty,"Angela Walker is a veteran working-class activist with decades of experience working for racial and economic justice in social movements, unions, and as an independent socialist candidate.",1588729335.0,"05/06/2020, 01:42:15",10,0,260,4.23739954572352,0.98,0.038461538461538464
68,GreenParty,I could stand in the middle of Fifth Avenue and rape somebody and I wouldn't lose any voters.,1588413956.0,"05/02/2020, 10:05:56",18,0,258,7.519772948699597,0.97,0.06976744186046512
69,GreenParty,You Guys Taking In Former Bernie Supporters Now He’s Dropped Out?,1586362424.0,"04/08/2020, 16:13:44",50,0,251,5.770702125024798,0.98,0.199203187250996
70,GreenParty,Don’t feel ashamed for voting for the political party most-aligned to your views.,1597303335.0,"08/13/2020, 07:22:15",38,0,251,7.99424463723625,0.97,0.15139442231075698
71,GreenParty,The U.S. doesn’t have to settle.,1593927985.0,"07/05/2020, 05:46:25",28,0,246,5.9986615309645686,0.98,0.11382113821138211
72,GreenParty,What do you guys think of my memes? pt. 2,1593446114.0,"06/29/2020, 15:55:14",44,1,247,12.202715874276237,0.95,0.17813765182186234
73,GreenParty,The Green Party needs to grow in order to counterbalance the Libertarians,1587778367.0,"04/25/2020, 01:32:47",27,0,243,5.95440481388394,0.98,0.1111111111111111
74,GreenParty,Jill Stein - Blaming Green voters for Trump’s win is BS. You want to claim Green votes but erase Libertarians &amp; 100M who stayed home? Assuming Green votes *belonged* to HRC exemplifies the arrogance that's driven many to run from the DNC. You can't just bully people into voting for you.,1601156761.0,"09/26/2020, 21:46:01",31,1,244,8.374723320385783,0.97,0.12704918032786885
75,GreenParty,"I want Trump out, but I don’t want Biden",1591178390.0,"06/03/2020, 09:59:50",104,0,247,11.884676778119228,0.95,0.42105263157894735
76,GreenParty,"Pledge to VOTE GREEN on or before November 3rd, 2020 to help the Green Party reach 5%!",1588006105.0,"04/27/2020, 16:48:25",31,1,247,7.361104292475915,0.97,0.12550607287449392
77,GreenParty,"Howie Hawkins, the Green Party candidate for President, said that he would redress past and ongoing injustices against Native Americans by honoring treaties, renaming the federal Columbus Day holiday as Indigenous People’s Day, and ending the systemic discrimination against indigenous people",1602507382.0,"10/12/2020, 12:56:22",3,0,243,4.464573308362816,0.98,0.012345679012345678
78,GreenParty,Green meme,1597271820.0,"08/12/2020, 22:37:00",16,0,242,2.3345972267447905,0.99,0.06611570247933884
79,GreenParty,A vote for Hawkins/Walker is a vote for left unity,1602444425.0,"10/11/2020, 19:27:05",36,0,244,24.600167231565138,0.91,0.14754098360655737
80,GreenParty,Subscribe to r/HowieHoes to join the Big Green Meme Team,1586725170.0,"04/12/2020, 20:59:30",6,0,239,7.909925221678975,0.97,0.02510460251046025
81,GreenParty,Happy Birthday to Karl Marx!,1588683400.0,"05/05/2020, 12:56:40",32,0,244,10.328300617182862,0.96,0.13114754098360656
82,GreenParty,more relevant than ever,1588175997.0,"04/29/2020, 15:59:57",1,0,235,4.831318217292591,0.98,0.00425531914893617
83,GreenParty,Rent doesn't wait on Congress.,1587545818.0,"04/22/2020, 08:56:58",26,0,234,6.245255432946067,0.97,0.1111111111111111
84,GreenParty,Green Party candidate accuses Twitter of censorship after campaign account suspended - Washington Times,1587334935.0,"04/19/2020, 22:22:15",8,0,234,4.35998270295255,0.98,0.03418803418803419
85,GreenParty,Type of recycling we do not approve of,1602695162.0,"10/14/2020, 17:06:02",20,1,234,6.0122536090492815,0.97,0.08547008547008547
86,GreenParty,Two of the many pins I have pressed for Green Party Supporters :),1599717860.0,"09/10/2020, 06:04:20",22,0,235,7.962255779770118,0.97,0.09361702127659574
87,GreenParty,"The Green Party is committed to building power independent of the capitalist parties. That means that we are running no matter who wins the Democratic Party nomination, providing you with a real alternative in November.",1584105758.0,"03/13/2020, 13:22:38",53,0,226,4.757186991564964,0.98,0.2345132743362832
88,GreenParty,The road to Trump was paved by the Democrats’ lesser-evil politics. We cannot count on those who have created the life and death crises we face to solve them. The working class cannot count on the capitalist parties to deliver on our issues. We need our own party! We need our own voice!,1589473065.0,"05/14/2020, 16:17:45",21,0,227,5.685839971628354,0.98,0.09251101321585903
89,GreenParty,"America, this is your ticket for socialist unity in 2020. Join us and let's change the US Left for good.",1591052411.0,"06/01/2020, 23:00:11",10,0,222,10.831007661208162,0.95,0.04504504504504504
90,GreenParty,Why the Green Party should not endorse Jesse Ventura,1588257861.0,"04/30/2020, 14:44:21",180,0,227,31.057975757981183,0.88,0.7929515418502202
91,GreenParty,Democrats only go for symbolic wins because they share the same corporate donors as the GOP. The article is linked in the comments,1602777546.0,"10/15/2020, 15:59:06",28,0,222,14.977199449630888,0.94,0.12612612612612611
92,GreenParty,"No time left for the ""lesser of two evils"": The planet is already dying",1589050788.0,"05/09/2020, 18:59:48",144,0,222,1.8945629034861895,0.99,0.6486486486486487
93,GreenParty,"I hope everyone will be able to vote like this soon. My vote will ultimately go to Biden, but I did what I could. #RCV",1603768451.0,"10/27/2020, 03:14:11",92,0,227,12.075734586951484,0.95,0.4052863436123348
94,GreenParty,I was a republican who voted Green Party in the 2020 general election,1602045593.0,"10/07/2020, 04:39:53",45,1,217,7.4757024517434445,0.97,0.2073732718894009
95,GreenParty,Made with google slides,1586970216.0,"04/15/2020, 17:03:36",16,0,221,8.360550496204496,0.96,0.07239819004524888
96,GreenParty,This is you EVERY time you comment about your voting intentions.,1599807277.0,"09/11/2020, 06:54:37",52,0,212,6.113616993730233,0.97,0.24528301886792453
97,GreenParty,Howie Hawkins is the only 2020 presidential candidate who supports ending the rampant government overreach which has ultimately lead to the current American police state.,1596075670.0,"07/30/2020, 02:21:10",13,0,213,13.250286741001304,0.94,0.06103286384976526
98,GreenParty,"Howie Hawkins, Madeline Hoffman and Craig Cayento handed out free ice cream to Garden State Greens &amp; Young EcoSocialists yesterday",1601729202.0,"10/03/2020, 12:46:42",29,0,214,8.327160487228781,0.96,0.13551401869158877
99,GreenParty,Time for a party for the people.,1586855826.0,"04/14/2020, 09:17:06",7,0,214,9.601343757298508,0.96,0.03271028037383177
100,GreenParty,"“I’d rather vote for something I want and not get it then vote for something I don’t want, and get it.” - Eugene Debs",1604061968.0,"10/30/2020, 12:46:08",11,0,215,7.874219058114193,0.96,0.05116279069767442
101,GreenParty,"We need to legalize marijuana and decriminalize other drugs, ending the Drug War and taking a major step towards ending mass incarceration.",1591301384.0,"06/04/2020, 20:09:44",7,0,213,-0.6959874845296667,1.0,0.03286384976525822
102,GreenParty,I voted my conscience.,1603482024.0,"10/23/2020, 19:40:24",45,1,211,13.677640604236757,0.94,0.2132701421800948
103,GreenParty,Most Americans defend capitalism as if they are a billionaire and this predatory economic system is working for them. Wake up. You are not a billionaire. We are in late-stage capitalism. It is killing us and our planet and it is time for an eco-socialist economy.,1599374533.0,"09/06/2020, 06:42:13",19,0,207,5.662697462038864,0.97,0.09178743961352658
104,GreenParty,"Change the dynamics of elections. Give the voter the freedom to choose among many options,instead of being demanded to show party loyalty.",1604002060.0,"10/29/2020, 20:07:40",23,1,214,8.902012067522577,0.96,0.10747663551401869
105,GreenParty,Officially voting Green this year...,1587963470.0,"04/27/2020, 04:57:50",35,0,205,8.025106272369243,0.96,0.17073170731707318
106,GreenParty,The government today is the direct result of you choosing the lesser of two evils for generations.,1586936000.0,"04/15/2020, 07:33:20",63,0,204,8.857781701410516,0.96,0.3088235294117647
107,GreenParty,Just voted in Florida!,1603657502.0,"10/25/2020, 20:25:02",35,0,206,29.405897294907078,0.88,0.16990291262135923
108,GreenParty,The Hawkins/Walker Campaign are now 81% of the way to securing the Green Party nomination!,1591795587.0,"06/10/2020, 13:26:27",30,0,204,4.751533642368713,0.98,0.14705882352941177
109,GreenParty,Please be patient with us dejected Bernie supporters,1586432755.0,"04/09/2020, 11:45:55",17,0,201,6.551190978674498,0.97,0.0845771144278607
110,GreenParty,The Green Party is committed to peace. We must lead in ending our country’s immoral &amp; unsustainable never ending wars &amp; reverse our worldwide military presence.,1588530828.0,"05/03/2020, 18:33:48",18,0,201,-0.11240263620206292,1.0,0.08955223880597014
111,GreenParty,Little Joke I made for people since I am now registered Green,1587681280.0,"04/23/2020, 22:34:40",38,0,205,5.872767801387596,0.97,0.18536585365853658
112,GreenParty,"Just voted Green for President for the first time ever, and my conscience is clear for the first time ever.",1602379553.0,"10/11/2020, 01:25:53",26,1,202,18.41879713625042,0.92,0.12871287128712872
113,GreenParty,First presidential election voting green!,1602733042.0,"10/15/2020, 03:37:22",9,1,197,8.218729535567974,0.96,0.04568527918781726
114,GreenParty,Read it and Weep!,1604243423.0,"11/01/2020, 15:10:23",103,4,205,32.9245990731649,0.86,0.5024390243902439
115,GreenParty,Let’s get to 5%!!!,1603935292.0,"10/29/2020, 01:34:52",14,1,197,16.736515039066234,0.92,0.07106598984771574
116,GreenParty,New York is a safe blue state so Democrats can vote Green and feel good about it because it will have absolutely no effect on the outcome of the election,1602861627.0,"10/16/2020, 15:20:27",39,0,192,6.607249077744939,0.97,0.203125
117,GreenParty,When the FCC tells Chris Hedges he can't run for office because he has a TV show,1590692409.0,"05/28/2020, 19:00:09",12,0,190,3.6186370388985836,0.98,0.06315789473684211
118,GreenParty,"Both Trump and Biden bring more environmental destruction, more endless wars, more rising inequality. We need solutions to these life and death issues. We need an Ecosocialist Green New Deal!",1589211824.0,"05/11/2020, 15:43:44",81,0,194,39.9991547092998,0.83,0.4175257731958763
119,GreenParty,Howie joined the good people of BLM to show support and fight injustice,1591640270.0,"06/08/2020, 18:17:50",6,0,188,3.1586441260335505,0.98,0.031914893617021274
120,GreenParty,"If There Is to Be Any Future for the U.S. Left, We Must Break with Sanders and the Democrats",1598285241.0,"08/24/2020, 16:07:21",72,0,193,22.68037202518329,0.89,0.37305699481865284
121,GreenParty,"Malcolm X: ""The white liberal differs from the white conservative only in one way; the liberal is more deceitful, more hypocritical than the conservative"" Joe Biden, who wrote the Crime Bill, opposed desegration, &amp; proposed a Cop Bill of Rights, is the perfect example of what X is saying",1592145613.0,"06/14/2020, 14:40:13",17,0,192,9.385912495574786,0.95,0.08854166666666667
122,GreenParty,"""The Green Party is not “bankrolled by Republicans.” That just is not true. We do not support Republicans. We had 0 Republicans at our national convention."" - Ohio Green Party 🌻 on Twitter",1600277543.0,"09/16/2020, 17:32:23",32,0,190,8.844973646212765,0.96,0.16842105263157894
123,GreenParty,The Democratic Party does not believe in direct democracy,1600388445.0,"09/18/2020, 00:20:45",29,0,185,33.72004071456499,0.85,0.15675675675675677
124,GreenParty,Chris Hedges to run for Congress on Green Party line,1590597237.0,"05/27/2020, 16:33:57",40,1,190,-0.8547979317215777,1.0,0.21052631578947367
125,GreenParty,"just voted for the first time in my life, I really hope my generation is the one to bring about change!",1604120088.0,"10/31/2020, 04:54:48",35,0,188,12.202680995685597,0.94,0.18617021276595744
126,GreenParty,Gallup: MAJORITY Of Americans Want A Third Party,1601999520.0,"10/06/2020, 15:52:00",17,0,189,8.07633171077876,0.96,0.08994708994708994
127,GreenParty,I do not believe it is true democracy if every candidate doesn't have the same opportunity for their ideas to be heard. Sign this petition for Jo Jorgensen and Howie Hawkins to take the debate stage alongside Trump and Biden.,1592902119.0,"06/23/2020, 08:48:39",11,0,185,4.460754789201985,0.98,0.05945945945945946
128,GreenParty,Democrats are trying to knock Green Party presidential candidate Howie Hawkins off the ballot in Pennsylvania. (we beat the petition challenge but the court battles still refuse to end) (GPUS),1599669996.0,"09/09/2020, 16:46:36",42,0,185,6.700440846286796,0.97,0.22702702702702704
129,GreenParty,"Receiving 5% of the popular vote means qualifying for federal funding. These funds could be used for more voter out reach, funding litigation, increased ballot access initiatives, paid regional organizers and much more",1598703467.0,"08/29/2020, 12:17:47",15,0,186,11.970726945139376,0.94,0.08064516129032258
130,GreenParty,HOWIE!!!! +1 Green,1603371082.0,"10/22/2020, 12:51:22",55,0,184,15.667336076841025,0.92,0.29891304347826086
131,GreenParty,"“The Republican and Democratic parties, or, to be more exact, the Republican-Democratic party, represent the capitalist class in the class struggle. They are the political wings of the capitalist system and such differences as arise between them relate to spoils and not to principles.”",1603205417.0,"10/20/2020, 14:50:17",3,0,181,6.008162799830586,0.97,0.016574585635359115
132,GreenParty,Democrats have always been good at pretending to listen to the working class - and that's all they will ever do to stay in power.,1594767534.0,"07/14/2020, 22:58:54",20,0,180,5.2940967441692806,0.97,0.1111111111111111
133,GreenParty,I'm now a proud Howie Ho,1586380020.0,"04/08/2020, 21:07:00",12,0,186,2.843020351083595,0.98,0.06451612903225806
134,GreenParty,Howie Hawkins 2020 Baby!!! Lets get 5 percent of the Vote!!!,1603923704.0,"10/28/2020, 22:21:44",36,2,179,17.50818080034938,0.91,0.2011173184357542
135,GreenParty,Green Party now has mathematically possible path to presidency,1588281519.0,"04/30/2020, 21:18:39",28,0,177,9.97014835062484,0.95,0.15819209039548024
136,GreenParty,Now is NOT the time to vote Third Party,1602855430.0,"10/16/2020, 13:37:10",75,0,178,22.868058568014277,0.89,0.42134831460674155
