,Subreddit,Title,Epoch Time,Date,Comments,Awards,Upvotes,Downvotes,Upvote Ratio,Comment/Upvote Ratio
502,GreenParty,Announcement of formation of Green Party USA in 1991 via CSPAN archives (featuring Howie Hawkins calling for the same policies we're all calling for today),1586448131.0,"04/09/2020, 16:02:11",0,0,63,1.1630775377846732,0.98,0.0
503,GreenParty,"Bernie just dropped out unfortunately, but I am now all in for Cal for Green Party. From CA for Bernie to CA for Green. Here’s why-",1586366860.0,"04/08/2020, 17:27:40",4,0,60,4.491145937344626,0.93,0.06666666666666667
504,GreenParty,"a reporter from corporate media asked me, isn't it selfish that essential and frontline workers at Instacart, Amazon, and hospitals are going on strike, when we have a pandemic? Wanna talk about selfish: let's talk about the billionaires.",1585637752.0,"03/31/2020, 06:55:52",3,0,60,4.586518921787871,0.93,0.05
505,GreenParty,"Under a capitalist system, we cannot solve the central problems of our time. The only way to create a just society and to save our environment is for us to build toward Ecosocialism.",1581976292.0,"02/17/2020, 21:51:32",8,0,64,5.297344728717405,0.92,0.125
506,GreenParty,If Bernie loses the nomination,1581526498.0,"02/12/2020, 16:54:58",27,0,61,8.029831996519647,0.88,0.4426229508196721
507,GreenParty,"""Facts: Like it or not the Green Party is only major electoral party that has been consistently Anti-War, that links climate change &amp; militarism, the only party that supports reparations, the party that produced original Green New Deal that was stolen &amp; distorted by Democrats."" - Ajamu Baraka",1579266586.0,"01/17/2020, 13:09:46",8,0,62,7.128126873361381,0.9,0.12903225806451613
508,GreenParty,Ranked-Choice Voting Could Play A Deciding Role In Maine's Senate Race - NPR,1602292365.0,"10/10/2020, 01:12:45",5,0,60,1.0745539835540185,0.98,0.08333333333333333
509,GreenParty,"Join Howie for a conversation with Aidan Hill, Green Party Mayoral Candidate for Berkeley, CA tonight at 7:30 PM EST/Noon PDT",1596806621.0,"08/07/2020, 13:23:41",2,0,62,1.6836174832890904,0.97,0.03225806451612903
510,GreenParty,"With the Green Party Presidential Nominating Convention this week, we have a number of campaign team members who will be doing workshops as part of the convention. Check out our teams workshops and the rest of the schedule!",1594221349.0,"07/08/2020, 15:15:49",1,0,63,3.1681615502052836,0.95,0.015873015873015872
511,GreenParty,Uniting the Left to Fight for an Ecosocialist United Ireland,1591540019.0,"06/07/2020, 14:26:59",3,0,63,1.3318561994261557,0.98,0.047619047619047616
512,GreenParty,"Third parties call for ballot access relief - Pittsburgh Post-Gazette (Green Party of Pennsylvania, GPUS)",1586285376.0,"04/07/2020, 18:49:36",2,0,62,0.7373384508039678,0.99,0.03225806451612903
513,GreenParty,Judge orders Green Party candidates off MT's Nov. 3 ballot,1596837478.0,"08/07/2020, 21:57:58",18,0,59,5.746083720926023,0.91,0.3050847457627119
514,GreenParty,"What Rage Against the Machine Was Talking About, Part 4",1595873787.0,"07/27/2020, 18:16:27",1,0,56,3.908613667249689,0.93,0.017857142857142856
515,GreenParty,'Putting nature first' could create nearly 400 million jobs by 2030,1594971084.0,"07/17/2020, 07:31:24",2,0,58,2.0923728498352645,0.97,0.034482758620689655
516,GreenParty,The Keystone Oil Spill No One is Talking About Will Be Nearly Impossible to Clean Up,1574520258.0,"11/23/2019, 14:44:18",1,0,63,3.778332532626095,0.94,0.015873015873015872
517,GreenParty,“Congrats to Councilmember Kshama Sawant on her reelection to the Seattle City Council! Socialism Will Win!“ - Howie Hawkins,1573339931.0,"11/09/2019, 22:52:11",3,0,62,3.510447975698753,0.95,0.04838709677419355
518,GreenParty,Steven Breedlove joins the race for Chico’s District 3 seat (Green Party of California),1599268947.0,"09/05/2020, 01:22:27",14,0,58,2.987007400128036,0.95,0.2413793103448276
519,GreenParty,TAKE THE GREEN PILL INSTEAD 💚💚💚,1594764576.0,"07/14/2020, 22:09:36",9,0,58,6.861823081210574,0.89,0.15517241379310345
520,GreenParty,Here we go again: neoliberal machine prepares ground to blame the Greens for a potential Biden defeat in November,1593958507.0,"07/05/2020, 14:15:07",13,0,57,3.9370423474368366,0.94,0.22807017543859648
521,GreenParty,"Green Party presidential nominee Howie Hawkins flew from Syracuse to Nashville today for the final presidential debate of the 2020 election, even though he has been shut out of the event",1603559133.0,"10/24/2020, 17:05:33",14,0,59,0.18874212062524975,1.0,0.23728813559322035
522,GreenParty,"In First, Union Endorses Third-Party Candidate (Green Franca Muller Paz) In Baltimore Council Race – Maryland Matters",1600913153.0,"09/24/2020, 02:05:53",4,0,62,1.5436528602959925,0.98,0.06451612903225806
523,GreenParty,"Patience and Tenacity in the Green Party: Howie Hawkins, the 2020 presidential nominee, ain't lost in the sauce. - Soft Punk",1596042809.0,"07/29/2020, 17:13:29",5,0,61,2.318073660900353,0.96,0.08196721311475409
524,GreenParty,sign the petition for ranked choice voting in Ohio and help end the 2-party system in America!,1593552873.0,"06/30/2020, 21:34:33",6,0,56,1.8322394581626398,0.97,0.10714285714285714
525,GreenParty,"Cops involved in Cover Up of Child Trafficking in Milwaukee-""Today Milwaukee protestors rescued some girls from a known sex trafficking house that police had refused to intervene in""",1593011560.0,"06/24/2020, 15:12:40",2,0,61,1.5394878810592374,0.98,0.03278688524590164
526,GreenParty,Capitalist Media &amp; Imperialist Politicians (including George W. Bush) are already trying to make this movement about electing Biden (who wrote the Crime Bill &amp; proposed a 'Police Officers Bill of Rights') rather than Defunding the Police. Don't let them get away with it!,1591542211.0,"06/07/2020, 15:03:31",5,0,59,2.4875080687331845,0.96,0.0847457627118644
527,GreenParty,"We do not have real political democracy. Ordinary people have little power over government decisions. They are reduced to begging representatives who are elected in an undemocratic electoral system. To have a democratic society, we need to restructure government and elections.",1588630529.0,"05/04/2020, 22:15:29",10,0,54,3.688188256472557,0.94,0.18518518518518517
528,GreenParty,Vote Green Party for a Green New Deal and to save our planet. Happy Earth Day.,1587572622.0,"04/22/2020, 16:23:42",0,0,54,3.3306182133174858,0.94,0.0
529,GreenParty,HOWIE HAWKINS EMERGES VICTORIOUS IN GREEN PRIMARIES IN CA AND NC,1583418084.0,"03/05/2020, 14:21:24",39,0,56,3.1081207787974208,0.95,0.6964285714285714
530,GreenParty,United States: Democrats move to suppress Green Party vote - Green Left,1601394366.0,"09/29/2020, 15:46:06",0,0,58,4.729153799589525,0.92,0.0
531,GreenParty,"I'm honored to announce I've received the endorsement of Sunrise Movement Pittsburgh , who are building a movement to save our collective future. - Jay Ting Walker for PA House 23 (me)",1600869530.0,"09/23/2020, 13:58:50",3,0,55,2.609027071777845,0.95,0.05454545454545454
532,GreenParty,Texas Supreme Court rules 3 Green Party candidates should be on ballot,1600213769.0,"09/15/2020, 23:49:29",3,0,58,2.011688436112408,0.97,0.05172413793103448
533,GreenParty,Maine: Ranked-choice voting people’s veto effort fails,1594849639.0,"07/15/2020, 21:47:19",5,0,55,1.236016108740948,0.98,0.09090909090909091
534,GreenParty,Howie Hawkins &amp; Angela Walker give Acceptance Speeches at the 2020 Green Party National Convention. They outline their vision for a Red-Green Alliance &amp; their Left Unity Campaign.,1594568228.0,"07/12/2020, 15:37:08",1,0,58,4.390085113089157,0.93,0.017241379310344827
535,GreenParty,4-day work week proposed by P.E.I. Green Party (Green Party of Canada),1593039607.0,"06/24/2020, 23:00:07",3,0,60,0.8964679184294155,0.99,0.05
536,GreenParty,"The rich should be paying for energy efficiency, not the poor by Jenny Jones (Green Party of England and Wales)",1582986917.0,"02/29/2020, 14:35:17",2,0,57,1.3661006877408468,0.98,0.03508771929824561
537,GreenParty,"The politics and economics of capitalism created this crisis so we must build an EcoSocialist future in order to overcome the looming climate catastrophe, rising inequality, and threat of nuclear annihilation.",1577897830.0,"01/01/2020, 16:57:10",18,0,55,8.878098723706934,0.86,0.32727272727272727
538,GreenParty,"Coal Knew, Too - A newly unearthed journal from 1966 shows the coal industry, like the oil industry, was long aware of the threat of climate change",1576773219.0,"12/19/2019, 16:33:39",1,0,59,2.1214298579084527,0.97,0.01694915254237288
539,GreenParty,"Non-voters are not apathetic, they are tired of the lesser of two evils, tired of choosing between oppressors.",1575513480.0,"12/05/2019, 02:38:00",6,0,54,6.207803375710206,0.9,0.1111111111111111
540,GreenParty,"KUTV interviews Howie Hawkins, Green Party &amp; Socialist Party candidate for president",1602083440.0,"10/07/2020, 15:10:40",3,0,57,3.708809366785154,0.94,0.05263157894736842
541,GreenParty,"Join the Socialist Party for a webinar with Howie Hawkins, the left unity presidential candidate, TONIGHT at 6:00 pm",1600609946.0,"09/20/2020, 13:52:26",5,0,59,5.62435179864805,0.91,0.0847457627118644
542,GreenParty,"I just completed a ""Who should I vote for"" quiz and Howie Hawkins was chosen, so why have I never heard of the guy?",1598642691.0,"08/28/2020, 19:24:51",22,0,56,2.273574291503664,0.96,0.39285714285714285
543,GreenParty,"I have less respect for democrats than the more honest pro-capitalist, pro-imperialist racist republicans. The democrat hypocrites have supported increases in military spending every year Trump as been in office. Why? Because like republicans they are a white supremacist party.",1596127874.0,"07/30/2020, 16:51:14",8,0,58,7.660273938662428,0.88,0.13793103448275862
544,GreenParty,"“We applaud every worker who walks off the job to demand the government provide fair wages, safe working conditions &amp; collective bargaining. Today's strike shows black &amp; brown people stepping into the leadership of not only the movement against police violence but for worker rights.""",1595275023.0,"07/20/2020, 19:57:03",1,0,58,1.1316999978494948,0.98,0.017241379310344827
545,GreenParty,The Lesser Evil,1587503016.0,"04/21/2020, 21:03:36",5,1,56,3.696762780101352,0.94,0.08928571428571429
546,GreenParty,Bernie Sanders on the importance of third parties (5/6/1991),1586884218.0,"04/14/2020, 17:10:18",3,0,57,5.36274856691211,0.91,0.05263157894736842
547,GreenParty,Whelp Bernie’s out... not voting for Biden so let’s do this,1586401237.0,"04/09/2020, 03:00:37",0,0,54,4.39175933191509,0.92,0.0
548,GreenParty,Used to be Blue; now im feeling Green.,1586976724.0,"04/15/2020, 18:52:04",12,0,55,3.0106567558802837,0.95,0.21818181818181817
549,GreenParty,As Biden Racks up Delegates the Crisis Among Black Folks and Democrat Party Deepens - Slick operatives among the Black Misleadership Class have made an electoral pact with big capitalists that is totally against the interests of the Black working class,1584192598.0,"03/14/2020, 13:29:58",2,0,58,6.784359830647929,0.9,0.034482758620689655
550,GreenParty,"“Aides Say Jimmy Carter Is Courted by Russians” - New York Times (May 13, 1976) History repeats itself and people keep buying it.",1582390999.0,"02/22/2020, 17:03:19",1,0,56,6.772631560441326,0.89,0.017857142857142856
551,GreenParty,"Hi I'm Lisa Savage and I'm running for US Senate as a Green under ranked choice voting in Maine, challenging Susan Collins. On r\wayofthebern",1579824167.0,"01/24/2020, 00:02:47",0,0,52,4.52259427475083,0.92,0.0
552,GreenParty,"1.9 billion people at risk from mountain water shortages, study shows",1577813099.0,"12/31/2019, 17:24:59",0,0,55,3.5954242486248944,0.94,0.0
553,GreenParty,"Exclusive: Canada police prepared to shoot Indigenous activists, documents show | World news",1576939436.0,"12/21/2019, 14:43:56",2,0,55,1.9478385797474758,0.97,0.03636363636363636
554,GreenParty,I'm totally a leftist,1601581474.0,"10/01/2020, 19:44:34",6,0,57,5.902315828950812,0.91,0.10526315789473684
555,GreenParty,End Fear Voting! Vote Your Values With Ranked Choice!,1601150046.0,"09/26/2020, 19:54:06",4,0,57,2.5784945609817527,0.96,0.07017543859649122
556,GreenParty,New interview with Howie!,1589214461.0,"05/11/2020, 16:27:41",1,0,55,-0.1315380304216518,1.0,0.01818181818181818
557,GreenParty,I'm a small Youtuber trying to find some third party representatives to have on my channel,1589017941.0,"05/09/2020, 09:52:21",4,0,53,4.477440187680159,0.92,0.07547169811320754
558,GreenParty,Whatever Happened to Left Solidarity?,1603731387.0,"10/26/2020, 16:56:27",22,0,50,5.8388073581812705,0.9,0.44
559,GreenParty,Howie will be in Denver tonight for a socially distanced Meet and Greet at the Mercury Cafe! Come meet The Original Green New Dealer and get involved in our people-powered movement for a better future!,1602255445.0,"10/09/2020, 14:57:25",6,0,53,3.162944778849649,0.94,0.11320754716981132
560,GreenParty,Lisa Savage talks about holding police accountable at the 9/11 Maine Senate Debate,1599927712.0,"09/12/2020, 16:21:52",8,0,53,3.0542814014899875,0.95,0.1509433962264151
561,GreenParty,Ajamu Baraka: “The struggle is for power not reform.”,1592449893.0,"06/18/2020, 03:11:33",3,0,51,1.2813301462989557,0.98,0.058823529411764705
562,GreenParty,Join Howie and Angela this Sunday at 5:00 PM EST for a Disability Rights Town Hall to discuss the issues and needs of the community during the current COVID crisis and beyond.,1589509497.0,"05/15/2020, 02:24:57",6,0,53,2.6800977128648142,0.95,0.11320754716981132
563,GreenParty,"The politicians in office, liberal and conservative, are captured by powerful real estate interests. For 50 years, they have been cutting funding for more cost-effective public housing and diverting housing funds to subsidizing private housing units.",1581608833.0,"02/13/2020, 15:47:13",1,0,54,3.090539720019372,0.95,0.018518518518518517
564,GreenParty,Green for U.S. Senate - Madelyn Hoffman of New Jersey (Interview),1602339494.0,"10/10/2020, 14:18:14",2,0,53,4.050696162362428,0.93,0.03773584905660377
565,GreenParty,The Alaska Green Party nominates Jesse Ventura/Cynthia McKinney over Howie,1598997875.0,"09/01/2020, 22:04:35",65,0,52,5.556676978799452,0.9,1.25
566,GreenParty,Why I Won't Vote for Biden or Trump,1586784856.0,"04/13/2020, 13:34:16",1,0,55,2.94979570392924,0.95,0.01818181818181818
567,GreenParty,The United States Is Where COVID-19 Deaths Are Being Under-reported (by GPUS Cochair Margaret Flowers),1586355814.0,"04/08/2020, 14:23:34",0,0,50,2.7938680824896807,0.95,0.0
568,GreenParty,"Congratulations to Senator Pauline O'Reilly, who has just been declared elected to the 26th Seanad on the Labour Panel. - Green Party Ireland",1585777231.0,"04/01/2020, 21:40:31",0,0,51,0.42528415580920154,0.99,0.0
569,GreenParty,Coronavirus Reminds Us How Much Needs To Change by Garret Wassermann (Candidate for PA House district 45),1584484822.0,"03/17/2020, 22:40:22",0,0,51,0.77912081423014,0.98,0.0
570,GreenParty,Support Ibrahim Taher's Green campaign for Senate in Oregon!,1602968584.0,"10/17/2020, 21:03:04",3,0,51,2.910574874717014,0.95,0.058823529411764705
571,GreenParty,Why don’t the Greens and the Libertarians organize a Third party debate?,1602683608.0,"10/14/2020, 13:53:28",8,0,50,3.7822016645574763,0.93,0.16
572,GreenParty,I got banned from r/JoeBiden for speaking the truth!,1597175292.0,"08/11/2020, 19:48:12",11,0,51,12.818322436545103,0.8,0.21568627450980393
573,GreenParty,Every state is a battleground,1580404055.0,"01/30/2020, 17:07:35",14,0,51,3.8750920647913603,0.93,0.27450980392156865
574,GreenParty,Irish Green Party election manifesto features Universal Basic Income,1579958613.0,"01/25/2020, 13:23:33",2,0,52,1.3345403010575438,0.97,0.038461538461538464
575,GreenParty,"Given that The Democratic Party is actively blocking ballot access for the Green Party in many states, why see them as allies or give them votes? That would just encourage this behavior further.",1600132863.0,"09/15/2020, 01:21:03",28,0,48,7.225302134040426,0.87,0.5833333333333334
576,GreenParty,"""I am ready to debate Trump and Biden, but are they ready to debate me? Their Commission on Presidential Debates — which sounds like a government agency but is in fact a private corporation controlled jointly by the two major parties — is designed to keep their competition out"" - Howie Hawkins",1593442136.0,"06/29/2020, 14:48:56",3,0,51,1.4455409660230174,0.97,0.058823529411764705
577,GreenParty,"Voter Registrations Are Way, Way Down During The Pandemic | Are there GP websites with information on how to remotely/safely register voters?",1593361909.0,"06/28/2020, 16:31:49",1,0,51,1.0450203732514396,0.98,0.0196078431372549
578,GreenParty,Trump Quietly Signs Order Removing Environmental Review Of Major Projects,1591820402.0,"06/10/2020, 20:20:02",3,0,50,1.7484625678763166,0.97,0.06
579,GreenParty,NYT = DNC mouthpiece,1586721537.0,"04/12/2020, 19:58:57",9,0,49,5.022521240707128,0.91,0.1836734693877551
580,GreenParty,"Chelsea Manning Is Free From Jail, Faces Exorbitant Fines (by GPUS Cochair Margaret Flowers and Kevin Zeese)",1584234558.0,"03/15/2020, 01:09:18",5,0,46,5.378169539781119,0.9,0.10869565217391304
581,GreenParty,"You should embrace ""Rank Choice Voting""",1603228988.0,"10/20/2020, 21:23:08",17,0,54,2.3980640698762983,0.96,0.3148148148148148
582,GreenParty,A reminder that this isn’t the first time the Democrats have kicked Greens off the ballot,1600414651.0,"09/18/2020, 07:37:31",4,0,50,6.8215655871194585,0.88,0.08
583,GreenParty,Howie Hawkins Named Green Party Nominee For President,1594732748.0,"07/14/2020, 13:19:08",14,0,49,7.1092878651153555,0.87,0.2857142857142857
584,GreenParty,The New York Green Party Convention is happening now! Tune in and participate along.,1589637136.0,"05/16/2020, 13:52:16",1,0,52,1.618335900148331,0.97,0.019230769230769232
585,GreenParty,Ecosocialists don't work with corporatists.,1587486509.0,"04/21/2020, 16:28:29",0,0,49,3.7601540298384037,0.93,0.0
586,GreenParty,"The People’s Choice Lisa Savage For Maine’s US Senate, Green Part Candidate",1599769381.0,"09/10/2020, 20:23:01",6,0,49,1.903915763878416,0.96,0.12244897959183673
587,GreenParty,Fight for the Right To Vote and To Have All Votes Counted,1597587477.0,"08/16/2020, 14:17:57",2,0,52,0.16255192232421933,1.0,0.038461538461538464
588,GreenParty,Capitalism in crisis,1596381033.0,"08/02/2020, 15:10:33",3,0,47,4.5711358439781264,0.91,0.06382978723404255
589,GreenParty,Love to see it,1594750384.0,"07/14/2020, 18:13:04",0,0,50,2.5809452315380597,0.95,0.0
590,GreenParty,Democrats and Republicans agree on everything these days,1588355475.0,"05/01/2020, 17:51:15",0,0,52,2.9710011712660602,0.95,0.0
591,GreenParty,"The prohibition of marijuana has fueled racist mass incarceration &amp; a deadly drug war. Legal cannabis is supported by 67% of the US &amp; is a policy that the Green Party has long championed. Legalize it, vote Green Party.",1587400903.0,"04/20/2020, 16:41:43",1,0,48,3.1124726239526908,0.94,0.020833333333333332
592,GreenParty,In honor of Howie’s twitter being suspended.,1587269167.0,"04/19/2020, 04:06:07",1,0,44,3.4745186851466983,0.93,0.022727272727272728
593,GreenParty,“The capitalist parties exist to advance the interests of the ruling class. The working class must organize independently in order to advance its own interests.“,1586882005.0,"04/14/2020, 16:33:25",1,0,47,3.191684476427916,0.94,0.02127659574468085
594,GreenParty,Little Howie ad/intro I made from platform clips,1586642470.0,"04/11/2020, 22:01:10",3,0,51,1.3155211496834767,0.97,0.058823529411764705
595,GreenParty,I voted Green in 2016 and I'll vote Green again.,1586386031.0,"04/08/2020, 22:47:11",4,0,47,3.0921316783175143,0.94,0.0851063829787234
596,GreenParty,Ralph Nader: Trump Should Be Impeached for His Climate Policy Alone (truthdig),1575205636.0,"12/01/2019, 13:07:16",2,0,48,4.044029747737163,0.92,0.041666666666666664
597,GreenParty,I'm in Kentucky. The Green party is off the ballot this time. Makes me want to vote Biden even less,1602385476.0,"10/11/2020, 03:04:36",32,0,44,8.338708611540234,0.84,0.7272727272727273
598,GreenParty,Howie Hawkins Fighting for the People! (Supporter Ad) (GPUS),1596591614.0,"08/05/2020, 01:40:14",2,0,45,2.4335938190254467,0.95,0.044444444444444446
599,GreenParty,Environmentalists Call To Arms,1595271599.0,"07/20/2020, 18:59:59",24,0,47,6.233835301066932,0.88,0.5106382978723404
600,GreenParty,Federal Charges Against Four Venezuelan Embassy Protectors Dropped! Work To Oppose US Imperialism And Build International Solidarity Continues!,1591237789.0,"06/04/2020, 02:29:49",0,0,47,1.8171838924368373,0.96,0.0
601,GreenParty,Former Green Party co-leader Jeanette Fitzsimons has died at the age of 75 (New Zealand),1583693064.0,"03/08/2020, 18:44:24",1,0,47,2.293623831522517,0.95,0.02127659574468085
602,GreenParty,Cory Booker is ready to defend his U.S. Senate seat after ending his bid for president. Here are some of his challengers in 2020. (including New Jersey Green Party candidate Madelyn Hoffman),1581131674.0,"02/08/2020, 03:14:34",2,0,44,2.750477192960531,0.94,0.045454545454545456
603,GreenParty,"""The agreement reached between the Trump administration and Democratic congressional leaders on the terms of the USMCA (US-Mexico-Canada Agreement) is an attack on workers, consumers, the environment, and democracy.""",1576172139.0,"12/12/2019, 17:35:39",3,0,46,5.386536737290534,0.9,0.06521739130434782
604,GreenParty,"We need to socialize social media and online platforms, give power to the users, and turn tech giants like Uber over to the workers",1574090063.0,"11/18/2019, 15:14:23",3,0,46,2.662863312961683,0.95,0.06521739130434782
605,GreenParty,"Finally got my ballot, dropping it off at my township hall tomorrow. HowieHawkins2020",1604174787.0,"10/31/2020, 20:06:27",21,0,47,7.371918834155707,0.86,0.44680851063829785
606,GreenParty,Who in the USA is voting Green Party?,1601865647.0,"10/05/2020, 02:40:47",62,0,43,7.497781916960271,0.85,1.441860465116279
607,GreenParty,Workers for the White House!,1599682990.0,"09/09/2020, 20:23:10",0,0,48,-0.06890237327482396,1.0,0.0
608,GreenParty,"Rapist Biden still opposes Medicare for All as the coronavirus crisis grows: ""Single payer will not solve that at all.""",1585639424.0,"03/31/2020, 07:23:44",0,0,45,8.014365754574015,0.85,0.0
609,GreenParty,Merkel 'slumps in Hamburg as Greens surge' (Germany),1582560171.0,"02/24/2020, 16:02:51",0,0,44,2.061920397061847,0.96,0.0
610,GreenParty,"Help ensure the next Congress is filled with grassroots-funded progressives who are for M4A, the GND, and more",1577672119.0,"12/30/2019, 02:15:19",15,0,47,2.6966636828917245,0.95,0.3191489361702128
611,GreenParty,The central Illinois chapter of the DSA endorses the Hawkins/Walker left unity campaign,1600174520.0,"09/15/2020, 12:55:20",2,0,47,0.7644145068603763,0.98,0.0425531914893617
612,GreenParty,"How would this election look if we could rank our choices and not vote for the ""lesser evil""?",1599354432.0,"09/06/2020, 01:07:12",9,0,45,1.4003406788590382,0.97,0.2
613,GreenParty,Ballot access frustration,1598032528.0,"08/21/2020, 17:55:28",15,0,47,3.5636570521194386,0.93,0.3191489361702128
614,GreenParty,"Angela Walker is a veteran working-class activist with decades of experience working for racial and economic justice in social movements, unions, and as an independent socialist candidate from her youth, and I am thrilled to have her as my running mate.",1589128033.0,"05/10/2020, 16:27:13",2,0,45,3.5277299304455596,0.93,0.044444444444444446
615,GreenParty,"Since I can't, in good conscience, vote for Biden. Here I am.",1588941910.0,"05/08/2020, 12:45:10",5,0,45,0.8999018978442521,0.98,0.1111111111111111
616,GreenParty,Greens say no return to “normal” after the crisis – UK Green news round up issue 57,1587989647.0,"04/27/2020, 12:14:07",0,0,43,1.5277412236039396,0.97,0.0
617,GreenParty,Ranked Choice Voting could enable Lisa Savage to defeat Susan Collins; but MSM is trying to minimize coverage of it nationally &amp; locally!,1584200275.0,"03/14/2020, 15:37:55",2,0,46,1.2313170973736902,0.97,0.043478260869565216
618,GreenParty,PUBLIC HOUSING IS THE SOLUTION TO THE AFFORDABLE HOUSING CRISIS,1581347086.0,"02/10/2020, 15:04:46",7,0,45,3.670300824306125,0.92,0.15555555555555556
619,GreenParty,Want to Stop Australia's Fires? Listen to Aboriginal People,1579557468.0,"01/20/2020, 21:57:48",0,0,46,2.5965442913575174,0.95,0.0
620,GreenParty,"“Facts: Like it or not the Green Party is the only major electoral party that has been consistently Anti-War, that links climate change &amp; militarism, the only party that supports reparations, the party that produced original Green New Deal that was stolen &amp; distorted by Democrats.” - Ajamu Baraka",1579190209.0,"01/16/2020, 15:56:49",22,0,45,4.20345661138991,0.91,0.4888888888888889
621,GreenParty,Scientists warn: More than half of the climate tipping points have been crossed.,1575121355.0,"11/30/2019, 13:42:35",2,0,44,4.031887352118147,0.92,0.045454545454545456
622,GreenParty,New Young Greens committees elected - Bright Green (Green Party of England and Wales),1597679596.0,"08/17/2020, 15:53:16",0,0,44,2.693592200645689,0.94,0.0
623,GreenParty,The problem with a 2 party system in a single image,1588013437.0,"04/27/2020, 18:50:37",1,0,43,2.2422162830363774,0.95,0.023255813953488372
624,GreenParty,So excited to vote green for the first time. A party with a strong eco-socialist platform,1586383796.0,"04/08/2020, 22:09:56",4,0,48,0.18982084763641183,1.0,0.08333333333333333
625,GreenParty,The US’s Wave of Hospital Closures Left Us Ill-Equipped for COVID-19 - Truthout (by GPUS Cochair Margaret Flowers),1585838604.0,"04/02/2020, 14:43:24",0,0,42,2.299308751021165,0.95,0.0
