,Subreddit,Title,Epoch Time,Date,Comments,Awards,Upvotes,Downvotes,Upvote Ratio,Comment/Upvote Ratio
626,GreenParty,The US was already in a housing crisis before the coronavirus hit. Now housing distress is accelerating along with the spread of the crisis. Building new public housing should be an important part of the economic recovery from the coronavirus depression.,1585759844.0,"04/01/2020, 16:50:44",1,0,40,2.1361705114918337,0.95,0.025
627,GreenParty,Tulsi Gabbard: Presidential candidates must also condemn election interference by US intelligence agencies,1582861922.0,"02/28/2020, 03:52:02",1,0,41,7.2272242158051725,0.85,0.024390243902439025
628,GreenParty,The difference between electing Republicans and electing Democrats is the difference between hitting a wall at 90 MPG and hitting a wall at 55 MPH,1604342236.0,"11/02/2020, 18:37:16",9,0,55,7.33127938137509,0.88,0.16363636363636364
629,GreenParty,Criminal Justice Reform in the US.,1591885725.0,"06/11/2020, 14:28:45",1,0,45,2.8637060675785477,0.94,0.022222222222222223
630,GreenParty,Natalie Bennett: Why should taxpayers bailout tax dodgers? (Green Party of England and Wales),1587555440.0,"04/22/2020, 11:37:20",0,0,39,2.73389777022588,0.93,0.0
631,GreenParty,We need community control of the police to have transparency &amp; accountability in the hands of the people!,1586701456.0,"04/12/2020, 14:24:16",0,0,42,4.936222987154146,0.89,0.0
632,GreenParty,"2020 Green Presidential Town Hall, Hosted by the Green Party of Allegheny County (Pittsburgh, PA)",1586533981.0,"04/10/2020, 15:53:01",0,0,42,0.5369237056228542,0.99,0.0
633,GreenParty,"Canada is in the midst of a Green Party leadership election. I made a video where I talk about how party leaders are chosen in Canada, using the Green Party as one of my examples. Someone over in r/GreenPartyofCanada suggested I post it more widely here. Hope you enjoy!",1585667374.0,"03/31/2020, 15:09:34",1,0,41,1.445207108430182,0.97,0.024390243902439025
634,GreenParty,"Greens Denounce Administration and Congressional Failure to Address Pandemic Threat to Health, Economy (GPUS)",1585310490.0,"03/27/2020, 12:01:30",0,0,43,1.0697380368276583,0.98,0.0
635,GreenParty,I voted...,1603886698.0,"10/28/2020, 12:04:58",10,0,43,4.067586300866367,0.91,0.23255813953488372
636,GreenParty,Hawkins campaign correctly calls for freeing political prisoner Julian Assange,1601851492.0,"10/04/2020, 22:44:52",2,0,41,4.376852988948897,0.9,0.04878048780487805
637,GreenParty,Poll: 60 percent of voters say a viable third party is needed to have an effective political system - The Hill,1600805497.0,"09/22/2020, 20:11:37",2,0,42,0.6563771319315208,0.98,0.047619047619047616
638,GreenParty,"""It is the liberal bourgeoisie — the Democratic mayors and governors and congressional leaders like Nancy Pelosi — who have facilitated Trump’s latest attacks...In truth, it has long been the velvet glove over the iron fist of state repression""",1591630032.0,"06/08/2020, 15:27:12",2,0,40,3.0811034510680244,0.93,0.05
639,GreenParty,"Under a capitalist system, we cannot solve the central problems of our time.",1575995586.0,"12/10/2019, 16:33:06",4,0,41,4.343453355254503,0.9,0.0975609756097561
640,GreenParty,"Hi I'm Lisa Savage and I'm running for US Senate as an independent under ranked choice voting in Maine, challenging Susan Collins. AMA",1600374458.0,"09/17/2020, 20:27:38",2,1,42,3.600091765355309,0.92,0.047619047619047616
641,GreenParty,"Rest In Power, Kevin Zeese",1599482699.0,"09/07/2020, 12:44:59",0,0,43,0.49149098553189674,0.99,0.0
642,GreenParty,Don’t miss our AMA on r/WayOfTheBern TODAY!,1598975980.0,"09/01/2020, 15:59:40",2,0,41,4.686756782142886,0.9,0.04878048780487805
643,GreenParty,Why Greens must be Red and Reds must be Green,1598621924.0,"08/28/2020, 13:38:44",0,0,41,3.1282528910537692,0.93,0.0
644,GreenParty,Green and Libertarian Partys sue NY over recent changes to Ballot access law,1595951389.0,"07/28/2020, 15:49:49",0,0,41,1.3718159604501352,0.97,0.0
645,GreenParty,Dario Hunter Fact Sheet,1595231573.0,"07/20/2020, 07:52:53",4,0,42,2.473261450543447,0.94,0.09523809523809523
646,GreenParty,"A deal to form a government is agreed between Fianna Fáil, Fine Gael and the Green Party in the Republic of Ireland.",1592229897.0,"06/15/2020, 14:04:57",3,0,39,2.093905175127823,0.95,0.07692307692307693
647,GreenParty,Black Alliance for Peace Calls on United Nations to Address U.S. Human Rights Crisis,1590960244.0,"05/31/2020, 21:24:04",2,0,44,-0.1438954072654468,1.0,0.045454545454545456
648,GreenParty,Greens from across 120 councils demand urgent funding for local authorities to tackle the coronavirus crisis - AGC (Green Party of England and Wales),1587190146.0,"04/18/2020, 06:09:06",0,0,41,0.07383687595510935,1.0,0.0
649,GreenParty,Howie Hawkins: For Medicare for All,1587065217.0,"04/16/2020, 19:26:57",1,0,42,3.4781105715693386,0.92,0.023809523809523808
650,GreenParty,Universal Basic Income,1585798036.0,"04/02/2020, 03:27:16",20,0,42,0.26535079939071693,0.99,0.47619047619047616
651,GreenParty,Just applied to join the Greens in Michigan,1583937886.0,"03/11/2020, 14:44:46",7,0,41,0.7157673457116545,0.98,0.17073170731707318
652,GreenParty,Kshama Sawant’s re-election hangs in the balance after $4.1 million was spent to defeat socialist and progressive candidates.,1573082619.0,"11/06/2019, 23:23:39",5,0,44,1.8229076349745412,0.96,0.11363636363636363
653,GreenParty,"The Green Party's presidential ticket is suing to get on Wisconsin's ballot, but election officials say it's too late - Milwaukee Journal Sentinel (GPUS)",1599753063.0,"09/10/2020, 15:51:03",5,0,40,3.7484524538920923,0.91,0.125
654,GreenParty,"As someone who has been a union member since I was a Marine with the American Servicemen’s Union until I retired last year as a Teamster as well as a member of the Industrial Workers of the World, I have lived the reality of mistreatment of workers in the United States",1599416895.0,"09/06/2020, 18:28:15",2,0,40,0.7934125916377681,0.98,0.05
655,GreenParty,Democrats aim to keep Green Party candidates off fall statewide ballot in Pennsylvania - WITF,1597445554.0,"08/14/2020, 22:52:34",2,0,40,3.0809610131746012,0.93,0.05
656,GreenParty,Howie Hawkins goes national,1594653297.0,"07/13/2020, 15:14:57",0,0,43,1.6317551359529432,0.96,0.0
657,GreenParty,Ask a Green Megathread - Summer 2020,1594653065.0,"07/13/2020, 15:11:05",62,0,40,-0.06436414344794628,1.0,1.55
658,GreenParty,"America needs a universal, affordable, and high-quality childcare system",1589379441.0,"05/13/2020, 14:17:21",0,0,38,2.0032775157463973,0.95,0.0
659,GreenParty,"Chris hedges interviews Howie Hawkins this Wednesday, 05/13 at 8:00 pm EST",1589243778.0,"05/12/2020, 00:36:18",1,0,36,3.875088200265189,0.9,0.027777777777777776
660,GreenParty,America needs a MASSIVE infrastructure investment NOW,1589124613.0,"05/10/2020, 15:30:13",1,0,40,2.5004867225561824,0.94,0.025
661,GreenParty,Third-party candidates’ ballot access rules officially loosened,1587753528.0,"04/24/2020, 18:38:48",2,0,44,0.8537081735001095,0.98,0.045454545454545456
662,GreenParty,OPINION: It’s time for progressives to form a separate political party - Indiana Daily Student (GPUS),1586876571.0,"04/14/2020, 15:02:51",0,0,41,2.14926117835455,0.95,0.0
663,GreenParty,A concept for the Green Party mascot,1586754333.0,"04/13/2020, 05:05:33",6,0,39,2.0337079376480958,0.95,0.15384615384615385
664,GreenParty,Just changed my registration! Thrilled to be in a party that represents me and aligns with my values!,1586556246.0,"04/10/2020, 22:04:06",5,0,38,2.037101386069409,0.95,0.13157894736842105
665,GreenParty,The Greens are coming! The Greens are coming! - Green Party of Florida,1586527901.0,"04/10/2020, 14:11:41",0,0,40,-0.17788196835661552,1.0,0.0
666,GreenParty,Green Party presidential candidate Howie Hawkins — RT Redacted Tonight,1586283298.0,"04/07/2020, 18:14:58",0,0,38,2.1047639113324834,0.95,0.0
667,GreenParty,Businesses and shops in Kirklees get three-month rent break amid coronavirus crisis - Led by Green Party Councillor Andrew Cooper (Green Party of England and Wales),1585487774.0,"03/29/2020, 13:16:14",0,0,39,0.4483364379743193,0.99,0.0
668,GreenParty,"Solidarity with Indigenous Canadians!- ""Anti-pipeline protests have shut down major rail networks across Canada as indigenous rights and environmental activists act in solidarity with the Wet'suwet'en people of British Columbia who are fighting to keep a natural gas pipeline off their land""",1582036144.0,"02/18/2020, 14:29:04",1,0,41,2.169448901086156,0.95,0.024390243902439025
669,GreenParty,Is Bernie Sanders like totally Green?,1581749152.0,"02/15/2020, 06:45:52",29,0,41,3.4800598869453268,0.92,0.7073170731707317
670,GreenParty,Greens need to be preparing now incorporate a flood of DemExiters into our state and local Green Party organizations and campaigns if the Democratic establishment bends its rules to deny Sanders their nomination.,1580697520.0,"02/03/2020, 02:38:40",29,0,39,5.606399830374762,0.87,0.7435897435897436
671,GreenParty,Government won't solve the climate crisis but our cities and mayors can by Sian Berry (co-leader of the Green Party of England &amp; Wales and 2020 London mayoral candidate),1577973025.0,"01/02/2020, 13:50:25",0,0,38,1.0915462755776915,0.97,0.0
672,GreenParty,Keep the GP on the ballot,1603536680.0,"10/24/2020, 10:51:20",2,0,38,3.5295147513359595,0.92,0.05263157894736842
673,GreenParty,I feel safe in the green party's spaces.,1601514821.0,"10/01/2020, 01:13:41",1,0,39,2.2112572852641463,0.95,0.02564102564102564
674,GreenParty,I interviewed Angela Walker! Interview | 2020 Green Party Vice Presidential Nominee,1593197250.0,"06/26/2020, 18:47:30",0,0,39,1.1840629771608704,0.97,0.0
675,GreenParty,Vote your principles.,1587148911.0,"04/17/2020, 18:41:51",0,0,42,2.6693098091920504,0.94,0.0
676,GreenParty,"I can do this too, Dems",1586979388.0,"04/15/2020, 19:36:28",0,0,37,3.7515681448379894,0.91,0.0
677,GreenParty,"Another Bernard Brother, reporting in!",1586886192.0,"04/14/2020, 17:43:12",1,0,40,1.5615650531218392,0.96,0.025
678,GreenParty,205 days.,1586737671.0,"04/13/2020, 00:27:51",7,0,41,3.807344697222895,0.92,0.17073170731707318
679,GreenParty,Can Howie Afford a TV ad? Now Would Be Good.,1586521973.0,"04/10/2020, 12:32:53",3,0,37,1.1536492275866337,0.97,0.08108108108108109
680,GreenParty,"Former Green Party leader and current MP Elizabeth May self-isolates, works from home, contemplates ukelele lessons. (Canada)",1584450441.0,"03/17/2020, 13:07:21",1,0,38,1.8638693759483758,0.95,0.02631578947368421
681,GreenParty,Implementing the Green New Deal will require ecosocialism - social ownership in key sectors in order to democratically plan the coordinated reconstruction of all economic sectors for ecological sustainability.,1582598117.0,"02/25/2020, 02:35:17",5,0,37,3.7298739078699583,0.91,0.13513513513513514
682,GreenParty,Jokes with Elon Musk,1603485343.0,"10/23/2020, 20:35:43",0,0,40,2.128911264045101,0.95,0.0
683,GreenParty,Green Party of Canada Leadership Candidate Meryam Haddad Proposes a One Time Alliance with the NDP to Achieve Electoral Reform,1600789259.0,"09/22/2020, 15:40:59",1,0,38,-0.08105008876387387,1.0,0.02631578947368421
684,GreenParty,An allegory,1597506048.0,"08/15/2020, 15:40:48",4,0,37,4.859674599765313,0.88,0.10810810810810811
685,GreenParty,Movement for People’s Party Aims to Unseat Duopoly in 2024,1594666871.0,"07/13/2020, 19:01:11",18,0,37,3.305293509256991,0.92,0.4864864864864865
686,GreenParty,"Earth is headed for 4°C temperature rise, organized society will break down",1593810530.0,"07/03/2020, 21:08:50",17,0,38,4.101897313839821,0.9,0.4473684210526316
687,GreenParty,"Vote Independent, Green Or Lesser Of Two Evil Duopoly?",1587576615.0,"04/22/2020, 17:30:15",2,0,38,1.2766800097891249,0.97,0.05263157894736842
688,GreenParty,Government must use enforcement to prevent illegal burning - Green Party Ireland,1587197395.0,"04/18/2020, 08:09:55",2,0,36,0.9608687096537096,0.97,0.05555555555555555
689,GreenParty,Where can I donate to Green Party/Howie Hawkins campaign?,1586441977.0,"04/09/2020, 14:19:37",6,0,36,1.9405239244213348,0.95,0.16666666666666666
690,GreenParty,"I'm the new guy. Checkin you out. You look nice. Tell me a little about yourself (wtf are greens and how do they appeal to progressives, not liberals, and who is this Howie guy?",1583900643.0,"03/11/2020, 04:24:03",17,0,38,4.404314628485672,0.9,0.4473684210526316
691,GreenParty,"""Congratulations to Dario Hunter who won tonights Green Party of Minnesota Presidential Caucus! Thanks to all who participated and organized tonights event.""",1582740661.0,"02/26/2020, 18:11:01",1,0,41,3.6768253087978024,0.92,0.024390243902439025
692,GreenParty,We Have Fifteen Years to Save the Amazon Rainforest from Becoming Savannah,1580337486.0,"01/29/2020, 22:38:06",3,0,38,2.4331878927146704,0.94,0.07894736842105263
693,GreenParty,“A central part of our Ecosocialist Green New Deal is worker ownership and economic democracy.” - Howie Hawkins,1579387526.0,"01/18/2020, 22:45:26",8,0,37,0.6394615589356718,0.98,0.21621621621621623
694,GreenParty,Jill Stein Smashes Hillary &amp; Defends Julian Assange (The Jimmy Dore Show on YouTube),1573392457.0,"11/10/2019, 13:27:37",1,0,39,5.168902750073443,0.88,0.02564102564102564
695,GreenParty,But What about the Supreme Court??,1603819296.0,"10/27/2020, 17:21:36",18,0,40,5.775070940940871,0.87,0.45
696,GreenParty,Green Party Candidate willing to debate Joe Biden or Trump,1602373456.0,"10/10/2020, 23:44:16",3,0,37,2.4191222840831372,0.94,0.08108108108108109
697,GreenParty,"Green Party's U.S. Senate Candidate David Black Advocates Universal Health Care, Steep Military Budget Cuts (Illinois Green Party)",1600959383.0,"09/24/2020, 14:56:23",1,0,36,1.533826663621646,0.96,0.027777777777777776
698,GreenParty,Howie Hawkins coming to Albany!,1599238430.0,"09/04/2020, 16:53:50",2,0,37,2.1278869486025727,0.95,0.05405405405405406
699,GreenParty,Democrats’ Efforts to Deny Ballot Lines to Green Party is Voter Suppression,1597754497.0,"08/18/2020, 12:41:37",8,0,37,1.7102837955453012,0.96,0.21621621621621623
700,GreenParty,The Green Party's future is to the left of Labour - Bright Green (Green Party of England and Wales),1594238983.0,"07/08/2020, 20:09:43",1,0,38,2.4478654052939532,0.94,0.02631578947368421
701,GreenParty,"Meryam Haddad, candidate for Canada's Green Party leadership, is doing an AMA today in r/GreenPartyOfCanada",1593706708.0,"07/02/2020, 16:18:28",0,0,34,4.471059962300558,0.88,0.0
702,GreenParty,"Chris Hedges interviews Howie Hawkins, Green for President",1590674155.0,"05/28/2020, 13:55:55",0,0,36,2.949201213925832,0.92,0.0
703,GreenParty,Please consider donating so Oklahoma residents have a chance to vote Green in November! Today was my very first donation :),1587257205.0,"04/19/2020, 00:46:45",1,0,37,0.15908869777173607,1.0,0.02702702702702703
704,GreenParty,The Oregon GOP's Favorite Anti-Environment Group Is Awash in Racism and Violent Threats,1586080434.0,"04/05/2020, 09:53:54",0,0,39,3.5334726309173377,0.92,0.0
705,GreenParty,"Join the Howie Hawkins Campaign after the Democratic Party Debate for a campaign livestream. Sunday night, around 10 PM EDT.",1584275172.0,"03/15/2020, 12:26:12",6,0,37,2.6067472997507792,0.93,0.16216216216216217
706,GreenParty,"The Corporations and Their Media Strangled Bernie, and Older Black Voters Tied the Knot",1584072072.0,"03/13/2020, 04:01:12",1,0,35,4.980860257129905,0.88,0.02857142857142857
707,GreenParty,"US 'plotted to kill Julian Assange and make it look like an accident': Spies discussed kidnapping or poisoning WikiLeaks founder in Ecuadorean embassy, extradition trial hears",1582633202.0,"02/25/2020, 12:20:02",1,0,37,5.4374418684630115,0.87,0.02702702702702703
708,GreenParty,"To save the planet, we have to kill capitalism by Benjamin Smith of the Green Party of England and Wales",1580906198.0,"02/05/2020, 12:36:38",2,0,36,4.471573874730844,0.89,0.05555555555555555
709,GreenParty,Germany’s Second Chamber - The Greens are now together with the conservatives the strongest force,1580564939.0,"02/01/2020, 13:48:59",14,0,35,3.155630484085137,0.92,0.4
710,GreenParty,"In a city where the average rent is close to $3,000 per month and thousands of people are living on the streets, the occupation quickly grew into a movement for housing justice. This film tells the story of the 50 days of struggle at 2928 Magnolia street from occupation to eviction.",1579472402.0,"01/19/2020, 22:20:02",2,0,35,2.5105452210633104,0.93,0.05714285714285714
711,GreenParty,If I can't vote for Howie in PA then I'm not voting at all.,1602185215.0,"10/08/2020, 19:26:55",13,0,37,6.610557228067471,0.85,0.35135135135135137
712,GreenParty,Wouldn't it be nice to have a Supreme Court that was always in favor of the environment?,1600699975.0,"09/21/2020, 14:52:55",14,0,34,2.844405759224621,0.92,0.4117647058823529
713,GreenParty,Atrocious Biden/Harris Record From The Memory Hole,1599931722.0,"09/12/2020, 17:28:42",3,0,32,6.617640024957375,0.83,0.09375
714,GreenParty,German Greens Discuss Climate and Corona at First Digital Party Congress,1588505555.0,"05/03/2020, 11:32:35",0,0,37,3.042613023655953,0.92,0.0
715,GreenParty,Is the green party growing?,1581671118.0,"02/14/2020, 09:05:18",21,0,39,0.6824657959329627,0.98,0.5384615384615384
716,GreenParty,"Lisa Savage: As U.S. senator, I'll stand up to neo-McCarthyism, say 'no' to U.S. wars (GP.org) &lt;- Lisa Savage of Solon is a teacher, founder of the Maine Natural Guard and candidate for the Maine Green Independent Party nomination for U.S. Senate",1573734436.0,"11/14/2019, 12:27:16",2,0,36,2.5645035082677268,0.93,0.05555555555555555
717,GreenParty,War on Green Party - By the Democratic Party,1600260157.0,"09/16/2020, 12:42:37",2,0,36,4.725960095152338,0.88,0.05555555555555555
718,GreenParty,Where the Pandemic Leaves the Climate Movement,1598886967.0,"08/31/2020, 15:16:07",0,0,34,2.5208625006051193,0.93,0.0
719,GreenParty,Dimitri Lascaris: Green Party should have ‘unapologetic’ left wing stances to take the fight to Trudeau,1598702136.0,"08/29/2020, 11:55:36",0,0,34,1.2282835408901818,0.97,0.0
720,GreenParty,"The Price of Free Speech by Pennsylvanian Green John Murphy for Counterpunch (2006, GPUS)",1598490501.0,"08/27/2020, 01:08:21",1,0,38,1.2883498196562115,0.97,0.02631578947368421
721,GreenParty,The Case for an Independent Left Party: From the Bottom Up,1598391692.0,"08/25/2020, 21:41:32",2,0,34,1.090592689959628,0.97,0.058823529411764705
722,GreenParty,Green Party calls for a halt to nuclear arsenal build-up (GPUS),1596501695.0,"08/04/2020, 00:41:35",2,0,37,0.8832397663402674,0.98,0.05405405405405406
723,GreenParty,Community Control of the Police: An Idea Whose Time Came and Never Left,1590953126.0,"05/31/2020, 19:25:26",1,0,36,0.9731376405888739,0.97,0.027777777777777776
724,GreenParty,One billion people will live in insufferable heat within 50 years,1588674251.0,"05/05/2020, 10:24:11",3,0,38,-0.18097028372377366,1.0,0.07894736842105263
725,GreenParty,Let's call New York what it is: voter suppression.,1588119643.0,"04/29/2020, 00:20:43",0,0,33,4.464764101336698,0.88,0.0
726,GreenParty,Celebrate Earth Day by Supporting the Green Party,1587570008.0,"04/22/2020, 15:40:08",4,0,34,0.8486575277489052,0.98,0.11764705882352941
727,GreenParty,"""Basic income would be ‘a faster’ way to get money to people who need it"" - Co-leader of the Green Party of England and Wales Sian Berry and Labour leader Jeremy Corbyn talk UBI with the New Journal",1585853499.0,"04/02/2020, 18:51:39",0,0,36,3.2036884591463206,0.92,0.0
728,GreenParty,Coronavirus Crisis Demands Immediate Crash Program and Long-term Structural Reform of Us Healthcare System - Howie Hawkins (GPUS),1584016623.0,"03/12/2020, 12:37:03",1,0,35,0.9292135461305975,0.97,0.02857142857142857
729,GreenParty,'Grandchildren will curse us' says Buckinghamshire Green councillor on new council's climate change plans (Green Party of England and Wales),1583076661.0,"03/01/2020, 15:31:01",0,0,37,0.7697265769180248,0.98,0.0
730,GreenParty,Capitalism is killing the Earth. We need an EcoSocialist Green New Deal!,1576252686.0,"12/13/2019, 15:58:06",4,0,38,6.467432633644584,0.85,0.10526315789473684
731,GreenParty,"Lisa Savage: As U.S. senator, I’ll stand up to neo-McCarthyism, say ‘no’ to U.S. wars",1574038400.0,"11/18/2019, 00:53:20",1,0,34,3.87045578591173,0.9,0.029411764705882353
732,GreenParty,"Howie Hawkins was interviewed on ""The Political Orphanage Podcast""",1603904957.0,"10/28/2020, 17:09:17",0,0,32,2.889061940225382,0.92,0.0
733,GreenParty,Rank Sara Gideon second to stop Susan Collins by Lisa Savage for the Mainer,1602612638.0,"10/13/2020, 18:10:38",2,0,34,0.9206480911498218,0.97,0.058823529411764705
734,GreenParty,"Angela interviews Michael Badges-Canning, Green candidate for Pennsylvania State House, 64th District.",1602080750.0,"10/07/2020, 14:25:50",2,0,33,0.5408440494828923,0.98,0.06060606060606061
735,GreenParty,voter suppression,1601882013.0,"10/05/2020, 07:13:33",2,0,34,5.372118065428992,0.86,0.058823529411764705
736,GreenParty,Donald Trump Has Added Trillions to the US Military Budget. Joe Biden Wants to Spend Even More.,1600288624.0,"09/16/2020, 20:37:04",1,0,30,5.703732813810923,0.84,0.03333333333333333
737,GreenParty,Wisconsin Man Who Says He Marched With Rittenhouse in Kenosha Was Immersed in White Supremacist Propaganda,1599123974.0,"09/03/2020, 09:06:14",0,0,32,5.211403466459686,0.86,0.0
738,GreenParty,Loving this new Savage campaign lit,1598666007.0,"08/29/2020, 01:53:27",3,0,34,1.8469977311354384,0.95,0.08823529411764706
739,GreenParty,Franca Muller Paz for Baltimore City Council,1597109897.0,"08/11/2020, 01:38:17",0,0,31,2.0325915780149515,0.94,0.0
740,GreenParty,I’m using Zoom to facilitate some civil discussions between Redditors with different thoughts on American race relations. I set up a quick survey if you’re interested in participating and hearing some different viewpoints.,1593321970.0,"06/28/2020, 05:26:10",4,0,35,4.195957767158532,0.89,0.11428571428571428
741,GreenParty,Join me on Wednesday at 3:00 PM EDT for an AMA on r/politics,1588038830.0,"04/28/2020, 01:53:50",3,0,33,3.4282449554735095,0.91,0.09090909090909091
742,GreenParty,We've got a real race brewing in Maine,1587062876.0,"04/16/2020, 18:47:56",0,0,37,2.5949047951528,0.93,0.0
743,GreenParty,North Carolina Green Party to Sanders Supporters: Help Us Build Political Power Independent of the Capitalist Parties (GPUS),1586880616.0,"04/14/2020, 16:10:16",0,0,37,-0.11647735138989646,1.0,0.0
744,GreenParty,"If only there were some, oh I don't know, 40 year record we could check and see if he was being sincere.",1586633068.0,"04/11/2020, 19:24:28",3,0,34,3.370220160484962,0.91,0.08823529411764706
745,GreenParty,Basic income is the answer to a COVID-stricken economy by Mike Schreiner (leader of the Green Party of Ontario) and Jo-Ann Roberts (Interim Leader of the Green Party of Canada),1585194788.0,"03/26/2020, 03:53:08",0,0,34,-0.1018266396706835,1.0,0.0
746,GreenParty,Houston Rent Strike freaks out Landlord,1585171653.0,"03/25/2020, 21:27:33",0,0,35,1.1396251978505916,0.97,0.0
747,GreenParty,Greens should stay independent of these competing partisan narratives. Greens should focus on the social and environmental problems that the Russiagate obsession is distracting the corporate media and the public away from.,1584894559.0,"03/22/2020, 16:29:19",0,0,34,0.8522849034429711,0.98,0.0
748,GreenParty,"""What we need is system change, not climate change"" - Natalie Bennett speaking at the House of Lords. (Green Party of England and Wales)",1581261229.0,"02/09/2020, 15:13:49",0,0,34,1.0665584283567924,0.97,0.0
749,GreenParty,How thawing permafrost is transforming the Arctic,1581025241.0,"02/06/2020, 21:40:41",0,0,33,2.965752792569944,0.92,0.0
750,GreenParty,"Maryland’s 45th District delegate should be elected, not appointed | Op Ed for The Baltimore Sun by Maryland Green Party co-chair Andy Ellis (GPUS)",1578667727.0,"01/10/2020, 14:48:47",2,0,36,1.0250098162879695,0.97,0.05555555555555555
751,GreenParty,"Pittsburgh, PA Greens at our local No War on Iran action. Tell us about your local demonstration. (GPUS)",1578197042.0,"01/05/2020, 04:04:02",6,0,33,2.7265792281237893,0.92,0.18181818181818182
752,GreenParty,Climate emergency demands an ecosocialist solution,1575906959.0,"12/09/2019, 15:55:59",0,0,32,2.0125508485264376,0.94,0.0
753,GreenParty,Democrats’ Plan Will Suppress Third Parties in New York - The New York Times (11-29-2019),1575308901.0,"12/02/2019, 17:48:21",2,0,32,1.634034509272503,0.95,0.0625
754,GreenParty,Greens to State Department: Respect Bolivia’s Self -Determination - Green Party US,1573574756.0,"11/12/2019, 16:05:56",1,0,34,0.10857505866419359,1.0,0.029411764705882353
755,GreenParty,Washington Journal: Howie Hawkins Discusses His 2020 Green Party Candidacy for President,1603566682.0,"10/24/2020, 19:11:22",1,0,33,2.4177767731790283,0.93,0.030303030303030304
756,GreenParty,Happy to see all the green downballot.,1603335295.0,"10/22/2020, 02:54:55",8,0,32,3.514320909481441,0.9,0.25
757,GreenParty,Ask a Green Megathread - Fall 2020,1600088874.0,"09/14/2020, 13:07:54",103,0,33,3.124756756822734,0.91,3.121212121212121
758,GreenParty,Beacon Podcast interviews Green Independent Lisa Savage - Maine Senate Race,1596722730.0,"08/06/2020, 14:05:30",1,0,33,2.3610405164575994,0.93,0.030303030303030304
759,GreenParty,A vision of a Universal Basic Income in the UK after Covid! Submitted to openDemocracy,1593359946.0,"06/28/2020, 15:59:06",1,0,33,1.097127313217257,0.97,0.030303030303030304
760,GreenParty,WE SEE YOU NYPD! - END POLICE BRUTALITY!,1592614983.0,"06/20/2020, 01:03:03",0,0,36,1.4240609703893412,0.96,0.0
761,GreenParty,"IF YOU GUYS WANT TO LEARN MORE ABOUT HOWIE , WATCH THIS INTERVIEW.",1586374960.0,"04/08/2020, 19:42:40",0,0,34,1.1486242028113125,0.97,0.0
