,Subreddit,Title,Epoch Time,Date,Comments,Awards,Upvotes,Downvotes,Upvote Ratio,Comment/Upvote Ratio
638,law,Thailand: Judge dies in apparent suicide protesting judicial system,1583595151.0,"03/07/2020, 15:32:31",4,0,181,2.7228694330894427,0.99,0.022099447513812154
639,law,Roger Stone Jurors Will Get Free Legal Help During Bias Dispute,1583250434.0,"03/03/2020, 15:47:14",41,0,184,13.958291976305333,0.93,0.22282608695652173
640,law,A years-old lawsuit challenging detention conditions in several of the Border Patrol’s Arizona stations will go to trial Monday as the agency as a whole has come under fire following several migrant deaths. The lawsuit filed in 2015 applies to eight Border Patrol facilities in Arizona,1578868409.0,"01/12/2020, 22:33:29",15,0,182,14.296113620114767,0.93,0.08241758241758242
641,law,U.S. Supreme Court rejects inmate's bid for sex reassignment surgery,1575927257.0,"12/09/2019, 21:34:17",164,0,183,11.78360907516742,0.94,0.8961748633879781
642,law,Manhattan District Attorney Vance urges judge to toss Trump challenge to tax records subpoena,1596473207.0,"08/03/2020, 16:46:47",30,0,177,6.878873059968214,0.96,0.1694915254237288
643,law,"AG Barr: ""History is written by the winners"" Isn't this simply saying ""I believe in autocracy?""",1588949930.0,"05/08/2020, 14:58:50",83,0,179,42.554238791432795,0.81,0.46368715083798884
644,law,Press Has First Amendment Right to See New Court Complaints on Day of Filing,1582395210.0,"02/22/2020, 18:13:30",19,0,177,4.090900183700313,0.98,0.10734463276836158
645,law,China says Hong Kong courts have no power to rule on face mask ban,1574129309.0,"11/19/2019, 02:08:29",16,0,182,5.299763320744148,0.97,0.08791208791208792
646,law,"Netflix asks viewers to watch controversial new show about child exploitation, 'Cuties,' Sen. Ted Cruz seeks criminal investigation",1600095734.0,"09/14/2020, 15:02:14",280,0,178,18.57581364437965,0.91,1.5730337078651686
647,law,"Trump Considers Banning Re-entry by Citizens Who May Have Coronavirus: Under the proposal, the government could block a citizen or legal resident’s entry if an official “reasonably believes” the person had been exposed to or was infected with the communicable disease",1597111713.0,"08/11/2020, 02:08:33",49,0,180,6.401018338994419,0.97,0.2722222222222222
648,law,Federal Law Enforcement Use Unmarked Vehicles To Grab Protesters Off Portland Streets,1594954526.0,"07/17/2020, 02:55:26",192,0,181,10.048348651622632,0.95,1.0607734806629834
649,law,Judge urges Legislature to bar police from using ‘deceptive schemes’ to skirt Miranda rights,1576126489.0,"12/12/2019, 04:54:49",31,0,180,4.065162053900707,0.98,0.17222222222222222
650,law,Duke Law: When Stand Your Ground Meets Blue Lives Matter,1590283371.0,"05/24/2020, 01:22:51",64,0,179,12.277207187471987,0.94,0.3575418994413408
651,law,Judge Strikes Down Republican-Backed Voter Registration Law as ‘Unconstitutional’ and ‘Discriminatory’,1586643278.0,"04/11/2020, 22:14:38",15,0,176,16.716349730624756,0.91,0.08522727272727272
652,law,Appeals court orders Trump's banks to turn financial records over to Congress,1575387204.0,"12/03/2019, 15:33:24",19,0,175,8.799069259776104,0.95,0.10857142857142857
653,law,A Michigan city will pay $190K to an American war veteran who was detained by ICE,1573820766.0,"11/15/2019, 12:26:06",42,0,182,9.03767775849633,0.95,0.23076923076923078
654,law,‘Where are all of the arrests?’: Trump demands Barr lock up his foes,1602163092.0,"10/08/2020, 13:18:12",39,0,175,13.231032605007073,0.93,0.22285714285714286
655,law,Jay-Z goes to bat for Mississippi prisoners and files federal lawsuit,1579104986.0,"01/15/2020, 16:16:26",32,0,174,14.850212861169496,0.92,0.1839080459770115
656,law,"As Evictions Loom, Lawyers Are Gearing Up to Help",1598268517.0,"08/24/2020, 11:28:37",122,0,177,5.590238110710317,0.97,0.6892655367231638
657,law,Opinion | The no-knock warrant for Breonna Taylor was illegal,1591293205.0,"06/04/2020, 17:53:25",50,0,175,4.706491356421708,0.97,0.2857142857142857
658,law,Plaintiffs want to blame China for the global pandemic,1586010891.0,"04/04/2020, 14:34:51",83,0,176,16.204016952926906,0.92,0.4715909090909091
659,law,Michigan Cops Seized This Woman’s Car After Her Then-Boyfriend Allegedly Picked Up a Prostitute,1581171484.0,"02/08/2020, 14:18:04",24,0,174,4.834056529982632,0.97,0.13793103448275862
660,law,"Gold Star Families Sue Defense Contractors, Alleging They Funded The Taliban",1577598067.0,"12/29/2019, 05:41:07",29,0,179,6.497425095664653,0.96,0.16201117318435754
661,law,John Oliver's recent segment on jury selection process. Thoughts on the accuracy and his point?,1597670368.0,"08/17/2020, 13:19:28",171,0,176,17.77338328765572,0.91,0.9715909090909091
662,law,Audio: Attorney General Barr Says DOJ Acts Independent Of Trump's Interests,1593130086.0,"06/26/2020, 00:08:06",27,0,177,8.234196927506673,0.96,0.15254237288135594
663,law,NYT Editorial Board | How the Supreme Court Lets Cops Get Away With Murder: The courts protected police abuses for years before George Floyd’s death. It’s time to rethink “qualified immunity”,1590882841.0,"05/30/2020, 23:54:01",47,0,175,19.61389876723524,0.9,0.26857142857142857
664,law,Russian firm says it will sue U.S for $50 billion after meddling case dropped,1584460426.0,"03/17/2020, 15:53:46",19,0,174,10.987434126451745,0.94,0.10919540229885058
665,law,"Trump bucks Barr’s request to stop tweeting about Justice Dept., declaring a ‘legal right’ to seek intervention in criminal cases",1581690350.0,"02/14/2020, 14:25:50",119,0,179,7.371150708355401,0.96,0.664804469273743
666,law,"Please help me make a poster like this, but for lawyers - Phrases lawyers say and what they really mean. What are some good/funny phrases that lawyers say and their real mening?",1580729143.0,"02/03/2020, 11:25:43",156,0,177,27.43965037036577,0.87,0.8813559322033898
667,law,US states move to stop prisons charging inmates for reading and video calls,1578949194.0,"01/13/2020, 20:59:54",28,0,179,5.518775735780139,0.97,0.1564245810055866
668,law,Police act like laws don't apply to them because of 'qualified immunity.' They're right.,1590963055.0,"05/31/2020, 22:10:55",45,0,175,15.290982318693978,0.92,0.2571428571428571
669,law,Selena Gomez Suing Game For $10 Million For Stealing Her Likeness,1587346564.0,"04/20/2020, 01:36:04",61,0,174,11.511601974837134,0.94,0.3505747126436782
670,law,France rules Google must pay news firms for content,1586635418.0,"04/11/2020, 20:03:38",21,0,177,5.773479074510362,0.97,0.11864406779661017
671,law,"Deputy who slammed N.C. middle school student to floor is fired, charged with assault",1576655698.0,"12/18/2019, 07:54:58",68,0,174,4.566950737934462,0.97,0.39080459770114945
672,law,Ginsburg at her own hearing.,1602704942.0,"10/14/2020, 19:49:02",16,0,170,16.206197236020955,0.91,0.09411764705882353
673,law,Police Agencies Acknowledge Slashing Protesters' Tires: Report,1591670153.0,"06/09/2020, 02:35:53",35,0,174,6.8100247910741984,0.96,0.20114942528735633
674,law,Ex-Trump campaign boss Paul Manafort released as coronavirus spreads in prisons,1589379101.0,"05/13/2020, 14:11:41",56,0,176,11.525547855873867,0.94,0.3181818181818182
675,law,Chief Justice John Roberts was hospitalized last month after injuring his head in a fall,1594176023.0,"07/08/2020, 02:40:23",66,0,169,2.8258827300062137,0.98,0.3905325443786982
676,law,Justice Dept. Opens Criminal Inquiry Into John Bolton’s Book,1600183457.0,"09/15/2020, 15:24:17",32,0,171,6.3397610807801925,0.96,0.1871345029239766
677,law,US Church Sues After Bible-Study Class is 'Zoombombed' with Child Pornography (SecAlerts),1589555057.0,"05/15/2020, 15:04:17",54,0,171,13.490648985569095,0.93,0.3157894736842105
678,law,"Publisher of The Federalist Broke the Law When He Tweeted He'd Send Employees ""Back to the Salt Mine"" If They Unionized, a Judge Has Ruled",1587672398.0,"04/23/2020, 20:06:38",27,0,170,4.673857225335695,0.97,0.1588235294117647
679,law,Judge Accuses DoorDash of Trying to 'Squirm' Out of Arbitration,1574780061.0,"11/26/2019, 14:54:21",93,0,169,3.8068827903418594,0.98,0.5502958579881657
680,law,"Federal Judge [Laurence Silberman] Lambasts Amendment to Rename Confederate Bases as ""Madness,"" Gets Thoroughly Bodied by Clerk",1592290976.0,"06/16/2020, 07:02:56",52,0,171,25.34021382638244,0.87,0.30409356725146197
681,law,CNN settles lawsuit with Nick Sandmann,1578429721.0,"01/07/2020, 20:42:01",151,0,167,24.678395491319122,0.87,0.9041916167664671
682,law,Skadden Says Juneteenth to Be Firmwide Holiday,1592049983.0,"06/13/2020, 12:06:23",60,0,170,20.69838291564784,0.89,0.35294117647058826
683,law,Ken Paxton Says New Anti-Abortion Law Bars State Employees from Donating to Planned Parenthood: Advocates warn that the attorney general’s new opinion indicates how far efforts to implement a vague new law could go,1578718137.0,"01/11/2020, 04:48:57",76,0,164,14.494429478442385,0.92,0.4634146341463415
684,law,"McGirt v Oklahoma judgment: For Major Crime Act purposes, land reserved for the Creek Nation since the 19th century remains “Indian country.” """,1594303399.0,"07/09/2020, 14:03:19",168,0,170,3.1589128079658906,0.98,0.9882352941176471
685,law,The President’s Legal Shell Game to Avoid Accountability,1584760552.0,"03/21/2020, 03:15:52",38,0,165,39.41257129279981,0.81,0.23030303030303031
686,law,"Devin Nunes Files Defamation Lawsuit (#7) Against Washington Post, Journalist",1583217059.0,"03/03/2020, 06:30:59",43,0,164,4.096335662335292,0.98,0.2621951219512195
687,law,Supreme Court rules 5-4 against an Arizona death row prisoner in a case he said could impact 20 prisoners in that state alone,1582644319.0,"02/25/2020, 15:25:19",59,0,167,13.027329335237312,0.93,0.3532934131736527
688,law,"Abbott Labs kills free tool that lets you own the blood-sugar data from your glucose monitor, saying it violates copyright law",1578073797.0,"01/03/2020, 17:49:57",32,0,165,7.718258090710151,0.96,0.19393939393939394
689,law,The Right to Escape From Prison,1603123868.0,"10/19/2020, 16:11:08",30,1,165,9.134786192400725,0.95,0.18181818181818182
690,law,Michigan Sheriff Defends Man Suspected of Planning Whitmer Kidnapping Conspiracy During ‘Wild’ Interview,1602275441.0,"10/09/2020, 20:30:41",90,0,167,9.82688956565687,0.94,0.5389221556886228
691,law,Video: America's Public Defense System is in Crisis,1583152858.0,"03/02/2020, 12:40:58",60,0,166,9.337890209901502,0.95,0.3614457831325301
692,law,"Court: Kansas ""Ag-Gag"" unconstitutionally bans free speech",1579831007.0,"01/24/2020, 01:56:47",8,0,163,0.8489273023259614,0.99,0.049079754601226995
693,law,City Of Dallas Shuts Down Business Of Man Who Called Cops Over 100 Times In 20 Months To Deal With Criminals Near His Car Wash | Techdirt,1579521878.0,"01/20/2020, 12:04:38",54,0,164,2.550368298251101,0.98,0.32926829268292684
694,law,Kavanaugh comes out in support of Bush v. Gore in footnote to DNC v. Wisconsin State Legislature,1603757052.0,"10/27/2020, 00:04:12",113,0,164,9.778839627101576,0.94,0.6890243902439024
695,law,Justice Department centralizes control of sensitive insider-trading probes,1589983090.0,"05/20/2020, 13:58:10",22,0,164,5.365858691197445,0.97,0.13414634146341464
696,law,"‘Anti-Feminist’ and ""Mens Rights"" lawyer identified as suspect in killing of son of Federal Judge in N.J.",1595277515.0,"07/20/2020, 20:38:35",54,0,162,18.405658708885596,0.9,0.3333333333333333
697,law,"Elizabeth Warren proposes civil and criminal penalties for knowing dissemination of ""information which undermines the right to vote""",1580341127.0,"01/29/2020, 23:38:47",115,0,166,16.056530041607033,0.91,0.6927710843373494
698,law,Oakland is the first California city to ban criminal background checks on renters,1579892717.0,"01/24/2020, 19:05:17",118,0,161,7.261683766990103,0.96,0.7329192546583851
699,law,Federal judge denies bid to undo Georgia voter purge,1577520677.0,"12/28/2019, 08:11:17",35,0,161,16.72928935252969,0.91,0.21739130434782608
700,law,"Judge Extends Census Counting, Rails Against Admin For Violating Her Previous Order",1601650007.0,"10/02/2020, 14:46:47",31,0,163,4.886474578144998,0.97,0.1901840490797546
701,law,"Judges Not Barred from Federalist Society, American Constitution Society Membership",1596280843.0,"08/01/2020, 11:20:43",69,0,161,8.270776416226056,0.95,0.42857142857142855
702,law,"“Defendant Shall Not Attend Protests”: In Portland, Getting Out of Jail Requires Relinquishing Constitutional Rights",1595969844.0,"07/28/2020, 20:57:24",97,0,165,17.578213773045718,0.9,0.5878787878787879
703,law,Trump to invoke Insurrection Act of 1807,1591054448.0,"06/01/2020, 23:34:08",211,0,162,3.5585333840781743,0.98,1.3024691358024691
704,law,Tennessee Supreme Court stays execution of death row inmate due to COVID-19 pandemic,1587313192.0,"04/19/2020, 16:19:52",23,0,161,7.109136662688968,0.96,0.14285714285714285
705,law,A District Court judge on Friday ruled that federal immigration officials cannot detain immigrants for the purpose of deportation if they are currently involved in legal proceedings to acquire legal status via a marriage to a U.S. citizen,1581366712.0,"02/10/2020, 20:31:52",14,0,161,13.17691483490006,0.92,0.08695652173913043
706,law,A federal judge rejected a lawsuit against President Trump over not keeping records of his meetings with foreign leaders. The judge ruled that past legal precedents say she cannot monitor the White House’s enforcement of laws on how executive branch records are kept,1581434844.0,"02/11/2020, 15:27:24",65,0,162,6.236463312616763,0.96,0.4012345679012346
707,law,Kentucky judge accused of courthouse threesome is suspended,1578519124.0,"01/08/2020, 21:32:04",36,0,158,6.945461113167909,0.96,0.22784810126582278
708,law,"The US Eliminated Nearly 21,000 Election Day Polling Locations for 2020",1603377981.0,"10/22/2020, 14:46:21",10,0,159,26.367987267024546,0.86,0.06289308176100629
709,law,"Michael Flynn’s Attorney Invokes ‘Executive Privilege,’ But Admits She Personally Spoke with Trump About the Case",1601401756.0,"09/29/2020, 17:49:16",52,0,157,10.81541821375842,0.94,0.33121019108280253
710,law,U.S. cities sue ATF over untraceable 'ghost guns',1598458529.0,"08/26/2020, 16:15:29",47,0,158,14.773732952509931,0.91,0.2974683544303797
711,law,"A Massachusetts City Decides to Recognize Polyamorous Relationships - The city of Somerville has broadened the definition of domestic partnership to include relationships between three or more adults, expanding access to health care.",1593838108.0,"07/04/2020, 04:48:28",110,0,157,12.771758118591123,0.92,0.7006369426751592
712,law,We don’t own our digital lives and it’s time we started caring about it,1590343799.0,"05/24/2020, 18:09:59",81,0,160,10.589949850683496,0.94,0.50625
713,law,"A federal judge on Thursday indefinitely blocked a new California labor law from applying to more than 70,000 independent truckers, deciding that it is preempted by federal rules on interstate commerce",1579411224.0,"01/19/2020, 05:20:24",47,0,157,6.12801078044447,0.96,0.29936305732484075
714,law,"Copyright Troll Richard Liebowitz May Have Cost His Client A Ton Of Money, And Set An Expensive Precedent For Copyright Trolls",1573650769.0,"11/13/2019, 13:12:49",58,0,163,5.748822728538471,0.97,0.3558282208588957
715,law,"Exclusive: Trump to block U.S. downloads of TikTok, WeChat on Sunday - officials",1600431901.0,"09/18/2020, 12:25:01",88,0,158,3.528328667604427,0.98,0.5569620253164557
716,law,"Poland: Judges punished for criticizing government reforms, report finds. Prosecutors and judges have been moved to lower courts, had cases taken away and have been otherwise disciplined for questioning the Polish government's controversial judicial reforms,",1583013754.0,"02/29/2020, 22:02:34",11,0,159,8.597369281313803,0.95,0.06918238993710692
717,law,Court rules Arizona GOP's ballot law discriminates against minorities,1580178495.0,"01/28/2020, 02:28:15",32,0,158,18.6845396892046,0.89,0.20253164556962025
718,law,Leaked audio: Lawyers praised 'beauty' of controversial protest-response tactics,1596534078.0,"08/04/2020, 09:41:18",109,0,159,15.183812825202835,0.91,0.6855345911949685
719,law,Homeland Security Was Destined to Become a Secret Police Force,1595738820.0,"07/26/2020, 04:47:00",79,0,159,26.49867443078233,0.86,0.4968553459119497
720,law,MIT &amp; Harvard sue Trump Administration over new Student Visa regulations,1594218083.0,"07/08/2020, 14:21:23",6,0,154,11.413034209931283,0.93,0.03896103896103896
721,law,Hong Kong Court of Appeal ruled in favour of the HK police: police don't require warrant to inspect the arrested’s phone.,1585873752.0,"04/03/2020, 00:29:12",6,0,156,11.667404462650438,0.93,0.038461538461538464
722,law,Orangutan granted ‘personhood’ settles into new Florida home,1574686820.0,"11/25/2019, 13:00:20",42,0,156,9.615513558986947,0.94,0.2692307692307692
723,law,"How We Found Out How Many Debt Collection Lawsuits Oportun Inc. Filed During the Pandemic - Justice of the peace courts, where a majority of debt claims are filed in Texas, aren’t required to report case-level information.",1599997100.0,"09/13/2020, 11:38:20",20,0,153,9.65443983551694,0.94,0.13071895424836602
724,law,"Federal judge finds state lacks standing, denies Oregon attorney general’s motion to restrict federal police actions",1595631951.0,"07/24/2020, 23:05:51",101,0,157,5.003820467634114,0.97,0.643312101910828
725,law,Law Professor On Misdemeanor Offenses And Racism In The Criminal System,1592137962.0,"06/14/2020, 12:32:42",158,0,156,27.223208051726942,0.85,1.0128205128205128
726,law,"The story of a black man in Georgia who was killed during a ""citizens arrest"" while jogging generated a lot of conversation here yesterday. A video was released today. In light of the video, does the case change significantly?",1588719092.0,"05/05/2020, 22:51:32",179,0,156,12.573035024211748,0.93,1.1474358974358974
727,law,"[New Jersey] Gov. Murphy is violating our right to bear arms by closing gun shops, lawsuit says",1585001308.0,"03/23/2020, 22:08:28",192,0,157,27.75865539225208,0.85,1.2229299363057324
728,law,Ruth Bader Ginsburg says deadline to ratify Equal Rights Amendment has expired: 'I'd like it to start over',1581391189.0,"02/11/2020, 03:19:49",108,0,153,9.048514352757849,0.94,0.7058823529411765
729,law,Man whose Supreme Court case turned much of Oklahoma criminal jurisdiction on its head heads to trial this week,1604327426.0,"11/02/2020, 14:30:26",52,0,161,7.527202874086413,0.96,0.32298136645962733
730,law,Bill de Blasio demands ICE agents stop pretending to be NYPD,1602458759.0,"10/11/2020, 23:25:59",47,0,156,9.52482801697866,0.94,0.30128205128205127
731,law,Minneapolis police officer arrested in George Floyd case,1590775368.0,"05/29/2020, 18:02:48",147,0,156,8.037041060022489,0.95,0.9423076923076923
732,law,SCOTUS: States can Keep Infringing Copyright With Immunity/Impunity,1585050637.0,"03/24/2020, 11:50:37",31,0,153,2.6224335337515186,0.98,0.20261437908496732
733,law,"White House claims “The president of the United States is not a civilian,”",1593058494.0,"06/25/2020, 04:14:54",87,0,154,8.536431649135551,0.95,0.564935064935065
734,law,George Washington University Law School Faculty Tried To Get Bill Barr’s Honorary Degree Revoked,1591384003.0,"06/05/2020, 19:06:43",21,0,154,15.89116534364993,0.91,0.13636363636363635
735,law,A would-be class suit alleging General Mills failed to disclose the presence of glyphosate residue in Cheerios can’t proceed because the plaintiff didn’t show she actually bought any cereal with the chemical in it ¯\_(ツ)_/¯,1590322063.0,"05/24/2020, 12:07:43",45,0,158,9.357643597052999,0.94,0.2848101265822785
736,law,"Banks Fast-Tracked Large PPP Loans (Small Business Loans) to Max Out Fees And Disfavor Smaller Businesses, Suits Allege.",1587526321.0,"04/22/2020, 03:32:01",25,0,153,4.208917436107328,0.97,0.16339869281045752
737,law,‘Nobody Cares About the Little People’: Cruise Crews File Covid-19 Suit,1587088888.0,"04/17/2020, 02:01:28",13,0,154,6.874135615721514,0.96,0.08441558441558442
738,law,"After 2 Supreme Court wins, Florida man gets $875K from city",1580949393.0,"02/06/2020, 00:36:33",38,0,155,4.285475908887264,0.97,0.24516129032258063
739,law,"Barr delivering a broadside to career prosecutors tonight, &amp; making the case that the AG intervening in cases is appropriate and proper. Says letting junior people set agenda ""might be a good philosophy for a Montessori preschool, but it is no way to run a federal agency.",1600306716.0,"09/17/2020, 01:38:36",50,0,155,4.803081256001661,0.97,0.3225806451612903
740,law,Federal hate crime charges filed against NY Hanukkah stabbing suspect,1577747057.0,"12/30/2019, 23:04:17",71,0,153,6.464558389997848,0.96,0.46405228758169936
741,law,California Police Are Using Copyright to Hide Surveillance Documents [in violation of law],1593535877.0,"06/30/2020, 16:51:17",19,0,151,3.842519963328556,0.98,0.12582781456953643
742,law,"Trump’s Bid to Stand Above the Law: Next week, the Supreme Court will hear lawyers argue the president’s claim that he has absolute immunity while in office",1588994686.0,"05/09/2020, 03:24:46",78,0,151,23.22409462347227,0.87,0.5165562913907285
743,law,Lori Loughlin accuses prosecutors of concealing evidence in college admissions scandal,1576466272.0,"12/16/2019, 03:17:52",52,0,149,5.579887621189414,0.96,0.348993288590604
744,law,WeChat: Judge blocks US attempts to ban downloads of Chinese app,1600615943.0,"09/20/2020, 15:32:23",112,0,152,5.086047218342344,0.97,0.7368421052631579
745,law,"Attorney General William Barr on video says he's not sure if the law allows a person to attempt to vote in an election twice, once by mail and again at the polls.",1599098827.0,"09/03/2020, 02:07:07",47,0,148,12.350484117852801,0.92,0.31756756756756754
746,law,Illinois Supreme Court Rules Chicago Police Department Misconduct Records Cannot Be Destroyed,1592495509.0,"06/18/2020, 15:51:49",8,0,149,6.2092955633668225,0.96,0.053691275167785234
747,law,"After 6 Murder Trials and 24 Years, Charges Dropped Against Curtis Flowers",1599256902.0,"09/04/2020, 22:01:42",30,0,152,5.126301900784142,0.97,0.19736842105263158
748,law,"California Court Upholds Monsanto Cancer Verdict, Slashes Damages to $21.5M",1595429278.0,"07/22/2020, 14:47:58",54,0,149,4.804328371474469,0.97,0.3624161073825503
749,law,Missouri Sues Televangelist Jim Bakker For Selling Fake Coronavirus Cure,1584110372.0,"03/13/2020, 14:39:32",23,0,149,7.56373467455623,0.95,0.15436241610738255
750,law,Samira Ahmed wins sex discrimination equal pay claim against BBC,1578673663.0,"01/10/2020, 16:27:43",43,0,149,14.156714662290966,0.91,0.28859060402684567
751,law,Elon Musk: pedo guy insult was 'not classy' but not meant literally,1575464189.0,"12/04/2019, 12:56:29",92,0,150,11.412330072042664,0.93,0.6133333333333333
752,law,"A federal judge voided five oil and gas leases on public lands that amounted to nearly a million acres, arguing that the Trump administration wrongly excluded public input",1582907999.0,"02/28/2020, 16:39:59",11,0,146,9.920161134045827,0.94,0.07534246575342465
753,law,L.A. is repealing requirements for would-be contractors to reveal NRA ties,1579650862.0,"01/21/2020, 23:54:22",22,0,150,12.837253352940678,0.92,0.14666666666666667
754,law,"USA's 1st settlement payment to a woman wrongfully charged for being topless: City of Loveland, Colorado pays $50K, drops charges against a woman who was issued a summons for topfree Frisbee playing in her own front yard",1573349864.0,"11/10/2019, 01:37:44",46,0,146,12.82686332165082,0.92,0.3150684931506849
755,law,Bridgegate Convictions Tossed Out by U.S. Supreme Court,1588861426.0,"05/07/2020, 14:23:46",142,0,149,8.120952814161257,0.95,0.9530201342281879
756,law,"No Qualified Immunity for Pittsburgh Cop Who Wrongly Detained Black Teenager, ‘Slammed’ Him Against a Wall",1600352330.0,"09/17/2020, 14:18:50",30,0,147,10.746932229864228,0.93,0.20408163265306123
757,law,"Robert Mueller: Roger Stone remains a convicted felon, and rightly so",1594509314.0,"07/11/2020, 23:15:14",21,0,143,15.16871787424904,0.9,0.14685314685314685
758,law,Burning Man organizers are suing the U.S. Bureau of Land Management to recover millions of dollars they say the government has overcharged them in fees over the past seven years at the counter-culture celebration in the Nevada desert,1577332105.0,"12/26/2019, 03:48:25",28,0,142,7.796904062686053,0.95,0.19718309859154928
759,law,"Broken windows and a Molotov cocktail: DOJ finds creative ways into local rioting cases. While some of the cases are unquestionably grave, others have raised questions about whether the federal government is stretching its authority to satisfy President Donald Trump",1592712563.0,"06/21/2020, 04:09:23",62,0,146,17.251683450614763,0.89,0.4246575342465753
760,law,7th circuit slams Board of Immigration Appeals after it defied its ruling on remand,1579829146.0,"01/24/2020, 01:25:46",33,0,149,7.81321037821877,0.95,0.2214765100671141
761,law,American Carnage at Lafayette Square,1591204074.0,"06/03/2020, 17:07:54",20,0,144,8.745240880026444,0.94,0.1388888888888889
762,law,Criminal Trespass Charges Dropped Against Two Journos Who Reported At Liberty U,1589582792.0,"05/15/2020, 22:46:32",27,0,141,6.516679324197895,0.96,0.19148936170212766
763,law,Supreme Court says it will hear cases over Obamacare constitutionality,1583160131.0,"03/02/2020, 14:42:11",73,0,141,4.411083039344874,0.97,0.5177304964539007
764,law,Breonna Taylor’s Ex Offered Plea Deal Which Required Him to Say She Was Part of Drug Operation (UPDATE),1599041379.0,"09/02/2020, 10:09:39",53,0,146,7.116042087332318,0.95,0.363013698630137
765,law,Ancient Lawyers/Judges from across the world!,1597855836.0,"08/19/2020, 16:50:36",24,0,145,9.37005772868855,0.94,0.16551724137931034
