,Subreddit,Title,Epoch Time,Date,Comments,Awards,Upvotes,Downvotes,Upvote Ratio,Comment/Upvote Ratio
0,law,Fox News Lawyer Suggests No Reasonable Viewer Would Think Tucker Carlson Is News,1592450892.0,"06/18/2020, 03:28:12",422,0,3507,182.05691730477292,0.95,0.12033076703735386
1,law,"Justice Ruth Bader Ginsburg, Champion Of Gender Equality, Dies At 87",1600472204.0,"09/18/2020, 23:36:44",655,2,2919,306.74002457093957,0.9,0.22439191503939707
2,law,SCOTUS: Held: An employer who fires an individual merely for being gay or transgender violates Title VII.,1592229792.0,"06/15/2020, 14:03:12",725,0,2151,91.80769317040767,0.96,0.33705253370525334
3,law,The Moderators of /r/law (save one) Endorse Joe Biden for President of the United States,1601657857.0,"10/02/2020, 16:57:37",228,23,1971,508.541062735349,0.79,0.1156773211567732
4,law,"Justin Amash: This week, I am introducing the Ending Qualified Immunity Act to eliminate qualified immunity and restore Americans’ ability to obtain relief when police officers violate their constitutionally secured rights.",1591015232.0,"06/01/2020, 12:40:32",263,0,1003,35.09334010125713,0.97,0.2622133599202393
5,law,Interesting Title,1595504948.0,"07/23/2020, 11:49:08",120,0,944,43.89205049286193,0.96,0.1271186440677966
6,law,"Five years ago today, the Supreme Court's decision in Obergefell v. Hodges legalized same-sex marriage in the U.S. Pictured: Plaintiff Jim Obergefell holds a photo of his late husband John Arthur.",1593186926.0,"06/26/2020, 15:55:26",65,0,856,63.19185566319027,0.93,0.07593457943925233
7,law,Dallas Police Department added “duty to intervene” to department policy today,1591327383.0,"06/05/2020, 03:23:03",62,0,835,7.106280130146274,0.99,0.07425149700598803
8,law,Illegal Picture Taken Inside the Supreme Court in 1932. Dr. Erich Salomon Faked a Broken Arm So He Could Hide a Camera in His Cast.,1599607293.0,"09/08/2020, 23:21:33",51,2,808,12.676336211632133,0.98,0.06311881188118812
9,law,Someone literally just flushed the toilet during Supreme Court oral arguments.,1588784831.0,"05/06/2020, 17:07:11",83,1,796,20.39662487295743,0.98,0.10427135678391959
10,law,Nobody reads privacy policies. This senator wants lawmakers to stop pretending we do. - Sen. Sherrod Brown wants to upend years of debate over a potential federal privacy law by shifting the burden away from consumers and onto companies.,1592575237.0,"06/19/2020, 14:00:37",67,0,782,7.96998559596625,0.99,0.08567774936061381
11,law,"PSA: Double Voting Is a Crime, and Solicitation of Double Voting Is Also a Crime",1599165381.0,"09/03/2020, 20:36:21",109,2,748,59.10799196248547,0.93,0.14572192513368984
12,law,Chief Justice of the Supreme Court of Ohio (who is a Republican) on the Ohio Republican Party statement re: recent ballot drop box ruling (x-post from /r/Ohio),1600313332.0,"09/17/2020, 03:28:52",76,1,688,22.660573732692683,0.97,0.11046511627906977
13,law,SC Supreme Court orders an immediate moratorium on no-knock warrants,1594414986.0,"07/10/2020, 21:03:06",103,0,678,8.493405028473035,0.99,0.15191740412979352
14,law,"Bernard Cohen, lawyer who won victory for interracial marriage in Loving v. Virginia, dies at 86",1602690377.0,"10/14/2020, 15:46:17",31,1,661,12.23830633355999,0.98,0.046898638426626324
15,law,"As a veteran and trial attorney, I think I have found my favorite mask.",1596652739.0,"08/05/2020, 18:38:59",21,0,659,48.5230307839488,0.93,0.03186646433990895
16,law,ACLU Offers Britney Spears Help If She Wants To Terminate Conservatorship,1597925650.0,"08/20/2020, 12:14:10",114,0,639,17.721424234232813,0.97,0.1784037558685446
17,law,I’m sure LegalZoom will be just fine,1600132999.0,"09/15/2020, 01:23:19",42,0,620,28.492347737312798,0.96,0.06774193548387097
18,law,"Gunman Opened Fire On Home Of U.S. District Judge Esther Salas, Killing Son And Injuring Husband",1595250555.0,"07/20/2020, 13:09:15",58,0,610,26.565625806238245,0.96,0.09508196721311475
19,law,OTD in 1981: President Reagan announced he would nominate Judge Sandra Day O’Connor to become the first female justice on the U.S. Supreme Court.,1594130281.0,"07/07/2020, 13:58:01",101,0,616,30.613839544255484,0.95,0.16396103896103897
20,law,Don't you know who I am: arguing with Orin Kerr about the 4th Am. edition.,1595341018.0,"07/21/2020, 14:16:58",131,0,607,31.944774262572196,0.95,0.2158154859967051
21,law,Federal Judge Declares ICE Arrests at Courthouses ‘Illegal’ in Huge Blow to Trump Administration,1591827141.0,"06/10/2020, 22:12:21",48,0,615,41.79388175576071,0.94,0.07804878048780488
22,law,butt shaking,1588693716.0,"05/05/2020, 15:48:36",56,0,609,15.026181210806385,0.98,0.09195402298850575
23,law,"Federal Judge tosses out GOP bid to throw out 100,000+ votes in drive-through voting case. Plaintiffs have no standing.",1604349001.0,"11/02/2020, 20:30:01",139,2,689,29.321315205115525,0.96,0.20174165457184326
24,law,"[Vermont's Secretary of State] We have formally requested that #SCOTUS correct the erroneous claim by Justice Kavanaugh that #VT has not changed voting procedures for the #2020Elections due to #COVID19. When it comes to issuing decisions on the voting rights of American citizens, facts matter.",1603918607.0,"10/28/2020, 20:56:47",102,0,596,31.364080986952217,0.95,0.17114093959731544
25,law,"Roger Stone ordered to report to prison July 14, as judge denies request for two-month delay",1593266530.0,"06/27/2020, 14:02:10",70,0,595,21.16614838098917,0.97,0.11764705882352941
26,law,"Federal Judge Signals It's Clear That Trump Tweet Intended to Declassify All Mueller Documents, Orders DOJ to Submit Proof of Trump's Intent to the Court",1602873609.0,"10/16/2020, 18:40:09",84,0,587,20.510665361332826,0.97,0.14310051107325383
27,law,"Death of man in Tacoma, Wash., who said 'I can't breathe' in police custody, ruled a homicide after new video emerges",1591388018.0,"06/05/2020, 20:13:38",112,0,582,24.668858798783845,0.96,0.19243986254295534
28,law,Ghislaine Maxwell arrested by FBI on charges related to Jeffrey Epstein,1593696429.0,"07/02/2020, 13:27:09",133,0,579,8.999335713377945,0.98,0.229706390328152
29,law,The Supreme Court on Monday left in place a ruling that deemed it unconstitutional to criminally prosecute homeless people for sleeping on outdoor public property when no other shelter is available,1576515251.0,"12/16/2019, 16:54:11",139,0,572,11.423069410274252,0.98,0.243006993006993
30,law,Students about to start law school: “I want to practice constitutional law!” Those same students when they see an opinion that begins like this screenshot: “Never mind.”,1592500486.0,"06/18/2020, 17:14:46",146,0,569,9.172188451741022,0.98,0.2565905096660808
31,law,Ruth Bader Ginsburg discharged from hospital,1594845047.0,"07/15/2020, 20:30:47",78,1,566,24.080270139681488,0.96,0.13780918727915195
32,law,65 faculty members from AG Barr's law school alma mater (GW) say he has 'failed to fulfill his oath of office',1592937222.0,"06/23/2020, 18:33:42",117,0,563,87.3168127401151,0.87,0.20781527531083482
33,law,It be like that sometimes,1575577615.0,"12/05/2019, 20:26:55",82,1,565,32.984669398983556,0.94,0.14513274336283186
34,law,Texas Supreme Court rejects Republican effort to toss nearly 127K votes,1604263606.0,"11/01/2020, 20:46:46",42,0,557,23.18913280994616,0.96,0.07540394973070018
35,law,Murkowski becomes 2nd GOP senator to oppose a vote on Trump Supreme Court nominee before election,1600618806.0,"09/20/2020, 16:20:06",261,0,557,32.788168778679506,0.94,0.46858168761220825
36,law,It's now a felony in Illinois to assault a retail worker who is enforcing face mask rules,1597231204.0,"08/12/2020, 11:20:04",136,0,560,19.129671404559986,0.97,0.24285714285714285
37,law,"Extending one's middle finger in the general direction of a police officer (at about the distance of a football field) does not give the officer reasonable suspicion to conduct a traffic stop, says the North Carolina Supreme Court.",1589656070.0,"05/16/2020, 19:07:50",81,0,558,10.357255686565168,0.98,0.14516129032258066
38,law,A woman is suing the city of San Antonio after a police officer pulled out her tampon in public,1591534822.0,"06/07/2020, 13:00:22",76,0,555,19.237287697633178,0.97,0.13693693693693693
39,law,ACLU suit claims demonstrators’ civil rights were violated when park was forcibly cleared for Trump photo-op at church,1591312734.0,"06/04/2020, 23:18:54",94,0,551,27.550860986780094,0.95,0.1705989110707804
40,law,Senator Dumped Up to $1.6 Million of Stock After Reassuring Public About Coronavirus Preparedness — ProPublica,1584657934.0,"03/19/2020, 22:45:34",68,0,545,17.402188870149416,0.97,0.12477064220183487
41,law,Harris County (Houston) DA dismisses nearly 800 cases against peaceful protesters arrested during police brutality marches,1591786364.0,"06/10/2020, 10:52:44",68,1,543,27.879313507187362,0.95,0.1252302025782689
42,law,Law librarian here. I’ll never throw this one away.,1576693902.0,"12/18/2019, 18:31:42",29,0,540,7.053604316824249,0.99,0.053703703703703705
43,law,Texas Republicans ask federal district court to toss out 100K+ curbside ballots in Harris County (Houston),1604169173.0,"10/31/2020, 18:32:53",183,0,529,22.814907413000014,0.96,0.34593572778827975
44,law,Bar Complaint Claims Kanye West’s Campaign Lawyer is Violating the Rules by Simultaneously Working For Trump,1596840684.0,"08/07/2020, 22:51:24",123,1,521,23.35458889974143,0.96,0.236084452975048
45,law,New Jersey officials to unveil legislation that would codify Roe v. Wade into state law,1601816365.0,"10/04/2020, 12:59:25",93,0,526,27.469175329288987,0.95,0.17680608365019013
46,law,Trump’s Taxes Show Chronic Losses and Years of Income Tax Avoidance,1601242683.0,"09/27/2020, 21:38:03",259,0,528,42.42559826997069,0.93,0.49053030303030304
47,law,Hot legal takes in the lawsuit against Palm Beach's mask ordinance.,1593631195.0,"07/01/2020, 19:19:55",80,0,530,4.944381219831143,0.99,0.1509433962264151
48,law,Trump removes independent Pentagon watchdog overseeing coronavirus funds,1586278273.0,"04/07/2020, 16:51:13",148,0,521,35.19213951796587,0.94,0.2840690978886756
49,law,Harvard Law student sues university over tuition prices as classes remain online,1592899040.0,"06/23/2020, 07:57:20",124,0,522,6.767428604635825,0.99,0.23754789272030652
50,law,U.S. Supreme Court rules that jury verdicts must be unanimous,1587393920.0,"04/20/2020, 14:45:20",232,1,515,10.552349956668081,0.98,0.45048543689320386
51,law,"The Minneapolis police officer who knelt on George Floyd's neck had 18 previous complaints against him, police department says",1590713607.0,"05/29/2020, 00:53:27",147,0,517,24.140792295668575,0.96,0.28433268858800775
52,law,‘Shamefully Stupid’: Lawyers Ridicule ‘Abusively Frivolous’ Jared and Ivanka Defamation Lawsuit Over COVID-19 Billboards,1603556432.0,"10/24/2020, 16:20:32",127,1,513,44.19299681319865,0.92,0.2475633528265107
53,law,Appeals court rules 10¢-a-page charge for court documents is too high,1596990034.0,"08/09/2020, 16:20:34",84,0,513,16.0518039187632,0.97,0.16374269005847952
54,law,135 Former Manhattan Federal Prosecutors Condemn Trump Firing of U.S. Attorney Berman,1592764499.0,"06/21/2020, 18:34:59",42,0,517,43.6408432562705,0.92,0.08123791102514506
55,law,Two DHS Officials Apparently Just Admitted Their Troops Have Been Violating the Constitution,1595443736.0,"07/22/2020, 18:48:56",119,0,514,47.14596562963243,0.92,0.23151750972762647
56,law,Sotomayor Blasts Supreme Court for Upholding Florida Poll Tax That Excludes Voters ‘Simply Because They Are Poor’,1594931478.0,"07/16/2020, 20:31:18",173,0,512,50.12407039276843,0.91,0.337890625
57,law,Ruth Bader Ginsburg announces cancer recurrence,1595002988.0,"07/17/2020, 16:23:08",378,0,507,24.67320927289245,0.95,0.7455621301775148
58,law,Bill to tear down federal courts’ paywall gains momentum in Congress - Federal courts charge 10 cents per page for many documents online.,1600351173.0,"09/17/2020, 13:59:33",63,0,508,12.097773064312378,0.98,0.12401574803149606
59,law,9th Circuit Threw Out First-Degree Murder Conviction Because Prosecutor Told Jury the ‘Presumption of Innocence Is Over’,1601389908.0,"09/29/2020, 14:31:48",50,0,503,5.886918369857824,0.99,0.09940357852882704
60,law,The Sixth Circuit Court of Appeals ruled last week that the state of Michigan has been so negligent toward the educational needs of Detroit students that children have been “deprived of access to literacy” in violation of the 14th Amendment,1588021483.0,"04/27/2020, 21:04:43",95,0,499,22.43284913747584,0.96,0.1903807615230461
61,law,"Portland issues ‘maximum fine’ on feds for unpermitted fence outside courthouse; bill is $192,000 ‘and counting’",1595965097.0,"07/28/2020, 19:38:17",289,0,501,42.732926235215245,0.92,0.5768463073852296
62,law,"Trump Administration Tries to Block Release of a Documentary that Shows ICE Agents Illegally Breaking into a Home, Eager to Arrest Immigrants Without Criminal Records",1595595773.0,"07/24/2020, 13:02:53",84,0,501,43.36746474132008,0.92,0.16766467065868262
63,law,US Circuit Courts Font Preference,1588733305.0,"05/06/2020, 02:48:25",115,0,499,3.2998985736311397,0.99,0.23046092184368738
64,law,Attorney General Keith Ellison to elevate charges against officer who knelt on George Floyd's neck; also charging other 3 involved,1591207587.0,"06/03/2020, 18:06:27",215,0,502,14.538551004747887,0.97,0.42828685258964144
65,law,"Judge Orders Alex Jones and Infowars to Pay $100,000 in Sandy Hook Legal Fees",1577806212.0,"12/31/2019, 15:30:12",48,0,496,24.46497897471204,0.95,0.0967741935483871
66,law,"A federal court on Friday vacated 287 oil and gas leases issued by the U.S. government that covered 145,063 acres of land in Montana, deciding that the Trump administration did not adequately consider risks to the environment and water supply",1588634444.0,"05/04/2020, 23:20:44",40,0,496,18.119972720054648,0.96,0.08064516129032258
67,law,New York Attorney General Moves To Dissolve The NRA After Fraud Investigation,1596728387.0,"08/06/2020, 15:39:47",211,0,493,31.02180707632226,0.94,0.4279918864097363
68,law,"SCOTUS rules against Trump administration in challenge to decision to end DACA program, which allowed noncitizens brought to this country illegally as children to apply for protection from deportation, holding decision was arbitrary and capricious",1592489104.0,"06/18/2020, 14:05:04",286,0,488,24.39466430703567,0.95,0.5860655737704918
69,law,Democracy Docket: Expert finds 90+% minority polling places in Georgia average minimum wait time was 51 minutes. 90+% White polling places average wait was around 6 minutes.,1599064312.0,"09/02/2020, 16:31:52",74,0,485,29.854321247652592,0.94,0.15257731958762888
70,law,"Above The Law founder/legal blogger David Lat, who was diagnosed with COVID-19, is now on a ventilator",1584830937.0,"03/21/2020, 22:48:57",76,0,484,9.034127267790666,0.98,0.15702479338842976
71,law,"Oregon will sue federal police agencies, open criminal investigation into use of force",1595068890.0,"07/18/2020, 10:41:30",239,0,475,26.680887779792386,0.95,0.5031578947368421
72,law,"20 Former U.S. Attorneys -- All Republicans -- Condemn 'Threat' Of Trump, Back Biden",1603890727.0,"10/28/2020, 13:12:07",111,0,469,58.98111884712512,0.89,0.23667377398720682
73,law,Legal Experts Torch President of the United States for Bragging About ‘Extrajudicial Killing’ of ‘100% Antifa’ Murder Suspect,1602798395.0,"10/15/2020, 21:46:35",100,1,470,46.69319850931845,0.91,0.2127659574468085
74,law,"Judge Orders Trump to Pay Stormy Daniels $44,100 for Legal Fees",1598173645.0,"08/23/2020, 09:07:25",22,0,471,41.05171153219351,0.92,0.04670912951167728
75,law,Pro-Trump group threatens legal action against ad that used the president’s own words on coronavirus,1585230873.0,"03/26/2020, 13:54:33",130,0,472,44.13143282933356,0.91,0.2754237288135593
76,law,Federal judge blocks Ohio from using coronavirus health order to restrict abortions,1585608750.0,"03/30/2020, 22:52:30",117,0,472,20.474033224271125,0.96,0.2478813559322034
77,law,"""Round Up The Green Hats"": NYPD Accused Of Deliberately Targeting Legal Observers In Brutal Bronx Mass Arrest",1591651772.0,"06/08/2020, 21:29:32",102,0,472,15.919727749501817,0.97,0.21610169491525424
78,law,"Kenosha Police Refuse to Comment on Cops Encouraging ‘Militia’, Justify Giving Alleged Shooter Bottle of Water",1598476955.0,"08/26/2020, 21:22:35",205,0,468,43.132181119322865,0.92,0.43803418803418803
79,law,‘Qualified immunity’ for police getting fresh look by Supreme Court after George Floyd death,1591271659.0,"06/04/2020, 11:54:19",97,0,463,16.047166825284535,0.97,0.20950323974082075
80,law,Trump floats election ‘delay’ amid claims of voting fraud,1596115134.0,"07/30/2020, 13:18:54",357,0,468,22.349384582105927,0.95,0.7628205128205128
81,law,"In Mississippi, a black man was arrested for a misdemeanor, and they didn't take his phone when they booked him. He asked, from inside the cell, if he could charge the phone, so they charged him. 12 year sentence. It was just upheld by the Mississippi Supreme Court.",1579049146.0,"01/15/2020, 00:45:46",120,0,466,20.02162310830903,0.96,0.2575107296137339
82,law,LeBron James' new nonprofit commits to pay fines for former felons looking to vote in Florida,1595651286.0,"07/25/2020, 04:28:06",60,1,461,35.80614284043503,0.93,0.1301518438177874
83,law,"Mark and Patricia McCloskey, the couple that drew national attention earlier this month after footage of them pointing guns at protesters outside their home went viral, have been charged with felony unlawful use of a weapon",1595280958.0,"07/20/2020, 21:35:58",367,0,461,24.85390496266234,0.95,0.7960954446854663
84,law,Lawyers: We can't find parents of 545 kids separated by Trump administration,1603289777.0,"10/21/2020, 14:16:17",244,1,464,38.89135927906972,0.92,0.5258620689655172
85,law,"Orange County Sheriffs asserted they did not know lying on police reports is perjury and illegal. 2 plead guilty to a lesser misdemeanor, 1 went to trial found guilty of felony.",1601204067.0,"09/27/2020, 10:54:27",75,0,456,4.1337703901976965,0.99,0.16447368421052633
86,law,Federal Judge Orders Trump Campaign to Provide Proof of Mail-In Voting Fraud,1597374445.0,"08/14/2020, 03:07:25",70,0,454,18.085487591489482,0.96,0.15418502202643172
87,law,"Nearly 2,000 DOJ alumni call on Barr to resign for ""repeated assaults on the rule of law""",1589250392.0,"05/12/2020, 02:26:32",71,0,460,74.82249559847969,0.86,0.15434782608695652
88,law,Lincoln Project responds with a backhand over the threat Kushner and Ivanka billboards suit.,1603647516.0,"10/25/2020, 17:38:36",61,0,458,39.92082598199306,0.92,0.1331877729257642
89,law,"The FBI thwarted an apparent plan to kidnap Michigan Gov. Gretchen Whitmer and attempt to “overthrow the government,”",1602175381.0,"10/08/2020, 16:43:01",167,0,457,20.876732257954416,0.96,0.36542669584245074
90,law,"Legal blogger David Lat recovering from COVID-19, off of ventilator and out of ICU",1585445576.0,"03/29/2020, 01:32:56",47,0,461,21.39872381683284,0.96,0.1019522776572668
91,law,"The Manhattan district attorney’s office suggested on Monday that it has been investigating President Trump and his company for possible bank and insurance fraud, a significantly broader inquiry than the prosecutors have acknowledged in the past",1596480851.0,"08/03/2020, 18:54:11",66,0,451,27.949783163057646,0.94,0.14634146341463414
92,law,Ohio judge says Republican Secretary of State Frank LaRose’s one ballot drop box per county rule is ‘arbitrary and unreasonable’,1600265192.0,"09/16/2020, 14:06:32",41,0,446,8.297898073795125,0.98,0.09192825112107623
93,law,"Judge orders Trump administration stop 'winding down' census collection, processing efforts",1599406817.0,"09/06/2020, 15:40:17",26,0,447,15.491585423474703,0.97,0.058165548098434
94,law,Roger Stone found guilty on 7/7 counts.,1573836841.0,"11/15/2019, 16:54:01",176,0,448,16.43994402582871,0.96,0.39285714285714285
95,law,"Trump v Vance: Article II and the Supremacy Clause do not categorically preclude, or require a heightened standard for, the issuance of a state criminal subpoena to a sitting President.",1594304098.0,"07/09/2020, 14:14:58",257,0,448,9.599700051092782,0.98,0.5736607142857143
96,law,"Colorado Passes Landmark Law Against Qualified Immunity, Creates New Way To Protect Civil Rights",1592844376.0,"06/22/2020, 16:46:16",48,0,454,16.57081129566643,0.96,0.10572687224669604
97,law,Federal Judge Halts Restrictions on Texas Ballot Drop-Off Boxes: ‘The State’s Proffered Reason of Ballot Security is a Pretext’,1602345012.0,"10/10/2020, 15:50:12",32,0,447,12.008468240123136,0.97,0.07158836689038031
98,law,Judge orders deposition against Alan Dershowitz by Jeffrey Epstein victim to be unsealed today,1595551884.0,"07/24/2020, 00:51:24",45,0,445,8.615177596487456,0.98,0.10112359550561797
99,law,California Republican Party says it will not comply with state's cease and desist order on ballot drop boxes,1602764726.0,"10/15/2020, 12:25:26",203,0,448,25.522065631680732,0.95,0.453125
100,law,You Have a First Amendment Right to Record the Police,1591700397.0,"06/09/2020, 10:59:57",78,0,451,12.213576167336441,0.97,0.1729490022172949
101,law,Trump Campaign told local North Carolina election officials not to follow a directive by the state's Board of Elections - AP News,1601903223.0,"10/05/2020, 13:07:03",44,0,442,19.333599140056606,0.96,0.09954751131221719
102,law,"“Elections that have been held with mail have found substantial fraud and coercion,” Barr said. “For example, we indicted someone in Texas, 1,700 ballots collected, he — from people who could vote, he made them out and voted for the person” Neither DOJ or local officials brought such an indictment",1599250215.0,"09/04/2020, 20:10:15",45,1,443,28.56301343868239,0.94,0.10158013544018059
103,law,"Caught fabricating evidence, convicted Baltimore police officer remains on force 2½ years later",1591598314.0,"06/08/2020, 06:38:34",105,0,446,10.986917277381622,0.98,0.23542600896860988
104,law,Judge whose anti-rape advice was 'close your legs' loses job,1590530739.0,"05/26/2020, 22:05:39",54,0,440,18.16416560204766,0.96,0.12272727272727273
105,law,"South Florida judge tells lawyers to get out of bed and wear a shirt for Zoom hearings—""One male lawyer appeared shirtless and one female attorney appeared still in bed, still under the covers.""",1586913475.0,"04/15/2020, 01:17:55",91,0,447,10.778986487775512,0.98,0.203579418344519
106,law,When the judge has had it up to here with your shenanigans,1590842783.0,"05/30/2020, 12:46:23",19,0,442,11.126293467167557,0.98,0.042986425339366516
107,law,Hawaii Supreme Court rules in favor of Native Hawaiians in land trust case,1593777590.0,"07/03/2020, 11:59:50",33,0,444,10.806857034115524,0.98,0.07432432432432433
108,law,"A federal judge on Sunday formally struck down a Trump administration attempt to end food stamp benefits for nearly 700,000 unemployed people, blocking as “arbitrary and capricious” the first of three such planned measures to restrict the federal food safety net",1603065513.0,"10/18/2020, 23:58:33",45,0,433,23.490330182571995,0.95,0.10392609699769054
109,law,Kyle Rittenhouse moved to Kenosha County to face homicide charges after judge denies defense's request for him to be released in Illinois,1604097525.0,"10/30/2020, 22:38:45",139,0,442,23.13132062703579,0.95,0.31447963800904977
110,law,There’s New Evidence ‘Defeat Crooked Hillary’ PAC Illegally Coordinated with 2016 Trump Campaign Through Cambridge Analytica: Complaint,1602909161.0,"10/17/2020, 04:32:41",36,0,435,30.830428893504006,0.93,0.08275862068965517
111,law,"I'm Suing the White House, CIA, and DOJ. Really.",1593089345.0,"06/25/2020, 12:49:05",118,0,430,55.58548821600033,0.89,0.2744186046511628
112,law,Trump sends cease and desist letter to CNN after they released a poll that he 'felt' was 'fake',1591873021.0,"06/11/2020, 10:57:01",153,0,430,22.09706942650405,0.95,0.3558139534883721
113,law,"NEVER, talk to the police.",1581096936.0,"02/07/2020, 17:35:36",95,0,424,26.749535268919942,0.94,0.2240566037735849
114,law,Message from Cleveland police tonight: “No media is allowed downtown unless they are inside their place of business. Period.”,1590972314.0,"06/01/2020, 00:45:14",126,0,430,11.696906178663824,0.97,0.2930232558139535
115,law,"[Marshall Cohen] Kavanaugh ruled AGAINST the six-day extension for Wisconsin to accept ballots postmarked by Election Day. He cited an article from legal scholar (and CNN contributor) Rick Pildes. But in that article, Pildes says states SHOULD extend postmark deadlines.",1603800052.0,"10/27/2020, 12:00:52",237,0,430,104.50869222153813,0.8,0.5511627906976744
116,law,FL online Bar Exam canceled 60 hours prior to start due to software concerns.,1597636199.0,"08/17/2020, 03:49:59",140,0,426,-0.6727470728454819,1.0,0.3286384976525822
117,law,Law students say they don't get mental health treatment for fear it will keep them from becoming lawyers. Some states are trying to change that,1582582793.0,"02/24/2020, 22:19:53",68,0,425,10.169818528582766,0.98,0.16
118,law,"South Dakota's Attorney General reported hitting a deer, but man's body discovered the next morning",1600106057.0,"09/14/2020, 17:54:17",169,0,422,5.844096793213964,0.99,0.4004739336492891
119,law,"The New York Attorney General is investigating President Trump’s private business for allegedly misleading lenders by inflating the value of its assets, the attorney general’s office said Monday in a legal filing",1598291841.0,"08/24/2020, 17:57:21",38,0,423,32.0424978122208,0.93,0.08983451536643026
120,law,Federal judge rules First Amendment doesn’t protect Connecticut man arrested with sign warning of ‘Cops Ahead’,1602068619.0,"10/07/2020, 11:03:39",218,0,417,5.682600544168622,0.99,0.5227817745803357
121,law,Full Bodycam Footage of George Floyd Arrest,1597147469.0,"08/11/2020, 12:04:29",340,0,424,13.237293057798752,0.97,0.8018867924528302
