,Subreddit,Title,Epoch Time,Date,Comments,Awards,Upvotes,Downvotes,Upvote Ratio,Comment/Upvote Ratio
509,law,"Judge rules sexual assault case against the military's No. 2 officer can proceed: A federal judge ruled Thursday that a retired officer's sexual assault case against Air Force Gen. John Hyten, the military's second-highest ranking officer, can proceed to the next phase",1603434049.0,"10/23/2020, 06:20:49",25,0,224,4.637031901922285,0.98,0.11160714285714286
510,law,Gun stores sue to stay open during coronavirus pandemic. Guess it depends on how you define 'essential service',1585314343.0,"03/27/2020, 13:05:43",119,0,226,27.020550833864064,0.89,0.5265486725663717
511,law,5th Circuit allows Texas to throw out subjectively determined signature mismatched ballots with no opportunity for voters to cure alleged defects.,1603131860.0,"10/19/2020, 18:24:20",73,0,220,3.5790197747153343,0.98,0.33181818181818185
512,law,Michigan to Pay $600 Million to Victims of Flint Water Crisis,1597887853.0,"08/20/2020, 01:44:13",14,0,219,4.932488919046762,0.98,0.0639269406392694
513,law,The Lawyer Whose Clients Didn’t Exist,1587053039.0,"04/16/2020, 16:03:59",32,0,222,1.7187336094563648,0.99,0.14414414414414414
514,law,Supreme Court to hear arguments over Trump tax records virtually,1586789074.0,"04/13/2020, 14:44:34",34,0,218,5.749165696506424,0.97,0.1559633027522936
515,law,Court Says Removing a Police GPS Tracker From Your Car Isn’t Theft,1582777111.0,"02/27/2020, 04:18:31",52,0,220,10.300293746870324,0.96,0.23636363636363636
516,law,Barr tells Republicans Durham report won't be ready by election,1602254201.0,"10/09/2020, 14:36:41",40,0,222,5.3624332033930955,0.98,0.18018018018018017
517,law,"Birmingham curfew expands to ban marches, demonstrations",1591273463.0,"06/04/2020, 12:24:23",80,0,218,12.181217838495058,0.95,0.3669724770642202
518,law,The Trump administration awarded billions of dollars in contracts for private companies to operate immigration detention centers in California —- less than two weeks before a new state law takes effect to prohibit them,1577144984.0,"12/23/2019, 23:49:44",27,0,219,22.623884740744046,0.91,0.1232876712328767
519,law,Alan Dershowitz Files SLAPP Suit Against CNN; Says Not Airing More Of What He Said Is Defamation,1600692635.0,"09/21/2020, 12:50:35",53,0,216,13.61360517447335,0.94,0.24537037037037038
520,law,Small-Firm Lawyer Tells Biglaw Team To ‘Eat Bowl Of Dicks’ During Settlement Negotiations,1575581649.0,"12/05/2019, 21:34:09",63,0,216,8.436515446500096,0.96,0.2916666666666667
521,law,"Jussie Smollett case: Special prosecutor finds ‘abuses of discretion,’ but no criminal wrongdoing by Kim Foxx",1597699677.0,"08/17/2020, 21:27:57",84,0,217,8.442391391378465,0.96,0.3870967741935484
522,law,US executes 2nd man in a week; lawyers said he had dementia,1594906889.0,"07/16/2020, 13:41:29",97,0,215,17.049294763974558,0.93,0.4511627906976744
523,law,"D.A.: DUI Charges Won't be Filed Against Drunk Aurora Cop, He Received 'Professional Courtesy'",1582273599.0,"02/21/2020, 08:26:39",78,0,215,12.220233513236877,0.95,0.3627906976744186
524,law,"Ted Lieu responds to frivolous legal threat from Devin Nunes. ""...take your letter and shove it.""",1579312490.0,"01/18/2020, 01:54:50",64,0,217,20.74211188963173,0.91,0.29493087557603687
525,law,KS Supreme Court rules in favor of Gov. Kelly. Churches are also limited in gathering sizes on Easter,1586663870.0,"04/12/2020, 03:57:50",15,0,216,3.3249489320102157,0.98,0.06944444444444445
526,law,"A federal judge in Pennsylvania ordered the release of 11 immigration detainees, over concerns that their health could be in jeopardy if they contracted coronavirus in detention",1585674300.0,"03/31/2020, 17:05:00",29,0,220,15.811707596582153,0.93,0.1318181818181818
527,law,Tulsi Gabbard Sues Hillary Clinton for Defamation,1579713628.0,"01/22/2020, 17:20:28",248,0,218,16.479292374957907,0.93,1.1376146788990826
528,law,White House Withholds 20 Emails Between Two Trump Aides on Ukraine Aid,1578111193.0,"01/04/2020, 04:13:13",46,0,217,22.698175986437093,0.91,0.2119815668202765
529,law,Two high profile lawyers (former AAG and former DOJ special prosecutor) have been accused of an Avenatti-esque ethical violation in relation to their Epstein settlement strategy,1575136913.0,"11/30/2019, 18:01:53",6,0,215,9.471976706879786,0.96,0.027906976744186046
530,law,The US’s jaywalking laws target people of colour. They should be abolished,1592390809.0,"06/17/2020, 10:46:49",272,0,217,63.22065107530767,0.77,1.2534562211981566
531,law,"Nunes's hunt for Twitter cow's identity at 'dead end,' attorney says",1592031947.0,"06/13/2020, 07:05:47",32,0,213,7.500882116772971,0.97,0.15023474178403756
532,law,"Court issues injunctions on telecom carriers who facilitated robocalls across US, DOJ says",1585345689.0,"03/27/2020, 21:48:09",10,0,217,1.3044582574165418,0.99,0.04608294930875576
533,law,"The 9th Circuit Court of Appeals on Friday ruled that President Trump’s use of emergency powers to allocate millions of dollars in funding for the construction of a southern border wall was illegal, the latest blow to the Trump administration’s effort to limit immigration",1602349697.0,"10/10/2020, 17:08:17",15,0,211,15.931520984341176,0.93,0.07109004739336493
534,law,U.S. court: Mass surveillance program exposed by Snowden was illegal,1599110297.0,"09/03/2020, 05:18:17",49,0,213,5.01369651262786,0.98,0.2300469483568075
535,law,Police Requests For Google Users’ Location Histories Face New Scrutiny - Geofence Warrants Are Staring Down Their First Legal Challenges,1596451057.0,"08/03/2020, 10:37:37",25,0,215,4.022005763935994,0.98,0.11627906976744186
536,law,Ahmaud Arbery: grand jury indicts three men in murder case,1593029924.0,"06/24/2020, 20:18:44",19,0,213,8.539761635267809,0.96,0.0892018779342723
537,law,"Ahead of Trump Bible photo op, police forcibly expel priest from St. John's church near White House",1591102526.0,"06/02/2020, 12:55:26",92,0,212,16.50107380929927,0.93,0.4339622641509434
538,law,Ginsburg hospitalized for treatment of chills and fever,1574555828.0,"11/24/2019, 00:37:08",150,0,213,11.551294997139848,0.95,0.704225352112676
539,law,"US Attorney Geoffrey Berman agrees to leave office ""in light of Attorney General Barr’s decision to respect the normal operation of law and have Deputy U.S. Attorney Audrey Strauss become Acting U.S. Attorney""",1592691340.0,"06/20/2020, 22:15:40",54,0,214,3.725855807401132,0.98,0.2523364485981308
540,law,"Anti-Vaxxer Sues Facebook, In The Middle Of A Pandemic, For 'In Excess' Of $5 Billion For Shutting Down His Account",1585717234.0,"04/01/2020, 05:00:34",96,0,214,9.268814710987357,0.96,0.4485981308411215
541,law,Supreme Court Issues Opinion in June Medical Services (Abortion Restrictions Case),1593440459.0,"06/29/2020, 14:20:59",202,0,212,11.495025690939059,0.95,0.9528301886792453
542,law,"Right-wing group must stop building private border wall in South Texas, judge says in temporary order",1575468773.0,"12/04/2019, 14:12:53",33,0,211,11.329714144158771,0.95,0.15639810426540285
543,law,Second California Court Tells State AG To Stop Screwing Around And Release Police Misconduct Records,1580985979.0,"02/06/2020, 10:46:19",15,0,210,5.298864924584592,0.98,0.07142857142857142
544,law,Law Criminalizing Pro-Immigration Speech Is So Broad That It Could Be Used to Punish Anti-Government Speech,1580475406.0,"01/31/2020, 12:56:46",116,0,211,15.3847013751693,0.93,0.5497630331753555
545,law,AMC Theaters in Talks with major Bankruptcy law firm,1586712110.0,"04/12/2020, 17:21:50",26,0,208,7.207320657744759,0.97,0.125
546,law,"[Steve Vladeck] By a 5-3 vote, #SCOTUS has put Alabama's ban on curbside voting back into effect, staying a district court injunction that had temporarily allowed localities to pursue such accommodations. Justice Sonia Sotomayor penned a five-page dissent.",1603327974.0,"10/22/2020, 00:52:54",155,0,208,6.831842377830895,0.97,0.7451923076923077
547,law,"Sean Hannity, Lou Dobbs to Be Deposed in Seth Rich Case",1600202977.0,"09/15/2020, 20:49:37",19,0,204,8.544122044968844,0.96,0.09313725490196079
548,law,Women win $13M in lawsuit against porn site in California,1578050859.0,"01/03/2020, 11:27:39",67,0,211,16.939067014929066,0.93,0.3175355450236967
549,law,How The Bankruptcy Code Protects Lenders And Harms Student Debtors — And What One Lawyer Is Doing About It,1603463026.0,"10/23/2020, 14:23:46",18,0,208,23.326187860907396,0.9,0.08653846153846154
550,law,Devin Nunes lost in court against a magazine. Now he wants to change US libel law,1602204330.0,"10/09/2020, 00:45:30",29,0,203,12.218304533268423,0.94,0.14285714285714285
551,law,Grand jury indicts Louisville cop in death of Breonna Taylor,1600881960.0,"09/23/2020, 17:26:00",318,0,210,40.88595234740956,0.84,1.5142857142857142
552,law,The Justice Department’s Indefensible About-Face on Emoluments - For decades the department has interpreted the Constitution to err on the side of country first. Now all that has changed.,1590496727.0,"05/26/2020, 12:38:47",65,0,208,19.97186111072736,0.91,0.3125
553,law,DC Circuit agrees to hear en banc the case where panel recently held House did not have standing to sue to enforce its subpoenas,1584140845.0,"03/13/2020, 23:07:25",29,0,208,5.553853272762126,0.97,0.13942307692307693
554,law,The Trump Campaign has filed a lawsuit against the Philadelphia County Board of elections in order to have poll watchers be placed in satellite offices.,1601762635.0,"10/03/2020, 22:03:55",31,0,206,8.609878115019654,0.96,0.15048543689320387
555,law,The Mansfield Rule and the lucrative world of law firm diversity marketing,1590509695.0,"05/26/2020, 16:14:55",25,0,207,12.500743004534456,0.94,0.12077294685990338
556,law,"Kentucky Atheist Awarded $150,000 In Fight Over Vanity License Plates",1582307697.0,"02/21/2020, 17:54:57",31,0,206,16.27724886465691,0.93,0.15048543689320387
557,law,Federal Circuit says gov't PACER fees are too high,1596801589.0,"08/07/2020, 11:59:49",49,0,204,9.31622841315334,0.96,0.24019607843137256
558,law,Prosecutor: 'No explicable reasons' for officer to shoot journalists with rubber bullets,1595378572.0,"07/22/2020, 00:42:52",18,0,203,17.782503168218824,0.92,0.08866995073891626
559,law,US Military Could Lose Space Force Trademark to Netflix Series,1591630496.0,"06/08/2020, 15:34:56",55,0,206,56.407554673892946,0.79,0.2669902912621359
560,law,A District Court judge rejects attempt by three California churches to hold services despite stay-at-home order,1587616024.0,"04/23/2020, 04:27:04",39,0,201,7.6905108092644525,0.96,0.19402985074626866
561,law,"California's groundbreaking privacy law takes effect in January. What does it do? Landmark law, the ‘most comprehensive’ in the US, gives Californians an arsenal of tools to protect their data online.",1577707574.0,"12/30/2019, 12:06:14",32,0,202,4.581460983981145,0.98,0.15841584158415842
562,law,"Former Trump campaign official Rick Gates sentenced to 45 days in jail on weekends, 3 years' probation after cooperation with Mueller",1576601801.0,"12/17/2019, 16:56:41",93,0,208,16.74380614443561,0.93,0.44711538461538464
563,law,Victory: Pennsylvania Supreme Court Rules Police Can’t Force You to Tell Them Your Password,1574386002.0,"11/22/2019, 01:26:42",41,0,202,-0.2276305868192594,1.0,0.20297029702970298
564,law,Justices to weigh Trump census plan to exclude noncitizens,1602962360.0,"10/17/2020, 19:19:20",91,0,202,9.480584666397249,0.96,0.4504950495049505
565,law,BYU creates new security department that it says will not be subject to Utah’s open records laws,1601856895.0,"10/05/2020, 00:14:55",30,0,203,8.83675688949998,0.96,0.1477832512315271
566,law,"Two federal judges rule in favor of mail-in voting in Montana, Alabama",1601512983.0,"10/01/2020, 00:43:03",3,0,204,8.229107776466691,0.96,0.014705882352941176
567,law,The DOJ made a statement about opening ballots and identifying individuals and their votes in a swing state then deleted the statement.,1600978830.0,"09/24/2020, 20:20:30",57,0,204,11.753777749639625,0.95,0.27941176470588236
568,law,"FBI notes on Michael Flynn unlikely to convince judge he was entrapped, legal experts say",1588304710.0,"05/01/2020, 03:45:10",140,0,204,28.476513801832624,0.88,0.6862745098039216
569,law,Record Bankruptcies Predicted in Next Year as Unemployment Soars,1586520957.0,"04/10/2020, 12:15:57",45,0,204,10.149043552921881,0.95,0.22058823529411764
570,law,IL Supreme Court: Misdemeanor convictions shouldn't preclude gun ownership forever,1580080596.0,"01/26/2020, 23:16:36",103,0,207,10.00436209144749,0.95,0.4975845410628019
571,law,Supreme Court will hear three cases over Trump's financial records,1576273684.0,"12/13/2019, 21:48:04",196,0,202,11.33396040926192,0.95,0.9702970297029703
572,law,Pennsylvania Republicans return to Supreme Court to challenge extended deadline for mail-in ballots,1603633698.0,"10/25/2020, 13:48:18",53,0,205,7.024347249535481,0.97,0.25853658536585367
573,law,Supreme Court eyes more gun cases as conservatives signal eagerness to expand 2nd Amendment protections,1589727329.0,"05/17/2020, 14:55:29",363,0,201,16.825617613382548,0.92,1.8059701492537314
574,law,"Paxton fought $300 hourly rate for attorneys prosecuting him, but OKs it for “rookie” lawyer in donor’s case",1602578608.0,"10/13/2020, 08:43:28",24,0,203,7.861214573482727,0.96,0.11822660098522167
575,law,NRA sues California Governor Gavin Newsom over gun store closures.,1585415540.0,"03/28/2020, 17:12:20",175,0,202,15.95660343195695,0.93,0.8663366336633663
576,law,"Congress Cannot Sue to Enforce Subpoenas Defied by Executive Branch, Appeals Court Rules",1582930489.0,"02/28/2020, 22:54:49",155,0,200,6.414163465620305,0.97,0.775
577,law,"N.J. company must pay for employee’s medical marijuana, appeals court rules",1579475501.0,"01/19/2020, 23:11:41",66,0,200,8.708468908810318,0.96,0.33
578,law,"Court grants temporary stay, allowing Texas governor's directive for limited drop box locations to continue",1602378719.0,"10/11/2020, 01:11:59",51,0,199,8.554913565389,0.96,0.2562814070351759
579,law,Federally appointed judges' expenses to be made public for first time,1595826877.0,"07/27/2020, 05:14:37",10,0,201,7.534618583285578,0.96,0.04975124378109453
580,law,LAPD officers charged (59 counts) for falsely labeling people as gang members,1594406909.0,"07/10/2020, 18:48:29",22,0,195,1.4192431915624866,0.99,0.11282051282051282
581,law,Trump signs order creating national commission to study police and justice system,1577102337.0,"12/23/2019, 11:58:57",48,0,200,6.709317536384134,0.97,0.24
582,law,Portland man who told immigrant to go back to his country asked to write 500-word essay,1574963436.0,"11/28/2019, 17:50:36",32,0,201,21.289527739867538,0.9,0.15920398009950248
583,law,"Long Shielded From Lawsuits, Prosecutors Face Scrutiny After Fake Subpoenas. The New Orleans district attorney’s office is trying to fend off a lawsuit that could chip away at prosecutors’ immunity from legal action",1580940971.0,"02/05/2020, 22:16:11",35,0,199,5.680243425109921,0.97,0.17587939698492464
584,law,Federal judge says he will block USPS policy changes nationwide,1600385448.0,"09/17/2020, 23:30:48",11,0,193,10.188419172039346,0.95,0.05699481865284974
585,law,UCLA Law Receives $15 Million Donation to Boost Native American Law and Policy,1601637524.0,"10/02/2020, 11:18:44",5,0,196,12.932145583501011,0.94,0.025510204081632654
586,law,Jack Burkman and Jacob Wohl caught felony charges in Michigan over voter suppression robocalls.,1601587518.0,"10/01/2020, 21:25:18",31,0,196,5.20920966014387,0.97,0.15816326530612246
587,law,"In rare rebuke, Chief Justice Roberts slams Schumer for 'threatening' comments",1583360773.0,"03/04/2020, 22:26:13",237,0,195,16.888108306678077,0.92,1.2153846153846153
588,law,"With no choice but Trump, voter sues over Minnesota primary",1576969120.0,"12/21/2019, 22:58:40",94,0,197,18.54061905257913,0.91,0.47715736040609136
589,law,A ‘broken’ system: Canadians can’t afford lawyers but don’t qualify for legal aid,1575803866.0,"12/08/2019, 11:17:46",27,0,193,10.513434526489277,0.95,0.13989637305699482
590,law,Indiana Judges Suspended After Drunken White Castle Fight,1573740650.0,"11/14/2019, 14:10:50",32,0,196,6.720083364761109,0.97,0.16326530612244897
591,law,"Protesters in Multiple States Are Facing Felony Charges, Including Terrorism",1599345228.0,"09/05/2020, 22:33:48",131,0,195,26.13586292021384,0.88,0.6717948717948717
592,law,Virginia Lawmakers Advance Bill That Bans Qualified Immunity for Cops,1598485321.0,"08/26/2020, 23:42:01",45,0,195,4.769220591290946,0.98,0.23076923076923078
593,law,"Following the suspension of civil statutes of limitations until April 19, 2020, New York State Chief Administrative Judge Marks issues AO suspending all non-essential filings until further order",1584972792.0,"03/23/2020, 14:13:12",36,0,198,4.559101147736726,0.98,0.18181818181818182
594,law,Deaf Man Sues Pornhub for Lack of Closed Captioning in Videos,1579263818.0,"01/17/2020, 12:23:38",64,0,197,11.130773796638778,0.95,0.3248730964467005
595,law,"Supreme Court reverses 5th Circuit grant of Qualified Immunity to Texas prison officials who held man in cells ""teeming with human waste""",1604339898.0,"11/02/2020, 17:58:18",47,0,220,1.9700968730949455,0.99,0.21363636363636362
596,law,Supreme Court Justice Ruth Bader Ginsburg hospitalized for possible infection,1594761955.0,"07/14/2020, 21:25:55",80,1,196,5.607047767034857,0.97,0.40816326530612246
597,law,"In Rare Decision, Federal Court Refuses to Grant Qualified Immunity to Overzealous Cop",1590691151.0,"05/28/2020, 18:39:11",24,0,193,5.385121718366463,0.97,0.12435233160621761
598,law,"Georgia Republicans cancel election for state Supreme Court, meaning governor can appoint a Republican",1589905762.0,"05/19/2020, 16:29:22",47,0,195,18.28819376932273,0.91,0.24102564102564103
599,law,Housing Lawyers Expect A Flood Of Cases Once Coronavirus Eviction Moratoriums End,1587654386.0,"04/23/2020, 15:06:26",56,0,191,5.014734013836289,0.97,0.2931937172774869
600,law,"Roger Stone, Trump Friend And Alleged Tie To WikiLeaks, Faces Trial In Washington",1572960600.0,"11/05/2019, 13:30:00",11,0,195,16.350569316183055,0.92,0.05641025641025641
601,law,Google victory in German top court over right to be forgotten: A German court has sided with Google and rejected requests to wipe entries from search results. The cases hinged on whether the right to be forgotten outweighed the public's right to know,1595877187.0,"07/27/2020, 19:13:07",13,0,192,5.1691068349738885,0.97,0.06770833333333333
602,law,'We're ashamed': High Court of Australia reveals former judge sexually harassed female associates,1592823874.0,"06/22/2020, 11:04:34",10,0,191,7.271236837566363,0.96,0.05235602094240838
603,law,"For cops who kill, special Supreme Court protection",1588946265.0,"05/08/2020, 13:57:45",102,0,190,19.45967094626411,0.91,0.5368421052631579
604,law,Nursing Homes Ask States For Immunity From Civil Suits Amid COVID-19,1587727079.0,"04/24/2020, 11:17:59",96,0,193,-0.5237609627122595,1.0,0.49740932642487046
605,law,Trump Campaign sues New York Times for libel over 2019 Op-Ed that suggested the campaign colluded with Russia,1582745937.0,"02/26/2020, 19:38:57",58,0,191,6.475472797367047,0.97,0.3036649214659686
606,law,Judge denies Trump's bid for a stay of subpoena in Manhattan DA's tax records case,1598024751.0,"08/21/2020, 15:45:51",43,0,191,6.300312983397987,0.97,0.225130890052356
607,law,Ghislaine Maxwell’s Case Being Handled by SDNY Public Corruption Unit Could Spell Trouble for U.S. Elites,1593876829.0,"07/04/2020, 15:33:49",46,0,188,9.009231630033725,0.95,0.24468085106382978
608,law,"Harvard Law is offering a free course in Contract Law for auditing. However, you can get a certificate for $125 USD. Is it worth it?",1587272506.0,"04/19/2020, 05:01:46",55,0,191,12.370146840542873,0.94,0.2879581151832461
609,law,[Florida] Court rules 'Stand Your Ground' applies in Port St. John man's case in deputy shooting,1587140585.0,"04/17/2020, 16:23:05",143,0,190,6.093930418146641,0.97,0.7526315789473684
610,law,Senate hits pause on confirming Trump’s judges,1586772131.0,"04/13/2020, 10:02:11",50,0,189,8.106420401378557,0.96,0.26455026455026454
611,law,DOJ backpedaling on sentencing recommendation for Trump ally Roger Stone after Trump tweets about it,1581452478.0,"02/11/2020, 20:21:18",74,0,194,5.172862053508084,0.97,0.38144329896907214
612,law,"DOJ intervenes in case challenging Illinois coronavirus restrictions, says governor went too far",1590191174.0,"05/22/2020, 23:46:14",62,0,191,10.974894499243959,0.95,0.32460732984293195
613,law,Barr tells federal prisons to send inmates home in response to coronavirus outbreak,1585345767.0,"03/27/2020, 21:49:27",35,0,189,40.38110208395554,0.82,0.18518518518518517
614,law,A D.C. judge issues a much-needed opinion on ‘junk science’,1582982639.0,"02/29/2020, 13:23:59",56,1,191,7.18788051212735,0.96,0.2931937172774869
615,law,Lawsuit: Office of Special Counsel Should Fine and Remove Kellyanne Conway from White House,1577366741.0,"12/26/2019, 13:25:41",20,0,191,40.14850550778988,0.83,0.10471204188481675
616,law,California teachers sue after jetliner dumps fuel on schools,1579357462.0,"01/18/2020, 14:24:22",99,0,188,12.989542693301445,0.94,0.526595744680851
617,law,Ninth Circuit panel rejects lawsuit by children asking courts to order federal government to take action against climate change; finds lack of standing [PDF of opinion],1579286457.0,"01/17/2020, 18:40:57",209,0,190,5.717485657861033,0.97,1.1
618,law,"U.S. Customs and Border Protection (CBP) is beginning a pilot program Monday to collect DNA from some migrants. CBP’s “limited, small-scale pilot program” will last 90 days in two locations and allow DNA to be taken from “certain individuals” in custody",1578349286.0,"01/06/2020, 22:21:26",78,0,192,13.347217765688214,0.94,0.40625
619,law,U.S. Supreme Court to hear Seminole tribal member's challenge to state jurisdiction in Indian Country,1576396365.0,"12/15/2019, 07:52:45",21,0,193,3.4680727530873128,0.98,0.10880829015544041
620,law,Federal prosecutors deny withholding exculpatory evidence in college admissions case,1586454579.0,"04/09/2020, 17:49:39",94,0,193,6.426814787782121,0.97,0.48704663212435234
621,law,Trump issues executive order banning TikTok from operating in 45 days if it's not sold by Chinese parent company,1596765631.0,"08/07/2020, 02:00:31",60,0,184,6.125270222960864,0.97,0.32608695652173914
622,law,President Donald Trump commutes ally Roger Stone's prison sentence,1594425536.0,"07/10/2020, 23:58:56",203,0,186,3.6628918376895,0.98,1.0913978494623655
623,law,"Philly man on death row 23 years for killing 4-year-old Northeast girl is ‘likely innocent,’ DA Larry Krasner says",1583277730.0,"03/03/2020, 23:22:10",24,0,190,4.223561169281766,0.98,0.12631578947368421
624,law,US Women's National Soccer Team granted class-action status in equal-pay lawsuit,1573391705.0,"11/10/2019, 13:15:05",90,0,192,20.01878409899453,0.91,0.46875
625,law,The Story Behind Bill Barr’s Unmarked Federal Agents,1591451264.0,"06/06/2020, 13:47:44",40,0,187,16.104512370507564,0.92,0.21390374331550802
626,law,Trump administration asks Supreme Court to make it legal to ban same-sex couples from adopting,1591290278.0,"06/04/2020, 17:04:38",77,0,188,29.081175453031193,0.87,0.4095744680851064
627,law,Supreme Court won't take up appeal of Michelle Carter's conviction for role in boyfriend's suicide,1578939626.0,"01/13/2020, 18:20:26",170,0,187,6.03238263311718,0.97,0.9090909090909091
628,law,"Trump signs four executive orders on coronavirus relief, bypassing Congress",1596923449.0,"08/08/2020, 21:50:49",119,0,187,12.132334360382345,0.94,0.6363636363636364
629,law,"A Richmond, Va.-area man who allegedly drove his truck into a crowd of protesters Sunday has admitted to being a leader of the Ku Klux Klan. Harry Rogers, 36, who has been charged with attempted malicious wounding, felony vandalism and assault and battery",1591646512.0,"06/08/2020, 20:01:52",61,0,185,10.4909951487206,0.95,0.32972972972972975
630,law,Will justice finally be done for Emmett Till? Family hope a 65-year wait may soon be over,1587819788.0,"04/25/2020, 13:03:08",29,0,187,21.51535066049928,0.9,0.15508021390374332
631,law,"Volunteers 3D-Print Unobtainable $11,000 Valve For $1 To Keep Covid-19 Patients Alive; Original Manufacturer Threatens To Sue",1584515529.0,"03/18/2020, 07:12:09",99,0,183,9.089324036938848,0.95,0.5409836065573771
632,law,Twitter Goes After Nunes' Lawyer for Trying to Out @DevinCow | Law &amp; Crime,1581279024.0,"02/09/2020, 20:10:24",36,0,184,17.301052853068967,0.91,0.1956521739130435
633,law,The Trump administration’s plans to resume federal executions next week for the first time in over 16 years were scuttled Friday night after the Supreme Court turned down the Justice Department’s emergency bid to lift a lower-court order blocking the plan,1575680992.0,"12/07/2019, 01:09:52",19,0,187,12.929634679806185,0.94,0.10160427807486631
634,law,Teacher Fired After Asking Trump to 'Remove' Illegal Immigrants Wins Her Appeal,1575204277.0,"12/01/2019, 12:44:37",252,0,189,14.656817412201036,0.93,1.3333333333333333
635,law,"Epic v. Apple -- I am only guessing, but I don't think ""ridable sharks"" have ever seen the likes of a pleading before. Magical, just, magical.",1597721908.0,"08/18/2020, 03:38:28",45,1,186,3.8283552958972678,0.98,0.24193548387096775
636,law,N.Y. Law Deans Say 2020 Class Should Be Allowed to Skip Bar Exam,1585852719.0,"04/02/2020, 18:38:39",253,0,185,33.6777891571451,0.85,1.3675675675675676
637,law,"Popehat: ""Do Amy Coney Barrett and Brett Kavanaugh Disagree On Whether The N-Word Creates A Hostile Work Environment? No. Remember: Most Legal Commentary Is Dumbed Down And Misleading.""",1602859583.0,"10/16/2020, 14:46:23",133,0,185,36.48176475427874,0.84,0.7189189189189189
