,Subreddit,Title,Epoch Time,Date,Comments,Awards,Upvotes,Downvotes,Upvote Ratio,Comment/Upvote Ratio
248,law,"For every 1% increase in the number of lawyers, economic growth falls 3% (1986)",1601940673.0,"10/05/2020, 23:31:13",84,0,328,31.910500285113528,0.91,0.25609756097560976
249,law,"In a 2 a.m order, a 5-4 Supreme Court clears the way for federal executions to resume after 17 years",1594728703.0,"07/14/2020, 12:11:43",322,1,328,6.559293995238306,0.98,0.9817073170731707
250,law,"Appeals Court Rejects Flynn Bid To Force Judge To End Criminal Case, No Questions Asked",1598890404.0,"08/31/2020, 16:13:24",98,0,323,15.980804873477553,0.95,0.30340557275541796
251,law,I’m a public defender in Manhattan. The Central Park video is all too familiar.,1590585945.0,"05/27/2020, 13:25:45",165,0,324,33.74276581505109,0.91,0.5092592592592593
252,law,Appeals court orders judge to dismiss Flynn charges,1593008260.0,"06/24/2020, 14:17:40",363,3,324,14.153736118911468,0.96,1.1203703703703705
253,law,Trump Fires U.S. Attorney Who Investigated His Associates,1592682237.0,"06/20/2020, 19:43:57",125,0,319,20.933704988869806,0.94,0.39184952978056425
254,law,"Three indicted for allegedly throwing Molotov cocktails at NYPD vehicles, face life in prison",1592065281.0,"06/13/2020, 16:21:21",288,0,321,13.241283556242252,0.96,0.897196261682243
255,law,"Police Department Shells Out $50,000 To Man After His Camera Catches Cops Fabricating Criminal Charges Against Him",1584228242.0,"03/14/2020, 23:24:02",51,0,323,7.188983334599527,0.98,0.15789473684210525
256,law,"Trump pays $2 million in damages ordered by judge over misuse of charity funds, according to NY attorney general",1576007168.0,"12/10/2019, 19:46:08",90,0,321,24.078924783306263,0.93,0.2803738317757009
257,law,Report: Police major in charge of Breonna Taylor officers pressured investigators,1602261465.0,"10/09/2020, 16:37:45",42,0,317,8.3385620059791,0.97,0.13249211356466878
258,law,"Justice Dept. deems New York City, Portland and Seattle 'anarchist jurisdictions'",1600700421.0,"09/21/2020, 15:00:21",131,0,318,8.510528453853965,0.97,0.4119496855345912
259,law,Alan Dershowitz Files $300 Million Lawsuit Against CNN for Portraying Him as an ‘Intellectual Who Had Lost His Mind’,1600209487.0,"09/15/2020, 22:38:07",87,0,317,11.413331127975482,0.97,0.2744479495268139
260,law,"Supreme Court, in 5-4 Decision, Rejects Church’s Challenge to Shutdown Order",1590814943.0,"05/30/2020, 05:02:23",125,0,323,6.567651523005679,0.98,0.38699690402476783
261,law,"Judge Orders Feds to Give Immigrant Detainees Food, Blankets, Showers",1582205137.0,"02/20/2020, 13:25:37",107,0,326,15.426255157166622,0.95,0.3282208588957055
262,law,"Michael Cohen, former personal lawyer and fixer for President Trump, was denied a promised early release from prison Friday, a day after an attorney from the Trump Organization sent him a threatening letter warning against him publishing a reported “tell-all” book before the 2020 election",1588374929.0,"05/01/2020, 23:15:29",63,0,317,24.94409795445307,0.93,0.19873817034700317
263,law,"Trump Could Be Investigated for Tax Fraud, D.A. Says for First Time",1600733798.0,"09/22/2020, 00:16:38",28,0,317,35.69136624205191,0.9,0.08832807570977919
264,law,Hospitals say feds are seizing masks and other coronavirus supplies without a word,1586320464.0,"04/08/2020, 04:34:24",175,0,319,14.102920985993876,0.96,0.54858934169279
265,law,Netanyahu To Be Indicted On Corruption Charges In Israel : NPR,1574356383.0,"11/21/2019, 17:13:03",14,0,317,13.194384189496759,0.96,0.04416403785488959
266,law,"So far, in jury selection at Roger Stone's trial: an observer had a seizure, Stone anxiously retreated to a bathroom for 30 minutes, Milo Yiannopoulos is there, the only juror questioned so far's husband works in DOJ's Nat'l Security Div &amp; she ran OMB comms. It's Day 1, y'all.",1572977290.0,"11/05/2019, 18:08:10",80,1,319,13.77224431818803,0.96,0.2507836990595611
267,law,St. Louis couple (both lawyers) pulls firearms on protesters cutting through their private street,1593465481.0,"06/29/2020, 21:18:01",334,0,318,23.41223259558302,0.93,1.050314465408805
268,law,Justice Dept dropping Flynn's criminal case,1588876265.0,"05/07/2020, 18:31:05",294,0,313,7.623046311226062,0.98,0.939297124600639
269,law,A Teenager Posted About Her COVID-19 Infection on Instagram. A Deputy Threatened To Arrest Her If She Didn't Delete It.,1587186947.0,"04/18/2020, 05:15:47",108,0,321,3.069491274704774,0.99,0.3364485981308411
270,law,Weinstein Is Convicted of Rape in New York Sexual Assault Trial,1582563279.0,"02/24/2020, 16:54:39",92,0,323,9.717109806936207,0.97,0.2848297213622291
271,law,checks out with us.,1581609714.0,"02/13/2020, 16:01:54",97,0,315,7.188289359082148,0.98,0.30793650793650795
272,law,a federal judge has ordered DOJ to confer with the WH about its official position on declassification of Russia docs in response to Trump’s tweets. BuzzFeed is seeking access to the *entire* Mueller report based on Trump’s declassification order via tweet.,1602214853.0,"10/09/2020, 03:40:53",22,0,319,8.572840102317059,0.97,0.06896551724137931
273,law,"Florida ruled felons must pay to vote. Now, it doesn’t know how many can.",1602163023.0,"10/08/2020, 13:17:03",160,0,318,19.99308285797025,0.94,0.5031446540880503
274,law,"Police misconduct, such as falsifying evidence, is a leading cause of wrongful convictions, study finds",1600281297.0,"09/16/2020, 18:34:57",80,0,316,10.33906985257886,0.97,0.25316455696202533
275,law,Man who refused to decrypt hard drives is free after four years in jail: Court holds that jail time to force decryption can't last more than 18 months.,1581557869.0,"02/13/2020, 01:37:49",79,0,313,7.968052951864763,0.98,0.2523961661341853
276,law,Biden camp raises money for post-election court brawl,1604327620.0,"11/02/2020, 14:33:40",26,0,322,19.71813121077946,0.94,0.08074534161490683
277,law,"Nearly 2,000 DOJ Alumni Sign Letter with Dire Warning: Bill Barr Is Working to Rig 2020 Election for Trump",1601606836.0,"10/02/2020, 02:47:16",26,0,313,45.68564066193909,0.87,0.08306709265175719
278,law,Trump campaign sues New Jersey after its decision to mail ballots in November election,1597840541.0,"08/19/2020, 12:35:41",121,0,315,9.745174188257351,0.97,0.38412698412698415
279,law,"Gov. Cuomo signs police reform legislation, including repeal of 50-a, into law",1591979950.0,"06/12/2020, 16:39:10",34,0,315,6.9445446584713295,0.98,0.10793650793650794
280,law,Federal Agents Shoot Portland Reporter With Projectile Hours After Judge Issues Restraining Order to Protect Journalists,1595608513.0,"07/24/2020, 16:35:13",118,0,308,26.776451522027685,0.92,0.38311688311688313
281,law,Rolling Stones Working With BMI to Stop Trump’s Use of ‘You Can’t Always Get What You Want’ at Rallies,1593403692.0,"06/29/2020, 04:08:12",28,0,311,27.57018327741656,0.92,0.09003215434083602
282,law,Police officer told to 'tone down your gayness' reaches $10 million settlement,1581521885.0,"02/12/2020, 15:38:05",108,0,317,16.159982764831454,0.95,0.34069400630914826
283,law,Federal Judge calls Secretary of Education Betsy Devos' student loan forgiveness process 'disturbingly Kafkaesque',1603234185.0,"10/20/2020, 22:49:45",25,0,309,20.10735944619904,0.94,0.08090614886731391
284,law,"Trump Adds Ted Cruz, Tom Cotton To List Of Potential Supreme Court Picks",1599738682.0,"09/10/2020, 11:51:22",198,0,308,13.951853358391759,0.96,0.6428571428571429
285,law,"8 Years After Proving Racism Affected His Trial, North Carolina Inmate Taken Off Death Row",1597595513.0,"08/16/2020, 16:31:53",12,0,317,13.062619347094198,0.96,0.03785488958990536
286,law,ACLU Wins Court Order Preventing Portland Police From ‘Collecting or Maintaining’ Recordings of Protesters,1596148472.0,"07/30/2020, 22:34:32",59,0,310,25.236305541475417,0.92,0.19032258064516128
287,law,SDNY Rejects ‘Absurd’ Notion That Jeffrey Epstein’s Non-Prosecution Agreement Still Protects Ghislaine Maxwell,1594677476.0,"07/13/2020, 21:57:56",31,0,310,7.978438284502943,0.97,0.1
288,law,"Texas Airport Has Spent Over $300,000 In Legal Fees Defending Decision To Ban Chick-Fil-A",1579968790.0,"01/25/2020, 16:13:10",310,0,314,20.73009163615285,0.94,0.9872611464968153
289,law,Judge: Wilber Ross’s Personal Email Account is Subject to FOIA Requests Because He Used It For Government Business,1595598086.0,"07/24/2020, 13:41:26",34,0,304,5.549632521057276,0.98,0.1118421052631579
290,law,Prosecutor: No time for evidence against arrested reporter,1595190213.0,"07/19/2020, 20:23:33",64,0,309,14.804958509390644,0.95,0.20711974110032363
291,law,"""In mid-1800s, ABA began expressing concerns over the “quality” of immigrant and “mixed-race” applicants. When the ABA inadvertently admitted three Black lawyers in 1920, it asked its members to consider expelling the Black attorneys because of the importance of “keeping pure the Anglo-Saxon race.""",1594253518.0,"07/09/2020, 00:11:58",64,0,306,22.408871991100057,0.93,0.20915032679738563
292,law,Court To Cop: We Don't Need On-Point Precedent To Deny You Immunity For Killing A Dog That Couldn't Hurt You,1581059768.0,"02/07/2020, 07:16:08",55,0,306,13.973334843837563,0.96,0.17973856209150327
293,law,"Ken Cuccinelli’s appointment to top immigration job was unlawful, court rules, invalidating policy memos he signed",1583100541.0,"03/01/2020, 22:09:01",73,0,309,14.920757859187574,0.95,0.23624595469255663
294,law,Renaming Penn Law exemplifies disregard for transparency and student voices,1573529849.0,"11/12/2019, 03:37:29",246,0,304,18.05000732301096,0.94,0.8092105263157895
295,law,Judge rules Michigan stay-at-home order doesn’t infringe on constitutional rights,1588216527.0,"04/30/2020, 03:15:27",88,0,307,12.821631344058517,0.96,0.28664495114006516
296,law,Federal judge shoots down Texas proclamation allowing one ballot drop-off location per county,1602301803.0,"10/10/2020, 03:50:03",36,0,303,10.272334768877101,0.97,0.1188118811881188
297,law,Good news for First Amendment freedom of assembly: “No-protest condition will be dropped for people facing federal charges in Portland demonstrations”,1596065444.0,"07/29/2020, 23:30:44",31,0,307,15.779372909152869,0.95,0.10097719869706841
298,law,Three GOP attorneys general sue to prevent adding Equal Rights Amendment to the Constitution,1576785563.0,"12/19/2019, 19:59:23",127,0,300,24.693437345598625,0.92,0.42333333333333334
299,law,9th Circuit Rules California's 10 Round Magazine Ban Unconstitutional,1597421599.0,"08/14/2020, 16:13:19",199,0,301,11.94150033972187,0.96,0.6611295681063123
300,law,"Devin Nunes can’t sue Twitter over statements by fake cow, judge rules",1593032502.0,"06/24/2020, 21:01:42",25,1,299,11.146432041530886,0.96,0.08361204013377926
301,law,"After Giuliani 'Fixer' Alleges Nunes Met With Ukrainian Officials to Seek Biden Dirt, Congressman Threatens to Sue Media",1574515545.0,"11/23/2019, 13:25:45",61,0,298,13.902735761330064,0.96,0.20469798657718122
302,law,Whistleblower Complaint Alleges Mass Hysterectomies at ICE Detention Center,1600110024.0,"09/14/2020, 19:00:24",78,0,295,13.979435202868956,0.95,0.26440677966101694
303,law,"DC mayor Muriel Bowser takes on Trump, sparks Third Amendment debate with call to remove troops from capital",1591369460.0,"06/05/2020, 15:04:20",114,0,298,18.957540695534476,0.94,0.3825503355704698
304,law,"Medical company threatens to sue volunteers that 3D-printed valves for life-saving coronavirus treatments - The valve typically costs about $11,000 — the volunteers made them for about $1",1584534688.0,"03/18/2020, 12:31:28",61,0,299,22.754690434011536,0.93,0.2040133779264214
305,law,Couple wins $115K verdict against Tennessee Bureau of Investigation agents for home invasion,1581975493.0,"02/17/2020, 21:38:13",73,0,297,3.6431564872970625,0.99,0.24579124579124578
306,law,DOJ Admits to Federal Court That Trump Lied to His Supporters on Twitter About Declassifying All Russia Docs,1602728325.0,"10/15/2020, 02:18:45",21,1,299,25.79283891215738,0.92,0.07023411371237458
307,law,"Breonna Taylor grand jury audio to be released Friday, Kentucky AG says",1601555074.0,"10/01/2020, 12:24:34",75,0,298,8.798019512168992,0.97,0.2516778523489933
308,law,"Oregon Supreme Court holds that the state constitution imposes a subject matter limitation on searches and seizures, bars pretextual traffic stops used to investigate other crimes.",1574088729.0,"11/18/2019, 14:52:09",37,0,297,5.294244095741476,0.98,0.12457912457912458
309,law,"Breonna Taylor grand jury members allowed to speak, judge says",1603220589.0,"10/20/2020, 19:03:09",111,0,293,19.699540940557142,0.94,0.378839590443686
310,law,Columnist who has accused Trump of sexual assault seeks to block DOJ intervention in defamation case,1601988729.0,"10/06/2020, 12:52:09",72,0,297,23.30046382042326,0.93,0.24242424242424243
311,law,"Minnesota is now using contact tracing to track protestors, as demonstrations escalate",1590947385.0,"05/31/2020, 17:49:45",33,0,295,20.107087448400193,0.94,0.11186440677966102
312,law,Teenager in Wisconsin shootings charged with six criminal counts: complaint,1598572302.0,"08/27/2020, 23:51:42",569,0,293,10.3542058678471,0.97,1.9419795221843004
313,law,U.S. Senators Introduce Ultimate Backdoor Bill Banning the Use of Strong Consumer-Grade Encryption,1593572644.0,"07/01/2020, 03:04:04",129,0,296,4.6835685926644715,0.98,0.4358108108108108
314,law,"‘We Need to Take Away Children,’ No Matter How Young, Justice Dept. Officials Said",1602027884.0,"10/06/2020, 23:44:44",67,0,288,20.223238447977167,0.93,0.2326388888888889
315,law,"State of the Sub, or: How Not To Get Banned",1582847760.0,"02/27/2020, 23:56:00",0,0,296,35.086394325660706,0.89,0.0
316,law,"The Evolution of Modern Use-of-Force Policies: ""Reversing a police-against-the-world mentality is essential to restoring police-community relations""",1590684010.0,"05/28/2020, 16:40:10",106,0,292,10.778123675308166,0.96,0.363013698630137
317,law,Lawyers for Michael Flynn and the Justice Department told a federal judge on Wednesday that he must agree to dismiss the criminal case against President Donald Trump's former national security adviser because the judge has no authority to do anything else,1592418038.0,"06/17/2020, 18:20:38",184,0,293,8.932250324670235,0.97,0.6279863481228669
318,law,Trump administration revokes transgender health protection,1592001522.0,"06/12/2020, 22:38:42",98,0,293,26.964501378821637,0.92,0.33447098976109213
319,law,Judge Deals Setback to Trump Family: Ugly Pyramid Scheme Lawsuit Likely to Unfold in Public,1589891343.0,"05/19/2020, 12:29:03",18,0,293,30.562038342435187,0.91,0.06143344709897611
320,law,ABA urges states that cancel bar exams due to COVID-19 to consider alternatives for law grads,1586378277.0,"04/08/2020, 20:37:57",118,0,294,13.051283141118347,0.96,0.4013605442176871
321,law,"Trump Again Tries to Block Subpoena for Taxes, Calling It ‘Wildly Overbroad’",1595939696.0,"07/28/2020, 12:34:56",104,0,286,14.130782234014589,0.95,0.36363636363636365
322,law,Federal appeals court allows lawsuit against former public officials in Flint water crisis to proceed,1590432478.0,"05/25/2020, 18:47:58",4,0,290,5.9196947509147435,0.98,0.013793103448275862
323,law,Rep. Devin Nunes slaps CNN with $435 million defamation lawsuit,1575407242.0,"12/03/2019, 21:07:22",117,0,288,16.360260658896323,0.95,0.40625
324,law,Federal Court Rules Suspicionless Searches of Travelers’ Phones and Laptops Unconstitutional,1573593460.0,"11/12/2019, 21:17:40",43,0,293,0.7269225213610184,1.0,0.14675767918088736
325,law,Does New York now have enough information to charge Trump with tax fraud?,1601300921.0,"09/28/2020, 13:48:41",88,0,295,50.347697885835714,0.85,0.2983050847457627
326,law,"Federal law prohibits president from sending “armed men,” such as federal law enforcement agents, to polls on Election Day. 18 USC 592.",1598037229.0,"08/21/2020, 19:13:49",49,0,292,27.28366648102292,0.91,0.1678082191780822
327,law,"We Need a Separate Police Justice System, a Court Martial for Cops",1599548499.0,"09/08/2020, 07:01:39",127,0,288,25.669630835397186,0.92,0.4409722222222222
328,law,"If they can't pay, judge says Florida felons can still vote",1590364770.0,"05/24/2020, 23:59:30",88,0,286,15.521236200122132,0.95,0.3076923076923077
329,law,Do not try and ride out an economic storm in law school.,1586878572.0,"04/14/2020, 15:36:12",102,0,289,21.806234500808728,0.93,0.35294117647058826
330,law,Arizona is the the first state to allow nonlawyer co-ownership of law firms,1598628927.0,"08/28/2020, 15:35:27",164,0,287,11.035830777914555,0.96,0.5714285714285714
331,law,Judge Orders Release of Unaired 'Apprentice' Tapes,1586536323.0,"04/10/2020, 16:32:03",30,0,288,14.36975959576273,0.95,0.10416666666666667
332,law,A Pennsylvania Court Tried To Force Ancestry.com To Open Up Its Database Of 16 Million DNA Profiles To The Police,1580820392.0,"02/04/2020, 12:46:32",132,0,289,9.47651780815903,0.97,0.45674740484429066
333,law,A federal judge revoked the grazing permit of two ranchers who were pardoned by President Donald Trump on an arson conviction for setting fire to federal lands. The judge ruled the U.S. Bureau of Land Management should not have issued a grazing permit after Trump’s July 2018 pardon,1576979279.0,"12/22/2019, 01:47:59",100,0,285,8.861671160192543,0.97,0.3508771929824561
334,law,Judge Scraps 'Conscience' Rule Protecting Doctors Who Deny Care For Religious Reasons,1573068798.0,"11/06/2019, 19:33:18",44,0,289,12.344498935043532,0.96,0.1522491349480969
335,law,"Workers who self-quarantine for coronavirus can sue employer if they’re fired, Case Western law professor says - cleveland.com",1584558563.0,"03/18/2020, 19:09:23",37,0,280,43.1549385729021,0.87,0.13214285714285715
336,law,Appeals Court Denies Qualified Immunity To Cop Who Argued Citizens Have No Right To Defend Themselves Against Armed Intruders,1573967675.0,"11/17/2019, 05:14:35",82,0,288,5.934923075347456,0.98,0.2847222222222222
337,law,"Controversial law allows police to seize and sell cars of non-lawbreakers, keeping the proceeds",1599117553.0,"09/03/2020, 07:19:13",47,0,285,8.143546225783723,0.97,0.1649122807017544
338,law,Missouri Supreme Court decides state public defenders have immunity from malpractice claims,1593991761.0,"07/05/2020, 23:29:21",49,0,283,7.763299709762862,0.97,0.17314487632508835
339,law,"Wrongfully convicted New York City man refused to admit guilt to parole board 8 times, attorney says",1580346133.0,"01/30/2020, 01:02:13",69,1,288,3.8019075715001804,0.99,0.23958333333333334
340,law,Barr warns that communities that don't show respect to law enforcement may not get police protection,1575484875.0,"12/04/2019, 18:41:15",251,0,285,25.97889646002335,0.92,0.8807017543859649
341,law,Trump Nominates Former Clarence Thomas Clerk Who Graduated Law School in 2012 to Lifetime Judgeship,1597268502.0,"08/12/2020, 21:41:42",138,0,282,14.35558258794373,0.95,0.48936170212765956
342,law,Missing From Supreme Court’s Election Cases: Reasons for Its Rulings,1603718455.0,"10/26/2020, 13:20:55",190,0,283,16.528833422805917,0.94,0.6713780918727915
343,law,"Trump’s stimulus orders don’t seem to be feasible or legal, experts say",1596944338.0,"08/09/2020, 03:38:58",91,0,280,23.411192803687527,0.92,0.325
344,law,UPDATE: Federal appeals court now says in-person Texas GOP convention can’t happen,1595129486.0,"07/19/2020, 03:31:26",37,0,281,13.112827094471697,0.96,0.13167259786476868
345,law,"The judge presiding over Roger Stone's case has denied a motion from the defendant to have her disqualified. Judge Amy Berman Jackson in a filing issued Sunday evening said Stone's legal team did not provide any ""factual or legal support"" to have her removed from presiding over his case",1582502233.0,"02/23/2020, 23:57:13",29,0,282,18.988291175510483,0.94,0.10283687943262411
346,law,When I find someone's shit language added to my initial draft,1601150301.0,"09/26/2020, 19:58:21",16,1,280,22.782081319172676,0.92,0.05714285714285714
347,law,Pakistani man shot dead in courtroom for claiming to be a prophet which is considered blasphemy in Pakistan,1596324817.0,"08/01/2020, 23:33:37",58,0,281,13.504478851803412,0.95,0.20640569395017794
348,law,"Kentucky State Police training slideshow quotes Hitler, advocates ‘ruthless’ violence",1604113635.0,"10/31/2020, 03:07:15",76,0,281,14.971369435332122,0.95,0.2704626334519573
349,law,The man who allegedly fired the first shot behind Kyle Rittenhouse prior to the fatal shooting has been charged.,1602686090.0,"10/14/2020, 14:34:50",436,0,279,24.538648420299126,0.92,1.5627240143369177
350,law,A GNC manager says he was fired because he enforced a local face mask ordinance. He sued. The company went into bankruptcy. The order in which this happened means everything to the lawsuit. | The Legal Examiner,1598535615.0,"08/27/2020, 13:40:15",25,0,279,7.690005189583303,0.97,0.08960573476702509
351,law,Michigan Court of Claims upholds Whitmer's power to extend stay-at-home order,1590107704.0,"05/22/2020, 00:35:04",23,0,284,11.492174794962466,0.96,0.08098591549295775
352,law,A federal judge in Washington has ordered the NSA to turn over to her a memo that details an unusual conversation in which President Donald Trump pleaded with former NSA chief Adm. Mike Rogers to take action to rebut news reports about collusion between the Trump campaign and Russia,1583635467.0,"03/08/2020, 02:44:27",22,0,282,19.800954506077517,0.93,0.07801418439716312
353,law,"Party houses defying COVID-19 orders may have utilities shut off, mayor says",1596893071.0,"08/08/2020, 13:24:31",68,0,280,10.963182354951925,0.96,0.24285714285714285
354,law,Corona Emergency Benchslap,1584734798.0,"03/20/2020, 20:06:38",65,0,279,2.2934287265388775,0.99,0.23297491039426524
355,law,Federal judge in Oregon upholds record $925 million damages verdict in unlawful recorded robocall case,1597801855.0,"08/19/2020, 01:50:55",29,0,274,3.326365803087299,0.99,0.10583941605839416
356,law,D.C. police will no longer handcuff children under 12,1580222371.0,"01/28/2020, 14:39:31",112,0,275,11.391983725531759,0.96,0.4072727272727273
357,law,Manhattan DA accuses Trump of trying to stall tax return subpoena,1594914985.0,"07/16/2020, 15:56:25",56,0,276,15.792841963179399,0.95,0.2028985507246377
358,law,"Supreme Court lawyer ""can't think of something more dangerous to our democracy"" than Dershowitz's Trump defense becoming precedent",1580521423.0,"02/01/2020, 01:43:43",108,0,275,53.95394542568823,0.84,0.3927272727272727
359,law,"Five American journalists sued the U.S. government Wednesday, alleging border authorities violated their First Amendment rights by inspecting their cameras and notebooks and questioning them extensively about their coverage of last year’s migrant caravan",1574330184.0,"11/21/2019, 09:56:24",11,0,277,7.749511742070638,0.97,0.039711191335740074
360,law,"The US government announced Friday it is ready to begin collecting DNA from all immigrants it detains, to be saved in a federal police database",1583521077.0,"03/06/2020, 18:57:57",105,0,274,16.987562256673925,0.94,0.38321167883211676
361,law,Biden says he's open to Obama being Supreme Court nominee,1577650741.0,"12/29/2019, 20:19:01",165,0,274,42.34298190315218,0.87,0.6021897810218978
362,law,Defeated GOP governor pardons violent criminals in a spree lawyers are calling an ‘atrocity of justice’,1576233923.0,"12/13/2019, 10:45:23",187,0,274,19.532905813685943,0.93,0.6824817518248175
363,law,"Six states, D.C. file lawsuit against Postal Service over service changes",1598018171.0,"08/21/2020, 13:56:11",39,0,273,11.68749683345834,0.96,0.14285714285714285
364,law,Harris County ADA's resignation letter.,1593148712.0,"06/26/2020, 05:18:32",69,0,273,9.254572805667635,0.97,0.25274725274725274
365,law,"Harvey Weinstein was told to stop using his cell phone in court. Now, he wants that judge to recuse himself",1578526185.0,"01/08/2020, 23:29:45",66,0,272,9.053640437421677,0.97,0.2426470588235294
366,law,"Lawyer for Vindman Sends Letter to Fox Demanding Retraction of ""Espionage"" Allegation",1574283778.0,"11/20/2019, 21:02:58",192,0,273,15.127188098048578,0.95,0.7032967032967034
367,law,Republicans ask Supreme Court to reinstate Arizona voting rules deemed racially biased,1596025161.0,"07/29/2020, 12:19:21",92,0,273,22.80930445515827,0.92,0.336996336996337
368,law,Danks &amp; Danks,1594598162.0,"07/12/2020, 23:56:02",14,0,275,19.494751568573292,0.93,0.05090909090909091
369,law,"Lori Loughlin, husband Mossimo Giannulli agree to plead guilty to charges in college admissions scandal",1590068144.0,"05/21/2020, 13:35:44",80,0,274,6.7609376088551585,0.98,0.291970802919708
370,law,"‘It’s really a question of when.’ The coronavirus pandemic is about to spawn a surge in bankruptcies, experts say",1585824691.0,"04/02/2020, 10:51:31",48,0,273,13.1351350106969,0.95,0.17582417582417584
371,law,Judge Overturns Verdict Against Virginia Man Who Flipped Off Cop,1585150656.0,"03/25/2020, 15:37:36",66,0,272,1.4518111866565278,0.99,0.2426470588235294
372,law,Powerful US attorney who investigated Trump associates refuses to step down after Barr tries to push him out,1592626486.0,"06/20/2020, 04:14:46",24,0,267,19.571542646370858,0.93,0.0898876404494382
373,law,We Cracked the Redactions in the Ghislaine Maxwell Deposition,1603390293.0,"10/22/2020, 18:11:33",57,0,271,7.3192465220105305,0.97,0.21033210332103322
374,law,Cory Booker Wants To End Qualified Immunity For Police Officers,1591603686.0,"06/08/2020, 08:08:06",72,0,270,13.757585088009819,0.95,0.26666666666666666
375,law,"District court reverses convictions of No More Death volunteers who left food and water in the desert for migrants, on religious freedom grounds",1580851402.0,"02/04/2020, 21:23:22",56,0,269,5.685493420402111,0.98,0.20817843866171004
