,Subreddit,Title,Epoch Time,Date,Comments,Awards,Upvotes,Downvotes,Upvote Ratio,Comment/Upvote Ratio
200,occupywallstreet,"Exclusive: 'Sorry is not enough', Caribbean states say of British slavery apologies -- ""British financial institutions that benefited from slavery . . . should go further than saying sorry for their role in the Atlantic slave trade and atone for their sins by funding Caribbean development""",1592587365.0,"06/19/2020, 17:22:45",14,0,188,4.40406161724772,0.98,0.07446808510638298
201,occupywallstreet,BREAKING: U.S. has lost 36.5 million jobs in 8 weeks and the real unemployment rate soars past 26%,1589465304.0,"05/14/2020, 14:08:24",21,0,183,1.8599359028733602,0.99,0.11475409836065574
202,occupywallstreet,Trump Push for 'Middle Class' Tax Cut Ahead of 2020 Derided as Admission That 'His First Tax Cut Was a Scam',1573676982.0,"11/13/2019, 20:29:42",28,0,183,4.3595695318165895,0.98,0.15300546448087432
203,occupywallstreet,Whistleblower: Wall Street has Engaged in Widespread Manipulation of Commercial Real Estate Mortgage Funds,1589937517.0,"05/20/2020, 01:18:37",22,0,184,0.055624173660106635,1.0,0.11956521739130435
204,occupywallstreet,"Inside the conservative network backing the anti-quarantine protests | ""The involvement of the Koch institutional apparatus in groups supporting these protests is clear to me ... These are extreme right-wing efforts to delegitimize government ... It's an anti-government crusade.""",1587578459.0,"04/22/2020, 18:00:59",20,0,187,5.793055713150636,0.97,0.10695187165775401
205,occupywallstreet,"Trump supporter reacts to Bernie Sanders's call for the end of anti-union ""right-to-work"" laws: ""Civil war before socialism. Armed and ready to fight""",1574903685.0,"11/28/2019, 01:14:45",30,0,185,4.592939978020581,0.98,0.16216216216216217
206,occupywallstreet,Said the pot,1603391873.0,"10/22/2020, 18:37:53",13,0,183,8.155476755981255,0.96,0.07103825136612021
207,occupywallstreet,"Billion-dollar meatpacking companies fined total of $30,000 after 10 worker COVID deaths, 1,600 infections",1600188218.0,"09/15/2020, 16:43:38",11,0,185,-0.6481185234030704,1.0,0.05945945945945946
208,occupywallstreet,"Trump chloroquine push came after talk with donor, source says: The official said he was instructed to implement a program aimed at expanding access to the drug after the president's conversation with a billionaire supporter.",1587667458.0,"04/23/2020, 18:44:18",11,0,187,4.03933883245486,0.98,0.058823529411764705
209,occupywallstreet,"Trump is threatening to undo the efforts against the coronavirus pandemic within weeks because of disruptions to the economy, while Republicans oppose progressive measures to expand the social safety net. Trump said that ""companies are loved by our workers"" because of ""big salaries.""",1585009343.0,"03/24/2020, 00:22:23",13,0,184,6.241415143078854,0.97,0.07065217391304347
210,occupywallstreet,Joe VS Bernie what do they really stand for ?,1579035938.0,"01/14/2020, 21:05:38",10,0,182,4.441966607914338,0.98,0.054945054945054944
211,occupywallstreet,"Evangelist who met with a Congressman: 'God has ordained' Trump to completely destroy his political enemies | In reaction to the impeachment of Trump, the evangelist cited biblical stories where God commanded wars &amp; genocide, which included an order to ""put to death men &amp; women, children &amp; infants""",1576683873.0,"12/18/2019, 15:44:33",20,0,181,4.932440830338805,0.97,0.11049723756906077
212,occupywallstreet,"Donald Trump's so-called 'miracle' coronavirus treatment was tested on cells derived from an abortion – The Trump administration has notably opposed medical research that uses fetal tissue from abortions, while knocking back numerous requests from scientists to work with it.",1602165185.0,"10/08/2020, 13:53:05",9,0,185,5.994476942941674,0.97,0.04864864864864865
213,occupywallstreet,A group of armed Trump supporters on a military vehicle were at the protest at the Pennsylvania State Capitol supporting Trump's call to open the economy,1587418962.0,"04/20/2020, 21:42:42",33,0,183,10.058906275176525,0.95,0.18032786885245902
214,occupywallstreet,"9 Iran pundits with undisclosed ties to the defense industry | 'Since Trump ordered the drone attack that killed Soleimani, numerous pundits who have appeared on cable TV to opine on Iran have undisclosed financial ties to the defense industry.'",1578833298.0,"01/12/2020, 12:48:18",4,0,180,2.61703248729728,0.99,0.022222222222222223
215,occupywallstreet,"Joe Biden to rich donors: ""Nothing would fundamentally change"" if he's elected: Along with praise for the 'civility' of racists",1577665932.0,"12/30/2019, 00:32:12",3,0,183,5.596746363559873,0.97,0.01639344262295082
216,occupywallstreet,"Stephen Miller’s Affinity for White Nationalism Revealed in Leaked Emails | Former Breitbart editor: ""What Stephen Miller sent to me in those emails has become policy at the Trump administration""",1573608901.0,"11/13/2019, 01:35:01",3,0,181,7.858820053936199,0.96,0.016574585635359115
217,occupywallstreet,"Climate change: The rich are to blame, international study finds",1586850152.0,"04/14/2020, 07:42:32",4,0,181,0.6602190659901055,1.0,0.022099447513812154
218,occupywallstreet,"Outrage and Disgust After 'Serial Killer' Navy SEAL, Pardoned by Trump for War Crimes, Rebrands as Conservative Influencer ""Everything's a grift today. Even, it seems, for pardoned war criminals.""",1577966976.0,"01/02/2020, 12:09:36",21,0,177,5.495256403122568,0.97,0.11864406779661017
219,occupywallstreet,Drake Knows,1601926956.0,"10/05/2020, 19:42:36",20,1,181,20.824160445385075,0.9,0.11049723756906077
220,occupywallstreet,"Trump's holiday menu: handouts for billionaires, hunger for the poor | Article by Bernie Sanders and Rashida Tlaib: ""This is what oligarchy looks like""",1577205846.0,"12/24/2019, 16:44:06",7,0,181,3.1061837345995684,0.98,0.03867403314917127
221,occupywallstreet,Pushing Hydroxychloroquine is Trump’s Latest Disaster Capitalism Scam,1586375936.0,"04/08/2020, 19:58:56",3,0,181,8.246251606723717,0.96,0.016574585635359115
222,occupywallstreet,"$4.7 billion a day. $32 billion a week. $141 billion a month. $845 billion over 6 months. That's how much 643 billionaires in America made during the pandemic, while 30 million Americans don't have enough food to eat. Yes. It's time for austerity for the billionaire class.",1600435328.0,"09/18/2020, 13:22:08",16,0,179,1.8093105819763196,0.99,0.0893854748603352
223,occupywallstreet,ICE Agents Are Arresting Black Lives Matter Protesters,1592179788.0,"06/15/2020, 00:09:48",1,0,180,4.328536165648245,0.98,0.005555555555555556
224,occupywallstreet,"US blocks vote on UN's bid for global ceasefire over reference to World Health Organization: Security council had spent weeks seeking resolution but Trump administration opposed mention of organization | The U.S. opposed the U.N.'s call to end war over the mention of ""specialized health agencies""",1589123338.0,"05/10/2020, 15:08:58",5,0,182,2.4261866508504113,0.99,0.027472527472527472
225,occupywallstreet,NYC Throws Students and Teachers Under the Bus To Protect Economy During Pandemic,1584281609.0,"03/15/2020, 14:13:29",4,0,178,2.818744045204852,0.98,0.02247191011235955
226,occupywallstreet,"Trump on his tax cuts in 2017: Slashing the corporate tax rate is ""probably the biggest factor in this plan"" | ""Corporations are literally going wild over this"" | After signing the tax cuts, Trump told friends at his Mar-a-Lago resort: ""You all just got a lot richer""",1577200066.0,"12/24/2019, 15:07:46",12,0,180,1.6152914774729084,0.99,0.06666666666666667
227,occupywallstreet,"Trump Appointees Manipulated Consumer Financial Protection Bureau's Payday Lending Research, Ex-Staffer Claims--steering the bureau’s reversal on payday lending rules to gut a key provision",1588255104.0,"04/30/2020, 13:58:24",2,0,173,3.9596777795104003,0.98,0.011560693641618497
228,occupywallstreet,"Dan Patrick, Republican Lt. Governor of Texas, on his support for opening the economy during the pandemic: ""There are more important things than living""",1587505175.0,"04/21/2020, 21:39:35",18,0,179,5.146701412157938,0.97,0.1005586592178771
229,occupywallstreet,"Corporate Democrat Jim Clyburn says that it's time to ""shut this primary down"" so that Joe Biden could avoid scrutiny: ""He says prolonging the primary process only makes it more likely that the favorite, Biden in his eyes, ""gets himself into trouble"" and hurts himself for the general election""",1583890287.0,"03/11/2020, 01:31:27",24,0,179,6.815891041702997,0.96,0.1340782122905028
230,occupywallstreet,"Leading By 9 in New Iowa Poll, Sanders Says His Campaign Is 'Worst Nightmare' of Trump and Billionaire Class",1580140917.0,"01/27/2020, 16:01:57",4,0,177,4.332652298296296,0.98,0.022598870056497175
231,occupywallstreet,"A vial of insulin costs $6 to make. This is not our health care system malfunctioning. This is exactly how it is designed to work: make as much profit for corporations as possible, regardless of the human cost. Insulin costs continue to rise, Half of patients Skip taking their Insulin due to cost.",1576531324.0,"12/16/2019, 21:22:04",1,0,177,2.286292022734017,0.99,0.005649717514124294
232,occupywallstreet,Coronavirus Laid Bare Flaws in the American Healthcare System,1586537275.0,"04/10/2020, 16:47:55",2,0,174,4.267774712796779,0.98,0.011494252873563218
233,occupywallstreet,NEW POWERFUL Bernie Sanders AD (KillerMike Speech)- THE TIME IS NOW!,1580471223.0,"01/31/2020, 11:47:03",8,0,173,0.8946480149173226,0.99,0.046242774566473986
234,occupywallstreet,Alex Jones’ Kills Credibility of Anti-Shutdown Protests,1587392491.0,"04/20/2020, 14:21:31",6,0,177,12.05905381136833,0.94,0.03389830508474576
235,occupywallstreet,Republican Senator's Adviser Formerly Served As Editor Of Neo-Confederate Magazine: One of South Carolina Sen. Lindsey Graham's longtime advisers was the editor-in-chief of a neo-Confederate magazine — a magazine Graham gave an interview to in 1999. (2015),1574541538.0,"11/23/2019, 20:38:58",2,0,176,3.7532042314220178,0.98,0.011363636363636364
236,occupywallstreet,'All my greatest achievement',1598617445.0,"08/28/2020, 12:24:05",22,1,175,17.98176041474329,0.91,0.12571428571428572
237,occupywallstreet,"A BLM tried to save the guy who got shot last night but the cops accidentally killed him. The cops let the MAGA/ fash die, let that sink in.",1598912860.0,"08/31/2020, 22:27:40",52,0,172,6.529446938794763,0.96,0.3023255813953488
238,occupywallstreet,They Filed for Unemployment Last Month. They Haven’t Seen a Dime. | U.S. labor departments are failing to support people affected by unemployment during the pandemic.,1587254100.0,"04/18/2020, 23:55:00",5,0,175,0.48260766331881655,1.0,0.02857142857142857
239,occupywallstreet,"URGENT PSA for IA Bernie Supporters: ""You must go EARLY to your caucus locations! If you get there and the venue is full to capacity, you WILL be turned away."" ""Also if you leave outside the caucus to smoke, to eat or anything, you will not be let back in"" and Other Crazy-@ss Caucus Rules.",1580761441.0,"02/03/2020, 20:24:01",1,0,172,2.971224439689138,0.98,0.005813953488372093
240,occupywallstreet,Tens of thousands sign ex-Australian Prime Minister Kevin Rudd’s petition to make Rupert Murdoch face a royal commission over his monopoly on Australian media,1602491220.0,"10/12/2020, 08:27:00",1,0,172,-0.732825974277489,1.0,0.005813953488372093
241,occupywallstreet,"""The Unraveling of America"" by Wade Davis, published on 6 August 2020 -- ""Today, the base pay of those at the top is commonly 400 times that of their salaried staff, with many earning orders of magnitude more in stock options and perks."" [United States of America]",1597045789.0,"08/10/2020, 07:49:49",6,0,174,1.455533708513002,0.99,0.034482758620689655
242,occupywallstreet,"NYPD to hold ""Blue Lives Matter"" rally in The Bronx, Morris Park's Loreto Playground",1592760115.0,"06/21/2020, 17:21:55",33,0,168,4.320722718609886,0.97,0.19642857142857142
243,occupywallstreet,"Bernie’s Easy Path Has Closed, But the Harder Path Is Better",1583847214.0,"03/10/2020, 13:33:34",4,0,173,-0.4952495927695679,1.0,0.023121387283236993
244,occupywallstreet,Bernie Sanders Wins Rigged CNN Debate #CNNIsTrash,1579112372.0,"01/15/2020, 18:19:32",2,0,171,4.497569146662556,0.97,0.011695906432748537
245,occupywallstreet,"Only Bernie Beats Trump, because only Bernie prevents another Trump",1574387631.0,"11/22/2019, 01:53:51",14,0,173,10.256011094906853,0.94,0.08092485549132948
246,occupywallstreet,Don’t forget where the real battle lies!,1576722653.0,"12/19/2019, 02:30:53",0,0,169,7.694012492610739,0.96,0.0
247,occupywallstreet,I've stayed within elite mansions. Behind closed doors I’ve witnessed firsthand what most Americans haven’t seen. This is my story — and a warning.,1573445075.0,"11/11/2019, 04:04:35",15,2,171,3.4439751254417104,0.98,0.08771929824561403
248,occupywallstreet,Mark Zuckerberg claimed Facebook makes a 'relatively small' amount from political advertising--it has made $2.2 billion from political ads since mid-2018,1603937098.0,"10/29/2020, 02:04:58",9,0,171,3.546248096185195,0.98,0.05263157894736842
249,occupywallstreet,Reminder: Police *purposefully* stood back to allow right-wing to kill Cornel West — only thing that stood between him and attackers was Antifa.,1598567860.0,"08/27/2020, 22:37:40",8,0,167,6.0981723782084885,0.96,0.04790419161676647
250,occupywallstreet,"Bernie Sanders: ""In January of 1991, one of the first votes I cast in Congress was against the war in Iraq. A decade after that first war in Iraq, I voted against yet another war in the same country. That was the right vote. We must end our endless wars.""",1578779426.0,"01/11/2020, 21:50:26",4,0,169,4.705720687939305,0.97,0.023668639053254437
251,occupywallstreet,U.S. jobless rate has already broken Great Depression records — and most media missed it: Media ran with the official jobless rate of 14.7% — even though the government admits it's really much higher,1589571081.0,"05/15/2020, 19:31:21",6,0,167,3.8112697333105814,0.98,0.03592814371257485
252,occupywallstreet,It’s that simple. We can’t defeat corporations if we vote for candidates who take their money.,1588181370.0,"04/29/2020, 17:29:30",21,0,164,20.183215495246344,0.89,0.12804878048780488
253,occupywallstreet,What does Ghislaine Maxwell have on Donald Trump?,1595637785.0,"07/25/2020, 00:43:05",7,0,170,5.814052301869424,0.97,0.041176470588235294
254,occupywallstreet,Unemployment Websites Are Crashing Across The Country,1584635348.0,"03/19/2020, 16:29:08",0,0,166,0.6805296558283089,1.0,0.0
255,occupywallstreet,Compilation Of Biden’s Public Lies &amp; Plagiarism,1583444791.0,"03/05/2020, 21:46:31",27,0,168,12.141030568769395,0.93,0.16071428571428573
256,occupywallstreet,A three-time cancer survivor who reached out to Senator Thom Tillis (R-NC) for help with her health insurance was told by a staffer for the Senator that she didn't deserve healthcare if she couldn't afford it. Tillis blocked Medicaid expansion in his state and strongly opposes universal healthcare.,1599692062.0,"09/09/2020, 22:54:22",22,0,164,1.3391692444540695,0.99,0.13414634146341464
257,occupywallstreet,“The Most Effective Way to Stop Police Terror Is Action at the Point of Production” | Longshore workers on the East and West Coast are stopping work today to demand an end to racist police murders.,1591753104.0,"06/10/2020, 01:38:24",5,0,165,3.6653226646941732,0.98,0.030303030303030304
258,occupywallstreet,"Black FOX Staffers Complained About Racism At Network Known for Being Racist | by Manny Otiko | Jul, 2020 | Medium",1595417532.0,"07/22/2020, 11:32:12",3,0,165,2.4108095435824737,0.99,0.01818181818181818
259,occupywallstreet,"Kyle Rittenhouse Is Latest Trump-Spawned Domestic Terrorist | by Manny Otiko | Aug, 2020 | Medium",1598794524.0,"08/30/2020, 13:35:24",36,0,160,16.80433423817513,0.9,0.225
260,occupywallstreet,"""Oh man. We REALLY need to talk about how the myth of American Exceptionalism is failing, how the only thing Trump can offer now is oppression, and the fascist threat of secret police and radical violence,"" writes Jared Yates Sexton on 17 July 2020. [United States of America]",1595071342.0,"07/18/2020, 11:22:22",6,0,162,8.575754143222127,0.95,0.037037037037037035
261,occupywallstreet,Bernie Sanders 8 1/2 hour filibuster but it's lofi,1583587510.0,"03/07/2020, 13:25:10",3,0,162,4.324235536644494,0.97,0.018518518518518517
262,occupywallstreet,"Trump proposed sending migrants to Guantánamo, book by anonymous author claims: Plan to designate migrants as ""enemy combatants"" (the term used by the Bush administration to detain al-Qaeda and Taliban suspects at Guantanamo Bay) provoked astonishment and mortification, says author of ""A Warning""",1573739184.0,"11/14/2019, 13:46:24",14,0,165,2.760478958955872,0.98,0.08484848484848485
263,occupywallstreet,Fruit Workers Strike for PPE and Hazard Pay,1589396999.0,"05/13/2020, 19:09:59",0,0,163,1.6806655763602407,0.99,0.0
264,occupywallstreet,65+ orgs call on Home Depot &amp; Lowe's to end sales of Bayer's cancer-linked Monsanto Roundup,1599079677.0,"09/02/2020, 20:47:57",2,0,160,4.817537786156606,0.97,0.0125
265,occupywallstreet,Scum keep saying that healthcare plan is around the corner.,1603551743.0,"10/24/2020, 15:02:23",53,0,159,3.0191755800795192,0.98,0.3333333333333333
266,occupywallstreet,"The corporate media and the establishment constantly smeared Bernie's campaign over ""toxic Bernie Bros,"" yet they never complain about toxic establishment/Biden supporters like this.",1583963976.0,"03/11/2020, 21:59:36",21,0,159,7.251158110827504,0.96,0.1320754716981132
267,occupywallstreet,"Strikes are 257% up in 2 years, even though labor union membership is down — why more workers are taking a stand",1581845989.0,"02/16/2020, 09:39:49",1,0,160,1.9969617422339354,0.99,0.00625
268,occupywallstreet,"The Alfalfa Club is an exclusive society for the political and economic elite, originally founded to celebrate Confederate General Robert E. Lee. Its participants in 2020 include Bezos, Mitt Romney, Ivanka Trump, Jared Kushner, Bill Gates, Wilbur Ross, Elaine Chao, Joe Lieberman, Mattis, Esper, etc.",1580180786.0,"01/28/2020, 03:06:26",12,0,161,3.6728759318497737,0.98,0.07453416149068323
269,occupywallstreet,Joe Rogan Experience #1330 - Bernie Sanders,1574077651.0,"11/18/2019, 11:47:31",46,0,159,10.453084897165525,0.94,0.2893081761006289
270,occupywallstreet,Revealed: US listed climate activist group as 'extremists' alongside mass killers,1585988571.0,"04/04/2020, 08:22:51",3,0,157,1.6823334218283321,0.99,0.01910828025477707
271,occupywallstreet,Capitalism By Martin Luther King Jr.,1575661256.0,"12/06/2019, 19:40:56",5,0,159,1.6469629566156527,0.99,0.031446540880503145
272,occupywallstreet,Writer for Tucker Carlson Resigns After ‘Abhorrent’ Online Posts Are Revealed,1594575798.0,"07/12/2020, 17:43:18",7,0,154,6.0463380792002965,0.96,0.045454545454545456
273,occupywallstreet,"Hospitals Got Bailouts and Furloughed Thousands While Paying C.E.O.s Millions: ""Dozens of top recipients of government aid have laid off, furloughed or cut the pay of tens of thousands of employees."" [United States of America]",1591622003.0,"06/08/2020, 13:13:23",3,0,154,1.0310276232803801,0.99,0.01948051948051948
274,occupywallstreet,CNN Journalist’s Arrest Is Another Step on the Path to Authoritarianism,1590859115.0,"05/30/2020, 17:18:35",2,0,156,2.1110592782105186,0.99,0.01282051282051282
275,occupywallstreet,"'Definition of a Rigged System,' Says Sanders Campaign After DNC Changes Debate Rules for Billionaire Latecomer Mike Bloomberg",1580588991.0,"02/01/2020, 20:29:51",5,0,157,2.285307009786692,0.99,0.03184713375796178
276,occupywallstreet,JP Morgan fined almost a billion dollars for hosting a criminal racketeering org that drove up the price of gold and silver for over a decade by flooding the market with orders that were never going to be executed,1601477322.0,"09/30/2020, 14:48:42",8,0,158,2.373316823412239,0.99,0.05063291139240506
277,occupywallstreet,"Facing Progressive Primary Challenger, Ways And Means Chair Richard Neal's Re-Election Is Funded By Big Tobacco, Defense Contractors, Alcohol Producers, And Credit Card Companies",1596286768.0,"08/01/2020, 12:59:28",2,0,158,1.0950940237969462,0.99,0.012658227848101266
278,occupywallstreet,Moms Showed Up To Protect Portland Protesters. The Feds Teargassed Them.,1595257983.0,"07/20/2020, 15:13:03",7,0,159,2.3608491037503256,0.99,0.0440251572327044
279,occupywallstreet,LAPD Officer uses Shield to smash Protestors ankles.,1601170253.0,"09/27/2020, 01:30:53",24,0,155,-0.2857102157688587,1.0,0.15483870967741936
280,occupywallstreet,The Breonna Taylor grand jury decision is criminal,1601054312.0,"09/25/2020, 17:18:32",4,0,152,9.452540966657779,0.94,0.02631578947368421
281,occupywallstreet,"/r/politics: 'I'm Rebecca Parson, a tenants' rights organizer and renter running for Congress (WA-06). My opponent, Derek Kilmer, is chair of the New Democrats &amp; is the 11th most conservative Democrat. I’m endorsed by Brand New Congress, DSA, Our Revolution, &amp; WA Democrats Progressive Caucus. AMA'",1588697063.0,"05/05/2020, 16:44:23",2,0,155,1.9590009482852224,0.99,0.012903225806451613
282,occupywallstreet,Buy Labor Union Made for Thanksgiving,1574863030.0,"11/27/2019, 13:57:10",6,0,154,5.761632522472809,0.96,0.03896103896103896
283,occupywallstreet,Pope Francis denounces 'inhumane detention camps' for migrants in Christmas message,1577292392.0,"12/25/2019, 16:46:32",6,0,152,2.7520667718786456,0.98,0.039473684210526314
284,occupywallstreet,Please Do Not Vote For Elizabeth Warren In Iowa,1580588814.0,"02/01/2020, 20:26:54",16,1,152,9.204878594098659,0.94,0.10526315789473684
285,occupywallstreet,Illegal Loggers in Amazon Kill Indigenous Leader Paulo Paulino Guajajara,1574514612.0,"11/23/2019, 13:10:12",1,0,151,1.6101899994868063,0.99,0.006622516556291391
286,occupywallstreet,"Trump tells Woodward he played down the threat of the coronavirus. ""I wanted to always play it down. I still like playing it down because I don't want to create a panic."" He also tells Woodward that ""plenty of young people"" are vulnerable -- different from his public message",1599681382.0,"09/09/2020, 19:56:22",14,0,152,4.222529821925804,0.97,0.09210526315789473
287,occupywallstreet,Assault on Wall Street,1580517414.0,"02/01/2020, 00:36:54",7,0,151,16.458616187212613,0.9,0.046357615894039736
288,occupywallstreet,Facebook’s Kenosha Guard Militia Event Was Reported 455 Times. Moderators Said It Was Fine.,1598741910.0,"08/29/2020, 22:58:30",8,0,146,3.9652650173527206,0.97,0.0547945205479452
289,occupywallstreet,"Evidence of Police Violence, PR Stunts, and Instigator Collusion During Denver's Peaceful Protest",1592688339.0,"06/20/2020, 21:25:39",5,0,154,3.927449967066309,0.98,0.032467532467532464
290,occupywallstreet,Former Republican refusing to shake hands with a Jewish man,1579222712.0,"01/17/2020, 00:58:32",54,0,150,56.61015272564643,0.73,0.36
291,occupywallstreet,"Andrew Perez: ""The @washingtonpost published an op-ed today slamming Bernie Sanders and Medicare for All that was written by execs at a think tank that gets funding from CVS Health, which owns insurance giant Aetna, and pharmaceutical companies https://t.co/aaHh3jTIJ5""",1579137859.0,"01/16/2020, 01:24:19",1,0,152,1.618517422186386,0.99,0.006578947368421052
292,occupywallstreet,"Televangelists, Dallas megachurch that hosted Pence approved for millions in pandemic aid [United States of America]",1594151386.0,"07/07/2020, 19:49:46",3,0,148,1.9439936071308068,0.99,0.02027027027027027
293,occupywallstreet,"Bernie Sanders: ""Iraq turned out to be the worst foreign policy blunder in the modern history [...] we lost 4,500 brave troops. Hundreds of thousands of Iraqis died. We have spent trillions of dollars on that endless war, money which should go into health care and education and infrastructure""",1579104546.0,"01/15/2020, 16:09:06",5,0,148,1.7139560372614824,0.99,0.033783783783783786
294,occupywallstreet,Bernie has been putting in the time for us since the 1960s. Let's put the time in these next 30 days for landslide wins in the early primaries! Sign up in the comments. 🔥,1578925553.0,"01/13/2020, 14:25:53",2,0,149,8.31888868800769,0.95,0.013422818791946308
295,occupywallstreet,"Bernie Sanders: ""If we get involved in a war in Iran, in all likelihood it will be even worse than the war in Iraq.""",1578441602.0,"01/08/2020, 00:00:02",4,0,152,2.13407319599159,0.99,0.02631578947368421
296,occupywallstreet,"“They got money for the wars but can’t feed the poor.” -Tupac Shakur, 1993",1578413671.0,"01/07/2020, 16:14:31",2,0,150,1.6236204484859798,0.99,0.013333333333333334
297,occupywallstreet,Belarus 2020,1597390236.0,"08/14/2020, 07:30:36",13,0,148,1.4677850075099457,0.99,0.08783783783783784
298,occupywallstreet,DNC members discuss rules change to stop Sanders at convention,1580569561.0,"02/01/2020, 15:06:01",23,0,149,2.393016031057414,0.98,0.15436241610738255
299,occupywallstreet,Liz should just drop out already and let Bernie handle this,1578627351.0,"01/10/2020, 03:35:51",23,0,146,17.964710907966577,0.89,0.15753424657534246
300,occupywallstreet,'A Stopped Rolex Is Right Twice a Day': Bernie Campaign Affirms Billionaire's Warning That President Sanders Is Coming,1578528751.0,"01/09/2020, 00:12:31",20,0,150,2.7973476505064525,0.98,0.13333333333333333
301,occupywallstreet,Ceo's who have been reported on forced labor,1604304582.0,"11/02/2020, 08:09:42",13,0,145,1.516871919758131,0.99,0.0896551724137931
302,occupywallstreet,How Ben Shapiro Pretends Nothing Can Be Done About Systemic Racism,1596906141.0,"08/08/2020, 17:02:21",30,0,145,8.176822033095675,0.95,0.20689655172413793
