,Subreddit,Title,Epoch Time,Date,Comments,Awards,Upvotes,Downvotes,Upvote Ratio,Comment/Upvote Ratio
422,occupywallstreet,Yahoo takes down post about Tara Read saved by Wayback Machine,1585392135.0,"03/28/2020, 10:42:15",39,0,110,8.998513023871212,0.92,0.35454545454545455
423,occupywallstreet,"Trump's 'herd immunity' for COVID-19 will bring ""untold death and suffering"".",1603672628.0,"10/26/2020, 00:37:08",7,0,112,7.225154480079425,0.94,0.0625
424,occupywallstreet,8 Million Have Slipped Into Poverty Since May as Federal Aid Has Dried Up | Poverty has worsened as Republicans continue to oppose Democratic stimulus legislation for being too generous.,1602782602.0,"10/15/2020, 17:23:22",26,0,107,3.631912529801326,0.97,0.24299065420560748
425,occupywallstreet,"With Deutsche Bank's help, an oligarch's buying spree trails ruin across the US heartland",1600806466.0,"09/22/2020, 20:27:46",0,0,109,0.2483387222027318,1.0,0.0
426,occupywallstreet,FBI: The deranged QAnon conspiracy theory poses a potential domestic terrorism threat. Trump:They like me very much.And these are people that love our country.,1597894752.0,"08/20/2020, 03:39:12",9,0,109,2.5540773554844804,0.98,0.08256880733944955
427,occupywallstreet,New @CNN/@DMRegister poll has @BernieSanders in the lead for the first time in Iowa. @BernieSanders 20% | @ewarren 17% | @PeteButtigieg 16% | @JoeBiden 15% | No other candidate breaks 10%,1578702905.0,"01/11/2020, 00:35:05",6,0,107,1.8953086975227507,0.98,0.056074766355140186
428,occupywallstreet,"Trump gains support among millionaires, CNBC survey finds | ""Of millionaires today who have donated to a campaign, the largest number — 39% — have donated to Trump.""",1577112152.0,"12/23/2019, 14:42:32",6,0,112,1.8901646338428435,0.98,0.05357142857142857
429,occupywallstreet,"If You Can’t Have Wealth Taxes, You Don’t Have a Country",1576637286.0,"12/18/2019, 02:48:06",2,0,109,5.486645856432617,0.95,0.01834862385321101
430,occupywallstreet,Global capitalism's breakdown: it now enriches billionaires while 73 poorest countries have record debts (unpayable). Covid worsens capitalism's mess. The system is the problem.,1602866012.0,"10/16/2020, 16:33:32",11,0,104,2.685569934618755,0.97,0.10576923076923077
431,occupywallstreet,"The Whiners Who Earn $200,000 and Complain They’re Broke",1595506553.0,"07/23/2020, 12:15:53",15,0,108,5.745650085013025,0.95,0.1388888888888889
432,occupywallstreet,A Call for Submissions: Capitalism Will Not Heal the Pandemic,1584110390.0,"03/13/2020, 14:39:50",1,0,108,2.317428609612449,0.98,0.009259259259259259
433,occupywallstreet,"Legislator insists Constitution says it’s OK to shoot socialists | At a speech by Trump's former Interior Secretary Ryan Zinke, Montana State Rep. Rodney Garcia suggested imprisoning &amp; killing socialists to stop them from joining the government | 'What did we do with our enemies in war? In Vietnam?'",1580768756.0,"02/03/2020, 22:25:56",12,0,107,-0.2878332577060547,1.0,0.11214953271028037
434,occupywallstreet,"America has spent $6.4 trillion on wars in the Middle East and Asia since 2001, a new study says",1579560132.0,"01/20/2020, 22:42:12",1,0,111,2.3909405592014537,0.98,0.009009009009009009
435,occupywallstreet,"I remember going to NYC for the first time ever in 2010. I went to Wall Street and held up a sign alone that said ""the bankers are the real terrorists"" or something and protested alone for a few hours while I remembered the foreclosed homes in my hometown. The next year was OWS. So it continues.",1573291024.0,"11/09/2019, 09:17:04",1,0,109,0.028747168341183738,1.0,0.009174311926605505
436,occupywallstreet,'The Big Short 2.0': How Hedge Funds Profited Off the Pain of Malls [United States of America],1598269676.0,"08/24/2020, 11:47:56",2,0,103,0.7585183054120819,0.99,0.019417475728155338
437,occupywallstreet,Coronavirus: Germany and France accuse US of taking face masks as international tensions rise,1586688375.0,"04/12/2020, 10:46:15",2,0,107,2.115077150909599,0.98,0.018691588785046728
438,occupywallstreet,#GeneralStrike is trending on Twitter,1585064070.0,"03/24/2020, 15:34:30",6,0,103,2.382496439135977,0.98,0.05825242718446602
439,occupywallstreet,Glenn Greenwald Is Innocent,1579783982.0,"01/23/2020, 12:53:02",14,0,106,2.1128238092083933,0.98,0.1320754716981132
440,occupywallstreet,"A church in California says it paid $50,000 to wipe out more than $5 million in medical debt for 5,555 struggling families in the LA area",1577153571.0,"12/24/2019, 02:12:51",5,0,105,0.9363868257033943,0.99,0.047619047619047616
441,occupywallstreet,Employers require coronavirus liability waivers as conflict mounts over workplace safety,1596383781.0,"08/02/2020, 15:56:21",6,0,107,2.938954891968365,0.97,0.056074766355140186
442,occupywallstreet,"Split societies, global chaos and World War Three: We could be in for the most tumultuous era in modern history -- ""There is the growing realization that humanity is in for an extremely rough ride that could last at least a decade. This sense of uncertainty has been building up for years.""",1595345646.0,"07/21/2020, 15:34:06",10,0,106,9.141832983006466,0.92,0.09433962264150944
443,occupywallstreet,Trump's 'opening the country' council features political donors and supporters: At least 25 individuals have made substantial donations in support of Trump. | 'And the council's healthcare group is represented mainly by pharmaceutical and insurance companies rather than public health professionals.',1587246000.0,"04/18/2020, 21:40:00",8,0,103,1.242220436173227,0.99,0.07766990291262135
444,occupywallstreet,The Pandemic Caused by Privilege and Capitalism. Part 2,1584612232.0,"03/19/2020, 10:03:52",2,0,103,4.884420973398463,0.95,0.019417475728155338
445,occupywallstreet,Still relevant,1578359481.0,"01/07/2020, 01:11:21",0,0,105,1.3443050145271513,0.99,0.0
446,occupywallstreet,"Exclusive: Canada police prepared to shoot Indigenous activists, documents show",1576898600.0,"12/21/2019, 03:23:20",1,0,103,1.00602667201899,0.99,0.009708737864077669
447,occupywallstreet,"""All These Rich People Can't Stop Themselves"": The Luxe Quarantine Lives of Silicon Valley's Elite [United States of America]",1597680753.0,"08/17/2020, 16:12:33",8,0,100,1.5218772740671795,0.99,0.08
448,occupywallstreet,Over 55 Climate Scientists Call BS on Joe Biden's Claim No Scientists Support Bernie Sanders' Climate Plan,1580308122.0,"01/29/2020, 14:28:42",1,0,106,2.0426273070859793,0.98,0.009433962264150943
449,occupywallstreet,"Trump slashed Puerto Rico's Medicaid money as part of budget deal | White House OMB spokesperson Chase Jennings called Trump's cuts to proposed Medicaid budget for Puerto Rico a ""win.""",1576764281.0,"12/19/2019, 14:04:41",3,0,103,1.7445993988570478,0.98,0.02912621359223301
450,occupywallstreet,Are Corporate Democrats losing on purpose — again?,1597618806.0,"08/16/2020, 23:00:06",19,0,104,10.31625644244781,0.91,0.18269230769230768
451,occupywallstreet,"FOX News Hosted Commentator Who Poisoned Stripper Girlfriend | by Manny Otiko | Left of Center | Aug, 2020 | Medium",1596567578.0,"08/04/2020, 18:59:38",2,0,106,2.317271643237717,0.98,0.018867924528301886
452,occupywallstreet,The Black Womxn’s March has shut down north bound traffic for miles on the FDR.,1595901530.0,"07/28/2020, 01:58:50",3,0,103,7.972042553837653,0.93,0.02912621359223301
453,occupywallstreet,Rising authoritarianism in the White House,1583773082.0,"03/09/2020, 16:58:02",1,0,106,3.6914304486758454,0.97,0.009433962264150943
454,occupywallstreet,"When peaceful protesting is ignored by power, violence is inevitable | Our government is designed to take on a parental role, and listening to the needs, wishes, and hardships that constituents face is part of the job description; so why didn’t they listen?",1597704723.0,"08/17/2020, 22:52:03",3,0,104,2.9868948854503543,0.97,0.028846153846153848
455,occupywallstreet,Kushner Stockpile Claim Totally At Odds With Trump’s Record,1586015724.0,"04/04/2020, 15:55:24",4,0,104,1.3541376920296386,0.99,0.038461538461538464
456,occupywallstreet,‘Kill all pensioners to save the American Dream’,1585139789.0,"03/25/2020, 12:36:29",5,0,100,6.745024641422049,0.94,0.05
457,occupywallstreet,Black supporters of Bernie say #NeverPete,1581056411.0,"02/07/2020, 06:20:11",41,0,102,6.507206844480351,0.94,0.4019607843137255
458,occupywallstreet,Iowa and the Farce of American Democracy,1580917458.0,"02/05/2020, 15:44:18",7,0,104,4.487807486133477,0.96,0.0673076923076923
459,occupywallstreet,"Trump's swamp: Robert Destro (who is now Trump's Assistant Secretary of the U.S. State Department for Democracy, Human Rights, and Labor) helped secure the election of George W. Bush during the 2004 election controversy in Ohio.",1572912479.0,"11/05/2019, 00:07:59",5,0,100,1.0520783009283434,0.99,0.05
460,occupywallstreet,"In ‘Hoax,’ CNN Reporter Says FOX News Has Blood on Its Hands | by Manny Otiko | Sep, 2020 | Medium",1601270168.0,"09/28/2020, 05:16:08",9,0,103,3.9867796698623152,0.96,0.08737864077669903
461,occupywallstreet,"Key Support for the Economy May Be About to Buckle: ""Government stimulus programs have helped support spending by lower-income Americans, but the money could soon run out"" [United States of America]",1592919766.0,"06/23/2020, 13:42:46",19,0,102,1.3229193929947485,0.99,0.18627450980392157
462,occupywallstreet,U.S. companies are forcing workers to train their own foreign replacements [United States of America],1577633960.0,"12/29/2019, 15:39:20",4,0,98,2.4734972963982926,0.98,0.04081632653061224
463,occupywallstreet,Major US corporations lay off thousands of workers while dishing out millions to shareholders,1588958284.0,"05/08/2020, 17:18:04",2,0,102,-0.09735849980268085,1.0,0.0196078431372549
464,occupywallstreet,Petition Target Worker COVID19 Emergency Demands,1584682466.0,"03/20/2020, 05:34:26",0,0,99,0.21362254472691689,1.0,0.0
465,occupywallstreet,Joe Rogan accused of racism and misogyny after Bernie tweets his endorsement,1579891922.0,"01/24/2020, 18:52:02",42,0,103,13.782728118598314,0.88,0.4077669902912621
466,occupywallstreet,Victorian State police in Australia to carry AR15s for ‘crowd control’,1577368593.0,"12/26/2019, 13:56:33",93,0,101,3.8234125239082175,0.96,0.9207920792079208
467,occupywallstreet,We Must Redistribute Wealth,1574006489.0,"11/17/2019, 16:01:29",3,0,96,4.248839561641574,0.96,0.03125
468,occupywallstreet,Joe Rogan fans defend his endorsement of Bernie Sanders,1579980254.0,"01/25/2020, 19:24:14",24,0,98,5.1747459417528745,0.95,0.24489795918367346
469,occupywallstreet,Elizabeth Warren supporters perpetuating more lies about Bernie Sanders and his supporters - Twitter thread,1579193155.0,"01/16/2020, 16:45:55",21,0,101,16.15615506699295,0.86,0.2079207920792079
470,occupywallstreet,"Trump's New SNAP Rule Impacts College Students By Limiting Benefits And Adding Confusion | 'Students shouldn't be punished for not being able to find steady employment in today's economy. This rule will disproportionately impact young people, people of color &amp; those who struggle to find employment.'",1576977735.0,"12/22/2019, 01:22:15",8,0,98,4.066728703639754,0.96,0.08163265306122448
471,occupywallstreet,Study: Inequality Robs $2.5 Trillion From U.S. Workers Each Year,1600225411.0,"09/16/2020, 03:03:31",1,0,97,3.2395948845555864,0.97,0.010309278350515464
472,occupywallstreet,Police Union Scrutiny Could Soon Move Into Finance,1595861741.0,"07/27/2020, 14:55:41",1,0,97,1.9851742286470113,0.98,0.010309278350515464
473,occupywallstreet,The US is apparently providing 'limited' support for the Taliban against ISIS,1586600350.0,"04/11/2020, 10:19:10",7,0,100,3.3720359225852405,0.97,0.07
474,occupywallstreet,The strike at McDonald’s is about more than fighting abuse — it’s about workplace democracy,1574102560.0,"11/18/2019, 18:42:40",1,0,97,2.214877407506137,0.98,0.010309278350515464
475,occupywallstreet,"After boost from Perry, backers got huge gas deal in Ukraine | Two GOP donors with close ties to Trump's Secretary of Energy and former Texas Governor Rick Perry, Michael Bleyzer (who also has ties to Rudy Giuliani) and Alex Cranberg, ""secured a potentially lucrative"" deal after support from Perry.",1573959301.0,"11/17/2019, 02:55:01",4,0,100,1.7653640329619122,0.98,0.04
476,occupywallstreet,"Today in the Old Bailey I watched the grim farce of the US/UK attempt to extradite Julian Assange. The bullying prosecutor is reduced to insulting the integrity of expert witnesses. Trapped behind glass, Julian is denied free access to his barrister. This is Britain's shame.",1600109652.0,"09/14/2020, 18:54:12",9,0,101,10.525501464219715,0.91,0.0891089108910891
477,occupywallstreet,"Who Is Funding Richard Neal’s Re-Election Campaign? Big Tobacco, Defense Contractors, Alcohol Producers, Credit Card Companies | NewBostonPost",1598536652.0,"08/27/2020, 13:57:32",1,0,100,1.4942487119984804,0.99,0.01
478,occupywallstreet,"Kanye’s An Idiot. The GOP Found Him Useful | by Manny Otiko | Aug, 2020 | Medium",1596938415.0,"08/09/2020, 02:00:15",12,0,97,5.487698803767628,0.95,0.12371134020618557
479,occupywallstreet,Buffalo Cop Aaron Torgalski Pushes Elderly Man who then bleeds from head,1591351572.0,"06/05/2020, 10:06:12",9,0,99,-0.1293533546854917,1.0,0.09090909090909091
480,occupywallstreet,The world is on lockdown. So where are all the carbon emissions coming from?,1589795863.0,"05/18/2020, 09:57:43",11,0,97,4.529348954066151,0.96,0.1134020618556701
481,occupywallstreet,Anti-Shutdown Protests Were Charlottesville 2.0 - Manny Otiko - Medium,1587654734.0,"04/23/2020, 15:12:14",6,0,93,6.313093884869559,0.94,0.06451612903225806
482,occupywallstreet,Organized Capitalists vs Organized Labor,1576034122.0,"12/11/2019, 03:15:22",1,0,97,2.349883117758793,0.98,0.010309278350515464
483,occupywallstreet,Rochester AFL-CIO Calls for General Strike if Trump Steals Election,1602714890.0,"10/14/2020, 22:34:50",1,0,97,2.3664731370908214,0.98,0.010309278350515464
484,occupywallstreet,The War On Drugs Is Institutional Entrapment!,1593109534.0,"06/25/2020, 18:25:34",3,0,95,1.2695662026959553,0.99,0.031578947368421054
485,occupywallstreet,"6,000 Black Lives Matter Protestors take a knee for George Floyd at step...",1592150106.0,"06/14/2020, 15:55:06",0,0,100,5.790451840367126,0.95,0.0
486,occupywallstreet,Joe Rogan begins the pivot from Bernie/Tulsi to Trump because Biden is the likely nominee.,1586036885.0,"04/04/2020, 21:48:05",143,0,96,17.053234561838224,0.85,1.4895833333333333
487,occupywallstreet,The worst person you know just made a great point.,1579305084.0,"01/17/2020, 23:51:24",10,0,97,16.665238645708854,0.85,0.10309278350515463
488,occupywallstreet,This is how Mitch McConnell falls,1600823719.0,"09/23/2020, 01:15:19",11,1,96,5.169471179122894,0.95,0.11458333333333333
489,occupywallstreet,Humanity Has Killed 83% of All Wild Mammals and Half of All Plants,1579727156.0,"01/22/2020, 21:05:56",6,0,94,3.852700226645439,0.96,0.06382978723404255
490,occupywallstreet,"What We Know About Wolverine Watchmen Accused of Terror, Kidnap Plot Against Michigan Gov. Gretchen Whitmer",1602206647.0,"10/09/2020, 01:24:07",39,0,92,3.7129985044555696,0.96,0.42391304347826086
491,occupywallstreet,"CNN Moderators, Alarmed by Cost of Medicare for All, Ignore Price Tag of Endless War - ""None of the candidates who said they support keeping troops in Iraq were asked how they were going to pay for it.""",1579101645.0,"01/15/2020, 15:20:45",2,0,91,1.8419452295428016,0.98,0.02197802197802198
492,occupywallstreet,CNN’s Sanders Hit Piece Doesn’t Pass the Smell Test,1578963900.0,"01/14/2020, 01:05:00",2,0,94,2.5140714043695596,0.97,0.02127659574468085
493,occupywallstreet,ICE Detention Center Captain Was on a Neo-Nazi Website and Wanted to Start a White Nationalist Group,1578427187.0,"01/07/2020, 19:59:47",5,0,95,-0.06463367618097493,1.0,0.05263157894736842
494,occupywallstreet,Don't Be Evil: How Big Tech Betrayed Its Founding Principles--And All of US,1577803332.0,"12/31/2019, 14:42:12",4,0,94,0.8955216914368407,0.99,0.0425531914893617
495,occupywallstreet,AOC: I’m tired of this idea that MedicareForAll and tuition free public colleges are some hand out from somebody else. Nobody else is giving us a damn thing. We build this on our own.,1576066438.0,"12/11/2019, 12:13:58",0,0,94,3.32086372522177,0.97,0.0
496,occupywallstreet,Welcome to . . .,1601527992.0,"10/01/2020, 04:53:12",17,0,92,6.8569301496156925,0.93,0.18478260869565216
497,occupywallstreet,Interview: More people are thinking about socialism,1590171502.0,"05/22/2020, 18:18:22",1,0,91,2.642339261598721,0.97,0.01098901098901099
498,occupywallstreet,Georgia candidates embrace group with extremist ties,1589666657.0,"05/16/2020, 22:04:17",11,0,94,2.1174036432371537,0.98,0.11702127659574468
499,occupywallstreet,UFC fighter Kevin Lee endorses Bernie Sanders for president.,1577061587.0,"12/23/2019, 00:39:47",1,0,95,7.536718204764057,0.93,0.010526315789473684
500,occupywallstreet,"Split shifts, unpredictable hours. A retail worker’s life.",1574802492.0,"11/26/2019, 21:08:12",0,0,97,0.9570421167916834,0.99,0.0
501,occupywallstreet,Trump has openly threatened to block federal aid to California three times as wildfires have ravaged the state,1573182302.0,"11/08/2019, 03:05:02",9,0,93,2.326966696487389,0.98,0.0967741935483871
502,occupywallstreet,"Political Parties are literal corporations that we vote for, and the DNC is owned by a company called the DNC Services Corporation.",1598953894.0,"09/01/2020, 09:51:34",10,0,90,18.949067951312742,0.83,0.1111111111111111
503,occupywallstreet,"When you try distancing the NYPD from George Floyd's murder, but forget about Eric Garner",1591820030.0,"06/10/2020, 20:13:50",3,0,91,1.29773751927587,0.99,0.03296703296703297
504,occupywallstreet,"Bernie Sanders: Trump has been attacking our campaign because he's getting nervous. Poll after poll shows that we are the strongest campaign to beat him, even in so-called ""red"" states like Texas. Together, we'll sweep him and all he stands for out of office.",1580479826.0,"01/31/2020, 14:10:26",2,0,89,2.2954480726661473,0.97,0.02247191011235955
505,occupywallstreet,"Bernie: ""I've got seven grandchildren, I've got four great kids - And I think we have a moral responsibility to make sure that the country and the planet we leave our kids and our grandchildren is a planet that is healthy and is habitable. I cannot think of anything more important than that.""",1580166357.0,"01/27/2020, 23:05:57",0,0,89,3.0779032880985966,0.97,0.0
506,occupywallstreet,"🚨🚨 NEW #IOWAPOLL 🚨🚨🚨Sanders: 20% (+5) Warren: 17% (+1) Buttigieg: 16% (-9) Biden: 15% (-) Klobuchar: 6% (-) Yang: 5% (+2) Booker:3% (-) Steyer:2% (-1) Gabbard:2% (-1) Bloomberg:1% (-1) Not sure: 11% (+6)Bernie Sanders leads the Iowa Poll for the first time, just weeks before the Iowa caucuses.",1578757668.0,"01/11/2020, 15:47:48",4,0,91,4.402688242709573,0.95,0.04395604395604396
507,occupywallstreet,One year of French police protecting their citizens ❤️,1575712685.0,"12/07/2019, 09:58:05",2,0,92,2.381049367439047,0.97,0.021739130434782608
508,occupywallstreet,"Fauci admits administration has restricted his media appearances, says he's not surprised Trump got COVID",1603073598.0,"10/19/2020, 02:13:18",1,0,92,0.7059446974914323,0.99,0.010869565217391304
509,occupywallstreet,"""The mainstream media doesn't talk about it. Congress doesn't talk about it. Trump doesn't talk about it. But three multi-billionaires now own more wealth than the bottom half of our society. That level of inequality is immoral and unsustainable."" - Bernie Sanders on Twitter",1598997371.0,"09/01/2020, 21:56:11",2,0,92,-0.10886601241338667,1.0,0.021739130434782608
510,occupywallstreet,Corporate America is conducting full scale assault on First Amendment!,1585783132.0,"04/01/2020, 23:18:52",10,0,87,6.082309773482294,0.93,0.11494252873563218
511,occupywallstreet,"Russia is a White Nationalist Country — Naturally, Tucker Carlson Loves It",1574968708.0,"11/28/2019, 19:18:28",14,0,92,14.057976219795961,0.87,0.15217391304347827
512,occupywallstreet,"A police killing in Philadelphia, a cry for justice everywhere",1604067496.0,"10/30/2020, 14:18:16",5,0,91,4.912363129719779,0.95,0.054945054945054944
513,occupywallstreet,Apple gave the FBI access to the iCloud account of a protester accused of setting police cars on fire,1600328137.0,"09/17/2020, 07:35:37",2,0,91,1.1878358254945312,0.99,0.02197802197802198
514,occupywallstreet,Anti-Union Operative Warns Business of Rise in Labor Activism,1588608439.0,"05/04/2020, 16:07:19",3,0,87,2.1936309398735148,0.98,0.034482758620689655
515,occupywallstreet,"Trump supporters want to imprison Speaker of the House Nancy Pelosi and most of the Democratic Party: ""90% of the communist democrats should be locked for treason they are a criminal organization determined to destroy the USA.""",1573474361.0,"11/11/2019, 12:12:41",17,0,87,14.138802122556015,0.86,0.19540229885057472
516,occupywallstreet,The Mofo In Chief Knew,1599730462.0,"09/10/2020, 09:34:22",4,0,89,7.637803666926374,0.92,0.0449438202247191
517,occupywallstreet,"Trump Knows Harris Birther Smear is a Lie, But His Cultists Will Believe It | by Manny Otiko | Aug, 2020 | Medium",1597531989.0,"08/15/2020, 22:53:09",32,0,86,7.703832627270543,0.92,0.37209302325581395
518,occupywallstreet,Medicare For All is downright revolutionary economic AMERICAN FREEDOM,1596742680.0,"08/06/2020, 19:38:00",5,0,92,3.102502896166996,0.97,0.05434782608695652
519,occupywallstreet,"Fundamentalists Lost Culture War in U.S., So They Outsourced it to Africa",1592673093.0,"06/20/2020, 17:11:33",2,0,91,3.3299824156279527,0.96,0.02197802197802198
520,occupywallstreet,"What is private equity, and why is it killing everything you love?",1578483012.0,"01/08/2020, 11:30:12",2,0,87,2.41734845451397,0.97,0.022988505747126436
521,occupywallstreet,"Conservatives: Minorities, poor people, labor unions, critics of the insurance industry, and indebted students are fake victims and they don't deserve help from the government.",1599071620.0,"09/02/2020, 18:33:40",11,0,89,4.893329547105424,0.95,0.12359550561797752
522,occupywallstreet,Covid-19 Isn't Killing Cash. People Are Hoarding More of It,1593799213.0,"07/03/2020, 18:00:13",2,0,87,1.9538870384602092,0.98,0.022988505747126436
523,occupywallstreet,Austria Has 90% Drop in Coronavirus Cases After Requiring People to Wear Face Masks,1588703876.0,"05/05/2020, 18:37:56",2,0,92,2.6115745308775473,0.97,0.021739130434782608
524,occupywallstreet,"Americans Want Jobs, Not War",1578340356.0,"01/06/2020, 19:52:36",7,0,89,2.0326959430106797,0.98,0.07865168539325842
525,occupywallstreet,"'Code for Massive Cuts': Audio Shows GOP Senator Joni Ernst Telling Donors She Wants 'Changes' to Medicare, Medicaid | Iowa Democratic Senate candidate Kimberly Graham: ""We barely invest in the health and well-being of our people as it is, and Joni Ernst thinks even that is too much.""",1581942946.0,"02/17/2020, 12:35:46",1,0,87,2.9200989834969135,0.97,0.011494252873563218
526,occupywallstreet,Traders openly admit to cashing in on conflict,1579700280.0,"01/22/2020, 13:38:00",5,0,89,2.5999795108269836,0.97,0.056179775280898875
527,occupywallstreet,Barbara Walter Was Done With Trump Bullshit in 1990,1595532845.0,"07/23/2020, 19:34:05",7,0,89,5.894482786840854,0.94,0.07865168539325842
528,occupywallstreet,"How trump Plans to Spin 200,000 Coronavirus Deaths...",1585756234.0,"04/01/2020, 15:50:34",1,0,88,6.802127474188637,0.93,0.011363636363636364
529,occupywallstreet,Unions can revive the American Dream,1600523856.0,"09/19/2020, 13:57:36",5,0,83,3.0887967633519224,0.96,0.060240963855421686
530,occupywallstreet,Debate Audience Rigged For Bloomberg | Jimmy Dore Show | 15:47,1582820574.0,"02/27/2020, 16:22:54",1,0,83,4.166958598092123,0.95,0.012048192771084338
531,occupywallstreet,Unify the oppressed by organizing incarcerated workers,1581346046.0,"02/10/2020, 14:47:26",2,0,89,0.12155902391208429,1.0,0.02247191011235955
532,occupywallstreet,"Republican North Carolina State Representative Larry Pittman has repeatedly compared Abraham Lincoln to Hitler, defended the Confederate States, and claimed that ""so many"" mass shooters were ""communist democrats"" in response to right-wing fake news shortly after the Parkland school shooting.",1581130331.0,"02/08/2020, 02:52:11",10,0,86,3.110193314430248,0.97,0.11627906976744186
533,occupywallstreet,"Walmart dodged US tax on $2 billion by routing cash through multiple countries, whistleblower says",1575310099.0,"12/02/2019, 18:08:19",2,0,83,1.5714695598090174,0.98,0.024096385542168676
534,occupywallstreet,"Harvard Economics Professor Greg Mankiw just called people fighting to correct economic inequality ""Occutards"" on his blog.",1593600160.0,"07/01/2020, 10:42:40",25,0,85,2.7395437397722304,0.97,0.29411764705882354
535,occupywallstreet,"""We’ll be cutting"": Trump promises to slash spending on entitlements (programs such as Medicare, Medicaid, and Social Security) during Fox News town hall",1583525252.0,"03/06/2020, 20:07:32",35,0,86,1.1678984168657962,0.99,0.4069767441860465
536,occupywallstreet,Enviro nonprofit would rather lay off all staff than deal with union,1596608656.0,"08/05/2020, 06:24:16",3,0,85,2.1667807489544515,0.98,0.03529411764705882
537,occupywallstreet,Donald Trump’s TERRIBLE record,1588773917.0,"05/06/2020, 14:05:17",43,0,83,11.54977798737633,0.88,0.5180722891566265
538,occupywallstreet,"Powerful GOP allies propel Trump effort to reopen economy | ""The push to revive the economy is being influenced and amplified by a potent alliance of big money business interests, religious freedom conservatives and small-government activists, some with direct dial to Trump.""",1587405271.0,"04/20/2020, 17:54:31",9,0,86,4.06856503523602,0.95,0.10465116279069768
