,Subreddit,Title,Epoch Time,Date,Comments,Awards,Upvotes,Downvotes,Upvote Ratio,Comment/Upvote Ratio
662,occupywallstreet,"Sanders, Lee, and Tlaib Partner to Combat Outrageous CEO Pay | Bernie Sanders, Barbara Lee, and Rashida Tlaib have introduced the Tax Excessive CEO Pay Act",1573736272.0,"11/14/2019, 12:57:52",1,0,52,3.1245742699037535,0.94,0.019230769230769232
663,occupywallstreet,"When Uber, Lyft, Doordash, Instacart, and Postmates have contributed over $180m on getting a ballot initiative passed, there is definitely something fishy going on...",1601594931.0,"10/01/2020, 23:28:51",0,0,57,0.34010490929156134,0.99,0.0
664,occupywallstreet,"Could The Politician's #Calexit Fantasy Bring Real Change? -- ""The Golden State Should Write a Fairer, More Equal American Constitution for the 21st Century"" [United States of America]",1594469504.0,"07/11/2020, 12:11:44",2,0,55,13.524572134595758,0.8,0.03636363636363636
665,occupywallstreet,"With climate discontent rising, scientists warn of social 'tipping point' - Reuters",1575933646.0,"12/09/2019, 23:20:46",1,0,54,3.7159688929354857,0.94,0.018518518518518517
666,occupywallstreet,Elizabeth Warren Isn’t Serious About Winning Medicare for All,1575825955.0,"12/08/2019, 17:25:55",10,0,52,10.75998163405145,0.83,0.19230769230769232
667,occupywallstreet,Bloomberg Spent His Entire Career Flattering Wall Street. | Now he wants you to believe he’d get tough on his best friends.,1583006771.0,"02/29/2020, 20:06:11",1,0,52,2.242731205419588,0.96,0.019230769230769232
668,occupywallstreet,Bernie Sanders responds to Trump's State of the Union,1580874307.0,"02/05/2020, 03:45:07",1,0,53,4.647568978259429,0.92,0.018867924528301886
669,occupywallstreet,"Bernie: ""The big money interests can run all the negative ads they want. It's not going to work. Our grassroots movement is stronger.""",1580345923.0,"01/30/2020, 00:58:43",1,0,55,4.321458831068995,0.93,0.01818181818181818
670,occupywallstreet,"The Landscape of Modern Money: a video guide to the fiat money system, the banking sector's role within it and the war on cash",1594645668.0,"07/13/2020, 13:07:48",0,0,52,3.795089784945546,0.93,0.0
671,occupywallstreet,Millionaire Trump Adviser Larry Kudlow Complains That $600-Per-Week Boost in Unemployment Benefits During the Pandemic Is Too Generous,1592270762.0,"06/16/2020, 01:26:02",8,0,52,3.331506707566767,0.94,0.15384615384615385
672,occupywallstreet,Police Respond to Protests With More Excessive Force,1590967496.0,"05/31/2020, 23:24:56",0,0,50,4.431696053929464,0.92,0.0
673,occupywallstreet,Pete Buttigieg Funded by Russian-Linked Oligarch Who Supports Trump and McConnell - Share this with your Pete-supporting acquaintances!,1581190723.0,"02/08/2020, 19:38:43",4,0,56,6.289169397440197,0.9,0.07142857142857142
674,occupywallstreet,Bernie Could Be America’s First Feminist President,1576685736.0,"12/18/2019, 16:15:36",3,0,55,4.014447782608457,0.93,0.05454545454545454
675,occupywallstreet,Trump Tells Allies He Wants Absolved War Criminals to Campaign for Him,1574877162.0,"11/27/2019, 17:52:42",6,0,56,1.4244009358998042,0.98,0.10714285714285714
676,occupywallstreet,Cultural Marxism Is a Far Right Conspiracy Theory,1599889806.0,"09/12/2020, 05:50:06",6,0,51,3.315239308906243,0.94,0.11764705882352941
677,occupywallstreet,10 Surprising People Who Advocated Socialism,1584588371.0,"03/19/2020, 03:26:11",1,0,51,1.6437937846632593,0.97,0.0196078431372549
678,occupywallstreet,Fuck the DNC,1580606966.0,"02/02/2020, 01:29:26",0,0,51,3.5730509455862745,0.93,0.0
679,occupywallstreet,Trump official [Frank Wuco] who suggested dropping nuclear bombs on Afghanistan now responsible for arms control issues,1574884173.0,"11/27/2019, 19:49:33",1,0,55,2.3879462102294724,0.96,0.01818181818181818
680,occupywallstreet,Look at how incredibly easy it is to defund the public sector when it’s not the cops. Poof! Just like that.,1602351277.0,"10/10/2020, 17:34:37",1,0,51,1.3207158394980993,0.97,0.0196078431372549
681,occupywallstreet,"‘Ellen’ Crew Furious Over Poor Communication Regarding Pay, Non-Union Workers During Coronavirus Shutdown",1587145033.0,"04/17/2020, 17:37:13",4,0,50,2.470375599887582,0.95,0.08
682,occupywallstreet,"If your #job is considered ""#essential"" during this #pandemic and you must work, firstly thank you for what you're doing, also I believe then your position deserves a #livingwage/raise and health benefits along with hazard pay. If corporate says no, then #unionize.",1585025266.0,"03/24/2020, 04:47:46",0,0,53,4.94501824675055,0.91,0.0
683,occupywallstreet,Mnuchin Admits Trump's Budget Cuts Social Security Even as President Claims He Is 'Not Touching' the Program,1581605105.0,"02/13/2020, 14:45:05",1,0,54,0.8349722111595455,0.98,0.018518518518518517
684,occupywallstreet,How an Anti-Sexist Candidate Got Smeared as Sexist,1579310626.0,"01/18/2020, 01:23:46",1,0,53,6.238707259239071,0.89,0.018867924528301886
685,occupywallstreet,‘Yikes’ — wage growth called ‘incredibly disappointing’ in jobs report,1578692683.0,"01/10/2020, 21:44:43",1,0,51,3.050201694387347,0.94,0.0196078431372549
686,occupywallstreet,Hempire Direct Demands Their Workers to Vote for Trump,1577428621.0,"12/27/2019, 06:37:01",2,0,49,2.2609524242843264,0.96,0.04081632653061224
687,occupywallstreet,Is a Billionaire more rich than a Millionaire?,1573254996.0,"11/08/2019, 23:16:36",1,0,48,2.074310811086285,0.96,0.020833333333333332
688,occupywallstreet,America's Fascists Do The Astroturf,1599157328.0,"09/03/2020, 18:22:08",1,0,51,3.25767197624954,0.94,0.0196078431372549
689,occupywallstreet,"If Trump Gets A Second Term, He’ll Bomb An American City | by Manny Otiko | Aug, 2020 | Medium",1597373219.0,"08/14/2020, 02:46:59",1,0,48,8.092207142891723,0.86,0.020833333333333332
690,occupywallstreet,Health and business concerns clash in debate over COVID-19 liability,1595601199.0,"07/24/2020, 14:33:19",4,0,52,1.9099132086960822,0.96,0.07692307692307693
691,occupywallstreet,Occupying NYC city hall to defund the NYPD,1592995281.0,"06/24/2020, 10:41:21",1,0,52,1.4654711396494662,0.97,0.019230769230769232
692,occupywallstreet,I’ve never felt less safe as an American Citizen.,1590916296.0,"05/31/2020, 09:11:36",0,0,46,3.151163963078062,0.94,0.0
693,occupywallstreet,Capitalism is killing us. The wealthy elite have made it clear they’d let millions of us succumb to a pandemic if it means the $$$ keeps flowing. It’s time to strike. It’s time for mass action. We MUST fight back.,1585350111.0,"03/27/2020, 23:01:51",1,0,49,2.275430685758863,0.96,0.02040816326530612
694,occupywallstreet,Say goodbye to the Klobuchar campaign,1583178465.0,"03/02/2020, 19:47:45",2,0,51,13.716196579395032,0.79,0.0392156862745098
695,occupywallstreet,"Exclusive: State Department cable reveals new Trump policy expanding landmine use | ""Under Trump’s new policy, the US military can now use landmines anywhere, including in “future potential conflicts,” according to the cable.""",1580404587.0,"01/30/2020, 17:16:27",6,0,53,1.3008221969429457,0.98,0.11320754716981132
696,occupywallstreet,"New Ad Campaign Ties Biden to 'Heartless' GOP Efforts to Cut Social Security ""Why did Joe Biden join Republicans to attack benefits for seniors?""",1579783655.0,"01/23/2020, 12:47:35",3,0,51,5.436182827112951,0.9,0.058823529411764705
697,occupywallstreet,"If There is Money for War, There is Money for Healthcare",1579223872.0,"01/17/2020, 01:17:52",0,0,46,4.79762646092847,0.91,0.0
698,occupywallstreet,Gay people I do NOT respect.,1578783783.0,"01/11/2020, 23:03:03",3,0,50,11.58794937194947,0.81,0.06
699,occupywallstreet,"How to win in 2020: “To the left, march.”",1576010133.0,"12/10/2019, 20:35:33",1,0,49,2.379444053456403,0.95,0.02040816326530612
700,occupywallstreet,"WH COVID-19 Outbreak Follows Traits of Trumpism | by Manny Otiko | Oct, 2020 | Medium",1601902801.0,"10/05/2020, 13:00:01",1,0,50,1.3115711575432272,0.97,0.02
701,occupywallstreet,Prison and police abolition: Reimagining public safety and liberation,1593094696.0,"06/25/2020, 14:18:16",0,0,45,4.646420360287955,0.91,0.0
702,occupywallstreet,"In Trump's 'LIBERATE' tweets, extremists see a call to arms: Trump's tweets pushed many online extremist communities to speculate whether the president was advocating for armed conflict | ""On pro-Trump message boards ... Trump’s tweets delivered a clear message: get ready for the civil war.""",1587164986.0,"04/17/2020, 23:09:46",15,0,47,3.9085702017852384,0.92,0.3191489361702128
703,occupywallstreet,Trump Doing Putin’s Bidding By Destroying U.S. From Within,1586015761.0,"04/04/2020, 15:56:01",5,0,50,11.37661121345672,0.81,0.1
704,occupywallstreet,Democratic National Committee chair Tom Perez issued a list of individuals he nominated for the 2020 Democratic National Convention committees. Let's examine some of the individuals. | Tom Perez is promoting right-wing Democrats to the leadership of the DNC.,1580081673.0,"01/26/2020, 23:34:33",0,0,51,0.31325226461174793,0.99,0.0
705,occupywallstreet,"In 'Mind-Blowing Omission,' Mayor Pete Buttigieg Failed to Disclose Wall Street Power Brokers in Release of Major Presidential Fundraisers",1576771103.0,"12/19/2019, 15:58:23",1,0,51,4.934239835245656,0.91,0.0196078431372549
706,occupywallstreet,"Game theory entails that for cooperation to evolve, when bad actors hit people, other people *must* hit them back at least as hard for the bad actors to learn that evil is not acceptable behavior. Otherwise, evil and dysfunction win by default. This is what has happened to America.",1599819175.0,"09/11/2020, 10:12:55",5,0,49,3.550367228116208,0.93,0.10204081632653061
707,occupywallstreet,Trans men are men. Pass it on.,1597509011.0,"08/15/2020, 16:30:11",1,0,46,18.41037521502298,0.71,0.021739130434782608
708,occupywallstreet,Coronavirus leads to class warfare in Hamptons,1585655072.0,"03/31/2020, 11:44:32",7,0,48,1.9299767203331513,0.96,0.14583333333333334
709,occupywallstreet,Amazon workers plan strike at Staten Island warehouse to demand coronavirus protections,1585529172.0,"03/30/2020, 00:46:12",3,0,45,1.8219334440881667,0.96,0.06666666666666667
710,occupywallstreet,Trump to remove climate change factors from environmental laws around major infrastructure projects,1578585069.0,"01/09/2020, 15:51:09",0,0,47,1.5486802306970304,0.97,0.0
711,occupywallstreet,The decade of the billionaire victim--how the Great Recession led not to an economic overhaul but to record-breaking inequality,1577462427.0,"12/27/2019, 16:00:27",3,0,50,1.9265568327946099,0.96,0.06
712,occupywallstreet,"Trump's swamp: Vice President Pence's Chief of Staff Marc Short was the president of a Koch Brothers front group (Freedom Partners) for five years (Likewise, Trump's Chief of Staff Mick Mulvaney has Koch ties). Marc Short was also the campaign finance director for Iran-Contra figure Oliver North.",1577203321.0,"12/24/2019, 16:02:01",0,0,44,2.1376660428449483,0.95,0.0
713,occupywallstreet,Packed house for Bernie tonight in Las Vegas,1577033037.0,"12/22/2019, 16:43:57",0,0,44,4.399152651416458,0.91,0.0
714,occupywallstreet,When Falling Behind on Rent Leads to Jail Time,1603726974.0,"10/26/2020, 15:42:54",0,0,46,0.7607320076020514,0.98,0.0
715,occupywallstreet,Voters For Trump Ad - SNL,1600057943.0,"09/14/2020, 04:32:23",2,0,43,7.752337603292787,0.85,0.046511627906976744
716,occupywallstreet,"I've seriously tried to believe capitalism and the planet can coexist, but I've lost faith",1583090090.0,"03/01/2020, 19:14:50",2,0,49,2.54486435776942,0.95,0.04081632653061224
717,occupywallstreet,"The degree to which Michael Bloomberg is using his fortune to fundamentally alter &amp; manipulate U.S. politics to his personal advantage extends way beyond ads. I've worked against him, covered him as a journalist &amp; worked with his top aides. Here’s their playbook: (1/17)",1581681486.0,"02/14/2020, 11:58:06",0,0,48,0.8313892616310312,0.98,0.0
718,occupywallstreet,Fox News poll finds a wealth tax is far more popular than Trump's wall,1576559813.0,"12/17/2019, 05:16:53",1,0,45,2.363534630639357,0.95,0.022222222222222223
719,occupywallstreet,"I'm sure that many of you are familiar with the American Legislative Exchange Council (ALEC), but for those of you that aren't, our team made some graphics summing up how it works and affects policy",1600663067.0,"09/21/2020, 04:37:47",0,0,46,2.8904806299610044,0.94,0.0
720,occupywallstreet,Man defends legacy of Che Guevara,1598124865.0,"08/22/2020, 19:34:25",4,0,45,6.8218516605828015,0.87,0.08888888888888889
721,occupywallstreet,“A forthright stand”: Communists in the struggle for Black lives,1597094293.0,"08/10/2020, 21:18:13",1,0,47,3.0203372519702683,0.94,0.02127659574468085
722,occupywallstreet,"America, Inc.",1593645058.0,"07/01/2020, 23:10:58",0,0,44,2.1480185588594907,0.95,0.0
723,occupywallstreet,Trump is the Frankenstein’s Monster That Ate The Republican Party,1590441649.0,"05/25/2020, 21:20:49",4,0,45,6.702717034531652,0.87,0.08888888888888889
724,occupywallstreet,Minimum wage increases aren't a job killer: Small business survey,1582327192.0,"02/21/2020, 23:19:52",1,0,43,2.373041942483475,0.95,0.023255813953488372
725,occupywallstreet,Nightmare on Wall Street,1580306538.0,"01/29/2020, 14:02:18",1,0,47,4.846379114708917,0.91,0.02127659574468085
726,occupywallstreet,What we really are...,1602201056.0,"10/08/2020, 23:50:56",1,0,44,4.373008371271425,0.91,0.022727272727272728
727,occupywallstreet,Hurry! Potus is sick,1601815229.0,"10/04/2020, 12:40:29",1,0,48,12.419766175484689,0.79,0.020833333333333332
728,occupywallstreet,Endless sea of protesters at George Floyd BlackLivesMatter Protest in NYC,1591105300.0,"06/02/2020, 13:41:40",1,0,45,1.5215762185590265,0.97,0.022222222222222223
729,occupywallstreet,"A 'Jubilee' Cancellation of Debt is Vital to Fighting the Coronavirus: Debt forgiveness for developing nations would 'free up resources to tackle urgent health, social and economic crises'",1586782778.0,"04/13/2020, 12:59:38",6,0,44,1.7823391800368356,0.96,0.13636363636363635
730,occupywallstreet,White House Seeks To Lower Farmworker Pay To Help Agriculture Industry | 'White House Chief of Staff Mark Meadows is working with Agriculture Secretary Sonny Perdue to reduce wages for foreign guest workers on American farms. Opponents argue it will hurt vulnerable workers &amp; depress domestic wages.',1586705011.0,"04/12/2020, 15:23:31",5,0,43,0.5943988442816845,0.99,0.11627906976744186
731,occupywallstreet,Starbucks worker says he was fired for union organizing and 'to create fear' |,1583092610.0,"03/01/2020, 19:56:50",0,0,43,3.5724835898091882,0.92,0.0
732,occupywallstreet,"""Good Ol' Boys Roundup"": White supremacist events organized by federal ATF agents in the 1980s and 1990s that featured racist exhibitions such as a ""n***** checkpoint area,"" ""n***** hunting licenses,"" &amp; t-shirts ""sold showing Martin Luther King Jr.'s face in sniper crosshairs.""",1579538805.0,"01/20/2020, 16:46:45",1,0,43,2.584724744559651,0.94,0.023255813953488372
733,occupywallstreet,Does Forgetting The First Amendment Even Matter? Do The Bill Of Rights Still Apply Anyway?,1604169816.0,"10/31/2020, 18:43:36",18,0,44,4.562058491687878,0.91,0.4090909090909091
734,occupywallstreet,International Notes: Mobilization against Israel’s annexation plan,1590675499.0,"05/28/2020, 14:18:19",0,0,42,4.0805831407433715,0.91,0.0
735,occupywallstreet,"Beyond Doubt History teaches us that a country without the rule of law or a respect for the truth, is not a Democracy.",1589928390.0,"05/19/2020, 22:46:30",2,0,42,6.35260455611369,0.87,0.047619047619047616
736,occupywallstreet,genstrike.org make viral pass it on,1585520023.0,"03/29/2020, 22:13:43",0,0,45,0.27989405551088,0.99,0.0
737,occupywallstreet,The MLK Quotes They Don’t Want Us To See,1580383164.0,"01/30/2020, 11:19:24",0,0,43,2.2946279023358898,0.95,0.0
738,occupywallstreet,"Climate Change Could Intensify Amazon Forest Fires, Turning It From a Carbon Sink to Source, Scientists Warn",1579441673.0,"01/19/2020, 13:47:53",1,0,47,3.838514364263986,0.92,0.02127659574468085
739,occupywallstreet,Rochester AFL-CIO Calls for General Strike If Trump Won’t Accept Election Results,1602771316.0,"10/15/2020, 14:15:16",0,0,41,0.42048163333949873,0.99,0.0
740,occupywallstreet,'Vote Him Out!': Protesters Boo Trump During Visit To Ruth Bader Ginsbur...,1600965890.0,"09/24/2020, 16:44:50",0,0,42,2.479468823909798,0.94,0.0
741,occupywallstreet,"Trump Labor Department (headed by corporate lawyer and lobbyist Eugene Scalia) Accused of Quietly 'Twisting the Law' to Slash Paid Sick Leave Amid Pandemic: ""The Trump administration is robbing workers of the paid sick days and paid leave Congress passed into law for them. That is unconscionable.""",1585867560.0,"04/02/2020, 22:46:00",0,0,42,-0.17312241422280295,1.0,0.0
742,occupywallstreet,"""One of the 79 accounts that @ShadowIncHQ follows is the dark money group that launched attack ads on Bernie last week."" @ShadowIncHQ built the Iowa Caucus app.",1580848962.0,"02/04/2020, 20:42:42",1,0,42,2.46534470143213,0.94,0.023809523809523808
743,occupywallstreet,Preexisting - Could this be his attempt at whittling down the competition?,1603926706.0,"10/28/2020, 23:11:46",6,0,43,4.590623406272847,0.9,0.13953488372093023
744,occupywallstreet,"Even before pandemic, 23% of state households were a paycheck away from poverty, report says",1592776296.0,"06/21/2020, 21:51:36",0,0,41,3.370973545076481,0.92,0.0
745,occupywallstreet,"Ted Cruz's Plan to Curtail the International Criminal Court's Power: In a meeting with pro-Israel activists, Cruz said he expected Russia and China to support his efforts. | Cruz's plan aims to block war crimes charges and condemns the ICC for investigating American soldiers and Israeli officials.",1583466115.0,"03/06/2020, 03:41:55",1,0,39,4.119619608521255,0.9,0.02564102564102564
746,occupywallstreet,"I’m not romanticizing American capitalism or American govt before the 1980s, but I can honestly tell you this: America wasn’t always the good guy but there was a general consensus we were supposed to be. When we weren’t, we were mentally healthy enough to hang our heads in shame. -- @marwilliamson",1578206019.0,"01/05/2020, 06:33:39",1,0,43,2.4183443707308,0.95,0.023255813953488372
747,occupywallstreet,"‘Authenticity,’ ‘Culturally Relevant’: Why Bernie Sanders Is Resonating With Latinos",1577047567.0,"12/22/2019, 20:46:07",1,0,40,3.7072546841353358,0.92,0.025
748,occupywallstreet,"International Notes: Portuguese CP “unwelcomes” Netanyahu, Pompeo",1575993938.0,"12/10/2019, 16:05:38",0,0,41,1.1738153440745194,0.97,0.0
749,occupywallstreet,"‎Real Politik: Donald has a Deutsche Problem, &amp; Other Tales of the Deep State",1594477592.0,"07/11/2020, 14:26:32",0,0,38,3.21091537618868,0.92,0.0
750,occupywallstreet,"Starting at $500,000: A Swiss Mountain Vault for Storing Riches -- ""Entrepreneurs plan to build strongrooms in the Bruenig massif""",1594391437.0,"07/10/2020, 14:30:37",6,0,37,3.5415638216509535,0.91,0.16216216216216217
751,occupywallstreet,"""Guam's history connects to the Black Lives Matter Movement"" by Senator Kelly Marsh, Member of the 35th Guam Legislature in Territory of Guam, United States of America",1592570189.0,"06/19/2020, 12:36:29",1,0,40,3.303482737075825,0.92,0.025
752,occupywallstreet,"Conservative commentator Stephen Miller (not related to the Trump White House's Stephen Miller) says that the U.S. would be ""absolutely justified"" to ""turn Iran [by bombing it] into a sheet of glass tomorrow""",1578167910.0,"01/04/2020, 19:58:30",2,0,40,4.056405483555238,0.91,0.05
753,occupywallstreet,"Corporate Tax Avoidance in the First Year of the Trump Tax Law | ""For most of these [profitable Fortune 500] companies, their effective federal income tax rate was much lower than the statutory corporate tax rate of 21 percent. This is by design."" | ""91 corporations did not pay federal income taxes""",1576870684.0,"12/20/2019, 19:38:04",6,0,39,3.749858609811433,0.91,0.15384615384615385
754,occupywallstreet,"Great Employment Numbers: 44% of Fully Employed Make $18,000 a Year or Less",1576187379.0,"12/12/2019, 21:49:39",1,0,37,2.69975492942217,0.93,0.02702702702702703
755,occupywallstreet,Workers demanding union rights plan to walk off the job in nationwide Strike for Black Lives,1594575122.0,"07/12/2020, 17:32:02",0,0,40,1.2928606258147965,0.97,0.0
756,occupywallstreet,Trump's Speech Over the Clearing of Peaceful Protestors,1591362180.0,"06/05/2020, 13:03:00",1,0,37,3.4953086099715023,0.91,0.02702702702702703
757,occupywallstreet,U.S. Airstrikes Hit All-Time High as Coronavirus Spreads in Somalia,1587587269.0,"04/22/2020, 20:27:49",2,0,39,0.8389234813442172,0.98,0.05128205128205128
758,occupywallstreet,'He's an idiot': critics say Trump has failed the US in this test of reassurance | World news | The Guardian,1584223710.0,"03/14/2020, 22:08:30",1,0,35,2.1582281006879,0.94,0.02857142857142857
759,occupywallstreet,Warren just sided with Trump on his climate-killing trade deal today.,1579293259.0,"01/17/2020, 20:34:19",5,0,40,3.913696404422261,0.91,0.125
760,occupywallstreet,International Notes: Delhi police target the left,1601396316.0,"09/29/2020, 16:18:36",1,0,36,1.9370131901705108,0.95,0.027777777777777776
761,occupywallstreet,Petition: Urge Congress to expand ballot access to ensure a safe and fair election! (more links in comments!),1599679210.0,"09/09/2020, 19:20:10",5,0,36,4.466262949691149,0.89,0.1388888888888889
762,occupywallstreet,Fascism: A rising danger,1599164298.0,"09/03/2020, 20:18:18",0,0,36,2.923731371228733,0.92,0.0
763,occupywallstreet,Elections 2020: The trouncing of a noted liberal,1597259895.0,"08/12/2020, 19:18:15",0,0,35,2.799795383561488,0.93,0.0
764,occupywallstreet,TIL multi-award-winning film 'The Corporation' has a timely sequel coming soon! Here's original for unintiated.,1596592993.0,"08/05/2020, 02:03:13",1,0,39,2.5860716608542447,0.94,0.02564102564102564
765,occupywallstreet,Philly DA Larry Krasner: Trump Is a “Wannabe Fascist.” I Will Charge His Agents If They Break Law,1595537801.0,"07/23/2020, 20:56:41",1,0,36,4.788975909752374,0.88,0.027777777777777776
766,occupywallstreet,Trump encourages governors to use aggressive tactics on protesters,1591027993.0,"06/01/2020, 16:13:13",1,0,36,2.2154850526530083,0.94,0.027777777777777776
767,occupywallstreet,"K Street Requests Taxpayer Bailout of Corporate Lobbyists: oil refining, construction, fast food restaurants, and chemical manufacturing are seeking federal cash to support their lobbyists in Washington, D.C.",1588786090.0,"05/06/2020, 17:28:10",1,0,35,3.968490048589004,0.9,0.02857142857142857
768,occupywallstreet,"Trump’s a Master Con Man, But He Can’t Cheat Coronavirus",1586674021.0,"04/12/2020, 06:47:01",0,0,37,1.5912983874486812,0.96,0.0
769,occupywallstreet,Sanders Campaign Declares Victory in Iowa and Releases Discrepancies,1581046137.0,"02/07/2020, 03:28:57",1,0,41,3.0158133096605795,0.93,0.024390243902439025
770,occupywallstreet,I met some people that like Bernie :) #ILikeBernie trends #1 on Twitter,1579661743.0,"01/22/2020, 02:55:43",1,0,40,2.1895392456187324,0.95,0.025
771,occupywallstreet,NYT Columnist Touts Warren as ‘Unity Candidate’…While Also Disclosing Her Husband Works for Warren Campaign,1579034022.0,"01/14/2020, 20:33:42",2,0,39,1.9448886442169808,0.95,0.05128205128205128
772,occupywallstreet,"Responsible - When you raise your hand and take the oath as president, you become responsible for the lives of the people.",1598481471.0,"08/26/2020, 22:37:51",1,0,33,7.119166667465997,0.82,0.030303030303030304
773,occupywallstreet,Big Brother is Watching - How Congress Just Expanded Internet Spying - Real Politik,1590159539.0,"05/22/2020, 14:58:59",0,0,37,2.7407712258495422,0.93,0.0
774,occupywallstreet,Solidarity in the time of COVID-19,1588686012.0,"05/05/2020, 13:40:12",0,0,40,0.8160874770311537,0.98,0.0
775,occupywallstreet,Hospital Workers Are Producing Their Own Masks: Yet Another Reason Why the Working Class Should Control All Production,1584740356.0,"03/20/2020, 21:39:16",1,0,35,3.534141492199389,0.91,0.02857142857142857
776,occupywallstreet,BREAKING: Bernie 2020 releases updated internal #IowaCaucus totals with 60% reporting: Sanders 29.4% Buttigieg 24.87% Warren: 20.65% Biden: 12.92% Klobuchar: 11.18%,1580842445.0,"02/04/2020, 18:54:05",2,0,37,2.392353385473463,0.94,0.05405405405405406
777,occupywallstreet,Fact Check: Joe Biden has advocated cutting Social Security for 40 years.,1578941980.0,"01/13/2020, 18:59:40",0,0,35,5.658538993488818,0.86,0.0
778,occupywallstreet,Canadian Navy Sailor Exposed as Neo-Nazi Arms Dealer,1575121394.0,"11/30/2019, 13:43:14",0,0,36,5.425495797532605,0.87,0.0
779,occupywallstreet,A Trump Tax Break To Help The Poor Went To a Rich GOP Donor’s Superyacht Marina: Wealthy donors Wayne Huizenga Jr. and Jeff Vinik lobbied then-Gov. Rick Scott for the lucrative tax break — and won it. Poorer communities lost out.,1573745894.0,"11/14/2019, 15:38:14",1,0,41,2.059139307695176,0.95,0.024390243902439025
780,occupywallstreet,“Policing Is Fundamentally a Tool of Social Control to Facilitate Our Exploitation” — The brutality we have repeatedly seen meted out by American police all over the country isn’t a bug of our political-economic system — it’s a feature.,1591754046.0,"06/10/2020, 01:54:06",0,0,40,2.6524185539822653,0.94,0.0
781,occupywallstreet,More than 140 journalists have been arrested or attacked by law enforcement during US protests,1591643497.0,"06/08/2020, 19:11:37",3,0,39,2.6924693610022175,0.94,0.07692307692307693
782,occupywallstreet,Mississippi Governor Tate Reeves Declares ‘Confederate Heritage Month’ During Coronavirus Pandemic: Republican Tate Reeves has a long history of ties to pro-Confederate groups.,1586221183.0,"04/07/2020, 00:59:43",2,0,36,1.0038111177597955,0.97,0.05555555555555555
