,Subreddit,Title,Epoch Time,Date,Comments,Awards,Upvotes,Downvotes,Upvote Ratio,Comment/Upvote Ratio
0,occupywallstreet,"Trump is fomenting unrest with calls to ""liberate"" Democratic-led Minnesota, Michigan, and Virginia from pandemic guidelines and invokes the second amendment while his government is doing almost nothing to expand the social safety net, which his entire administration has attacked for years.",1587157359.0,"04/17/2020, 21:02:39",128,0,574,14.926105069940036,0.97,0.2229965156794425
1,occupywallstreet,"In Fiery Floor Speech, Bernie Sanders Rips GOP for Relentless Efforts to 'Punish' Poor People: ""Meanwhile, these very same folks had no problem a couple years ago voting for a trillion dollars in tax breaks for billionaires and large profitable corporations. Not a problem.""",1585235434.0,"03/26/2020, 15:10:34",3,1,551,3.484143666235468,0.99,0.0054446460980036296
2,occupywallstreet,"Alexandria Ocasio-Cortez's Wall Street-backed primary challenger, former CNBC host Michelle Caruso-Cabrera, who accused Ocasio-Cortez of being ""out of touch,"" lived in Trump Tower for years, called for privatizing Medicare and Social Security, and supported tax cuts and ending public-sector unions.",1588037354.0,"04/28/2020, 01:29:14",47,0,523,16.57090566497436,0.97,0.08986615678776291
3,occupywallstreet,"Congresswoman Ilhan Omar: ""It's time for a universal basic income.""",1587954221.0,"04/27/2020, 02:23:41",5,0,459,15.961152375497704,0.97,0.010893246187363835
4,occupywallstreet,#NotDying4WallStreet is trending on Twitter after Trump said that he supported ending the efforts against the coronavirus because of the economy after the stock market lost its gains under his presidency.,1585060970.0,"03/24/2020, 14:42:50",39,0,450,11.077730846297527,0.98,0.08666666666666667
5,occupywallstreet,Important facts regarding the lethality and use of rubber bullets,1591127158.0,"06/02/2020, 19:45:58",38,0,450,5.6069002816340685,0.99,0.08444444444444445
6,occupywallstreet,"By a 5–4 Vote, SCOTUS Lets Wisconsin Throw Out Tens of Thousands of Ballots: The conservative majority just approved one of the most brazen acts of voter suppression in modern times.",1586229050.0,"04/07/2020, 03:10:50",170,0,438,10.049014376167804,0.98,0.3881278538812785
7,occupywallstreet,Alexandria Ocasio-Cortez: GOP &amp; Democrats are both coming to the same conclusion: Universal Basic Income is going to have to play a role in helping Americans weather this crisis.,1584377709.0,"03/16/2020, 16:55:09",61,0,433,3.203836426750513,0.99,0.14087759815242495
8,occupywallstreet,Billionaires will do anything to protect billionaires,1582161444.0,"02/20/2020, 01:17:24",4,0,437,3.810255559071095,0.99,0.009153318077803204
9,occupywallstreet,"George Floyd, autopsy: “He didn’t die from asphyxiation or strangulation.”",1590894473.0,"05/31/2020, 03:07:53",4,0,435,14.11883237807001,0.97,0.009195402298850575
10,occupywallstreet,CoronaStrike for our lives,1590483168.0,"05/26/2020, 08:52:48",16,0,416,6.037506682876767,0.99,0.038461538461538464
11,occupywallstreet,"Whole Foods Employees Are Staging a Nationwide 'Sick-Out': Workers say they will strike Tuesday because the Amazon subsidiary has failed to prioritize their safety | It's the latest in a wave of strikes led by workers who are demanding increased pay, sick leave &amp; safety precautions amid the pandemic",1585605676.0,"03/30/2020, 22:01:16",4,1,417,0.5176101597018032,1.0,0.009592326139088728
12,occupywallstreet,AOC taking billionaires to school,1589524149.0,"05/15/2020, 06:29:09",36,0,390,6.166085738321044,0.98,0.09230769230769231
13,occupywallstreet,"Bernie Sanders Says 'Get Rid of the Insurance Companies,' Won't Support Anything But Medicare For All",1581696078.0,"02/14/2020, 16:01:18",48,0,385,-0.11203206497475549,1.0,0.12467532467532468
14,occupywallstreet,"Pro-gun activists threaten to kill state lawmaker over bill they misunderstood: Virginia legislator Lee Carter (who is a Democratic Socialist, Marine Corps veteran, and supporter of gun ownership) wrote a bill to allow teachers to strike. Pro-gun activists wrongly concluded it threatens their rights",1579526361.0,"01/20/2020, 13:19:21",30,0,381,19.302346617821684,0.95,0.07874015748031496
15,occupywallstreet,"Alexandria Ocasio-Cortez: This is not the time for half measures. We need to take dramatic action now to stave off the worst public health and economic effects. That includes making moves on paid leave, debt relief, waiving work requirements, guaranteeing healthcare, Universal Basic Income, etc.",1584064978.0,"03/13/2020, 02:02:58",16,0,355,4.350441651258961,0.99,0.04507042253521127
16,occupywallstreet,"Amy Coney Barrett, John Roberts, and Brett Kavanaugh all worked on George W. Bush's legal team during the 2000 recount in Florida and worked to stop votes from being counted.",1601332285.0,"09/28/2020, 22:31:25",15,0,352,9.474203628669386,0.97,0.04261363636363636
17,occupywallstreet,"Coronavirus Is a Labor Crisis, and a General Strike Might Be Next: Workers all over America are striking, walking off the job, protesting, and organizing ""sick-outs"" during the coronavirus pandemic. A general strike could be big, and it might already be starting.",1585870084.0,"04/02/2020, 23:28:04",11,0,340,3.8890107408018366,0.99,0.03235294117647059
18,occupywallstreet,"If Capitalism is so Great, Why does it Need to Be Bailed Out by Socialism Every ten years?",1585507260.0,"03/29/2020, 18:41:00",35,0,340,19.476661227584827,0.95,0.10294117647058823
19,occupywallstreet,"Trump says that the Democrats ""shouldn't be allowed to win"" the 2020 election because of his handling of the pandemic: ""They want to make Trump look as bad as they can because they want to try and win an election that they shouldn't be allowed to win based on the fact that we have done a great job.""",1586263265.0,"04/07/2020, 12:41:05",102,0,343,3.8488764306105168,0.99,0.29737609329446063
20,occupywallstreet,"'We're Just Getting Started,' Says Union Leader, as Worker Strike Activity Hits 35-Year High Under Trump: ""Trump's economy is not a workers' economy, and workers know solidarity is the best way to fight back.""",1581510578.0,"02/12/2020, 12:29:38",14,0,335,4.358467656489779,0.99,0.041791044776119404
21,occupywallstreet,November 3rd 2020. Spread the word!,1585712888.0,"04/01/2020, 03:48:08",56,0,336,24.64192758284139,0.93,0.16666666666666666
22,occupywallstreet,Save and share this! Denver swat pushes photographer into a fire,1591027019.0,"06/01/2020, 15:56:59",21,0,325,3.945455539698173,0.99,0.06461538461538462
23,occupywallstreet,"'A New Low': Betsy DeVos Sued for Garnishing Wages of Nearly 300,000 Student Loan Borrowers During Pandemic",1588516023.0,"05/03/2020, 14:27:03",37,0,328,6.845641952982305,0.98,0.11280487804878049
24,occupywallstreet,"‘I Think People Will Starve.’ Experts Are Worried About the Hundreds of Thousands Who Could Lose Food Stamps Come April | Nearly 700,000 people across the country could lose their food stamps once Trump's new rule kicks in in April, according to the USDA's own estimates.",1581779155.0,"02/15/2020, 15:05:55",33,0,314,6.994473275725625,0.98,0.10509554140127389
25,occupywallstreet,"MSNBC in 'Full-Blown Freakout' Mode as Bernie Sanders Cements Status as Democratic Frontrunner: ""Nazi comparisons, commentators near tears, and even a stunning admission that maybe they don't understand the country anymore.""",1582474260.0,"02/23/2020, 16:11:00",18,0,314,4.558974926514338,0.99,0.05732484076433121
26,occupywallstreet,"Despite the fact that Bernie Sanders campaigned strongly for Hillary Clinton in 2016, Clinton continues to bash Bernie Sanders and his supporters, saying that ""nobody likes him,"" and declines to say if she will endorse him if he becomes the Democratic nominee against Trump in 2020.",1579624455.0,"01/21/2020, 16:34:15",112,0,313,8.660777967722368,0.97,0.35782747603833864
27,occupywallstreet,"Conservative Operatives Float Plan to Place Retired Military, Police Officers as GOP Poll Watchers on Election Day | ""The idea is a reprisal of once-illegal Election Day “ballot security” intimidation tactics, intended to challenge voter registration and remove voters from the rolls.""",1586697949.0,"04/12/2020, 13:25:49",58,0,311,2.76289810449731,0.99,0.1864951768488746
28,occupywallstreet,America's richest 400 families now pay a lower tax rate than the middle class,1581876543.0,"02/16/2020, 18:09:03",6,0,306,0.47165351272371936,1.0,0.0196078431372549
29,occupywallstreet,“Don't Fear the Virus”,1602324376.0,"10/10/2020, 10:06:16",2,1,306,10.02051750815491,0.97,0.006535947712418301
30,occupywallstreet,"'Beyond Predatory': Trump Treasury Department Gives Banks Green Light to Seize $1,200 Stimulus Checks to Pay Off Debts",1587315679.0,"04/19/2020, 17:01:19",14,0,300,2.824968039477369,0.99,0.04666666666666667
31,occupywallstreet,This is how billionaires get rich: Police clearing a blockade of an Amazon facility in France.,1575145886.0,"11/30/2019, 20:31:26",19,0,297,0.06396027583957675,1.0,0.06397306397306397
32,occupywallstreet,"TIL that Sanders' first election to the senate marked the first Republican loss for this seat in 144 years, ending the longest single party Senate winning streak in history.",1579446597.0,"01/19/2020, 15:09:57",8,0,295,7.406462575319608,0.98,0.02711864406779661
33,occupywallstreet,The 1 Percent Are Cheating Us Out of a Quarter-Trillion Dollars in Taxes Every Year,1594728471.0,"07/14/2020, 12:07:51",15,0,293,3.0196270719699214,0.99,0.051194539249146756
34,occupywallstreet,"""Out of a Dictator's Handbook"": Trump Threatens to Adjourn Congress to Unilaterally Install Judges, Political Nominees: ""That's banana republic stuff,"" said Rep. Jamie Raskin, a constitutional law expert.",1587048087.0,"04/16/2020, 14:41:27",30,0,300,10.71880995866917,0.97,0.1
35,occupywallstreet,"Why We Want to Abolish Billionaires: Hard work doesn’t get you a billion dollars — rent extraction, financial speculation, resource monopolization, and exploiting working people does. We don’t envy the superrich, we want to stop them.",1573217999.0,"11/08/2019, 12:59:59",16,0,294,5.424127429756425,0.98,0.05442176870748299
36,occupywallstreet,8 people made over a billion dollars during the pandemic. Who are these fuckers?,1589300433.0,"05/12/2020, 16:20:33",6,0,295,4.832041342535092,0.98,0.020338983050847456
37,occupywallstreet,Grocery workers are beginning to die of coronavirus,1586438723.0,"04/09/2020, 13:25:23",14,0,292,1.7628095577565546,0.99,0.04794520547945205
38,occupywallstreet,The White House Wanted To Give $0 To Tribes In The $2 Trillion Stimulus Bill: Senate Republicans also worked to scale back direct relief for Native Americans.,1586087168.0,"04/05/2020, 11:46:08",22,0,291,5.899881075543021,0.98,0.07560137457044673
39,occupywallstreet,zoooooom,1598330554.0,"08/25/2020, 04:42:34",0,0,288,3.454660909435802,0.99,0.0
40,occupywallstreet,"Republican Congressman Matt Gaetz: ""Now that we clearly see Antifa as terrorists, can we hunt them down like we do those in the Middle East?""",1591191650.0,"06/03/2020, 13:40:50",35,0,291,2.73646747196824,0.99,0.12027491408934708
41,occupywallstreet,'Their money couldn't buy a movement': Alexandria Ocasio-Cortez taunts Wall Street after triumphing over her billionaire-backed primary opponent,1593015055.0,"06/24/2020, 16:10:55",3,0,289,5.867934074458105,0.98,0.010380622837370242
42,occupywallstreet,"Bernie Sanders: ""If elected, I promise to be the most pro-union president in American history.""",1579984267.0,"01/25/2020, 20:31:07",11,0,285,5.438247164643315,0.98,0.03859649122807018
43,occupywallstreet,"President Trump: ""The United States of America will be designating ANTIFA as a Terrorist Organization."" (Antifa, short for anti-fascist, is a general term for socialist, communist, and anarchist-inspired left-wing activism against the far-right)",1590951828.0,"05/31/2020, 19:03:48",48,0,281,4.992062890301611,0.98,0.1708185053380783
44,occupywallstreet,Banker who signed off Trump loans found dead after seemingly killing himself,1575477046.0,"12/04/2019, 16:30:46",19,0,283,4.632768624443997,0.98,0.06713780918727916
45,occupywallstreet,"Bernie Sanders scares the shit out of Republicans - ""Do not underestimate Bernie in a general election. His campaign is a juggernaut, and he built it off of like $3 donations from millions of people. You don't want to see what that machine does when it doesn't have primary opponents.""",1580072706.0,"01/26/2020, 21:05:06",16,0,278,7.131355468333993,0.97,0.05755395683453238
46,occupywallstreet,"It's like 2016 all over again. See foot, shoot foot.",1579823012.0,"01/23/2020, 23:43:32",40,0,278,9.594748318924246,0.97,0.14388489208633093
47,occupywallstreet,"Pete Buttigieg Is a Wall Street Democrat Beholden to Corporate Interests: Given his history, it is no surprise that Wall Street, Big Tech, Big Pharma, health insurers, real estate developers and private equity have decided to invest millions of dollars into Buttigieg’s campaign.",1582038689.0,"02/18/2020, 15:11:29",2,0,275,5.448069180165021,0.98,0.007272727272727273
48,occupywallstreet,Millionaires and billionaires are set to reap more than 80% of the benefits from a change to the tax law Republicans put in the coronavirus economic relief package,1587063165.0,"04/16/2020, 18:52:45",4,0,268,-0.5880806641355321,1.0,0.014925373134328358
49,occupywallstreet,Why Can't You Just Follow The Rules?,1592182420.0,"06/15/2020, 00:53:40",9,0,272,7.020072805534937,0.97,0.03308823529411765
50,occupywallstreet,Trump wants the news to waste the whole day talking about his tweet threatening to delay the election. The actual news is that US GDP plunged by a record 33% annual rate in the 2nd quarter as coronavirus lockdowns raged. Don't get distracted. Focus.,1596126889.0,"07/30/2020, 16:34:49",4,0,268,5.395434253968176,0.98,0.014925373134328358
51,occupywallstreet,"""SoCiALisM CaN NeVeR WoRk In AmErIcA! PRiVaTiZaTiOn Is ALwAyS BeTtEr!""",1591204155.0,"06/03/2020, 17:09:15",7,0,270,11.755806714237224,0.96,0.025925925925925925
52,occupywallstreet,Black Lives Matter protests continue at Trump’s doorstep,1591802306.0,"06/10/2020, 15:18:26",2,0,269,3.232843439766782,0.99,0.007434944237918215
53,occupywallstreet,"In His First Presidential Campaign, Joe Biden Told Black Voters To “Reject” Progressive Civil Rights Activist Jesse Jackson | Biden distorted Jackson's views, and later clarified that he was criticizing Jackson for ""pitting"" minorities and poor whites against the ""middle class"" with ""class warfare.""",1583714591.0,"03/09/2020, 00:43:11",26,0,265,8.086346135802273,0.97,0.09811320754716982
54,occupywallstreet,"MSNBC anchor Chuck Todd blasted for Nazi smear on leading Democrat Bernie Sanders | After MSNBC's Chris Matthews invoked ""executions in Central Park"" to smear Bernie Sanders, MSNBC's Chuck Todd quoted neoconservative writer Jonathan Last comparing supporters of Bernie Sanders to the Nazi Brownshirts",1581390195.0,"02/11/2020, 03:03:15",18,0,262,4.695078514611225,0.98,0.06870229007633588
55,occupywallstreet,This is just sad,1598430681.0,"08/26/2020, 08:31:21",6,0,262,-0.7867814914748692,1.0,0.022900763358778626
56,occupywallstreet,NYC BLM Protesters take the Brooklyn Bridge shuttinG down traffic to Manhattan in solidarity with the city of Portland.,1595787097.0,"07/26/2020, 18:11:37",70,0,262,6.293027229961126,0.98,0.26717557251908397
57,occupywallstreet,Bloomberg quietly plotting brokered convention strategy: The effort is designed as a potential backstop to block Bernie Sanders by poaching supporters from Joe Biden and other moderates. | Mega-billionaire Mike Bloomberg is plotting to hijack the Democratic nomination with moderate allies and donors,1582305143.0,"02/21/2020, 17:12:23",19,0,263,3.7141556073484026,0.99,0.07224334600760456
58,occupywallstreet,The GOP's claim that antifa is infiltrating George Floyd protests is a right-wing 'bogeyman' that bears all the hallmarks of a domestic disinformation campaign,1591661206.0,"06/09/2020, 00:06:46",5,0,262,1.752474855866069,0.99,0.019083969465648856
59,occupywallstreet,"GOP Senator Lamar Alexander, Who Voted for Trump Tax Cuts, Now Says There's 'Not Enough Money to Help Everybody' Harmed by Covid-19",1589241540.0,"05/11/2020, 23:59:00",31,0,262,0.844500064414774,1.0,0.1183206106870229
60,occupywallstreet,"The Trump Administration Will Move Ahead With Its Plan To Kick People Off Of Food Stamps Despite The Coronavirus Outbreak | The White House projects 700,000 people would lose SNAP eligibility while another estimate projects that over a million people would lose assistance.",1584152246.0,"03/14/2020, 02:17:26",44,0,259,4.798728628840877,0.98,0.16988416988416988
61,occupywallstreet,Brooklyn Man Was Arrested For Curfew Violation. The FBI Interrogated Him About His Political Beliefs. (citizens with left-wing political views are being targeted),1591328098.0,"06/05/2020, 03:34:58",13,0,261,6.118165937339825,0.98,0.04980842911877394
62,occupywallstreet,A light at the end of the tunnel...,1602587581.0,"10/13/2020, 11:13:01",11,0,257,4.07992781384479,0.98,0.042801556420233464
63,occupywallstreet,"William Barr's classmates say he's using Trump to get the power he always wanted | 'I think he believes in Old Testament values [...] He picketed a school function because it was serving as a fundraiser for the NAACP [...] There are people out there who are fascist. William Barr, in my view, is one'",1582551811.0,"02/24/2020, 13:43:31",6,0,256,7.0033662898578655,0.97,0.0234375
64,occupywallstreet,"""Let me repeat that. 467 billionaires have seen their wealth go up by over $730 billion during the pandemic."" - Bernie Sanders on Twitter",1596679344.0,"08/06/2020, 02:02:24",7,0,260,2.805262928969455,0.99,0.026923076923076925
65,occupywallstreet,Trump twice pushed back the deadline to release his 2019 financial disclosures. Then dropped them with no warning late on Friday. Then said he was banning TikTok and pulled everyone's attention away. We're still paying attention. See his finances here:,1596437298.0,"08/03/2020, 06:48:18",7,0,254,9.01607219085821,0.97,0.027559055118110236
66,occupywallstreet,"Armed troops in Portland, Oregon, are taking people prisoner in the streets while refusing to identify themselves as law enforcement and operating out of civilian vehicles. No one on scene knows what jurisdiction or capacity they are operating in, or what happened to the person taken into the van.",1594941237.0,"07/16/2020, 23:13:57",21,0,252,4.697356312494833,0.98,0.08333333333333333
67,occupywallstreet,"America Is Going On A General Strike starting March 31 - No Rent, No Work, No Debt!",1585404604.0,"03/28/2020, 14:10:04",8,0,255,9.906276193390795,0.96,0.03137254901960784
68,occupywallstreet,Activists across the US and the world protest a possible war with Iran,1578184682.0,"01/05/2020, 00:38:02",13,0,252,0.9208109285540615,1.0,0.051587301587301584
69,occupywallstreet,"Jared Kushner revealed as brains behind Donald Trump's ""half-baked"" coronavirus response",1584294756.0,"03/15/2020, 17:52:36",15,0,253,3.909756136822466,0.98,0.05928853754940711
70,occupywallstreet,Minneapolis Mayor Booed Out of Rally for Saying “I Do Not Support the Abolition of the Police”,1591500204.0,"06/07/2020, 03:23:24",27,0,250,3.5662910922580693,0.99,0.108
71,occupywallstreet,"Bernie: ""Let Iowa be the beginning of a new America. An America based on the principles of justice. Social justice. Economic justice. Racial justice. Environmental justice. Let us show the world what America can become."" -&gt; vid",1580687585.0,"02/02/2020, 23:53:05",4,0,251,4.037102356461503,0.98,0.01593625498007968
72,occupywallstreet,"Secular Talk: ""If the DNC screws Bernie again it simply won't be tolerated. Millions of people will be in the streets demanding the will of the voters is upheld. Don't try us.""",1580608735.0,"02/02/2020, 01:58:55",17,0,255,6.745807739701775,0.97,0.06666666666666667
73,occupywallstreet,"Police Use Violent Threats, Legalized Bribery To Dodge Oversight",1591885024.0,"06/11/2020, 14:17:04",2,0,255,2.676153895713128,0.99,0.00784313725490196
74,occupywallstreet,'The rich are to blame for climate change' international study finds,1584443498.0,"03/17/2020, 11:11:38",7,0,251,2.9614120505365804,0.99,0.027888446215139442
75,occupywallstreet,"Joe Biden has praised George W. Bush (Liberty Medal), Dick Cheney (""I actually like Dick Cheney for real [...] he's a decent man""), Mike Pence (""decent guy""), Strom Thurmond (eulogy), Jesse Helms (""only Helms can fix the U.N.""), &amp; William Barr (""heck of an honorable guy""; ""one of the best"" U.S. AGs)",1581251409.0,"02/09/2020, 12:30:09",25,0,247,7.042408918442703,0.97,0.10121457489878542
76,occupywallstreet,Truth Spotted on Boston Street Corner,1578411975.0,"01/07/2020, 15:46:15",1,0,248,-1.0913518959225996,1.0,0.004032258064516129
77,occupywallstreet,Colorado Springs Officer Keith Wrede Used Fake Name To Post Comments About Protesters: ‘Kill Them All’,1597170229.0,"08/11/2020, 18:23:49",11,0,248,5.1375253845671125,0.98,0.04435483870967742
78,occupywallstreet,"Trump budget would cut Medicare, Medicaid and Social Security while expanding tax cuts for the rich: “We will not be touching your Social Security and Medicare in Fiscal 2021 Budget,"" Trump lied hours earlier | Trump's budget also proposes severe cuts to food stamps, education, etc.",1581424451.0,"02/11/2020, 12:34:11",41,0,247,2.7736402015006547,0.99,0.1659919028340081
79,occupywallstreet,How Much Would Bernie's Medicare-For-All Cost You?,1572991370.0,"11/05/2019, 22:02:50",18,0,249,6.071239748016524,0.98,0.07228915662650602
80,occupywallstreet,"Tesla forced all workers to take a 10 percent pay cut from mid-April until July. In the same period, Tesla stock skyrocketed and CEO Elon Musk’s net worth quadrupled from $25 billion to over $100 billion. Musk is a modern-day robber baron.",1599604157.0,"09/08/2020, 22:29:17",17,0,247,11.342411757556874,0.96,0.06882591093117409
81,occupywallstreet,"Erik Prince Recruits Ex-Spies to Help Infiltrate Liberal Groups | Blackwater founder Erik Prince recruited American and British spies for surveillance operations that included infiltrating Democratic congressional campaigns, labor organizations and other groups considered hostile to the Trump agenda",1583620287.0,"03/07/2020, 22:31:27",8,0,245,1.7895525410072537,0.99,0.0326530612244898
82,occupywallstreet,The Belief That Everything Will Be Fine Once Trump’s Gone Is More Dangerous Than Trump,1581610221.0,"02/13/2020, 16:10:21",18,0,247,5.714747840762072,0.98,0.0728744939271255
83,occupywallstreet,You don’t hate monday...,1600720059.0,"09/21/2020, 20:27:39",11,0,244,9.988800133898224,0.96,0.045081967213114756
84,occupywallstreet,"The NYPD is Stealing Bikes, Leaving Protesters Stranded",1591245411.0,"06/04/2020, 04:36:51",3,0,243,2.585593682463241,0.99,0.012345679012345678
85,occupywallstreet,It's not as simple as just seizing money from billionaires,1576480183.0,"12/16/2019, 07:09:43",18,0,241,2.106576499636475,0.99,0.07468879668049792
86,occupywallstreet,Bernie Sanders Is a Critic of US Imperialism. Elizabeth Warren Is Not.,1576159802.0,"12/12/2019, 14:10:02",4,0,239,10.83112913058963,0.96,0.016736401673640166
87,occupywallstreet,"Fascism Expert: Don’t Expect Trump To Leave WH, If He Loses",1591970189.0,"06/12/2020, 13:56:29",53,0,244,15.358241465026083,0.94,0.21721311475409835
88,occupywallstreet,"""More people were killed by police in 2019 than have been killed in all school shootings in American history combined.""",1589332211.0,"05/13/2020, 01:10:11",67,0,236,4.839812301756069,0.98,0.2838983050847458
89,occupywallstreet,Why is this a hard choice?,1600568359.0,"09/20/2020, 02:19:19",6,0,237,3.880739089172323,0.98,0.02531645569620253
90,occupywallstreet,"Trump administration expected to loosen restrictions on use of landmines | The Trump administration is expected to loosen restrictions on the US military's ability to use landmines, weapons that have been banned by more than 160 countries due to their history of killing and wounding civilians.",1580396572.0,"01/30/2020, 15:02:52",29,0,238,2.9706125690393606,0.99,0.12184873949579832
91,occupywallstreet,"America's Social Unrest Is About to Get Much Worse, Congress Fears: ""Police reform may quell some of the distress. But there's about to be a massive drop-off in help for the unemployed. And that's when things may explode."" [United States of America]",1592242074.0,"06/15/2020, 17:27:54",20,0,239,0.43237609747444594,1.0,0.08368200836820083
92,occupywallstreet,"Tucker Carlson is a Racist, Con Man — and FOX News’ Top-Rated Star",1588343604.0,"05/01/2020, 14:33:24",54,0,232,12.213532989449646,0.95,0.23275862068965517
93,occupywallstreet,"As Corporations Plead For Taxpayer Bailouts, Goldman Sachs Gives CEO 20% Pay Bounce: Goldman Sachs CEO David Solomon gets $27.5 million in cash and stock for his work last year.",1584904760.0,"03/22/2020, 19:19:20",16,0,237,3.5605901902754056,0.99,0.06751054852320675
94,occupywallstreet,"""Two-thirds of America thinks the economy is helping the rich and hurting the working class. What particularly angers me—and why people have such contempt for Washington—is the corporate control over our political life while the middle class disappears."" - @SenSanders | new Pew poll | CNBC (link)",1576792749.0,"12/19/2019, 21:59:09",1,0,232,3.4436763062398654,0.99,0.004310344827586207
95,occupywallstreet,"CEOs now earn 320 times more than average workers. Worker pay has increased by 13.7% since 1978. CEO pay has increased by 1,167%.",1597930837.0,"08/20/2020, 13:40:37",13,0,233,-0.5624419853167524,1.0,0.055793991416309016
