,Subreddit,Title,Epoch Time,Date,Comments,Awards,Upvotes,Downvotes,Upvote Ratio,Comment/Upvote Ratio
217,todayilearned,TIL a pod of dolphins saved a group of swimmers from a great white shark by herding the swimmers together and doing tight circles around them to create a barrier. The dolphins kept this up for 40 minutes until the shark lost interest and was safe for the swimmers to swim to shore.,1595172795.0,"07/19/2020, 15:33:15",1599,0,77378,2829.3903665389516,0.96,0.020664788441158984
218,todayilearned,"TIL in 2009, a 14-year-old boy showed up at a Chicago police station in uniform and worked 5 hours of a shift. He allegedly got a police radio, ticket book and rode with an officer for several hours before his identity was realised. He knew procedure due to a ""police explorer"" program he’d gone to.",1578178476.0,"01/04/2020, 22:54:36",1213,2,77296,4591.145656381836,0.94,0.015692920720347753
219,todayilearned,"TIL Former US President Andrew Jackson was approached by a man who pulled a gun on him.The man pulled the trigger and shot at him but misfired, he then took another gun out of his pocket and and pulled the trigger but that gun also misfired.Jackson who was 67 at that time then beat him with his cane",1591149704.0,"06/03/2020, 02:01:44",2260,1,77274,9731.89457039941,0.89,0.029246577115200456
220,todayilearned,"TIL poison dart frogs are actually harmless when kept in captivity. In the wild, they only develop poison because they eat mostly ants, and the ants themselves ingest different varieties of poisonous plants.",1598007266.0,"08/21/2020, 10:54:26",949,6,77217,3130.85102067751,0.96,0.01229003975808436
221,todayilearned,"TIL Clint Eastwood was mayor of tiny Carmel-by-the-Sea, CA in the 1980s; he ran because he wanted to lift a ban on public ice cream sales, flew home from movie sets for weekly council meetings, wrote a column in the town paper, and a local hotel changed their slogan to ""make my stay"".",1595776388.0,"07/26/2020, 15:13:08",2362,3,77154,7097.48004809671,0.92,0.030614096482359954
222,todayilearned,"TIL Alien’s entire cast including Sigourney Weaver was originally just genderless last names, and they then picked the best person for each character, then chose a first name for them",1600619325.0,"09/20/2020, 16:28:45",1630,49,77118,5814.882593892369,0.93,0.021136440260380196
223,todayilearned,"TIL that when Henry Ford doubled the pay of his auto workers from $2.50 per day to $5, he didn't do it for altruistic reasons. His factory had one of the highest turnover rates (due to danger of the assembly line and tedium of the work). After the raises, it dropped to the lowest.",1582298014.0,"02/21/2020, 15:13:34",4178,1,77002,6258.71224806238,0.92,0.05425833095244279
224,todayilearned,TIL getting a boner when climbing Everest is common thanks to the change in pressure,1604273312.0,"11/01/2020, 23:28:32",1779,67,77028,7096.627886171482,0.92,0.023095497741081165
225,todayilearned,TIL There is a phenomenon where millions of people in Britain all simultaneously turn on their electric kettles during commercial TV breaks causing massive power surges countrywide.,1602337037.0,"10/10/2020, 13:37:17",2735,39,76971,5440.11822735153,0.93,0.03553286302633459
226,todayilearned,"TIL that Neil Armstrong's barber sold Armstrong's hair for $3k without his consent. Armstrong threatened to sue the barber unless he either returned the hair or or donated the proceeds to charity. Unable to retrieve the hair, the barber donated the $3k to a charity of Armstrong's choosing.",1602193731.0,"10/08/2020, 21:48:51",1489,20,76786,4770.037124956449,0.94,0.01939155575235069
227,todayilearned,TIL that the reason Sherlock Holmes adaptations portray him as cold and unemotional is because later stories where he has empathy and warmth are owned by the Conan Doyle Estate. They will sue if a depiction of Holmes uses character traits that they own the rights to.,1597706530.0,"08/17/2020, 23:22:10",1931,9,76765,4789.312876247539,0.94,0.02515469289389696
228,todayilearned,"TIL that when future US President Lyndon B. Johnson was Senate majority leader, he instructed his staff to make his scotch and soda significantly weaker than his guest’s, so that he could keep a clearer head",1602455006.0,"10/11/2020, 22:23:26",1690,13,76596,3765.4582300183683,0.95,0.022063815342837745
229,todayilearned,TIL a man who was paralyzed from a surfing accident neck injury was able to walk again from an experimental treatment. Stem cells from the man's own stomach fat were injected into his spinal cord to regenerate and repair the injury.,1581179268.0,"02/08/2020, 16:27:48",1379,2,76528,3995.198037369133,0.95,0.018019548400585405
230,todayilearned,"TIL that anyone who moves to Villas Las Estrellas, a settlement in Antarctica, must first have their appendix preemptively removed because the nearest hospital is over 600 miles away.",1597890378.0,"08/20/2020, 02:26:18",1883,5,76528,3790.2054656561522,0.95,0.02460537319673845
231,todayilearned,"TIL when deaf people with schizophrenia 'hear voices', they hallucinate hands communicating using sign language",1582487581.0,"02/23/2020, 19:53:01",1330,4,76511,4500.337149599727,0.94,0.0173831213812393
232,todayilearned,"TIL Nikola Tesla once spent over $2,000 on an injured white pigeon. The amount includes building a device that comfortably supported her so her bones could heal. ""I loved that pigeon as a man loves a woman, and she loved me. As long as I had her, there was a purpose to my life,"" he said of her.",1575662838.0,"12/06/2019, 20:07:18",2400,4,76475,4824.328656023616,0.94,0.03138280483818241
233,todayilearned,"TIL that Michael Jackson removed ""Dirty Diana"" from his concert setlist in London for Princess Diana to be respectful, but she asked for him to keep it in the setlist as it was one of her personal favorites.",1594518028.0,"07/12/2020, 01:40:28",1551,0,76316,4127.459814602596,0.95,0.02032339221133183
234,todayilearned,"TIL that Frank Sinatra and the Rat Pack are widely credited with helping end segregation in Las Vegas, by refusing to perform in venues that wouldn't allow blacks.",1590686413.0,"05/28/2020, 17:20:13",1293,3,76293,5050.856067876506,0.94,0.01694781959026385
235,todayilearned,TIL Freddie Mercury spent his last months recording as many vocals as he could for the rest of Queen to finish after his death,1601553901.0,"10/01/2020, 12:05:01",914,71,76256,4664.910024656812,0.94,0.011985942089802769
236,todayilearned,"TIL Queen Elizabeth II specifically asked to be in a James Bond skit with Daniel Craig for the Olympics, breaking royal protocol. When asked if she would like to say something she said, ""Of course I must say something. After all, he is coming to rescue me.""",1597602383.0,"08/16/2020, 18:26:23",1830,12,76236,6133.868742008359,0.93,0.02400440736659846
237,todayilearned,"TIL of the UK's ""Right To Roam"" - people can access most mountains, moors, heaths and downs that are privately owned for hiking and leisure",1595241688.0,"07/20/2020, 10:41:28",5444,0,76232,6014.279153535201,0.93,0.07141357959911848
238,todayilearned,"TIL Clyde Tombaugh, the man who discovered Pluto, has finally visited it, as his ashes are aboard the New Horizons spacecraft that completed a Pluto flyby in 2015.",1578913750.0,"01/13/2020, 11:09:10",799,2,76189,4625.511456556211,0.94,0.010487078187139875
239,todayilearned,"TIL about Alexander Litvinenko, a former Russian spy that solved his own murder case. He was poisoned with a cup of tea in a London hotel. Working with Scotland Yard detectives, as he lay dying, he traced the lethal substance to a former comrade in the Russian secret service",1595351861.0,"07/21/2020, 17:17:41",1427,2,76107,3745.5980913277454,0.95,0.018749917878775935
240,todayilearned,"TIL in the 50-plus year history of the Japanese bullet train system, carrying over 5.3 billion passengers, there has been not a single passenger fatality or injury due to train accidents.",1579222921.0,"01/17/2020, 01:02:01",2111,2,76070,3623.1536368970555,0.95,0.02775075588273958
241,todayilearned,TIL Classical Greece wasn't filled with pure white marble everything. The statues and ruins we see today were actually painted in all kinds of vivid colors that were just stripped bare back to their original white marble by time.,1586648671.0,"04/11/2020, 23:44:31",1658,1,75972,6814.665503500466,0.92,0.021823829832043385
242,todayilearned,"TIL That when Bill Paxton died, hundreds of storm chasers spelt out his initials BP across three states using GPS markers to honor him for his role as a storm chaser in the 90s movie Twister.",1601375428.0,"09/29/2020, 10:30:28",1587,46,75940,6548.450014427712,0.92,0.020898077429549643
243,todayilearned,"TIL that J.K. Rowling wrote a real person into The Goblet of Fire. The girl was named Natalie McDonald, a Harry Potter fan who was dying of leukaemia while Rowling was still writing the book. You see her character as a first-year who dons the sorting hat and is sorted into Gryffindor.",1588938728.0,"05/08/2020, 11:52:08",2644,0,75893,10565.565911370504,0.88,0.034838522656898525
244,todayilearned,"TIL the USSR expected to win the final of the 1957 Ice Hockey World Championships, held in Moscow, but lost to Sweden. The organizers did not have the Swedish national anthem ready for the medal ceremony, so the Swedish players sang a drinking song and it was broadcast over the PA system.",1602609679.0,"10/13/2020, 17:21:19",995,37,75872,4585.015887952031,0.94,0.01311419232391396
245,todayilearned,"TIL that bears are considered by many wildlife biologists to be one of the most intelligent land animals of North America. They possess the largest and most convoluted brains relative to their size of any land mammal. In the animal kingdom, their intelligence compares with that of higher primates.",1584310004.0,"03/15/2020, 22:06:44",1700,1,75795,4055.9611197029444,0.95,0.022428920113463948
246,todayilearned,TIL A 2 year study showed that washing hands 5 times daily reduced incidence of respiratory infections by 45%.,1583102638.0,"03/01/2020, 22:43:58",2222,6,75783,3840.287339166098,0.95,0.029320560020057267
247,todayilearned,"TIL that in 1997 a poacher named Vladimir Markov shot and wounded a tiger and then stole a part of the tiger's kill. The injured tiger staked out Markov's cabin, waited 12-48 hours for Markov to come home and then proceeded to kill him and eat him.",1599296905.0,"09/05/2020, 09:08:25",1451,75,75631,6058.31366652358,0.93,0.019185254723592178
248,todayilearned,"TIL that in 1971, burglars broke into an FBI office by writing a note that said “Please don’t lock this door tonight” and plastering it onto the front door. It worked and they stole several files.",1585467223.0,"03/29/2020, 07:33:43",1249,4,75561,3449.507100729985,0.96,0.016529691242836913
249,todayilearned,"TIL A Group Of Flat Earthers Spend $20,000 Trying To Prove Earth Is Flat, Accidentally Prove It's Round",1590440164.0,"05/25/2020, 20:56:04",3525,1,75496,10481.747626523647,0.88,0.04669121542863198
250,todayilearned,"TIL Out of all the species that ever lived throughout all of Earth’s history, only a fraction of a percent have fossilized. Even fewer are discovered by humans. Most of life’s history will be forever unknown",1595905610.0,"07/28/2020, 03:06:50",2153,2,75271,3580.1862479851698,0.95,0.028603313361055385
251,todayilearned,"TIL that Johnny Cash’s guitar player died in 1968. Cash found himself at a show where the temporary replacement, Carl Perkins, couldn’t make it. An audience member asked Cash if he could fill in for the night, and he said yes. Bob Wootton then became Cash’s guitar player for the next 29 years",1581519820.0,"02/12/2020, 15:03:40",726,1,75227,3017.267946696622,0.96,0.009650790274768367
252,todayilearned,"TIL since 2015, Sesame Street has been funded by HBO due to PBS funding issues",1591801294.0,"06/10/2020, 15:01:34",1637,0,75168,5049.469627296508,0.94,0.021777884206045126
253,todayilearned,"TIL that in Churchill, Manitoba, it is customary to leave car doors unlocked in order to provide other residents a quick escape should they come face-to-face with a polar bear.",1594760855.0,"07/14/2020, 21:07:35",1958,0,75054,3647.867272513162,0.95,0.026087883390625417
254,todayilearned,TIL that Alan Alda met his wife of over 60 years at a dinner party when they were the only two guests who ate the rum cake after it fell on the kitchen floor.,1604178177.0,"10/31/2020, 21:02:57",894,16,75080,7628.97166087752,0.91,0.011907298881193394
255,todayilearned,"TIL Getty Images, a company infamous for sending threatening letters requesting payment when their photos are used without permission, was sued for more than $1 billion in damages when they mistakenly demanded a “settlement payment” from a photographer for her own work.",1587241578.0,"04/18/2020, 20:26:18",1229,1,74964,3536.939237214683,0.95,0.01639453604396777
256,todayilearned,"TIL a woman told an auto shop she had to cancel her service appt. as her car was stolen. One of the 3 Tulsa men who own the auto shop called her back the next day to tell her he &amp; his buddies are chasing her stolen car. With TPD dispatch, they got her car back after after a 15 min chase.",1582853177.0,"02/28/2020, 01:26:17",870,2,74735,5480.361516032441,0.93,0.011641131999732388
257,todayilearned,"TIL in 1960, an Australian father won nearly $3 million (adjusted AU$) in the lottery, with his picture getting plastered all over the news. Shortly after, his 8-year-old son was kidnapped for ransom and eventually murdered. This changed anonymity laws for lottery winners in Australia forever.",1579132115.0,"01/15/2020, 23:48:35",2053,1,74706,3116.2980788918794,0.96,0.027481059084946323
258,todayilearned,"TIL Ray Burton, who was the father of Cliff Burton, used Cliff's royalties for the first 3 Metallica albums to fund kids scholarships at Castro Valley High School. Ray wanted to keep his sons name alive by putting kids through collage with his sons royalties for 30 years.",1600168707.0,"09/15/2020, 11:18:27",1730,103,74592,6911.674703540848,0.92,0.023192835692835694
259,todayilearned,"TIL three 13 year old girls submitted a script for ""Tiny Toon Adventures"". Producer Steven Spielberg was so impressed that he invited the girls to Hollywood to work on the episode and paid them $3,000. This later inspired a Simpsons episode where Bart and Lisa write an Itchy &amp; Scratchy cartoon.",1604353355.0,"11/02/2020, 21:42:35",803,17,74582,5265.9230252515845,0.93,0.010766672923761766
260,todayilearned,"TIL defensive tackle Derrick Nnadi vowed to pay the average adoption fee of $150 for every dog at a Missouri shelter if the Kansas City Chiefs won the Super Bowl. They won, and Nnadi paid the fees. A few days later, all 109 shelter dogs had been adopted.",1594085782.0,"07/07/2020, 01:36:22",948,5,74523,5512.544511363143,0.93,0.012720904955517089
261,todayilearned,TIL that a lottery winner wore a scream mask to collect his one million so that his relatives won't take his money,1596839355.0,"08/07/2020, 22:29:15",2063,1,74495,8544.628459469925,0.9,0.02769313376736694
262,todayilearned,"TIL that James McCormick sold the ADE 651, a fake ‘bomb detector’, all over the world (specifically Iraq) by purchasing novelty golf ball detectors for less than $20 and reselling it for $5000 each. His scam has cost lives and the ‘bomb detectors’ are probably still in use today.",1594038364.0,"07/06/2020, 12:26:04",2150,0,74483,4207.141183710293,0.95,0.028865647194661868
263,todayilearned,"TIL Biz Markie was not supposed to sing the chorus in his hit song ""Just a Friend"", but none of the people he invited showed up at the studio so he sang it himself.",1601528043.0,"10/01/2020, 04:54:03",1558,71,74456,4669.221526961395,0.94,0.02092511013215859
264,todayilearned,"TIL that the largest Masonic Temple in the world, the Detroit Masonic Temple, was saved from foreclosure in 2013 by Jack White of the White Stripes. White paid off $142,000 owed in back taxes by the Temple due to the fact that it had given his mother a job as an usher when she was in need.",1588981112.0,"05/08/2020, 23:38:32",1602,3,74422,5110.396047885326,0.94,0.021525892881137296
265,todayilearned,TIL Scientists discovered sharks that are living in an active underwater volcano. Divers cannot investigate because they would get burns from the acidity and heat.,1591351249.0,"06/05/2020, 10:00:49",1883,1,74365,3246.7336972771736,0.96,0.025321051569958987
266,todayilearned,"TIL that over the 125 years of the New York Public Library's existence, the most checked-out books are: The Snowy Day, The Cat in the Hat, 1984, Where the Wild Things Are, To Kill a Mockingbird, Charlotte's Web, Fahrenheit 451, How to Win Friends..., Harry Potter 1, and The Very Hungry Caterpillar",1600251432.0,"09/16/2020, 10:17:12",1442,50,74214,4620.724702771389,0.94,0.01943029617053386
267,todayilearned,TIL a man in 2002 found a way to crack the lottery in the US state of Michigan using math and probability. He figured out that if he bought a certain amount of tickets that he would certainly make a profit. He and his wife Marge ended up making millions of dollars.,1575938734.0,"12/10/2019, 00:45:34",2191,1,74114,5211.539611211047,0.93,0.029562565777046173
268,todayilearned,"TIL The US had to abandon construction of a border fort in New York State after realising that they'd accidentally built it on the Canadian side of the border. It was promptly nicknamed ""Fort Blunder"".",1585343957.0,"03/27/2020, 21:19:17",1187,1,74041,4522.237627516675,0.94,0.016031658135357438
269,todayilearned,"TIL Seth MacFarlane served as executive producer of the Neil deGrasse Tyson-hosted series Cosmos. He was instrumental in providing funding for the series, as well as securing studio support for it from other entertainment execs.",1588248359.0,"04/30/2020, 12:05:59",2225,1,73968,13857.192971129232,0.84,0.030080575383949815
270,todayilearned,"TIL Modern body armor was created by a pizza delivery guy who was wounded in the head and leg after a pizza delivery turned into a shootout. Richard Davis, a former US Marine, developed the bulletproof vest using Kevlar. During testing, he shot himself in the chest 190 times.",1586437444.0,"04/09/2020, 13:04:04",2480,2,73833,5742.97433094657,0.93,0.03358931643032249
271,todayilearned,"TIL that during WW2, Canada gave out buttons to people who tried to enlist but were refused due to medical reasons to show their willingness to fight.",1594311804.0,"07/09/2020, 16:23:24",1927,2,73651,3669.8002979030716,0.95,0.026163935316560534
272,todayilearned,"TIL that a fearless goat-herding dog called Odin refused to abandon his flock of goats during deadly California wildfires in 2017, while his owners ran to safety. Days later his family returned to their destroyed home and found him AND the goats still alive.",1581105823.0,"02/07/2020, 20:03:43",1106,2,73570,4325.946235879528,0.94,0.015033301617507136
273,todayilearned,"TIL about Amy Rorbach, a reporter for ABC News, who underwent a mammogram live on air in 2013 to promote the procedure for Breast Cancer Awareness month. It was discovered that she did have cancer, and the procedure likely saved her life.",1598278694.0,"08/24/2020, 14:18:14",723,6,73502,3493.649114900676,0.95,0.009836467034910614
274,todayilearned,"TIL death from laughter is a recorded cause of death throughout history. One such instance, an English man laughed for 25 consecutive minutes at a joke on the TV show The Goodies. His widow wrote a letter to the show creators thanking them for making his last moments of life so pleasant.",1591832568.0,"06/10/2020, 23:42:48",1616,1,73311,3817.0997431751603,0.95,0.022043076755193628
275,todayilearned,TIL Italian speakers with dyslexia tend to have less severe reading impairment than English or French speakers due to Italian's simpler and more phonetic spelling.,1602102479.0,"10/07/2020, 20:27:59",2254,22,73163,3465.877427053798,0.95,0.030807922037095252
276,todayilearned,TIL the former Bloods and Crips gang leaders made peace with each other and started an organization to promote peace in their communities. They’re now training former gang members and community leaders to help younger generations.,1574522508.0,"11/23/2019, 15:21:48",1575,2,73109,5314.191925236737,0.93,0.02154317525886006
277,todayilearned,"TIL that the Breaking Bad team was offered $75 million to produce three additional episodes after the final season. This much money was stated to be more than the profits they had made in five years. The team refused, saying that the final episodes did not lend themselves to additional installments.",1596769109.0,"08/07/2020, 02:58:29",2773,3,73095,3559.6541039257136,0.95,0.037936931390655994
278,todayilearned,"TIL Ariana Grande tried to get Japanese tattoo that read ""Seven Rings"" but found out later it read ""Small Charcoal Grill"" and then attempted to correct it, only for it to still be wrong and then read ""Japanese BBQ finger""",1580094628.0,"01/27/2020, 03:10:28",2519,1,72937,9470.970433715935,0.89,0.0345366549213705
279,todayilearned,"TIL in August 1968 after being turned down by 19 other teams, the Atlanta Braves signed 62-year-old pitcher Satchel Paige so he could get his MLB pension. He needed only 158 days on an active roster to reach the five-year minimum required to receive his pension. He collected $250 a month.",1597247206.0,"08/12/2020, 15:46:46",1160,7,72937,3471.820277938721,0.95,0.015904136446522343
280,todayilearned,"TIL that in Return of the Jedi (1983) for the speeder chase, Garrett Brown walked through the forest shooting at less than one frame per second. By walking at about 5 mph and projecting the footage at 24 frame/s, the motion seen in the film appeared as if it were moving at around 120 mph",1599392303.0,"09/06/2020, 11:38:23",1493,46,72922,4801.209587530349,0.94,0.020473931049614657
281,todayilearned,"TIL in 2007, reigning Jeopardy! champion Scott Weiss purposely placed his final bet in such a way as to force the first three-way tie in the game's history. He said he knew he could have bet more and won the game, but thought it would be fun to force a tie instead.",1576461314.0,"12/16/2019, 01:55:14",886,1,72915,3522.361259558267,0.95,0.012151134883083042
282,todayilearned,"TIL almost all shells open on the right-hand side, with the exception of a few snail species whose shells open on the left. If you find a shell that opens on the left (as long as it's from a normally right-hand species), you have a rare shell sometimes highly sought by collectors.",1603026742.0,"10/18/2020, 13:12:22",791,34,72789,4458.750376503231,0.94,0.010867026611163774
283,todayilearned,"TIL there is a method of growing rhubarb known as ""forcing"" where the plant grows in complete darkness and is tended to in candlelight. It grows so quickly during this process that you can hear it grow.",1591759600.0,"06/10/2020, 03:26:40",2242,2,72726,2664.074550038611,0.96,0.030828039490691087
284,todayilearned,"TIL in several Chinese cities, there is a service called ""jam-busting"". Drivers in traffic jams who need to get somewhere urgently call for a couple of people to show up on a motorbike. One stays with your car, and the other puts you on the back of the bike, and blasts off through and around the jam",1601744098.0,"10/03/2020, 16:54:58",1417,26,72717,4181.428660213656,0.95,0.019486502468473672
285,todayilearned,"TIL that in 1937, dancer Patricia Douglas was brutally assaulted at an MGM party. Instead of bartering her silence for a studio contract or cash, Douglas went public with her story and filed a landmark lawsuit. The studio covered up the crime and destroyed her life.",1591882659.0,"06/11/2020, 13:37:39",1321,4,72713,3835.5111403256014,0.95,0.018167315335634617
286,todayilearned,"TIL that during the sinking of the Titanic, a drunken baker helped load women and children into the lifeboats, refused a seat for himself, threw deck chairs overboard for passengers to use as flotation devices, and somehow survived hours swimming in the freezing water until he was rescued at dawn.",1595747100.0,"07/26/2020, 07:05:00",1395,0,72678,2725.19950986364,0.96,0.0191942541071576
287,todayilearned,TIL of a woman who gave her neighbor a ‘box of sex toys’ to hold on to. 6 months later the neighbor noticed a stench coming from her closet where the box was stored. She finally opened it and found a decomposing severed head inside. It was the original woman’s husband.,1584912188.0,"03/22/2020, 21:23:08",1459,0,72671,5303.597292414022,0.93,0.020076784411938737
288,todayilearned,"TIL that since Jason Alexander (George Costanza) is a trained Broadway singer, he had to re-record the famous George answering machine song because he sung it too well; Larry David wanted him to purposely sing terrible to make it sound believable.",1594381293.0,"07/10/2020, 11:41:33",1833,0,72602,4721.944497550736,0.94,0.025247238368089033
289,todayilearned,TIL ‘Nigerian Prince’ scam e-mails are intentionally filled with grammatical errors and typos to filter out all but the most gullible recipients. This strategy minimizes false positives and self-selects for those individuals most susceptible to being defrauded.,1590876638.0,"05/30/2020, 22:10:38",1509,1,72525,5947.289814045333,0.92,0.020806618407445708
290,todayilearned,"TIL The man credited with saving both Apollo 12 and Apollo 13 was forced to resign years later while serving as the Chief of NASA when Texas Senator Robert Krueger blamed him for $500 million of overspending on Space Station Freedom, which later evolved into the International Space Station (ISS).",1581298845.0,"02/10/2020, 01:40:45",1650,0,72301,4031.907422363918,0.95,0.02282126111672038
