,Subreddit,Title,Epoch Time,Date,Comments,Awards,Upvotes,Downvotes,Upvote Ratio,Comment/Upvote Ratio
733,todayilearned,"TIL despite what Bugs Bunny cartoons tell us, carrots are like candy to rabbits and should only be fed as an occasional treat only to them; having too much can result in obesity",1591298324.0,"06/04/2020, 19:18:44",1166,1,50057,3406.689391320797,0.94,0.023293445472161736
734,todayilearned,"TIL - The UK sits under 5 different air masses, creating unpredictable weather patterns and mimicking both tropical and polar climates. Although on the same latitude as Canada the UK often gets rain instead of snow throughout the year and humidity compared to that of a rainforest in summer.",1597222327.0,"08/12/2020, 08:52:07",3585,7,50048,2794.210218428998,0.95,0.07163123401534527
735,todayilearned,"TIL Jack Lukas, USMC Medal of Honor recipient at the age of 17 jumped on 2 grenades. Had 20+ surgeries and 200+ pieces of shrapnel removed, and lived. Then at age 40, jumped out of an airplane and his parachutes didn’t open, and walked away. Still keep going until Leukemia took him at the age of 80.",1580162975.0,"01/27/2020, 22:09:35",955,1,50040,2977.331150834092,0.94,0.019084732214228618
736,todayilearned,TIL that the Mayan people constructed the temples in a way that a handclap at the base of the temple produces an echo that sounds like the call of the sacred Quetzal bird. For them the bird was a messenger of the gods.,1594548424.0,"07/12/2020, 10:07:04",1261,2,49990,2916.616727216933,0.94,0.0252250450090018
737,todayilearned,"TIL that Ted Kaczynski (the Unabomber), Ramzi Yousef (the 1993 World Trade Center bomber), and Timothy McVeigh (the Oklahoma City bomber), all became friends in prison, and regularly discussed religion and politics until McVeigh's execution.",1579288555.0,"01/17/2020, 19:15:55",2397,2,49977,4038.211744158725,0.93,0.04796206254877244
738,todayilearned,TIL that Princess Leia's hair in Star Wars was inspired by women of the Mexican revolution.,1579812912.0,"01/23/2020, 20:55:12",744,2,49962,4804.272665507204,0.91,0.014891317401224931
739,todayilearned,"TIL some Buddhist monks attempt to mummify themselves alive—and at least two dozen have succeeded. The process involves eating only pine needles, resins &amp; seeds to eliminate all body fat, and then slowly reducing liquid intake to zero, thus dehydrating the body and shrinking all organs, until death.",1603221803.0,"10/20/2020, 19:23:23",2030,25,49909,3714.2803540223395,0.93,0.04067402672864614
740,todayilearned,"TIL the first person to register for the first comics con, held in New York in 1964, was George R.R. Martin.",1580329137.0,"01/29/2020, 20:18:57",781,0,49785,3995.81454841957,0.93,0.01568745606106257
741,todayilearned,TIL about the windshield phenomenon. People tend to find fewer insects smashed on the windscreens of their cars now compared to a decade or several decades ago.,1591933375.0,"06/12/2020, 03:42:55",5576,0,49715,4025.978579908311,0.93,0.11215930805591874
742,todayilearned,"TIL in 346BC, Alexander the Great, at the age of 10, after taming a large anxious horse he was allowed to buy it. He named the horse ""Bucephalas"", and he rode the horse until the Battle or Hydapes in 326BC when it died at the age of 30. Alexander later named a city after his steed.",1576173099.0,"12/12/2019, 17:51:39",991,1,49674,3299.2446849194894,0.94,0.019950074485646414
743,todayilearned,"TIL After Czech gymnast Věra Čáslavská lost her training facility due to the Soviet-led invasion of Czechoslovakia, she trained for the 1968 Olympics in the forest using potato sacks as weights and logs as beams. She medaled in all six events, four of them Gold.",1584657710.0,"03/19/2020, 22:41:50",436,0,49641,2689.3447020471067,0.95,0.008783062387945448
744,todayilearned,"TIL of a study in which five octopi were submerged in water laced with MDMA. After absorbing the drug, they proceeded to cuddle with each other, instead of playing with the Star Wars figurines that would normally have intrigued them.",1600260395.0,"09/16/2020, 12:46:35",1526,31,49613,2316.8567157813522,0.96,0.03075806744200109
745,todayilearned,TIL that in Georgia one can be sentenced to banishment from all but one county (a total banishment is unconstitutional). Usually that is Echols which is mostly an unpopulated swamp. Most choose to leave the State instead.,1599239671.0,"09/04/2020, 17:14:31",1497,19,49571,2082.3003132066588,0.96,0.03019910834963991
746,todayilearned,"TIL that the collapse of the Soviet Union directly correlated with the resurgence of Cuba’s amazing coral reef. Without Russian supplied synthetic fertilizers and ag practices, Cubans were forced to depend on organic farming. This led to less chemical runoff in the oceans.",1583294271.0,"03/04/2020, 03:57:51",1566,1,49562,3151.6330779057535,0.94,0.03159678786166821
747,todayilearned,"TIL a study found after a 90 min. workout, athletes who ate organic peanut butter, Clif Shot Bloks, Cytomax powder, PowerBars, &amp; Gatorade showed no difference in insulin, glucose, cholesterol, or triglyceride levels compared to athletes who ate hotcakes, OJ, a hash brown, a hamburger, fries, &amp; Coke.",1585517521.0,"03/29/2020, 21:32:01",2046,2,49547,4622.51379016522,0.91,0.04129412477042001
748,todayilearned,"TIL The longest-reigning monarch in British history, Queen Elizabeth II is the first British monarch to have a sapphire jubilee, marking 65 years of reign. There were no public celebrations and she spent the day in ""quiet reflection"" and undertaking official work",1578983643.0,"01/14/2020, 06:34:03",2346,2,49490,6997.550667421776,0.88,0.04740351586179026
749,todayilearned,TIL about two guys who used a decommissioned Atlas Missile Silo to produce an estimated 90% of the LSD sold in America in the late 90's and early 2000s.,1595496305.0,"07/23/2020, 09:25:05",2004,1,49481,2603.796246873375,0.95,0.040500394090661064
750,todayilearned,"TIL that David Tennant was so popular as the Tenth Doctor in Doctor Who that the BBC considered cancelling the show upon his exit rather than casting a new Doctor, as they thought the show would fail without him.",1590067270.0,"05/21/2020, 13:21:10",2695,0,49405,3208.380814878132,0.94,0.05454913470296529
751,todayilearned,"TIL, there is blood type called ""RH null"", which is called ""golden blood"". This blood is so rare that only 43 people worldwide have it. Its properties make it attractive in numerous medical applications and make it very valuable.",1577155061.0,"12/24/2019, 02:37:41",1440,3,49345,2913.7414334972273,0.94,0.02918228797243895
752,todayilearned,TIL Hugh Hefner paid a Chicago calendar company $500 for a nude images of Marilyn Monroe. These photos launched Playboy in 1953 and helped to create the first edition of the famous magazine. Monroe never posed for Playboy and was never paid directly for the use of the images.,1600137881.0,"09/15/2020, 02:44:41",1811,11,49326,3495.8861538662095,0.93,0.03671491708226898
753,todayilearned,"TIL when Buzz Aldrin, second man on the moon, guest starred in The Simpsons, writers were concerned he would be offended by his line, ""second comes after first,"" and offered an alternative- ""first to take a soil sample."" However, Aldrin preferred the original line, and it remained in the script.",1604048731.0,"10/30/2020, 09:05:31",1121,14,49270,4218.033616928071,0.92,0.02275218185508423
754,todayilearned,"TIL Pharrell Made Only $2,700 In Songwriter Royalties From 43 Million Plays Of ‘Happy’ On Pandora",1579996345.0,"01/25/2020, 23:52:25",2503,2,49195,5571.456883501225,0.9,0.05087915438560829
755,todayilearned,"TIL Atari programmers met with Atari CEO Ray Kassar in May 1979 to demand that the company treat developers as record labels treated musicians, with royalties and their names on game boxes. Kassar said no and that ""anyone can do a cartridge."" So the programmers left Atari and founded Activision",1599088510.0,"09/02/2020, 23:15:10",1202,5,49179,2300.027111364885,0.96,0.024441326582484393
756,todayilearned,"TIL Mel Brooks was a producer on the movie The Elephant Man, but his name was intentionally uncredited as to not lead audiences to believe the film was a comedy",1585793556.0,"04/02/2020, 02:12:36",504,0,49117,3281.209621286209,0.94,0.010261213021967953
757,todayilearned,"TIL: Raccoons are not native to Germany. They were brought there in the 1920s for their pelts. During World War II, an Allied bomb hit a raccoon farm wall, allowing a dozen or so to escape. Today, German cities are being overrun by millions of raccoons!",1591722393.0,"06/09/2020, 17:06:33",1551,0,49097,2788.0304302964287,0.95,0.03159052487932053
758,todayilearned,"TIL that ants are amongst the few animals who passed the mirror test, which is a strong evidence of self-recognition, and indicates the possibility of self-awareness (i.e. a “sense of self”).",1583933861.0,"03/11/2020, 13:37:41",1601,0,49056,3937.7134133641666,0.93,0.03263617090671885
759,todayilearned,TIL For the first Superman movie producers wanted Christopher Reeve to wear fake muscles under the suit but he refused. He instead started an intense two-month training program which added 14kg to his 86kg frame. He got so big they had to reshoot earlier scenes as they didn’t match the later shots.,1601273623.0,"09/28/2020, 06:13:43",1507,14,49041,2431.1863629903237,0.95,0.030729389694337392
760,todayilearned,TIL that Kevin Smith donated all future residuals from Weinstein-made films to Women in Film charity.,1574985247.0,"11/28/2019, 23:54:07",919,1,49032,6175.854090918365,0.89,0.018742861804535813
761,todayilearned,"TIL An outbreak of Syphilis caused a surge in Wigmaking. Wigs covered up baldness and head sores caused by Syphilis. Powdered Wigs were popular because the powder contained lavender or orange, to cover up bad smells.",1575288200.0,"12/02/2019, 12:03:20",1577,0,49005,2651.660602597767,0.95,0.03218038975614733
762,todayilearned,"TIL Despite its association with the supernatural, a full moon rarely occurs on Halloween. The next time this will happen is Halloween night of 2020.",1592689043.0,"06/20/2020, 21:37:23",1484,1,48972,3927.1040131020345,0.93,0.030303030303030304
763,todayilearned,"TIL despite the Romans using lead water pipes, lead poisoning from the water supply system was almost nonexistent since the high calcium content in their water created a layer of plaque preventing the water contacting the lead itself.",1588109292.0,"04/28/2020, 21:28:12",1412,0,48962,1880.815911968195,0.96,0.02883869122993342
764,todayilearned,"TIL that American newspaper ""the New York Post"" was originally founded by Alexander Hamilton and was a respected publication. It wasn't until the 1970s when it became a tabloid.",1597075806.0,"08/10/2020, 16:10:06",1708,1,48954,4914.025890664925,0.91,0.034889896637659845
765,todayilearned,"TIL that in 1939, radio station WJSV in Washington, DC recorded their entire 19-hour broadcast day for historic purposes. It contains the only known recordings of a number of programs from the Golden Age of Radio. It is now in the National Recording Registry and is available free, streaming online.",1575117857.0,"11/30/2019, 12:44:17",682,1,48928,2453.1214385608764,0.95,0.01393884892086331
766,todayilearned,"TIL In order to convince Robin Williams to play the Genie in Aladdin (1992), Disney hired an animator to draw and lip-sync the Genie performing Williams’ own stand-up comedy. Williams was so impressed that he signed on immediately.",1598889643.0,"08/31/2020, 16:00:43",525,6,48860,3072.7550782228354,0.94,0.010744985673352435
767,todayilearned,"TIL the British Library must store one copy of every single book published in the UK and Ireland. It houses over 200,000,000 publications, adds 6 miles (9.65 km) of new shelf space a year, and receives over 8000 new publications each day",1593075013.0,"06/25/2020, 08:50:13",1122,0,48856,2027.525490645894,0.96,0.02296544948419846
768,todayilearned,"TIL In April of 1996, Taco Bell announced in seven leading U.S. newspapers, including the New York Times, that the company had purchased the Liberty Bell to ""reduce the country's debt"" and renamed it the ""Taco Liberty Bell"". Outraged people were happy to hear that it was an April Fools Day prank.",1604087354.0,"10/30/2020, 19:49:14",539,14,48835,4283.7213645461015,0.92,0.011037165967031842
769,todayilearned,"TIL that in the film Candyman, Tony Todd negotiated a fee of $1000 for each time he was stung during the bee scene. He walked away with $23000.",1577757873.0,"12/31/2019, 02:04:33",774,2,48744,3465.696184027598,0.93,0.01587887740029542
770,todayilearned,TIL There are almost no mosquitoes in Disney World (Florida) even though it is in a swampy territory abundant with bugs. They have a sophisticated mosquito surveillance program to try and eliminate them quickly.,1584797014.0,"03/21/2020, 13:23:34",1338,0,48739,2807.76098033959,0.95,0.02745234822216295
771,todayilearned,TIL about Eddie the Otter. Eddie was a multi talented Otter famous for being able to dunk basketballs and suck his own penis. He died peacefully at the age of 20.,1603093029.0,"10/19/2020, 07:37:09",1089,86,48704,5672.988094239219,0.9,0.02235955978975033
772,todayilearned,"TIL that the Statue of Liberty is walking, and has a broken chain at her feet",1600390819.0,"09/18/2020, 01:00:19",1329,28,48658,3433.229516702442,0.93,0.027313083151794156
773,todayilearned,"TIL in 1817 a woman posed as the fictional Princess Caraboo of Javasu. She fooled a small British town for months into believing she was a princess who had been captured by pirates, jumped overboard in the British Channel and swam ashore. She was later recognised as a cobbler's daughter from Devon.",1604142099.0,"10/31/2020, 11:01:39",534,7,48650,2779.131823873715,0.95,0.010976361767728674
774,todayilearned,TIL: Sir George Everest did not want Mount Everest named after him. He objected that his surname could not be written in the Hindi language and that it was difficult for the locals to pronounce.,1583411540.0,"03/05/2020, 12:32:20",1198,2,48528,2125.1853132140604,0.96,0.02468677876689746
775,todayilearned,"TIL despite Christians making up only 1.5% of the population of Japan, the majority of Japanese people are married in a Christian ceremony. By contrast, the traditional Shinto ceremony makes up only 1 in 6 Japanese weddings.",1598706146.0,"08/29/2020, 13:02:26",1639,4,48521,2295.9568772481143,0.95,0.03377918839265473
776,todayilearned,"TIL that from 1513 to 1972, the Danish Kings were named Christian, Frederick, Christian, Frederick, Christian, Frederick, Christian, Frederick, Christian, Frederick, Christian, Frederick, Christian, Frederick, Christian, Frederick, Christian, Frederick (it ended with the current monarch, a Queen)",1596015693.0,"07/29/2020, 09:41:33",945,0,48513,2367.4877652259456,0.95,0.019479314822830995
777,todayilearned,"TIL since the studio didn’t have enough budget to shoot Riddick (2013). Vin Diesel had to mortgage his house, obtain loans and spend most of his own money on the production",1575682428.0,"12/07/2019, 01:33:48",1696,0,48517,3055.742745619391,0.94,0.03495681925922872
778,todayilearned,Today I learned that Ringo Starr was the narrator for Thomas the Tank Engine from 1984-1990.,1574888737.0,"11/27/2019, 21:05:37",1105,1,48499,5930.5364779482625,0.89,0.02278397492731809
779,todayilearned,"TIL of Ken Allen, a Borneo orangutan in the San Diego Zoo who escaped his enclosure three times. He never acted aggressively towards anyone during his escapes, and generally wandered around the zoo looking at other animals.",1602953680.0,"10/17/2020, 16:54:40",1122,31,48453,1877.0125361783503,0.96,0.023156460900253854
780,todayilearned,TIL That the U.S. First Lady in 1885 - 86 was a lesbian. Rose Cleveland served as the First Lady for her brother who was unmarried. She carried on a relationship for more than 30 years with Evangeline Whipple until Rose died of the Spanish Influenza in 1918.,1584321330.0,"03/16/2020, 01:15:30",997,1,48389,4540.158081710426,0.91,0.0206038562483209
781,todayilearned,"TIL Danish Astronomer Tycho Brahe owned roughly one percent of all the money in Denmark, wore a nose made of gold after losing his own in a duel and had a pet moose that he sent out to attend parties in his place until it one night got so drunk that it fell down a flight of stairs and broke its neck",1585259786.0,"03/26/2020, 21:56:26",1045,3,48363,1957.4662253778442,0.96,0.021607427165395033
782,todayilearned,TIL Singer Rod Stewart took cocaine anally to protect his singing voice. Stewart bought anticold capsules; removed the contents; filled the empty capsules with cocaine; and put them up his butt to be absorbed.,1604951635.0,"11/09/2020, 19:53:55",1925,12,48450,3479.9195260193083,0.93,0.03973168214654283
783,todayilearned,TIL that a fisherman in Florida hooked a swordfish so big that it dragged his boat for 20 miles and fought for eight hours before he could pull it in. It turned out to be the biggest swordfish ever caught in Florida waters.,1574619966.0,"11/24/2019, 18:26:06",2287,0,48268,6147.472260490533,0.89,0.047381287809729014
784,todayilearned,"TIL JFK was stranded on a desert island during WWII, and eventually rescued thanks to a coconut he had carved a distress message into. He later displayed this coconut in the Oval Office.",1602175975.0,"10/08/2020, 16:52:55",1090,21,48262,2662.818694935704,0.95,0.022585056566242594
785,todayilearned,"TIL in 1924, a Russian scientist started blood transfusion experiments, hoping to achieve eternal youth. After 11 blood transfusions, he claimed he had improved his eyesight and stopped balding. He died after a transfusion with a student suffering from malaria and TB (The student fully recovered).",1579087894.0,"01/15/2020, 11:31:34",1345,0,48223,2600.0476907100747,0.95,0.02789125521016942
786,todayilearned,"TIL a German company developed a pane glass for windows that replicates the way birds see spiders' webs so they will avoid flying into them, thus greatly reducing the high avian death rate caused by collision with building windows",1589561069.0,"05/15/2020, 16:44:29",578,2,48184,1993.0691598878257,0.96,0.01199568321434501
787,todayilearned,"TIL that in the 80s, businessman Armand Hammer bought a significant portion of the company that makes ""Arm &amp; Hammer"" products simply because people kept asking him about the name",1576780593.0,"12/19/2019, 18:36:33",653,1,48185,2742.1360088075307,0.95,0.01355193524955899
788,todayilearned,"TIL Early in his career, H.B. Reese, inventor of the Reese's Peanut Butter Cup, created two nearly identical candy bars. The ""Lizzie Bar"" was named after his oldest daughter and the ""Johnny Bar"" was named after his son. The only difference between the two was that the Johnny Bar had nuts.",1592315244.0,"06/16/2020, 13:47:24",732,0,48120,2972.5346205417154,0.94,0.015211970074812968
789,todayilearned,TIL that turkeys will attack or attempt to dominate humans they view as subordinate,1594284968.0,"07/09/2020, 08:56:08",2280,3,48068,2048.313450707028,0.96,0.04743280352833486
790,todayilearned,"TIL that opossum’s eat 95% of all ticks they come across — up to 5,000 a year!",1593779459.0,"07/03/2020, 12:30:59",1017,1,48052,3346.92286288819,0.93,0.021164571713976524
791,todayilearned,"TIL Saran Wrap isn't as ""clingy"" is because it used to have a toxic chemical in it and they voluntarily removed it, costing them almost half their market share",1588256173.0,"04/30/2020, 14:16:13",1433,0,47963,5125.556112468468,0.9,0.029877197006025476
792,todayilearned,"TIL that the Brontosaurus was thought to be a mistake, the creature had never existed. The animal was actually an Apatosaurus, a previously discovered dinosaur, and it should have had that name. Now it's been discovered that they actually are two separate animals, and the Brontosaurus exists again.",1585579154.0,"03/30/2020, 14:39:14",1142,0,47918,2357.843882886569,0.95,0.023832380316373806
793,todayilearned,"TIL in 2015, a guide dog in New York was awarded the ASPCA’s “Dog of the Year” award for running in front of an oncoming bus to protect his blind owner, and didn’t leave her side until she received medical attention even though he suffered a broken leg.",1581467257.0,"02/12/2020, 00:27:37",608,3,47901,2561.463072473598,0.95,0.012692845660842153
794,todayilearned,"TIL of the “Buckskin Girl” murdered 40 years ago, and unable to be identified but named after her coat. In 2017 an unrefrigerated lab vial of her blood was successfully DNA analysed. Her mother was located still living in the same house, refusing to move or change phone numbers hoping for her return",1595048902.0,"07/18/2020, 05:08:22",703,0,47850,1791.1018623294367,0.96,0.014691745036572623
795,todayilearned,"TIL The rarest natural hair color in the world is red, with only 1-2% of the world population having natural red hair. Second is blond, with 3%, then brown/brunette, with 11%, and finally black with 75-85%.",1587406294.0,"04/20/2020, 18:11:34",4040,0,47828,4734.060807695045,0.91,0.08446934849878732
796,todayilearned,TIL When The Empire Strikes Back debuted in 1980 some showings were preceded by the short film Black Angel which was directed by Star Wars art director Roger Christian. The film was thought lost for decades but has since been recovered and is available on YouTube.,1574079492.0,"11/18/2019, 12:18:12",793,0,47817,2996.5090258517157,0.94,0.01658406006232093
797,todayilearned,"TIL Seinfeld was assigned to an inexperienced NBC executive and intentionally broke many sitcom stereotypes: Jerry and Elaine's relationship never blossomed, it offers no growth or reconciliation to its characters, and even Susan's death elicits no genuine emotions from anybody in the show.",1595622416.0,"07/24/2020, 20:26:56",2023,1,47794,4299.711411131437,0.92,0.042327488806126294
798,todayilearned,"TIL in The Land Before Time, the dinosaur Rooter consoles Littlefoot after his mother dies. This scene was added at the advice of psychologists to soften the blow, showing that death is something that Littlefoot, and the audience, have to deal with.",1595880792.0,"07/27/2020, 20:13:12",1268,1,47785,2648.5914271477086,0.95,0.02653552369990583
799,todayilearned,"TIL the first artifical sweetener Saccharin was discovered on accident when a chemist forgot to wash his hands after work and tasted something ""unspeakably sweet"" during supper. He dropped his dinner and went on to taste every beaker in his lab, which luckily for him contained nothing poisonous.",1596204284.0,"07/31/2020, 14:04:44",1151,0,47776,2354.4914960137685,0.95,0.024091594105827195
800,todayilearned,"TIL that when the Japanese emperor announced Japan's surrender in WW2, his speech was too formal and vague for the general populace to understand. Many listeners were left confused and it took some people hours, some days, to understand that Japan had, in fact, surrendered.",1579787512.0,"01/23/2020, 13:51:52",1935,2,47709,3806.6018212352064,0.93,0.04055838521033767
801,todayilearned,"TIL: in 1978, 2,300 students tried to set a WR for the largest tug of war game. Instead, disaster ensued. The 2,000ft long braided nylon rope snapped, recoiling several thousand pounds of stored energy. Nearly 200 students lay wounded, 5 with severed fingertips, hundreds more faced 2nd degree burns.",1593731084.0,"07/02/2020, 23:04:44",1373,0,47666,1890.6416739803317,0.96,0.028804598665715605
802,todayilearned,TIL: the popular Sriracha sauce in the US (in the green-capped bottle) tastes different because they have a different supplier of chile peppers. The owner sued the original supplier for $1 million claiming he overpaid. The farmer countersued and won $23.3 million and now makes his own sriracha.,1586128390.0,"04/05/2020, 23:13:10",1762,0,47634,3380.0316649184315,0.93,0.036990385019104004
803,todayilearned,"TIL that in the mid-1990s, a man in Montana was able to build fully armed Cobra attack helicopters out of supposedly demilitarized military surplus parts. He then used them to hunt coyotes.",1598373967.0,"08/25/2020, 16:46:07",1679,15,47632,2408.208720821858,0.95,0.03524941215989251
804,todayilearned,"TIL that Leah Betts, a girl that made headlines after dying from taking a single ecstasy pill, didn’t actually die directly from taking the drug, but instead from drinking 7 litres of water in 90 minutes. Ecstasy causes water retention, making even slightly high water consumption fatal.",1573982298.0,"11/17/2019, 09:18:18",2804,1,47535,4072.2215489203663,0.92,0.058988114021247505
805,todayilearned,"TIL that Mel Blanc, the voice of Barney Rubble, suffered a car crash during production of Season 1 and so the actors would crowd around his hospital bed to record lines while the producers used a built in speaker to direct. Around forty episodes were recorded in such a manner.",1579006538.0,"01/14/2020, 12:55:38",752,0,47399,2530.151315019066,0.95,0.01586531361421127
806,todayilearned,"TIL The Hoovers both spoke Mandarin. In the White House they would speak in Mandarin to avoid eavesdroppers. To date, Lou Hoover is the only First Lady to speak an Asian language. They were also well versed in Latin; working together to translate ""De Re Metallica"" a 16th century mining textbook.",1595331739.0,"07/21/2020, 11:42:19",1169,1,47376,2317.208456721084,0.95,0.024674940898345155
807,todayilearned,"TIL that in 1920, the town of Jackson, Wyoming elected an all-female town council by a margin of 2-1 over the men, drawing the most voters the town had ever seen. Known as the ""pettycoat rulers,"" the women served for 3 years and did a great deal to clean up the notoriously lawless town.",1603492538.0,"10/23/2020, 22:35:38",594,13,47264,4576.896780423987,0.91,0.012567704807041299
