,Subreddit,Title,Epoch Time,Date,Comments,Awards,Upvotes,Downvotes,Upvote Ratio,Comment/Upvote Ratio
0,todayilearned,"TIL During an interview with Stephen Hawking, the camera operator yanked a cable causing an alarm and Hawking to slump forward. Worried they had killed him, everyone rushed over to find Hawking giggling at his own joke. The alarm was from an office computer losing power.",1592530504.0,"06/19/2020, 01:35:04",1819,16,154764,6059.080453748436,0.96,0.011753379338864335
1,todayilearned,TIL the FBI has struggled to hire hackers because of the FBI hiring rule that the applicant must not have used marijuana during the last 3 years.,1589462742.0,"05/14/2020, 13:25:42",7915,5,151334,5495.255118517613,0.96,0.05230153171131405
2,todayilearned,"TIL a fan drove three hours to deliver rapper, Boozie Badazz, a much needed dosage of insulin. She refused to accept payment and instead asked for just a photo. On her way home she stopped at a store, bought a scratch off ticket, and won $10,000.",1597278293.0,"08/13/2020, 00:24:53",3195,14,146970,13243.537109641678,0.92,0.021739130434782608
3,todayilearned,"TIL actor Robert Pattinson dealt with an obsessed fan who had been camping outside his apartment by taking her out on a dinner date. ""I just complained about everything in my life and she never came back.""",1576428431.0,"12/15/2019, 16:47:11",2767,4,144876,6891.167983657622,0.95,0.019099091636986112
4,todayilearned,"TIL that millennial dads are spending 3 times as much times with their kids than their fathers spent with them. Back in 1982, 43% of fathers admitted they'd never changed a diaper. Today, that number is down to about 3%.",1578146348.0,"01/04/2020, 13:59:08",7080,18,144417,9190.410604681529,0.94,0.049024699308253185
5,todayilearned,TIL The cast of FRIENDS each made $1M per episode in the final two seasons and now make $20M per year per cast member for reruns. The show still generates $1B/year for Warner Bros. All thanks to David Schwimmer encouraging the cast to negotiate as a team.,1597110829.0,"08/11/2020, 01:53:49",5588,30,142011,11031.88890467622,0.93,0.039349064509087324
6,todayilearned,"TIL a waitress was tipped a lottery ticket and won $10,000,000. She was then sued by her colleagues for their share. Then she was sued by the man who tipped her the ticket. Then she was kidnapped by her ex husband, and shot him in the chest. Then she went to court against the IRS.",1587427683.0,"04/21/2020, 00:08:03",5716,2,139545,6315.865480780136,0.96,0.04096169694363825
7,todayilearned,"TIL Costco's hot dog has remained $1.50 since it was first introduced in 1984. After the company president complained they were losing money on it, CEO Jim Sinegal put his foot down. ""If you raise [the price of] the effing hot dog, I will kill you,"" Sinegal said.",1600699667.0,"09/21/2020, 14:47:47",6381,318,137524,9755.78179917761,0.93,0.046399173962362934
8,todayilearned,"TIL Romans were known to create tombs for their dogs and gave them epitaphs to remember them by. One such inscription read, “I am in tears, while carrying you to your last resting place as much as I rejoiced when bringing you home with my own hands 15 years ago.”",1580425174.0,"01/30/2020, 22:59:34",2559,15,134813,6868.885090120981,0.95,0.01898184893148287
9,todayilearned,"TIL many doctors have stopped calling cancer treatment a ""fight"" or ""battle"". They argue these terms misrepresent how treatment works and if treatments fail, the patient is left with guilt and a false belief they didn't ""fight"" hard enough.",1593535190.0,"06/30/2020, 16:39:50",2259,9,132173,7618.560717121058,0.95,0.017091236485515197
10,todayilearned,"TIL that everyone in Singapore above the age of 21 is automatically registered as an organ donor. Opting out from this Act will result in you being put at the very bottom of the organ priority list, should you need an organ transplantation.",1594896534.0,"07/16/2020, 10:48:54",3809,2,126067,9270.345883903705,0.93,0.030214092506365663
11,todayilearned,"TIL BBC journalists requested an interview with Facebook because they weren't removing child abuse photos. Facebook asked to be sent the photos as proof. When journalists sent the photos, Facebook reported the them to the police because distributing child abuse imagery is illegal.",1576597607.0,"12/17/2019, 15:46:47",4508,7,125844,5499.824623194756,0.96,0.035822128985092655
12,todayilearned,"TIL Canadian researchers watched 40 episodes of 'The Dr. Oz Show' and found that nearly 40% of the medical advice is not evidence-based, and 15% goes directly against evidence.",1586460760.0,"04/09/2020, 19:32:40",2501,2,125768,7275.875466423051,0.95,0.019885821512626422
13,todayilearned,"TIL “Military Grade” is just a marketing ploy. In the actual military, “military grade” means “meeting the bare-minimum requirements of durability, while also costing the least.”",1596124326.0,"07/30/2020, 15:52:06",5380,5,125474,9486.411724930134,0.93,0.042877408865581716
14,todayilearned,"TIL: This year, the official Yu Gi Oh tournament hosted by Konami instituted a hygiene clause to rulebook. This allows judges to penalize players with dirty clothing or terrible odor by giving them a loss. Super Smash Bros tournament have also started implementing similar rules.",1575143795.0,"11/30/2019, 19:56:35",6718,2,125247,6665.5290312345605,0.95,0.05363801128969157
15,todayilearned,"TIL Dr. Phil lost his license to practise psychology in 2006. Therefore, all guests on his TV show must sign a contract stating they are only there to receive ""advice"" from an individual, not a psychologist.",1586278943.0,"04/07/2020, 17:02:23",2835,0,119377,6669.333804152149,0.95,0.023748293222312505
16,todayilearned,TIL Six Georgia inmates out on work detail saved a Deputy Sheriff who collapsed unconscious. They could have taken his gun &amp; fled with the work van but used the Deputy's phone to call 911. The Sheriff's Office gave the men a pizza party with homemade dessert &amp; recommended reduced sentences.,1588518781.0,"05/03/2020, 15:13:01",2702,2,116365,6966.992956798393,0.94,0.02322004039015168
17,todayilearned,"TIL a Georgia teacher who bought a $400 travel insurance policy was rewarded $10,000 because she read the fine print of the contract. After reading to page 7, she saw a “Pays to Read” bit that said the first to email and mention the fine print contest would win 10K.",1581896484.0,"02/16/2020, 23:41:24",1859,2,115720,6397.123791554914,0.95,0.016064638783269962
18,todayilearned,"TIL in 1980 the FBI formed a fake company and attempted to bribe members of congress. Nearly 25% of those tested accepted the bribe, and were convicted",1603299005.0,"10/21/2020, 16:50:05",4126,77,115614,6610.329303006321,0.95,0.035687719480339754
19,todayilearned,"TIL a very frugal librarian, the late Robert Morin, left millions of his life savings to the University of New Hampshire where he worked as a librarian, then the University spent $1 million dollars of that money on a scoreboard for a new football stadium.",1602631477.0,"10/13/2020, 23:24:37",4645,85,114597,12683.580757879186,0.9,0.04053334729530442
20,todayilearned,"TIL That while filming Tokyo Drift, they couldn't get a permit to film a scene. They filmed it anyway, and the studio hired a fall guy to claim to be the director and spend a night in jail.",1595160182.0,"07/19/2020, 12:03:02",1919,3,114320,4917.722129737114,0.96,0.016786214135759273
21,todayilearned,"TIL United Airlines had assured a blind woman that they would help her off the plane but only after the other passengers had gotten off, before forgetting about her and locking the plane up with her in it after everybody else had left.",1597317165.0,"08/13/2020, 11:12:45",2968,14,113502,7466.91269771113,0.94,0.026149318954732076
22,todayilearned,"TIL a New Jersey man bought a $5 bottle of orange juice from Shoprite; his wife said it was too expensive and sent him back to return it, because it was on sale for $2.50 elsewhere. He then decided to buy 2 lottery tickets with the cash refunded from the OJ; he won $315.3 million.",1584917554.0,"03/22/2020, 22:52:34",1366,1,113224,10149.413379661884,0.92,0.012064579947714265
23,todayilearned,TIL 29-yr-old Marine veteran Taylor Winston stole a truck to drive victims of the Las Vegas shooting to the hospital. He and his girlfriend made 2 trips having to pick only the most critically injured 10 - 15 people each time after helping boost others over a fence away from the shooter.,1586612810.0,"04/11/2020, 13:46:50",2615,6,113046,8434.0268433108,0.93,0.023132176282221396
24,todayilearned,"TIL Garden Veggie Straws, which shows fresh vegetables on the bag, and are promoted as a healthy alternative to chips, are actually made of salt, starch, and tomato paste. They have less nutrition than actual potato chips and the manufacturer, which has a history of false claims, is now being sued.",1585154353.0,"03/25/2020, 16:39:13",3039,3,112819,6249.227424906567,0.95,0.026936952109130555
25,todayilearned,"TIL that Jimmy Carter is the longest-lived president, the longest-retired president, the first president to live forty years after their inauguration, and the first to reach the age of 95.",1581628539.0,"02/13/2020, 21:15:39",3582,4,112530,10073.161873069475,0.92,0.03183151159690749
26,todayilearned,"TIL that Persian King Agha Mohammad Khan ordered the execution of two servants for being too loud. Since it was a holy day, he postponed their execution by a day and made the servants return to their duties. They murdered the king in his sleep that night.",1600643770.0,"09/20/2020, 23:16:10",2583,87,111042,4180.239690259827,0.96,0.02326146863349003
27,todayilearned,"TIL The ashes of Stephen Hawking were buried between the graves of Isaac Newton and Charles Darwin, in a section of Westminster Abbey known as the ""Scientists Corner."" As a final tribute, during the burial, the European Space Agency beamed recordings of Hawking's voice to the nearest black hole.",1599699150.0,"09/10/2020, 00:52:30",1548,149,110329,5265.276555254139,0.95,0.014030762537501473
28,todayilearned,"TIL in Lord of War starring Nicholas Cage, they bought 3000 real guns for the filming because it was cheaper to buy real guns and resell later than buying props. They also rented 50 tanks which were only available for a short period because the source had to sell them to Libya later",1593161052.0,"06/26/2020, 08:44:12",2382,2,109999,5234.595483966739,0.95,0.021654742315839234
29,todayilearned,"TIL Dogs get sprayed by Skunks so often because Skunks lift their tails as a warning, Dogs see this as ""Come smell my butt"" which is the EXACT OPPOSITE MESSAGE from what the Skunk is trying to send.",1583966949.0,"03/11/2020, 22:49:09",1283,3,109347,5611.378272438553,0.95,0.011733289436381428
30,todayilearned,"TIL that an outlaw isn't any mere criminal, but rather a criminal who has been sentenced to be ""outside of the protection of the law"". He has no right to trial, and can be killed or persecuted by anybody.",1589637480.0,"05/16/2020, 13:58:00",2764,3,108950,4152.256847670258,0.96,0.02536943552088114
31,todayilearned,"TIL in 1995, France found a man guilty of killing a teen girl, but he was able to avoid sentencing by hiding out in Germany. In 2009, the victim's father hired a team to kidnap the killer out of Germany and dump him in front of a French courthouse. It worked, and he is now serving 15 years.",1580918506.0,"02/05/2020, 16:01:46",3205,0,108916,4344.9121635406045,0.96,0.02942634690954497
32,todayilearned,"TIL the founder of Hyundai was born to an impoverished family of peasants in what is now North Korea. In 1998, he sent 1001 cows to his hometown in North Korea as a repayment 1000 times over for a cow that he stole in the early 1930s to afford his train ticket to Seoul and escape from poverty.",1603631505.0,"10/25/2020, 13:11:45",1787,66,108653,7725.565834366556,0.93,0.0164468537454097
33,todayilearned,"TIL that in “Forrest Gump,” when his microphone is cut off at the rally, what you don’t hear him say is “Sometimes when people go to Vietnam, they go home to their mommas without any legs. Sometimes they don’t go home at all. That’s a bad thing. That’s all I have to say about that.”",1596735002.0,"08/06/2020, 17:30:02",2898,4,108558,10277.452588845554,0.91,0.026695407063505223
34,todayilearned,TIL a guide dog named Roselle led a group of people including her blind owner down 78 flights of stairs before the North Tower collapsed on 9/11. She only stopped to give kisses to a woman who was having a panic attack.,1592435615.0,"06/17/2020, 23:13:35",1241,10,108541,7364.596668869752,0.94,0.011433467537612515
35,todayilearned,"TIL that the firm Cantor Fitzgerald lost 658 employees on 9/11. The CEO, who was taking his child to school that day, later distributed $180 million to the families and offered jobs to all children of the victims. 57 of those children were employed by Cantor Fitzgerald as of 2016.",1592993805.0,"06/24/2020, 10:16:45",2333,7,108407,7429.5661580174055,0.94,0.021520750505041188
36,todayilearned,"TIL after writing the main riff of Seven Nation Army, Jack White planned to save it in case he was ever asked to write a James Bond theme. Deciding this was unlikely to happen, he recorded the song anyways. Five years later, he was asked to write the theme song for the Bond film Quantum of Solace.",1593363881.0,"06/28/2020, 17:04:41",2027,2,108162,7498.422813958139,0.94,0.01874040790665853
37,todayilearned,"TIL After Martin Luther King was killed in 1968, his funeral was held at Morehouse College in Atlanta, Georgia, and a small group of current students were chosen to be ushers for his funeral. One of those ushers was Samuel L. Jackson.",1592052595.0,"06/13/2020, 12:49:55",1481,3,107299,8418.715253221642,0.93,0.013802551747919365
38,todayilearned,TIL Gordon Ramsay set up a business inside a London prison that taught inmates how to bake and sold the goods on the outside. Providing the prison with financial support while giving the inmates work experience they could use to find honest work after their sentence.,1604936211.0,"11/09/2020, 15:36:51",1981,119,107239,14937.19280444269,0.88,0.018472757112617613
39,todayilearned,"TIL only three people in the nation were qualified to hand-pack the parachutes for Apollo 15. Their expertise was so vital, they were not allowed to ride in the same car together for fear that a single auto accident could cripple the space program.",1576797392.0,"12/19/2019, 23:16:32",1590,3,106258,4417.921045838419,0.96,0.014963579212859268
40,todayilearned,"TIL: Teddy Roosevelt was chosen as Vice President due to his support of anti-trust reform, and conservatives knew the VP had little power. Six months into the term, President McKinley was assassinated and Roosevelt became President, ushering in an unprecedented era of anti-trust and labor reforms.",1598571410.0,"08/27/2020, 23:36:50",3268,43,106000,7551.996361700891,0.93,0.030830188679245283
41,todayilearned,TIL the Hawaiian island of Kauai encourages tourists to check a dog out of shelters for a day as part of a field trip for dogs program. Having the dogs out and about gives them exercise and increases their chances of getting adopted by a local.,1604874147.0,"11/08/2020, 22:22:27",998,172,105985,6869.739497612842,0.94,0.009416426852856536
42,todayilearned,"TIL a local folk remedy in Boho, Ireland was to place soil from the local church under a pillow while you slept to cure infections. In 2018 a microbiologist found the churchyard's soil contains a previously unknown strain of streptomyces which can be used to create antibiotics",1590105125.0,"05/21/2020, 23:52:05",2005,4,105418,6163.916768506213,0.94,0.019019522282722117
43,todayilearned,"TIL Jim Carrey was the first actor to have three films go straight to number one in the same year. The year was 1994, and the films were The Mask, Ace Ventura: Pet Detective, and Dumb and Dumber.",1598635814.0,"08/28/2020, 17:30:14",3157,41,104772,7192.680311798074,0.94,0.030132096361623336
44,todayilearned,"TIL a suicide bomber with explosives in his laptop boarded the Somali owned Daallo Airlines in 2016 intending to blow the whole aircraft. Twenty minutes after the takeoff, the bomb exploded, creating a hole in the plane, and the suicide bomber was sucked out of the plane. He was the only fatality.",1594392265.0,"07/10/2020, 14:44:25",1865,4,104773,4642.5063051542675,0.96,0.017800387504414306
45,todayilearned,"TIL Seth Putnam, lead singer of the grindcore band Anal Cunt, wrote a song making fun of comatose people called ‘You’re in a Coma’. Putnam himself was in a coma years later, and after waking remarked that “being in a coma was just as fuckin’ stupid as I wrote it was”.",1594161336.0,"07/07/2020, 22:35:36",3144,3,104556,8922.847833088934,0.92,0.03007001032939286
46,todayilearned,"TIL The bellybutton is so dirty scientists are finding new unknown bacteria. One person had bacterium previously found only on Japanese soil, where he had never been.",1584739065.0,"03/20/2020, 21:17:45",3466,7,103114,6229.703775541449,0.94,0.03361328238648486
47,todayilearned,"TIL: You are less likely to die during an economic depression. This is mostly attributed to cleaner air, reduced traffic, and fewer dollars spent on vices like tobacco and alcohol.",1584565319.0,"03/18/2020, 21:01:59",2062,0,103034,10908.050981580236,0.9,0.020012811305006116
48,todayilearned,"TIL that “TurboTax Free” is not actually free, but “TurboTax Free File” actually IS free (if you make under 36k). This was done to purposefully mislead the public into paying for a service that should be free according to the IRS.",1596383606.0,"08/02/2020, 15:53:26",2853,7,102925,6963.880350347754,0.94,0.02771921301918873
49,todayilearned,"TIL 22-yr-old Canadian man John McCue took it upon himself to fill potholes with the sign: ""I filled the potholes. Pay me instead of your taxes."" Drivers gave him cash, coffee and joints for filling in potholes.",1583077743.0,"03/01/2020, 15:49:03",2301,5,102887,5081.067304912533,0.95,0.022364341461992284
50,todayilearned,TIL learned that in 1985 a guy programmed his computer to call Jerry Falwell Sr's toll free prayer line every 30 seconds for 8 months. It clogged up the lines and cost them over $750k in reverse charges.,1598310132.0,"08/24/2020, 23:02:12",2260,64,102654,11646.745923465802,0.9,0.022015703236113546
51,todayilearned,TIL that in 2020 two rival Drug Cartels Decided to have a friendly soccer Match. The match ended with 16 deaths and 5 injuries,1597060562.0,"08/10/2020, 11:56:02",2950,17,102519,6105.341473682231,0.94,0.028775153873916055
52,todayilearned,"TIL Ghostbusters actor Ernie Hudson, who played Winston Zeddemore, auditioned as the voice for the same character in the animated series but was rejected because they didn't think he sounded enough like Winston from the movie.",1596798392.0,"08/07/2020, 11:06:32",1667,0,102243,6676.180176972062,0.94,0.01630429467053979
53,todayilearned,"TIL while Sharon was giving up, sick in bed with cancer, Ozzy asked Robin Williams to visit her. He hopped in her sick bed randomly and apparently her family went from crying to peeing themselves laughing in a second. She loved it and went from giving up to chemo the next day.",1598939179.0,"09/01/2020, 05:46:19",1584,79,102052,11684.401706652861,0.9,0.015521498843726727
54,todayilearned,"TIL in 2012, a burger king employee anonymously posted an image on 4-chan of him putting his feet in lettuce, with the caption: ""This is the lettuce you eat at Burger King."" It took 20 minutes for people to track down the branch the employee worked at and contact the news. He was promptly fired.",1576501554.0,"12/16/2019, 13:05:54",4163,1,101819,8354.830308808363,0.92,0.040886278592404166
55,todayilearned,"TIL that even though Philo Farnsworth, the inventor of electronic television, was disappointed by it for most of his life, he changed his mind the day he saw Neil Armstrong walk on the Moon thanks to his invention, telling his wife ""this has made it all worthwhile"".",1593299562.0,"06/27/2020, 23:12:42",1562,3,101172,4053.7804967200645,0.96,0.015439054283793935
56,todayilearned,"TIL Fred Rogers proposed to his wife Joanne via letter. When she received it, Joanne rushed to a payphone to respond. She was so nervous that when Fred answered the phone she was focused on the phone booth graffiti and greeted him by saying, ""Shit."" Fred laughed and she agreed to marry him.",1594223633.0,"07/08/2020, 15:53:53",1021,8,101167,7702.677101109701,0.93,0.01009222374885091
57,todayilearned,TIL an average silver back can deadlift 1800 lb and their grip can crush a crocodile's skull | They are 4 to 9 times stronger than an average human male.,1597582690.0,"08/16/2020, 12:58:10",6143,35,100928,5092.493746813881,0.95,0.06086517121116043
58,todayilearned,TIL Research shows that starting school at 10am instead of 8:30am halves student illness and improves academic performance.,1584813523.0,"03/21/2020, 17:58:43",3909,0,100579,10048.473340666009,0.91,0.03886497181320156
59,todayilearned,"TIL that LBJ constantly asked the flight crew of Air Force One to change the temperature of the cabin. Eventually, they installed a fake control knob for him to 'control' the temperature himself. The president stopped complaining.",1594810451.0,"07/15/2020, 10:54:11",2513,1,100191,5490.114308686549,0.95,0.02508209320198421
60,todayilearned,"TIL Dave Grohl wrote and recorded an entire album by himself, singing and playing each instrument in the studio. He chose the name Foo Fighters to hide his identity. After a record label picked it up he needed to recruit members to perform the songs live. Thus the Foo Fighters were created.",1597419255.0,"08/14/2020, 15:34:15",2298,30,100182,10427.539854764793,0.91,0.022938252380667185
61,todayilearned,"TIL in 1954, Ernest Hemingway survived two plane crashes in two days. He was presumed dead almost 24 hours later until he was spotted coming out of the jungle carrying bananas and a bottle of gin.",1595439233.0,"07/22/2020, 17:33:53",1846,5,99923,4110.542006983858,0.96,0.018474225153368093
62,todayilearned,"TIL that in Japan, if a working day falls between two public holidays, that working day becomes an additional holiday by law, also known as a ""Citizen's Holiday"".",1600858737.0,"09/23/2020, 10:58:57",2628,77,99588,5336.271776412628,0.95,0.026388721532714786
63,todayilearned,"TIL in 2015 a fan of the Austrailian band Peking Duk got backstage at their concert by adding himself as a family member on their Wiki page and showing it to security. The band wasn't even upset, saying ""We ended up having a bunch of beers with him and he was an absolute legend.""",1601419330.0,"09/29/2020, 22:42:10",629,68,99528,8055.349313139668,0.93,0.006319829595691664
64,todayilearned,"TIL ""Nearly 75 percent of all aluminum ever produced is still in use today"" due to recycling",1593224013.0,"06/27/2020, 02:13:33",1748,1,99481,4432.661852057427,0.96,0.017571194499452155
65,todayilearned,"TIL in 2004, a group of Yale students pranked Harvard by posing as a Harvard Prep Squad and handing out placards to over 1,800 Harvard fans at a football game. The Harvard fans were told they would spell out, “Go Harvard” when in reality, it actually said “We Suck.”",1596854003.0,"08/08/2020, 02:33:23",970,4,99283,5274.205247442762,0.95,0.009770051267588611
66,todayilearned,"TIL that India requires voting booths within 2 km of every registered voter. This means some poll workers trek for days through mountains and jungles to reach small, remote villages, sometimes for only a single registered voter.",1597353098.0,"08/13/2020, 21:11:38",2051,15,99118,5636.661292105811,0.95,0.020692507919853106
67,todayilearned,"TIL that a guy called Dale Schroeder used his life savings to send 33 students to college. he grew up poor in Iowa, never married, had no children, and worked as a carpenter at the same company for 67 years and only owned 2 jeans.",1573707024.0,"11/14/2019, 04:50:24",2671,3,99008,6557.1791562175495,0.94,0.02697761797026503
68,todayilearned,"TIL in the 1790s, an Oxford student introduced using guano (bird poop) as fertiliser. He spread guano across the university lawn, using it to spell G U A N O. The lawn was soon scrubbed, but when spring came, the word GUANO was clearly visible, growing higher and thicker than the rest of the grass",1602419254.0,"10/11/2020, 12:27:34",1200,43,98926,5107.7868286173325,0.95,0.012130279198592888
69,todayilearned,"TIL Mel Gibson could not get any studio to fund 'Passion of the Christ'. Instead of scrapping the film, he chose to finance it all by himself, an action which analysts labelled as ""idiotic"". He spent $45M on the project and went on to make over $475M because he didn't have to split the profits.",1603288890.0,"10/21/2020, 14:01:30",5021,53,98917,14817.79519379721,0.87,0.05075972785264413
70,todayilearned,"TIL that when Winston Churchill Sold Chartwell, the family home, to the National Trust, he required that there always be a marmalade cat named Jock in ""comfortable residence."" The Trust honored that request. The current occupant is Jock VII, a six month old rescue kitten.",1599967073.0,"09/13/2020, 03:17:53",1266,280,98517,5386.807463545832,0.95,0.01285057401260696
71,todayilearned,"TIL that Ethan Zuckerman, the man who invented pop-up ads has apologized to the world for creating one of the Internet's most hated forms of advertising.",1591644161.0,"06/08/2020, 19:22:41",1219,1,98202,5963.239839757851,0.94,0.012413189140750697
72,todayilearned,"TIL about Whipping Tom of 1681, a nickname given to a serial spanker in London. He would wait for an unaccompanied woman, grab her, lift her dress and slap her buttocks whiles shouting ""Spanko!"" before fleeing. Vigilantes would dress in women's clothing and patrol the areas he was known to operate.",1597949051.0,"08/20/2020, 18:44:11",2555,31,98030,4903.063680085674,0.95,0.026063449964296645
