,Subreddit,Title,Epoch Time,Date,Comments,Awards,Upvotes,Downvotes,Upvote Ratio,Comment/Upvote Ratio
437,todayilearned,TIL Converse shoes have “fuzzy soles” so they can be imported as slippers which dramatically reduces import taxes.,1590261903.0,"05/23/2020, 19:25:03",1781,2,63511,5773.289061975185,0.92,0.028042386358268646
438,todayilearned,TIL that the borders between Belgium and the Netherlands are so complex that many buildings have an international border running right through them. A bank was built on top of the border so paperwork was moved from one side of the building to the other whenever one nationality’s tax inspectors came.,1601303837.0,"09/28/2020, 14:37:17",1030,33,63487,2339.3355462332256,0.96,0.016223793847559342
439,todayilearned,"TIL in the 1988 box-office bomb ""Mac and Me"", the wheelchair-bound lead child character was played by a real wheelchair-bound actor with spina bifida. In real life, when people asked why he was in a wheelchair, the 12-year-old would reply, ""Vietnam.""",1576222580.0,"12/13/2019, 07:36:20",1267,0,63458,6368.923231661101,0.91,0.01996596173847269
440,todayilearned,"TIL that Popeye the Sailor became so popular during the Great Depression that consumption of spinach increased by 33%. His popularity also led to American children listing spinach as their third favorite food, after turkey and ice cream.",1580673930.0,"02/02/2020, 20:05:30",1276,1,63422,2521.9419106006826,0.96,0.020119201538898176
441,todayilearned,"TIL in 2007, 33-year-old Steve Way weighed over 100kg, smoked 20 cigarettes a day &amp; ate junk food regularly. In order to overcome lifestyle-related health issues, he started taking running seriously. In 2008, he ran the London Marathon in under 3 hours and, in 2014, he set the British 100 km record",1602762077.0,"10/15/2020, 11:41:17",1686,34,63438,6772.288456537077,0.9,0.026577130426558213
442,todayilearned,"TIL Lyme Disease is far less prevalent in the west coast of the US thanks, in part, to the Western Fence Lizard which carries a protein that cures the disease in the ticks that bite them, thereby reducing the probability of infection to humans and other tick hosts.",1591977664.0,"06/12/2020, 16:01:04",1405,0,63412,2812.281574226625,0.96,0.0221566895855674
443,todayilearned,"TIL of Mim, an eastern grey kangaroo raised by a family who hand-fed her. After they released her, Mim roamed wild for years; but when wildfires burned near the family's home in Kulnura, Australia, Mim turned up at their door seeking shelter. They let her stay indoors where she lounged on a blanket.",1583937820.0,"03/11/2020, 14:43:40",539,2,63360,3578.0615527832706,0.95,0.008506944444444444
444,todayilearned,"TIL that a permit was denied for the production crew of ""The Sopranos"" to film the episode ""Pine Barrens"" at South Mountain Reservation by Essex County, New Jersey Executive James Treffinger, due to the show depicting Italians as corrupt, Treffinger was later convicted and imprisoned for corruption",1597133483.0,"08/11/2020, 08:11:23",1214,6,63362,3934.318267787792,0.94,0.019159748745304756
445,todayilearned,"TIL that ""Airplane"" was judged ""culturally, historically, or aesthetically"" significant and added to the National Film Registry in 2010",1585836158.0,"04/02/2020, 14:02:38",1746,5,63335,6350.311185324637,0.91,0.02756769558695824
446,todayilearned,"TIL Ariana Grande grew up wealthy. Both her parents were rich corporate bosses, with their notoriety helping her get early gigs performing with orchestras and on cruise ships.",1582567000.0,"02/24/2020, 17:56:40",7405,0,63161,13896.581780756285,0.82,0.11724006902993936
447,todayilearned,TIL that the founder of Old Bay seafood seasoning founded his own company after being fired by McCormick after two days on the job after they found out he was Jewish,1604724752.0,"11/07/2020, 04:52:32",1555,16,63199,5157.549965198661,0.92,0.024604819696514187
448,todayilearned,"TIL William Still, the father of the Underground Railroad, interviewed and kept records of every escaped slave he came across. Once, while interviewing a man, he discovered that the man was actually his long-lost brother.",1574000203.0,"11/17/2019, 14:16:43",641,1,62874,3488.508720369544,0.95,0.010194993160925024
449,todayilearned,"TIL that Andre Agassi, one of the greatest ever male tennis players (and husband of Steffi Graf, one of the greatest ever female tennis players), wrote in his autobiography that ""I hate tennis, hate it with a dark and secret passion, and always have""",1596500510.0,"08/04/2020, 00:21:50",2591,2,62842,3336.2979648906767,0.95,0.04123038732058178
450,todayilearned,"TIL that in 2012 an 11 year old boy accidentally flew to Rome alone without any money, passports, or boarding passes while running away from his mom in a mall. No one realized until the plane was already halfway to Italy.",1580467005.0,"01/31/2020, 10:36:45",1879,2,62813,4276.60532790568,0.94,0.029914189737793133
451,todayilearned,"TIL that in 2008 a bear was sued for stealing honey by a Macedonian beekeeper. The bear was found guilty, and the beekeeper received 1,700 euro from the state for the damages.",1586685615.0,"04/12/2020, 10:00:15",792,1,62813,5091.521756362374,0.93,0.012608854854886727
452,todayilearned,"TIL: J.R.R Tolkien was rejected for a Nobel Prize, in 1961, on the grounds of his poor storytelling.",1601245395.0,"09/27/2020, 22:23:15",2706,45,62749,4805.015014357574,0.93,0.04312419321423449
453,todayilearned,TIL that the journalist Nellie Bly got bored of writing about fashion and gardening and instead went undercover in a mental asylum to expose the horrible conditions there. She later travelled around the world by balloon in record time.,1602244658.0,"10/09/2020, 11:57:38",753,27,62732,3701.2229942258273,0.94,0.012003443218771918
454,todayilearned,"TIL about the Chinese poem ""Lion-Eating Poet in the Stone Den,"" or ""Shī shì shí shī shǐ."" The poem is solely composed of ""shi"" 92 times, but pronounced with different tones.",1583498976.0,"03/06/2020, 12:49:36",1587,2,62708,4662.9409938145545,0.93,0.025307775722395866
455,todayilearned,"TIL that the obelisk that stands at the centre of Saint Peter’s Square in Vatican City, is a four thousand year old Egyptian obelisk that was brought to Rome from Alexandria by Caligula in 37 AD.",1585690447.0,"03/31/2020, 21:34:07",1646,1,62641,2863.570465152945,0.96,0.026276719720310978
456,todayilearned,"TIL Married With Children never had canned laughter. They used only original laughter, applause, shouts etc. that came from the viewers while the series was filmed in front of them. Sometimes the audience had to be shut down for the show to continue.",1582056054.0,"02/18/2020, 20:00:54",1863,2,62635,4474.936752144626,0.93,0.029743753492456296
457,todayilearned,TIL some indigenous people are known to have deciphered bird language and used it to locate predators that birds were warning other birds about,1594742634.0,"07/14/2020, 16:03:54",1152,3,62633,3713.085405398335,0.94,0.01839285999393291
458,todayilearned,"TIL that during the filming of Mrs. Doubtfire (1993) Robin Williams improvised so much that there were PG, PG-13, R, and NC-17 edits of the film",1591673735.0,"06/09/2020, 03:35:35",1438,1,62612,3955.605280848409,0.94,0.02296684341659746
459,todayilearned,"TIL, FDR asked singer Eddie Cantor if he could get a million people to send in a dollar to support polio research. He replied that it would be easier to ask for dimes. By the end of the month, the White House had received 2.68 million dimes ($268k) and the March of Dimes began.",1577137552.0,"12/23/2019, 21:45:52",1110,0,62587,3540.2131441608362,0.95,0.017735312445076454
460,todayilearned,"TIL that journalist Dan Rather, became famous after his reporting saved thousands of lives during Hurricane Carla in 1961. Rather created the first radar weather report by overlaying a transparent map over a radar image of Hurricane Carla. This then helped initiate the evacuation of 350,000 people.",1602291590.0,"10/10/2020, 00:59:50",771,45,62573,4257.925449805232,0.94,0.012321608361433846
461,todayilearned,"TIL the Berlin Wall came down by mistake. When the East Germans planned to slowly open the border they announced it at a press conference without including a plan. When a reporter asked when it would be opened, the party official mistakenly said ""Immediately, without delay"" causing a run on the wall",1588290659.0,"04/30/2020, 23:50:59",1968,1,62572,4235.866112500444,0.94,0.03145176756376654
462,todayilearned,"TIL At the end of high school, Donald Glover, aka Childish Gambino, was voted “Most Likely to Write for The Simpsons.” Then at the age of 23, Glover was hired by Tina Fey to write for 30 Rock after he submitted a spec script (a non-commissioned unsolicited screenplay) about The Simpsons.",1588508947.0,"05/03/2020, 12:29:07",1086,2,62474,7056.991807046317,0.9,0.017383231424272498
463,todayilearned,"TIL Soviet Premier Nikita Khrushchev was so impressed by First Lady Jackie Kennedy after meeting her that he later sent her a puppy; the animal was significant for being the offspring of Strelka, the dog that had gone to space during a Soviet space mission",1595281187.0,"07/20/2020, 21:39:47",912,1,62466,3042.6989659712344,0.95,0.014599942368648545
464,todayilearned,"TIL that H.R. Giger (the designer of the alien in Alien), once got stopped by Dutch customs because of his disturbing drawings, which they thought were photographs. Giger later said: ""Where on Earth did they think I could have photographed my subjects? In hell, perhaps?""",1602168667.0,"10/08/2020, 14:51:07",1147,7,62446,3082.3181511528965,0.95,0.018367869839541365
465,todayilearned,TIL The band Fleetwood Mac seriously considered thanking their drug dealer in their album credits for Rumours.They ultimately decided against it after their drug dealer was murdered.,1585524271.0,"03/29/2020, 23:24:31",824,0,62432,3672.9286101352773,0.94,0.013198359815479241
466,todayilearned,"TIL In males, 80% to 95% of REM sleep is normally accompanied by partial to full penile erection.",1585950542.0,"04/03/2020, 21:49:02",3004,1,62391,4478.893690343102,0.93,0.048147970059784266
467,todayilearned,"TIL American author Washington Irving lied when he said Christopher Columbus sailed the world in a bid to prove it wasn't flat. The truth is that 'Flat Earth' has not been a mainstream theory since at least 600 B.C. In the 1400s, almost everybody would have known the Earth was round.",1598968331.0,"09/01/2020, 13:52:11",2013,13,62332,4927.619346789463,0.93,0.03229480844510043
468,todayilearned,"TIL Norman Greenbaum wrote the famous song, ""Spirit in The Sky"" in only 15 minutes, and has been living solely on the royalties for the last 50 years.",1588017818.0,"04/27/2020, 20:03:38",2107,1,62316,2657.913713602611,0.96,0.033811541177225755
469,todayilearned,"TIL Liu Chuyu, a Song dynasty princess complained to her brother that it was unfair he was allowed to have as many concubines as he wanted while she was limited to a single husband. He agreed and gave her a harem of 30 young men.",1600661529.0,"09/21/2020, 04:12:09",1445,41,62230,3247.6537341300427,0.95,0.023220311746745943
470,todayilearned,"TIL that Adam Devine, who plays Adam Demamp on Workaholics, was hit by a cement truck at age 11, and both his legs were completely mangled. To pass time while recovering, he’d call radio DJ’s and impersonate celebrities, which is how he discovered his love of comedy.",1578365318.0,"01/07/2020, 02:48:38",714,0,62171,4476.058209175011,0.93,0.011484454166733686
471,todayilearned,"TIL the Tourette Association of America initially feared South Park’s release of their Tourettes episode, but ended up being surprised at how accurate and well-researched the show was on the condition. The only thing they critiqued was the frequent use of “coprolalia” or rampant swearing.",1593208760.0,"06/26/2020, 21:59:20",2112,0,62128,4627.252858976819,0.93,0.0339943342776204
472,todayilearned,"TIL that Thomas Paine, one of America's founding fathers, was extremely progressive for his time. He advocated for the separation of church and state, universal suffrage, the abolition of slavery, and an early kind of socialism. When he died, only six men came to his funeral.",1573834335.0,"11/15/2019, 16:12:15",2715,2,61985,8761.350832238459,0.88,0.04380091957731709
473,todayilearned,"TIL: Delta airlines no longer allows snub nosed dog breeds such as bulldogs, pugs, shar pei, etc. because of the breeds' breathing difficulties.",1574863836.0,"11/27/2019, 14:10:36",2419,0,61964,4193.88516234704,0.94,0.03903879672067652
474,todayilearned,"TIL Michael Jackson's Super Bowl half time show was so successful that for the first time ever, a performance won higher ratings than the game.",1599000629.0,"09/01/2020, 22:50:29",1777,23,61874,4970.667202024924,0.93,0.028719656075249702
475,todayilearned,TIL that the French soldier Jean Bernadotte became so popular in Sweden that they elected him king in 1818 when their own royal family was about to die out. The Bernadotte family still rules in Sweden today,1583408099.0,"03/05/2020, 11:34:59",1235,0,61720,3279.012259455434,0.95,0.020009721322099806
476,todayilearned,"TIL that Isaac Asimov died from complications of HIV. In 1983 got HIV from a blood transfusion during heart surgery. His doctors told him to keep it quiet. 10 Ten years later, after most of Asimov's physicians had died, Asimov's family agreed that the HIV story should be made public.",1579486964.0,"01/20/2020, 02:22:44",1023,2,61699,3144.7516966455732,0.95,0.016580495632019968
477,todayilearned,"TIL There was an entire horror movie filmed inside the US Disney parks, without permission. Actors and crew dressed up as tourists and filmed over 2 weeks in each park. Disney chose to ignore the movie, most likely to avoid giving it further attention. It premiered at Sundance.",1585879320.0,"04/03/2020, 02:02:00",1391,1,61684,5649.417522168762,0.92,0.022550418260813176
478,todayilearned,"TIL Britain is responsible for 63 independence day celebrations around the world. That is, on average, 1 Independence Day celebration from UK every 6 days through out the year.",1599338199.0,"09/05/2020, 20:36:39",1587,18,61606,2951.6256993528586,0.95,0.025760477875531602
479,todayilearned,"TIL as many as three US Presidents, and also Abraham Lincoln's son, may have died as a result of a contaminated water supply to the White House. Until 1850 there was no sewage system and a field of human excrement called ""night soil"" flowed freely into the water supply.",1600438629.0,"09/18/2020, 14:17:09",1075,30,61605,2703.4842508504953,0.96,0.01744988231474718
480,todayilearned,"TIL about war pigs against the siege of Megara in 266BC. Pigs were set on fire with resin, and sent towards the army's war elephants. The squealing pigs terrorized the elephants, causing them panic and trample anyone close by, ending the siege due to the high number of elephant-caused casualties.",1595847020.0,"07/27/2020, 10:50:20",1725,2,61475,3074.5738583197235,0.95,0.028060187067913786
481,todayilearned,"TIL of Charles Ramsey, a Cleveland man who was key in the rescue of 3 women &amp; a child from over a decade of captivity in a neighbor's home. When word got out he was eating a Big Mac when he heard a woman's cries for help, over a dozen Ohio restaurants pledged to offer him a free burger anytime.",1590695566.0,"05/28/2020, 19:52:46",1504,3,61452,4529.178132739733,0.93,0.024474386513050835
482,todayilearned,"TIL That in 2012 the University of Chicago received a package for ""Henry Jones Jr"" (Indiana Jones). Inside a replica of Indiana's notebook. Turned out that someone had ordered it online, it fell out the packet and a postal worker assumed the name/address on the notebook was the intended recipient",1576666163.0,"12/18/2019, 10:49:23",747,1,61431,4868.425928671233,0.93,0.012159984372710847
483,todayilearned,"TIL that the concrete used by the Roman Empire has been proposed as an alternative to modern concrete. It's believed that it would have a substantially smaller environmental impact than our own in addition to being far more durable, surviving thousands of years in harsh conditions nearly unscathed.",1583277751.0,"03/03/2020, 23:22:31",2134,1,61383,7931.976122528518,0.89,0.03476532590456641
484,todayilearned,TIL that ZZ Top is the longest-running group with an unchanged line-up in the entire history of popular music,1585180999.0,"03/26/2020, 00:03:19",1465,2,61358,4153.602627760003,0.94,0.023876267153427427
485,todayilearned,"TIL In March 2006 a man purchased an authentic official copy of the Declaration of Independence, one of 200 “official copies” commissioned by John Quincy Adams in 1820, for $2.48 at a Nashville, TN thrift shop. It later sold for $477,650 at auction.",1586263605.0,"04/07/2020, 12:46:45",874,0,61349,3253.307521955714,0.95,0.014246360983879118
486,todayilearned,"TIL that generally speaking, a Dane speaking Danish can understand and be understood by Norwegians speaking Norwegian, and Swedes speaking Swedish. This is because the languages of Scandinavia are considered ""mutually intelligible"".",1587334002.0,"04/19/2020, 22:06:42",3728,0,61338,5033.5419082454755,0.92,0.060777984283804494
487,todayilearned,"TIL that Mark Ruffalo had brain cancer when his wife was pregnant with their first child, and had to fight through facial paralysis and balance problems for months.",1600747807.0,"09/22/2020, 04:10:07",929,40,61320,6191.660147681847,0.91,0.015150032615786041
488,todayilearned,"TIL when Arnold Schwarzenegger was Governor of California, rival politicians accused him of hiding the words, 'Fuck You', in an acrostic-style message to them when he vetoed a bill. When asked, Schwarzenegger's campaign team said, ""My goodness. What a coincidence.""",1594005939.0,"07/06/2020, 03:25:39",1565,1,61280,4480.493418626531,0.93,0.025538511749347258
489,todayilearned,"TIL: Beethoven was such a massive star that following composers struggled to pull away from his artistic gravity. Brahms for example refused to make a symphony for 21 years, feeling unworthy. Schubert said: Who can ever do anything, after Beethoven?",1574978075.0,"11/28/2019, 21:54:35",1534,0,61263,2605.3911278981395,0.96,0.025039583435352498
490,todayilearned,"TIL In 1986, a French woman studied for months so she could learn how to fly a helicopter. Then she rented one, flew it over a prison and grabbed her husband, a convicted bank robber, from the prison's roof.",1598763148.0,"08/30/2020, 04:52:28",704,10,61254,2882.911195458386,0.96,0.011493126979462566
491,todayilearned,"TIL about 'Botanical Sexism', a process by which urban landscapers, in an effort to keep streets clear of seeds &amp; flowers, plant only male trees. The male trees lack the seeds of their female counterparts &amp; as the trees get bigger, their pollen counts increases which can worsen seasonal allergies.",1588159358.0,"04/29/2020, 11:22:38",1615,2,61225,8063.314231311015,0.88,0.026378113515720704
492,todayilearned,"TIL that in the 80s, deaf Nicaraguan children with no prior sign language (or any true language) exposure were brought together to a deaf school, &amp; started spontaneously making their own sign language, developing complexity &amp; syntax. This gave linguists rare insight into the birth of human language.",1593605227.0,"07/01/2020, 12:07:07",624,3,61198,3065.1844812118143,0.95,0.010196411647439459
493,todayilearned,TIL of a 1993 proposal to build a giant advertising billboard in outer space that would appear roughly the same size and brightness as the moon. The project didnt meet funding and inspired a bill to ban all advertisement in outer space.,1587311461.0,"04/19/2020, 15:51:01",1190,0,61145,2397.4392045936693,0.96,0.019461934745277618
494,todayilearned,"TIL a 60-year-old American man with severe amnesia was blind for 9 months due not being able to afford cataract surgery. When a charity paid for it and he could see again, he was shocked to discover he was around 20 years older than he thought he was.",1582987511.0,"02/29/2020, 14:45:11",1279,0,61136,3571.8137049719444,0.94,0.020920570531274534
495,todayilearned,"TIL Christopher Havens, a convicted murderer solves ancient math problem in prison. Taught himself higher math and solved the age-old math puzzle of number theory involving so-called continued fractions over which Euclid has already racked his brains. He then published the journal in January 2020.",1598514460.0,"08/27/2020, 07:47:40",2011,15,61133,4032.818620848935,0.94,0.03289549016079695
496,todayilearned,"TIL In 1964, Bell Labs built a large space antenna. Upon testing, two of their scientists encountered ‘interference’, which could not be isolated. After multiple attempts to fix the bug, they determined the “noise” was in fact, a remnant ‘hum’ from the Big Bang. They went on to win The Nobel Prize.",1600457980.0,"09/18/2020, 19:39:40",1035,43,61077,3215.4847497521187,0.95,0.016945822486369666
497,todayilearned,"TIL of Kay Antonelli. Her official civil service title, as printed on her employment documentation, was ""computer"". During her work as a computer, she invented the subroutine (a sequence of computer instructions which can be used repeatedly). Today, the subroutine is essential programming for all.",1599570036.0,"09/08/2020, 13:00:36",1114,34,61006,5226.278343809303,0.92,0.01826049896731469
498,todayilearned,"TIL there's a scientist named John B. Goodenough who was responsible for the invention of RAM, creation of Li-ion batteries in the 1970s (used in virtually all devices today), and is current working on the next breakthrough in revolutionary Solid State batteries at the age of 97 years old.",1594701404.0,"07/14/2020, 04:36:44",1181,2,60981,2466.5740554754448,0.96,0.019366687984782145
499,todayilearned,"TIL of Dodger, a ginger cat who was discovered by his owner to have been riding the public buses near his home in England, at least once taking a 10 mile round trip. The drivers give him food, he sits on passengers' laps, and drivers know which stop to let him off at.",1583445019.0,"03/05/2020, 21:50:19",513,4,60952,3492.733565493101,0.95,0.00841645885286783
500,todayilearned,"TIL that the first first-person shooter, Maze, was created in 1973. It included features like corner peeking, AI bots, and 8-player online play. In fact, it was so popular that DARPA had to ban it from ARPANET because half of all network activity for a month was between players at MIT and Stanford.",1592380688.0,"06/17/2020, 07:58:08",1197,1,60920,2650.618640844281,0.96,0.019648719632304662
501,todayilearned,"TIL a ""Power Ranger"" has spent 2 hrs a day helping Tokyo subway riders lug heavy packages and baby strollers up the station stairs, as it has no elevators nor escalators. He said: ""Japanese people find it hard to accept help, they feel obligated to the other person, so the mask really helps me out.""",1592490363.0,"06/18/2020, 14:26:03",899,0,60879,3353.693079181874,0.95,0.014766996829777099
502,todayilearned,"TIL that shortly after the death of Harambe the gorilla, his sperm was extracted from his corpse in order to preserve genetic diversity and prevent his bloodline from dying out",1587757034.0,"04/24/2020, 19:37:14",1618,1,60878,3663.8243521409167,0.94,0.026577745655244917
503,todayilearned,"TIL Jimmy Carter said if he became president, he would release all government UFO information to the public. Once elected, he decided not to due to ""national security concerns""",1586813507.0,"04/13/2020, 21:31:47",3134,0,60835,3757.7783890127175,0.94,0.05151639681104627
504,todayilearned,"TIL that Matthew McConaughey originally auditioned with Kate Winslet for 'Titanic' (1997) and was confident he got the role of Jack, but Leonardo DiCaprio interviewed next and James Cameron said every woman in the building showed up for the meeting so he thought, 'maybe I should cast this guy'.",1592507561.0,"06/18/2020, 19:12:41",1502,0,60813,3037.7286376102347,0.95,0.024698666403565026
505,todayilearned,"TIL that in July 2018, Russian scientists collected and analysed 300 prehistoric worms from the permafrost and thawed them. 2 of the ancient worms revived and began to move and eat. One is dated at 32,000 years old, the other 41,700 years old.",1583864428.0,"03/10/2020, 18:20:28",1554,1,60781,3361.8904351297388,0.95,0.025567200276402167
506,todayilearned,"TIL Paul Revere III, the great-great-great-great-grandson of the American Revolutionary War hero of the same name, currently serves as legal counsel for a copper manufacturing company which was founded by the original Paul Revere in 1801.",1599875058.0,"09/12/2020, 01:44:18",920,27,60739,6338.2388835018355,0.91,0.015146775547835821
507,todayilearned,TIL Steve-O Celebrated 10 Years of Sobriety by Participating in a Triathlon,1598463726.0,"08/26/2020, 17:42:06",1028,27,60607,5336.503690433165,0.92,0.016961737093075056
508,todayilearned,"TIL that James Doohan (i.e. Scotty in the Original Star Trek) helped a suicidal fan by personally requesting her attendance to a convention, after 8 years of silence he received a letter from her thanking him for what he did, and stating she had earned her Masters degree in Electronic Engineering.",1579317708.0,"01/18/2020, 03:21:48",518,2,60567,4832.96398483371,0.93,0.008552512094044612
509,todayilearned,"TIL the USSR tried to blackmail a gay US journalist with photos of him having sex with a Soviet spy, but he refused to cooperate and reported the incident to the CIA. When the Soviets sent the photos to prominent journalists, they all refused to out him.",1589758240.0,"05/17/2020, 23:30:40",1577,2,60448,4554.052274934766,0.93,0.026088538909475913
510,todayilearned,"TIL Robocop's suit was so cumbersome, it would not fit into his police car. Every time you see Robocop driving, he doesn’t have his Robo pants on.",1599582760.0,"09/08/2020, 16:32:40",976,15,60432,2632.998709183281,0.96,0.016150383902568177
