,Subreddit,Title,Epoch Time,Date,Comments,Awards,Upvotes,Downvotes,Upvote Ratio,Comment/Upvote Ratio
441,ukpolitics,"YouGov: For the first time since early March, more people now disapprove of the government (42%) than approve (39%)",1589883925.0,"05/19/2020, 10:25:25",222,0,1449,50.488726258721044,0.97,0.15320910973084886
442,ukpolitics,Tory peer paid £6m by Russian energy company linked to billionaire friend of Vladimir Putin,1600605307.0,"09/20/2020, 12:35:07",101,1,1455,22.733677800296164,0.98,0.06941580756013746
443,ukpolitics,"'Crystal clear' drunk people can't socially distance, say police in England",1593933318.0,"07/05/2020, 07:15:18",668,0,1449,22.112878230150045,0.98,0.4610075914423741
444,ukpolitics,BBC News: UK to shut pubs and restaurants in virus fight,1584724441.0,"03/20/2020, 17:14:01",728,0,1446,14.28893400086713,0.99,0.5034578146611342
445,ukpolitics,Chancellor refuses to say if he'd live on £94 sick pay in toe-curling interview,1584012549.0,"03/12/2020, 11:29:09",674,0,1446,88.82493772694443,0.94,0.4661134163208852
446,ukpolitics,NHS staff can refuse to treat racist or sexist patients under new rules,1582040907.0,"02/18/2020, 15:48:27",909,0,1446,64.9034692502928,0.96,0.6286307053941909
447,ukpolitics,John Bercow nominated for peerage by Jeremy Corbyn,1579409181.0,"01/19/2020, 04:46:21",282,0,1440,52.574775178538175,0.96,0.19583333333333333
448,ukpolitics,"UK Population: COVID-19, tested, tested positive and deaths. Each circle represents 1 million people",1587023674.0,"04/16/2020, 07:54:34",294,0,1440,54.43800439959114,0.96,0.20416666666666666
449,ukpolitics,'Shameful' not to publish Russia report - Clinton,1573540458.0,"11/12/2019, 06:34:18",533,0,1442,109.84998660376618,0.93,0.369625520110957
450,ukpolitics,"EXCL: There are currently no tests at all available in ANY of the top 10 Covid-19 hotspots in England, LBC can reveal. No walk-in, drive-through or home tests available for people in Bolton, Salford, Bradford, Blackburn, Oldham, Preston, Pendle, Rochdale, Tameside or Manchester.",1600090437.0,"09/14/2020, 13:33:57",384,1,1439,26.13536286140925,0.98,0.26685198054204307
451,ukpolitics,"The fatal delusions of Boris Johnson. Boris Johnson believes that post-Brexit Britain is an exceptional, “world-beating” power. Yet it has proved itself incapable of fulfilling its most basic responsibility: keeping its citizens safe.",1593635018.0,"07/01/2020, 20:23:38",383,0,1437,140.771643594416,0.91,0.2665274878218511
452,ukpolitics,"Bob on government warnings to ""stay at home"" over Easter bank holiday weekend",1586495973.0,"04/10/2020, 05:19:33",215,0,1438,66.95819063874342,0.96,0.14951321279554938
453,ukpolitics,"Up to 30,000 affordable houses to be scrapped under Tory planning reforms",1602052459.0,"10/07/2020, 06:34:19",366,0,1434,24.15395978122706,0.98,0.25523012552301255
454,ukpolitics,Clive Lewis: Labour must push for proportional representation,1578658222.0,"01/10/2020, 12:10:22",725,0,1438,55.05762248964356,0.96,0.5041724617524339
455,ukpolitics,"'We have no objections': Security officials say secret Russia report being blocked by Boris Johnson government can be published immediately. 'We are as much spectators in this as you are,' security source tells The Independent, as government blocks publication of documents until after election.",1572948969.0,"11/05/2019, 10:16:09",248,0,1432,22.93411708183271,0.98,0.17318435754189945
456,ukpolitics,[YouGov] Allowing MPs to continue to vote remotely during the coronavirus crisis is overwhelmingly supported across parties: Con voters: 77% Lab voters: 84% Lib Dem voters: 93% Remain voters: 88% Leave voters: 72%,1591218700.0,"06/03/2020, 21:11:40",184,0,1433,11.613685972576604,0.99,0.1284019539427774
457,ukpolitics,"More than 28% of England's secondary schools now in the red, study finds",1576743421.0,"12/19/2019, 08:17:01",452,0,1430,29.43815144926316,0.98,0.31608391608391606
458,ukpolitics,“Tony Abbott is a homophobe and a misogynist” Health Sec @MattHancock : “He’s also an expert on trade” #KayBurley JM,1599125970.0,"09/03/2020, 09:39:30",460,1,1425,65.03510055003449,0.96,0.32280701754385965
459,ukpolitics,Sky ‘Looking After’ Customers By Putting Up U.K. Television Prices Amid Coronavirus Crisis,1585235795.0,"03/26/2020, 15:16:35",221,0,1425,68.83335129955094,0.95,0.1550877192982456
460,ukpolitics,"Opening pubs ‘a disaster waiting to happen’, says PM’s own expert",1593750549.0,"07/03/2020, 04:29:09",517,1,1420,35.02900490035381,0.98,0.36408450704225354
461,ukpolitics,88% of Conservative ads on Facebook 'misleading',1575661983.0,"12/06/2019, 19:53:03",117,0,1423,74.81957239891403,0.95,0.08222066057624737
462,ukpolitics,Liverpool Mayor Joe says refugees welcome in Liverpool but Nigel Farage isn't,1596843153.0,"08/07/2020, 23:32:33",655,0,1419,103.47429916799115,0.93,0.4615926708949965
463,ukpolitics,Prince Andrew 'had visits from Epstein's fixer Ghislaine Maxwell 4 times a day',1580054382.0,"01/26/2020, 15:59:42",284,0,1417,34.30284096767241,0.98,0.20042342978122796
464,ukpolitics,Matt's Cartoon 02/09/2020,1599034484.0,"09/02/2020, 08:14:44",79,0,1409,70.04784552565798,0.95,0.056068133427963095
465,ukpolitics,Tony Blair and John Major unite to condemn Boris Johnson's law-breaking bill,1599938491.0,"09/12/2020, 19:21:31",447,0,1419,56.08723236106357,0.96,0.3150105708245243
466,ukpolitics,I am an Immigrant to the UK and I think people take a lot of what makes this country good for granted.,1600985306.0,"09/24/2020, 22:08:26",472,12,1416,119.20156163955858,0.92,0.3333333333333333
467,ukpolitics,"""Ministers are increasingly nervous that a Scottish breakaway is on the cards (the cabinet was recently briefed that the latest opinion polls show 56% of Scots would vote for independence, and 44% to stay in the UK).""",1599488455.0,"09/07/2020, 14:20:55",1252,0,1410,53.734431394676676,0.96,0.8879432624113475
468,ukpolitics,Gap between rich and poor pupils in England 'grows by 46% in a year',1598939615.0,"09/01/2020, 05:53:35",522,0,1407,34.79258087606058,0.98,0.37100213219616207
469,ukpolitics,81% of all bets on Britain’s next prime minister favour Keir Starmer to succeed Boris Johnson,1589623982.0,"05/16/2020, 10:13:02",474,1,1408,205.8953087321272,0.87,0.3366477272727273
470,ukpolitics,"BBC News (UK) on Twitter: We have removed a video of the chancellor’s plans for the UK economy. While we don’t think that readers would take the images at face value, on reflection we think the illustrations struck the wrong note and we’ve removed the article.",1596304506.0,"08/01/2020, 17:55:06",390,0,1394,38.17544853079107,0.97,0.2797704447632712
471,ukpolitics,Keir Starmer on Twitter: No one would argue with putting in place local action to reduce the transmission of coronavirus. But announcing measures affecting potentially millions of people late at night on Twitter is a new low for the government’s communications during this crisis. (cont...),1596154570.0,"07/31/2020, 00:16:10",391,0,1398,50.324821601360554,0.97,0.27968526466380544
472,ukpolitics,"Coronavirus: Masks in shops 'must be compulsory', London mayor says",1592636765.0,"06/20/2020, 07:06:05",480,0,1402,21.91686763852249,0.98,0.34236804564907275
473,ukpolitics,Matt Hancock Names Two Asians When Asked To Identify Black Cabinet Members,1591519448.0,"06/07/2020, 08:44:08",797,0,1395,168.38596355242225,0.89,0.571326164874552
474,ukpolitics,Union anger as 'essential' Chesterfield Royal Hospital service outsourced to US company,1577024349.0,"12/22/2019, 14:19:09",484,1,1399,64.79427072066323,0.96,0.3459614010007148
475,ukpolitics,Large crowds 'coughing at police and spitting' when asked to move back during serious incident in Yorkshire,1584890745.0,"03/22/2020, 15:25:45",748,0,1397,27.403776809362625,0.98,0.5354330708661418
476,ukpolitics,Peter Brookes Cartoon,1588138086.0,"04/29/2020, 05:28:06",133,0,1388,88.16903791529126,0.94,0.09582132564841499
477,ukpolitics,The government knew the NHS couldn't cope with a pandemic three years ago but didn't act.,1586330767.0,"04/08/2020, 07:26:07",713,0,1390,119.6585835492715,0.92,0.5129496402877698
478,ukpolitics,"Jeremy Corbyn: Patriotism is about supporting each other, not attacking somebody else. It’s about loving your country enough to make it a place where nobody is homeless or hungry, held back or left behind.",1575235169.0,"12/01/2019, 21:19:29",342,0,1390,68.80429202525715,0.95,0.2460431654676259
479,ukpolitics,UK facing 'K-shaped' economic recovery as the gulf between the 'haves' and 'have nots' widens - 'Some people are sitting there with piles of cash in the bank and others will be wondering how they are going to buy food',1596025157.0,"07/29/2020, 12:19:17",507,0,1379,36.427960776645705,0.97,0.36765772298767224
480,ukpolitics,Tory plan to scrap election watchdog 'undermines democracy',1598899182.0,"08/31/2020, 18:39:42",409,0,1373,44.05344425204498,0.97,0.29788783685360526
481,ukpolitics,"Peter Brookes Times Cartoon (9 Jan 2020) - ""Special Relationship""",1578552495.0,"01/09/2020, 06:48:15",227,0,1382,92.93913332023203,0.94,0.16425470332850942
482,ukpolitics,"General election: Voters doubt Tory pledge to spend more on public services, according to poll",1573405928.0,"11/10/2019, 17:12:08",268,0,1375,63.866484242180604,0.96,0.19490909090909092
483,ukpolitics,Vote Leave AI firm wins seven government contracts in 18 months,1588583572.0,"05/04/2020, 09:12:52",336,0,1374,55.71945514287518,0.96,0.2445414847161572
484,ukpolitics,Fury as UK government looks to blame predicted Brexit chaos on logistics sector,1600936010.0,"09/24/2020, 08:26:50",312,0,1375,42.488628265543184,0.97,0.22690909090909092
485,ukpolitics,Dominic Cummings to be ‘forced’ to pay backdated council tax,1603140846.0,"10/19/2020, 20:54:06",285,2,1377,47.12370500738939,0.97,0.20697167755991286
486,ukpolitics,MPs tell Boris Johnson to 'get a grip' over delay in report into Russian political interference,1592813432.0,"06/22/2020, 08:10:32",207,0,1370,41.70045254378215,0.97,0.1510948905109489
487,ukpolitics,Marginals where BXP votes made the difference - How much of Labours losses were due to BXP ?,1576366089.0,"12/14/2019, 23:28:09",251,3,1368,35.04182070110687,0.98,0.1834795321637427
488,ukpolitics,Self-isolating studengs being charged £120 per week to have meals delivered,1602072673.0,"10/07/2020, 12:11:13",478,1,1361,8.046553258032418,0.99,0.35121234386480527
489,ukpolitics,John Bercow: ‘I do not believe Jeremy Corbyn is anti-Semitic’ | British GQ,1573149413.0,"11/07/2019, 17:56:53",428,0,1369,72.09732636485364,0.95,0.3126369612856099
490,ukpolitics,"Covid: PM has 'lost control of virus', says Labour leader",1601791682.0,"10/04/2020, 06:08:02",425,3,1363,55.31430394194854,0.96,0.3118121790168745
491,ukpolitics,The Tories’ dodgy “factcheckUK” tweets are a taste of what’s to come - British electoral law has failed to keep up with technology,1574288138.0,"11/20/2019, 22:15:38",160,0,1357,38.34610974507859,0.97,0.11790714812085483
492,ukpolitics,The contrast between the PM hiding in a fridge and the reception Corbyn had across the country couldn’t be greater,1576145483.0,"12/12/2019, 10:11:23",459,0,1363,122.21361915175157,0.92,0.3367571533382245
493,ukpolitics,Michael Goodier on Twitter: Looks like sixth form and FE colleges have particularly lost out in the standardization process for this year's A Level results. Private schools reaping the benefits with a huge increase in grade A and above.,1597316803.0,"08/13/2020, 11:06:43",255,0,1357,30.688716393754703,0.98,0.18791451731761238
494,ukpolitics,"A new academic report on the UK internal market bill concludes that it will: weaken devolution,worsen relations between UK and devolved govts, not guarantee high standards of regulation after Brexit.",1603097388.0,"10/19/2020, 08:49:48",181,0,1361,27.888074443502774,0.98,0.13299044819985306
495,ukpolitics,Talking racism in the UK. The reactions to recent statements by Stormzy and Gary Neville show just how hard it is to discuss racism in public.,1577293368.0,"12/25/2019, 17:02:48",1013,0,1358,134.33019817222885,0.91,0.7459499263622975
496,ukpolitics,Boris Johnson compared to Trump after banning ministers from BBC Radio 4's Today programme,1577115408.0,"12/23/2019, 15:36:48",361,0,1359,91.42937245126996,0.94,0.2656364974245769
497,ukpolitics,Boris Johnson Is Threatening To Review Channel 4's Broadcasting License,1574964373.0,"11/28/2019, 18:06:13",464,1,1351,65.54849760417346,0.95,0.34344929681717246
498,ukpolitics,"This Dutch cartoon in the Volkskrant newspaper depicts Brexit as a gang rape of Britain, led by Boris Johnson. Strong stuff in the 3rd best selling daily in the Netherlands.",1575356338.0,"12/03/2019, 06:58:58",367,0,1352,106.45911449034224,0.93,0.27144970414201186
499,ukpolitics,Extinction Rebellion protesters arrested after blockading Murdoch print sites,1599289144.0,"09/05/2020, 06:59:04",1149,5,1357,46.609739515714864,0.97,0.8467207074428887
500,ukpolitics,Keir Starmer: Boris Johnson should have drawn a line under the Dominic Cummings saga but was too weak to act. The public have sacrificed so much for the health of our nation - which he's now undermined. And sent a message that there's one rule for them and another for the British people.,1590681757.0,"05/28/2020, 16:02:37",341,0,1349,45.63155108398496,0.97,0.25277983691623424
501,ukpolitics,The “Sun” forced to delete article promoting fascist propaganda against UK left,1576169276.0,"12/12/2019, 16:47:56",79,0,1351,129.00754853809826,0.91,0.05847520355292376
502,ukpolitics,"Coronavirus PPE: all 400,000 gowns flown from Turkey for NHS fail UK standards. Health department understood to be returning shipment of PPE and seeking refund",1588833788.0,"05/07/2020, 06:43:08",583,0,1349,21.584922382470722,0.98,0.43217197924388434
503,ukpolitics,"Starmer on BBC Breakfast: ""Nonsense"" to call to 'Defund the Police'",1593439690.0,"06/29/2020, 14:08:10",1114,2,1347,72.97329964621235,0.95,0.8270230141054195
504,ukpolitics,Adam Price: Wales goes into firebreak and they said they couldn’t even bring the Job Support Scheme forward a week. England goes into lockdown and they move heaven and earth in a day. We Stand Together??!!! Like the words “United Kingdom” it’s one big con job. Join the indy movement today.,1604313405.0,"11/02/2020, 10:36:45",405,0,1362,80.72936862710526,0.94,0.2973568281938326
505,ukpolitics,"UK announces 2% digital services tax on Facebook, Google and Amazon",1583943387.0,"03/11/2020, 16:16:27",443,0,1342,22.508441384503158,0.98,0.3301043219076006
506,ukpolitics,"Boris Johnson is preparing to introduce national lockdown restrictions from next Wednesday The restrictions could see everything except nurseries, schools, universities and non-essential shops close until Dec 1 PM presser on Monday",1604094644.0,"10/30/2020, 21:50:44",1260,3,1342,23.880667326101047,0.98,0.9388971684053651
507,ukpolitics,Students 'should get a year's refund due to Covid-19 crisis',1587536408.0,"04/22/2020, 06:20:08",915,0,1335,115.86506772813118,0.92,0.6853932584269663
508,ukpolitics,Anger as ministers use obscure rule to deny MPs a vote on blocking chlorinated chicken. Ministers attacked for ‘unbelievable’ tactic to thwart expected Tory revolt to protect food standards,1602371956.0,"10/10/2020, 23:19:16",354,2,1340,21.53312902492962,0.98,0.26417910447761195
509,ukpolitics,"Treasury figures from Budget confirm there was no £350m a week Brexit dividend - Brexit has in fact cost every person in the UK £1,200 so far, spending watchdog says – as economy flat-lines",1583963863.0,"03/11/2020, 21:57:43",360,0,1333,87.21185022196255,0.94,0.2700675168792198
510,ukpolitics,Coronavirus: Nurse racially attacked by couple while walking to overtime shift,1584419943.0,"03/17/2020, 04:39:03",653,0,1332,58.728596581989905,0.96,0.49024024024024027
511,ukpolitics,"2017-&gt;2019 GE vote shifts (England, Lab/Con/LD)",1576402128.0,"12/15/2019, 09:28:48",260,1,1333,60.91120067001725,0.96,0.19504876219054765
512,ukpolitics,"Mikey Smith on Twitter: This is picking up steam, so… No, Britain First’s Jayda Fransen isn’t behind the ‘anti-lockdown’ events being planned around the UK. She owns Freedom Movement Ltd and a group called British Freedom Movement. A different group, UK Freedom Movement, are behind the rallies.",1589467671.0,"05/14/2020, 14:47:51",251,0,1334,61.87844249618274,0.96,0.18815592203898052
513,ukpolitics,"“Before the end of this Parliament we will publish a draft bill setting out the proposed terms and timing of an independence referendum” First Minister Nicola Sturgeon says ""we will make the case for Scotland to become an independent country”",1598970029.0,"09/01/2020, 14:20:29",959,2,1328,81.30003544313445,0.94,0.7221385542168675
514,ukpolitics,Hull asks to be first UK city to trial universal basic income,1579448808.0,"01/19/2020, 15:46:48",816,0,1336,39.30091822318968,0.97,0.6107784431137725
515,ukpolitics,"Majority of UK public back 2030 zero-carbon target – poll. Nearly half of Tory voters back plan, compared with 16% who back party’s 2050 target.",1573117473.0,"11/07/2019, 09:04:33",480,0,1336,28.9920313511318,0.98,0.3592814371257485
516,ukpolitics,AI firm that worked with Vote Leave wins new coronavirus contract | Technology,1591082523.0,"06/02/2020, 07:22:03",226,0,1330,43.01580997233805,0.97,0.1699248120300752
517,ukpolitics,Lifestyle Company with No Employees or Trading History Handed £25 Million PPE Contract – Byline Times,1593719601.0,"07/02/2020, 19:53:21",260,1,1333,24.236721241774603,0.98,0.19504876219054765
518,ukpolitics,"David Allen Green: Given how this government has dealt with the logistics of A-level results during a health crisis, imagine what the government will be like with all the ongoing logistical demands for dozens of policy areas after the end of the Brexit transition period",1597611086.0,"08/16/2020, 20:51:26",213,0,1329,55.15667331130658,0.96,0.16027088036117382
519,ukpolitics,Easyjet shareholders get £174 million dividends as airline appeals for taxpayer support,1585380782.0,"03/28/2020, 07:33:02",554,0,1329,137.19043972663826,0.91,0.41685477802859294
520,ukpolitics,"""If Boris Johnson was poor and fathered this many kids he'd be condemned""",1583264297.0,"03/03/2020, 19:38:17",533,0,1320,96.192368535789,0.93,0.4037878787878788
521,ukpolitics,MP Nadia Whittome on Twitter: Today I’m thinking of the millions of people whose loved ones have been killed by Iain Duncan Smith’s policies.,1577650897.0,"12/29/2019, 20:21:37",973,0,1325,178.91508526213624,0.88,0.7343396226415094
522,ukpolitics,Boris Johnson in hospital for tests on advice of doctors - No 10 says it is ‘precautionary measure,1586117633.0,"04/05/2020, 20:13:53",1464,4,1314,29.121570309077924,0.98,1.1141552511415524
523,ukpolitics,"Four-day working week could create 500K new jobs in UK, study says",1598793619.0,"08/30/2020, 13:20:19",513,0,1315,53.59590355824639,0.96,0.39011406844106467
524,ukpolitics,Report on Russian election meddling which was blocked by ministers 'names nine top Tory donors,1573464516.0,"11/11/2019, 09:28:36",79,0,1318,38.95677747954505,0.97,0.05993930197268589
525,ukpolitics,"Millions being ignored by ‘morally and politically bankrupt’ UK voting system, new report claims",1583136832.0,"03/02/2020, 08:13:52",539,0,1318,81.68195485214892,0.94,0.40895295902883155
526,ukpolitics,Parents who lose a child will receive two weeks' paid bereavement leave under new government rules.,1579763751.0,"01/23/2020, 07:15:51",614,0,1315,31.87445382188048,0.98,0.46692015209125476
527,ukpolitics,"BREAKING: Chancellor says he is making available £330bn of guaranteed loans for businesses, equivalent to 15% of GDP. This is unprecedented in peacetime. #COVID2019",1584465581.0,"03/17/2020, 17:19:41",900,0,1314,6.668297317616862,0.99,0.684931506849315
528,ukpolitics,"NHS director 'outraged and disgusted' at 5G conspiracy attacks - A prominent scientist has accused celebrities of ""fanning the flames"" of conspiracy theories linking the outbreak to 5G masts.",1586025969.0,"04/04/2020, 18:46:09",435,0,1306,32.91889531243737,0.98,0.3330781010719755
529,ukpolitics,"Zoom's end-to-end encryption isn't actually end-to-end at all. Good thing the PM isn't using it for Cabinet calls. Oh, for f...",1585829459.0,"04/02/2020, 12:10:59",332,0,1311,65.32642616753992,0.95,0.2532418001525553
530,ukpolitics,"Jeremy Corbyn on Twitter: Secure a credible deal in three months. Put it to the people for the final say, with the option to remain, in six months. That’s our Brexit policy.",1572955844.0,"11/05/2019, 12:10:44",954,0,1305,66.55059221303304,0.95,0.7310344827586207
531,ukpolitics,Fresh BBC complaints as Question Time ranter linked to National Front,1582568900.0,"02/24/2020, 18:28:20",619,0,1309,72.51876269742684,0.95,0.47288006111535524
532,ukpolitics,US woman charged over Harry Dunn death,1576849179.0,"12/20/2019, 13:39:39",346,0,1310,33.2918329634997,0.98,0.2641221374045801
533,ukpolitics,Exclusive: inquests into NHS staff coronavirus deaths told not to look at PPE shortages,1588180962.0,"04/29/2020, 17:22:42",166,0,1306,35.306786988076965,0.97,0.12710566615620214
534,ukpolitics,Coronavirus: Unions call for all workers to receive sick pay if outbreak keeps them home,1583736120.0,"03/09/2020, 06:42:00",460,0,1304,21.152234742966357,0.98,0.35276073619631904
535,ukpolitics,Japan trade deal commits UK to stricter state aid curbs than in EU talks,1600019927.0,"09/13/2020, 17:58:47",306,1,1300,41.743467893758634,0.97,0.2353846153846154
536,ukpolitics,"Post-Brexit UK always welcome back in EU, says Timmermans",1577343580.0,"12/26/2019, 06:59:40",1073,0,1306,81.92821569500302,0.94,0.821592649310873
537,ukpolitics,Labour groups push for Keir Starmer to back proportional representation,1600514013.0,"09/19/2020, 11:13:33",495,2,1298,29.29882405489252,0.98,0.3813559322033898
538,ukpolitics,Protesters clean up Black Lives Matter graffiti,1591689428.0,"06/09/2020, 07:57:08",651,0,1301,85.04250814889292,0.94,0.5003843197540354
539,ukpolitics,Tory MP under fire for attempting to defame Keir Starmer with doctored video,1589448971.0,"05/14/2020, 09:36:11",335,2,1295,43.33504678775353,0.97,0.25868725868725867
540,ukpolitics,Tesco baby food blackmail farmer revealed as former North East Lincolnshire Councillor and Tory chairman - Grimsby Live,1598164622.0,"08/23/2020, 06:37:02",197,0,1294,39.786157613625846,0.97,0.15224111282843894
541,ukpolitics,Top 1% of British earners get 17% of nation's income,1590040807.0,"05/21/2020, 06:00:07",924,0,1293,71.86826535744103,0.95,0.7146171693735499
542,ukpolitics,ITV claims Boris Johnson had four-year affair with Jennifer Arcuri. During that time then Mayor wrote to City Hall monitoring officer nine times declaring various personal interests - but never mentioned Arcuri’s name.,1573986918.0,"11/17/2019, 10:35:18",180,0,1294,46.32733070747122,0.97,0.1391035548686244
543,ukpolitics,A&amp;E waiting times hit worst-ever level,1573724760.0,"11/14/2019, 09:46:00",500,0,1294,19.96841975099437,0.98,0.38639876352395675
544,ukpolitics,Conservative Party under investigation over £2.6m EU election spending. The Electoral Commission announces it is investigating the Tories and the Green Party relating to last May's elections.,1585929355.0,"04/03/2020, 15:55:55",171,0,1297,64.77785108777562,0.95,0.1318427139552814
545,ukpolitics,Morten Morland on the government’s latest coronavirus advice,1584338182.0,"03/16/2020, 05:56:22",439,0,1294,53.30516916211127,0.96,0.339258114374034
546,ukpolitics,Another government U-turn: Free meal vouchers to continue over summer,1592308982.0,"06/16/2020, 12:03:02",373,0,1289,45.12774983234567,0.97,0.28937160589604344
547,ukpolitics,"BBC Economics editor Faisal Islam, while looking into Cummings claims he had been concerned about the threat of a coronavirus, finds he edited that 2019 blogpost to add that quote more recently - the same day he returned to work after Durham",1590446290.0,"05/25/2020, 22:38:10",265,0,1291,26.955453528947828,0.98,0.20526723470178157
548,ukpolitics,UK has 'no plans' to stop its WHO funding after Trump cuts US financial support,1586972760.0,"04/15/2020, 17:46:00",501,0,1290,48.622632387308386,0.96,0.3883720930232558
549,ukpolitics,Labour MP calls Brexiteers ‘sh*tbag racist w***ers’ over Proms row,1598455388.0,"08/26/2020, 15:23:08",967,0,1288,69.38246531784671,0.95,0.7507763975155279
550,ukpolitics,Matt on new immigration minimum wage rules,1582266622.0,"02/21/2020, 06:30:22",366,0,1293,80.54592097465752,0.94,0.28306264501160094
551,ukpolitics,Boris Johnson adviser quits over race and eugenics controversy,1581969485.0,"02/17/2020, 19:58:05",426,0,1286,38.692859390261674,0.97,0.3312597200622084
552,ukpolitics,"Chancellor Rishi Sunak joins forces with French, Spanish and Italian finance ministers to write back to the US Treasury Secretary @stevenmnuchin1 to say they will press ahead with digital taxes, that the pandemic is making tech companies “more powerful and more profitable”..",1592496911.0,"06/18/2020, 16:15:11",155,0,1287,8.739820124210382,0.99,0.12043512043512043
553,ukpolitics,Coronavirus has exposed the myth of British exceptionalism,1586589216.0,"04/11/2020, 07:13:36",1214,1,1283,222.3814238520158,0.85,0.946219797349961
554,ukpolitics,"Nicholas Watt: Jeremy Corbyn confirms Lab will vote against brexit bill on Friday: ‘...by putting an impossible timetable for a good deal with the EU, Boris Johnson has already shown that his priority is a toxic deal with Donald Trump that will sell out our NHS and risk the safety of our food.’",1576611702.0,"12/17/2019, 19:41:42",823,0,1288,98.99425624703144,0.93,0.6389751552795031
555,ukpolitics,EU president tells Boris Johnson his latest Brexit plan is just no-deal: ‘We are fine with that’,1581444198.0,"02/11/2020, 18:03:18",768,0,1289,53.51024176940723,0.96,0.595810705973623
