,Subreddit,Title,Epoch Time,Date,Comments,Awards,Upvotes,Downvotes,Upvote Ratio,Comment/Upvote Ratio
670,ukpolitics,'Removing the whip from Julian Lewis is such a stupid and self-defeating form of revenge it’s hard not to grab the popcorn. He’s the ISC chair. He’s aligned with the opposition already. The Russia report is coming. And now the government has no hold on him.',1594954172.0,"07/17/2020, 02:49:32",275,0,1136,34.547279895516795,0.97,0.2420774647887324
671,ukpolitics,"General election: Jeremy Corbyn says files have 'cold, hard evidence' PM is lying on NI",1575626428.0,"12/06/2019, 10:00:28",360,0,1136,54.42553474982469,0.95,0.31690140845070425
672,ukpolitics,"""Cannabis legalisation will be a likely response to the UK’s upcoming desperation for tax revenue, with concomitant opportunities for investors"" | Politics",1589497863.0,"05/14/2020, 23:11:03",737,0,1132,37.352748325781704,0.97,0.651060070671378
673,ukpolitics,"""What has been scarcely discussed is the fact that, when the transition period ends, so do the 977 bilateral agreements the EU has made with the rest of the world.""",1578040655.0,"01/03/2020, 08:37:35",471,0,1129,66.19157859562415,0.94,0.4171833480956599
674,ukpolitics,"Marcus Rashford's petition to end child food poverty signed by 1,000,000",1603904249.0,"10/28/2020, 16:57:29",161,1,1132,29.96761750694145,0.97,0.142226148409894
675,ukpolitics,England's test and trace is a fiasco because this government hates the public sector,1600321805.0,"09/17/2020, 05:50:05",231,0,1132,46.47322370146526,0.96,0.2040636042402827
676,ukpolitics,Why on earth aren’t English politicians wearing face masks?,1594719008.0,"07/14/2020, 09:30:08",305,0,1127,51.042932705059684,0.96,0.2706299911268855
677,ukpolitics,"'This is extraordinarily damning. Data Impact Assessment for NHS app just published. ‘The DPIA must not claim the data is anonymous, or that the app preserves anonymity, as under UK law it does not’'",1589041235.0,"05/09/2020, 16:20:35",242,0,1124,46.4267851689267,0.96,0.21530249110320285
678,ukpolitics,Boris Johnson under fire for failure to respond to killing of Qassem Suleimani,1578212261.0,"01/05/2020, 08:17:41",571,0,1125,111.6472743730933,0.91,0.5075555555555555
679,ukpolitics,Thousands of depression cases 'linked to universal credit'. A study has linked a spike in mental-health problems among the unemployed with the rollout of universal credit and other government welfare changes.,1582881856.0,"02/28/2020, 09:24:16",251,0,1127,70.03497741358251,0.94,0.22271517302573204
680,ukpolitics,BBC News: UK employment falls by biggest amount in over a decade,1597126792.0,"08/11/2020, 06:19:52",499,0,1124,34.10527529302817,0.97,0.44395017793594305
681,ukpolitics,Coronavirus: infected minster Nadine Dorries had been in No 10,1583879051.0,"03/10/2020, 22:24:11",651,1,1123,22.975706975859794,0.98,0.5796972395369546
682,ukpolitics,"Professor Hayward from SAGE: “We can't turn back the clock but if we had chosen a 2 week circuit breaker at that time [mid September] we would definitely have saved thousands of lives and we would clearly have inflicted substantially less damage on our economy than the proposed 4-week lockdown will""",1604316577.0,"11/02/2020, 11:29:37",293,1,1137,37.93940712112067,0.97,0.25769569041336854
683,ukpolitics,Harry Dunn death: US officials say UK's extradition request 'highly inappropriate',1578722066.0,"01/11/2020, 05:54:26",604,0,1122,32.987290424773846,0.97,0.5383244206773619
684,ukpolitics,NHS faces drug shortages as Brexit stockpile used in Covid crisis | Society,1601964644.0,"10/06/2020, 06:10:44",271,0,1121,20.370880201098544,0.98,0.24174843889384479
685,ukpolitics,Matt on the new points-based immigration system,1582432443.0,"02/23/2020, 04:34:03",86,0,1122,81.13432340112763,0.93,0.0766488413547237
686,ukpolitics,"BREAKING - Russia may have had an impact on the result of the Brexit referendum, according to a secret intelligence report suppressed by Downing Street. See Sunday Times tomorrow",1573948050.0,"11/16/2019, 23:47:30",285,0,1116,56.95402099773105,0.95,0.2553763440860215
687,ukpolitics,MPs say government is out-of-touch for putting Waitrose and M&amp;S on free school meal vouchers scheme but not Aldi and Lidl,1596098372.0,"07/30/2020, 08:39:32",316,0,1117,38.25073238461141,0.97,0.2829006266786034
688,ukpolitics,Robert Jenrick admits Israeli billionaire in donor row is family friend,1593249000.0,"06/27/2020, 09:10:00",222,0,1118,35.11694433001503,0.97,0.19856887298747763
689,ukpolitics,[YouGov] 13% approve of protesters pulling down the Edward Colston statue. 40% approve removal but not in the way in which it was done,1591629878.0,"06/08/2020, 15:24:38",1055,0,1114,33.25588976844574,0.97,0.9470377019748654
690,ukpolitics,John Cleese: Hard to tell if I recorded this 30 years or 10 minutes ago...[video],1592001412.0,"06/12/2020, 22:36:52",383,4,1112,64.93162946435041,0.94,0.3444244604316547
691,ukpolitics,"UK prepared to sacrifice free trade deal with China to protect people of Hong Kong, Raab says",1591199893.0,"06/03/2020, 15:58:13",266,0,1113,28.467099189089367,0.98,0.2389937106918239
692,ukpolitics,"Clean Air in Europe During Lockdown ‘Leads to 11,000 Fewer Deaths’",1588484091.0,"05/03/2020, 05:34:51",178,0,1113,32.65055946690654,0.97,0.15992812219227315
693,ukpolitics,"BREAKING: UK reports 342 new cases of coronavirus and 10 new deaths, raising total to 1,140 cases and 21 dead",1584196885.0,"03/14/2020, 14:41:25",863,0,1113,21.188279450092523,0.98,0.7753818508535489
694,ukpolitics,"Facial recognition has been used unlawfully and violated human rights, Court of Appeal rules in landmark case",1597142305.0,"08/11/2020, 10:38:25",133,0,1112,18.778228934683284,0.98,0.1196043165467626
695,ukpolitics,Britain is the worst-hit country outside of the US and Brazil. It STILL won't wear masks,1594586752.0,"07/12/2020, 20:45:52",555,0,1109,79.11387594938651,0.93,0.5004508566275925
696,ukpolitics,A tenth of UK millionaires paid lower rate of tax than someone earning just £15k,1592297406.0,"06/16/2020, 08:50:06",332,0,1102,44.49324405365769,0.96,0.30127041742286753
697,ukpolitics,Chief nurse dropped from Downing Street coronavirus briefing ‘after refusing to back Dominic Cummings’,1591964756.0,"06/12/2020, 12:25:56",169,0,1107,31.41291968255291,0.97,0.15266485998193316
698,ukpolitics,"Being wealthy adds nine years to life expectancy, says study",1579072384.0,"01/15/2020, 07:13:04",634,0,1105,51.391185426321044,0.96,0.5737556561085972
699,ukpolitics,There’s been a 165% increase in homelessness since the Tories took power,1574245731.0,"11/20/2019, 10:28:51",269,0,1105,46.28446951919955,0.96,0.24343891402714932
700,ukpolitics,Boris Johnson’s father accidentally emails BBC expressing China’s concerns over ‘no message’ from PM after coronavirus,1580976856.0,"02/06/2020, 08:14:16",234,0,1107,32.74493093587648,0.97,0.21138211382113822
701,ukpolitics,"""Something that doesn't exist at the moment"" Transport Secretary, Grant Shapps MP, admits on #BBCBreakfast the technology to carry out PM's moonshot attempt for testing doesn't currently exist.",1599725940.0,"09/10/2020, 08:19:00",239,1,1106,5.729597115675688,0.99,0.21609403254972875
702,ukpolitics,With China coming under scrutiny for false reporting of COVID-19 figures I was reminded of this somewhat comic video when the BBC attempted to interview an independent political candidate,1586272831.0,"04/07/2020, 15:20:31",392,0,1101,30.490339650198848,0.97,0.35603996366939145
703,ukpolitics,The Tories can’t win without the press. This isn’t how democracy works.,1573816532.0,"11/15/2019, 11:15:32",434,0,1106,95.2338957837992,0.92,0.3924050632911392
704,ukpolitics,"Westminster voting intention: LAB: 42% (+5) CON: 37% (-3) LDEM: 8% (-) GRN: 5% (-) via @IpsosMORI, 22 - 28 Oct",1604054420.0,"10/30/2020, 10:40:20",591,0,1107,47.772094759660376,0.96,0.5338753387533876
705,ukpolitics,RSPCA attacks Liz Truss's food trade panel as a 'Trojan horse' that risks undermining Britain's world-leading farm and food standards,1594627274.0,"07/13/2020, 08:01:14",166,0,1098,35.446086083657065,0.97,0.151183970856102
706,ukpolitics,"Boris Johnson says the NHS will be ""overwhelmed"" and Britain will become like Italy unless people immediately follow social distancing orders",1584831942.0,"03/21/2020, 23:05:42",816,0,1097,9.106822900725547,0.99,0.7438468550592525
707,ukpolitics,SNP MP Margaret Ferrier breached Covid-19 guidelines by traveling to parliament before waiting for results of a positive covid test after experiencing symptoms,1601571927.0,"10/01/2020, 17:05:27",353,5,1100,35.717637799462864,0.97,0.3209090909090909
708,ukpolitics,Women still can’t have birth partners - but we can all go to Nandos,1600639287.0,"09/20/2020, 22:01:27",326,0,1100,41.9589178107849,0.96,0.2963636363636364
709,ukpolitics,No 10 should back working from home,1596957851.0,"08/09/2020, 07:24:11",703,0,1097,36.851423986206555,0.97,0.6408386508659982
710,ukpolitics,Fertility rate: 'Jaw-dropping' global crash in children being born,1594794239.0,"07/15/2020, 06:23:59",1694,0,1098,25.513957730662014,0.98,1.5428051001821494
711,ukpolitics,Dominic Cummings claimed he wrote about coronavirus last year to bolster todays other claim he wasn't against lockdown - he appears to have been lying about that,1590440974.0,"05/25/2020, 21:09:34",195,0,1101,38.322955384622446,0.97,0.1771117166212534
712,ukpolitics,"Dido 'Queen of Carnage' Harding to lead UK's Institute for Health Protection because Test and Trace went so well. Oh, that's right. It was a farce",1597762814.0,"08/18/2020, 15:00:14",188,0,1095,43.893261555211666,0.96,0.17168949771689498
713,ukpolitics,"Thanks to outsourcing, England's test and trace system is in chaos",1596179931.0,"07/31/2020, 07:18:51",222,0,1101,53.08596415433544,0.95,0.2016348773841962
714,ukpolitics,Peter Brookes on coronavirus panic buying,1583562364.0,"03/07/2020, 06:26:04",79,0,1095,76.67918046339446,0.93,0.07214611872146119
715,ukpolitics,"Prince Andrew accuser Virginia Roberts Giuffre: 'I'm not suicidal, in case something happens to me'",1576081252.0,"12/11/2019, 16:20:52",134,0,1095,25.386477973790534,0.98,0.1223744292237443
716,ukpolitics,"80% of low-income families financially worse off since pandemic, new report finds",1598335406.0,"08/25/2020, 06:03:26",317,0,1099,37.7935252925688,0.97,0.28844404003639673
717,ukpolitics,Politicians like to posture about Northern Ireland. But no one really cares about us,1600582513.0,"09/20/2020, 06:15:13",572,1,1094,36.16735514696302,0.97,0.5228519195612431
718,ukpolitics,Revealed: ex-KGB agent did meet Boris Johnson at Italian party,1573978252.0,"11/17/2019, 08:10:52",123,0,1095,51.449602414149695,0.96,0.11232876712328767
719,ukpolitics,China will override Hong Kong legal system as details of new law revealed,1592670385.0,"06/20/2020, 16:26:25",303,2,1089,25.731921612956285,0.98,0.27823691460055094
720,ukpolitics,Boris Johnson boasts he's helped hungry children while ending their free meal vouchers,1592131327.0,"06/14/2020, 10:42:07",143,0,1088,54.92368933201533,0.95,0.13143382352941177
721,ukpolitics,A moment of history. The UK has officially left the European Union.,1580511699.0,"01/31/2020, 23:01:39",1247,4,1095,124.62922255426315,0.9,1.1388127853881278
722,ukpolitics,"Andrew Neil accused Labour of letting off a Holocaust denier with ""just a letter of warning"" but a Jewish Chronicle article shows that this is completely untrue",1574841270.0,"11/27/2019, 07:54:30",467,0,1090,114.52816726038895,0.9,0.42844036697247706
723,ukpolitics,The fall in life expectancy is proof that austerity kills,1582697942.0,"02/26/2020, 06:19:02",602,0,1089,125.96657406742338,0.9,0.5528007346189164
724,ukpolitics,"Conservatives in Finchley, Putney and Hendon have been placing these outside primary schools on polling day.",1576148815.0,"12/12/2019, 11:06:55",456,0,1089,56.48414905167397,0.95,0.418732782369146
725,ukpolitics,UK has 'insufficient ships' to protect fisheries after Brexit,1580026036.0,"01/26/2020, 08:07:16",774,0,1083,48.597508323997545,0.96,0.7146814404432132
726,ukpolitics,"The Secret Barrister on Twitter: This...doesn’t actually make any sense. It’s not a legal position, it’s a string of words desperately grasping for meaning.",1599753671.0,"09/10/2020, 16:01:11",351,1,1085,37.49560164726108,0.97,0.32350230414746545
727,ukpolitics,YouGov: By 53% to 40% Brits say that the Dominic Cummings story is still important and that people should continue to try and hold him to account on the issue.,1590686864.0,"05/28/2020, 17:27:44",246,0,1084,28.14003932090941,0.97,0.22693726937269373
728,ukpolitics,BREAKING: Labour has lodged formal complaint with the Parliamentary Commissioner for Standards asking for Boris Johnson's £15k Mustique villa holiday to be investigated,1581601700.0,"02/13/2020, 13:48:20",177,0,1086,58.86540348265976,0.95,0.16298342541436464
729,ukpolitics,Whips knew of concerns about rape suspect Tory MP ‘for years’,1596875712.0,"08/08/2020, 08:35:12",156,0,1079,35.83232045498312,0.97,0.14457831325301204
730,ukpolitics,Piers Morgan slams 'gutless weasel' Boris Johnson over hypocritical free press comments,1599461652.0,"09/07/2020, 06:54:12",358,0,1080,74.92610355132888,0.94,0.3314814814814815
731,ukpolitics,Since the crisis began there has been a collapse in confidence in the media across countries in the survey - the biggest fall being in the UK with a 21% net loss in confidence,1586852802.0,"04/14/2020, 08:26:42",394,0,1085,55.36144586525347,0.95,0.3631336405529954
732,ukpolitics,"#OTD 2000. On Frost, Tony Blair pledges an extra £12bn for the #NHS - to bring spending up to EU average by 2006. It resulted in one of the biggest ever increases for the NHS - exceeded by the £24bn extra in 04/05 - with nurses also receiving a £1k pay rise.",1579159429.0,"01/16/2020, 07:23:49",506,0,1079,50.271112219186534,0.96,0.468952734012975
733,ukpolitics,Cartoon for @LondonEconomic [oc],1603214649.0,"10/20/2020, 17:24:09",35,1,1080,21.3932512802553,0.98,0.032407407407407406
734,ukpolitics,What a Federal UK might look like.,1603195154.0,"10/20/2020, 11:59:14",645,1,1080,79.0281703684052,0.93,0.5972222222222222
735,ukpolitics,"Brexit will not get done by 2021, EU chief negotiator admits in leaked recording that blows hole in Boris Johnson promise",1576075570.0,"12/11/2019, 14:46:10",181,0,1073,58.813061776935456,0.95,0.16868592730661697
736,ukpolitics,General election: John Bercow to join Sky News for election night coverage,1574100429.0,"11/18/2019, 18:07:09",162,0,1069,28.392614498389094,0.97,0.15154349859681945
737,ukpolitics,Jeremy Corbyn: Don't listen to the scare stories in the billionaire-owned press. Our plans are fully-costed and they'll improve people’s lives. But don’t just take my word for it - 163 of our country's top economists and academics agree.,1576079766.0,"12/11/2019, 15:56:06",233,0,1078,111.33788307100804,0.91,0.21614100185528756
738,ukpolitics,YouGov: 64% of Brits - including 73% of Labour voters and 59% of Tory voters - support Labour's vow to bring in laws which will control the rate at which landlords can increase the rent on privately rented properties,1574700041.0,"11/25/2019, 16:40:41",285,0,1077,53.867620115538784,0.95,0.2646239554317549
739,ukpolitics,"[Douglas Ross MP] I haven't commented publicly on the situation with Dominic Cummings as I have waited to hear the full details. I welcome the statement to clarify matters, but there remains aspects of the explanation which I have trouble with. As a result I have resigned as a government Minister.",1590481682.0,"05/26/2020, 08:28:02",327,1,1071,19.945140470434126,0.98,0.30532212885154064
740,ukpolitics,"Nadia Whittome MP on Twitter, ‘This morning on @politicseastmid, I urged Tory MPs: Don't let history remember you as the people who were prepared to forfeit lives and livelihoods because you didn't want Keir Starmer and Andy Burnham to be right.’",1603659479.0,"10/25/2020, 20:57:59",229,0,1069,55.931865654065405,0.95,0.21421889616463985
741,ukpolitics,"Boris Johnson Pledges To 'Build Build Build' – Then Cuts Affordable Homes Budget: Just weeks after budget promised £12bn over five years, cash has now been spread over eight years",1593517598.0,"06/30/2020, 11:46:38",272,0,1062,16.549673840311698,0.98,0.256120527306968
742,ukpolitics,"A British Newspaper Has Given Chinese Coronavirus Propaganda A Direct Line To The UK During the pandemic, the Daily Telegraph continues to sell space to China to push the party line.",1585799210.0,"04/02/2020, 03:46:50",467,2,1066,52.460774209482,0.95,0.43808630393996245
743,ukpolitics,Home Office boss quits over 'campaign against him',1582970554.0,"02/29/2020, 10:02:34",482,0,1065,31.954669850105347,0.97,0.45258215962441317
744,ukpolitics,Extreme poverty 'will double by Christmas' in UK because of Covid-19,1600061495.0,"09/14/2020, 05:31:35",407,2,1060,26.064525055845706,0.98,0.3839622641509434
745,ukpolitics,"Despite PM's praise of nurses, it's Tory policies that made them suffer",1586799070.0,"04/13/2020, 17:31:10",223,0,1062,129.80475579501945,0.89,0.20998116760828625
746,ukpolitics,"Revealed: UK shields used in US BLM protests, despite govt claim of ""no evidence""",1601876387.0,"10/05/2020, 05:39:47",522,0,1062,91.25374379842492,0.92,0.4915254237288136
747,ukpolitics,Morten Morland on new immigration rules being proposed to Parliament by Priti Patel,1589864124.0,"05/19/2020, 04:55:24",518,0,1066,87.33281916366172,0.92,0.48592870544090055
748,ukpolitics,‘They want to divide and rule’: Sir Ed Davey vows not to allow government to turn British politics into ‘culture war’,1598773264.0,"08/30/2020, 07:41:04",624,0,1061,60.81251454141852,0.95,0.588124410933082
749,ukpolitics,Peter Foster: It beggars belief that we’re back to ‘no deal’ threats again - and cab ministers who say trading with EU on WTO terms “isn’t so bad”. Seriously? What an ambition for any govt to have. No wonder the world thinks we’ve gone mad. #brexit.,1579278137.0,"01/17/2020, 16:22:17",459,0,1064,72.01822554087403,0.94,0.43139097744360905
750,ukpolitics,"NEW Forest councillors have hit back at Sir Desmond Swayne after the MP said US rioters ""have it coming"" in response to emails from constituents about to protests following the death of George Floyd.",1591428676.0,"06/06/2020, 07:31:16",371,0,1058,44.03037316816972,0.96,0.3506616257088847
751,ukpolitics,MPs ask No 10 to clarify Dominic Cummings role in defence review | Politics,1597288213.0,"08/13/2020, 03:10:13",139,0,1055,26.59162724787825,0.98,0.13175355450236967
752,ukpolitics,"BBC One - Panorama, Has the Government Failed the NHS?",1588016431.0,"04/27/2020, 19:40:31",331,1,1059,38.93677673568709,0.96,0.3125590179414542
753,ukpolitics,‘They’re in a panic’: Unease grows in UK government over handling of Covid-19,1589613714.0,"05/16/2020, 07:21:54",422,0,1059,79.8925843622244,0.93,0.39848914069877245
754,ukpolitics,"Boris Johnson said UK’s poorest communities are made-up of ‘chavs,’ ‘burglars,’ ‘drug addicts,’ and ‘losers’",1575152059.0,"11/30/2019, 22:14:19",216,0,1053,56.472551389313594,0.95,0.20512820512820512
755,ukpolitics,Government paid Vote Leave AI firm to analyse UK citizens' tweets,1597079095.0,"08/10/2020, 17:04:55",143,0,1059,36.02693628911402,0.97,0.13503305004721436
756,ukpolitics,"Brendan Cox on Twitter: The day before the election in 2015 Jo, the kids and me were knocking on doors mobilising the vote. Jo met a Tory who was thinking about not voting. She urged them to vote because even though it made her election less likely, voting was more important. Please vote.",1576139131.0,"12/12/2019, 08:25:31",170,0,1054,54.10801042944945,0.95,0.16129032258064516
757,ukpolitics,How the government quietly revealed all the ways in which Brexit will make our lives worse,1595192613.0,"07/19/2020, 21:03:33",477,0,1051,50.86854477443649,0.95,0.4538534728829686
758,ukpolitics,Sturgeon: Scotland 'cannot be imprisoned' in UK,1576405552.0,"12/15/2019, 10:25:52",1480,2,1051,110.73895413794457,0.9,1.4081826831588964
759,ukpolitics,"""UK chemical industry warns of £1bn cost to duplicate EU regime” — Peter Foster for the Financial Times.",1596436198.0,"08/03/2020, 06:29:58",570,0,1051,48.5511048586427,0.96,0.5423406279733587
760,ukpolitics,Russia report reveals UK government failed to address Kremlin interference,1595324842.0,"07/21/2020, 09:47:22",361,0,1053,30.72730306889457,0.97,0.34283000949667614
761,ukpolitics,"Due to depreciation of the sterling, the Brexit referendum increased UK consumer prices by 2.9%, which amounts to £870 per year increase in the cost of living for the average UK household.",1583148951.0,"03/02/2020, 11:35:51",288,0,1050,65.63138734378549,0.94,0.2742857142857143
762,ukpolitics,'Biggest failure in a generation': Where did Britain go wrong?,1588663352.0,"05/05/2020, 07:22:32",823,1,1051,110.3221519548465,0.91,0.7830637488106565
763,ukpolitics,Matt Hancock tweets new coronavirus advice - but people had to pay to read it,1584259174.0,"03/15/2020, 07:59:34",172,0,1053,69.36803102263798,0.94,0.16334283000949668
764,ukpolitics,"The BBC normalised racism last night, pure and simple",1582294655.0,"02/21/2020, 14:17:35",1563,0,1047,202.8409901020566,0.84,1.492836676217765
765,ukpolitics,Rupert Murdoch gives up his bonus as News Corp loses US$1bn in three months,1588922652.0,"05/08/2020, 07:24:12",168,0,1046,54.13486683272981,0.95,0.16061185468451242
766,ukpolitics,Exclusive: Second Covid wave forecast to be more deadly than first,1603867841.0,"10/28/2020, 06:50:41",883,1,1044,48.22777656405924,0.96,0.8457854406130269
767,ukpolitics,"Greg Marshall (Labour Parliamentary Candidate) As I understand it, the police had to intervene to stop my political opponents illegally flyposting all over #Broxtowe today at 2am. Outrageous behaviour.",1576160252.0,"12/12/2019, 14:17:32",113,0,1047,38.913026543663364,0.96,0.10792741165234002
768,ukpolitics,"Hostility to Corbyn curbed labour efforts to tackle antisemitism, says leaked report",1586715978.0,"04/12/2020, 18:26:18",983,0,1047,70.30261219836666,0.94,0.938872970391595
769,ukpolitics,"The Brexit Party is to be relaunched as an anti-lockdown party called Reform UK, in a move which could alarm Conservative MPs jittery about Covid-19 policy. Plans to change the name of the Brexit Party to Reform UK were submitted to the Electoral Commission last week.",1604266432.0,"11/01/2020, 21:33:52",670,1,1045,41.66289930970265,0.96,0.6411483253588517
770,ukpolitics,Boris Johnson faces fury at PMQs as he claims NO country has a working coronavirus tracing app - but Keir Starmer tells him 12MILLION people have already downloaded Germany's version | Daily Mail,1593003538.0,"06/24/2020, 12:58:58",316,0,1038,50.66503134860204,0.95,0.3044315992292871
771,ukpolitics,Peter Brookes on the declining global stock markets,1582957292.0,"02/29/2020, 06:21:32",301,0,1045,111.89941180893788,0.9,0.2880382775119617
772,ukpolitics,UK plans to bring forward ban on fossil fuel vehicles to 2030,1600666798.0,"09/21/2020, 05:39:58",788,1,1044,32.44774472982908,0.97,0.7547892720306514
773,ukpolitics,Morten Morland cartoon,1597479778.0,"08/15/2020, 08:22:58",137,2,1046,37.181595354945784,0.97,0.13097514340344169
774,ukpolitics,Another time Gove turned up to something he was not qualified for,1574974852.0,"11/28/2019, 21:00:52",105,1,1043,57.45163387673847,0.95,0.10067114093959731
775,ukpolitics,"Dominic Cummings’ unpaid £30,000 council bill ‘written off’",1602706654.0,"10/14/2020, 20:17:34",169,0,1041,37.67654567642421,0.97,0.16234390009606148
776,ukpolitics,"Jeremy Corbyn: Investing in our public services is not ""free stuff"". It ensures that we have the best healthcare, the best education and the most skilled workforce. And how will we pay for it? By ending the actual giveaways Tories have been handing their billionaire friends.",1575838949.0,"12/08/2019, 21:02:29",593,0,1034,75.69732048477954,0.93,0.5735009671179884
777,ukpolitics,"Keir Starmer - “Too many people today are struggling to make ends meet, held back by jobs that don’t pay enough; a social security system that has subjected people to the most appalling indignity; and a public sector that is on its knees after a decade of cuts. [Thread]”",1581087436.0,"02/07/2020, 14:57:16",397,0,1035,60.18464827408275,0.95,0.38357487922705313
778,ukpolitics,Easyjet seeks state loans — but pays Stelios £60m,1584863345.0,"03/22/2020, 07:49:05",399,0,1041,17.880976431308227,0.98,0.38328530259365995
779,ukpolitics,BBC accused of removing audience laughter at Boris Johnson on Question Time,1574619574.0,"11/24/2019, 18:19:34",139,1,1033,58.881046873708556,0.95,0.1345595353339787
780,ukpolitics,MP Philip Davies brands 16-year-old ‘intolerant’ for supporting free school meals extension,1603569598.0,"10/24/2020, 19:59:58",280,0,1031,31.504985418464003,0.97,0.27158098933074687
781,ukpolitics,How much do you trust the following on Coronavirus? Yougov/Sky News 20-21 April,1587672895.0,"04/23/2020, 20:14:55",571,0,1023,28.070413868540072,0.97,0.5581622678396871
782,ukpolitics,Johnson's pick to help lead Grenfell inquiry has links to cladding firm,1579190467.0,"01/16/2020, 16:01:07",165,0,1025,41.796700909006404,0.96,0.16097560975609757
783,ukpolitics,"Following its inclusion in the Labour manifesto, 69% of Brits say that historical injustice, colonialism and the role of the British Empire should be taught as part of the national curriculum",1574869347.0,"11/27/2019, 15:42:27",480,0,1021,60.77768973189336,0.94,0.4701273261508325
784,ukpolitics,"Britons paying 40% more for energy than in 2015, analysis reveals",1577692000.0,"12/30/2019, 07:46:40",410,0,1026,56.74241029078348,0.95,0.3996101364522417
785,ukpolitics,Inventing a 'migrant invasion' is part of a toxic rhetorical ploy | Kenan Malik,1597648513.0,"08/17/2020, 07:15:13",754,0,1021,152.92389163987195,0.87,0.7384916748285995
