,Subreddit,Title,Epoch Time,Date,Comments,Awards,Upvotes,Downvotes,Upvote Ratio,Comment/Upvote Ratio
219,ukpolitics,Boris Johnson struggling to hire as no-one wants to work with Dominic Cummings,1602478177.0,"10/12/2020, 04:49:37",375,0,1899,52.202898785986235,0.97,0.19747235387045814
220,ukpolitics,Sadiq Khan says Cobra hasn't met since May 10 and he hasn't spoken to Boris Johnson in four months,1600442160.0,"09/18/2020, 15:16:00",244,1,1891,32.38641551349383,0.98,0.12903225806451613
221,ukpolitics,Labour Manifesto,1574335542.0,"11/21/2019, 11:25:42",2775,1,1884,104.27878640799463,0.95,1.4729299363057324
222,ukpolitics,Morten Morland on the spread of the coronavirus,1583217537.0,"03/03/2020, 06:38:57",245,0,1882,102.67678318306025,0.95,0.1301806588735388
223,ukpolitics,Matt on new measures to lockdown Britain,1585028902.0,"03/24/2020, 05:48:22",80,0,1880,50.29151362648213,0.97,0.0425531914893617
224,ukpolitics,Anger as Michael Gove got daughter tested while NHS staff still wait,1586778260.0,"04/13/2020, 11:44:20",516,0,1882,71.56375643981573,0.96,0.27417640807651433
225,ukpolitics,Conservative Party ministers bankrolled by donors linked to Russia,1595484117.0,"07/23/2020, 06:01:57",326,0,1873,48.64840780824238,0.97,0.17405232247730912
226,ukpolitics,Bob on Keir Starmer's election as leader of the Labour Party,1586065309.0,"04/05/2020, 05:41:49",575,0,1879,154.2474599925199,0.92,0.30601383714741887
227,ukpolitics,"'Would you rather your house burnt down, or that your daughter married a black man?'",1601625732.0,"10/02/2020, 08:02:12",863,2,1868,101.19252712211323,0.95,0.4619914346895075
228,ukpolitics,UK in recession for first time in 11 years,1597212184.0,"08/12/2020, 06:03:04",1829,1,1868,29.63136428584653,0.98,0.9791220556745182
229,ukpolitics,Boris Johnson’s govt is sitting on an Internal report that estimates that the UK shellfish industry - the biggest &amp; most profitable part of the UK fishing sector - will collapse in 10 months of there’s no deal[Thread],1582367154.0,"02/22/2020, 10:25:54",468,0,1861,77.22926805405473,0.96,0.25147770016120363
230,ukpolitics,"""Under the Tories your child's education could depend on just one book. (Your cheque book.)"" - 1987 Labour Party Poster",1603020858.0,"10/18/2020, 11:34:18",358,0,1861,90.62868637105339,0.95,0.19236969371305748
231,ukpolitics,[Discussion] When was the last time that a PM was not backed by Rupert Murdoch and his media? We've had decades of hand picked PMs and yet everyone here is flipping out that Labour lost. Nothing changed. Murdoch did his thing and we do not live in a free democracy.,1576689118.0,"12/18/2019, 17:11:58",617,1,1863,281.4613931558497,0.87,0.33118625872249063
232,ukpolitics,York to ban private cars from city centre within three years. City councillors unveil ‘unashamedly ambitious’ goal to cut carbon emissions.,1577788913.0,"12/31/2019, 10:41:53",538,0,1856,33.946086614320166,0.98,0.28987068965517243
233,ukpolitics,Joe Biden's campaign statement on Ireland &amp; Irish America. Joe Biden “will ensure there will be no US / U.K. trade deal if the implementation of Brexit imperils the Good Friday Agreement.”,1602976646.0,"10/17/2020, 23:17:26",843,0,1851,67.93553721568014,0.96,0.4554294975688817
234,ukpolitics,"British far right ‘becoming more racist’ after Black Lives Matter protests, report finds",1597567171.0,"08/16/2020, 08:39:31",2037,0,1852,127.27813513554133,0.94,1.099892008639309
235,ukpolitics,Rare footage of Boris Johnson at nudist protest emerges from early 2000s,1594664402.0,"07/13/2020, 18:20:02",195,0,1854,55.66175046753847,0.97,0.10517799352750809
236,ukpolitics,"General Election: Almost every Tory Ad is dishonest, compared to none of labour's, Research finds. Most people believe politicians should be legally required to be accurate in ads",1576063346.0,"12/11/2019, 11:22:26",146,2,1847,89.88069857712003,0.95,0.07904710341093665
237,ukpolitics,"Peter Geoghegan: ""This #defundthebbc thing came on my radar again a few minutes ago so decided to take a bit of a closer look. Not much info on site https://defundbbc.uk, but does have a privacy policy. And guess what the only website with same privacy policy I can find is.... Brexit Central",1592345740.0,"06/16/2020, 22:15:40",440,1,1842,47.98102137709384,0.97,0.23887079261672095
238,ukpolitics,"The contract on Corbyn: Corbyn is not an anti-Semite. His real sin is to fight against injustice in the world, including the version Israel perpetrates",1574908643.0,"11/28/2019, 02:37:23",812,0,1839,244.7881839992342,0.88,0.4415443175638934
239,ukpolitics,Tom Harper on Twitter: Breaking - 9 Russian businessmen who gave money to the Conservative party are named in a secret intelligence report on the threats posed to UK democracy which was suppressed last week by Downing Street. See tomorrow’s Sunday Times story with @cazjwheeler,1573335787.0,"11/09/2019, 21:43:07",282,2,1838,28.069570385216366,0.98,0.15342763873775844
240,ukpolitics,Comparing lockdown to World War Two is an insult to the wartime generation,1589087047.0,"05/10/2020, 05:04:07",503,0,1843,105.47327167095386,0.95,0.272924579489962
241,ukpolitics,Investigation reveals Leicester clothes workers supplying Boohoo are paid as little as £3.50 an hour,1593932614.0,"07/05/2020, 07:03:34",445,0,1840,36.801303080954085,0.98,0.2418478260869565
242,ukpolitics,MP caught on tube without mask complains country is ‘like East Germany under the Stasi’,1601017643.0,"09/25/2020, 07:07:23",450,0,1834,13.296168782060477,0.99,0.24536532170119957
243,ukpolitics,Michael Gove's Twitter account likes picture of porn before swiftly deleting it,1590780292.0,"05/29/2020, 19:24:52",276,0,1831,50.995361878800395,0.97,0.1507373020207537
244,ukpolitics,"UK PM says ""everyone"" should now avoid social contact with others and stop non-essential travel to fight coronavirus",1584378344.0,"03/16/2020, 17:05:44",1574,0,1836,16.397482581922077,0.99,0.8572984749455338
245,ukpolitics,"Keir Starmer on Twitter ""I'm very pleased and relieved that the test result for one of my children came back negative this morning. Thank you to the NHS hospital where my wife works for ensuring that their staff and family members have quick access to a test""",1600252459.0,"09/16/2020, 10:34:19",263,3,1833,59.90793524319429,0.97,0.14348063284233498
246,ukpolitics,Russian Tory donors named in secret report,1573370287.0,"11/10/2019, 07:18:07",273,0,1830,32.09181671374813,0.98,0.14918032786885246
247,ukpolitics,UK's number of doctors per capita is one of the lowest in Europe,1577087607.0,"12/23/2019, 07:53:27",685,0,1828,42.905533530436514,0.98,0.37472647702407
248,ukpolitics,Arrogant and offensive. Can you imagine having to work with these truth twisters?,1590339485.0,"05/24/2020, 16:58:05",265,3,1822,29.450805203555092,0.98,0.14544456641053788
249,ukpolitics,Private Eye Summer Quiz Pt 2...,1598523966.0,"08/27/2020, 10:26:06",203,0,1822,22.923419028351645,0.99,0.11141602634467618
250,ukpolitics,Boris Johnson reprimanded by watchdog for repeatedly misleading parliament on child poverty,1596125804.0,"07/30/2020, 16:16:44",136,0,1818,60.924627127700205,0.97,0.0748074807480748
251,ukpolitics,Cannabis campaigners say legalise weed NOW to ease coronavirus anxieties and UK economy,1601732622.0,"10/03/2020, 13:43:42",744,4,1821,98.112976918311,0.95,0.4085667215815486
252,ukpolitics,Video resurfaces of Iain Duncan Smith trying to stop MPs scrutinising Brexit agreement he now wants rewritten,1596629819.0,"08/05/2020, 12:16:59",253,1,1823,62.1052248122603,0.97,0.1387822270981898
253,ukpolitics,Trump promised the U.K. a lucrative U.S. trade deal. But Britons don't believe him and many want to prioritize the E.U.,1589725937.0,"05/17/2020, 14:32:17",531,0,1821,105.67674394263645,0.95,0.2915980230642504
254,ukpolitics,Sturgeon stunned as Johnson goes AWOL in middle of pandemic. The leaders of Scotland and Wales have accused Boris Johnson of deserting his post at one of the “most critical points” of the pandemic.,1600499801.0,"09/19/2020, 07:16:41",337,2,1815,66.37050576305819,0.96,0.18567493112947658
255,ukpolitics,‘You can’t lose an election as badly as we did in December and carry on as if everything is fine’ – Sir Keir Starmer,1597473965.0,"08/15/2020, 06:46:05",1371,1,1814,81.6722451815674,0.96,0.7557883131201764
256,ukpolitics,"🚨 LABOUR LEAD for the the first time since Boris Johnson became PM 🚨 Latest @OpiniumResearch poll of @ObserverUK: LAB 42% (+3) CON 39% (-3) LD 5% (-1) Changes from fortnight ago. Poll conducted online among 2,002 people, Sept 23-25.",1601146879.0,"09/26/2020, 19:01:19",715,10,1808,105.09336952856506,0.95,0.3954646017699115
257,ukpolitics,"This reply by @MattHancock is one of the most extraordinary replies I’ve ever seen in the House of Commons. The evasiveness, the rudeness, the arrogance. On a life and death issue.",1601816925.0,"10/04/2020, 13:08:45",292,0,1804,34.42188570579947,0.98,0.16186252771618626
258,ukpolitics,John Bercow reveals he was subjected to Anti-Semitic abuse from Conservatives,1581142577.0,"02/08/2020, 06:16:17",429,2,1806,139.11009956018916,0.93,0.23754152823920266
259,ukpolitics,Google bans eight different Tory election adverts as disinformation concerns mount,1575164329.0,"12/01/2019, 01:38:49",232,0,1803,39.92157332634383,0.98,0.12867443150305047
260,ukpolitics,HRMC has more staff chasing benefit cheats than wealthy tax dodgers,1579612803.0,"01/21/2020, 13:20:03",462,1,1803,80.92305126096858,0.96,0.2562396006655574
261,ukpolitics,Legal action taken against PM over refusal to investigate Kremlin meddling,1603954090.0,"10/29/2020, 06:48:10",262,2,1797,59.91735266411524,0.97,0.1457985531441291
262,ukpolitics,"Tories used disinformation 'with new level of impunity' during 2019 election, report finds",1598197331.0,"08/23/2020, 15:42:11",376,1,1793,66.94108607828525,0.96,0.20970440602342444
263,ukpolitics,"Chief nurse Ruth May confirms ""I was dropped"" from no10 press conference in June, after she was asked a preparatory session about Dominic Cumnings' conduct ""In my opinion the rules were clear, they were there for everyone's safety and they applied to us all.""",1595253032.0,"07/20/2020, 13:50:32",193,0,1799,36.09077776671006,0.98,0.10728182323513062
264,ukpolitics,"Keir Starmer: I understand that the Government’s trying to rise to the challenge, but we’ve seen a real issue about protective equipment with the Government saying one thing and the frontline saying another. There must be proper, Parliamentary scrutiny of the decisions being made.",1586690616.0,"04/12/2020, 11:23:36",385,0,1790,52.88012719812218,0.97,0.21508379888268156
265,ukpolitics,MP caring for disabled wife says Government 'silencing' him amid bitter row over end of virtual Commons,1591339179.0,"06/05/2020, 06:39:39",302,0,1787,28.45327336536866,0.98,0.1689983212087297
266,ukpolitics,Jacob Rees-Mogg told to quit after overseeing Commons 'shambles'. Jacob Rees-Mogg is under increasing pressure to resign over the shambolic return of MPs to Parliament amid fears that the move is endangering lives and harming democracy.,1591304176.0,"06/04/2020, 20:56:16",280,0,1789,81.92320010844105,0.96,0.15651201788708777
267,ukpolitics,MP who voted against same-sex marriage elected to be parliament’s new LGBT and equalities chief,1580391046.0,"01/30/2020, 13:30:46",402,0,1788,67.82615060169474,0.96,0.22483221476510068
268,ukpolitics,Britain is sleepwalking towards authoritarianism,1597731362.0,"08/18/2020, 06:16:02",1186,0,1783,148.41808473732704,0.92,0.6651710600112171
269,ukpolitics,Dominic Cummings was ‘spotted on riverside path in Barnard Castle’,1590907960.0,"05/31/2020, 06:52:40",413,0,1784,75.63048984127522,0.96,0.23150224215246637
270,ukpolitics,A low profile event; the Lib Dem parliamentary party group photo,1576510041.0,"12/16/2019, 15:27:21",662,0,1783,47.89724473409751,0.97,0.3712843522153674
271,ukpolitics,"Cummings saga damaged UK lockdown unity, study suggests",1596086118.0,"07/30/2020, 05:15:18",494,0,1784,69.39481139122336,0.96,0.2769058295964126
272,ukpolitics,Tax-avoiding firms ‘should not receive government support’. The Scottish Government signalled its support for a proposal to bar companies registered in tax havens from receiving bailouts.,1589805813.0,"05/18/2020, 12:43:33",177,0,1779,34.49834778365789,0.98,0.09949409780775717
273,ukpolitics,Boris Johnson 'broke government social distancing rules' by hosting meeting for 50 Tory MPs,1599226137.0,"09/04/2020, 13:28:57",185,3,1780,63.38047106118438,0.97,0.10393258426966293
274,ukpolitics,Blower on the 2 million people left unemployed due to coronavirus,1586929672.0,"04/15/2020, 05:47:52",559,0,1773,64.73291021171985,0.96,0.3152848279751833
275,ukpolitics,"BREAKING: Muslim Council of Britain stands by Chief Rabbi but also tells people to vote with their conscience on Islamophobia in Tory party: “This an issue that is particularly acute in the Conservative Party who have approached Islamophobia with denial, dismissal and deceit.”",1574768056.0,"11/26/2019, 11:34:16",837,0,1780,162.82420022271708,0.92,0.4702247191011236
276,ukpolitics,EU National Anthem hits number 1 on UK download chart - on Brexit Day,1580488047.0,"01/31/2020, 16:27:27",476,0,1777,136.88213081368735,0.93,0.2678671918964547
277,ukpolitics,"London’s extraordinary surplus of empty luxury apartments revealed: 39% of homes worth £1m to £5m and 64% of homes worth more than £5m are underused. Moreover, 42% of the homes owned by foreign investors are empty.",1577991870.0,"01/02/2020, 19:04:30",630,0,1781,30.164553309534313,0.98,0.35373385738349244
278,ukpolitics,"HELLO! I was Lord Buckethead in the 2017 Election but I have since renounced my peerage, partly because I promised to abolish the Lords and I'm a politician who keeps my promises, and partly because of an unfortunate battle on the planet Copyright. This has left me unbowed but...",1573762073.0,"11/14/2019, 20:07:53",137,2,1773,31.224192852692568,0.98,0.0772701635645798
279,ukpolitics,"Boris Johnson pledge for 50,000 more nurses not quite what it seems - 12k from abroad, 14k new undergrad students, 5k degree apprenticeships. Which leaves 19k nurses “retained” who would otherwise have left... so not “new” nurses at all",1574610525.0,"11/24/2019, 15:48:45",417,0,1768,78.5411158273098,0.96,0.23585972850678733
280,ukpolitics,Sir Keir Starmer says second lockdown would be 'government failure - not an act of God',1600764671.0,"09/22/2020, 08:51:11",457,5,1766,38.209790343771374,0.98,0.2587768969422424
281,ukpolitics,"Andrew Adonis on Twitter: ‘In my 47 years in Parliament, under 9 prime ministers, I have never seen trust in a government fall so far and so fast’ - Betty Boothroyd excoriating Johnson just now",1603187232.0,"10/20/2020, 09:47:12",371,1,1766,30.880235911970203,0.98,0.210079275198188
282,ukpolitics,Starmer overtakes Johnson as preferred choice for prime minister | Politics,1593319751.0,"06/28/2020, 04:49:11",651,3,1766,102.44311501266884,0.95,0.3686296715741789
283,ukpolitics,Council of Europe issues media freedom alert over UK government blacklisting of investigative journalists,1599334754.0,"09/05/2020, 19:39:14",180,4,1763,50.454001677170936,0.97,0.1020986954055587
284,ukpolitics,"Private Eye, 10th January 2020",1578486090.0,"01/08/2020, 12:21:30",176,0,1767,46.81841846698012,0.97,0.09960384833050367
285,ukpolitics,Piers Morgan: I'm driving to my parents if Cummings isn't fired today,1590232823.0,"05/23/2020, 11:20:23",885,1,1755,79.15182222081103,0.96,0.5042735042735043
286,ukpolitics,"Surrey Police: A driver’s vision is very important. If you have any concerns about your eyesight don’t drive, until you’ve sought the advice of a qualified Optician. A driver must be able to read a standard number plate from 20 meters.",1590430785.0,"05/25/2020, 18:19:45",172,1,1753,30.166950825168442,0.98,0.09811751283513977
287,ukpolitics,The Cummings effect: study finds public faith was lost after aide's trip,1596780577.0,"08/07/2020, 06:09:37",408,0,1754,81.81629517929537,0.96,0.23261117445838084
288,ukpolitics,Martin Rowson on VE Day,1588962740.0,"05/08/2020, 18:32:20",255,0,1747,67.40969430915811,0.96,0.14596451058958215
289,ukpolitics,Head of UK government legal department quits over Brexit,1599558113.0,"09/08/2020, 09:41:53",424,2,1745,12.58560015312787,0.99,0.24297994269340975
290,ukpolitics,"Election Maps UK: To what extent, if at all, would you support or oppose the UK switching to a Proportional Representation voting system - Support: 54%, Oppose: 16%, Neither: 22%, Don't Know: 9% Via @RedfieldWilton, 25 Jun.",1593185083.0,"06/26/2020, 15:24:43",472,0,1742,27.709299133073955,0.98,0.2709529276693456
291,ukpolitics,Morten Morland on Boris' first public statement since returning to work after recovery,1588051596.0,"04/28/2020, 05:26:36",100,0,1742,119.8213165368229,0.94,0.0574052812858783
292,ukpolitics,"The UK Labour party wants to tax Amazon, Facebook and Google to fund a $25 billion plan for free, high-speed internet for the whole country",1573824926.0,"11/15/2019, 13:35:26",698,0,1746,47.52628895763223,0.97,0.3997709049255441
293,ukpolitics,"At PMQs, Keir Starmer claimed that, until 12 March, government guidance had said people in care homes were ‘very unlikely’ to be infected with Covid-19. Boris Johnson said this was incorrect, but Mr Starmer was correct and previous guidance did say this.",1589394675.0,"05/13/2020, 18:31:15",493,2,1740,54.459627522301616,0.97,0.2833333333333333
294,ukpolitics,Fury as Tory welfare slasher Iain Duncan Smith is handed a knighthood,1577521796.0,"12/28/2019, 08:29:56",563,0,1736,134.9938556205134,0.93,0.32430875576036866
295,ukpolitics,"Boohoo’s sweatshop suppliers: ‘They only exploit us. They make huge profits and pay us peanuts’ — Undercover at an East Midlands factory making clothes for the hugely profitable Boohoo and Nasty Gal labels, our reporter found almost no protective equipment, and wages as low as £3.50 an hour",1593958398.0,"07/05/2020, 14:13:18",390,0,1738,15.6561205688688,0.99,0.2243958573072497
296,ukpolitics,Boris Johnson sparks 'cronyism' row after awarding peerages to senior party donors and his own brother,1596261558.0,"08/01/2020, 05:59:18",514,0,1734,44.18280701363324,0.98,0.2964244521337947
297,ukpolitics,"Fullfact: We’ve seen a viral post that claims there are more food banks than McDonald’s branches in the UK. This is correct, and in fact it's likely the figure given for the number of food banks is an underestimate.",1575906772.0,"12/09/2019, 15:52:52",346,0,1733,54.55104208355783,0.97,0.1996537795729948
298,ukpolitics,"It's not a journalist's job to be positive during a pandemic. Repeated attacks on media outlets for not supporting the government are dangerous and draining, writes Liam Thorp.",1592168769.0,"06/14/2020, 21:06:09",168,0,1735,74.5739047103641,0.96,0.0968299711815562
299,ukpolitics,In light of recent events... [oc],1591566975.0,"06/07/2020, 21:56:15",665,0,1736,75.20263030873048,0.96,0.38306451612903225
300,ukpolitics,It's time to admit that Eat Out to Help Out was a mistake – because it boosted the resurgence of the virus,1601476720.0,"09/30/2020, 14:38:40",557,0,1727,116.02997051163538,0.94,0.322524609148813
301,ukpolitics,"What is happening to the Uighurs? Mass internment, torture, forced labour, forced sterilisation, that’s what. Our piece on @BBCNewsnight last night",1595017141.0,"07/17/2020, 20:19:01",459,1,1728,49.95019355046452,0.97,0.265625
302,ukpolitics,"Michael Gove has, on occasion, gone on a drive to test his eyesight.",1590483461.0,"05/26/2020, 08:57:41",540,2,1735,8.843511660946206,0.99,0.3112391930835735
303,ukpolitics,"Deputy British ambassador Steven Dick, 37, died yesterday after contracting coronavirus. He was a really nice bloke and a great diplomat. Last week he told me he had the virus but was feeling fine. Awful.",1585157551.0,"03/25/2020, 17:32:31",298,0,1727,18.105706255467112,0.99,0.17255356108859293
304,ukpolitics,"Only one MP for Sunderland was invited to the call (regarding regional tier lockdown). She had to inform the government that there are actually three MPs for Sunderland, apparently to some surprise.",1602593108.0,"10/13/2020, 12:45:08",154,0,1727,17.738547121495003,0.99,0.08917197452229299
305,ukpolitics,It’s not just Boris Johnson’s lying. It’s that the media let him get away with it,1574105347.0,"11/18/2019, 19:29:07",175,1,1727,90.30787215320652,0.95,0.1013317892298784
306,ukpolitics,Boris Johnson confronted over claim no country has working coronavirus app - after 12m downloads in Germany,1592998960.0,"06/24/2020, 11:42:40",508,1,1732,49.95637603518276,0.97,0.29330254041570436
307,ukpolitics,Number of UK citizens emigrating to EU has risen by 30% since Brexit vote,1596519543.0,"08/04/2020, 05:39:03",571,0,1726,70.38914118619027,0.96,0.3308227114716107
308,ukpolitics,Influential group of MPs calls for total ban on gambling advertising,1592227394.0,"06/15/2020, 13:23:14",337,0,1720,24.339065455925947,0.99,0.19593023255813954
309,ukpolitics,England’s ‘World Beating’ System to Track the Virus Is Anything But,1592465985.0,"06/18/2020, 07:39:45",345,0,1715,56.4185978684518,0.97,0.20116618075801748
310,ukpolitics,"Andrew Neil - The original target was 100,000 people tested by end-April. That target has been missed, despite the headline figure. Indeed the more you looked at the 122,000 stat, the more it looks a propaganda figure rather than a reliable guide.",1588360893.0,"05/01/2020, 19:21:33",456,0,1717,71.28170322298001,0.96,0.26557949912638323
311,ukpolitics,"Voters dislike Jo Swinson the more they see her, poll finds",1574165406.0,"11/19/2019, 12:10:06",933,0,1713,83.03386531190381,0.95,0.5446584938704028
312,ukpolitics,"BREAKING: European Parliament says it will not ratify any trade deal between the UK and the EU if the Prime Minister breaks international law by overriding the Withdrawal Agreement. Makes negotiations utterly academic, yet UK has insisted they continue regardless.",1599847541.0,"09/11/2020, 18:05:41",579,0,1701,36.095890332785984,0.98,0.3403880070546737
313,ukpolitics,The BBC has seen photos of Mr Jenrick + Mr Desmond sitting at the same table at the fundraising dinner. And photos of Boris Johnson with his arm around Mr Desmond. The Conservative Party refused permission for us to publish them. - @steveswannBBC,1593044303.0,"06/25/2020, 00:18:23",220,0,1708,33.9276359586388,0.98,0.1288056206088993
314,ukpolitics,"UK will open path to citizenship for 3m Hong Kong citizens, PM says",1593603455.0,"07/01/2020, 11:37:35",957,1,1703,37.692262851037185,0.98,0.5619495008807985
315,ukpolitics,"Keir Starmer: Protesters were wrong, but Colston statue should have been removed long ago",1591606587.0,"06/08/2020, 08:56:27",1142,0,1701,83.5977177530433,0.95,0.6713697824808936
316,ukpolitics,PM says Dominic Cummings acted responsibly and with integrity,1590336436.0,"05/24/2020, 16:07:16",1243,5,1698,36.153863345230775,0.98,0.732037691401649
317,ukpolitics,Angela Rayner says Trump and Johnson are competing to be the 'biggest idiot',1601997837.0,"10/06/2020, 15:23:57",389,2,1694,107.95083811470181,0.94,0.2296340023612751
318,ukpolitics,Man Who Has Never Had an Actual Job Encourages Laid-Off Workers to Pick Fruit,1590215604.0,"05/23/2020, 06:33:24",742,0,1689,194.2250201777456,0.9,0.43931320307874483
319,ukpolitics,The voting system Rees Mogg forced through is in chaos tonight. The card readers have broken and MPs are stuck in long queues unable to social distance. Many of us are about to travel home to towns and cities across the country. This government is beyond irresponsible,1600287489.0,"09/16/2020, 20:18:09",238,0,1687,60.65561230188905,0.97,0.14107883817427386
320,ukpolitics,"Tory MP candidate caught getting friend to pose as anti-Labour swing voter, as party's disinformation campaign continues",1574695879.0,"11/25/2019, 15:31:19",161,0,1684,44.71076382462229,0.97,0.09560570071258907
321,ukpolitics,"‘No One’ Protected British Democracy From Russia, U.K. Report Concludes",1595404008.0,"07/22/2020, 07:46:48",393,0,1685,43.92476455804285,0.97,0.23323442136498515
322,ukpolitics,"""It's Happening,"" Declares Jeremy Corbyn as Early UK Election Reports Suggest ""Longest Queues Ever"". ""These images of people queuing to vote will scare the death out of the Tories. Get up, get out, and let's make history.""",1576170348.0,"12/12/2019, 17:05:48",867,0,1682,164.7183862838956,0.91,0.5154577883472057
323,ukpolitics,"Election Maps UK: ""In hindsight, do you think Britain was right or wrong to vote to leave the European Union? Right to leave: 39% (-2), Wrong to leave: 50% (+4) Via @YouGov, 23-24 Sep. Changes w/ 8-9 Sep.",1601312257.0,"09/28/2020, 16:57:37",669,2,1680,52.450889917511404,0.97,0.3982142857142857
324,ukpolitics,"This fortnight’s Private Eye front cover (No. 1522, 22/5/20)",1589963955.0,"05/20/2020, 08:39:15",133,0,1673,31.383879501229785,0.98,0.0794979079497908
325,ukpolitics,"[House of Commons] MPs have voted against New Clause 17, with 340 votes to 251. The New Clause intended to protect the NHS and publicly funded health and care services in other parts of the UK from any form of control from outside the UK.",1595281053.0,"07/20/2020, 21:37:33",560,1,1672,53.488418375630545,0.97,0.3349282296650718
326,ukpolitics,Exclusive: Public Want Test And Trace Taken Out Of Hands Of Private Firms,1602509410.0,"10/12/2020, 13:30:10",228,0,1672,34.398063104481025,0.98,0.13636363636363635
327,ukpolitics,"Stop Brexit man refuses to quit after Boris Johnson tells him 'put a sock in it'. Steve Bray may have won just 949 votes as the Lib Dem candidate for Cynon Valley - but despite being singled out for mockery by Boris Johnson, he and his megaphone are planning to return to Westminster this week",1576431418.0,"12/15/2019, 17:36:58",884,0,1671,119.75899671376169,0.93,0.5290245362058648
