,Subreddit,Title,Epoch Time,Date,Comments,Awards,Upvotes,Downvotes,Upvote Ratio,Comment/Upvote Ratio
0,ukpolitics,MEGATHREAD 16/11/19 - We'll plant a tree for every upvote*,1573894000.0,"11/16/2019, 08:46:40",840,0,9634,119.82773499494579,0.99,0.08719119784097987
1,ukpolitics,"I work in the Netherlands and I'm the only Brit in my company, came into work to see this on my desk",1576225587.0,"12/13/2019, 08:26:27",1262,2,8317,665.0217372221068,0.93,0.15173740531441626
2,ukpolitics,British Youth 1970 vs 2020,1599069687.0,"09/02/2020, 18:01:27",1488,35,7419,44.70197206663397,0.99,0.20056611403154065
3,ukpolitics,Alistair Campbell's BBC interview for anyone who missed it.,1590508422.0,"05/26/2020, 15:53:42",969,13,5466,119.09822938778143,0.98,0.17727771679473106
4,ukpolitics,NEW: Corbyn reveals 451 pages of unredacted govt documents which he says confirms that NHS services would be on the table as part of UK/USA trade negotiations.,1574850167.0,"11/27/2019, 10:22:47",1698,7,5381,249.16066745556873,0.96,0.3155547296041628
5,ukpolitics,Jeremy Corbyn: The people telling you we can't solve the climate crisis helped create it. The people telling you they won't sell off our NHS can afford private healthcare. The people telling you we can’t scrap tuition fees went to university for free. They are not on your side.,1575725470.0,"12/07/2019, 13:31:10",772,0,4430,216.21709875983743,0.95,0.17426636568848758
6,ukpolitics,Jeremy Corbyn: If some accuse me of talking to both sides in the Brexit debate then so be it. I’m proud of it. Why would I only want to talk to half the country? I don’t want to live in half a country. A prime minister must talk and listen to everyone - and bring our divided country together.,1575636175.0,"12/06/2019, 12:42:55",1176,3,4240,218.93478352185593,0.95,0.27735849056603773
7,ukpolitics,MPs requested the Queen to withdraw the right of the Royal Hong Kong Police Association to use the name “Royal”,1575304579.0,"12/02/2019, 16:36:19",263,1,4164,81.6066181417591,0.98,0.06316042267050913
8,ukpolitics,My cartoon for The London Economic [oc],1590694252.0,"05/28/2020, 19:30:52",88,0,4119,106.54016941700229,0.97,0.021364408837096383
9,ukpolitics,"Jeremy Corbyn: I'm sick of campaigning to protect things and stop them from being closed. I want to lead a government that invests in hospitals, libraries and youth centres, and builds truly affordable new houses for all of us to live in.",1575565187.0,"12/05/2019, 16:59:47",998,2,3905,168.8668709065023,0.96,0.2555697823303457
10,ukpolitics,Wishing Boris well but also wanting him to be held accountable are both ok.,1586349025.0,"04/08/2020, 12:30:25",1052,10,3895,303.6038867534835,0.93,0.27008985879332476
11,ukpolitics,"Corbyn: “If I was proposing the creation of our NHS today, the Conservatives would call it health communism.”",1573924607.0,"11/16/2019, 17:16:47",734,1,3800,171.38753492511933,0.96,0.1931578947368421
12,ukpolitics,Ben Jennings on Boris Johnson and the London Bridge attack,1575227911.0,"12/01/2019, 19:18:31",246,2,3685,146.205067283297,0.96,0.06675712347354139
13,ukpolitics,Boris Johnson has a lot on his plate,1603798603.0,"10/27/2020, 11:36:43",234,1,3688,130.80917902170768,0.97,0.06344902386117136
14,ukpolitics,Boris Johnson hides in fridge to avoid questions as aide swears at GMB reporter,1576052586.0,"12/11/2019, 08:23:06",844,2,3648,129.4662365749532,0.97,0.23135964912280702
15,ukpolitics,An actual Lib Dem leaftlet,1575999389.0,"12/10/2019, 17:36:29",354,1,3591,127.21676871701447,0.97,0.0985797827903091
16,ukpolitics,Brexit Cartoon From the New Zealand Herald,1593348942.0,"06/28/2020, 12:55:42",475,1,3594,162.17072309294144,0.96,0.13216471897607124
17,ukpolitics,Cummings advises Boris [oc],1590394126.0,"05/25/2020, 08:08:46",255,1,3562,149.02008769727763,0.96,0.07158899494665918
18,ukpolitics,EXCLUSIVE: Leaked behind the scenes video of Boris Johnson at Conservative HQ.,1575447777.0,"12/04/2019, 08:22:57",662,1,3490,305.40014865498506,0.92,0.18968481375358165
19,ukpolitics,"Today Priti Patel said ""there's no such thing as dabbling in drugs, these are serious offences"". Last summer, 7 out of 11 Tory leadership hopefuls, including Boris Johnson, admitted they dabbled in drugs. Why is it one rule for Cabinet members and another for my constituents? [David Lammy]",1582144704.0,"02/19/2020, 20:38:24",619,0,3461,74.85875023280823,0.98,0.17885004334007512
20,ukpolitics,"YouGov: Aldi have committed to never stocking chlorinated chicken. This is aligned with the public's view, as 80% of Brits say that it would be unacceptable to allow imports of chlorine washed chicken as part of a US trade deal",1594140849.0,"07/07/2020, 16:54:09",649,0,3429,48.255842865157774,0.99,0.18926800816564596
21,ukpolitics,Bereaved MP Laurence Robertson calls for Dominic Cummings to go,1590591293.0,"05/27/2020, 14:54:53",392,0,3375,93.86166214387595,0.97,0.11614814814814815
22,ukpolitics,Blower on government advice that advises against sunbathing in public places,1586153292.0,"04/06/2020, 06:08:12",1009,0,3357,133.0281664001427,0.96,0.300565981531129
23,ukpolitics,Who’s in charge?,1598259272.0,"08/24/2020, 08:54:32",308,4,3325,53.11219195581407,0.98,0.09263157894736843
24,ukpolitics,"There are 151 billionaires in Britain and I can promise you not one of them has donated to our campaign. Our average donation is £25. Meanwhile a third of them bankroll the Tories. They are bought by the few, Labour is owned by the many. [Jeremy Corbyn]",1575827603.0,"12/08/2019, 17:53:23",1249,0,3318,197.37127228948611,0.94,0.3764315852923448
25,ukpolitics,"UK government urged to suspend export of tear gas, rubber bullets and riot shields to US amid 'excessive' use of force - British law requires exports to be suspended if they are used for internal repression",1591031384.0,"06/01/2020, 17:09:44",651,0,3311,117.08052776963586,0.97,0.19661733615221988
26,ukpolitics,Three-quarters of Labour members want party to back proportional representation,1576565948.0,"12/17/2019, 06:59:08",1466,0,3302,65.81579672369662,0.98,0.4439733494851605
27,ukpolitics,"Corbyn: If your wages never seem to go up and your bills never seem to come down - the system isn’t working for you. We've had the greatest slump in wages since the first steam trains were built. Let's turn this around. Vote Labour to put money in your pocket, not the billionaires'.",1576094184.0,"12/11/2019, 19:56:24",937,1,3278,226.20999127305777,0.94,0.28584502745576573
28,ukpolitics,Dominic Cumming's spare cottage appears to have no planning permission and pays no council tax,1590912461.0,"05/31/2020, 08:07:41",480,0,3271,146.2974812645225,0.96,0.14674411494955672
29,ukpolitics,"A Conservative MP has said that free school meals are effectively a direct payment to brothels and drug dealers. Notwithstanding the fact that the vouchers in summer could only be used to purchase food, this stigmatisation of working class families is disgraceful and disgusting.",1603476771.0,"10/23/2020, 18:12:51",513,0,3261,56.47620340444337,0.98,0.15731370745170192
30,ukpolitics,“The PM has said he wants to bring unity to the country... I therefore congratulate him on having in one short year united his five predecessors” – Labour’s Ed Miliband says the Internal Market Bill is “trashing” the UK’s reputation,1600100628.0,"09/14/2020, 16:23:48",388,8,3215,30.057479294081077,0.99,0.12068429237947123
31,ukpolitics,Cartoon for @LondonEconomic [oc],1603702243.0,"10/26/2020, 08:50:43",191,2,3205,80.7806276796232,0.98,0.05959438377535101
32,ukpolitics,The government has given PPE Medpro a contract – not advertised to other bidders – to supply 25 million gowns for health workers. PPE Medro was set up 7 weeks earlier. It has close connections to Tory Party donors. Definition of corruption: Dishonest conduct by those in power.,1602429821.0,"10/11/2020, 15:23:41",258,1,3113,39.50840165403861,0.99,0.0828782524895599
33,ukpolitics,"Brexit has now cost more than the International Space Station – and it continues to rocket. ""We could all have free groceries for a year for the cost of Brexit.""",1600336232.0,"09/17/2020, 09:50:32",717,2,3102,121.14732673277513,0.96,0.2311411992263056
34,ukpolitics,"🚨 Excl: Ken Clarke on Boris Johnson's deal with EU - He was ""desperate… there was no proper negotiating."" - Johnson was alone with Varadkar for 90 mins and caved. - Boris ""hadn’t understood what he was agreeing to."" In essence, a clueless capitulation.",1576133438.0,"12/12/2019, 06:50:38",515,1,3075,136.5927091532394,0.96,0.16747967479674797
35,ukpolitics,"Gordon Brown: “This is a global problem, not just a national problem.. We’ve had too much America first, India first, China first. We’ve had too much of this populist nationalism. We’re finding that we’re connected and depend on each other, whether we like it or not.”",1584610582.0,"03/19/2020, 09:36:22",746,2,3068,135.84493076356148,0.96,0.24315514993481094
36,ukpolitics,A furious Theresa May tears into Michael Gove for appointing a National Security Advisor with no experience in national security.,1593520921.0,"06/30/2020, 12:42:01",669,0,3045,71.9274407262983,0.98,0.21970443349753693
37,ukpolitics,Does anyone else think this clapping is getting a bit ridiculous?,1586520521.0,"04/10/2020, 12:08:41",1091,1,3046,184.75600837374304,0.94,0.3581746552856205
38,ukpolitics,Ridicule as Boris Johnson insists he's never told a lie in his political career,1575018993.0,"11/29/2019, 09:16:33",531,3,3035,62.8460941691028,0.98,0.17495881383855025
39,ukpolitics,"Driving blind: Cummings comes full circle - The architect of Brexit is now an unelected, unaccountable bureaucrat refusing to cede control",1590472389.0,"05/26/2020, 05:53:09",579,0,3011,107.38854508899794,0.97,0.19229491863168383
40,ukpolitics,Blower on the easing of lockdown restrictions in England,1592973464.0,"06/24/2020, 04:37:44",405,0,3004,70.81453034994502,0.98,0.13482023968042608
41,ukpolitics,"Private Eye cover (No. 1530, 11/9/20)",1599645400.0,"09/09/2020, 09:56:40",223,2,2977,18.672276268348014,0.99,0.07490762512596574
42,ukpolitics,Lib Dem candidate endorses Labour rival in his own seat out of 'human dignity and concern for our country',1576065325.0,"12/11/2019, 11:55:25",727,0,2971,81.24287098013292,0.97,0.24469875462807136
43,ukpolitics,London Bridge victim's father condemns 'beyond disgusting' Boris Johnson for using son's death for political gain,1575280168.0,"12/02/2019, 09:49:28",877,0,2959,157.05335553969235,0.95,0.2963839134842852
44,ukpolitics,"This BBC Question Time audience member, who is Jewish, says the media choose to attack the Labour leaders ‘character, because his policies are correct’. “Corbyn is not an anti-Semite, the right-wing press takes things out of context”",1573211339.0,"11/08/2019, 11:08:59",902,1,2960,259.71794954088955,0.92,0.3047297297297297
45,ukpolitics,"""If the Tories had a soul, they'd sell it."" - 1983 Labour Party Poster",1574626753.0,"11/24/2019, 20:19:13",480,0,2949,114.05487890688028,0.96,0.16276703967446593
46,ukpolitics,Tory trustee for Feeding Britain votes against feeding Britain,1603354221.0,"10/22/2020, 08:10:21",374,3,2940,62.601003442589445,0.98,0.1272108843537415
47,ukpolitics,"Keir Starmer: I spent five years as Director of Public Prosecutions working on live operations with the security intelligence services. I'm not going to take lectures from a Prime Minister, who sat on an Intelligence and Security Committee report for ten months, on national security.",1595436598.0,"07/22/2020, 16:49:58",537,1,2931,102.99455005981645,0.97,0.18321392016376664
48,ukpolitics,Peter Brookes on Boris Johnson's response to Black Lives Matter protests,1591768018.0,"06/10/2020, 05:46:58",278,0,2889,117.34478886570923,0.96,0.09622706818968502
49,ukpolitics,Peter Brookes on the re-opening of Parliament with physical distancing measures in place,1587616017.0,"04/23/2020, 04:26:57",67,0,2870,34.288277237171314,0.99,0.023344947735191638
50,ukpolitics,"""It just so happens that making the British prime minister happy isn't the vocation of sovereign leaders of the 27 member states that chose to remain in the EU."" - @EmmanuelMacron, French President",1602888481.0,"10/16/2020, 22:48:01",750,0,2856,76.87289353986898,0.97,0.26260504201680673
51,ukpolitics,Matt on the impact of the coronavirus on airlines,1584080670.0,"03/13/2020, 06:24:30",78,0,2845,19.569013301905215,0.99,0.02741652021089631
52,ukpolitics,Twitter threatens to BAN the Tory Party after their press team 'attempts to mislead' public by changing their online name to FactCheckUK during election debate,1574235948.0,"11/20/2019, 07:45:48",403,1,2836,85.67980769320639,0.97,0.1421015514809591
53,ukpolitics,David Miliband: The UK needs to take the politics of America as a warning We must not wait until we reach American levels of dysfunction to learn that we need to work hard to sustain the liberal democracy we are lucky to inherit,1602616481.0,"10/13/2020, 19:14:41",424,0,2839,68.02133149408473,0.98,0.14934836209933075
54,ukpolitics,Boris Johnson failure to release Russia report an affront to democracy,1592376054.0,"06/17/2020, 06:40:54",326,0,2818,86.18628983460121,0.97,0.1156848828956707
55,ukpolitics,Britons are still staying at home because they don’t trust the government over Covid-19,1594378560.0,"07/10/2020, 10:56:00",637,0,2821,51.3414488047888,0.98,0.22580645161290322
56,ukpolitics,The Secret Barrister: The Prime Minister has basically copied and pasted my blogpost into a thread and passed it off as his own explanation. A blogpost which I had to write to rebut the lies he spent yesterday spouting. This is weapons grade shithousery.,1575194192.0,"12/01/2019, 09:56:32",253,3,2785,77.66788587198289,0.97,0.09084380610412926
57,ukpolitics,Brexit will soon have cost the UK more than all of its payments to the EU over the last 47 years put together,1579006697.0,"01/14/2020, 12:58:17",1089,0,2765,162.78131815153256,0.94,0.3938517179023508
58,ukpolitics,"Jeremy Corbyn: They said rebuilding our country after World War II was impossible, but we did it. They said creating the NHS was impossible, but we did it. They said securing a minimum wage was impossible, but we did it. Imagine what we can achieve if we come together again.",1575982428.0,"12/10/2019, 12:53:48",791,0,2739,166.59916987597217,0.94,0.2887915297553852
59,ukpolitics,So this happened. The Conservative Party took an interview from @GMB this morning. They edited it to add on the last shot in which Keir Starmer looks stumped. But that didn't happen. In the original Keir Starmer immediately answered @piersmorgan 's question.,1572970180.0,"11/05/2019, 16:09:40",404,0,2733,49.843953123531264,0.98,0.1478229052323454
60,ukpolitics,"Jeremy Corbyn's three sons pen a letter about their dad and his treatment in the media: ""We've never seen a politician to be smeared and vilified so much""",1576334809.0,"12/14/2019, 14:46:49",1687,2,2728,285.7091788994644,0.91,0.6184017595307918
61,ukpolitics,Dominic Cummings says he drove to Barnard Castle to test his eyesight,1590422477.0,"05/25/2020, 16:01:17",1044,5,2701,81.79431908318429,0.97,0.38652350981118105
62,ukpolitics,"Government just voted with majority of 53 to strip amendment 16 from #AgricultureBill, which would have safeguarded food standards in trade deals - demonstrating beyond doubt that their promises are totally utterly &amp; completely worthless - even when enshrined in their manifesto",1602540374.0,"10/12/2020, 22:06:14",594,1,2678,58.48536659834008,0.98,0.22180731889469754
63,ukpolitics,Joe Pike: Tried to show @BorisJohnson the picture of Jack Williment-Barr. The 4-year-old with suspected pneumonia forced to lie on a pile of coats on the floor of a Leeds hospital. The PM grabbed my phone and put it in his pocket:,1575896095.0,"12/09/2019, 12:54:55",684,2,2671,83.86961794615081,0.97,0.25608386372145264
64,ukpolitics,In the UK the number of cases rose rapidly. But the public and authorities are only learning this now because these cases were only published now as a backlog. The reason was apparently that the database is managed in Excel and the number of columns had reached the maximum.,1601891894.0,"10/05/2020, 09:58:14",677,6,2675,30.233301650535395,0.99,0.2530841121495327
65,ukpolitics,Moreland on Russian interference,1595146284.0,"07/19/2020, 08:11:24",93,0,2672,71.25386808539906,0.97,0.03480538922155688
66,ukpolitics,Thousands call for new Brexit ‘lorry park’ to be named after Nigel Farage,1602837825.0,"10/16/2020, 08:43:45",302,0,2672,51.221722784481244,0.98,0.11302395209580839
67,ukpolitics,"Jeremy Corbyn: As Prime Minister, I will be an honest broker and not campaign for either side in the final say referendum. We will negotiate a good deal, put that to the people alongside remain and then implement your decision. We must bring the country together and get beyond Brexit.",1574453320.0,"11/22/2019, 20:08:40",1097,0,2663,128.96698240731212,0.95,0.41194141945174617
68,ukpolitics,Ed Milliband Commons Speech on Internal Market Bill,1600153083.0,"09/15/2020, 06:58:03",446,9,2660,42.95798173772346,0.98,0.16766917293233083
69,ukpolitics,"Ben Jennings on Harry, Andrew and royal scandals – cartoon",1578867577.0,"01/12/2020, 22:19:37",392,0,2659,49.74340238639206,0.98,0.14742384355020685
70,ukpolitics,"Sir David Attenborough says it is ""shameful"" of the Prime Minister not to attend last night's climate change debate. ""I don't know what else he had to do, but it would have to be very, very important to dodge this one."" Snow meets Attenborough. Tonight at 7pm on Channel 4.",1575055576.0,"11/29/2019, 19:26:16",286,0,2650,90.81001069069225,0.97,0.1079245283018868
71,ukpolitics,Peter Brookes on a WW2 veteran raising £13 million for the NHS by doing laps around his garden,1587101599.0,"04/17/2020, 05:33:19",199,0,2649,66.6899875275999,0.98,0.07512268780671952
72,ukpolitics,Keir Starmer on Twitter: The coronavirus crisis is far from over. It's simply wrong to send homeless people back onto the streets. Right now they need emergency support. But after this crisis we can't forget we all but ended rough sleeping overnight. We can end it for good.,1589558350.0,"05/15/2020, 15:59:10",271,0,2639,57.61325211123176,0.98,0.10269041303524062
73,ukpolitics,"Caroline Lucas: ""No Mr Gove, we don’t need to wait until the pandemic is over before we can identify Government mistakes - just for starters: - ignoring SAGE advice to lock down sooner - dire performance of Test, Trace &amp; Isolate - woeful communications - deceitful double standards""",1604235458.0,"11/01/2020, 12:57:38",324,1,2647,74.13228067607952,0.97,0.1224027200604458
74,ukpolitics,Keir Starmer scores highest ratings of any Opposition leader since Tony Blair in mid-90s,1591955030.0,"06/12/2020, 09:43:50",775,0,2631,97.07772153434234,0.96,0.29456480425693654
75,ukpolitics,"Private Eye cover (No. 1532, 09/10/20)",1602159017.0,"10/08/2020, 12:10:17",116,2,2625,58.03891154350413,0.98,0.04419047619047619
76,ukpolitics,The solution to Boris' Bridge problems: Isle of Roundabout,1581774310.0,"02/15/2020, 13:45:10",368,0,2611,19.7737155129239,0.99,0.14094216775181923
77,ukpolitics,"BREAKING: A Durham Police investigation has concluded that Dominic Cummings DID breach lockdown rules when he drove to Barnard Castle, the Telegraph has learned",1590665938.0,"05/28/2020, 11:38:58",596,1,2604,91.32719072075179,0.97,0.22887864823348694
78,ukpolitics,Keir Starmer’s approval rating rockets - giving him a 24 point lead over Boris Johnson,1590302917.0,"05/24/2020, 06:48:37",743,1,2603,109.69080626131881,0.96,0.2854398770649251
79,ukpolitics,UK's first full heroin perscription scheme extended after vast drop in crime and homelessness,1598001646.0,"08/21/2020, 09:20:46",724,4,2605,19.054374989805183,0.99,0.2779270633397313
80,ukpolitics,The government is paying the Sun and Daily Mail for positive coverage of its coronavirus response,1590742233.0,"05/29/2020, 08:50:33",332,1,2598,87.55884441694161,0.97,0.12779060816012316
81,ukpolitics,Morten Morland on the government's falling opinion polls,1590644761.0,"05/28/2020, 05:46:01",257,0,2596,42.9971266741145,0.98,0.09899845916795069
82,ukpolitics,This election surely marks the end of the UK as it currently exists.,1576218072.0,"12/13/2019, 06:21:12",2027,5,2582,609.0921144031126,0.81,0.7850503485670023
83,ukpolitics,"This fortnight’s Private Eye front cover (No. 1520, 24/4/20)",1587562315.0,"04/22/2020, 13:31:55",154,1,2584,47.50209016209919,0.98,0.05959752321981424
84,ukpolitics,"British press dramatically cut criticism of ruling Tories for 2019 election, study finds Coverage of Labour was also over twice as hostile compared to previous poll",1576924354.0,"12/21/2019, 10:32:34",506,0,2579,168.14674071105537,0.94,0.19620007754943777
85,ukpolitics,Boris Johnson said he 'loved' fox hunting in a 'semi-sexual' way and encouraged illegal hunts to ignore ban,1595064288.0,"07/18/2020, 09:24:48",670,0,2573,97.96871957814847,0.96,0.26039642440730665
86,ukpolitics,"Police block Buchanan Street, Glasgow as anti-Boris Johnson protesters increase the volume and march the entire length of the street.",1576305394.0,"12/14/2019, 06:36:34",1968,1,2569,178.3356742357705,0.94,0.7660568314519268
87,ukpolitics,Speaker promotes Keir Starmer to PM,1592411813.0,"06/17/2020, 16:36:53",239,0,2547,43.53056063838676,0.98,0.09383588535531999
88,ukpolitics,"Britain is becoming a GoFundMe nation, with the public doing the government's job",1604309077.0,"11/02/2020, 09:24:37",532,0,2560,112.22247365365729,0.96,0.2078125
89,ukpolitics,Just been told that I’m becoming a doctor early,1584661903.0,"03/19/2020, 23:51:43",340,5,2521,58.87439169328081,0.98,0.13486711622372075
90,ukpolitics,Leaked document reveals US drug firms are pushing Trump to target the NHS after Brexit,1575527004.0,"12/05/2019, 06:23:24",533,1,2504,70.22473576911125,0.97,0.2128594249201278
91,ukpolitics,"“Even if you just look at the total amount that Labour currently wants to increase the spending, it would basically bring us still to levels that are lower than France, Norway, and Sweden.” - Economist Mariana Mazzucato on Labour’s spending plans",1574411126.0,"11/22/2019, 08:25:26",917,0,2496,91.47498756576806,0.96,0.36738782051282054
92,ukpolitics,"'Real number of people being tested for coronavirus is around 40,000 a day not 200,000 as govt suggests, according to Kate Lamble of BBC's More or Less. Double counting, tests sent out but not done, all being counted as tests done. Worse than just misleading.'",1591150896.0,"06/03/2020, 02:21:36",320,0,2479,44.8023442984786,0.98,0.1290843081887858
93,ukpolitics,"YouGov on Twitter | Contrary to Dominic Raab’s claim that ""no one gives a toss"", half of Brits (50%) say it was unacceptable for the Conservative party to change their Twitter account to 'factcheckUK' during last night’s debate. Just 12% think it was acceptable",1574265010.0,"11/20/2019, 15:50:10",312,0,2472,57.60949182972945,0.98,0.1262135922330097
94,ukpolitics,"Fourth firm with links to Dominic Cummings awarded £640,000 in government work without an open tender process",1600711113.0,"09/21/2020, 17:58:33",248,5,2469,39.65488038055673,0.98,0.10044552450384771
95,ukpolitics,"Today I am proposing a new law making it a illegal for politicians to lie to the public. 50 years ago we made it illegal for companies to lie to us with the Trade Descriptions Act. Sadly, it looks like we need the same principle to apply to politicians",1576064409.0,"12/11/2019, 11:40:09",470,2,2458,70.766321231667,0.97,0.19121236777868186
96,ukpolitics,Labour and Conservative vote share by age group 1992-2019,1592554857.0,"06/19/2020, 08:20:57",1460,1,2453,38.21954847057668,0.98,0.5951895637994292
97,ukpolitics,These MPs just voted against protecting the NHS from a post-Brexit trade deal,1595317355.0,"07/21/2020, 07:42:35",660,0,2449,114.22013419762652,0.96,0.2694977541853818
98,ukpolitics,"Britain Is Becoming America in All the Worst Ways - British politicians used to condescend to their U.S. counterparts. During the pandemic, they've started copying their most destructive habits.",1594032299.0,"07/06/2020, 10:44:59",624,1,2443,97.38774648941171,0.96,0.25542365943512074
99,ukpolitics,Morten Morland Cartoon,1592286005.0,"06/16/2020, 05:40:05",119,0,2450,80.5792680608397,0.97,0.04857142857142857
100,ukpolitics,Tories tweet anti-Labour posts under 'factcheckUK' brand | Politics,1574197582.0,"11/19/2019, 21:06:22",404,1,2443,58.88641189719874,0.98,0.16537044617273844
101,ukpolitics,The Sun records £68m loss amid falling sales and hacking damages,1582474419.0,"02/23/2020, 16:13:39",382,1,2438,32.405284905724784,0.99,0.15668580803937654
102,ukpolitics,Laura Kuenssberg faces criticism over Tory 'punch' claim. The BBC’s political editor Laura Kuenssberg is facing calls to resign after she incorrectly claimed that a Labour activist had assaulted a Tory staffer.,1575923556.0,"12/09/2019, 20:32:36",585,1,2427,113.01395923467453,0.96,0.24103831891223734
103,ukpolitics,Bob on the lack of PPE in the NHS,1587274963.0,"04/19/2020, 05:42:43",181,0,2423,107.93244798319529,0.96,0.07470078415187784
104,ukpolitics,Dominic Cummings ignored coronavirus lockdown rules for SECOND time to visit parents,1590258854.0,"05/23/2020, 18:34:14",579,1,2414,79.45922657813753,0.97,0.23985086992543497
105,ukpolitics,Tesla Gigafactory Europe heads to Germany not UK as Elon Musk blames Brexit uncertainty,1573625865.0,"11/13/2019, 06:17:45",831,0,2415,70.20402334030769,0.97,0.3440993788819876
106,ukpolitics,Peter Brookes on Brexit Day,1580455798.0,"01/31/2020, 07:29:58",240,1,2411,134.82183484475217,0.95,0.09954375777685608
107,ukpolitics,🚨 Breaking: Ofcom rejects Boris Johnson’s complaint about Channel 4 climate debate,1575373666.0,"12/03/2019, 11:47:46",183,1,2395,79.42652233659146,0.97,0.07640918580375783
