,Subreddit,Title,Epoch Time,Date,Comments,Awards,Upvotes,Downvotes,Upvote Ratio,Comment/Upvote Ratio
0,wallstreetbets,"Elon has transcended time, space, and county regulations",1589229677.0,"05/11/2020, 20:41:17",4941,0,80574,9155.152639932698,0.9,0.06132251098369201
1,wallstreetbets,"BREAKING: CNBC Officially Gives Up, Stocks Enter Kangaroo Market",1591999223.0,"06/12/2020, 22:00:23",1524,0,68777,2687.096661370335,0.96,0.02215857045233145
2,wallstreetbets,How to get oil back up,1587431901.0,"04/21/2020, 01:18:21",565,0,67097,2234.271415182491,0.97,0.008420644738214824
3,wallstreetbets,I guess they didn’t like my “printer goes brrrrr” posts every day.,1591963508.0,"06/12/2020, 12:05:08",1055,0,64574,4459.742991435007,0.94,0.01633784495307709
4,wallstreetbets,100% Accurate,1596707632.0,"08/06/2020, 09:53:52",453,0,59291,3342.9633751520814,0.95,0.0076402826735929566
5,wallstreetbets,All In The War Machine,1578411630.0,"01/07/2020, 15:40:30",788,0,57464,2963.0739048383402,0.95,0.013712933314770987
6,wallstreetbets,"I Will Invest $100,000 Into Whatever Is The Top Reply In A Week lol",1594824008.0,"07/15/2020, 14:40:08",17104,0,54253,10604.735793198452,0.84,0.31526367205500155
7,wallstreetbets,"I said if SPY closed green today, I would drink my pee. Here is my lame video.",1588201953.0,"04/29/2020, 23:12:33",3258,0,52037,7292.287473912613,0.88,0.06260929723081654
8,wallstreetbets,I Feel Targeted,1603470933.0,"10/23/2020, 16:35:33",542,0,51888,5389.592620727526,0.91,0.010445575084798027
9,wallstreetbets,Gold Standard &lt; Big Mac Standard,1597318716.0,"08/13/2020, 11:38:36",1195,0,50858,2862.40865958784,0.95,0.023496794997837116
10,wallstreetbets,Why should any American company ever act responsibly again?,1586451659.0,"04/09/2020, 17:00:59",2893,0,49990,3470.3708109887593,0.94,0.05787157431486297
11,wallstreetbets,Who smiled,1587151408.0,"04/17/2020, 19:23:28",759,0,48934,2681.5342624334517,0.95,0.015510687865287939
12,wallstreetbets,Putshire Cashaway,1586881268.0,"04/14/2020, 16:21:08",951,0,46613,2494.4882080566385,0.95,0.020402033767403942
13,wallstreetbets,Economic Scarcity 🤔💰,1589983775.0,"05/20/2020, 14:09:35",852,0,44305,3220.593646347341,0.93,0.019230335176616636
14,wallstreetbets,"What 3,280,000 jobless claims looks like versus the past 50 years of reports",1585227186.0,"03/26/2020, 12:53:06",2491,0,44159,1894.8366435886855,0.96,0.05640979188840327
15,wallstreetbets,12-year old Russian trader loses everything after visiting WSB,1589632593.0,"05/16/2020, 12:36:33",1325,0,43290,2968.9027133450945,0.94,0.030607530607530607
16,wallstreetbets,"Ha, that's an easy one",1581087268.0,"02/07/2020, 14:54:28",364,0,42975,2984.3235758644078,0.94,0.008470040721349622
17,wallstreetbets,Stonks,1594850291.0,"07/15/2020, 21:58:11",384,0,42687,2096.225151472856,0.95,0.008995712980532715
18,wallstreetbets,DON'T DOUBT UR VIBE,1580837624.0,"02/04/2020, 17:33:44",3687,0,42605,3916.942797377327,0.92,0.08653913859875602
19,wallstreetbets,It really do be like that doe,1602392693.0,"10/11/2020, 05:04:53",292,0,41712,1875.2658869698353,0.96,0.007000383582662063
20,wallstreetbets,Infinite Oil Storage,1587478801.0,"04/21/2020, 14:20:01",620,0,40541,2169.449184842393,0.95,0.01529316001085321
21,wallstreetbets,Pain.,1601566900.0,"10/01/2020, 15:41:40",435,0,39914,2764.690315126092,0.94,0.0108984316280002
22,wallstreetbets,"Me on Nio, GE and Ford.",1603207297.0,"10/20/2020, 15:21:37",611,0,39109,3499.92714847171,0.92,0.015623002377969266
23,wallstreetbets,Stimulus &amp; Printer 500 - On the Run,1592314000.0,"06/16/2020, 13:26:40",535,0,38376,1610.1513976126662,0.96,0.013941004794663332
24,wallstreetbets,"For the first time in my life... I feel.. At home 😌 $-148,173.58",1587658794.0,"04/23/2020, 16:19:54",1887,0,37386,2182.9348390139858,0.94,0.05047343925533622
25,wallstreetbets,Everyone Trading the TSLA Squeeze Today,1594692102.0,"07/14/2020, 02:01:42",1041,0,36656,1961.4498730479827,0.95,0.028399170667830643
26,wallstreetbets,Laid off due to COVID. Moved my 401k into an IRA. “Invested” it all on SPX fd calls today....,1598474364.0,"08/26/2020, 20:39:24",2034,0,35626,2654.2879789615035,0.93,0.05709313422781115
27,wallstreetbets,"Nothing can stop tech, NASDAQ 11K EOW 🚀🚀",1595507443.0,"07/23/2020, 12:30:43",814,0,35196,2676.744212432146,0.93,0.023127628139561315
28,wallstreetbets,"TESLA TO THE MOON! Papi musk wearing the “cybershoes”, gonna sell more than Jordans",1581191184.0,"02/08/2020, 19:46:24",971,0,35061,6858.374627561549,0.84,0.02769458942985083
29,wallstreetbets,"Tesla CEO Elon Musk Says stock price is too high, shares fall",1588346340.0,"05/01/2020, 15:19:00",3217,0,34548,1820.8622813682086,0.95,0.09311682297093898
30,wallstreetbets,Up (2020),1599083645.0,"09/02/2020, 21:54:05",547,0,34555,2101.604869396564,0.94,0.015829836492548113
31,wallstreetbets,Found a Wall Street 🌈🐻 in the wild,1598056586.0,"08/22/2020, 00:36:26",659,0,34514,3334.1812644905367,0.91,0.019093701106797242
32,wallstreetbets,If you’re wondering why Robinhood wasn’t working...,1583187195.0,"03/02/2020, 22:13:15",1938,0,33376,427.9769448564766,0.99,0.058065675934803454
33,wallstreetbets,“We live in a fraudulent system” - someone from the Big Short,1585242585.0,"03/26/2020, 17:09:45",1080,0,33281,1912.7587047342095,0.95,0.032450947988341694
34,wallstreetbets,Yes,1603675873.0,"10/26/2020, 01:31:13",265,0,33326,4416.77377710944,0.88,0.00795174938486467
35,wallstreetbets,Tesla bears in the future,1590204343.0,"05/23/2020, 03:25:43",464,0,32919,1804.253532388022,0.95,0.014095203377988396
36,wallstreetbets,State of the Spectrum,1580992593.0,"02/06/2020, 12:36:33",867,0,32488,4192.88896718053,0.89,0.02668677665599606
37,wallstreetbets,The Federal Reserve vs Covid-19,1586612907.0,"04/11/2020, 13:48:27",930,0,32318,1809.4330137573852,0.95,0.028776533201311964
38,wallstreetbets,When the puts go from -99% to -98%,1586781295.0,"04/13/2020, 12:34:55",308,0,32233,1905.1407261432178,0.94,0.009555424564886917
39,wallstreetbets,This sub in nutshell,1599377503.0,"09/06/2020, 07:31:43",423,0,32243,1484.237706066946,0.96,0.013119126632137207
40,wallstreetbets,Former playboy bunny Holly Madison says bulls hold the line (top confirmed).,1592673657.0,"06/20/2020, 17:20:57",1594,0,31715,5581.1415689880305,0.85,0.05026012927636765
41,wallstreetbets,Congrats autists! The Cover of Bloomberg Businessweek!,1582722351.0,"02/26/2020, 13:05:51",1602,0,31477,307.05069672164245,0.99,0.05089430377736125
42,wallstreetbets,Long $AMZN,1591115415.0,"06/02/2020, 16:30:15",839,0,30961,1688.5623369434106,0.95,0.02709860792610058
43,wallstreetbets,Elon Musk prepares for the Q1 earnings call,1588242489.0,"04/30/2020, 10:28:09",990,0,30142,2364.9120327729834,0.93,0.03284453586357906
44,wallstreetbets,He's already dead,1587407099.0,"04/20/2020, 18:24:59",1912,0,30013,1597.7973426377066,0.95,0.0637057275180755
45,wallstreetbets,"I'm back, bitches!",1599489302.0,"09/07/2020, 14:35:02",1061,0,29735,5004.853733642041,0.86,0.035681856398183956
46,wallstreetbets,"Papa is signalling us, stock will go up from 1000% to 10000% by 2022 📈",1600779734.0,"09/22/2020, 13:02:14",824,0,29253,3944.7074553123166,0.88,0.028168051140054013
47,wallstreetbets,Kanye gets it,1595964478.0,"07/28/2020, 19:27:58",565,0,29251,2123.2503147876523,0.93,0.019315578954565656
48,wallstreetbets,IM TYRONE! Sent this to my buddy.,1593106745.0,"06/25/2020, 17:39:05",863,0,29173,2500.455802830533,0.92,0.02958214787646111
49,wallstreetbets,THE TRUE WSB LOGO IS BACK!!! The ugly baby is gone forever! Mission accomplished! This is a win for all of America!,1586360226.0,"04/08/2020, 15:37:06",591,0,28719,3910.7852990274514,0.88,0.020578710957902435
50,wallstreetbets,Depression is back on,1586423766.0,"04/09/2020, 09:16:06",1521,0,28648,1846.8473520560037,0.94,0.053092711533091315
51,wallstreetbets,"What can I say, you win some, you lose some😎",1603103413.0,"10/19/2020, 10:30:13",328,0,28589,1810.927413283025,0.94,0.011472944139354298
52,wallstreetbets,"Mama, we made it.",1600182325.0,"09/15/2020, 15:05:25",1129,0,28040,1663.6168290291716,0.94,0.04026390870185449
53,wallstreetbets,"Quit my job to trade for a living, ended up losing everything... wasted 4 years of my life.",1581242653.0,"02/09/2020, 10:04:13",2408,0,27901,2531.7714592585144,0.92,0.08630515035303395
54,wallstreetbets,a wise man once said,1589760001.0,"05/18/2020, 00:00:01",751,0,27903,5194.835646518302,0.84,0.026914668673619323
55,wallstreetbets,It's not about money...it’s about sending a message.,1595534214.0,"07/23/2020, 19:56:54",280,0,27735,1536.111696605276,0.95,0.010095547142599604
56,wallstreetbets,Buy $TSLA,1574569227.0,"11/24/2019, 04:20:27",637,0,27659,2372.156790930454,0.92,0.023030478325319063
57,wallstreetbets,70k to 1.5M - BOW TO YOUR GOD,1582134371.0,"02/19/2020, 17:46:11",1614,0,27588,5928.341682600236,0.82,0.05850369725967812
58,wallstreetbets,I’ve lost so much hair I could make my own $ROPE,1587732370.0,"04/24/2020, 12:46:10",366,0,27528,1760.4336604765413,0.94,0.013295553618134264
59,wallstreetbets,Tesla to the moon,1594648400.0,"07/13/2020, 13:53:20",1371,0,27525,2114.0481769668077,0.93,0.04980926430517711
60,wallstreetbets,Should we short Tesla stock now?,1588832264.0,"05/07/2020, 06:17:44",1351,0,27517,1956.3023231207262,0.93,0.049096921902823706
61,wallstreetbets,"Not to brag, but looks like I’m so autistic that people are writing articles about my exploits",1588881327.0,"05/07/2020, 19:55:27",705,0,27329,1572.7394225037642,0.95,0.0257967726590801
62,wallstreetbets,Using literal chicken shit to predict next week ft. babey chickies,1593254314.0,"06/27/2020, 10:38:34",523,0,27047,1301.7188333399354,0.95,0.019336710171183494
63,wallstreetbets,Hey if it's fucking yellow outside does that mean stocks are gonna go up or down?,1599680617.0,"09/09/2020, 19:43:37",857,0,26979,1445.200518614438,0.95,0.03176544719967382
64,wallstreetbets,"Brothers, the time has come for the ultimate YOLO. [$780k 6/19 SPX 1500P]",1585272851.0,"03/27/2020, 01:34:11",3651,0,26875,2675.1387645528303,0.91,0.13585116279069767
65,wallstreetbets,"My SURGEON Is On WSB, And Basically Just Called Me A Retard",1602526886.0,"10/12/2020, 18:21:26",1072,0,26926,3057.741355197828,0.9,0.039812820322365
66,wallstreetbets,Look what the neighbors are saying about you degenerates,1588860291.0,"05/07/2020, 14:04:51",795,0,26857,1497.256057683764,0.95,0.029601221283091932
67,wallstreetbets,The Simpsons Predicting Oil Crash,1587551199.0,"04/22/2020, 10:26:39",277,0,26537,1247.4067125355905,0.96,0.010438256019896747
68,wallstreetbets,When r/all meets r/wallstreetbets. STONKS ONLY GO UP,1581556445.0,"02/13/2020, 01:14:05",669,0,26404,1868.282200701,0.93,0.025337070140887746
69,wallstreetbets,ALL HAIL THE MUSK,1600126116.0,"09/14/2020, 23:28:36",1122,0,26368,6269.373388002834,0.81,0.04255157766990291
70,wallstreetbets,TSLA investors be like,1598985078.0,"09/01/2020, 18:31:18",595,0,26165,721.3963207327688,0.97,0.02274030193005924
71,wallstreetbets,Your Bank Account’s Worst Nightmare,1604191099.0,"11/01/2020, 00:38:19",555,0,26183,1162.608168799772,0.96,0.02119695985945079
72,wallstreetbets,New icon I made for Robinhood in iOS14,1600545382.0,"09/19/2020, 19:56:22",293,0,26044,750.458738284171,0.97,0.01125019198279834
73,wallstreetbets,$35k -&gt; $1.25M in 4~ months,1594225171.0,"07/08/2020, 16:19:31",1759,0,25976,3009.6059856265892,0.9,0.06771635355712965
74,wallstreetbets,When the stock market doesn't need the economy,1598287099.0,"08/24/2020, 16:38:19",535,0,25862,1900.2358725366612,0.93,0.020686721831258217
75,wallstreetbets,Scared Money Don't Make Money,1582907553.0,"02/28/2020, 16:32:33",805,0,25481,610.3533114840466,0.98,0.031592166712452414
76,wallstreetbets,This 🌈 🐻 is still waiting,1588987197.0,"05/09/2020, 01:19:57",597,0,25414,1281.141319760849,0.95,0.02349098921854096
77,wallstreetbets,Waiting for $TSLA to do it's thing™,1599044644.0,"09/02/2020, 11:04:04",1005,0,25280,1751.8238441190915,0.94,0.039754746835443035
78,wallstreetbets,The last sub standing,1593519924.0,"06/30/2020, 12:25:24",1225,0,25237,5750.963011815402,0.81,0.04853984229504299
79,wallstreetbets,The current market explained,1598920339.0,"09/01/2020, 00:32:19",568,0,25105,233.52803382017737,0.99,0.022624975104560845
80,wallstreetbets,This has to be the top,1581985152.0,"02/18/2020, 00:19:12",730,0,24958,2723.2773345790774,0.9,0.02924913855276865
81,wallstreetbets,To the newcomers,1579798634.0,"01/23/2020, 16:57:14",503,0,24822,1301.6667026110044,0.95,0.020264281685601484
82,wallstreetbets,I made this one... with my tears.,1584380881.0,"03/16/2020, 17:48:01",332,0,24746,316.0164603854355,0.99,0.013416309706619252
83,wallstreetbets,Some retard walked into my clinic today needing a tumor removed from his leg,1602553746.0,"10/13/2020, 01:49:06",518,0,24722,4613.972711342005,0.84,0.02095299733031308
84,wallstreetbets,Ladies and Gentlemen. We Got him.,1586350611.0,"04/08/2020, 12:56:51",2318,0,24270,3275.007190104752,0.88,0.09550885867325917
85,wallstreetbets,Elon carrying his second child,1590849281.0,"05/30/2020, 14:34:41",1011,0,24110,4062.908158407874,0.86,0.04193280796350062
86,wallstreetbets,We're gunning for you r/askreddit,1587215579.0,"04/18/2020, 13:12:59",1572,0,23828,3624.481486280187,0.87,0.06597280510323988
87,wallstreetbets,Bezos tommorow morning,1590739540.0,"05/29/2020, 08:05:40",422,0,23820,691.4475446789766,0.97,0.017716204869857262
88,wallstreetbets,New dollar menu,1587412965.0,"04/20/2020, 20:02:45",374,0,23749,845.0495830789005,0.97,0.015748031496062992
89,wallstreetbets,The king,1602705250.0,"10/14/2020, 19:54:10",945,0,23601,4284.59825084894,0.85,0.040040676242532096
90,wallstreetbets,Bulls Take a Casual Day on the Slopes,1588595212.0,"05/04/2020, 12:26:52",425,0,23503,1292.6170130145001,0.95,0.018082797940688424
91,wallstreetbets,1 million,1584410908.0,"03/17/2020, 02:08:28",559,0,23242,212.2442075027284,0.99,0.024051286464159712
92,wallstreetbets,Every night,1590252476.0,"05/23/2020, 16:47:56",255,0,23098,1319.3075716199564,0.95,0.011039916875919993
93,wallstreetbets,New banner proposal to replace the Boss Baby logo,1584895904.0,"03/22/2020, 16:51:44",931,0,22961,570.6569092902791,0.98,0.04054701450285266
94,wallstreetbets,Change it back please.,1584462230.0,"03/17/2020, 16:23:50",499,0,22706,353.4922453824511,0.98,0.02197657006958513
95,wallstreetbets,It‘s cocksure coming...any moment now...,1596087069.0,"07/30/2020, 05:31:09",657,0,22552,1357.4321754504708,0.94,0.02913267115998581
96,wallstreetbets,Hang in there kings.,1599657022.0,"09/09/2020, 13:10:22",360,0,22276,850.7870011193736,0.96,0.01616089064463997
97,wallstreetbets,EVERYONE JUST STAY CALM!!!!,1582859759.0,"02/28/2020, 03:15:59",521,0,22189,128.69112340594802,0.99,0.023480102753616658
98,wallstreetbets,You wouldn't understand,1593264490.0,"06/27/2020, 13:28:10",252,0,22152,401.6922344050363,0.98,0.011375947995666305
99,wallstreetbets,What device do you guys use to trade?,1604332621.0,"11/02/2020, 15:57:01",693,0,22802,293.0637457721532,0.99,0.03039207087097623
100,wallstreetbets,Scientific proof to inverse WSB,1596299433.0,"08/01/2020, 16:30:33",789,3,21912,1000.1738829555034,0.96,0.03600766703176342
101,wallstreetbets,Let it go my brothers,1599566031.0,"09/08/2020, 11:53:51",832,52,21714,1958.8733759468087,0.92,0.038316293635442575
102,wallstreetbets,"Robinhood gang, RISE UP! (Sound On)",1591811441.0,"06/10/2020, 17:50:41",438,10,21570,892.2488162233421,0.96,0.020305980528511822
103,wallstreetbets,TSLA 400p 7/17 confirmed?,1591870722.0,"06/11/2020, 10:18:42",1104,2,21533,2194.538789076556,0.91,0.05127014350067338
104,wallstreetbets,💤,1594168680.0,"07/08/2020, 00:38:00",552,5,21399,1391.5773115624652,0.94,0.02579559792513669
105,wallstreetbets,Which one of you retards was at my local brewery today?,1604092076.0,"10/30/2020, 21:07:56",484,46,21473,367.16088591736116,0.98,0.02253993387044195
106,wallstreetbets,To the guy browsing WSB ON yesterdays flight from DFW TO COS on American airlines by row 21,1600834659.0,"09/23/2020, 04:17:39",675,60,21335,1305.6869369691412,0.94,0.03163815326927584
107,wallstreetbets,Just buy tech calls.,1599595420.0,"09/08/2020, 20:03:40",368,56,21255,1180.4128521690473,0.95,0.017313573276876028
108,wallstreetbets,"The inevitable progression of every WSB member. Don’t worry fam, we all kings.",1601230915.0,"09/27/2020, 18:21:55",496,63,21206,1383.4542892311983,0.94,0.023389606715080637
109,wallstreetbets,loss porn 101,1602447768.0,"10/11/2020, 20:22:48",218,34,21061,1510.0798296206012,0.93,0.010350885523004606
110,wallstreetbets,Bears feasting on AAPL next week confirmed,1601113864.0,"09/26/2020, 09:51:04",328,110,20964,820.6794187763298,0.96,0.015645869108948673
111,wallstreetbets,Maximum low effort,1596135392.0,"07/30/2020, 18:56:32",337,2,20911,686.3889652099533,0.97,0.01611591985079623
112,wallstreetbets,It's been downhill since March,1592841657.0,"06/22/2020, 16:00:57",1908,22,20897,1294.7601986039663,0.94,0.09130497200555103
113,wallstreetbets,"She doesn’t understand stonks and how they only go up, wisely put it all on Tesla calls",1603422100.0,"10/23/2020, 03:01:40",274,35,20842,916.897342864715,0.96,0.013146531043086076
114,wallstreetbets,this does not feel bullish,1592099714.0,"06/14/2020, 01:55:14",614,3,20784,1079.8315507735788,0.95,0.029541955350269437
115,wallstreetbets,The Bear Case vs Bull Case Argument,1587680575.0,"04/23/2020, 22:22:55",1060,30,20736,773.4017167036072,0.96,0.051118827160493825
116,wallstreetbets,save us jerome,1579896050.0,"01/24/2020, 20:00:50",283,1,20653,531.7797278247017,0.97,0.013702609790345228
117,wallstreetbets,The REAL person of the year,1576349080.0,"12/14/2019, 18:44:40",240,3,20648,1493.898097478599,0.93,0.01162340178225494
118,wallstreetbets,"SEC is a joke, insider trading is rampant, if youre retail you have no chance",1596026984.0,"07/29/2020, 12:49:44",1448,9,20457,1085.4102271661177,0.95,0.07078261719704747
119,wallstreetbets,It's our cherished annual tradition returning!,1590501660.0,"05/26/2020, 14:01:00",985,6,20322,1199.5451711419337,0.94,0.04846963881507726
120,wallstreetbets,That's what matters in the end,1598755972.0,"08/30/2020, 02:52:52",329,28,20239,250.8331034962248,0.99,0.01625574386086269
121,wallstreetbets,Time to move to ToS,1583160725.0,"03/02/2020, 14:52:05",1300,8,20224,142.63350394867302,0.99,0.06428006329113924
122,wallstreetbets,Autism IS contagious,1590782068.0,"05/29/2020, 19:54:28",1141,2,20191,1704.3008278947163,0.92,0.05651032638304195
123,wallstreetbets,Posting on WSB,1588684661.0,"05/05/2020, 13:17:41",389,19,20121,1322.7305918860147,0.94,0.019333035137418617
124,wallstreetbets,Trading Firm Bankrupted After Algorithm Tracking r/wallstreetbets Learns How To YOLO On Weekly Options,1600346389.0,"09/17/2020, 12:39:49",509,88,20011,1354.8617099544463,0.94,0.025436010194393083
125,wallstreetbets,Honestly though,1591103202.0,"06/02/2020, 13:06:42",172,0,19816,801.26768184108,0.96,0.008679854662898667
126,wallstreetbets,"+$69,420 in a month",1587582850.0,"04/22/2020, 19:14:10",892,7,19792,2047.8864245781297,0.91,0.045068714632174614
127,wallstreetbets,"$6+ million gains in 1 year (+48,000%)",1601260907.0,"09/28/2020, 02:41:47",1473,207,19764,1115.78217480698,0.95,0.07452944748026716
128,wallstreetbets,billy no!,1596337095.0,"08/02/2020, 02:58:15",245,12,19720,517.2669819538933,0.97,0.01242393509127789
129,wallstreetbets,117k to 5k. I sit here typing this as I drown my sorrows in a bottle of whisky. Gambling is bad. The market won.. GG.,1586925920.0,"04/15/2020, 04:45:20",1718,12,19617,1073.4980017006346,0.95,0.08757710149360248
130,wallstreetbets,"Bend over, here it comes again!",1585678112.0,"03/31/2020, 18:08:32",565,4,19562,463.64827826893816,0.98,0.028882527348941825
131,wallstreetbets,Deal or Priced In?,1576776679.0,"12/19/2019, 17:31:19",460,28,19510,1880.4547857984326,0.91,0.023577652485904665
132,wallstreetbets,All of you in the next few months.,1578275533.0,"01/06/2020, 01:52:13",304,3,19500,766.3277945761511,0.96,0.01558974358974359
133,wallstreetbets,Money printer go BRRR,1586093375.0,"04/05/2020, 13:29:35",329,25,19478,255.14122238818527,0.99,0.016890851216757367
134,wallstreetbets,You asked for the bear to be gayer. New mascot proposal.,1585140286.0,"03/25/2020, 12:44:46",636,12,19385,837.3704975580549,0.96,0.03280887283982461
135,wallstreetbets,Joe Rogan told his friend about his Spotify deal ahead of time so that they could get in the stock earlier! Schaub let it slip on his last podast...this shound't be allowed!,1590375063.0,"05/25/2020, 02:51:03",1407,3,19240,1266.7031362273337,0.94,0.07312889812889813
136,wallstreetbets,Bulls take flight,1592343585.0,"06/16/2020, 21:39:45",408,24,19208,998.9745206962034,0.95,0.0212411495210329
137,wallstreetbets,Is This the WallStreetBets Way?,1602079564.0,"10/07/2020, 14:06:04",850,108,19119,1233.6729128612023,0.94,0.04445839217532298
138,wallstreetbets,Lemme GUH some Margin Fraud,1572973190.0,"11/05/2019, 16:59:50",331,8,18980,779.2118429433831,0.96,0.01743940990516333
139,wallstreetbets,Fuck Warren Buffett,1591711253.0,"06/09/2020, 14:00:53",881,5,18973,1653.1727287181566,0.92,0.04643440678859432
140,wallstreetbets,When your Tesla calls don't print...,1600976035.0,"09/24/2020, 19:33:55",271,44,18952,694.914143218859,0.96,0.014299282397636134
141,wallstreetbets,Basically the result my trades over the last two weeks,1595081680.0,"07/18/2020, 14:14:40",221,2,18943,733.2276781611727,0.96,0.011666578683418678
142,wallstreetbets,The Great Bear Depression of 2020,1591629279.0,"06/08/2020, 15:14:39",556,29,18546,1250.36053143533,0.94,0.02997951040655667
143,wallstreetbets,WARNING: Ameritrade requires you to have had a GF!,1596117951.0,"07/30/2020, 14:05:51",500,4,18341,601.9732682633585,0.97,0.027261327081402324
144,wallstreetbets,Questrade raped and murdered a young girl in 1990,1585883116.0,"04/03/2020, 03:05:16",841,96,18312,633.0228034639149,0.97,0.04592616863259065
145,wallstreetbets,A rare look into a typical WSB DD lab,1588153029.0,"04/29/2020, 09:37:09",428,38,18226,956.8688771996276,0.95,0.023482936464391528
146,wallstreetbets,YOLO Tesla Gains,1595256827.0,"07/20/2020, 14:53:47",423,4,18109,979.869496719788,0.95,0.02335855099674195
147,wallstreetbets,Dumping your entire net worth into SPY calls &gt; diversification,1598559385.0,"08/27/2020, 20:16:25",397,13,18105,979.5268018061324,0.95,0.02192764429715548
148,wallstreetbets,For all the boomers out there,1583430781.0,"03/05/2020, 17:53:01",408,5,18106,843.162615466972,0.96,0.022533966640892522
149,wallstreetbets,It’s been in front of us all along AMZN 9/18 4000c,1598664875.0,"08/29/2020, 01:34:35",256,33,18094,134.8094878356751,0.99,0.014148336465126561
150,wallstreetbets,"I wonder if anyone had a better return than 96k%, total 53k profit overnight for 65 contracts on AIMT buyout",1600613693.0,"09/20/2020, 14:54:53",774,87,18085,1649.1874103711998,0.92,0.04279789881116948
151,wallstreetbets,Who nutted,1586975698.0,"04/15/2020, 18:34:58",254,4,18071,1377.59438628297,0.93,0.014055669304410382
152,wallstreetbets,"Just arrived today, had a canvas portrait made of J Pow Wow, SAVIOR OF THE BULLS",1592607290.0,"06/19/2020, 22:54:50",715,15,18072,1687.868324029696,0.91,0.039563966356795044
153,wallstreetbets,Bulls seeing the senate going into recess and stimulus cheques getting pushed further out,1601759655.0,"10/03/2020, 21:14:15",544,42,18079,935.7282565835121,0.95,0.030090159853974223
154,wallstreetbets,"Much like Derrick Henry, the S&amp;P 500 cannot be stopped",1579042321.0,"01/14/2020, 22:52:01",379,9,18064,1413.5011258743689,0.93,0.020980956598759964
155,wallstreetbets,This is the most autistic thing I've seen done by this sub,1591803260.0,"06/10/2020, 15:34:20",664,1,17986,1012.5818778483626,0.95,0.03691760257978428
156,wallstreetbets,Whoa... the stock is so high lol 😳,1577118287.0,"12/23/2019, 16:24:47",389,1,17945,1465.7334844469333,0.92,0.021677347450543328
157,wallstreetbets,Petition to change our mascot back to the OG baby.,1584449407.0,"03/17/2020, 12:50:07",512,11,17937,629.3333995356224,0.97,0.028544349668283436
158,wallstreetbets,Inside CDC Headquarters: Coronovirus discussion,1584193448.0,"03/14/2020, 13:44:08",676,64,17941,353.8572995555078,0.98,0.037679059138286605
159,wallstreetbets,The split strategy,1598452432.0,"08/26/2020, 14:33:52",366,29,17797,676.5838410525648,0.96,0.020565263808507053
160,wallstreetbets,She doesn’t get it guys. Too the moon!,1603654566.0,"10/25/2020, 19:36:06",275,24,17746,1565.8079388919505,0.92,0.015496449904203765
161,wallstreetbets,I’m still sore,1599747194.0,"09/10/2020, 14:13:14",292,55,17658,761.4086110541539,0.96,0.01653641408993091
162,wallstreetbets,Thanks to selling puts on Amazon I no longer need to plan any of my meals,1594997343.0,"07/17/2020, 14:49:03",450,3,17507,740.6168038578071,0.96,0.02570400411264066
163,wallstreetbets,Friendly reminder on what to do during this Fed Minute drop,1597861421.0,"08/19/2020, 18:23:41",429,18,17457,1826.7397744999835,0.91,0.024574669187145556
164,wallstreetbets,I paid off all of mine and my girlfriends debt,1600064423.0,"09/14/2020, 06:20:23",1758,147,17442,1348.6375551377969,0.93,0.10079119367045064
165,wallstreetbets,Chris Hansen would like WallStreetBets to take a seat...right over there.,1590801745.0,"05/30/2020, 01:22:25",599,17,17358,765.2667302751761,0.96,0.03450858393824173
166,wallstreetbets,No fight for green men,1578060573.0,"01/03/2020, 14:09:33",265,1,17219,621.7766398575222,0.97,0.015389976189093444
167,wallstreetbets,“How did you decide on a strategy before yolo’ing your entire life savings?”,1595281693.0,"07/20/2020, 21:48:13",315,6,17191,552.0808153518119,0.97,0.018323541387935547
168,wallstreetbets,The gecko is dead. Base your SPY bets on which side of the lawn my dog shits on.,1590025517.0,"05/21/2020, 01:45:17",719,6,17184,1329.2011069890068,0.93,0.04184124767225326
