,Subreddit,Title,Epoch Time,Date,Comments,Awards,Upvotes,Downvotes,Upvote Ratio,Comment/Upvote Ratio
169,wallstreetbets,Negative news ain’t gonna stop these algo boys 📈,1589032316.0,"05/09/2020, 13:51:56",474,4,17150,878.5167723376326,0.95,0.027638483965014577
170,wallstreetbets,Fixed The Bloomberg Cover,1582807373.0,"02/27/2020, 12:42:53",307,16,17120,119.50920800889799,0.99,0.017932242990654206
171,wallstreetbets,Make sure you set realistic goals for yourself,1594502168.0,"07/11/2020, 21:16:08",354,3,17076,275.25945501442766,0.98,0.02073085031623331
172,wallstreetbets,50k to 1M. Thank you daddy Musk!,1598897998.0,"08/31/2020, 18:19:58",1137,71,16989,289.0487962014631,0.98,0.0669256577785626
173,wallstreetbets,SPY 225 next week confirmed,1601034319.0,"09/25/2020, 11:45:19",203,53,16941,728.0019347633497,0.96,0.011982763709344195
174,wallstreetbets,Wallstreet Debate,1601984727.0,"10/06/2020, 11:45:27",430,161,16932,1316.772736154402,0.93,0.025395700448854242
175,wallstreetbets,Robinhood free money cheat works pretty well. 1 million dollar position on 4k,1572910260.0,"11/04/2019, 23:31:00",2315,18,16901,820.5324018490101,0.95,0.13697414354180226
176,wallstreetbets,Years of trading academy wasted,1603888883.0,"10/28/2020, 12:41:23",598,13,16830,821.1027659423089,0.95,0.03553178847296495
177,wallstreetbets,Moderator's Update on Paper Trading Competition,1581524070.0,"02/12/2020, 16:14:30",649,22,16772,818.8021379539823,0.95,0.038695444788933935
178,wallstreetbets,NEW HIGH SCORE!!!,1583856302.0,"03/10/2020, 16:05:02",1385,11,16764,498.98463238115437,0.97,0.08261751371987593
179,wallstreetbets,To the rest of Reddit infiltrating wsb to try and stir up political conversations: Positions or Ban,1604013657.0,"10/29/2020, 23:20:57",741,67,16802,361.8181229767106,0.98,0.044101892631829544
180,wallstreetbets,Map customized for wsb,1586051529.0,"04/05/2020, 01:52:09",380,6,16606,207.07908830557426,0.99,0.02288329519450801
181,wallstreetbets,My new tradeing Command Center.,1598796852.0,"08/30/2020, 14:14:12",806,41,16516,296.6025092857017,0.98,0.048801162509082105
182,wallstreetbets,How do I face my family?,1599178924.0,"09/04/2020, 00:22:04",1190,244,16519,1265.3478152030875,0.93,0.0720382589745142
183,wallstreetbets,Zoom is Now Worth More Than the World’s 7 Biggest Airlines,1589690260.0,"05/17/2020, 04:37:40",1154,2,16425,713.5311416915865,0.96,0.07025875190258751
184,wallstreetbets,A Beautiful Design,1574688722.0,"11/25/2019, 13:32:02",298,9,16288,1346.706505930455,0.92,0.01829567779960707
185,wallstreetbets,WallStreet's Got Talent: The 2020 Market,1596631348.0,"08/05/2020, 12:42:28",419,38,16237,533.2803615969824,0.97,0.025805259592289215
186,wallstreetbets,What is the point of /r/personalfinance?,1601889835.0,"10/05/2020, 09:23:55",1486,146,16179,4387.900541878207,0.79,0.09184745657951665
187,wallstreetbets,"14k -&gt; 159k -&gt; 4$ , this is what happens when you never stop yoloing spy weeklies",1595689839.0,"07/25/2020, 15:10:39",1088,7,16177,841.4089431753346,0.95,0.06725598071335848
188,wallstreetbets,"Dear Diary, I lost it all again",1596839719.0,"08/07/2020, 22:35:19",1419,23,16143,738.408900655184,0.96,0.08790187697454005
189,wallstreetbets,Guess who’s losing money tomorrow WOOO,1603852815.0,"10/28/2020, 02:40:15",445,26,16173,1181.6200755112404,0.93,0.02751499412601249
190,wallstreetbets,They said buy the dip,1588796004.0,"05/06/2020, 20:13:24",1268,7,16061,855.269272185833,0.95,0.07894900691115124
191,wallstreetbets,My Girlfriend PDT restricted and thought it was an achievement,1596809291.0,"08/07/2020, 14:08:11",963,2,16024,939.7977825444214,0.94,0.06009735396904643
192,wallstreetbets,"No news in 5 days except for ""We're stopping for another month""",1590587618.0,"05/27/2020, 13:53:38",932,2,15975,448.40035951574464,0.97,0.05834115805946792
193,wallstreetbets,Who’s next on the list?,1590417238.0,"05/25/2020, 14:33:58",1051,2,15965,910.9961322982235,0.95,0.0658315064202944
194,wallstreetbets,"Apple started WWIII so that phones would be destroyed, reducing the average upgrade cycle time. Long $AAPL.",1578148697.0,"01/04/2020, 14:38:17",177,1,15897,1082.678551836354,0.94,0.011134176259671636
195,wallstreetbets,"Good Luck tomorrow Bear Gang, You're Gonna Need It",1586712123.0,"04/12/2020, 17:22:03",564,26,15872,649.1830048338998,0.96,0.03553427419354839
196,wallstreetbets,"Imagine being so autistic you make 4.2 Million dollars in a couple days, dont sell, and lose it all...",1580920362.0,"02/05/2020, 16:32:42",1293,6,15809,3334.468536989265,0.83,0.08178885444999684
197,wallstreetbets,Not to mention that whole pandemic thing,1591017757.0,"06/01/2020, 13:22:37",362,1,15786,455.48529226292703,0.97,0.022931711643228176
198,wallstreetbets,I have to go make a call.,1594918280.0,"07/16/2020, 16:51:20",514,1,15777,739.9922675446323,0.96,0.03257907079926475
199,wallstreetbets,Retarded Chinese investors reacting to NKLA revenue numbers,1598639310.0,"08/28/2020, 18:28:30",490,26,15733,1635.3226198680895,0.91,0.0311447276425348
200,wallstreetbets,"As Sunday evening approaches, JPOW JR checks in on his dad.",1599424358.0,"09/06/2020, 20:32:38",179,37,15721,839.8592105003991,0.95,0.011386044144774506
201,wallstreetbets,Stonks.,1591024266.0,"06/01/2020, 15:11:06",379,3,15685,266.8617070402561,0.98,0.02416321326107746
202,wallstreetbets,CNN every morning,1603394448.0,"10/22/2020, 19:20:48",274,25,15637,578.4749258492411,0.96,0.017522542687216217
203,wallstreetbets,Long $LYFT,1603570147.0,"10/24/2020, 20:09:07",321,15,15603,1047.4363406967786,0.94,0.02057296673716593
204,wallstreetbets,We did it WSBs,1582822663.0,"02/27/2020, 16:57:43",490,1,15557,226.01700848895598,0.99,0.03149707527158192
205,wallstreetbets,"If SPY closes green tomorrow, I'll get a tattoo of the WSB logo",1595802912.0,"07/26/2020, 22:35:12",968,20,15409,949.5039915271591,0.94,0.0628204296190538
206,wallstreetbets,34k -&gt; 566k in AMZN Calls this week - I'm out ✌️✌️,1587059802.0,"04/16/2020, 17:56:42",1508,7,15390,1533.99795114046,0.91,0.09798570500324887
207,wallstreetbets,"WSB ""YOLO King"" Lands Interview on CNBC",1573218579.0,"11/08/2019, 13:09:39",593,16,15343,1567.0182336582875,0.91,0.038649547024701816
208,wallstreetbets,WSB users interacting in real life,1601396658.0,"09/29/2020, 16:24:18",466,29,15322,288.69473596962234,0.98,0.03041378410129226
209,wallstreetbets,When a new autist joins this sub...,1602882548.0,"10/16/2020, 21:09:08",264,81,15334,926.4385061982757,0.94,0.01721664275466284
210,wallstreetbets,"R.I.P WSBGod, may your tendies rain down from the heavens",1585176781.0,"03/25/2020, 22:53:01",959,15,15243,909.816092665129,0.94,0.06291412451617136
211,wallstreetbets,What have you tards done???,1581354048.0,"02/10/2020, 17:00:48",1098,6,15197,1010.9772283260863,0.94,0.07225110219122195
212,wallstreetbets,I was an investor until last week I finally became an autist.,1603791712.0,"10/27/2020, 09:41:52",557,68,15188,957.0746457223868,0.94,0.036673689755069794
213,wallstreetbets,At least one you guys made it out on top.,1599435722.0,"09/06/2020, 23:42:02",574,38,15039,414.76448467899536,0.97,0.03816743134516923
214,wallstreetbets,What Liquidity Problem?,1584646037.0,"03/19/2020, 19:27:17",309,3,15011,157.64852974512542,0.99,0.02058490440343748
215,wallstreetbets,Keep it up retards,1579609633.0,"01/21/2020, 12:27:13",279,3,14992,1138.2490118136757,0.93,0.01860992529348986
216,wallstreetbets,AMD vs Intel,1595626974.0,"07/24/2020, 21:42:54",479,8,14986,775.8047613313538,0.95,0.03196316562124649
217,wallstreetbets,America’s Self-Sustaining Economy,1586805698.0,"04/13/2020, 19:21:38",358,14,14961,483.68306546130043,0.97,0.023928881759240694
218,wallstreetbets,timing is everything,1595363462.0,"07/21/2020, 20:31:02",334,1,14923,712.8786877702187,0.95,0.022381558667828184
219,wallstreetbets,Some advice from the old fucks,1584031814.0,"03/12/2020, 16:50:14",1652,10,14904,313.3859583542144,0.98,0.11084272678475578
220,wallstreetbets,Tesla Call Holders Last Week,1599499623.0,"09/07/2020, 17:27:03",374,33,14859,233.03630616352712,0.98,0.025169930681741705
221,wallstreetbets,"Fed Hate Thread: These fucking bankers say in order to preserve the economy we need to blow the bubble even bigger. We live in a free market economy right? Think again buddy. If your company is big enough, you can take on all the toxic risk you want and the Fed will just come in and buy it off you.",1584966935.0,"03/23/2020, 12:35:35",2213,9,14854,439.7952696536595,0.97,0.14898343880436246
222,wallstreetbets,WSB only wants one thing and it’s disgusting,1601504518.0,"09/30/2020, 22:21:58",319,19,14843,720.6341334983208,0.95,0.021491612207774707
223,wallstreetbets,WSBgod vs THE MOUSE,1584550740.0,"03/18/2020, 16:59:00",1044,12,14815,226.40088968892633,0.98,0.0704691191360108
224,wallstreetbets,Bull Gang - 9 days later,1582901110.0,"02/28/2020, 14:45:10",270,5,14795,109.64275128807276,0.99,0.018249408583981074
225,wallstreetbets,Chicks with $DKS,1596114334.0,"07/30/2020, 13:05:34",340,32,14748,590.6818337107597,0.96,0.023053973420124763
226,wallstreetbets,Robinhood turned its theme to red today in honor of Valentine’s Day!,1581702357.0,"02/14/2020, 17:45:57",302,5,14758,861.2080570262951,0.94,0.020463477435966933
227,wallstreetbets,"First week on Wallstreet, nobody told me about this shit. I guess I’ll see you all in 90 days lol",1602939969.0,"10/17/2020, 13:06:09",1001,39,14641,1022.3927252283174,0.93,0.06836964688204357
228,wallstreetbets,All My Money Goes Away In The End ft Johnny Cash,1587129951.0,"04/17/2020, 13:25:51",457,36,14586,990.4275957524969,0.94,0.03133141368435486
229,wallstreetbets,"Papa Elon, hold us, tell us it’s going to be okay.",1595397113.0,"07/22/2020, 05:51:53",394,11,14551,1026.8548674231824,0.93,0.02707717682633496
230,wallstreetbets,$SPY going to $500 because it’s literally called the s and p 500. Calls 👍,1591200175.0,"06/03/2020, 16:02:55",505,2,14519,1001.8460660569654,0.94,0.0347820097802879
231,wallstreetbets,Oil tankers are returning to the California coastline. Nature is healing. #WeAreTheVirus 🙏🏻,1587800423.0,"04/25/2020, 07:40:23",442,4,14524,645.6796390466243,0.96,0.030432387771963647
232,wallstreetbets,$10k -&gt; $1k -&gt; $70k -&gt; $2k,1595592713.0,"07/24/2020, 12:11:53",656,5,14457,577.4360635985649,0.96,0.04537594245002421
233,wallstreetbets,You think I’ll get the job ?,1597534371.0,"08/15/2020, 23:32:51",388,14,14336,481.8529791573983,0.97,0.027064732142857144
234,wallstreetbets,A brief explanation of options for stoolies.,1585523644.0,"03/29/2020, 23:14:04",802,39,14328,923.5398352623724,0.94,0.05597431602456728
235,wallstreetbets,Tomorrow be like:,1583714408.0,"03/09/2020, 00:40:08",540,1,14297,185.7924040635353,0.99,0.03777016157235784
236,wallstreetbets,Papa Musk with the wise words,1587524792.0,"04/22/2020, 03:06:32",501,1,14275,1404.942443699907,0.91,0.03509632224168126
237,wallstreetbets,Bull Belly Floppp,1600699508.0,"09/21/2020, 14:45:08",506,64,14181,736.8236576785584,0.95,0.03568154573020239
238,wallstreetbets,Don't ban me. I'm just venting,1597120202.0,"08/11/2020, 04:30:02",192,8,14159,439.6785854853824,0.97,0.013560279680768415
239,wallstreetbets,"""I've been trading options the last few weeks""",1583917533.0,"03/11/2020, 09:05:33",281,4,14161,76.84882016814117,0.99,0.019843231410211142
240,wallstreetbets,Fuck you KODK,1597037591.0,"08/10/2020, 05:33:11",247,12,14119,148.69751905902922,0.99,0.017494156809972378
241,wallstreetbets,He hath delivered thy autismos to the promised land,1597937174.0,"08/20/2020, 15:26:14",738,16,14075,926.4495838647417,0.94,0.05243339253996448
242,wallstreetbets,FSLY Showing “Dick n’Balls” Shaped Decline,1596658389.0,"08/05/2020, 20:13:09",380,7,14070,925.5822707895732,0.94,0.02700781805259417
243,wallstreetbets,SEC Launches Investigation Of Trading In Kodak Shares Before And After $765 Million Loan Disclosure,1596561347.0,"08/04/2020, 17:15:47",604,1,14072,500.4568423834626,0.97,0.04292211483797612
244,wallstreetbets,Welcome to Fabulous Wallstreetbets,1588516108.0,"05/03/2020, 14:28:28",390,16,14040,643.5433862334721,0.96,0.027777777777777776
245,wallstreetbets,I’ve never scored above a 99% on anything before,1600462921.0,"09/18/2020, 21:02:01",454,73,14008,430.26818993018423,0.97,0.03241005139920046
246,wallstreetbets,Prepaid $TSLA Calls! Only 1.1k!!!,1581299529.0,"02/10/2020, 01:52:09",308,5,13995,855.9482790904967,0.94,0.022007859949982136
247,wallstreetbets,WSB vs. the world,1592504823.0,"06/18/2020, 18:27:03",472,1,13960,491.5163346228055,0.97,0.033810888252149
248,wallstreetbets,Recently converted and proud Bull here,1588939366.0,"05/08/2020, 12:02:46",454,1,13960,1132.7907633670056,0.92,0.032521489971346705
249,wallstreetbets,The Oracle Speaks,1585400792.0,"03/28/2020, 13:06:32",1455,2,13919,495.9344449139171,0.97,0.10453337165026223
250,wallstreetbets,WSB rn,1583098194.0,"03/01/2020, 21:29:54",278,5,13916,85.17792845853364,0.99,0.019977004886461626
251,wallstreetbets,Get those $V calls ready boys,1593220221.0,"06/27/2020, 01:10:21",898,0,13886,521.6739262486262,0.96,0.06466945124585914
252,wallstreetbets,"Apparently, this is the place people come after they are still alive from blowing their accounts",1602610937.0,"10/13/2020, 17:42:17",770,52,13871,785.1575845572097,0.95,0.05551149881046788
253,wallstreetbets,Robinhood Execute Order 66,1583244606.0,"03/03/2020, 14:10:06",497,23,13793,205.74247927063698,0.99,0.03603277024577684
254,wallstreetbets,Buffett's Plan for WW3,1578317024.0,"01/06/2020, 13:23:44",300,17,13795,933.5907982798726,0.94,0.021747009786154403
255,wallstreetbets,Never Go Full Money Printer,1590683571.0,"05/28/2020, 16:32:51",425,60,13768,410.8899843027284,0.97,0.030868680999418942
256,wallstreetbets,"Warren Buffett on Airlines, Scared Money Gon' Save Money",1588623363.0,"05/04/2020, 20:16:03",405,4,13752,883.2831964530233,0.94,0.029450261780104712
257,wallstreetbets,I imagine this is how most conversations with people on this subreddit go,1591142686.0,"06/03/2020, 00:04:46",361,1,13725,307.1848002974839,0.98,0.026302367941712205
258,wallstreetbets,Leaked Nicola investor presentation,1600437037.0,"09/18/2020, 13:50:37",339,31,13714,574.9030047449505,0.96,0.02471926498468718
259,wallstreetbets,She says it's for luck 😤,1599998981.0,"09/13/2020, 12:09:41",501,108,13562,1566.2644021894212,0.9,0.03694145406282259
260,wallstreetbets,Wall Street Musk Convinces Joe Rogan To Buy Puts,1590931782.0,"05/31/2020, 13:29:42",329,33,13501,873.7408687626266,0.94,0.024368565291459893
261,wallstreetbets,Me IRL,1600956179.0,"09/24/2020, 14:02:59",216,43,13423,647.3342832214821,0.95,0.01609178276093273
262,wallstreetbets,Just don't fucking dance,1584015157.0,"03/12/2020, 12:12:37",962,14,13414,605.7080587625405,0.96,0.07171611748919039
263,wallstreetbets,"New banner/mascots/logo proposal: Big Gay Bear, Baby Belfort and Chad Bull",1585573138.0,"03/30/2020, 12:58:58",381,15,13408,582.5838696498195,0.96,0.028415871121718377
264,wallstreetbets,Bears celebrating their Lehman shorts behind reporter in 2008,1588286775.0,"04/30/2020, 22:46:15",427,5,13397,416.680690935631,0.97,0.03187280734492797
265,wallstreetbets,"Every time I see a ""Technical ANALysis"" post",1585709972.0,"04/01/2020, 02:59:32",544,6,13371,551.2761398686034,0.96,0.04068506469224441
266,wallstreetbets,"If you think the current WSB logo is bad, this is what someone threw into the hat during the decision process",1584508041.0,"03/18/2020, 05:07:21",688,4,13370,627.4212944939081,0.96,0.05145848915482423
267,wallstreetbets,TSLA shorts vs longs.,1594385555.0,"07/10/2020, 12:52:35",451,1,13349,590.1910956687498,0.96,0.033785302269832944
268,wallstreetbets,Autist traded options before knowing what they were,1581437592.0,"02/11/2020, 16:13:12",543,0,13340,548.2852284746896,0.96,0.04070464767616192
269,wallstreetbets,"Elon’s taking a break from Twitter.. TSLA 1,500!",1591067807.0,"06/02/2020, 03:16:47",337,0,13302,588.3382266712379,0.96,0.025334536159975943
270,wallstreetbets,Just bought some calls on $PUMPKIN 🎃,1604063865.0,"10/30/2020, 13:17:45",212,39,13281,224.8804676303298,0.98,0.01596265341465251
271,wallstreetbets,People in this sub be tho,1604299018.0,"11/02/2020, 06:36:58",134,25,13489,304.0316619105415,0.98,0.009934020312847505
272,wallstreetbets,GME YOLO update — Oct 8 2020,1602187831.0,"10/08/2020, 20:10:31",1143,140,13193,745.8410964244486,0.95,0.08663685287652544
273,wallstreetbets,Its been a rough year &amp; a half.,1596204741.0,"07/31/2020, 14:12:21",760,9,13157,483.02429161388864,0.96,0.057763927947100405
274,wallstreetbets,BUILT DIFFERENT 🥶😈,1601652065.0,"10/02/2020, 15:21:05",397,44,13158,731.9098856596156,0.95,0.03017175862593099
275,wallstreetbets,JPOW only knows ⬆️,1592918626.0,"06/23/2020, 13:23:46",299,1,13155,387.96893751605603,0.97,0.02272900038008362
276,wallstreetbets,New Robinhood Traders this week,1599304535.0,"09/05/2020, 11:15:35",365,40,13116,384.8259946144299,0.97,0.027828606282403173
277,wallstreetbets,Stock Market of 2020,1594764970.0,"07/14/2020, 22:16:10",348,12,13059,396.315525486556,0.97,0.026648288536641397
278,wallstreetbets,The Wallstreetbets Bears Survive the Quad Witch,1584755341.0,"03/21/2020, 01:49:01",389,19,12988,172.50462992673238,0.99,0.02995072374499538
279,wallstreetbets,Buying just about any calls in the past 6 months,1601857375.0,"10/05/2020, 00:22:55",322,25,12980,413.39097075684913,0.97,0.024807395993836672
280,wallstreetbets,When the relatives ask “how’s the trading going?” this Christmas,1573659289.0,"11/13/2019, 15:34:49",165,0,12957,561.4238863394039,0.96,0.012734429266033805
281,wallstreetbets,Candlelight dinner,1582274645.0,"02/21/2020, 08:44:05",177,2,12787,180.67482378094974,0.99,0.013842183467584266
282,wallstreetbets,When will you guys learn?,1601384597.0,"09/29/2020, 13:03:17",280,41,12781,571.5895299651147,0.96,0.021907518973476255
283,wallstreetbets,"Friday night 8:10 showing, buy AMC puts.",1599323990.0,"09/05/2020, 16:39:50",762,23,12720,441.86378122024144,0.97,0.05990566037735849
284,wallstreetbets,Any brokers accepting puts on my marriage?,1586089696.0,"04/05/2020, 12:28:16",267,4,12697,309.6032394356007,0.98,0.021028589430574153
285,wallstreetbets,Tesla Truck I'm only going to say this once,1574424894.0,"11/22/2019, 12:14:54",2467,5,12672,2533.3077629077598,0.83,0.19468118686868688
286,wallstreetbets,"The harder they soar, the FSLY they fall (-4.4k -&gt; 380k live)",1602771206.0,"10/15/2020, 14:13:26",1126,72,12646,654.8419907989428,0.95,0.08904001265222204
287,wallstreetbets,I made it! 6 figures!,1603819685.0,"10/27/2020, 17:28:05",915,72,12631,617.1874933739637,0.95,0.07244082020425936
288,wallstreetbets,The Great Unwinding: Why WSB Will Keep Losing Their Tendies,1584809475.0,"03/21/2020, 16:51:15",7326,71,12588,207.14310145883246,0.98,0.5819828408007627
289,wallstreetbets,Woof Shit Bets - Doo Diligence Ep. 5/21,1590091414.0,"05/21/2020, 20:03:34",560,12,12555,722.7731884339773,0.95,0.04460374352847471
290,wallstreetbets,WSB makes a plan for Monday,1584293088.0,"03/15/2020, 17:24:48",497,11,12507,116.93571259710006,0.99,0.03973774686175741
291,wallstreetbets,i DoN't WaNt To TrAdE yOu AnYmOrE,1591881663.0,"06/11/2020, 13:21:03",236,9,12485,327.9886299635273,0.97,0.018902683219863835
292,wallstreetbets,Bears finally waking up to seeing red,1591719156.0,"06/09/2020, 16:12:36",412,9,12400,337.41290996017415,0.97,0.0332258064516129
293,wallstreetbets,Relatable,1589904430.0,"05/19/2020, 16:07:10",283,5,12345,299.38703599287874,0.98,0.02292426083434589
294,wallstreetbets,"How all of you look spamming your shitty questrade posts, make wallstreetbets great again",1585919157.0,"04/03/2020, 13:05:57",231,7,12325,1270.541128133249,0.91,0.018742393509127788
295,wallstreetbets,True account of the emergency rate cut,1583633015.0,"03/08/2020, 02:03:35",168,12,12310,185.49558037118732,0.99,0.013647441104792851
296,wallstreetbets,Tipanic,1579718759.0,"01/22/2020, 18:45:59",427,15,12267,510.02475028929257,0.96,0.03480883671639358
297,wallstreetbets,Fed Chair 'Mountain Dew' Camacho Powell's plan to fix the economy,1586268323.0,"04/07/2020, 14:05:23",334,22,12238,185.97386372892834,0.99,0.027292041183199868
298,wallstreetbets,GTA 6 Confirmed,1590168682.0,"05/22/2020, 17:31:22",234,6,12195,846.1122522181086,0.94,0.01918819188191882
299,wallstreetbets,u/RobinhoodTeam tries to manage r/WallStreetBets,1575308877.0,"12/02/2019, 17:47:57",163,9,12084,536.7380792577933,0.96,0.013488910956636875
300,wallstreetbets,Wsb was around back then?,1600636759.0,"09/20/2020, 21:19:19",363,28,12058,217.73253295206996,0.98,0.03010449494111793
301,wallstreetbets,Papa Elon,1597743401.0,"08/18/2020, 09:36:41",290,17,11998,847.6388643153496,0.93,0.024170695115852642
302,wallstreetbets,"Stop with the support threads. If you need emotional guidance, go back to twoxchromosomes",1585101004.0,"03/25/2020, 01:50:04",335,12,11950,1037.0218090572107,0.92,0.02803347280334728
303,wallstreetbets,It’s a sign,1599879751.0,"09/12/2020, 03:02:31",131,64,11933,182.41842319743046,0.98,0.010977960278220062
304,wallstreetbets,SEC when they visit our future building in wallstreet,1601164196.0,"09/26/2020, 23:49:56",210,40,11909,560.9973611052119,0.96,0.017633722394827443
305,wallstreetbets,Good work gentlemen.,1594062867.0,"07/06/2020, 19:14:27",509,5,11913,557.1161885999718,0.96,0.04272643330815076
306,wallstreetbets,Thank you for flying WSB,1582644877.0,"02/25/2020, 15:34:37",518,26,11817,176.66204840488172,0.99,0.04383515274604383
307,wallstreetbets,"If tonight is the last night for the sub, I love you all",1593400067.0,"06/29/2020, 03:07:47",719,6,11814,638.3022020236986,0.95,0.060859996614186555
308,wallstreetbets,To all the Newbz asking for advice -,1584096740.0,"03/13/2020, 10:52:20",529,6,11789,145.74082617803288,0.99,0.04487233862074815
309,wallstreetbets,JPOW's plan,1604241438.0,"11/01/2020, 14:37:18",324,26,11856,140.08753122178132,0.99,0.027327935222672066
310,wallstreetbets,I parsed over a million r/WallStreetBets comments. Here's WSB's sentiment alongside the S&amp;P 500,1596991893.0,"08/09/2020, 16:51:33",576,16,11763,137.8474623249258,0.99,0.04896710022953328
311,wallstreetbets,Buyin Puts At the Bottom (bear edition),1593873792.0,"07/04/2020, 14:43:12",416,70,11724,629.3897907578557,0.95,0.03548277038553395
312,wallstreetbets,Chris Hansen - To Catch a Bear 🐻,1592749402.0,"06/21/2020, 14:23:22",402,13,11721,776.6340483841977,0.94,0.0342974148963399
313,wallstreetbets,Stonkss go ups,1592941235.0,"06/23/2020, 19:40:35",189,5,11697,337.7981628946709,0.97,0.01615798922800718
314,wallstreetbets,WSB survives the great reddit hate speech purge,1593451963.0,"06/29/2020, 17:32:43",1098,1,11668,1061.1840428651249,0.92,0.09410353102502571
315,wallstreetbets,National Parks Know What is What. Found in front of (Federal) Reserve.,1596915672.0,"08/08/2020, 19:41:12",166,5,11649,103.79025027481111,0.99,0.014250150227487338
316,wallstreetbets,They are on to us... r/wallstreetbets on Bloomberg,1581670249.0,"02/14/2020, 08:50:49",744,2,11631,291.77812826746595,0.98,0.06396698478204797
317,wallstreetbets,When you move out of Mom's basement and the desperation sets in,1595166362.0,"07/19/2020, 13:46:02",110,1,11611,480.81282296469,0.96,0.009473774868659031
318,wallstreetbets,"Hey yall. I drew the original baby, AMA",1584990965.0,"03/23/2020, 19:16:05",622,18,11617,188.38628530616552,0.98,0.053542222604803305
319,wallstreetbets,Went from 80k to 2.2m to 1m in the past month. Time to retire from this emotional rollercoaster and rollover to TD and schwab.,1586206195.0,"04/06/2020, 20:49:55",1024,7,11606,352.3711599955732,0.97,0.08823022574530415
320,wallstreetbets,WallStreetBets now public again due to scammers.,1584315599.0,"03/15/2020, 23:39:59",3610,27,11547,316.34338836932693,0.97,0.31263531653243265
321,wallstreetbets,"If you switch Google to Korean, red Means UP. if we all move to Korea we'll be RICH!",1601070724.0,"09/25/2020, 21:52:04",291,24,11546,329.54002397332806,0.97,0.02520353369132167
322,wallstreetbets,TSLA TENDIES,1580746526.0,"02/03/2020, 16:15:26",991,7,11537,447.7140439834038,0.96,0.08589754702262287
323,wallstreetbets,The different types of DD on this sub,1597836027.0,"08/19/2020, 11:20:27",273,38,11512,471.93009264661487,0.96,0.023714384989576096
324,wallstreetbets,Trading advice from WSB in a meme,1587315109.0,"04/19/2020, 16:51:49",292,3,11426,519.2062672210923,0.96,0.025555750043759845
325,wallstreetbets,The only financial advice I follow,1592009067.0,"06/13/2020, 00:44:27",308,0,11418,83.06395301683733,0.99,0.02697495183044316
326,wallstreetbets,Elon’s master plan,1580324981.0,"01/29/2020, 19:09:41",524,0,11417,714.7172336372587,0.94,0.04589647017605326
327,wallstreetbets,Might be best to go private for a bit?,1582771940.0,"02/27/2020, 02:52:20",1115,9,11412,282.53735697560114,0.98,0.09770417104801962
328,wallstreetbets,I'm finally getting the hang of this,1601928612.0,"10/05/2020, 20:10:12",417,53,11401,302.29013848695286,0.97,0.03657573897026577
329,wallstreetbets,The unofficial wallstreetbets alignment chart,1592067112.0,"06/13/2020, 16:51:52",331,5,11348,557.7913213373486,0.95,0.029168135354247445
330,wallstreetbets,The Great Crash of 2020,1598415369.0,"08/26/2020, 04:16:09",260,30,11341,356.69238911006323,0.97,0.02292566793051759
331,wallstreetbets,Donation we needed,1583290274.0,"03/04/2020, 02:51:14",384,11,11321,406.95895750810996,0.97,0.033919265082589876
332,wallstreetbets,BULL GANG renaming the Virus is the only way China will get rid of this thing QUICKLY.,1580097016.0,"01/27/2020, 03:50:16",152,4,11277,433.39805938035533,0.96,0.013478762082114038
333,wallstreetbets,Magic lines go brrrrrrrrrrrrrr,1594002620.0,"07/06/2020, 02:30:20",447,1,11261,485.1280834483132,0.96,0.03969452091288518
334,wallstreetbets,"Hertz bankruptcy is CANCELLED by robinhood ""investors""",1591377352.0,"06/05/2020, 17:15:52",1121,1,11199,372.22409080949546,0.97,0.10009822305562997
