,Subreddit,Title,Epoch Time,Date,Comments,Awards,Upvotes,Downvotes,Upvote Ratio,Comment/Upvote Ratio
335,wallstreetbets,Its not Robinhood’s fault this time,1600752204.0,"09/22/2020, 05:23:24",156,43,11158,205.6232933256997,0.98,0.013981000179243593
336,wallstreetbets,Musk is Genius,1597675767.0,"08/17/2020, 14:49:27",654,24,11075,1233.5108801412753,0.9,0.05905191873589165
337,wallstreetbets,WSB Buying Calls,1599696319.0,"09/10/2020, 00:05:19",149,36,11071,210.36908438715545,0.98,0.013458585493632012
338,wallstreetbets,Trump says the US is not gonna open as he previously wanted. Markets gonna be a green as money Monday! The less economic activity = higher stock prices!,1586563440.0,"04/11/2020, 00:04:00",1137,2,11039,759.3314546353304,0.94,0.10299846000543528
339,wallstreetbets,I made this 129 days ago and the mods will not approve. It’s all true now.,1584170720.0,"03/14/2020, 07:25:20",222,7,10932,344.733461726677,0.97,0.02030735455543359
340,wallstreetbets,The Fed is the Ultimate Autist,1584050349.0,"03/12/2020, 21:59:09",624,3,10922,251.88501732756413,0.98,0.05713239333455411
341,wallstreetbets,I remember back when +1.7k in a day felt great. Ha!,1602119081.0,"10/08/2020, 01:04:41",494,46,10923,460.6273295579613,0.96,0.04522567060331411
342,wallstreetbets,Loving this new logo!,1584593317.0,"03/19/2020, 04:48:37",198,1,10886,499.9120663202302,0.96,0.018188498989527836
343,wallstreetbets,Retard gang check 😤,1596812571.0,"08/07/2020, 15:02:51",189,5,10871,349.19299961380057,0.97,0.017385705086928525
344,wallstreetbets,If you don’t love me at my +7% then you don’t deserve me at my -20%,1585076266.0,"03/24/2020, 18:57:46",674,4,10866,204.55482653885701,0.98,0.0620283452972575
345,wallstreetbets,Just bought $5 worth of WTI crude and it's coming,1587416108.0,"04/20/2020, 20:55:08",214,5,10762,90.09806886702427,0.99,0.019884779780709905
346,wallstreetbets,Jerome Powell prints too much money and dies,1586660234.0,"04/12/2020, 02:57:14",282,10,10768,690.9456636519826,0.94,0.026188707280832096
347,wallstreetbets,Stonks only go up,1591911425.0,"06/11/2020, 21:37:05",208,1,10757,245.86286773837492,0.98,0.01933624616528772
348,wallstreetbets,Turned 32 today. She knows imma get us rich in no time so she’s 100% support squad,1601945029.0,"10/06/2020, 00:43:49",427,49,10758,634.1203632634224,0.94,0.039691392452128646
349,wallstreetbets,"The prophet spoke to us, but we did not listen.",1600154675.0,"09/15/2020, 07:24:35",194,24,10733,471.67384400314586,0.96,0.018075095499860243
350,wallstreetbets,Wallstreetbets Can’t Handle the Truth,1585827390.0,"04/02/2020, 11:36:30",357,15,10738,213.63454727000135,0.98,0.033246414602346806
351,wallstreetbets,Serious Note: You can always make and lose more money but don’t take your life.,1584365762.0,"03/16/2020, 13:36:02",793,24,10720,300.477141091691,0.97,0.07397388059701493
352,wallstreetbets,Oil producers to buyers right now,1587419900.0,"04/20/2020, 21:58:20",176,0,10713,130.0209860387913,0.99,0.016428638103239055
353,wallstreetbets,Infinite Leverage Helped Land Me My Dream Internship,1573343004.0,"11/09/2019, 23:43:24",316,4,10702,467.0952971956358,0.96,0.02952719117921884
354,wallstreetbets,Wall Street is trying to tell us something.,1589724322.0,"05/17/2020, 14:05:22",359,1,10700,440.59334657338513,0.96,0.03355140186915888
355,wallstreetbets,"It ain’t much but it’s honest work ,,",1581388532.0,"02/11/2020, 02:35:32",748,5,10698,1026.795846743009,0.91,0.06991961114226958
356,wallstreetbets,Charles Schwab State of Mind,1574376259.0,"11/21/2019, 22:44:19",302,1,10671,405.20827088762053,0.96,0.028301002717645955
357,wallstreetbets,The Birth of a Degenerate,1597654255.0,"08/17/2020, 08:50:55",165,19,10671,191.07954978851922,0.98,0.015462468372223785
358,wallstreetbets,How the Twitter Hack Should Have Went,1594862992.0,"07/16/2020, 01:29:52",272,2,10666,251.36637598562083,0.98,0.0255015938496156
359,wallstreetbets,D PUMP,1596623460.0,"08/05/2020, 10:31:00",190,4,10651,602.5038610527154,0.95,0.017838700591493756
360,wallstreetbets,The ad tech really nailed the demographic,1590303716.0,"05/24/2020, 07:01:56",145,1,10636,226.82656402774228,0.98,0.013632944716058668
361,wallstreetbets,SEC is really addressing RobinHood users here,1576029770.0,"12/11/2019, 02:02:50",292,0,10618,92.54582416826452,0.99,0.02750047089847429
362,wallstreetbets,Just a friendly reminder of whats been going on since April. And Jerome just confirmed SPY 400C,1598707658.0,"08/29/2020, 13:27:38",589,26,10595,238.60278415588982,0.98,0.05559226050023596
363,wallstreetbets,Tatted Up Musk Vs. Simulation Cramer - Revenge of The Tweet,1595934031.0,"07/28/2020, 11:00:31",355,20,10584,423.62987120447906,0.96,0.03354119425547997
364,wallstreetbets,ShOUld I seLl mY CAlLs gUYs?,1582552840.0,"02/24/2020, 14:00:40",550,0,10567,215.52978305826946,0.98,0.05204883126715246
365,wallstreetbets,All of WSB right now,1583508670.0,"03/06/2020, 15:31:10",477,1,10533,198.90572515210988,0.98,0.04528624323554543
366,wallstreetbets,Cramer finally giving WSB autists a shoutout,1593611149.0,"07/01/2020, 13:45:49",291,5,10507,700.1458190914382,0.94,0.027695821833063673
367,wallstreetbets,"In case you lost some money today, don't forget about this guy",1577744090.0,"12/30/2019, 22:14:50",693,3,10497,304.85179474697543,0.97,0.06601886253215204
368,wallstreetbets,How this market downturn compares to 2008 market crash.,1583559461.0,"03/07/2020, 05:37:41",1251,3,10487,162.68854329437454,0.98,0.11929055020501574
369,wallstreetbets,Proof that $SPCE is past its prime,1582215192.0,"02/20/2020, 16:13:12",406,1,10488,295.6703410595146,0.97,0.038710907704042716
370,wallstreetbets,I started a new green energy car company called Edison,1599843987.0,"09/11/2020, 17:06:27",524,54,10425,321.46950226266745,0.97,0.05026378896882494
371,wallstreetbets,"When unemployment hits record levels, and markets shoot up.",1585840286.0,"04/02/2020, 15:11:26",517,4,10421,236.50780929355278,0.98,0.049611361673543804
372,wallstreetbets,WSB Saturday Chat,1587245235.0,"04/18/2020, 21:27:15",100002,42,10349,456.5766804804189,0.96,9.662962605082617
373,wallstreetbets,stocks can rise 1000s of % but can only be down 100%,1598879251.0,"08/31/2020, 13:07:31",533,15,10347,172.47599393807286,0.98,0.051512515705035275
374,wallstreetbets,Trump waking up JPowell to turn on the money printers at the open,1586006565.0,"04/04/2020, 13:22:45",131,4,10292,281.3624423234651,0.97,0.012728332685581033
375,wallstreetbets,I feel attacked,1591794421.0,"06/10/2020, 13:07:01",666,0,10289,589.4410240639263,0.95,0.06472932257750996
376,wallstreetbets,Retired at 21 with tesla puts,1584572740.0,"03/18/2020, 23:05:40",1553,1,10257,884.4316504724393,0.92,0.15140879399434531
377,wallstreetbets,"""At LeAsT yOuRe YoUnG"" - Boomers that probably sold me these options",1586487301.0,"04/10/2020, 02:55:01",806,11,10220,526.7803716455855,0.95,0.07886497064579256
378,wallstreetbets,WSB right now:,1597232813.0,"08/12/2020, 11:46:53",553,8,10203,447.2053887735383,0.96,0.05419974517298834
379,wallstreetbets,Live action board room meeting of Travis Milton explaining Nikolas Hydrogen production.,1600256586.0,"09/16/2020, 11:43:06",356,17,10205,292.27971198493833,0.97,0.03488486036256737
380,wallstreetbets,Live footage of bears this weekend after booking 3 days of gains,1599504519.0,"09/07/2020, 18:48:39",319,28,10201,333.73492191344303,0.97,0.031271443976080775
381,wallstreetbets,Lord of WSB,1583152037.0,"03/02/2020, 12:27:17",318,17,10183,101.35669265039542,0.99,0.03122851811843268
382,wallstreetbets,"Last night, it really hit me. This is pure gambling.",1602324604.0,"10/10/2020, 10:10:04",736,61,10159,576.6946007445858,0.95,0.07244807559799193
383,wallstreetbets,World War 3 Has Started,1578022797.0,"01/03/2020, 03:39:57",842,5,10141,1366.2641835066843,0.88,0.08302928705255892
384,wallstreetbets,"The great collapse: Why S&amp;P 500 will drop below 2,400 within 2 weeks",1586875517.0,"04/14/2020, 14:45:17",683,17,10125,721.1965059229005,0.93,0.06745679012345679
385,wallstreetbets,His poor heart :(,1583370604.0,"03/05/2020, 01:10:04",363,12,10101,123.25632862683597,0.99,0.035937035937035934
386,wallstreetbets,Donald Trump has an Important Announcement for WSB,1596884301.0,"08/08/2020, 10:58:21",395,15,10087,783.8512262275435,0.93,0.039159313968474274
387,wallstreetbets,"I’m gonna make a shit ton of money come Monday when the Market drops again, we gotta give back like we used to",1583015544.0,"02/29/2020, 22:32:24",873,11,10032,234.51311777344017,0.98,0.08702153110047847
388,wallstreetbets,Bears R 🌈🌈🌈,1592872930.0,"06/23/2020, 00:42:10",570,5,10023,960.5323016947914,0.91,0.05686920083807243
389,wallstreetbets,$3.5 -&gt; $25 Gift Card to Chili's in 4~ Months,1594248327.0,"07/08/2020, 22:45:27",263,21,9987,321.52082497271476,0.97,0.026334234504856315
390,wallstreetbets,"Here's some advice: Recession is incoming, so do your best to keep your job and kick ass at it.",1584109479.0,"03/13/2020, 14:24:39",1344,9,9971,350.2805628561837,0.97,0.1347908935914151
391,wallstreetbets,Guy at bank laughed when I said I use info from you retards on WSB,1601391032.0,"09/29/2020, 14:50:32",468,61,9966,227.65122986486313,0.98,0.04695966285370259
392,wallstreetbets,Time to trade in TSLA for a Model 3.,1598203560.0,"08/23/2020, 17:26:00",433,6,9920,390.85904357416075,0.96,0.043649193548387095
393,wallstreetbets,"I present to you: the headquarters of Robinhood Financial, LLC.",1579961586.0,"01/25/2020, 14:13:06",621,3,9909,566.30256022297,0.95,0.06267029972752043
394,wallstreetbets,My Econ professor said option trading is “one of the worst investments a college student could make.”,1582962629.0,"02/29/2020, 07:50:29",757,2,9861,274.6997818313557,0.97,0.07676706216408072
395,wallstreetbets,$1M in gold gains,1595858427.0,"07/27/2020, 14:00:27",577,1,9848,676.0072777367841,0.94,0.058590576766856216
396,wallstreetbets,Low effort,1586223980.0,"04/07/2020, 01:46:20",201,3,9831,163.10303010940697,0.98,0.020445529447665547
397,wallstreetbets,The comedy how I lost all my money in two hours,1595900215.0,"07/28/2020, 01:36:55",660,22,9760,669.255501693895,0.94,0.06762295081967214
398,wallstreetbets,Depiction of Robinhood Users this Morning,1583767727.0,"03/09/2020, 15:28:47",474,9,9738,49.60827160671579,0.99,0.04867529266789895
399,wallstreetbets,When an WSB Autist visits R/Investing...,1582049640.0,"02/18/2020, 18:14:00",420,14,9715,424.0756940975152,0.96,0.04323211528564076
400,wallstreetbets,New official Tesla brand short shorts available on Tesla website - get a fresh pair for only $69.420,1593991270.0,"07/05/2020, 23:21:10",545,2,9700,749.0342686915665,0.93,0.05618556701030928
401,wallstreetbets,"Person of the Year, Jerome Powell.",1603728079.0,"10/26/2020, 16:01:19",193,24,9697,511.6218561589849,0.95,0.01990306280292874
402,wallstreetbets,The sub now that Italy has the flu,1582514942.0,"02/24/2020, 03:29:02",412,2,9662,76.09170449445992,0.99,0.04264127509832333
403,wallstreetbets,"It's either because we've been hardened, or already broke",1599762998.0,"09/10/2020, 18:36:38",276,26,9644,194.3998558618332,0.98,0.02861883036084612
404,wallstreetbets,Every gay bear right now.,1601054710.0,"09/25/2020, 17:25:10",284,52,9637,373.4865966782654,0.96,0.029469751997509598
405,wallstreetbets,The mentality of this subreddit summarised in 4 seconds,1598957420.0,"09/01/2020, 10:50:20",133,9,9633,139.60410299738578,0.99,0.013806706114398421
406,wallstreetbets,Wall Street Peppa,1601842300.0,"10/04/2020, 20:11:40",190,41,9609,840.8523952263404,0.92,0.019773129357893642
407,wallstreetbets,Literally No One Cares You Lost Money on Tesla,1600916454.0,"09/24/2020, 03:00:54",390,22,9607,504.5097109586204,0.95,0.04059539918809202
408,wallstreetbets,This place lately...,1583357995.0,"03/04/2020, 21:39:55",358,3,9565,119.12906668541837,0.99,0.03742812336644015
409,wallstreetbets,Investing for the long term,1584796049.0,"03/21/2020, 13:07:29",467,4,9561,219.43234257643053,0.98,0.04884426315238992
410,wallstreetbets,$100k on $AMZN Puts,1573760843.0,"11/14/2019, 19:47:23",1662,4,9545,693.1647495854086,0.93,0.17412257726558408
411,wallstreetbets,R. Cally,1584734868.0,"03/20/2020, 20:07:48",244,16,9544,214.76300141923457,0.98,0.02556580050293378
412,wallstreetbets,Papa Elon respecting the hustle on twitter - 9/25 600C,1600897971.0,"09/23/2020, 21:52:51",188,26,9538,315.98383347209347,0.97,0.019710631159572237
413,wallstreetbets,WSB Iceberg,1575059898.0,"11/29/2019, 20:38:18",126,0,9535,207.05413860159206,0.98,0.013214472994231778
414,wallstreetbets,New WSB mascot?,1576195457.0,"12/13/2019, 00:04:17",139,1,9475,327.0871363519018,0.97,0.01467018469656992
415,wallstreetbets,Bears 70 years into the permabull infinite money economy,1585617584.0,"03/31/2020, 01:19:44",380,3,9358,147.1009145551834,0.98,0.04060696730070528
416,wallstreetbets,Pretty much sums up the traders in 2020.,1596365752.0,"08/02/2020, 10:55:52",467,0,9342,535.8330367575891,0.95,0.04998929565403554
417,wallstreetbets,Public Company Shopping,1600356752.0,"09/17/2020, 15:32:32",300,126,9304,181.2013633627812,0.98,0.03224419604471195
418,wallstreetbets,Huge Reversal Off Bottom 2004-2020 Trendline,1603997807.0,"10/29/2020, 18:56:47",220,10,9344,222.15711445698798,0.98,0.023544520547945206
419,wallstreetbets,"All debts must be paid, March 21 2020",1584834634.0,"03/21/2020, 23:50:34",519,18,9280,124.85494357167227,0.99,0.05592672413793103
420,wallstreetbets,All of WSB this week.,1597370071.0,"08/14/2020, 01:54:31",275,5,9261,303.53486636284833,0.97,0.029694417449519492
421,wallstreetbets,Stonks only go up! And protect against coronavirus!,1594744933.0,"07/14/2020, 16:42:13",140,2,9265,240.92696522145707,0.97,0.015110631408526714
422,wallstreetbets,Step by step autist guide to Robinhood fiasco,1575286172.0,"12/02/2019, 11:29:32",379,4,9257,414.17545227565097,0.96,0.04094198984552231
423,wallstreetbets,PRPL Rain,1596507694.0,"08/04/2020, 02:21:34",577,8,9232,479.4170590789945,0.95,0.0625
424,wallstreetbets,Does Robinhood Price Match?,1585945946.0,"04/03/2020, 20:32:26",229,3,9215,323.25420943399877,0.97,0.024850786760716222
425,wallstreetbets,Welcome to the Fund,1604160271.0,"10/31/2020, 16:04:31",214,11,9269,145.10455354946498,0.98,0.02308771172726292
426,wallstreetbets,"$AMZN $3800 Call, cant go tits up!",1595369767.0,"07/21/2020, 22:16:07",501,1,9185,225.86531241090415,0.98,0.05454545454545454
427,wallstreetbets,4D Chess: How to save the economy and win the WSB vote in one move,1583940409.0,"03/11/2020, 15:26:49",279,0,9170,405.769506788145,0.96,0.030425299890948745
428,wallstreetbets,S&amp;P 500 trading halts for 15 minutes after 7% drop at open,1583760997.0,"03/09/2020, 13:36:37",1069,0,9113,46.535848349698426,0.99,0.1173049489739932
429,wallstreetbets,BREAKING NIKOLA NEWS,1599831013.0,"09/11/2020, 13:30:13",405,40,9085,390.676382559408,0.96,0.0445789763346175
430,wallstreetbets,"No Lambo yet, had to tell the neighbors another way...",1603063810.0,"10/18/2020, 23:30:10",230,36,9060,938.7588966116691,0.91,0.025386313465783666
431,wallstreetbets,Trade Cycle Update: 2020,1603237756.0,"10/20/2020, 23:49:16",258,28,9038,242.50137405410896,0.97,0.028546138526222616
432,wallstreetbets,We're gonna need ALL your energy for this one boys,1584978004.0,"03/23/2020, 15:40:04",250,15,9022,93.05195324943816,0.99,0.027710042119264023
433,wallstreetbets,"WSBgod returning to reveal to his disciples that he doubled, not lost his portfolio",1581017530.0,"02/06/2020, 19:32:10",210,1,9019,290.40006104496933,0.97,0.023284177846767933
434,wallstreetbets,Fat balance sheets,1580580822.0,"02/01/2020, 18:13:42",294,3,8983,696.4162746369602,0.93,0.03272848714238005
435,wallstreetbets,Me for the past 45 minutes when WSB went private,1584316767.0,"03/15/2020, 23:59:27",213,2,8983,216.43259417631634,0.98,0.023711454970499833
436,wallstreetbets,We live in a society,1573038933.0,"11/06/2019, 11:15:33",240,3,8951,197.89549994298977,0.98,0.026812646631661267
437,wallstreetbets,We do not merely destroy our enemies; we change them.,1588963979.0,"05/08/2020, 18:52:59",245,3,8918,286.74840025350386,0.97,0.027472527472527472
438,wallstreetbets,The Infinite Leveragiers: Battle of the Autists,1573139930.0,"11/07/2019, 15:18:50",228,6,8906,384.5146564023271,0.96,0.025600718616662924
439,wallstreetbets,INFLUWARS,1580735145.0,"02/03/2020, 13:05:45",196,11,8897,449.844110109505,0.95,0.022029897718332022
440,wallstreetbets,Fiending for them tendies,1603376597.0,"10/22/2020, 14:23:17",304,21,8895,422.03289135785235,0.95,0.034176503653738054
441,wallstreetbets,The current gangs of r/wsb,1596735436.0,"08/06/2020, 17:37:16",508,8,8887,228.94619379943288,0.97,0.0571621469562282
442,wallstreetbets,Too late for TSLA? Don't forget the first company that got Elon his hair back.,1597779657.0,"08/18/2020, 19:40:57",401,6,8880,413.99629379007274,0.96,0.045157657657657654
443,wallstreetbets,I will get rich or die trying,1582664585.0,"02/25/2020, 21:03:05",962,5,8865,69.46985509202932,0.99,0.10851663846587704
444,wallstreetbets,"Dudes, if you aren't yoloing now, what the fuck are you doing?",1588182799.0,"04/29/2020, 17:53:19",270,7,8852,442.61507847282155,0.95,0.030501581563488478
445,wallstreetbets,Just look for someone in the know,1581957058.0,"02/17/2020, 16:30:58",182,6,8847,393.3740387533908,0.96,0.020571945292189444
446,wallstreetbets,The fed repos are an attempt to prop up the global banking industry,1583457758.0,"03/06/2020, 01:22:38",1853,60,8816,219.27869778055538,0.98,0.21018602540834846
447,wallstreetbets,Me after my calls expire worthless,1581904115.0,"02/17/2020, 01:48:35",128,1,8797,417.56822634623677,0.95,0.014550414914175287
448,wallstreetbets,“Special Guest” on CNBC Starter Pack,1586373722.0,"04/08/2020, 19:22:02",248,4,8781,193.76224990066112,0.98,0.028242796947955815
449,wallstreetbets,"Best day since 1933, eh?",1585202321.0,"03/26/2020, 05:58:41",210,3,8748,236.16167087742906,0.97,0.02400548696844993
450,wallstreetbets,Made 40k from 800 in 2 months. Pretty good for an 18 y/o,1583814028.0,"03/10/2020, 04:20:28",1122,4,8745,472.63732135142163,0.95,0.12830188679245283
451,wallstreetbets,4 Years ago I told you virgins to buy AMD at 2.30. This week they hit a 19 year high.,1573392384.0,"11/10/2019, 13:26:24",510,0,8744,402.4722506258695,0.96,0.05832570905763952
452,wallstreetbets,So this is r/wallstreetbets,1582162367.0,"02/20/2020, 01:32:47",273,10,8707,228.0709303257372,0.97,0.03135408292178707
453,wallstreetbets,I hate every single one of you,1581433235.0,"02/11/2020, 15:00:35",888,1,8693,543.1431439219959,0.94,0.1021511561026113
454,wallstreetbets,Whistleblower claims Mormon church has amassed 100 BILLION dollar tax free fund,1576596892.0,"12/17/2019, 15:34:52",550,3,8658,407.86874413050464,0.96,0.06352506352506353
455,wallstreetbets,I need my Courage in a cup today,1583779037.0,"03/09/2020, 18:37:17",194,1,8650,144.94221493767145,0.98,0.022427745664739884
456,wallstreetbets,Just an 83k loss in less than a year keep scrolling.,1603931366.0,"10/29/2020, 00:29:26",493,50,8659,58.59720022437796,0.99,0.056934980944681836
457,wallstreetbets,Stonkbob Tells it Like It Is,1586859470.0,"04/14/2020, 10:17:50",178,0,8621,408.71770238325007,0.95,0.020647256698758845
458,wallstreetbets,How the hell do you lunatics do this options shit everyday?!,1597074091.0,"08/10/2020, 15:41:31",1049,19,8615,213.25198655987333,0.98,0.12176436448055716
459,wallstreetbets,"""One of us One of us""",1603145919.0,"10/19/2020, 22:18:39",410,22,8604,417.51157373940987,0.95,0.04765225476522548
460,wallstreetbets,If he bought this truck with anything other than ford puts I'll be disappointed,1595185258.0,"07/19/2020, 19:00:58",235,0,8593,185.95256273773884,0.98,0.027347841266146863
461,wallstreetbets,StonksOnlyGoUp,1591673443.0,"06/09/2020, 03:30:43",438,0,8567,218.8928654192896,0.98,0.0511264153145792
462,wallstreetbets,It really do be like that sometimes..,1592881452.0,"06/23/2020, 03:04:12",122,9,8553,290.3418163281567,0.97,0.014264000935344323
463,wallstreetbets,Robinhood,1575925680.0,"12/09/2019, 21:08:00",193,1,8542,232.28146454508533,0.97,0.022594240224771717
464,wallstreetbets,Do I have any chance - put my life savings on GME and want to kill myself,1602341210.0,"10/10/2020, 14:46:50",2496,64,8548,426.387837414939,0.95,0.29199812821712684
465,wallstreetbets,Everything is priced in.,1576500732.0,"12/16/2019, 12:52:12",437,6,8534,392.5071971976813,0.96,0.051206936958050155
466,wallstreetbets,how fucked are we boys,1604112141.0,"10/31/2020, 02:42:21",501,19,8601,105.41458323117513,0.99,0.05824904080920823
467,wallstreetbets,Time for another r/WSB orientation,1580163978.0,"01/27/2020, 22:26:18",347,15,8521,313.4333041439313,0.96,0.040722919845088607
468,wallstreetbets,Thanks lord for our daily tendies (Students loans about to be paid off!!!),1583774839.0,"03/09/2020, 17:27:19",1066,2,8507,156.20700703778675,0.98,0.12530856941342425
469,wallstreetbets,The market today,1601299056.0,"09/28/2020, 13:17:36",271,29,8498,366.2356683400885,0.96,0.03188985643680866
470,wallstreetbets,How Today Felt...,1582326897.0,"02/21/2020, 23:14:57",270,8,8498,97.74152361680535,0.99,0.031772181689809366
471,wallstreetbets,Autists Get a Margin Call,1585749814.0,"04/01/2020, 14:03:34",260,18,8485,174.93130503284556,0.98,0.030642309958750738
472,wallstreetbets,"I’m the 28.6k guy, I’m not roping, but I am done",1598464628.0,"08/26/2020, 17:57:08",1165,106,8435,486.75344945986944,0.95,0.13811499703615887
473,wallstreetbets,Video of new WSB Autists and their MSFT Calls Today,1581459767.0,"02/11/2020, 22:22:47",298,4,8424,258.3491283438543,0.97,0.035375118708452044
474,wallstreetbets,How to spot a market bubble,1581777250.0,"02/15/2020, 14:34:10",1041,2,8413,668.0489548321566,0.93,0.12373707357660763
475,wallstreetbets,Are girls attracted to a more volatile portfolio?,1599839334.0,"09/11/2020, 15:48:54",692,59,8385,505.14000240804853,0.94,0.0825283243887895
476,wallstreetbets,The dude even looks like Robinhood.,1587489782.0,"04/21/2020, 17:23:02",392,1,8368,174.40153863066917,0.98,0.04684512428298279
477,wallstreetbets,Find the bear 🐻,1582303354.0,"02/21/2020, 16:42:34",240,5,8369,206.17771735687893,0.98,0.028677261321543794
478,wallstreetbets,Yep. Just yep.,1574969460.0,"11/28/2019, 19:31:00",52,0,8361,456.99599521570417,0.95,0.006219351752182753
479,wallstreetbets,Wallstreetbets Bears the Last Two Days,1585159358.0,"03/25/2020, 18:02:38",276,8,8342,136.51704928108848,0.98,0.03308559098537521
480,wallstreetbets,I increased all of mine and my wife's boyfriend debt,1600098714.0,"09/14/2020, 15:51:54",225,51,8331,668.4315719261504,0.93,0.02700756211739287
481,wallstreetbets,TSLA mooned today because short selling was BANNED,1588646120.0,"05/05/2020, 02:35:20",476,9,8321,327.62982004362857,0.96,0.05720466290109362
482,wallstreetbets,Change the fucking logo.,1584895086.0,"03/22/2020, 16:38:06",259,3,8304,290.59465715198166,0.97,0.031189788053949903
483,wallstreetbets,Making Sense of Tesla's Bull Run (Margin Call 2011),1598025314.0,"08/21/2020, 15:55:14",298,14,8294,216.07814854428216,0.97,0.035929587653725586
484,wallstreetbets,400% Gain. Just in time for the Holidays. Merry Christmas everyone.,1576870509.0,"12/20/2019, 19:35:09",463,1,8285,414.7474085333324,0.95,0.055884127942063974
485,wallstreetbets,Retards will be retards,1594040816.0,"07/06/2020, 13:06:56",278,3,8270,496.67664697050895,0.94,0.03361547762998791
486,wallstreetbets,Pitbull warned y'all,1596053211.0,"07/29/2020, 20:06:51",265,1,8262,162.8982579261192,0.98,0.03207455821834907
487,wallstreetbets,WARNING! This type of market action leads to despair..or worse.,1599225840.0,"09/04/2020, 13:24:00",882,116,8235,296.27258323388924,0.97,0.10710382513661203
488,wallstreetbets,Amazon Prime sale was a flop,1602806325.0,"10/15/2020, 23:58:45",1472,21,8198,327.1055999643413,0.96,0.17955598926567456
489,wallstreetbets,"I don’t invent, i don’t have a portfolio. I know Jack shit about the market, but I do know one thing.....",1584653008.0,"03/19/2020, 21:23:28",280,3,8191,274.5790372514166,0.97,0.03418386033451349
490,wallstreetbets,Bulls on the wsb boat,1593432571.0,"06/29/2020, 12:09:31",217,6,8183,287.3405960811324,0.97,0.026518391787852865
491,wallstreetbets,Where did all the bulls and bears go?,1592024349.0,"06/13/2020, 04:59:09",218,1,8170,46.690586488472036,0.99,0.026682986536107713
492,wallstreetbets,Bears will have their vengeance,1588071554.0,"04/28/2020, 10:59:14",477,5,8166,280.4553210359718,0.97,0.05841293166789126
493,wallstreetbets,Bears since March,1591651538.0,"06/08/2020, 21:25:38",216,6,8162,160.0267879296025,0.98,0.02646410193580005
494,wallstreetbets,All it takes is a printer to save the day,1585627357.0,"03/31/2020, 04:02:37",347,2,8131,139.21522406987424,0.98,0.04267617759193211
495,wallstreetbets,"Even with +29% today, one small popcorn is more expensive than one share of AMC",1588172451.0,"04/29/2020, 15:00:51",362,2,8088,175.09168239046085,0.98,0.044757665677546986
496,wallstreetbets,Tesla bullish statement from CEO.,1578628028.0,"01/10/2020, 03:47:08",189,0,8085,344.7955205303879,0.96,0.023376623376623377
497,wallstreetbets,This sub needs to be quarantined from the rest of the world,1580654237.0,"02/02/2020, 14:37:17",368,6,8068,223.24482885231373,0.97,0.04561229548834903
498,wallstreetbets,Mike Bloomberg drops out of the 2020 presidential race,1583334973.0,"03/04/2020, 15:16:13",641,0,8059,48.67402126126672,0.99,0.07953840426851967
499,wallstreetbets,How most of the DD around here goes.,1600522157.0,"09/19/2020, 13:29:17",193,19,8051,239.58105559814976,0.97,0.0239721773692709
500,wallstreetbets,I trade AAPL for a living,1602685810.0,"10/14/2020, 14:30:10",1253,36,8034,710.1420957670289,0.92,0.15596216081652975
501,wallstreetbets,"no one has time to read how splits work, here's all you need to know:",1597182220.0,"08/11/2020, 21:43:40",315,29,8001,48.313145235342745,0.99,0.03937007874015748
