,Subreddit,Title,Epoch Time,Date,Comments,Awards,Upvotes,Downvotes,Upvote Ratio,Comment/Upvote Ratio
668,wallstreetbets,R/wsb once everyone’s million dollar margin plays fail.,1573052276.0,"11/06/2019, 14:57:56",202,2,5651,37.18082818331095,0.99,0.03574588568394974
669,wallstreetbets,Tim Apple’s blessings led my portfolio to a 100% gain YTD,1577211675.0,"12/24/2019, 18:21:15",366,0,5630,258.7207338421131,0.96,0.0650088809946714
670,wallstreetbets,"$82.2mil of AMD in one year. Average trade of 200k, wash, rinse and repeated daily.",1576637419.0,"12/18/2019, 02:50:19",800,0,5607,159.06776453007387,0.97,0.14267879436418762
671,wallstreetbets,Pour one out for u/SwineFluPandemic,1581861776.0,"02/16/2020, 14:02:56",385,2,5607,300.2916836027398,0.95,0.0686641697877653
672,wallstreetbets,I think all the awesome advise from this forum is the main reason for my success! Thank you!,1599582962.0,"09/08/2020, 16:36:02",308,19,5598,99.79430507108191,0.98,0.05501964987495534
673,wallstreetbets,That's the spirit,1591733852.0,"06/09/2020, 20:17:32",645,0,5598,97.27770299341682,0.98,0.1152197213290461
674,wallstreetbets,Tesla in full retarded elephant formation,1577385058.0,"12/26/2019, 18:30:58",161,2,5596,350.8683538674868,0.94,0.028770550393137955
675,wallstreetbets,Me discovering r/wallstreetbets,1588338605.0,"05/01/2020, 13:10:05",188,7,5589,127.36386560038045,0.98,0.033637502236536054
676,wallstreetbets,How this market downturn compares to 2008 market crash -updated.,1584094582.0,"03/13/2020, 10:16:22",750,0,5597,75.64401608707067,0.99,0.13400035733428622
677,wallstreetbets,"You all aren't bulls or bears, you're a sheep.",1585253376.0,"03/26/2020, 20:09:36",775,7,5581,506.28117868946174,0.92,0.13886400286686973
678,wallstreetbets,Bulls when they find out the printer has run out of ink,1585791910.0,"04/02/2020, 01:45:10",213,1,5581,92.57138494323772,0.98,0.03816520336857194
679,wallstreetbets,Go all in on TSLA they said 😂,1594829086.0,"07/15/2020, 16:04:46",673,4,5576,147.90754837925942,0.97,0.12069583931133429
680,wallstreetbets,BREAKING: GameStop installs Calculator on all retail store PCs,1602271552.0,"10/09/2020, 19:25:52",226,14,5572,175.87005572543785,0.97,0.04055994256999282
681,wallstreetbets,Is $SPY a good company?,1573466142.0,"11/11/2019, 09:55:42",315,1,5565,322.0700724531289,0.95,0.05660377358490566
682,wallstreetbets,Modern problems require modern so... Ah shit,1584321572.0,"03/16/2020, 01:19:32",85,1,5519,74.51782703923163,0.99,0.015401340822612792
683,wallstreetbets,"I was told to post this. I think i beat the game. I bought every reasonable call selling for .01 and bought them. Over 1000 contracts. The slightest upward movement makes me money, and they cant go lower than i already bought them for. It either goes up, or expires worthless.",1583295056.0,"03/04/2020, 04:10:56",1006,10,5518,139.48442656306452,0.98,0.1823124320405944
684,wallstreetbets,Recession of 2020 (colorized),1580259130.0,"01/29/2020, 00:52:10",151,5,5495,142.8481808862307,0.97,0.027479526842584166
685,wallstreetbets,I know the market's headed for a downturn because in the past week I've had no less than four friends ask me how to buy stocks.,1586814112.0,"04/13/2020, 21:41:52",954,0,5494,287.45573904407775,0.95,0.17364397524572261
686,wallstreetbets,never watched it before :\,1595144496.0,"07/19/2020, 07:41:36",173,0,5483,492.87445236298663,0.92,0.03155207003465256
687,wallstreetbets,Let me point you in the right direction,1575257101.0,"12/02/2019, 03:25:01",89,0,5449,117.5560338653404,0.98,0.016333272160029364
688,wallstreetbets,"18 y/o $800 to $115,000 in 2 months",1584397173.0,"03/16/2020, 22:19:33",945,1,5454,253.33336523576236,0.96,0.17326732673267325
689,wallstreetbets,"""Wow! A gun!""",1588535240.0,"05/03/2020, 19:47:20",187,7,5437,35.12527073522233,0.99,0.034393967261357364
690,wallstreetbets,All in REGN,1603102761.0,"10/19/2020, 10:19:21",280,18,5444,98.47429914796157,0.98,0.05143277002204261
691,wallstreetbets,I KNOW this isn't r/investing but fucking hell,1599820367.0,"09/11/2020, 10:32:47",542,33,5425,485.4331929531563,0.92,0.09990783410138249
692,wallstreetbets,$160k in $SPY puts. God speed former money.,1575491504.0,"12/04/2019, 20:31:44",993,4,5425,332.1644024682937,0.94,0.18304147465437787
693,wallstreetbets,Robinhood reportedly installed bulletproof glass after frustrated traders kept showing up at its office,1594353779.0,"07/10/2020, 04:02:59",437,0,5410,104.33609802490537,0.98,0.08077634011090573
694,wallstreetbets,Hang on gay bears! It's the same as in 2008.,1585128869.0,"03/25/2020, 09:34:29",411,17,5381,95.96204114523334,0.98,0.07637985504553058
695,wallstreetbets,I am probably infected with the beer virus,1584107911.0,"03/13/2020, 13:58:31",553,3,5379,118.15540772846089,0.98,0.10280721323666109
696,wallstreetbets,Made this WSB kid gif for everyone. Use it as you will.,1587500995.0,"04/21/2020, 20:29:55",154,10,5367,104.24014525436269,0.98,0.02869386994596609
697,wallstreetbets,Saw so many gain posts on Friday 7/10,1594477026.0,"07/11/2020, 14:17:06",217,2,5361,143.30375598343926,0.97,0.04047752285021451
698,wallstreetbets,"Daddy, Where Does Money Come From? Birds, Bees, Long Term Debt Instruments, and You",1585141205.0,"03/25/2020, 13:00:05",1697,28,5363,69.28674800809222,0.99,0.31642737273913857
699,wallstreetbets,WSB-Boy,1599758762.0,"09/10/2020, 17:26:02",159,44,5357,28.447088428233656,0.99,0.029680791487773008
700,wallstreetbets,"The stock market will go up this week, here's why:",1599401266.0,"09/06/2020, 14:07:46",414,32,5352,218.56822450632262,0.96,0.0773542600896861
701,wallstreetbets,2nd round of stimulus,1592239098.0,"06/15/2020, 16:38:18",254,3,5348,95.03813713372074,0.98,0.047494390426327596
702,wallstreetbets,"Papa Elon has spoken, stonks go up",1600717894.0,"09/21/2020, 19:51:34",278,16,5332,301.5614712900142,0.95,0.052138034508627154
703,wallstreetbets,"I've lost 240k on Luckin Coffee, all my life savings. Now I'm broke af.",1591128352.0,"06/02/2020, 20:05:52",1475,9,5330,129.09176120321263,0.98,0.2767354596622889
704,wallstreetbets,It's been a rough Q1 2020,1585683016.0,"03/31/2020, 19:30:16",137,1,5331,89.06708664536109,0.98,0.025698743200150066
705,wallstreetbets,Thanks gentlemen 👍,1574323094.0,"11/21/2019, 07:58:14",244,0,5328,180.02659683773163,0.97,0.0457957957957958
706,wallstreetbets,"It do be like that, though",1589984592.0,"05/20/2020, 14:23:12",146,1,5323,105.18317875760113,0.98,0.027428142025173775
707,wallstreetbets,The Simpsons predicting WSB in 1996,1594232227.0,"07/08/2020, 18:17:07",118,1,5305,42.88336575176163,0.99,0.022243166823751177
708,wallstreetbets,Microsoft bid rejected by Tiktok,1600039277.0,"09/13/2020, 23:21:17",772,12,5275,196.64123454865694,0.96,0.14635071090047394
709,wallstreetbets,APA and MLA citations not needed. Source: People,1575637339.0,"12/06/2019, 13:02:19",110,0,5250,100.54871370312503,0.98,0.02095238095238095
710,wallstreetbets,BREAKING: Futures hit limit down in the first 5 minutes of futures trading. Bloody Monday incoming. GG bulls,1584914972.0,"03/22/2020, 22:09:32",2452,0,5233,105.67203815088124,0.98,0.46856487674374164
711,wallstreetbets,Was the circuit breaker on Monday an engineered drop? How MM have been setting Wednesday 3/11/20 for the next leg down.,1583884431.0,"03/10/2020, 23:53:51",2327,35,5220,93.39661905506273,0.98,0.44578544061302683
712,wallstreetbets,He is one of us,1591100654.0,"06/02/2020, 12:24:14",136,0,5217,160.52010113355027,0.97,0.026068621813302665
713,wallstreetbets,This explains why Robin hood traders are bat shit crazy. YOLO for life 🤘🏻,1591663971.0,"06/09/2020, 00:52:51",252,0,5212,74.38798578718252,0.99,0.04834996162701458
714,wallstreetbets,Thanks Tom Arnold!,1576259485.0,"12/13/2019, 17:51:25",139,3,5188,146.86202032490382,0.97,0.026792598303777948
715,wallstreetbets,"All debts must be paid, March 15 2020",1584216863.0,"03/14/2020, 20:14:23",296,8,5175,40.63196603313554,0.99,0.05719806763285024
716,wallstreetbets,I failed my portfolio margin call. Final damage before TDA liquidated my account.,1584650225.0,"03/19/2020, 20:37:05",1073,18,5169,32.35075568432512,0.99,0.20758367189011415
717,wallstreetbets,My Insane Month of Calls ($500 to $22.4k),1582234100.0,"02/20/2020, 21:28:20",463,1,5167,78.61536264629285,0.99,0.08960712212115347
718,wallstreetbets,"Touched the bulls balls today, my calls are about to BRRRRRR",1591988711.0,"06/12/2020, 19:05:11",417,3,5133,136.0120811294446,0.97,0.08123904149620105
719,wallstreetbets,Two different types of traders,1599699385.0,"09/10/2020, 00:56:25",142,11,5134,71.58823583740468,0.99,0.02765874561745228
720,wallstreetbets,Why doesn't J Pow announce a split for the dollar?,1598624967.0,"08/28/2020, 14:29:27",263,15,5131,62.75035902894524,0.99,0.0512570648996297
721,wallstreetbets,Jan 15th is signing day.,1577801978.0,"12/31/2019, 14:19:38",544,0,5106,305.06201389333637,0.94,0.10654132393262829
722,wallstreetbets,Oh yeah.,1603657318.0,"10/25/2020, 20:21:58",61,9,5104,93.45509170472633,0.98,0.01195141065830721
723,wallstreetbets,We should pool money to have lawyers on retainer for the subreddit.,1573511785.0,"11/11/2019, 22:36:25",296,1,5100,140.1048542516046,0.97,0.05803921568627451
724,wallstreetbets,Thanks Robinhood,1590822613.0,"05/30/2020, 07:10:13",71,0,5089,30.13791326847968,0.99,0.013951660444095107
725,wallstreetbets,THE BIG SHORT,1583158998.0,"03/02/2020, 14:23:18",1025,5,5093,123.89748213236999,0.98,0.20125662674258787
726,wallstreetbets,Robinhood trader shorts Disney with entire life savings,1592902526.0,"06/23/2020, 08:55:26",138,3,5090,74.3747886797455,0.99,0.02711198428290766
727,wallstreetbets,Order 66: The Revenge of the Bears,1585514361.0,"03/29/2020, 20:39:21",11762,35,5037,84.36231627382767,0.98,2.335120111177288
728,wallstreetbets,"Secret message in 'Wake me up when September ends""",1601543150.0,"10/01/2020, 09:05:50",197,32,5032,205.3889547261915,0.96,0.039149443561208266
729,wallstreetbets,Inverse WSB would only work in a place where the market makes sense.,1586470848.0,"04/09/2020, 22:20:48",270,4,5025,36.17936563125386,0.99,0.05373134328358209
730,wallstreetbets,Everything is fine,1583458849.0,"03/06/2020, 01:40:49",470,0,5010,52.703427254704366,0.99,0.09381237524950099
731,wallstreetbets,Monday is predicted.,1591993837.0,"06/12/2020, 20:30:37",639,5,5008,78.8579600273124,0.98,0.1275958466453674
732,wallstreetbets,The absolutely biggest problem with these new users,1584931658.0,"03/23/2020, 02:47:38",585,5,4999,381.68019760207335,0.93,0.1170234046809362
733,wallstreetbets,"The Stock Market Crash of 2020 (Ft. Bill Gates, Prickly Microbes, and Financial Chaos)",1584592593.0,"03/19/2020, 04:36:33",337,29,4997,59.6466086063856,0.99,0.06744046427856715
734,wallstreetbets,Elon our Lord feeding the five thousand with tendies,1580794635.0,"02/04/2020, 05:37:15",171,4,4986,158.983235191703,0.97,0.03429602888086643
735,wallstreetbets,Now I'm really getting no sleep at night.,1584457177.0,"03/17/2020, 14:59:37",106,0,4979,213.53407957725176,0.96,0.021289415545290218
736,wallstreetbets,My uncle works at the Federal Reserve and I need some good banter to throw at him this Thanksgiving,1574778647.0,"11/26/2019, 14:30:47",896,1,4973,395.32278218757256,0.93,0.18017293384275085
737,wallstreetbets,Ran out of lube? No worries,1587418459.0,"04/20/2020, 21:34:19",26,2,4971,25.293963664568764,0.99,0.005230335948501308
738,wallstreetbets,Petition for a new sub motto,1582766748.0,"02/27/2020, 01:25:48",239,1,4952,122.60265172928212,0.98,0.048263327948303715
739,wallstreetbets,New high score. Thanks AMD!,1595599936.0,"07/24/2020, 14:12:16",539,5,4954,111.81244141453226,0.98,0.10880096891400888
740,wallstreetbets,Daddy Musk Appreciation Thread,1578509523.0,"01/08/2020, 18:52:03",332,0,4942,288.2988733955508,0.94,0.06717927964386888
741,wallstreetbets,I was told that I belong here 😊 1k to 270k to 8k.,1595718925.0,"07/25/2020, 23:15:25",695,3,4939,157.03274687129306,0.97,0.14071674428021866
742,wallstreetbets,Gg seems like my ceiling was at 140k tried twice and got rejected both times.,1575034441.0,"11/29/2019, 13:34:01",410,0,4941,245.76285086744338,0.95,0.08297915401740538
743,wallstreetbets,Early morning loss porn....I’ll be back soon!,1595329931.0,"07/21/2020, 11:12:11",308,3,4924,95.80049583110394,0.98,0.06255077173030058
744,wallstreetbets,A Quick Roadmap,1583119703.0,"03/02/2020, 03:28:23",300,2,4911,66.7932801444249,0.99,0.06108735491753207
745,wallstreetbets,Gravity Gear,1601492987.0,"09/30/2020, 19:09:47",110,17,4915,119.45396489197992,0.98,0.022380467955239063
746,wallstreetbets,LORD OF THE CALLS,1581705638.0,"02/14/2020, 18:40:38",249,11,4906,84.94668415942397,0.98,0.05075417855686914
747,wallstreetbets,"""Trevor Milton has resigned as Executive Chairman of Nikola Motors (NASDAQ: NKLA)”",1600659902.0,"09/21/2020, 03:45:02",1003,42,4898,127.96500687526805,0.97,0.20477746018783177
748,wallstreetbets,"Private sector jobs up 749,000 in September, vs 600,000 estimate, ADP says",1601468349.0,"09/30/2020, 12:19:09",478,13,4895,281.51514125925587,0.95,0.09765066394279877
749,wallstreetbets,The Big V,1587094874.0,"04/17/2020, 03:41:14",191,6,4892,96.0560788073326,0.98,0.03904333605887163
750,wallstreetbets,Silver linings,1584490154.0,"03/18/2020, 00:09:14",130,5,4887,95.20443007126596,0.98,0.026601186822181298
751,wallstreetbets,r/askreddit summed up my feed today,1602844001.0,"10/16/2020, 10:26:41",207,63,4891,166.0546274404278,0.97,0.04232263340830096
752,wallstreetbets,"My SQ ride is over, from 2.2k -----&gt; 94k in four months.",1598277778.0,"08/24/2020, 14:02:58",405,9,4886,96.65595924371337,0.98,0.08288988948014736
753,wallstreetbets,Rick and Stonky,1587059733.0,"04/16/2020, 17:55:33",120,9,4886,120.99144837465155,0.98,0.024559967253376995
754,wallstreetbets,Saudis on that Iran News and Oil Spike,1578055109.0,"01/03/2020, 12:38:29",192,0,4859,107.89859282831549,0.98,0.03951430335459971
755,wallstreetbets,"The name of the company, Eastman Kodak Co.",1596063225.0,"07/29/2020, 22:53:45",201,0,4829,42.55654895304997,0.99,0.04162352453924208
756,wallstreetbets,"bulls, who’s laughing now? 💎🙌😭",1587482543.0,"04/21/2020, 15:22:23",376,0,4819,87.98192646725511,0.98,0.07802448640796845
757,wallstreetbets,Bulls this week,1587531263.0,"04/22/2020, 04:54:23",248,1,4816,166.35252231675076,0.97,0.05149501661129568
758,wallstreetbets,6000% on AAL Calls,1591308762.0,"06/04/2020, 22:12:42",661,1,4805,225.87813261418887,0.96,0.13756503642039541
759,wallstreetbets,QE5 just started in Miami. The FED is making it rain.,1590627495.0,"05/28/2020, 00:58:15",396,0,4803,79.38133363763063,0.98,0.08244846970643348
760,wallstreetbets,DOW FUTURES DOWN 1000 POINTS FOR OPEN TOMORROW,1583705213.0,"03/08/2020, 22:06:53",1539,1,4790,76.4301028111031,0.98,0.32129436325678495
761,wallstreetbets,Buy Puts 🐸,1585195446.0,"03/26/2020, 04:04:06",178,6,4787,44.6676261582661,0.99,0.03718404010862753
762,wallstreetbets,The pain of buying options explained in just FOUR seconds,1576057327.0,"12/11/2019, 09:42:07",106,0,4773,27.618509452258877,0.99,0.022208254766394302
763,wallstreetbets,The prophecy was right!,1603896008.0,"10/28/2020, 14:40:08",226,11,4791,75.60818274044505,0.98,0.04717178042162388
764,wallstreetbets,“DADDY MUSK” u/WSBgod gets to pick the font.,1580823172.0,"02/04/2020, 13:32:52",281,2,4773,70.81534650249523,0.99,0.05887282631468678
765,wallstreetbets,All debts to be repaid.,1583531775.0,"03/06/2020, 21:56:15",328,3,4761,63.416862488376864,0.99,0.06889308968704054
766,wallstreetbets,Stonks only go up,1581084539.0,"02/07/2020, 14:08:59",161,5,4760,60.19722427688339,0.99,0.033823529411764704
767,wallstreetbets,"My, How Times Have Changed!",1589898092.0,"05/19/2020, 14:21:32",94,1,4752,89.73134061477049,0.98,0.01978114478114478
768,wallstreetbets,So the War Cycle begins,1578120238.0,"01/04/2020, 06:43:58",144,0,4740,112.85448327233098,0.98,0.030379746835443037
769,wallstreetbets,Every company is a tech company,1581822867.0,"02/16/2020, 03:14:27",198,2,4724,74.11536127493855,0.98,0.04191363251481795
770,wallstreetbets,You love to see it,1600578739.0,"09/20/2020, 05:12:19",289,11,4726,94.37511031386475,0.98,0.06115107913669065
771,wallstreetbets,Any Plays for Nvidia ??,1599080821.0,"09/02/2020, 21:07:01",211,7,4716,86.22671571332648,0.98,0.04474130619168787
772,wallstreetbets,"TSLA 7/17, A Short Story.",1595131728.0,"07/19/2020, 04:08:48",170,4,4697,77.09574384423831,0.98,0.036193314881839474
773,wallstreetbets,Live action shot of a Wallstreetbets user submitting Robinhood orders on margin,1573144490.0,"11/07/2019, 16:34:50",186,2,4702,93.42975390782249,0.98,0.03955763504891536
774,wallstreetbets,Low cost OC,1602609692.0,"10/13/2020, 17:21:32",288,9,4699,365.74936120365055,0.93,0.0612896360927857
775,wallstreetbets,South Park has known how the fed operates since 2009,1588496299.0,"05/03/2020, 08:58:19",130,1,4696,111.66142494991982,0.98,0.02768313458262351
776,wallstreetbets,Elon lost $768 MILLION after the Cybertruck announcement,1574521493.0,"11/23/2019, 15:04:53",684,0,4700,1276.2722962376365,0.79,0.14553191489361703
777,wallstreetbets,Tomorrow bull confirmed,1579748524.0,"01/23/2020, 03:02:04",82,0,4684,41.74405110292719,0.99,0.017506404782237403
778,wallstreetbets,business as usual,1585269891.0,"03/27/2020, 00:44:51",277,3,4667,39.08409903101892,0.99,0.059352903364045424
779,wallstreetbets,Whoever posted this chart in the daily discussion a few weeks ago freaking nailed it. Well done.,1584363550.0,"03/16/2020, 12:59:10",394,1,4672,124.00471370915784,0.97,0.08433219178082192
780,wallstreetbets,I guide others to a treasure I cannot possess.,1603901803.0,"10/28/2020, 16:16:43",214,6,4685,54.34385041190035,0.99,0.04567769477054429
781,wallstreetbets,But when Jpow does it... 😤,1596466312.0,"08/03/2020, 14:51:52",261,1,4660,52.53932833363615,0.99,0.05600858369098712
782,wallstreetbets,Mods please impose a minimum subscription period to post,1583075563.0,"03/01/2020, 15:12:43",369,2,4647,232.37050658556382,0.95,0.07940606843124597
783,wallstreetbets,AAL Gains ($11k to $95k) and my journey,1591438524.0,"06/06/2020, 10:15:24",603,4,4644,204.37904976037862,0.96,0.1298449612403101
784,wallstreetbets,WeWork the movie written by the writer of The Big Short. Get your memes ready retards,1575434725.0,"12/04/2019, 04:45:25",203,0,4637,117.83620509374032,0.98,0.04377830493853785
785,wallstreetbets,"Lost $25,000 because Chase YouInvest is pretty much fraud.",1586211182.0,"04/06/2020, 22:13:02",530,7,4645,182.12201407687007,0.96,0.11410118406889128
786,wallstreetbets,Hip to be a bear,1600085794.0,"09/14/2020, 12:16:34",161,39,4636,117.70098796597722,0.98,0.03472821397756687
787,wallstreetbets,A harbinger for the next weeks,1580902547.0,"02/05/2020, 11:35:47",331,0,4631,186.50290048617717,0.96,0.07147484344633988
788,wallstreetbets,Which one of you autists did this,1587645103.0,"04/23/2020, 12:31:43",490,0,4621,30.214065850203042,0.99,0.10603765418740532
789,wallstreetbets,"CONGRATULATIONS NKLA BAG HOLDERS, PAPA TREVOR GOT A NEW RANCH!!!",1596585028.0,"08/04/2020, 23:50:28",383,1,4611,118.22477827038892,0.98,0.08306224246367383
790,wallstreetbets,Ghanaian pallbearers have finally shown up to collect our fallen oil &amp; gas fellas out there:,1587394300.0,"04/20/2020, 14:51:40",249,5,4615,87.27540629491523,0.98,0.05395449620801734
791,wallstreetbets,Newest Corona Virus Strain Confirmed,1583102983.0,"03/01/2020, 22:49:43",96,0,4607,195.0810202939465,0.96,0.020837855437377904
792,wallstreetbets,r/investing talking to r/wallstreetbets,1596335426.0,"08/02/2020, 02:30:26",204,2,4593,40.36924158153124,0.99,0.04441541476159373
793,wallstreetbets,"Robinhood Statement on Options, Collateral, and Margin",1575248264.0,"12/02/2019, 00:57:44",813,18,4588,389.6747253899757,0.92,0.17720139494333043
794,wallstreetbets,Bears everytime unemployment numbers are released,1587646132.0,"04/23/2020, 12:48:52",242,0,4576,78.60987657821988,0.98,0.052884615384615384
795,wallstreetbets,Market sentiment in a nutshell,1590975879.0,"06/01/2020, 01:44:39",232,0,4565,28.43245183214458,0.99,0.05082146768893757
796,wallstreetbets,Last video footage of Ron Jeremy.,1593918589.0,"07/05/2020, 03:09:49",348,8,4568,286.73516293282955,0.94,0.07618213660245184
797,wallstreetbets,"Tesla's lead researcher, Jeff Dahn, releases paper on new anode-free battery that can go 420.69 miles",1597501232.0,"08/15/2020, 14:20:32",299,1,4571,181.755538806392,0.96,0.06541238241085101
798,wallstreetbets,It was just SoftBank all along.,1599316192.0,"09/05/2020, 14:29:52",336,16,4541,72.25727548634495,0.98,0.07399251266240917
799,wallstreetbets,And that was the funny thing...,1583891467.0,"03/11/2020, 01:51:07",120,5,4539,145.23752853428323,0.97,0.026437541308658295
800,wallstreetbets,As soon as the futures open up,1592816513.0,"06/22/2020, 09:01:53",137,0,4526,151.6649866515172,0.97,0.03026955368979231
801,wallstreetbets,I shall name my first son Shopify,1592489592.0,"06/18/2020, 14:13:12",790,3,4524,101.71081117838821,0.98,0.17462422634836428
802,wallstreetbets,BREAKING: Court grants Amazon Web Services request to temporarily halt work on $MSFT's JEDI Cloud contract.,1581621089.0,"02/13/2020, 19:11:29",897,0,4510,243.23482547157437,0.95,0.19889135254988913
803,wallstreetbets,🌈🐻,1592986753.0,"06/24/2020, 08:19:13",77,1,4511,155.02652400258376,0.97,0.01706938594546664
804,wallstreetbets,TIME Person of the Year 2019,1576105444.0,"12/11/2019, 23:04:04",256,3,4488,377.28108133407295,0.92,0.0570409982174688
805,wallstreetbets,Bears checking their accounts after a month,1589471256.0,"05/14/2020, 15:47:36",166,7,4484,81.6506322995765,0.98,0.037020517395182875
806,wallstreetbets,Just a Friendly Reminder from Mike Pence,1585243007.0,"03/26/2020, 17:16:47",220,0,4464,112.79929238034129,0.98,0.0492831541218638
807,wallstreetbets,"$28.6k yolo, and perhaps a farewell for this bear",1598392546.0,"08/25/2020, 21:55:46",1284,83,4463,198.85040319317523,0.96,0.287698857270894
808,wallstreetbets,I may be *slightly* over leveraged for a red Monday.,1593283983.0,"06/27/2020, 18:53:03",215,0,4463,46.45412074012347,0.99,0.048173874075733814
809,wallstreetbets,The astronauts are bulls,1584015928.0,"03/12/2020, 12:25:28",150,2,4428,47.22412085887845,0.99,0.03387533875338753
810,wallstreetbets,"As always, be careful who you take “advice” from",1600446671.0,"09/18/2020, 16:31:11",31,31,4416,78.58188958455594,0.98,0.007019927536231884
811,wallstreetbets,There is no fairytale ending to this story...,1587572347.0,"04/22/2020, 16:19:07",274,0,4420,81.69895105296018,0.98,0.061990950226244346
812,wallstreetbets,"The Virgin Market Maker 🤓 vs. The Chad ""The Kid"" 🌈🐻",1584479688.0,"03/17/2020, 21:14:48",174,3,4410,74.62297170240981,0.98,0.03945578231292517
813,wallstreetbets,The Covid-19 cheatsheet,1582552338.0,"02/24/2020, 13:52:18",323,1,4396,77.7748409331034,0.98,0.07347588717015469
814,wallstreetbets,I know we all made fat bank on puts this past week. Let's get this community known for something other than our autism.,1583527591.0,"03/06/2020, 20:46:31",192,5,4401,136.1754149635708,0.97,0.043626448534423996
815,wallstreetbets,oil squad,1587420511.0,"04/20/2020, 22:08:31",161,1,4396,33.37961812611684,0.99,0.03662420382165605
816,wallstreetbets,JPOW's printer goes BRRR,1586688999.0,"04/12/2020, 10:56:39",209,7,4395,130.40579252463067,0.97,0.047554038680318544
817,wallstreetbets,Imagine Kodak,1596043463.0,"07/29/2020, 17:24:23",396,1,4391,24.717163496594367,0.99,0.09018446823047142
818,wallstreetbets,"""Can we all just get along?"" - Rodney King",1582917658.0,"02/28/2020, 19:20:58",123,2,4390,26.05764600589555,0.99,0.028018223234624145
819,wallstreetbets,"BOEING once, BOEING twice.. SOLD",1578546166.0,"01/09/2020, 05:02:46",163,0,4389,80.77451841840684,0.98,0.03713830029619503
820,wallstreetbets,In Regards to WSB's Takeover of Detroit (Free Money Inside),1579371604.0,"01/18/2020, 18:20:04",346,2,4368,155.46930968184097,0.97,0.07921245421245421
821,wallstreetbets,"It’s Not Time To Trade FDs, Just Relax, Take It Easy",1587730569.0,"04/24/2020, 12:16:09",234,12,4370,104.54877598853727,0.98,0.05354691075514874
822,wallstreetbets,Re-opening the economy!,1590346934.0,"05/24/2020, 19:02:14",157,6,4363,152.30163662643463,0.97,0.035984414393765755
823,wallstreetbets,Let’s go boys,1598015563.0,"08/21/2020, 13:12:43",295,2,4356,157.8138743950558,0.97,0.067722681359045
824,wallstreetbets,Anyone holding HTZ?,1603075631.0,"10/19/2020, 02:47:11",208,7,4356,89.84352598335408,0.98,0.047750229568411386
825,wallstreetbets,Hereby I declare the covid recession as officially over,1591642923.0,"06/08/2020, 19:02:03",222,2,4346,94.44494523079447,0.98,0.051081454210768526
826,wallstreetbets,Airline companies flex after 3% gain,1600118843.0,"09/14/2020, 21:27:23",84,12,4345,31.522128203290777,0.99,0.019332566168009206
827,wallstreetbets,You sure you bought the right stock? Some investors with spelling challenges pumped up the wrong ticker... ;),1594954505.0,"07/17/2020, 02:55:05",237,3,4339,23.04900491722674,0.99,0.05462088038718599
828,wallstreetbets,Top Is In,1596914208.0,"08/08/2020, 19:16:48",412,8,4326,340.8353940386878,0.93,0.09523809523809523
829,wallstreetbets,Summary for the first week,1586265456.0,"04/07/2020, 13:17:36",94,1,4324,58.6283652029033,0.99,0.021739130434782608
830,wallstreetbets,My friend showed me his Robinhood account yesterday 😂,1573942921.0,"11/16/2019, 22:22:01",253,0,4319,81.11299922502076,0.98,0.0585783746237555
831,wallstreetbets,"Nightmare of ‘young, dumb investors’.",1602758692.0,"10/15/2020, 10:44:52",674,14,4319,192.33334468096837,0.96,0.15605464227830515
832,wallstreetbets,Feast your eyes on my losses: -$689k on SPX puts,1586879402.0,"04/14/2020, 15:50:02",802,16,4314,107.59267386884312,0.98,0.18590635141400091
833,wallstreetbets,I found out why I get morning wood,1579278847.0,"01/17/2020, 16:34:07",164,1,4308,177.4447312082566,0.96,0.03806870937790158
