,Subreddit,Title,Epoch Time,Date,Comments,Awards,Upvotes,Downvotes,Upvote Ratio,Comment/Upvote Ratio
676,worldpolitics,My tiddies might be a bit bigger than you thought,1596302440.0,"08/01/2020, 17:20:40",90,15,3479,118.2124666793643,0.97,0.025869502730669732
677,worldpolitics,Up if you’d fuck,1599097767.0,"09/03/2020, 01:49:27",73,5,3468,652.043750287804,0.84,0.02104959630911188
678,worldpolitics,Moms just wanna have fun,1594986624.0,"07/17/2020, 11:50:24",201,2,3455,529.0523613442406,0.87,0.058176555716353114
679,worldpolitics,"I love the smell of freshly baked cookies, don’t you?",1602443994.0,"10/11/2020, 19:19:54",169,7,3486,343.2896079646921,0.91,0.04847963281698221
680,worldpolitics,My little dinosaur,1602590557.0,"10/13/2020, 12:02:37",109,3,3469,224.61230100127614,0.94,0.03142115883539925
681,worldpolitics,I heard you guys prefer your loaves to be double-fluffed?,1603881287.0,"10/28/2020, 10:34:47",29,6,3464,95.22505530632225,0.97,0.008371824480369515
682,worldpolitics,"DIS IS OUR SUB-RED-IT, ZOG OFF!",1589650893.0,"05/16/2020, 17:41:33",44,3,3426,259.62580472543095,0.93,0.01284296555750146
683,worldpolitics,Thank you for your service.,1573945463.0,"11/16/2019, 23:04:23",473,0,3429,325.16873692366244,0.91,0.1379410906969962
684,worldpolitics,Here's a diamond block for every upvoter,1589327324.0,"05/12/2020, 23:48:44",6,0,3406,216.60138354108722,0.94,0.0017615971814445098
685,worldpolitics,"But hey, I ain’t complaining.",1597631360.0,"08/17/2020, 02:29:20",65,0,3403,102.85478710124971,0.97,0.01910079341757273
686,worldpolitics,I expect a calm and rational discourse,1594678947.0,"07/13/2020, 22:22:27",45,0,3398,36.367804644582066,0.99,0.013243084167157151
687,worldpolitics,Here's a happy Pepe in this trying time,1596456443.0,"08/03/2020, 12:07:23",170,1,3393,333.7481359944991,0.91,0.050103153551429414
688,worldpolitics,enough naked women. how many upvotes can a ELKAY LZS8L ADA Filtered 8 GPH Water Cooler (Refrigerated Drinking Fountain) get?,1589376911.0,"05/13/2020, 13:35:11",37,0,3375,95.9297946671827,0.97,0.010962962962962963
689,worldpolitics,Upvote my math homework,1589220616.0,"05/11/2020, 18:10:16",69,0,3379,304.1098864304463,0.92,0.020420242675347738
690,worldpolitics,"The more things change, ...",1587249349.0,"04/18/2020, 22:35:49",205,0,3369,130.31584832073486,0.96,0.060848916592460674
691,worldpolitics,"Do you call this a diplomatic solution? No, I call it aggressive negotiations.",1589783922.0,"05/18/2020, 06:38:42",60,0,3372,177.58764312012363,0.95,0.017793594306049824
692,worldpolitics,"Promises made, promises kept",1579397393.0,"01/19/2020, 01:29:53",382,0,3374,250.63582186698795,0.93,0.11321873147599289
693,worldpolitics,Boot hair looking mofo,1589708968.0,"05/17/2020, 09:49:28",17,0,3361,356.0520023592344,0.9,0.0050580184468908065
694,worldpolitics,Posting Big Chungus Images until I’m forgiven: Day 35: The Chungle Book,1601377549.0,"09/29/2020, 11:05:49",36,7,3360,206.04843053494324,0.94,0.010714285714285714
695,worldpolitics,4 if you count plant gang,1589780464.0,"05/18/2020, 05:41:04",44,0,3333,108.91118743600055,0.97,0.013201320132013201
696,worldpolitics,Why is that only girls with huge breast get upvotes?,1600859005.0,"09/23/2020, 11:03:25",115,4,3320,634.6227020508363,0.84,0.03463855421686747
697,worldpolitics,This sub right now,1588896179.0,"05/08/2020, 00:02:59",50,0,3318,209.84331349730746,0.94,0.015069318866787222
698,worldpolitics,[f]uck it. Enjoy my tits and my pussy,1588866597.0,"05/07/2020, 15:49:57",34,0,3300,272.1361311464075,0.92,0.010303030303030303
699,worldpolitics,Five intersecting tetrahedra,1598528361.0,"08/27/2020, 11:39:21",38,1,3290,56.59307160532035,0.98,0.011550151975683891
700,worldpolitics,Guys I made eggs,1589779202.0,"05/18/2020, 05:20:02",77,1,3289,129.97063246623748,0.96,0.023411371237458192
701,worldpolitics,If titties can get 7k+ upvotes how much love can Kronk get?,1589572650.0,"05/15/2020, 19:57:30",30,0,3291,375.6311133409981,0.9,0.009115770282588878
702,worldpolitics,best dating app idea ever,1596388198.0,"08/02/2020, 17:09:58",52,0,3292,141.28023230636882,0.96,0.015795868772782502
703,worldpolitics,When someone wants to actually discuss world politics in this sub,1589030213.0,"05/09/2020, 13:16:53",41,0,3282,116.84571493631529,0.97,0.012492382693479586
704,worldpolitics,Friendly advice to my fellow weirdos,1594696361.0,"07/14/2020, 03:12:41",30,0,3283,87.57989773116424,0.97,0.009137983551629607
705,worldpolitics,Meanwhile in the US...,1586295793.0,"04/07/2020, 21:43:13",186,0,3280,137.0016685440587,0.96,0.056707317073170734
706,worldpolitics,"I’m bored, you’re bored, here’s a nude bc why not 😎",1598377621.0,"08/25/2020, 17:47:01",167,4,3278,463.34862364802484,0.88,0.05094569859670531
707,worldpolitics,Thought y'all might like to see my new aquarium setup :),1601095719.0,"09/26/2020, 04:48:39",41,7,3253,60.78132062583336,0.98,0.012603750384260683
708,worldpolitics,I have a proposition,1589860382.0,"05/19/2020, 03:53:02",127,1,3249,173.31280031097458,0.95,0.03908895044629117
709,worldpolitics,Enjoy 😋,1600539347.0,"09/19/2020, 18:15:47",34,10,3237,199.4370488845675,0.94,0.01050355267222737
710,worldpolitics,I hope you like me and my tits [20 F] [OC],1599475574.0,"09/07/2020, 10:46:14",129,11,3241,456.8318418564718,0.88,0.03980253008330762
711,worldpolitics,The sub currently,1589693128.0,"05/17/2020, 05:25:28",25,0,3226,156.58318578775925,0.95,0.007749535027898326
712,worldpolitics,Upvote these titties,1588974026.0,"05/08/2020, 21:40:26",38,0,3223,182.985509591761,0.95,0.01179025752404592
713,worldpolitics,How many updoots can me and my OMEGA zucchini get on my cake day?,1594592685.0,"07/12/2020, 22:24:45",56,0,3212,310.1902845237323,0.91,0.017434620174346202
714,worldpolitics,I hope you like my plants [OC],1600607889.0,"09/20/2020, 13:18:09",142,10,3208,464.8686007676779,0.87,0.0442643391521197
715,worldpolitics,"Fuck it, this is a Cambrian era sub now. Upvote trilobites",1589066528.0,"05/09/2020, 23:22:08",34,0,3206,143.75824519481603,0.96,0.010605115408608859
716,worldpolitics,Me looking at what this sub has become,1588858432.0,"05/07/2020, 13:33:52",26,0,3198,93.4961301006706,0.97,0.008130081300813009
717,worldpolitics,The fallen shall be remembered as the emperors finest.,1589643074.0,"05/16/2020, 15:31:14",17,1,3192,217.5838308192515,0.94,0.005325814536340852
718,worldpolitics,Can we take a moment and thank fire fighters. Without them you wouldn't be seeing boobies,1597482670.0,"08/15/2020, 09:11:10",85,1,3185,1187.748745299622,0.73,0.026687598116169546
719,worldpolitics,WORLD PEACE ACHIEVED AHHAHAHAHAHAHAHA!!!!,1588952237.0,"05/08/2020, 15:37:17",32,0,3190,188.02494418080505,0.94,0.010031347962382446
720,worldpolitics,The truth hurts!,1588201370.0,"04/29/2020, 23:02:50",285,1,3186,166.5254328216547,0.95,0.08945386064030132
721,worldpolitics,uP vOtE tHiS sO iTs ThE fIrSt ThInG tHaT pOpS uP wHeN yOu SeArCh DoNaLd TrUmP,1589049964.0,"05/09/2020, 18:46:04",136,0,3174,368.8690603386208,0.9,0.0428481411468179
722,worldpolitics,Cheezse,1604154890.0,"10/31/2020, 14:34:50",47,0,3220,103.54490557210829,0.97,0.014596273291925466
723,worldpolitics,Bent over on the couch [20 F] [OC],1600083139.0,"09/14/2020, 11:32:19",130,9,3160,418.8565153257773,0.88,0.04113924050632911
724,worldpolitics,Oldie but a goodie,1589711468.0,"05/17/2020, 10:31:08",17,0,3139,303.46547103344847,0.91,0.00541573749601784
725,worldpolitics,upvote if you like the view ;),1589430260.0,"05/14/2020, 04:24:20",86,1,3142,414.2837948802421,0.88,0.02737110120942075
726,worldpolitics,Cotton Pence,1602122237.0,"10/08/2020, 01:57:17",129,1,3152,188.50611457756122,0.94,0.04092639593908629
727,worldpolitics,Pretty self explanatory,1589841916.0,"05/18/2020, 22:45:16",27,0,3132,91.22772836729882,0.97,0.008620689655172414
728,worldpolitics,Upvote if you like red heads sucking cock off trail [NSFW],1589001775.0,"05/09/2020, 05:22:55",88,0,3121,217.64157368403994,0.93,0.02819609099647549
729,worldpolitics,insert political statement,1589899753.0,"05/19/2020, 14:49:13",35,0,3118,95.3144195404293,0.97,0.011225144323284156
730,worldpolitics,"""...You ain't Black!""",1596819898.0,"08/07/2020, 17:04:58",229,0,3126,628.8263528002603,0.83,0.07325655790147152
731,worldpolitics,No mods so enjoy my blowjob video ;),1588886331.0,"05/07/2020, 21:18:51",53,0,3116,148.62424994433195,0.95,0.01700898587933248
732,worldpolitics,Do you like what’s under my hoodie ?,1600269367.0,"09/16/2020, 15:16:07",180,5,3108,342.352740294441,0.9,0.05791505791505792
733,worldpolitics,Its meme time,1589324261.0,"05/12/2020, 22:57:41",11,0,3095,91.00045914026214,0.97,0.003554119547657512
734,worldpolitics,"Titties can get thousands of upvotes, but what about fried ice cream?",1603281464.0,"10/21/2020, 11:57:44",72,3,3110,258.5464512110957,0.92,0.02315112540192926
735,worldpolitics,Sorry to tell you all this way,1590105071.0,"05/21/2020, 23:51:11",43,1,3090,82.80597387987518,0.97,0.013915857605177993
736,worldpolitics,Republicans are Traitors,1576244346.0,"12/13/2019, 13:39:06",573,0,3091,414.95360518867756,0.88,0.18537690067939178
737,worldpolitics,Plant gang: we have achieved flight!,1602069255.0,"10/07/2020, 11:14:15",86,3,3082,73.08046210421799,0.98,0.027903958468526932
738,worldpolitics,"Yay, physics!",1601857972.0,"10/05/2020, 00:32:52",35,2,3081,78.81407944551756,0.98,0.011359948068808828
739,worldpolitics,"Makes sense. More American citizens voting is a good thing, unless you're a Republican.",1587082814.0,"04/17/2020, 00:20:14",382,0,3058,488.5324886052131,0.86,0.1249182472204055
740,worldpolitics,The current battle for supremacy of this sub,1589624134.0,"05/16/2020, 10:15:34",40,0,3059,178.7256452379138,0.94,0.013076168682576005
741,worldpolitics,who's excited for thigh high season?,1602774272.0,"10/15/2020, 15:04:32",103,4,3092,239.17039553448285,0.93,0.0333117723156533
742,worldpolitics,French flag. Upvote this so it is the first result on Google for French Flaf.,1589040795.0,"05/09/2020, 16:13:15",49,0,3048,318.9305499996067,0.91,0.016076115485564306
743,worldpolitics,The only politics I follow is the god emperor’s word,1589673340.0,"05/16/2020, 23:55:40",18,0,3045,94.36008804634821,0.97,0.005911330049261084
744,worldpolitics,"Up arrows, now",1588806791.0,"05/06/2020, 23:13:11",74,1,3043,516.4514380013088,0.85,0.024318107131120606
745,worldpolitics,Hope you like my smooth pussy,1602509081.0,"10/12/2020, 13:24:41",65,3,3052,256.4171463847392,0.92,0.02129750982961992
746,worldpolitics,Ohh no I did it again 🤪,1600634763.0,"09/20/2020, 20:46:03",99,8,3033,451.2363010129043,0.87,0.032640949554896145
747,worldpolitics,Such a strong leader.,1587477262.0,"04/21/2020, 13:54:22",152,0,3030,124.85188354008505,0.96,0.050165016501650166
748,worldpolitics,Congratulations. You've killed it.,1590347595.0,"05/24/2020, 19:13:15",90,2,3012,133.94414431318592,0.96,0.029880478087649404
749,worldpolitics,First date,1603507203.0,"10/24/2020, 02:40:03",80,3,3030,186.78961657713626,0.94,0.026402640264026403
750,worldpolitics,Hail to the new overlords...who are they now?,1589746246.0,"05/17/2020, 20:10:46",45,0,2984,90.60137280970321,0.97,0.015080428954423592
751,worldpolitics,Trumpers have no sense of history and in times like these it is painfully obvious,1578446688.0,"01/08/2020, 01:24:48",285,0,2979,282.43160443323404,0.91,0.09566968781470292
752,worldpolitics,$36 million wasted.,1588247652.0,"04/30/2020, 11:54:12",207,0,2979,138.40468906665365,0.96,0.06948640483383686
753,worldpolitics,Oh here we go again..,1585003203.0,"03/23/2020, 22:40:03",320,1,2970,144.9246761104332,0.95,0.10774410774410774
754,worldpolitics,This is Trumpian economics,1582471054.0,"02/23/2020, 15:17:34",584,0,2952,284.6727799970122,0.91,0.1978319783197832
755,worldpolitics,"Instead of usual boob drops, i give you face drop..and you give LSA flair...ok???",1602631261.0,"10/13/2020, 23:21:01",108,13,2969,209.77566847592834,0.93,0.036375884136072754
756,worldpolitics,Gotta catch 'em all! (with your mouth this time),1601983806.0,"10/06/2020, 11:30:06",102,9,2960,271.7677280649864,0.92,0.03445945945945946
757,worldpolitics,Never knew his name was Norville,1598230699.0,"08/24/2020, 00:58:19",35,0,2944,48.710021206619786,0.98,0.01188858695652174
758,worldpolitics,Every sub right now,1589706632.0,"05/17/2020, 09:10:32",13,0,2941,275.72949902667597,0.91,0.004420265215912955
759,worldpolitics,This place shall fall into compliance!,1589682587.0,"05/17/2020, 02:29:47",17,1,2945,152.18207283605398,0.95,0.005772495755517827
760,worldpolitics,Fact,1601942899.0,"10/06/2020, 00:08:19",16,1,2960,58.06507663172715,0.98,0.005405405405405406
761,worldpolitics,"Yes, join us in the dark side",1597869791.0,"08/19/2020, 20:43:11",49,0,2934,104.80295493682843,0.97,0.016700749829584187
762,worldpolitics,Arguing about Socialism in the United States,1582474060.0,"02/23/2020, 16:07:40",490,0,2928,165.664503398963,0.95,0.16734972677595628
763,worldpolitics,Checkmate libruls,1587942569.0,"04/26/2020, 23:09:29",208,0,2921,132.97978737496896,0.96,0.07120849024306744
764,worldpolitics,Trump’s 29th Trip To Mar-a-Lago Brings Golf Tab To 334 Years Of Presidential Salary,1581773684.0,"02/15/2020, 13:34:44",535,1,2919,192.6891350566375,0.94,0.18328194587187394
765,worldpolitics,I heard there's a Party here?,1589785337.0,"05/18/2020, 07:02:17",45,1,2910,127.14553448511651,0.96,0.015463917525773196
766,worldpolitics,"Roses are red, so is the state, let us be comrades, because you are great",1590788776.0,"05/29/2020, 21:46:16",106,1,2910,271.93333356637504,0.91,0.036426116838487975
767,worldpolitics,We need a better economy,1577199698.0,"12/24/2019, 15:01:38",418,0,2901,117.01873315917874,0.96,0.14408824543260945
768,worldpolitics,.,1596917917.0,"08/08/2020, 20:18:37",38,1,2894,232.69128637679842,0.93,0.013130615065653075
769,worldpolitics,"Last one, I promise...strawberry butterfly",1601767214.0,"10/03/2020, 23:20:14",21,5,2895,68.33268914277733,0.98,0.007253886010362694
770,worldpolitics,The president isn't a very smart man.,1585137560.0,"03/25/2020, 11:59:20",403,0,2886,214.11490792353788,0.93,0.13963963963963963
771,worldpolitics,Would it be that bad of an idea?,1589051454.0,"05/09/2020, 19:10:54",69,0,2875,151.5395052188769,0.95,0.024
772,worldpolitics,r/WorldPolitics,1588915407.0,"05/08/2020, 05:23:27",41,0,2869,224.45548648657723,0.93,0.014290693621470896
773,worldpolitics,I'm beginning to get it.,1583328220.0,"03/04/2020, 13:23:40",219,1,2871,158.82611930963003,0.95,0.07628004179728318
774,worldpolitics,Left or right? Upvote to get a loaded 81 yo Garand in your DMs 😘,1601658853.0,"10/02/2020, 17:14:13",100,2,2850,206.3821270464141,0.93,0.03508771929824561
775,worldpolitics,Harley Quinn,1599964979.0,"09/13/2020, 02:42:59",50,3,2841,301.3617455159092,0.9,0.017599436818021823
776,worldpolitics,This sub is a mess,1588848683.0,"05/07/2020, 10:51:23",34,0,2811,140.15325492894954,0.95,0.012095339736748489
777,worldpolitics,I've made peace with my enemy,1594296923.0,"07/09/2020, 12:15:23",89,0,2794,276.89117808829315,0.91,0.03185397279885469
778,worldpolitics,I’m afraid to ask...,1603144675.0,"10/19/2020, 21:57:55",111,3,2801,90.90963919859678,0.97,0.039628704034273474
779,worldpolitics,So tired of all this political trash in my favorite porn sub,1588864114.0,"05/07/2020, 15:08:34",19,1,2778,211.44699082031684,0.93,0.006839452843772498
780,worldpolitics,Naked girls can get thousands of upvotes but what about some for our boys in blue!,1589269190.0,"05/12/2020, 07:39:50",39,0,2776,218.2308883434339,0.93,0.014048991354466859
781,worldpolitics,Wanna fuck me in the ass? 😁,1589220930.0,"05/11/2020, 18:15:30",109,3,2777,189.06510113381137,0.94,0.03925099027727764
782,worldpolitics,make me your medium titty goth gf 🖤,1589118664.0,"05/10/2020, 13:51:04",171,1,2767,236.5730155454662,0.92,0.061799783158655586
783,worldpolitics,"Checkmate, loyalists 😎",1590153828.0,"05/22/2020, 13:23:48",152,1,2762,115.3257767267819,0.96,0.05503258508327299
784,worldpolitics,"If you're tired of boobies, it's time to upvote some booty! 🤘",1588918192.0,"05/08/2020, 06:09:52",36,2,2758,212.88398699101617,0.93,0.01305293691080493
785,worldpolitics,God bless you NSFW tag,1589292560.0,"05/12/2020, 14:09:20",14,0,2748,57.83050623970075,0.98,0.005094614264919942
786,worldpolitics,Enough of the tits upvote Kaiser Wilhelm II,1589246515.0,"05/12/2020, 01:21:55",67,0,2753,196.5490175261698,0.93,0.024337086814384307
787,worldpolitics,Fuck thots,1603369958.0,"10/22/2020, 12:32:38",53,2,2757,146.25703402315685,0.95,0.01922379397896264
788,worldpolitics,#594c28,1594440387.0,"07/11/2020, 04:06:27",103,0,2729,182.757301368139,0.94,0.03774276291681935
789,worldpolitics,Picture featuring two guys who totally don’t know each other with a cameo from a guy who totally didn’t kill himself.,1575413874.0,"12/03/2019, 22:57:54",238,0,2721,90.5917872486325,0.97,0.0874678427048879
790,worldpolitics,Here are my nurse titties to make your day better 🥰,1593444093.0,"06/29/2020, 15:21:33",107,1,2710,340.79029378365567,0.89,0.03948339483394834
791,worldpolitics,We shall continue,1589821565.0,"05/18/2020, 17:06:05",29,0,2705,120.72765852998145,0.96,0.010720887245841035
792,worldpolitics,Let peace remain,1590350094.0,"05/24/2020, 19:54:54",29,0,2706,91.97310642717457,0.97,0.010716925351071693
793,worldpolitics,I promise tomorrow ill have plants [OC],1600514557.0,"09/19/2020, 11:22:37",97,11,2694,431.79456896796637,0.86,0.036005939123979216
794,worldpolitics,The Dreadnought just wants to be included,1590336934.0,"05/24/2020, 16:15:34",39,0,2693,121.24477427634883,0.96,0.014481990345339769
795,worldpolitics,Upvote if you like these tits/are over 5ft/have crippling depression,1597753381.0,"08/18/2020, 12:23:01",136,1,2686,493.39024001186226,0.84,0.05063291139240506
796,worldpolitics,Life pro tip.,1584798882.0,"03/21/2020, 13:54:42",103,0,2693,99.92306477942884,0.96,0.03824730783512811
797,worldpolitics,Why Plant Gang is a small but Mighty force.,1590054827.0,"05/21/2020, 09:53:47",68,0,2687,90.73431907240001,0.97,0.02530703386676591
798,worldpolitics,Jesus,1589317375.0,"05/12/2020, 21:02:55",128,1,2694,234.41790999716522,0.92,0.047512991833704527
799,worldpolitics,I just found diamonds in Minecraft!,1589600900.0,"05/16/2020, 03:48:20",64,0,2688,226.7220096036035,0.92,0.023809523809523808
800,worldpolitics,192 representatives voted against allowing Medicare to negotiate cheaper drug prices for seniors,1577753569.0,"12/31/2019, 00:52:49",355,0,2685,137.8385748775254,0.95,0.13221601489757914
801,worldpolitics,Now how true is this?,1580777849.0,"02/04/2020, 00:57:29",417,0,2687,293.3312842140399,0.9,0.15519166356531447
802,worldpolitics,what,1602404790.0,"10/11/2020, 08:26:30",28,7,2701,72.6502536162825,0.97,0.01036653091447612
803,worldpolitics,Former President of Estonia,1580513157.0,"01/31/2020, 23:25:57",229,2,2658,105.23837515223568,0.96,0.08615500376222723
804,worldpolitics,"Stay safe everyone, enjoy some cold ones",1595813395.0,"07/27/2020, 01:29:55",67,0,2655,115.59533240845349,0.96,0.025235404896421846
805,worldpolitics,Berserktards providing backup,1589840892.0,"05/18/2020, 22:28:12",52,0,2654,84.0137300532756,0.97,0.019593067068575734
806,worldpolitics,Completely exposed for you [f22],1589483132.0,"05/14/2020, 19:05:32",50,0,2650,106.01595201220243,0.96,0.018867924528301886
807,worldpolitics,The new King.,1588996320.0,"05/09/2020, 03:52:00",9,0,2646,122.04493883731175,0.96,0.003401360544217687
808,worldpolitics,FUNNY,1579001785.0,"01/14/2020, 11:36:25",187,0,2646,452.5677755634779,0.85,0.07067271352985639
809,worldpolitics,It wasn't the WHO that put us in the position we are today. It was our own president.,1587218123.0,"04/18/2020, 13:55:23",285,1,2638,251.32200262453853,0.91,0.10803639120545869
810,worldpolitics,Hits hard 😔,1597607604.0,"08/16/2020, 19:53:24",55,1,2627,63.169930570740235,0.98,0.020936429387133613
811,worldpolitics,Literally just black,1590099814.0,"05/21/2020, 22:23:34",73,0,2629,198.34595721262122,0.93,0.027767211867630277
812,worldpolitics,The Church of C.H.U.D.,1581778940.0,"02/15/2020, 15:02:20",327,0,2626,370.3844895635043,0.88,0.12452399086062452
813,worldpolitics,Happens everyday\((°.°))/,1590627999.0,"05/28/2020, 01:06:39",14,0,2623,85.93487234236727,0.97,0.00533739992375143
814,worldpolitics,他没有自杀 🤫,1588848217.0,"05/07/2020, 10:43:37",139,0,2613,218.56904029969655,0.92,0.05319556065824722
815,worldpolitics,Political Repression: Made in the USA!,1573010696.0,"11/06/2019, 03:24:56",238,1,2612,104.44406486587468,0.96,0.09111791730474732
816,worldpolitics,Capitalism has some glaring holes.,1584447890.0,"03/17/2020, 12:24:50",229,0,2613,178.48700158839483,0.94,0.0876387294297742
817,worldpolitics,Nobody expected it,1589779866.0,"05/18/2020, 05:31:06",21,0,2599,173.48552538605736,0.94,0.008080030781069641
818,worldpolitics,Magic blanket ✨,1603098531.0,"10/19/2020, 09:08:51",107,5,2624,248.0366734485333,0.91,0.040777439024390245
819,worldpolitics,I'm doing my part!,1589674534.0,"05/17/2020, 00:15:34",24,0,2605,117.0890591553034,0.96,0.009213051823416507
820,worldpolitics,"""I raised that boy""",1589587387.0,"05/16/2020, 00:03:07",21,0,2594,249.79317712866214,0.91,0.008095605242868157
821,worldpolitics,"Politics bad, porn and shitposting good",1603854778.0,"10/28/2020, 03:12:58",33,1,2620,110.39872706457072,0.96,0.012595419847328244
822,worldpolitics,"Geopolitical turmoil and mod drama aside, titties are here to uni[f]y",1588856767.0,"05/07/2020, 13:06:07",32,1,2588,249.3188198386497,0.91,0.012364760432766615
823,worldpolitics,i have the best policies. my policies are so huge. nobody can resist my policies.,1590319783.0,"05/24/2020, 11:29:43",124,0,2577,321.1648063047628,0.89,0.04811796662786186
824,worldpolitics,.,1589200745.0,"05/11/2020, 12:39:05",42,0,2570,98.16441276158685,0.96,0.01634241245136187
825,worldpolitics,Garlic Bread,1591451656.0,"06/06/2020, 13:54:16",44,0,2571,74.74410019693687,0.97,0.017113963438350838
826,worldpolitics,Unexpected,1589646636.0,"05/16/2020, 16:30:36",33,0,2553,118.37379661104433,0.96,0.012925969447708578
827,worldpolitics,Bernie has an interesting new policy to propose to the senate,1588813815.0,"05/07/2020, 01:10:15",26,0,2535,228.59966374296255,0.92,0.010256410256410256
828,worldpolitics,"Naked girls get thousands of likes, how much for one of our frontline Corona Virus heroes?",1589413018.0,"05/13/2020, 23:36:58",44,1,2525,397.2382512976551,0.86,0.017425742574257427
829,worldpolitics,"Testing the free karma possibilities, if I get more than 0 upvotes it's a succes",1588860844.0,"05/07/2020, 14:14:04",22,0,2507,147.6413313214307,0.94,0.008775428799361787
830,worldpolitics,"Just joined here today, hi everyone 😊",1602516777.0,"10/12/2020, 15:32:57",263,4,2556,286.8500115408974,0.9,0.10289514866979656
831,worldpolitics,I come from r/dogelore in peace!,1589813625.0,"05/18/2020, 14:53:45",44,0,2504,94.71030111858863,0.96,0.01757188498402556
832,worldpolitics,HAHAHA! I’ve got my account back! Finally guessed my password right~! ^•^! 🤍,1602686034.0,"10/14/2020, 14:33:54",55,2,2503,192.60966860374901,0.93,0.021973631642029565
833,worldpolitics,Hotter than most of these thots.,1601015278.0,"09/25/2020, 06:27:58",60,4,2491,90.15919952674813,0.97,0.02408671216378964
834,worldpolitics,cow,1599559032.0,"09/08/2020, 09:57:12",44,5,2491,50.09421051721574,0.98,0.017663588920112404
835,worldpolitics,Not Even Pepperidge Farms Remembers,1587251719.0,"04/18/2020, 23:15:19",106,0,2491,74.5593375798594,0.97,0.0425531914893617
836,worldpolitics,Socialism for the rich,1585221950.0,"03/26/2020, 11:25:50",159,0,2464,89.67112794252444,0.96,0.06452922077922078
837,worldpolitics,Upvote for my (ass)ets? 😏 [GIF],1588903461.0,"05/08/2020, 02:04:21",17,0,2461,184.15948996902353,0.93,0.00690776107273466
838,worldpolitics,My 2 cents,1591450416.0,"06/06/2020, 13:33:36",107,2,2461,286.29130087397925,0.9,0.043478260869565216
839,worldpolitics,Can I get upvotes for my brave dog?,1602977613.0,"10/17/2020, 23:33:33",41,10,2467,414.7069224699144,0.86,0.016619375760032428
840,worldpolitics,"Thots get thousands of likes. How much can Settra the Imperishable, the King of Kings, High King of Nehekhara, Lord of the Earth, Monarch of the Sky, Ruler of the Four Horizons, Mighty Lion of the Infinite Desert, Great Hawk of the Heavens, Majestic Emperor of the Shifting Sands can get?",1589642812.0,"05/16/2020, 15:26:52",46,3,2454,148.6665976312329,0.94,0.018744906275468622
841,worldpolitics,"Fuck it, 2 updoots and I buy the Pope Mouse",1589003768.0,"05/09/2020, 05:56:08",45,0,2461,90.11112616535684,0.96,0.01828524989841528
842,worldpolitics,"Oh hey there, I heard you like boobs. Here are my boobs. 💁🏻‍♀️🐰 (oc)",1588897435.0,"05/08/2020, 00:23:55",127,0,2455,151.32960542390765,0.94,0.05173116089613035
843,worldpolitics,Hold the line brothers!,1589779246.0,"05/18/2020, 05:20:46",14,0,2447,121.84546149472044,0.95,0.005721291377196567
844,worldpolitics,I’m not even a part of this subreddit. Fuck it. Upvote this big wheel,1588800710.0,"05/06/2020, 21:31:50",26,0,2445,167.68808718742412,0.94,0.01063394683026585
845,worldpolitics,The world will never know.,1587301146.0,"04/19/2020, 12:59:06",211,0,2446,127.01937227905773,0.95,0.08626328699918234
846,worldpolitics,"Despite the header, there's no actual Anime Tiddies on the front page. Allow me to remedy that.",1589034839.0,"05/09/2020, 14:33:59",44,0,2442,143.10056326568974,0.94,0.018018018018018018
847,worldpolitics,Quick before the tits come in,1589130476.0,"05/10/2020, 17:07:56",29,1,2437,106.88382203788024,0.96,0.011899876897825195
848,worldpolitics,I for one welcome the shitposts,1589693693.0,"05/17/2020, 05:34:53",17,0,2430,160.17342711057063,0.94,0.0069958847736625515
849,worldpolitics,we need more goth chics in fishnets in politics. The world would be a better place,1588868239.0,"05/07/2020, 16:17:19",25,0,2434,138.8519460921948,0.95,0.010271158586688579
