,Subreddit,Title,Epoch Time,Date,Comments,Awards,Upvotes,Downvotes,Upvote Ratio,Comment/Upvote Ratio
0,worldpolitics,Epstein!- Upvote this picture so that it’s the second thing people see when they google Epstein.,1588562978.0,"05/04/2020, 03:29:38",2353,14,108012,20253.019968639506,0.84,0.021784616524089917
1,worldpolitics,Epstein ! Upvote this picture so it’s the third picture you see when you google Donald Trump,1588586662.0,"05/04/2020, 10:04:22",1640,6,100555,22633.15349750484,0.82,0.01630948237283079
2,worldpolitics,Epstein ! Upvote this picture so it’s the third picture you see when you google Donald Trump,1588630538.0,"05/04/2020, 22:15:38",1630,9,96768,25576.14031620804,0.79,0.016844411375661377
3,worldpolitics,The White House deleted this official photo. Captain Fake Spray Tan in all of his orange glory.,1581163387.0,"02/08/2020, 12:03:07",4966,8,88001,16727.760888387522,0.84,0.05643117691844411
4,worldpolitics,Laura Ingraham. Upvote this image so it's the first photo you see when you google Laura Ingraham.,1588766027.0,"05/06/2020, 11:53:47",2887,4,87771,40128.57129808041,0.69,0.03289241321165305
5,worldpolitics,Upvote if you want to impeach:,1575925036.0,"12/09/2019, 20:57:16",3236,11,83190,39201.78737990916,0.68,0.03889890611852386
6,worldpolitics,Will Americans learn from this?,1584063692.0,"03/13/2020, 01:41:32",4429,5,77717,16158.096871361107,0.83,0.056988818405239526
7,worldpolitics,Tweet from the advisor of president of Iran,1578240390.0,"01/05/2020, 16:06:30",6020,5,76592,14697.043130697377,0.84,0.07859828702736578
8,worldpolitics,Upvote me and get a video in your DM 🍑😇,1589342231.0,"05/13/2020, 03:57:11",3350,27,72541,9737.681670720995,0.88,0.04618078052411739
9,worldpolitics,This is what class warfare looks like.,1584016563.0,"03/12/2020, 12:36:03",1968,5,68983,11943.46316021365,0.85,0.028528767957322818
10,worldpolitics,The Trump Economy,1583500176.0,"03/06/2020, 13:09:36",4527,1,67781,22388.626013369867,0.75,0.06678862808161579
11,worldpolitics,Donald Trump is a criminally negligent president.,1585309829.0,"03/27/2020, 11:50:29",6636,15,67533,24309.00756187708,0.74,0.09826307138732175
12,worldpolitics,Epstein! Upvote this picture so it's the fourth picture you see when you Google Donald Trump,1588676736.0,"05/05/2020, 11:05:36",1644,2,67389,27906.71313937365,0.71,0.024395672884298624
13,worldpolitics,Tax Billionaires. They can afford it.,1576585545.0,"12/17/2019, 12:25:45",4866,3,66060,16591.711190980437,0.8,0.07366030881017258
14,worldpolitics,Congratulations President Trump!,1582896331.0,"02/28/2020, 13:25:31",6986,5,61824,22797.525634091886,0.73,0.1129981884057971
15,worldpolitics,Well done Denmark. The rest of the world should take note.,1587336228.0,"04/19/2020, 22:43:48",1160,3,59918,3873.351341393638,0.94,0.019359791715344302
16,worldpolitics,Never Forget,1585894024.0,"04/03/2020, 06:07:04",4926,10,59604,18917.332468113396,0.76,0.08264546003623918
17,worldpolitics,Biggest piece of shit in the country.,1576510036.0,"12/16/2019, 15:27:16",4119,20,56481,25700.507312769594,0.69,0.07292717905136241
18,worldpolitics,Yup.,1587726835.0,"04/24/2020, 11:13:55",2648,8,54085,16572.396756743852,0.77,0.0489599704169363
19,worldpolitics,Idk guys this healthcare thing is so complex and radical,1578757910.0,"01/11/2020, 15:51:50",3161,2,52030,9285.444613234584,0.85,0.06075341149336921
20,worldpolitics,Fuck this guy,1585466882.0,"03/29/2020, 07:28:02",2055,0,51774,12182.53033001192,0.81,0.03969173716537258
21,worldpolitics,Trump supporters don't understand the concept of hypocrisy.,1584619610.0,"03/19/2020, 12:06:50",3613,9,51750,15572.478039248905,0.77,0.06981642512077295
22,worldpolitics,Boomer economics.,1583424904.0,"03/05/2020, 16:15:04",2127,6,50442,9466.397742108056,0.84,0.04216724158439396
23,worldpolitics,Never forget that Trump and his cult are responsible for making the USA the worst place on the planet when it comes to the deadly Covid-19 virus,1585515471.0,"03/29/2020, 20:57:51",5239,11,49830,19191.205322445618,0.72,0.10513746738912302
24,worldpolitics,"DON'T GET FOOLED AGAIN- The Republicans lied, tricked, and pushed American into an illegal invasion of Iraq, don't let them do it again with Iran",1578151369.0,"01/04/2020, 15:22:49",2963,10,49828,15901.228871539846,0.76,0.05946455807979449
25,worldpolitics,STILL the biggest piece of shit in the country.,1584366512.0,"03/16/2020, 13:48:32",2331,7,48117,18060.274999980888,0.73,0.04844441673421036
26,worldpolitics,Bernie: US billionaires are $282 billion richer as 22 million lost their jobs in less than a month,1587910252.0,"04/26/2020, 14:10:52",2914,11,47670,11325.176661622434,0.81,0.06112859240612545
27,worldpolitics,Bernie Sanders always has the receipts,1582339127.0,"02/22/2020, 02:38:47",3026,4,47000,10494.218974725714,0.82,0.06438297872340426
28,worldpolitics,Corona Irony.,1583800157.0,"03/10/2020, 00:29:17",1758,5,46992,11334.573855993425,0.81,0.03741062308478039
29,worldpolitics,Do you ?,1585614166.0,"03/31/2020, 00:22:46",809,1,45822,5877.6831560701685,0.89,0.01765527475884946
30,worldpolitics,America’s President Everybody,1586263578.0,"04/07/2020, 12:46:18",3612,2,44806,16706.59728261877,0.73,0.08061420345489444
31,worldpolitics,Being poor in America is expensive,1581961719.0,"02/17/2020, 17:48:39",1711,2,42846,6333.97320723009,0.87,0.039933716099519206
32,worldpolitics,Obama was all class and integrity.,1573318752.0,"11/09/2019, 16:59:12",2762,2,42669,9889.5432889695,0.81,0.06473083503245916
33,worldpolitics,It's immoral for a company that receives a bailout from the taxpayers to gift a bonus to its CEO. Capitalism is class warfare.,1586971265.0,"04/15/2020, 17:21:05",1370,3,42454,5677.27503533868,0.88,0.032270221887219105
34,worldpolitics,This is corruption out in the open.,1586434420.0,"04/09/2020, 12:13:40",2324,5,42153,9771.350316557764,0.81,0.05513249353545418
35,worldpolitics,Priorities,1584189958.0,"03/14/2020, 12:45:58",1386,2,41772,7563.4156081113615,0.85,0.0331801206549842
36,worldpolitics,America can do it,1586652407.0,"04/12/2020, 00:46:47",2710,1,41753,8022.457363761714,0.84,0.06490551577132182
37,worldpolitics,So True......,1580264037.0,"01/29/2020, 02:13:57",2972,1,40939,9384.51682562058,0.81,0.07259581328317741
38,worldpolitics,Capitalists thrive on misery.,1584447418.0,"03/17/2020, 12:16:58",2663,4,40747,10784.137043937655,0.79,0.06535450462610744
39,worldpolitics,He has a point,1587763803.0,"04/24/2020, 21:30:03",1133,2,40219,6664.455241457908,0.86,0.02817076506128944
40,worldpolitics,Greatest country in the world!,1583883729.0,"03/10/2020, 23:42:09",2106,0,39876,7738.926967397318,0.84,0.05281372253987361
41,worldpolitics,AOC proven right: Amazon expands into NYC without taking billions in public cash,1575765736.0,"12/08/2019, 00:42:16",3890,4,39838,12088.425667665048,0.77,0.09764546412972538
42,worldpolitics,Thanks Obama,1581449662.0,"02/11/2020, 19:34:22",2768,5,39670,9188.869385017235,0.81,0.06977564910511722
43,worldpolitics,VP Pence and other official White House staff engaging in prayer against coronavirus. These are adults in positions of power.,1583108517.0,"03/02/2020, 00:21:57",4267,1,39340,12734.56441948207,0.76,0.10846466700559228
44,worldpolitics,So do you think the economy would be better if the people were given $13k each or corporations?,1587641886.0,"04/23/2020, 11:38:06",3043,7,38985,8978.159708432067,0.81,0.07805566243426959
45,worldpolitics,PSA:,1578866242.0,"01/12/2020, 21:57:22",2466,1,38887,8879.264753550946,0.81,0.06341450870470851
46,worldpolitics,We in the USA owe the rest of the world a Bernie Sanders presidency,1577529659.0,"12/28/2019, 10:40:59",3777,5,38732,18641.730085773073,0.68,0.09751626562015904
47,worldpolitics,Trump eliminated the position that made sure America was prepared for a pandemic like the Coronavirus,1582572973.0,"02/24/2020, 19:36:13",2442,2,38657,7563.703899004002,0.84,0.06317096515508187
48,worldpolitics,sO DisREsPecFtUl,1580956798.0,"02/06/2020, 02:39:58",2609,2,38561,11004.256731198038,0.78,0.0676590337387516
49,worldpolitics,Less rich billionaires is one of the horrors of Socialism.,1583718084.0,"03/09/2020, 01:41:24",3191,2,38546,11014.864091863827,0.78,0.082784205883879
50,worldpolitics,Nazi lives don't matter,1574217622.0,"11/20/2019, 02:40:22",8776,6,38535,10378.8586462686,0.79,0.2277410146619956
51,worldpolitics,Sad but true,1588169193.0,"04/29/2020, 14:06:33",2149,5,37541,11049.90051622042,0.77,0.057244079806078686
52,worldpolitics,Trump supporters hate when you quote the president to them.,1586914041.0,"04/15/2020, 01:27:21",2076,2,37175,4539.829454415492,0.89,0.05584398117014122
53,worldpolitics,Completely sums it up,1580917938.0,"02/05/2020, 15:52:18",4890,11,36632,21244.050156017278,0.63,0.133489844944311
54,worldpolitics,"They will tell you they disagree with every type of ""bail out"", but for some reason they are only vocally opposed to student loan forgiveness. Its because their orange god uses farm subsidies to buy votes from the farmers in middle America, and thats a-okay to the Trumpsters.",1583063769.0,"03/01/2020, 11:56:09",3285,1,35942,8369.368452363102,0.81,0.09139725112681542
55,worldpolitics,Where is the conservative outrage?,1586610314.0,"04/11/2020, 13:05:14",2463,3,35449,10462.766340833012,0.77,0.06948009816920082
56,worldpolitics,Only in America...,1578929025.0,"01/13/2020, 15:23:45",2617,4,34760,13718.642440515265,0.72,0.07528768699654775
57,worldpolitics,Trump supporters be like...,1579872541.0,"01/24/2020, 13:29:01",4131,10,34753,16597.771311703626,0.68,0.11886743590481397
58,worldpolitics,Conservative Americans 10 tear challenge,1587555318.0,"04/22/2020, 11:35:18",2122,3,34693,8676.35563974877,0.8,0.061165076528406304
59,worldpolitics,Pretty weird.,1586523427.0,"04/10/2020, 12:57:07",1417,2,34650,4884.689566186535,0.88,0.04089466089466089
60,worldpolitics,Don't give money to millionaires. Its not hard,1585664321.0,"03/31/2020, 14:18:41",781,3,34267,4790.101417499485,0.88,0.022791607085534186
61,worldpolitics,They need everybody's help,1581286246.0,"02/09/2020, 22:10:46",1520,3,34227,5833.341888469637,0.85,0.044409384404125396
62,worldpolitics,The face of pure anti-American evil,1580561364.0,"02/01/2020, 12:49:24",2864,8,34175,11788.401541521562,0.74,0.08380395025603511
63,worldpolitics,This is unacceptable,1574599233.0,"11/24/2019, 12:40:33",4437,1,34002,5646.571713931975,0.86,0.1304923239809423
64,worldpolitics,"Obama was taller, also.",1574302705.0,"11/21/2019, 02:18:25",2986,3,33782,7677.9420010409085,0.81,0.08839026700609792
65,worldpolitics,"Isn't it ironic, don't you think?",1584706112.0,"03/20/2020, 12:08:32",709,3,33539,3458.151931873188,0.91,0.02113956886013298
66,worldpolitics,Don't you think it's a little weird that the United States has the most cases in this pandemic?,1587993934.0,"04/27/2020, 13:25:34",2221,2,33506,6040.388421612464,0.85,0.06628663522951113
67,worldpolitics,This is double banana. Upvote for 5 years of good luck. Ignore for 10 years of bad luck. Wouldn’t risk it,1604298935.0,"11/02/2020, 06:35:35",204,20,33560,12745.438353353107,0.72,0.006078665077473182
68,worldpolitics,"Trump supporters don't care about facts, if they did they wouldn't be Trump supporters.",1587038490.0,"04/16/2020, 12:01:30",3157,4,32869,12668.027256184134,0.72,0.09604794791444826
69,worldpolitics,The American “Dream”,1585832453.0,"04/02/2020, 13:00:53",1363,0,32832,5562.131934202975,0.86,0.04151437621832359
70,worldpolitics,"Increase taxes on the wealthy, they can afford to pay more.",1586828477.0,"04/14/2020, 01:41:17",1599,0,32265,5608.197701102428,0.85,0.04955834495583449
71,worldpolitics,Tax The Rich!!,1572981316.0,"11/05/2019, 19:15:16",2546,0,31802,7608.855107150397,0.81,0.08005785799635243
72,worldpolitics,Fathers are important,1577671082.0,"12/30/2019, 01:58:02",3451,9,31484,7455.088299539202,0.81,0.10961123110151189
73,worldpolitics,"Hundreds of kids in Texas are spending Christmas Eve taking care of each other. Freezing cold, insufficient food, water, medical attention, hygienic resources. No contact with their parents. Many as young as 1.",1577250089.0,"12/25/2019, 05:01:29",4322,16,31486,6891.945922792329,0.82,0.1372673569205361
74,worldpolitics,The condition trump supporters left the boardwalk after the trump rally.,1580355817.0,"01/30/2020, 03:43:37",3326,3,31400,8789.688888677163,0.78,0.10592356687898088
75,worldpolitics,Thanks Obama.,1581828185.0,"02/16/2020, 04:43:05",2644,9,30817,9621.125158667543,0.76,0.08579680046727456
76,worldpolitics,Sums it up....,1579229486.0,"01/17/2020, 02:51:26",1161,9,30742,4899.527866925622,0.86,0.03776592284171492
77,worldpolitics,Do you ?,1587426428.0,"04/20/2020, 23:47:08",639,0,30336,2610.6241569682024,0.92,0.021064082278481014
78,worldpolitics,This sub lately,1582683522.0,"02/26/2020, 02:18:42",1000,2,30259,2846.804808691799,0.91,0.03304801877127466
79,worldpolitics,Religious freaks have no place in governance,1586347379.0,"04/08/2020, 12:02:59",1586,1,29352,6349.328654936253,0.82,0.05403379667484328
80,worldpolitics,"Just admit it, you don't hate Socialism, you hate poor people.",1582291966.0,"02/21/2020, 13:32:46",2376,3,28946,11131.629840122849,0.72,0.08208388032888828
81,worldpolitics,Another day in paradise!,1576154845.0,"12/12/2019, 12:47:25",992,3,28894,2888.851785024697,0.91,0.03433238734685402
82,worldpolitics,Remind me again why Christians support this piece of trash?,1577370715.0,"12/26/2019, 14:31:55",4358,1,28417,11664.151753689126,0.71,0.15335890488088116
83,worldpolitics,Communism!!!!1!11!,1582236298.0,"02/20/2020, 22:04:58",2724,0,28237,7283.541348372652,0.79,0.09646917165421255
84,worldpolitics,Pretty much sums it up,1587214032.0,"04/18/2020, 12:47:12",1580,0,27999,7193.349827258848,0.8,0.056430586806671665
85,worldpolitics,Trump predicting trump!,1578050724.0,"01/03/2020, 11:25:24",1060,2,27691,3589.293486621442,0.89,0.038279585424867285
86,worldpolitics,Our system is too broken,1585561704.0,"03/30/2020, 09:48:24",946,0,27261,6616.443230997364,0.8,0.03470158834965702
87,worldpolitics,"Fuck it, 100 upvotes and this becomes a Don Cheadle themed subreddit.",1588983032.0,"05/09/2020, 00:10:32",393,2,27212,3876.284933098588,0.88,0.014442157871527268
88,worldpolitics,Important,1579492108.0,"01/20/2020, 03:48:28",1344,2,27085,5566.000547875352,0.83,0.04962156175004615
89,worldpolitics,The Stock Market is NOT the economy.,1588338197.0,"05/01/2020, 13:03:17",1325,3,26930,3626.465343104137,0.88,0.049201633865577424
90,worldpolitics,Hey remember how America goes around murdering people and then gets the super confuse when someone retaliates?,1578391630.0,"01/07/2020, 10:07:10",2423,5,26695,8159.648350411509,0.77,0.09076606106012362
91,worldpolitics,President Trump should resign.,1585790559.0,"04/02/2020, 01:22:39",1339,3,26374,4444.704428321551,0.86,0.05076969742928642
92,worldpolitics,Should the person with the most votes be the Democratic Party nominee?,1582178231.0,"02/20/2020, 05:57:11",2483,1,26324,5240.300478470574,0.83,0.09432457073393101
93,worldpolitics,And these people vote too!,1587293481.0,"04/19/2020, 10:51:21",1175,1,26282,4448.749095059793,0.86,0.044707404307130355
94,worldpolitics,Bernie is the only option,1583203928.0,"03/03/2020, 02:52:08",1862,3,26166,7537.922874579657,0.78,0.07116104868913857
95,worldpolitics,Fuck you gop,1580522382.0,"02/01/2020, 01:59:42",3572,8,26074,11093.6943550285,0.7,0.13699470737132777
96,worldpolitics,President Trump accomplished in his first term what it takes most Republican presidents two terms to accomplish.,1586174418.0,"04/06/2020, 12:00:18",1825,1,25806,7522.166812052208,0.77,0.070719987599783
97,worldpolitics,"Keep up, Deplorables.",1587383173.0,"04/20/2020, 11:46:13",1829,1,25755,3639.5146136081785,0.88,0.07101533682780042
98,worldpolitics,“Friendly reminder”,1579055576.0,"01/15/2020, 02:32:56",1584,3,24957,2723.5745607931676,0.9,0.06346916696718355
99,worldpolitics,Cracks may be forming in the walls surrounding the Trump Cult,1584103974.0,"03/13/2020, 12:52:54",1433,3,24722,6660.21296216418,0.79,0.05796456597362673
100,worldpolitics,"Since the rules apparently don’t matter anymore, upvote Xi Pooh",1588725716.0,"05/06/2020, 00:41:56",376,6,24704,2079.463149890951,0.92,0.01522020725388601
101,worldpolitics,This sums it up very well,1584662592.0,"03/20/2020, 00:03:12",3505,7,24280,9692.545637929856,0.71,0.14435749588138386
102,worldpolitics,Anyone who doesn't upvote this is a meanie,1590793563.0,"05/29/2020, 23:06:03",237,1,24174,4574.171653244495,0.84,0.00980392156862745
103,worldpolitics,"Democratic Socialism isn't ""free stuff"". It is getting services for your tax dollars.",1581088702.0,"02/07/2020, 15:18:22",1920,1,24119,5379.956540731164,0.82,0.07960529043492683
104,worldpolitics,Its not hard to understand,1576283570.0,"12/14/2019, 00:32:50",1571,2,24113,3746.0835477393157,0.87,0.06515157798697797
105,worldpolitics,Stuff like this is how you get crowds of people doing crazy shit.,1584533490.0,"03/18/2020, 12:11:30",911,1,23859,3628.8268994281134,0.87,0.03818265643991785
106,worldpolitics,So patriotic.,1581603965.0,"02/13/2020, 14:26:05",1141,0,23637,4618.708249874457,0.84,0.04827177729830351
107,worldpolitics,Everything is easier when you're rich.,1584277647.0,"03/15/2020, 13:07:27",1099,1,23498,2660.6559031015786,0.9,0.04676993786705252
108,worldpolitics,Upvote the shit out of my cute doggo and ill post my wife's tits.,1588892746.0,"05/07/2020, 23:05:46",761,3,23128,5332.275590258538,0.81,0.032903839501902454
109,worldpolitics,... then you are not a patriot,1577623227.0,"12/29/2019, 12:40:27",2347,3,23012,7207.064652554029,0.76,0.10199026594820094
110,worldpolitics,Factual,1583595803.0,"03/07/2020, 15:43:23",1852,0,22835,7633.460943136193,0.75,0.08110356908254872
111,worldpolitics,A Putin truth bomb,1575817328.0,"12/08/2019, 15:02:08",2533,3,22575,10413.41226793747,0.68,0.11220376522702104
112,worldpolitics,American economics explained.,1586699923.0,"04/12/2020, 13:58:43",1337,2,22048,6013.4362104628235,0.79,0.060640420899854865
113,worldpolitics,Unions have given us so much,1577044084.0,"12/22/2019, 19:48:04",1188,5,21411,4386.018117345513,0.83,0.05548549810844893
114,worldpolitics,Trump has committed crimes against humanity,1586021567.0,"04/04/2020, 17:32:47",2497,4,21199,7258.844645608402,0.74,0.11778857493277985
115,worldpolitics,Just. Like. That.,1588247728.0,"04/30/2020, 11:55:28",1073,0,20919,2753.545397700429,0.88,0.05129308284334815
116,worldpolitics,Oh no! The poor billionaires!,1582766154.0,"02/27/2020, 01:15:54",1467,0,20915,3313.7489899169595,0.86,0.07014104709538609
117,worldpolitics,Are you confused by what's going on in the Middle East? Read this to clear everything up.,1578642691.0,"01/10/2020, 07:51:31",717,8,20908,1806.5763735816909,0.92,0.0342930935527071
118,worldpolitics,"Calm down, it's not like they're kneeling during a song.",1587470609.0,"04/21/2020, 12:03:29",2399,8,20841,4457.759030835867,0.82,0.11510963965260784
119,worldpolitics,Fuck Modi,1576808544.0,"12/20/2019, 02:22:24",1029,7,20379,1489.1394344750297,0.93,0.050493154718092154
120,worldpolitics,Late-Stage Capitalism,1585225173.0,"03/26/2020, 12:19:33",1036,1,20260,3081.003757170136,0.87,0.05113524185587364
121,worldpolitics,This should keep every American up at night,1578073862.0,"01/03/2020, 17:51:02",1454,0,20248,2950.0535014092893,0.87,0.07180956143816673
122,worldpolitics,Congratulations President Trump!,1583843451.0,"03/10/2020, 12:30:51",1806,0,20240,6011.149942538359,0.77,0.0892292490118577
123,worldpolitics,Black vs. White,1587517038.0,"04/22/2020, 00:57:18",1734,2,20064,6098.473962000913,0.77,0.08642344497607655
124,worldpolitics,Republicans and hypocrisy: Can you name a more iconic duo?,1578578354.0,"01/09/2020, 13:59:14",1110,1,20035,2978.005977803863,0.87,0.05540304467182431
125,worldpolitics,"Damn, didn't realize it was legal for our public servants to commit murder in broad daylight",1574158883.0,"11/19/2019, 10:21:23",1118,0,19571,3312.466435926719,0.86,0.05712533851106229
126,worldpolitics,We have to be dangerous,1579610408.0,"01/21/2020, 12:40:08",1391,1,19510,3771.8296147228575,0.84,0.07129677088672476
127,worldpolitics,They worship him more than they used to worship Jesus.,1581778506.0,"02/15/2020, 14:55:06",2780,0,19223,8891.614707250297,0.68,0.144618425844041
128,worldpolitics,Some Republicans are willing to admit the truth about Trump,1588511404.0,"05/03/2020, 13:10:04",1907,2,19071,6135.1021713452865,0.76,0.09999475643647422
129,worldpolitics,Twitter hurt my feelings :(,1590715992.0,"05/29/2020, 01:33:12",766,2,19045,1865.2261256945312,0.91,0.040220530322919404
130,worldpolitics,Instead of upvoting the thots. Upvote the birthday boy,1589332869.0,"05/13/2020, 01:21:09",111,5,18696,1198.4491533628425,0.94,0.005937098844672657
131,worldpolitics,Good luck America!,1586066861.0,"04/05/2020, 06:07:41",875,1,18414,2348.730788301029,0.89,0.047518192679483005
132,worldpolitics,Up vote the sexiest person who has ever lived.,1588944244.0,"05/08/2020, 13:24:04",208,4,18325,3216.605115224538,0.85,0.011350613915416098
133,worldpolitics,Truth,1585397963.0,"03/28/2020, 12:19:23",978,1,17943,3285.095604842125,0.85,0.054505935462297275
134,worldpolitics,No mods? Here are my tits ¯\_(ツ)_/¯,1588851329.0,"05/07/2020, 11:35:29",721,15,17682,2416.434789718078,0.88,0.04077593032462391
135,worldpolitics,Let’s do it,1582058927.0,"02/18/2020, 20:48:47",700,2,17675,1635.7789429853656,0.92,0.039603960396039604
136,worldpolitics,What the coronavirus has taught us about people in desperate situations.,1584231048.0,"03/15/2020, 00:10:48",856,3,17648,2338.666588671691,0.88,0.048504079782411606
137,worldpolitics,"Google removed all search suggestion for 「黃色」meaning yellow which represents HK’s revolution while every other color result is intact, fuck google censorship fuck you for supporting CCP",1590058479.0,"05/21/2020, 10:54:39",431,7,17602,1242.5562035712974,0.93,0.024485853880240882
138,worldpolitics,Our president is a fucking moron.,1582810088.0,"02/27/2020, 13:28:08",1089,2,17599,2723.0642269105447,0.87,0.061878515824762774
139,worldpolitics,Our current situation in Iran.,1578327737.0,"01/06/2020, 16:22:17",647,2,17593,1871.975107054015,0.9,0.036775990450747455
140,worldpolitics,if literally everything can get thousands of upvotes how much can literally nothing get?,1593618787.0,"07/01/2020, 15:53:07",216,5,17483,3227.2511926399384,0.84,0.012354859005891438
141,worldpolitics,Donald Trump doesn't care about the deaths of American citizens.,1586865209.0,"04/14/2020, 11:53:29",985,0,17387,2175.376798932968,0.89,0.05665152125150975
142,worldpolitics,"Since the rules apparently don't matter anymore, upvote this potato.",1588691995.0,"05/05/2020, 15:19:55",536,6,17389,1870.7936876056046,0.9,0.03082408419115533
143,worldpolitics,This is America,1586089738.0,"04/05/2020, 12:28:58",1285,4,17239,2946.635089066167,0.85,0.07454028655954521
144,worldpolitics,BerNie brOs are all wHite dudEs in their 30's.,1580808889.0,"02/04/2020, 09:34:49",991,1,16862,4849.4907467434605,0.78,0.05877120151820662
145,worldpolitics,Well said,1584328176.0,"03/16/2020, 03:09:36",960,0,16857,2232.7907436895475,0.88,0.05694963516639971
146,worldpolitics,"Straight up anime titties hentai. Your move mods, let's see if you have the balls to remove my post.",1588796244.0,"05/06/2020, 20:17:24",744,12,16789,2274.722327457428,0.88,0.04431472988266127
147,worldpolitics,Please upvote my dads lobster he is so proud,1588910490.0,"05/08/2020, 04:01:30",319,3,16664,2709.6296019988295,0.86,0.01914306289006241
148,worldpolitics,Definitely going to go over some peoples head,1577888333.0,"01/01/2020, 14:18:53",1209,3,16502,3096.906139396109,0.84,0.07326384680644771
149,worldpolitics,Upvote the duck and you get the fuck,1589137688.0,"05/10/2020, 19:08:08",133,1,16345,1338.0486057815215,0.92,0.008137044967880086
150,worldpolitics,🤔,1584750993.0,"03/21/2020, 00:36:33",560,1,16282,783.7584451623952,0.95,0.034393809114359415
151,worldpolitics,"[NSFW][NSFL][Spoiler][Just don't open this post, I'm begging you]",1588984631.0,"05/09/2020, 00:37:11",54,2,16050,1688.3964299884356,0.9,0.0033644859813084112
152,worldpolitics,Truth.,1587858422.0,"04/25/2020, 23:47:02",969,2,15816,2119.619945691,0.88,0.061267071320182095
153,worldpolitics,SCHLOP SCHLOP SCHLOP SCHLOP SCHLOP SCHLOP SCHLOP SCHLOP SCHLOP SCHLOP SCHLOP SCHLOP SCHLOP SCHLOP SCHLOP SCHLOP SCHLOP SCHLOP SCHLOP SCHLOP SCHLOP SCHLOP SCHLOP SCHLOP SCHLOP SCHLOP SCHLOP SCHLOP SCHLOP SCHLOP SCHLOP SCHLOP SCHLOP SCHLOP SCHLOP SCHLOP SCHLOP SCHLOP SCHLOP SCHLOP SCHLOP SCHLOP SCHLOP,1589019216.0,"05/09/2020, 10:13:36",324,2,15791,1231.5807825208612,0.93,0.020518016591729468
154,worldpolitics,We have bigger fish to fry,1579172974.0,"01/16/2020, 11:09:34",1221,1,15690,3261.9234956226173,0.83,0.07782026768642447
155,worldpolitics,From New York City With love!,1585769765.0,"04/01/2020, 19:36:05",882,5,15580,5221.476174362884,0.75,0.05661103979460847
156,worldpolitics,Priorities matter,1586123642.0,"04/05/2020, 21:54:02",708,1,15351,2015.5365936115013,0.88,0.04612077389095173
157,worldpolitics,Socialism not good when it benefits the people,1579765216.0,"01/23/2020, 07:40:16",1007,0,15320,1942.5606527794152,0.89,0.06573107049608355
158,worldpolitics,True that,1576897307.0,"12/21/2019, 03:01:47",960,2,15008,1203.238550466771,0.93,0.06396588486140725
159,worldpolitics,"""Better things aren't possible""",1576932344.0,"12/21/2019, 12:45:44",914,0,14837,1410.0617017173372,0.91,0.061602749882051624
160,worldpolitics,Looking at you GOP.,1579112300.0,"01/15/2020, 18:18:20",986,3,14799,3513.0121072994552,0.81,0.06662612338671532
161,worldpolitics,Iran,1578459686.0,"01/08/2020, 05:01:26",1889,4,14782,5493.433238508984,0.73,0.12779055608172102
162,worldpolitics,Don’t forget about how it’s okay to run over protesters...,1587957417.0,"04/27/2020, 03:16:57",1399,4,14766,2878.492675577687,0.84,0.0947446837328999
