,Subreddit,Title,Epoch Time,Date,Comments,Awards,Upvotes,Downvotes,Upvote Ratio,Comment/Upvote Ratio
329,worldpolitics,Upvote for the ass. Comment for the tits,1589028872.0,"05/09/2020, 12:54:32",198,0,7067,563.9647742274665,0.93,0.02801754634215367
330,worldpolitics,A part of history,1579355724.0,"01/18/2020, 13:55:24",569,2,7061,661.2727889416547,0.91,0.08058348675824954
331,worldpolitics,Counting is hard,1592990186.0,"06/24/2020, 09:16:26",340,0,7044,308.57580322771537,0.96,0.04826802952867689
332,worldpolitics,Power of spoken truth,1587254908.0,"04/19/2020, 00:08:28",261,0,7000,571.310860111872,0.92,0.03728571428571428
333,worldpolitics,"Meanwhile at the ""Blacks for trump rally""",1573238999.0,"11/08/2019, 18:49:59",628,0,6943,819.2222380271678,0.89,0.090450813769264
334,worldpolitics,can I offer you all three pairs of redditor titties?,1591822859.0,"06/10/2020, 21:00:59",191,0,6940,779.550467485551,0.9,0.027521613832853026
335,worldpolitics,this is getting out of hand bruh,1589706990.0,"05/17/2020, 09:16:30",68,0,6911,507.6858102984688,0.93,0.009839386485313269
336,worldpolitics,schlop schlop schlop schlop schlop schlop schlop schlop schlop schlop schlop schlop schlop schlop schlop schlop schlop schlop schlop schlop schlop schlop schlop schlop schlop schlop schlop schlop,1588950789.0,"05/08/2020, 15:13:09",52,1,6904,305.49075962910774,0.96,0.007531865585168019
337,worldpolitics,Upvote tiny crab,1590389828.0,"05/25/2020, 06:57:08",90,0,6878,357.2480604256134,0.95,0.013085199185809828
338,worldpolitics,Shitposting warhammer now that the slaaneshi corruption has been purged part 2,1589651278.0,"05/16/2020, 17:47:58",71,1,6863,417.919388450483,0.94,0.010345330030598864
339,worldpolitics,"A new U.N. report argues many of the street protests popping up around the globe are driven by a growing sense that societies are rigged to favor the powerful — and trap the masses in low-wage, dead-end lives. n.pr/35kPSbv",1576992274.0,"12/22/2019, 05:24:34",611,2,6816,185.32579412691575,0.97,0.08964201877934272
340,worldpolitics,"Thots and harlots get hundreds of upvotes, how about some love for my boy Harold.",1597418065.0,"08/14/2020, 15:14:25",111,8,6794,922.6514951747859,0.88,0.016337945245805122
341,worldpolitics,More more more,1589812457.0,"05/18/2020, 14:34:17",66,0,6757,359.84850428585196,0.95,0.009767648364658873
342,worldpolitics,Sweet sweet anarchy,1589059090.0,"05/09/2020, 21:18:10",133,0,6717,185.15749396852607,0.97,0.01980050617835343
343,worldpolitics,upvote my kitty 😻😻,1591868563.0,"06/11/2020, 09:42:43",70,0,6685,607.4915360622599,0.92,0.010471204188481676
344,worldpolitics,Plz like so i can quit my job someday,1598269903.0,"08/24/2020, 11:51:43",121,2,6676,738.5051576454634,0.9,0.01812462552426603
345,worldpolitics,So I heard this sub likes Thigh-highs?,1603214033.0,"10/20/2020, 17:13:53",51,8,6659,294.5023611422075,0.96,0.007658807628773089
346,worldpolitics,"If a naked girl can get thausends of upvotes, than what can a snek get?",1597765772.0,"08/18/2020, 15:49:32",133,6,6573,810.1638910252605,0.89,0.02023429179978701
347,worldpolitics,We Must Unite Against The True Enemy.,1590764600.0,"05/29/2020, 15:03:20",254,0,6537,941.1598634114998,0.87,0.03885574422517975
348,worldpolitics,...,1595923121.0,"07/28/2020, 07:58:41",143,0,6536,393.55226111375487,0.94,0.021878824969400246
349,worldpolitics,The world according to this subreddit,1588855113.0,"05/07/2020, 12:38:33",99,1,6538,261.4910260072793,0.96,0.015142245334964822
350,worldpolitics,Pretty much the story so far,1589894584.0,"05/19/2020, 13:23:04",220,0,6535,655.8329954815345,0.91,0.03366488140780413
351,worldpolitics,Zoom in on my pussy!,1597990332.0,"08/21/2020, 06:12:12",215,18,6525,682.66188525092,0.91,0.03295019157088123
352,worldpolitics,Lets show some respect to these brave bois,1588934673.0,"05/08/2020, 10:44:33",19,1,6496,528.4386440491626,0.92,0.0029248768472906403
353,worldpolitics,(F18),1595310249.0,"07/21/2020, 05:44:09",155,2,6488,338.1783969325461,0.95,0.023890258939580765
354,worldpolitics,A naked girl can get hundreds of upvotes but how many upvotes can our glorious Kaiser Wilhelm get?,1590624802.0,"05/28/2020, 00:13:22",105,2,6482,1045.3699492922242,0.86,0.016198704103671708
355,worldpolitics,Fuck it Cthulhu 2020,1591073947.0,"06/02/2020, 04:59:07",121,0,6467,344.5006984284273,0.95,0.018710375753827124
356,worldpolitics,stop looking at pictures of boobs and look at more pictures of my boobs,1596111463.0,"07/30/2020, 12:17:43",218,0,6475,658.6550658661454,0.91,0.033667953667953665
357,worldpolitics,"Petition to make this the sub icon, considering it is what most posters believe the world looks like.",1576529444.0,"12/16/2019, 20:50:44",389,1,6450,621.7076233740709,0.91,0.06031007751937985
358,worldpolitics,Obamacrons are back,1589710707.0,"05/17/2020, 10:18:27",97,0,6439,296.68127929371076,0.96,0.01506445100170834
359,worldpolitics,.,1591468957.0,"06/06/2020, 18:42:37",64,0,6443,289.91802810240733,0.96,0.009933260903305914
360,worldpolitics,"Ah yes, politics...",1589031482.0,"05/09/2020, 13:38:02",38,0,6437,138.9395979644578,0.98,0.005903371135622185
361,worldpolitics,???????,1588828116.0,"05/07/2020, 05:08:36",139,1,6428,236.93060861962476,0.96,0.0216241443683883
362,worldpolitics,Mods are asleep. Upvote tall Yoda,1588930330.0,"05/08/2020, 09:32:10",43,1,6404,253.95257122043677,0.96,0.006714553404122424
363,worldpolitics,If the Trumpers want war put them on the front lines,1578446311.0,"01/08/2020, 01:18:31",952,0,6398,3080.6860051097774,0.67,0.1487964989059081
364,worldpolitics,Anyone remember this scene,1590869821.0,"05/30/2020, 20:17:01",113,0,6400,235.12211378797838,0.96,0.01765625
365,worldpolitics,meowdy,1591569663.0,"06/07/2020, 22:41:03",217,0,6377,495.1580271242319,0.93,0.03402854006586169
366,worldpolitics,If you haven't seen it already,1590128304.0,"05/22/2020, 06:18:24",117,1,6327,283.5649951486348,0.96,0.01849217638691323
367,worldpolitics,So we posting ira shit now,1590316275.0,"05/24/2020, 10:31:15",160,0,6327,157.12393309706476,0.98,0.02528844634107792
368,worldpolitics,To those of you who upvote thots,1593162703.0,"06/26/2020, 09:11:43",97,1,6322,522.5573137942138,0.92,0.015343245808288516
369,worldpolitics,Four fucking pixels.,1599222447.0,"09/04/2020, 12:27:27",178,21,6308,377.90857799703736,0.94,0.028218135700697526
370,worldpolitics,It’s not HIS money. It’s OURS,1584764621.0,"03/21/2020, 04:23:41",310,0,6297,289.24027595323514,0.96,0.049229791964427505
371,worldpolitics,"If naked women can get 1k+ upvotes, how many can the soil triangle get?",1588999051.0,"05/09/2020, 04:37:31",73,1,6288,213.55361738061674,0.97,0.01160941475826972
372,worldpolitics,A meme for Monday,1599508515.0,"09/07/2020, 19:55:15",178,3,6276,268.80783704249734,0.96,0.028362014021669855
373,worldpolitics,The time is now,1592021124.0,"06/13/2020, 04:05:24",126,0,6273,387.82313575006447,0.94,0.020086083213773313
374,worldpolitics,"Keep it up friendos, you're doing great",1591184374.0,"06/03/2020, 11:39:34",179,0,6261,179.66017250204277,0.97,0.028589682159399457
375,worldpolitics,Ran into Craig Robinson at Best Buy,1589989234.0,"05/20/2020, 15:40:34",184,0,6255,221.12853741351773,0.97,0.02941646682653877
376,worldpolitics,its important,1596155715.0,"07/31/2020, 00:35:15",375,1,6254,171.81757549996655,0.97,0.05996162456028142
377,worldpolitics,noticing a spike in nudes recently in this sub. here is another pic of a cat to counteract that.,1603563633.0,"10/24/2020, 18:20:33",168,24,6285,335.1744618609091,0.95,0.02673031026252983
378,worldpolitics,Reddit marching on worldpolitics [colorized 2020],1589324869.0,"05/12/2020, 23:07:49",63,0,6200,112.33418789109237,0.98,0.010161290322580644
379,worldpolitics,I share this knowledge,1602829497.0,"10/16/2020, 06:24:57",129,4,6270,131.64466759996503,0.98,0.02057416267942584
380,worldpolitics,The struggle is real,1592596705.0,"06/19/2020, 19:58:25",152,2,6156,174.95930377940385,0.97,0.024691358024691357
381,worldpolitics,Shitposting warhammer until the slaaneshi corruption is purged part 36,1589582901.0,"05/15/2020, 22:48:21",70,1,6134,629.2814814891526,0.91,0.011411803064884252
382,worldpolitics,Duwang Gang ahead.,1589708413.0,"05/17/2020, 09:40:13",66,0,6094,908.5161490254932,0.87,0.010830324909747292
383,worldpolitics,why not both?,1590428055.0,"05/25/2020, 17:34:15",159,1,6101,841.4253747820903,0.88,0.026061301425995737
384,worldpolitics,Just a friendly reminder :),1591690859.0,"06/09/2020, 08:20:59",138,1,6089,398.93504551362,0.94,0.02266382000328461
385,worldpolitics,It really be like that,1578819987.0,"01/12/2020, 09:06:27",209,0,6088,466.5198360815157,0.93,0.03432982917214192
386,worldpolitics,Day 13 of roasting different subreddits,1595769611.0,"07/26/2020, 13:20:11",144,0,6082,334.32737924490175,0.95,0.02367642222952976
387,worldpolitics,"I don't have titties, but I have a violin. How many upvotes for this!?",1588947822.0,"05/08/2020, 14:23:42",77,1,6052,578.6587351670423,0.91,0.012723066754791804
388,worldpolitics,likes plz,1600736747.0,"09/22/2020, 01:05:47",69,18,6038,847.9338924464291,0.88,0.01142762504140444
389,worldpolitics,Just a succulent Chinese meal ready to receive your limp upvotes,1597144463.0,"08/11/2020, 11:14:23",136,0,6037,372.0420230359259,0.94,0.02252774556899122
390,worldpolitics,Shitposting Warhammer until the slaaneshi corruption is purged part 1,1588905099.0,"05/08/2020, 02:31:39",116,1,6038,365.5459301528281,0.94,0.019211659489897316
391,worldpolitics,Step bro please help I’m stuck,1596211641.0,"07/31/2020, 16:07:21",77,0,6040,279.5803389679204,0.96,0.012748344370860927
392,worldpolitics,Do you guys like my boobs &lt;3,1596297667.0,"08/01/2020, 16:01:07",186,1,6022,600.1701449148359,0.91,0.030886748588508803
393,worldpolitics,Thots are temporary and still won’t fuck you. Water cares.,1591619177.0,"06/08/2020, 12:26:17",56,0,6017,372.76714461906886,0.94,0.00930696360312448
394,worldpolitics,Looking behind the curtain,1585271262.0,"03/27/2020, 01:07:42",330,0,6008,343.09922094196736,0.95,0.05492676431424767
395,worldpolitics,I’m scared says Ralph,1597514285.0,"08/15/2020, 17:58:05",131,0,6001,225.72152654989077,0.96,0.02182969505082486
396,worldpolitics,Foreign socialists asking for US tax payer's money,1584994697.0,"03/23/2020, 20:18:17",234,0,5989,117.62801447919537,0.98,0.03907163132409417
397,worldpolitics,But her emails!......,1583284280.0,"03/04/2020, 01:11:20",552,0,5990,966.1595500468884,0.86,0.09215358931552588
398,worldpolitics,Mods just don't even care. Except for THIS. All mods are afraid of this image. DO NOT LET IT DIE.,1588792995.0,"05/06/2020, 19:23:15",52,0,5970,381.9338130049118,0.94,0.008710217755443886
399,worldpolitics,Remember when he said he wouldn't have time for golf. He was being sarcastic.,1588086334.0,"04/28/2020, 15:05:34",390,0,5967,350.8347141700988,0.94,0.06535947712418301
400,worldpolitics,Makes sense 😰,1599844917.0,"09/11/2020, 17:21:57",47,12,5930,383.52283767503286,0.94,0.007925801011804385
401,worldpolitics,if naked women can get thousands of upvotes how many can my bus get?,1597348363.0,"08/13/2020, 19:52:43",124,4,5929,580.9255628953697,0.91,0.020914150784280654
402,worldpolitics,The čäť,1594224314.0,"07/08/2020, 16:05:14",65,0,5923,202.48208931463614,0.97,0.010974168495694749
403,worldpolitics,"Take a break, then continue.",1589795033.0,"05/18/2020, 09:43:53",78,0,5911,355.2258337911999,0.94,0.01319573676196921
404,worldpolitics,Check out this dirty hoe,1593881508.0,"07/04/2020, 16:51:48",104,1,5905,403.6955197887073,0.94,0.017612193056731583
405,worldpolitics,Maymay,1601547215.0,"10/01/2020, 10:13:35",41,1,5895,184.3278758146398,0.97,0.006955046649703138
406,worldpolitics,"Quick, the mods are asleep so let's upvote this bread again!",1596780855.0,"08/07/2020, 06:14:15",119,0,5893,491.95113244564527,0.92,0.020193449855761072
407,worldpolitics,Oh yeah,1589293885.0,"05/12/2020, 14:31:25",72,0,5878,197.14848739325953,0.97,0.012249064307587616
408,worldpolitics,Yes,1593120737.0,"06/25/2020, 21:32:17",75,0,5882,188.09059371878357,0.97,0.012750765045902755
409,worldpolitics,I can’t wait to play Call of Duty: War Crimes.,1598861508.0,"08/31/2020, 08:11:48",116,2,5863,140.03820566173,0.98,0.019785092955824663
410,worldpolitics,"Mods are gone, upvote political compass.",1588864398.0,"05/07/2020, 15:13:18",216,3,5855,316.6185997344937,0.95,0.036891545687446625
411,worldpolitics,Upvote for boobs and smile? :),1603707809.0,"10/26/2020, 10:23:29",236,13,5921,792.8284340100672,0.88,0.039858132072285085
412,worldpolitics,"If boobs get 1k upvotes, how many for the sexiest man alive?",1589115774.0,"05/10/2020, 13:02:54",40,0,5845,286.95649688557114,0.95,0.006843455945252352
413,worldpolitics,It’s a green square. That’s it. Give me your frigging upvotes.,1588810278.0,"05/07/2020, 00:11:18",54,3,5796,514.1383751673393,0.92,0.009316770186335404
414,worldpolitics,Is this how you launch a political career? #Titties2020 ✌️,1588942919.0,"05/08/2020, 13:01:59",159,3,5789,405.80273929529267,0.93,0.02746588357229228
415,worldpolitics,Don't post anything that might get this subreddit banned or quarantined,1588832964.0,"05/07/2020, 06:29:24",1214,0,5781,644.0818733142278,0.9,0.2099982701954679
416,worldpolitics,The US has a Cuck President.,1577893806.0,"01/01/2020, 15:50:06",540,0,5775,789.8974009311296,0.88,0.09350649350649351
417,worldpolitics,Mooooo,1592793210.0,"06/22/2020, 02:33:30",60,1,5757,161.60824832572962,0.97,0.010422094841063054
418,worldpolitics,Was so hot out at work that I had to have a little fun and take off my clothes Hope you guys like tan lines! upvote and ill send you more exclusives,1601174647.0,"09/27/2020, 02:44:07",157,21,5715,307.69651530379815,0.95,0.02747156605424322
419,worldpolitics,JUNE 2020 IS GONNA BE HARD,1591094568.0,"06/02/2020, 10:42:48",123,0,5702,167.82955758130993,0.97,0.021571378463696948
420,worldpolitics,This is the most lewd thing I want to see in this sub,1590146813.0,"05/22/2020, 11:26:53",82,0,5698,199.78134689851868,0.97,0.014391014391014392
421,worldpolitics,Filthy Bitch Is Soaking Wet And Ready To Play With Her Toy,1593258557.0,"06/27/2020, 11:49:17",58,0,5681,358.32920347896015,0.94,0.010209470163703573
422,worldpolitics,If you mess with the hoot you get the shoot.,1596951134.0,"08/09/2020, 05:32:14",54,2,5685,190.21077590088225,0.97,0.00949868073878628
423,worldpolitics,What’s with all the tits,1588906216.0,"05/08/2020, 02:50:16",53,3,5677,210.2271936740808,0.96,0.009335916857495156
424,worldpolitics,What a bunch of knock-offs,1573462564.0,"11/11/2019, 08:56:04",142,0,5671,112.80823391926333,0.98,0.02503967554223241
425,worldpolitics,You have sinned by upvoting thottery now clean yourself from sins by upvoting him the god himself,1591861193.0,"06/11/2020, 07:39:53",78,0,5657,656.5210773073168,0.9,0.013788226975428673
426,worldpolitics,"Okay Google, wipe everything.",1594275303.0,"07/09/2020, 06:15:03",61,0,5660,98.55991588586949,0.98,0.0107773851590106
427,worldpolitics,Every Upvote gets a nude 😝,1603294566.0,"10/21/2020, 15:36:06",201,10,5707,910.5467536183205,0.86,0.03521990537935868
428,worldpolitics,Me enjoying my favorite new hentai sub,1588836152.0,"05/07/2020, 07:22:32",26,0,5628,289.9992608105931,0.95,0.004619758351101635
429,worldpolitics,This man has the MATH,1577930096.0,"01/02/2020, 01:54:56",480,0,5611,340.6497507467275,0.94,0.08554624844056317
430,worldpolitics,Never let thots break your will,1592561408.0,"06/19/2020, 10:10:08",309,0,5597,643.1247154234252,0.9,0.05520814722172592
431,worldpolitics,F,1590097947.0,"05/21/2020, 21:52:27",125,0,5584,317.21131423991665,0.95,0.02238538681948424
432,worldpolitics,Pussy pic with plants for your pleasure 😘,1600966153.0,"09/24/2020, 16:49:13",69,12,5592,377.7081344394401,0.94,0.012339055793991416
433,worldpolitics,Me after seeing this sub,1592676751.0,"06/20/2020, 18:12:31",53,0,5553,163.19804157772705,0.97,0.009544390419593013
434,worldpolitics,Trajan is disappointed in you lads,1588856869.0,"05/07/2020, 13:07:49",69,0,5532,312.3154283614631,0.95,0.012472885032537961
435,worldpolitics,Do you have a moment to upvote our lord and savior Jesus Christ?,1589407578.0,"05/13/2020, 22:06:18",74,0,5533,334.3074607366989,0.94,0.01337429965660582
436,worldpolitics,Do you remember ?,1585698573.0,"03/31/2020, 23:49:33",177,0,5490,130.40478904348038,0.98,0.03224043715846994
437,worldpolitics,"""What happened?""",1589043771.0,"05/09/2020, 17:02:51",708,1,5462,223.7193342004157,0.96,0.1296228487733431
438,worldpolitics,Where are the budget-minded people now?,1578199208.0,"01/05/2020, 04:40:08",526,0,5453,244.73787248335066,0.96,0.09646066385475885
439,worldpolitics,Patrick Stewart turns the ol' 80 today,1594637925.0,"07/13/2020, 10:58:45",69,0,5447,237.34215790819508,0.96,0.01266752340738021
440,worldpolitics,it doesnt look wrong,1593838488.0,"07/04/2020, 04:54:48",75,0,5446,164.6749502898274,0.97,0.013771575468233566
441,worldpolitics,Joe Biden molests anime girls,1588843285.0,"05/07/2020, 09:21:25",274,2,5445,638.8840892848812,0.89,0.05032139577594123
442,worldpolitics,Why hasn't this happened?,1585740449.0,"04/01/2020, 11:27:29",382,0,5442,403.1717741565617,0.93,0.07019478133039324
443,worldpolitics,"Let's get back to some actual headlines, shall we?",1588838593.0,"05/07/2020, 08:03:13",49,0,5431,215.36062420207145,0.96,0.00902227950653655
444,worldpolitics,"Naked girls can get a lot of upvotes, but can upvotes get a lot of naked girls? 🤔",1598785455.0,"08/30/2020, 11:04:15",124,2,5432,397.2620689617697,0.93,0.022827687776141383
445,worldpolitics,"Fuck the mods, here’s my tits",1588829594.0,"05/07/2020, 05:33:14",132,0,5411,588.4090740420279,0.9,0.024394751432267603
446,worldpolitics,Wholsum 100.,1592877846.0,"06/23/2020, 02:04:06",72,0,5402,180.7568326525543,0.97,0.013328396890040726
447,worldpolitics,"Tits can get thousands of upvotes, how many for this fine boy?",1589274736.0,"05/12/2020, 09:12:16",53,0,5403,456.22428291641154,0.92,0.009809365167499537
448,worldpolitics,Hoo rah,1578109502.0,"01/04/2020, 03:45:02",756,1,5387,570.8086541748398,0.9,0.14033785038054575
449,worldpolitics,My attempt at new Banner Art for the sub.,1590161040.0,"05/22/2020, 15:24:00",125,1,5365,305.61773644203095,0.95,0.023299161230195712
450,worldpolitics,What the hell happened here,1589595860.0,"05/16/2020, 02:24:20",116,0,5354,248.16660650509584,0.96,0.021666044079193127
451,worldpolitics,I heard dogs were getting upvotes,1599640727.0,"09/09/2020, 08:38:47",42,4,5354,275.6304533594275,0.95,0.007844602166604408
452,worldpolitics,😘,1589324869.0,"05/12/2020, 23:07:49",31,0,5328,199.22663204428864,0.96,0.005818318318318318
453,worldpolitics,Why are there politics in r/worldpolitics?,1591781232.0,"06/10/2020, 09:27:12",105,1,5312,275.3959326922859,0.95,0.01976656626506024
454,worldpolitics,I just can't vibe anymore...,1596995111.0,"08/09/2020, 17:45:11",124,2,5297,147.142582391607,0.97,0.0234094770624882
455,worldpolitics,Well if the doctors said so,1600907994.0,"09/24/2020, 00:39:54",21,2,5281,151.36434301099052,0.97,0.003976519598560878
456,worldpolitics,Upvote cuz dog with pipe,1595200617.0,"07/19/2020, 23:16:57",48,0,5251,170.67033395809358,0.97,0.009141115977908969
457,worldpolitics,this sub in a nutshell,1596036021.0,"07/29/2020, 15:20:21",74,0,5238,208.8149303478658,0.96,0.014127529591447117
458,worldpolitics,It bears repeating,1580741466.0,"02/03/2020, 14:51:06",827,1,5218,402.79772121400674,0.93,0.1584898428516673
459,worldpolitics,Rip,1593555268.0,"06/30/2020, 22:14:28",75,0,5204,173.22567504787185,0.97,0.014411990776325902
460,worldpolitics,War is a racket,1578495227.0,"01/08/2020, 14:53:47",263,0,5197,188.21428877662038,0.97,0.05060611891475852
461,worldpolitics,Upvote my pussy &lt;3,1598565007.0,"08/27/2020, 21:50:07",41,3,5187,350.69500327767037,0.94,0.007904376325428958
462,worldpolitics,Welp,1592921312.0,"06/23/2020, 14:08:32",74,0,5193,199.16559010879064,0.96,0.01424995185827075
463,worldpolitics,I know its not titties but can my boy Obi-Wan get some love,1588897607.0,"05/08/2020, 00:26:47",49,1,5180,310.3299369757933,0.94,0.00945945945945946
464,worldpolitics,Much respect!!,1600035063.0,"09/13/2020, 22:11:03",105,3,5155,278.29786881647306,0.95,0.020368574199806012
465,worldpolitics,Maurice,1592646726.0,"06/20/2020, 09:52:06",91,0,5152,231.5960574726014,0.96,0.017663043478260868
466,worldpolitics,"This is something most of us can agree with: Tiananmen Square 1989, where people protesting where shot and turned into fucking goo just to be more easily disposed of.",1588860251.0,"05/07/2020, 14:04:11",170,1,5137,218.73781578181934,0.96,0.03309324508467978
467,worldpolitics,Where,1601609013.0,"10/02/2020, 03:23:33",191,5,5143,142.66497107630676,0.97,0.037137857281742175
468,worldpolitics,"I know thots can get tons of upvotes, but how much can my dog get?",1592184052.0,"06/15/2020, 01:20:52",45,1,5134,710.0394766364516,0.88,0.00876509544215037
469,worldpolitics,Wise quotes,1595043250.0,"07/18/2020, 03:34:10",52,0,5129,363.26937455422194,0.93,0.010138428543575747
470,worldpolitics,"My boobs says hi, upvote to say hi back ☺️",1589245573.0,"05/12/2020, 01:06:13",112,1,5131,323.4536259200904,0.94,0.021828103683492497
471,worldpolitics,1 upvote = 1 more remote,1588977935.0,"05/08/2020, 22:45:35",149,3,5109,502.52902985766923,0.91,0.02916422000391466
472,worldpolitics,Real life night mode gang,1594384280.0,"07/10/2020, 12:31:20",114,0,5113,153.73015646983367,0.97,0.022296107960101702
473,worldpolitics,"Spare change? Spare change, ma’am?",1595591694.0,"07/24/2020, 11:54:54",65,0,5102,102.17234607339287,0.98,0.012740101920815367
474,worldpolitics,It’s a stupid point to argue tbh,1595854562.0,"07/27/2020, 12:56:02",191,0,5099,377.670423091321,0.93,0.03745832516179643
475,worldpolitics,"If Fictional Soldiers Get That Much Love, How Many can These Boys Get?",1592088582.0,"06/13/2020, 22:49:42",65,0,5103,490.3725790440167,0.91,0.012737605330197924
476,worldpolitics,Here's a nice family photo of my plants to balance things up a bit.,1594557763.0,"07/12/2020, 12:42:43",90,0,5099,238.67309262756316,0.96,0.017650519709747008
477,worldpolitics,Two types of lurkers on this sub,1590587941.0,"05/27/2020, 13:59:01",65,1,5095,221.1801203300347,0.96,0.012757605495583905
478,worldpolitics,Tittes are nice but what I really want is....,1588943574.0,"05/08/2020, 13:12:54",32,1,5080,222.40018824002163,0.96,0.006299212598425197
479,worldpolitics,Me desperately trying to dodge that Asian ladies pussy goop,1602010719.0,"10/06/2020, 18:58:39",121,14,5114,304.956093158723,0.94,0.023660539694955025
480,worldpolitics,😳😳😳,1598911199.0,"08/31/2020, 21:59:59",41,2,5083,170.10313291173225,0.97,0.008066102695258705
481,worldpolitics,An explanation of what had happened,1588975164.0,"05/08/2020, 21:59:24",137,4,5110,-11.670900252792308,1.0,0.02681017612524462
482,worldpolitics,If you don't upvote this you are a bad person.,1590968925.0,"05/31/2020, 23:48:45",72,0,5050,765.5467576175242,0.87,0.014257425742574258
483,worldpolitics,This sub is a mess,1589709998.0,"05/17/2020, 10:06:38",41,0,5052,461.9456849305079,0.92,0.008115597783056216
484,worldpolitics,"Knock, knock...",1598186011.0,"08/23/2020, 12:33:31",50,1,5057,163.30834692515873,0.97,0.009887284951552304
485,worldpolitics,"Learn the truth, fellas",1596646900.0,"08/05/2020, 17:01:40",140,0,5047,247.60092066163088,0.95,0.027739251040221916
486,worldpolitics,Upvote my tits in favor of equality,1589201276.0,"05/11/2020, 12:47:56",74,1,5057,760.4689824122925,0.87,0.014633181728297409
487,worldpolitics,Oof,1595423204.0,"07/22/2020, 13:06:44",143,0,5047,265.9195323230806,0.95,0.028333663562512382
488,worldpolitics,"""guys laugh it's from jojo""",1589708685.0,"05/17/2020, 09:44:45",28,0,4960,478.22721971240935,0.91,0.00564516129032258
489,worldpolitics,if a nude girl can get 1k up votes how much can Barry's ptsd get?,1596896736.0,"08/08/2020, 14:25:36",42,0,4935,463.0659159819779,0.91,0.00851063829787234
490,worldpolitics,Harry Patch was the last British soldier who fought in the WW1 trenches to die.,1577849948.0,"01/01/2020, 03:39:08",262,1,4906,88.17243990422594,0.98,0.05340399510803098
491,worldpolitics,"A new home, yoda has found",1589025106.0,"05/09/2020, 11:51:46",52,0,4906,201.2716913322556,0.96,0.01059926620464737
492,worldpolitics,I smell a crusade,1589711495.0,"05/17/2020, 10:31:35",20,0,4901,246.4967490170311,0.95,0.004080799836768007
493,worldpolitics,"I see boobs on here all the time, so here's something for the ladies",1595214514.0,"07/20/2020, 03:08:34",143,3,4892,196.62449669884882,0.96,0.029231398201144725
494,worldpolitics,Can't tell em apart,1582280612.0,"02/21/2020, 10:23:32",308,0,4890,258.7669988100952,0.95,0.06298568507157465
495,worldpolitics,Not sure how it is in the good ol US and A,1598321593.0,"08/25/2020, 02:13:13",174,1,4885,354.37422859103754,0.93,0.035619242579324466
496,worldpolitics,"I'm to old, dammit",1590566399.0,"05/27/2020, 07:59:59",144,0,4868,308.4079951082331,0.94,0.029580936729663106
497,worldpolitics,L̶i̶b̶e̶r̶t̶a̶r̶i̶a̶n̶i̶s̶m̶ Sociopathy,1584926131.0,"03/23/2020, 01:15:31",383,0,4854,278.5744744991807,0.95,0.07890399670374948
498,worldpolitics,What sweet hell did I just walk into?!,1590195027.0,"05/23/2020, 00:50:27",79,2,4846,161.75403386436665,0.97,0.016302104828724722
499,worldpolitics,The new r/worldpolitics,1588876103.0,"05/07/2020, 18:28:23",24,0,4849,157.74827442730657,0.97,0.004949474118374922
500,worldpolitics,I hope this is what he meant,1595550520.0,"07/24/2020, 00:28:40",208,0,4848,618.0782949633931,0.89,0.0429042904290429
501,worldpolitics,Do you guys like my shy pussy?,1594135680.0,"07/07/2020, 15:28:00",81,0,4838,314.24698827030716,0.94,0.016742455560148823
502,worldpolitics,Alex Jones with some big ol milkers,1588854087.0,"05/07/2020, 12:21:27",72,0,4832,365.93253744969843,0.93,0.014900662251655629
