,Subreddit,Title,Epoch Time,Date,Comments,Awards,Upvotes,Downvotes,Upvote Ratio,Comment/Upvote Ratio
163,worldpolitics,The Senate is full of cucks. Let's replace them with fighters.,1584833851.0,"03/21/2020, 23:37:31",545,1,14740,1588.2011775515293,0.9,0.036974219810040704
164,worldpolitics,“I’m rooting for Russia”,1574788587.0,"11/26/2019, 17:16:27",1423,3,14650,2678.7317602719777,0.85,0.09713310580204779
165,worldpolitics,Alabama lawmaker responds to abortion ban with mandatory vasectomy bill: 'It always takes two to tango',1581882360.0,"02/16/2020, 19:46:00",2082,0,14604,3314.345479200336,0.82,0.14256368118323748
166,worldpolitics,A photograph from an alternate timeline.,1579296147.0,"01/17/2020, 21:22:27",665,0,14568,2691.295338721855,0.84,0.04564799560680945
167,worldpolitics,Naked girls can get thousands of upvotes. How many can General Iroh get,1598696335.0,"08/29/2020, 10:18:55",126,22,14524,2442.0087523624898,0.86,0.008675296061690995
168,worldpolitics,Instead they worship a golden cow,1583239704.0,"03/03/2020, 12:48:24",783,2,14435,1776.4479468924783,0.89,0.05424315898856945
169,worldpolitics,We’ve got your back guys,1589707472.0,"05/17/2020, 09:24:32",222,3,14228,2305.7866702320607,0.86,0.015603036266516728
170,worldpolitics,Who could have imagined ....,1586779241.0,"04/13/2020, 12:00:41",859,4,14080,1323.3320159244086,0.91,0.06100852272727273
171,worldpolitics,We could have just skipped the primary season,1583287671.0,"03/04/2020, 02:07:51",2252,1,13838,2638.381581755497,0.84,0.1627402803873392
172,worldpolitics,Absolutely Despicable,1585969166.0,"04/04/2020, 02:59:26",834,2,13684,1439.8463797794593,0.9,0.060947091493715286
173,worldpolitics,"Fuck it, world politics is in shambles, upvote to bring attention to tianamen cube",1589037544.0,"05/09/2020, 15:19:04",204,1,13640,877.2203785375568,0.94,0.014956011730205278
174,worldpolitics,"If this gets 5 upvotes, I will replace all the soda in my garage with water",1591722535.0,"06/09/2020, 17:08:55",237,0,13620,2337.854685062108,0.85,0.01740088105726872
175,worldpolitics,TOLD YA!!!!!,1577463806.0,"12/27/2019, 16:23:26",1258,0,13546,2252.73797203486,0.86,0.09286874354052857
176,worldpolitics,"To support FOS or not to support FOS, that is the question!",1587680516.0,"04/23/2020, 22:21:56",1473,1,13492,1727.1063780986497,0.89,0.10917580788615476
177,worldpolitics,Orwell,1588120358.0,"04/29/2020, 00:32:38",1211,4,13216,2222.158432361646,0.86,0.0916313559322034
178,worldpolitics,said the quiet parts out loud,1579447789.0,"01/19/2020, 15:29:49",271,0,13065,687.5225844099696,0.95,0.020742441637964026
179,worldpolitics,The Connection Between Slavery And American Capitalism!,1582725210.0,"02/26/2020, 13:53:30",1097,1,13049,2483.1963132429664,0.84,0.08406774465476281
180,worldpolitics,Republicans don't care about the poor and middle class. They only measure a person's worth based on their economic output.,1587125442.0,"04/17/2020, 12:10:42",835,3,13008,1821.3364462719164,0.88,0.06419126691266913
181,worldpolitics,Upvote to stray further,1589308449.0,"05/12/2020, 18:34:09",50,0,12997,622.6354227827705,0.95,0.003847041624990382
182,worldpolitics,These are Christians I can stand behind,1581416562.0,"02/11/2020, 10:22:42",815,1,12896,2387.7915020250402,0.84,0.06319789081885856
183,worldpolitics,Brexit freedom explained!,1581004384.0,"02/06/2020, 15:53:04",925,0,12898,1415.418258142554,0.9,0.07171654520080632
184,worldpolitics,No hostile takeover is complete without a superior siege engine,1588860870.0,"05/07/2020, 14:14:30",164,5,12855,842.0711835312959,0.94,0.012757681835861533
185,worldpolitics,I am once again asking you to upvote my my titties,1588868846.0,"05/07/2020, 16:27:26",481,3,12838,2535.1777824450546,0.84,0.03746689515500857
186,worldpolitics,Republican hypocrisy knows no bounds,1574105911.0,"11/18/2019, 19:38:31",975,0,12737,1426.4946779562579,0.9,0.0765486378268038
187,worldpolitics,UPVOTE WINNIE THE POOH,1589174251.0,"05/11/2020, 05:17:31",91,2,12697,826.3419555681267,0.94,0.007167047334015909
188,worldpolitics,Woman who lost job for middle-finger gesture to Trump wins election and now gets power to legislate over his golf course,1573041467.0,"11/06/2019, 11:57:47",1022,0,12563,1259.3815524379188,0.91,0.0813499960200589
189,worldpolitics,Truth,1584903094.0,"03/22/2020, 18:51:34",853,1,12477,3010.176334793552,0.81,0.06836579305922898
190,worldpolitics,What COVID-19 has exposed!,1584145607.0,"03/14/2020, 00:26:47",498,1,12208,1105.5747040582446,0.92,0.04079292267365662
191,worldpolitics,What's the verdict on thots who play Warhammer?,1589663767.0,"05/16/2020, 21:16:07",702,4,12195,1801.6539984593,0.87,0.057564575645756455
192,worldpolitics,In honor of George Floyd,1591154628.0,"06/03/2020, 03:23:48",173,1,12179,2086.5678005846894,0.85,0.014204778717464488
193,worldpolitics,Upvote my cute little PUSSY,1589533053.0,"05/15/2020, 08:57:33",154,2,12104,1042.6789480925872,0.92,0.012723066754791804
194,worldpolitics,Things America can't afford,1580665211.0,"02/02/2020, 17:40:11",921,1,12094,1654.5989618015956,0.88,0.07615346452786506
195,worldpolitics,I mean.... Can we at least come to some sort of compromise here? 💁🏻‍♀️ (oc),1589933367.0,"05/20/2020, 00:09:27",550,4,12045,2588.5353830649146,0.82,0.045662100456621
196,worldpolitics,Welcome to the revolution Yang gang,1581495405.0,"02/12/2020, 08:16:45",698,0,11900,1563.6198516847053,0.88,0.05865546218487395
197,worldpolitics,How many upvotes can the uncle of the internet get?,1589773690.0,"05/18/2020, 03:48:10",114,5,11793,1355.9973087419676,0.9,0.00966675146273213
198,worldpolitics,Let's do it,1576237534.0,"12/13/2019, 11:45:34",1096,1,11774,2875.0972552734165,0.8,0.09308646169526075
199,worldpolitics,Have a great day!,1579543284.0,"01/20/2020, 18:01:24",765,0,11768,722.6277492529134,0.94,0.06500679809653297
200,worldpolitics,"Nails it, again.",1587168384.0,"04/18/2020, 00:06:24",763,0,11681,3163.9763845822017,0.79,0.06531975002140228
201,worldpolitics,"Naked girls get thousands of upvotes, how many for our boys in blue?",1589553581.0,"05/15/2020, 14:39:41",158,3,11673,1322.1072735936432,0.9,0.013535509294954168
202,worldpolitics,Hmm...,1591221225.0,"06/03/2020, 21:53:45",219,0,11655,465.4777530812826,0.96,0.01879021879021879
203,worldpolitics,MAGA Logic,1579018450.0,"01/14/2020, 16:14:10",1571,1,11617,2913.7111424617524,0.8,0.13523284841181027
204,worldpolitics,Not Complaining,1588863355.0,"05/07/2020, 14:55:55",151,0,11562,482.7859316315171,0.96,0.013060024217263448
205,worldpolitics,Wow!!!!!,1579918560.0,"01/25/2020, 02:16:00",748,2,11548,537.1316284969325,0.96,0.06477312088673363
206,worldpolitics,Someone called Trump's bluff,1588054765.0,"04/28/2020, 06:19:25",880,0,11448,2343.062129737953,0.83,0.07686932215234102
207,worldpolitics,Perfect crime,1583322788.0,"03/04/2020, 11:53:08",338,1,11431,1328.0551433926757,0.9,0.02956871664771236
208,worldpolitics,Impeachment eve rallies across the United States,1576634527.0,"12/18/2019, 02:02:07",1639,0,11248,1605.2038928927632,0.88,0.14571479374110954
209,worldpolitics,Don't forget,1581056830.0,"02/07/2020, 06:27:10",491,0,11204,1034.2938500435048,0.92,0.0438236344162799
210,worldpolitics,Think of this when you call them shit hole countries next time!,1584886090.0,"03/22/2020, 14:08:10",479,0,11154,1508.9201253166575,0.88,0.04294423525192756
211,worldpolitics,Best description of 3 years of Trump!,1580087326.0,"01/27/2020, 01:08:46",863,2,11119,2394.339985555196,0.82,0.07761489342566777
212,worldpolitics,I'd rather have universal healthcare than a Space Force.,1576854741.0,"12/20/2019, 15:12:21",1127,1,11084,1806.2216169120857,0.86,0.10167809455070372
213,worldpolitics,"You all upvoting porn, dogs and pussy, how many can a potato get?",1592220394.0,"06/15/2020, 11:26:34",139,1,11075,1061.3369555345635,0.91,0.01255079006772009
214,worldpolitics,Make me fit boi,1593981510.0,"07/05/2020, 20:38:30",158,3,10952,1879.5154438348509,0.85,0.014426588750913075
215,worldpolitics,Bern it to the Ground !,1583009197.0,"02/29/2020, 20:46:37",623,0,10880,1761.5650326858467,0.86,0.057261029411764704
216,worldpolitics,Found this on fb. Def. belongs here,1588458306.0,"05/02/2020, 22:25:06",857,2,10839,1044.6466241760536,0.91,0.07906633453270596
217,worldpolitics,Upvote this picture of Rudy Giuliani so it becomes the top image on Google.,1603313934.0,"10/21/2020, 20:58:54",426,5,10959,989.937969987217,0.92,0.03887215986860115
218,worldpolitics,Who is the foreign agent?,1582383142.0,"02/22/2020, 14:52:22",947,0,10688,1794.6667048396175,0.86,0.08860404191616766
219,worldpolitics,Welcome to the cum zone,1590945620.0,"05/31/2020, 17:20:20",142,0,10680,1419.211986570721,0.88,0.013295880149812735
220,worldpolitics,Agreed.,1583964887.0,"03/11/2020, 22:14:47",942,0,10664,1271.617686444908,0.89,0.08833458364591147
221,worldpolitics,I’m chinese and ginger!,1595254762.0,"07/20/2020, 14:19:22",400,16,10603,457.9236889265667,0.96,0.0377251721210978
222,worldpolitics,Meanwhile in Iowa,1572926262.0,"11/05/2019, 03:57:42",655,1,10593,1596.3093236705536,0.87,0.061833286132351555
223,worldpolitics,"If you're worried Bernie couldn't get anything through Congress, then change who's in fucking Congress",1581924292.0,"02/17/2020, 07:24:52",958,2,10566,2021.5891815336508,0.84,0.09066818095778914
224,worldpolitics,Unsolicited Dick Pic,1591283133.0,"06/04/2020, 15:05:33",160,0,10430,802.9465172064374,0.93,0.015340364333652923
225,worldpolitics,How interesting...,1578534261.0,"01/09/2020, 01:44:21",700,0,10424,1435.735741714565,0.88,0.0671527244819647
226,worldpolitics,Child labor is so cute!,1576677033.0,"12/18/2019, 13:50:33",568,0,10402,969.8015390313685,0.91,0.05460488367621611
227,worldpolitics,Upvote This,1592319007.0,"06/16/2020, 14:50:07",130,1,10380,2699.221779832553,0.79,0.012524084778420038
228,worldpolitics,Tell me more about them human rights America.,1577157351.0,"12/24/2019, 03:15:51",1443,0,10372,1174.6530060963341,0.9,0.13912456613960664
229,worldpolitics,The irony,1585090863.0,"03/24/2020, 23:01:03",519,0,10327,509.295737462995,0.95,0.05025660888931926
230,worldpolitics,IMPORTANT PSA!,1592497154.0,"06/18/2020, 16:19:14",239,0,10319,670.250659667312,0.94,0.023161159027037505
231,worldpolitics,Next Tipp,1587812543.0,"04/25/2020, 11:02:23",446,0,10243,622.8891883539873,0.94,0.043541931074880406
232,worldpolitics,His men cheered for him as he left.... that tells the story,1585932310.0,"04/03/2020, 16:45:10",602,0,10212,440.454731215179,0.96,0.05895025460242852
233,worldpolitics,"Will Bunch: Just now, it's reported that A)Trump donor, Mar-a-Lago pal runs a pharmaceutical company selling hydroxychloroquine sulfate and B)The government is confiscating key medical supplies that are doled out to Trump favorites. Not one major U.S. paper has called for Trump to resign",1586488101.0,"04/10/2020, 03:08:21",1002,0,10189,1145.3942771951752,0.9,0.09834134851310236
234,worldpolitics,Ever notice only trump’s people are charged/found guilty of felonies?,1573909642.0,"11/16/2019, 13:07:22",1458,0,10148,3269.5631924833633,0.76,0.14367363027197477
235,worldpolitics,"Cant beat em, join em",1589111522.0,"05/10/2020, 11:52:02",186,2,10132,526.9125590762214,0.95,0.01835767864192657
236,worldpolitics,Peace at last.,1590295004.0,"05/24/2020, 04:36:44",422,2,10039,884.0086631205559,0.92,0.042036059368463
237,worldpolitics,The party of law and order strikes again.,1587000122.0,"04/16/2020, 01:22:02",659,0,9994,689.4682177588693,0.94,0.06593956373824295
238,worldpolitics,r/russia banned me for this but i spent too much time on it to just give up. please screenshot this and show r/russia what they are missing,1593352617.0,"06/28/2020, 13:56:57",472,0,9982,1004.2467087098175,0.91,0.04728511320376678
239,worldpolitics,Hey there im getting fat coz covid so in 3 hours i will do how many pushups i have to from this on reddit live stream :) see you there,1597927949.0,"08/20/2020, 12:52:29",330,0,9897,1104.0970116285425,0.9,0.033343437405274325
240,worldpolitics,Heard worldpolitics is a porn subreddit now. Heres my titties!,1588828917.0,"05/07/2020, 05:21:57",491,0,9830,1707.9199767704467,0.85,0.04994913530010173
241,worldpolitics,'Honest' Trump,1580026936.0,"01/26/2020, 08:22:16",552,0,9794,620.0220603110192,0.94,0.056361037369818255
242,worldpolitics,Mitch McConnell! Upvote this so it’s the first thing people see when they search for Mitch McConnell.,1601420625.0,"09/29/2020, 23:03:45",136,4,9779,1356.7092903774992,0.88,0.013907352490029655
243,worldpolitics,"Y'all upvoting tits and dogs, how many can snek get?",1592136435.0,"06/14/2020, 12:07:15",111,6,9744,1378.8209279629755,0.88,0.011391625615763547
244,worldpolitics,Change my mind.,1588426580.0,"05/02/2020, 13:36:20",423,1,9649,1108.2444721733773,0.9,0.04383873976577884
245,worldpolitics,A rare sight indeed...,1580959369.0,"02/06/2020, 03:22:49",551,1,9596,1152.8930338684258,0.89,0.057419758232596915
246,worldpolitics,Day 1,1584411576.0,"03/17/2020, 02:19:36",540,1,9580,1810.7637227762298,0.84,0.05636743215031315
247,worldpolitics,"If this gets enough upvotes, there will be a picture of a giant flying penis on the frontpage.",1588829332.0,"05/07/2020, 05:28:52",46,0,9576,843.3487318433527,0.92,0.004803675856307435
248,worldpolitics,The world is watching America falling in pieces.,1599907844.0,"09/12/2020, 10:50:44",1253,10,9524,1254.3466814983567,0.88,0.13156236875262495
249,worldpolitics,This is how we know Bernie's our candidate.,1582846586.0,"02/27/2020, 23:36:26",1014,2,9409,1552.5136748377645,0.86,0.10776915718992454
250,worldpolitics,There you go,1592417680.0,"06/17/2020, 18:14:40",122,3,9403,836.9866888801334,0.92,0.012974582580027651
251,worldpolitics,"Grant Imahara, I learned alot from you as a kid, you will be sorely missed. RIP.",1594732510.0,"07/14/2020, 13:15:10",197,1,9390,421.8406288677561,0.96,0.020979765708200215
252,worldpolitics,The people at the bottom are the economy,1586735238.0,"04/12/2020, 23:47:18",456,0,9374,705.7687720489885,0.93,0.048645188820140815
253,worldpolitics,How many like for my dad with some random fish?,1590265936.0,"05/23/2020, 20:32:16",209,4,9333,1268.3678717406583,0.88,0.02239365691631844
254,worldpolitics,"We'll likely 'never see a more godly' president than Trump, Michele Bachmann says",1581700546.0,"02/14/2020, 17:15:46",760,2,9275,1294.8855380644763,0.88,0.08194070080862534
255,worldpolitics,Different kind of Crusade,1589709390.0,"05/17/2020, 09:56:30",131,3,9259,1650.8427006752627,0.85,0.014148396155092342
256,worldpolitics,Quadruple the tits Quadruple the Karma?,1589204835.0,"05/11/2020, 13:47:15",314,0,9257,1397.1347079963343,0.87,0.03392027654747758
257,worldpolitics,Ah shit here we go again,1591000391.0,"06/01/2020, 08:33:11",184,0,9135,691.690433420581,0.93,0.020142309797482213
258,worldpolitics,why do i hear boss music?,1589709975.0,"05/17/2020, 10:06:15",94,0,9069,880.6569020792103,0.91,0.01036497960083802
259,worldpolitics,GOP Senators,1579708891.0,"01/22/2020, 16:01:31",1050,0,9050,1445.8144404374198,0.86,0.11602209944751381
260,worldpolitics,The Simpsons nailed it again.,1590661573.0,"05/28/2020, 10:26:13",82,0,9001,234.71421521039883,0.97,0.009110098877902456
261,worldpolitics,I will rub this dogs tummy once for every upvote I get. No upvotes means no tummy rubs.,1591930534.0,"06/12/2020, 02:55:34",133,0,8989,1105.386433201369,0.89,0.014795861608632773
262,worldpolitics,If naked women can get thousands of upvoted how many can our lord get?,1593784018.0,"07/03/2020, 13:46:58",137,0,8937,1530.7525994542557,0.85,0.015329528924695088
263,worldpolitics,Murphy's law in action,1593070325.0,"06/25/2020, 07:32:05",117,0,8831,300.66495436892546,0.97,0.013248782697316273
264,worldpolitics,"No, not like that.",1583757335.0,"03/09/2020, 12:35:35",445,0,8823,423.6373471063198,0.95,0.05043635951490423
265,worldpolitics,"I'm new to reddit, but this place seems pretty neat",1589864876.0,"05/19/2020, 05:07:56",95,1,8730,337.5145234120555,0.96,0.010882016036655211
266,worldpolitics,Me checking r/worldpolitics for any new headlines around the world,1588804015.0,"05/06/2020, 22:26:55",171,1,8707,181.96870588577985,0.98,0.019639370621339153
267,worldpolitics,*Confusing nut*,1589651949.0,"05/16/2020, 17:59:09",124,2,8683,163.7432955278182,0.98,0.014280778532765173
268,worldpolitics,These leaders put themselves on the line for common decency. How will you vote?,1576139189.0,"12/12/2019, 08:26:29",703,1,8685,1109.332544700188,0.89,0.08094415659182498
269,worldpolitics,Plea from the healthcare staff!,1585438425.0,"03/28/2020, 23:33:45",1361,1,8539,5773.303263122816,0.6,0.15938634500526994
270,worldpolitics,The truth will set you free..,1579664838.0,"01/22/2020, 03:47:18",832,0,8535,1283.9102882023617,0.87,0.09748096074985355
271,worldpolitics,"I mean, you would have to be pretty self-deluded.",1577780484.0,"12/31/2019, 08:21:24",1118,0,8451,1534.15154159558,0.85,0.1322920364453911
272,worldpolitics,oh God oh oh Fuck,1590220462.0,"05/23/2020, 07:54:22",191,1,8448,273.46628933799366,0.97,0.022608901515151516
273,worldpolitics,The mad lad actually did it,1591332185.0,"06/05/2020, 04:43:05",229,0,8401,358.6889284431345,0.96,0.027258659683371027
274,worldpolitics,All of the Las Vegas hotels have donated food and rooms for emergency personnel in Las Vegas except for one: The Trump International Hotel Las Vegas.,1586555521.0,"04/10/2020, 21:52:01",634,1,8337,416.96425299904513,0.95,0.07604653952261005
275,worldpolitics,I'm too afraid to ask anymore...,1588844929.0,"05/07/2020, 09:48:49",127,0,8287,389.82169034571416,0.96,0.015325208157354893
276,worldpolitics,Leadership vs. Reality TV,1582988703.0,"02/29/2020, 15:05:03",923,0,8267,1072.5088538946366,0.89,0.11164872384178057
277,worldpolitics,I drink a pint of strong ale for each upvote!,1591974502.0,"06/12/2020, 15:08:22",324,0,8249,986.3774020140609,0.89,0.039277488180385504
278,worldpolitics,Not that I’m complaining,1588857295.0,"05/07/2020, 13:14:55",48,1,8249,236.8955352991743,0.97,0.005818887137834889
279,worldpolitics,ACTUAL small tits that ACTUALLY deserve updoots,1594483816.0,"07/11/2020, 16:10:16",83,0,8240,402.4731656369986,0.95,0.010072815533980583
280,worldpolitics,"Quick, the mods are asleep so upvote this bread",1595651772.0,"07/25/2020, 04:36:12",109,0,8218,1058.686154087025,0.89,0.013263567778048187
281,worldpolitics,"A Saudi Wahhabi terrorist killed 3 american citizens on US soil and trump reaction is to accept Muhammad Bone Saw prince ""apology """,1575717738.0,"12/07/2019, 11:22:18",1110,0,8219,1078.3592320234675,0.88,0.13505292614673317
282,worldpolitics,This is the most important thing you will ever upvote today,1592361290.0,"06/17/2020, 02:34:50",49,0,8207,593.2888319747126,0.93,0.005970512976727184
283,worldpolitics,Every upvote gets a nude,1603390569.0,"10/22/2020, 18:16:09",180,10,8420,1381.6701328228683,0.86,0.021377672209026127
284,worldpolitics,The orange cult is falling right in line.,1578206508.0,"01/05/2020, 06:41:48",756,0,8160,388.19714185325574,0.95,0.09264705882352942
285,worldpolitics,( . )( .) Check out these big ole animitties ( .)( .),1592454550.0,"06/18/2020, 04:29:10",215,3,8158,367.31780791010897,0.96,0.026354498651630302
286,worldpolitics,Upvote hot Spanish chicks,1589075187.0,"05/10/2020, 01:46:27",80,1,8152,576.7103718054259,0.93,0.009813542688910697
287,worldpolitics,What everyone was already thinking!,1588859395.0,"05/07/2020, 13:49:55",442,1,8040,766.2379135544179,0.91,0.054975124378109454
288,worldpolitics,Upvote this so people get Rick rolled when they join,1589030063.0,"05/09/2020, 13:14:23",62,0,7983,766.394957405666,0.91,0.007766503820618815
289,worldpolitics,Fun facts,1600453898.0,"09/18/2020, 18:31:38",125,10,7896,329.6894418535958,0.96,0.01583080040526849
290,worldpolitics,Guys this is really important,1594837805.0,"07/15/2020, 18:30:05",231,0,7765,418.12287562407255,0.95,0.029748873148744366
291,worldpolitics,This is human body at its finest,1589982697.0,"05/20/2020, 13:51:37",86,0,7671,557.2426052938335,0.93,0.011211054621301004
292,worldpolitics,The Words of a true President and Christian,1582151085.0,"02/19/2020, 22:24:45",736,3,7667,473.59817061813374,0.94,0.09599582626842311
293,worldpolitics,"I am honest, just upvote me for free to give me karma",1589324122.0,"05/12/2020, 22:55:22",57,0,7645,660.3334442895175,0.92,0.007455853499018967
294,worldpolitics,Taking one glance at this subreddit,1589203220.0,"05/11/2020, 13:20:20",43,3,7630,169.62168832894804,0.98,0.0056356487549148095
295,worldpolitics,Upvote the One True God,1589045735.0,"05/09/2020, 17:35:35",145,0,7634,596.3164978002915,0.93,0.01899397432538643
296,worldpolitics,Upvote this kickass turtle,1591635515.0,"06/08/2020, 16:58:35",120,0,7622,232.4083550571777,0.97,0.01574389923904487
297,worldpolitics,1 upvote = 1 boop on Dexters nose and 1 treat,1594045712.0,"07/06/2020, 14:28:32",170,0,7615,1037.163254357114,0.88,0.02232435981615233
298,worldpolitics,"‘Seven whistleblowers’: ""Kushner (allegedly) gave the green light to MBS to arrest ... Jamal Khashoggi ... Turkish intelligence obtained an intercept of the call between Kushner and MBS. And President Erdogan used it to get Trump to roll over and pull American troops out of northern Syria.""",1572868833.0,"11/04/2019, 12:00:33",552,2,7569,499.16335295224144,0.94,0.0729290527150218
299,worldpolitics,"Boobs get likes, but What About Bob?",1597262340.0,"08/12/2020, 19:59:00",160,2,7568,550.761356346984,0.93,0.021141649048625793
300,worldpolitics,I made dinner and need karma,1590462613.0,"05/26/2020, 03:10:13",108,0,7560,949.4000970824636,0.89,0.014285714285714285
301,worldpolitics,I don't have beef with any Iranians,1578351449.0,"01/06/2020, 22:57:29",617,0,7536,498.50712071777707,0.94,0.08187367303609341
302,worldpolitics,Kim Jong Un. Make this the first thing people see when they google his name.,1588948762.0,"05/08/2020, 14:39:22",59,1,7538,496.3122177588966,0.94,0.007827009816927567
303,worldpolitics,"If naked women can get thousanda of upvotes, how many can a picture of the beautiful Alaskan landscape get?",1596845790.0,"08/08/2020, 00:16:30",99,0,7507,798.3844055905447,0.9,0.013187691487944585
304,worldpolitics,Naked girls get thousands of upvotes how much can this old fisherman from Senegal get,1598815713.0,"08/30/2020, 19:28:33",108,2,7466,520.2335841855283,0.93,0.014465577283686044
305,worldpolitics,Let’s vote for what really matters,1591116741.0,"06/02/2020, 16:52:21",106,1,7434,387.9859749712532,0.95,0.01425881086898036
306,worldpolitics,upvote if you like nudes with your news 😏,1588864406.0,"05/07/2020, 15:13:26",96,0,7420,791.7937776025392,0.9,0.01293800539083558
307,worldpolitics,Just checking in to see if America is great yet?,1584643468.0,"03/19/2020, 18:44:28",720,2,7402,990.0362447764273,0.88,0.09727100783572007
308,worldpolitics,This sub right now,1592276561.0,"06/16/2020, 03:02:41",81,1,7379,2299.443429188508,0.76,0.010977097167637891
309,worldpolitics,Upvote if you want this good boi to smash the primaries:,1575939128.0,"12/10/2019, 00:52:08",571,1,7370,2318.5104861338186,0.76,0.07747625508819539
310,worldpolitics,These are confusing times.,1589764744.0,"05/18/2020, 01:19:04",112,0,7349,358.6535964137647,0.95,0.015240168730439516
311,worldpolitics,Money go brrr,1592830924.0,"06/22/2020, 13:02:04",111,1,7334,268.8163304834661,0.96,0.015134987728388328
312,worldpolitics,Current state of the realm,1589628774.0,"05/16/2020, 11:32:54",183,1,7316,361.3467225499462,0.95,0.02501366867140514
313,worldpolitics,"much like our politicians, i bet it'd take you longer to clean up this mess than you think (oc)",1591532543.0,"06/07/2020, 12:22:23",350,0,7278,893.3464928948342,0.89,0.04809013465237703
314,worldpolitics,A dollar in my G-string 😜🤭,1596068931.0,"07/30/2020, 00:28:51",113,4,7230,260.4054173665372,0.97,0.015629322268326418
315,worldpolitics,I love this subreddit,1589643495.0,"05/16/2020, 15:38:15",162,2,7227,408.33673048444416,0.95,0.0224159402241594
316,worldpolitics,Naked girls get thousands of likes. What about my dog?,1599577659.0,"09/08/2020, 15:07:39",80,12,7229,1074.3375926973695,0.87,0.011066537557061834
317,worldpolitics,Upvote if you like nuclear titties (the future if the energy),1590839898.0,"05/30/2020, 11:58:18",102,0,7221,380.64121796403833,0.95,0.014125467386788533
318,worldpolitics,One of these is not like the others,1578023739.0,"01/03/2020, 03:55:39",508,0,7206,1399.1891868228813,0.84,0.07049680821537607
319,worldpolitics,A bit misleading,1596681060.0,"08/06/2020, 02:31:00",90,0,7213,171.43376813044233,0.98,0.01247747123249688
320,worldpolitics,Why are they there,1575411497.0,"12/03/2019, 22:18:17",521,0,7194,856.6613107926614,0.89,0.07242146232971922
321,worldpolitics,So unfair!!!,1579822025.0,"01/23/2020, 23:27:05",565,0,7180,438.75295114952496,0.94,0.0786908077994429
322,worldpolitics,Basically what's happening right now,1589827758.0,"05/18/2020, 18:49:18",65,0,7169,577.7718489539238,0.93,0.009066815455433115
323,worldpolitics,This exists therefore it must be upvoted.,1603980850.0,"10/29/2020, 14:14:10",83,8,7254,446.7169575934404,0.94,0.011441963054866281
324,worldpolitics,I will drink a bottle of water for every upvote I get,1591900398.0,"06/11/2020, 18:33:18",177,0,7151,560.4533411428374,0.93,0.024751782967417143
325,worldpolitics,First time coming to this subreddit,1599148697.0,"09/03/2020, 15:58:17",61,8,7128,339.98215690012967,0.95,0.00855780022446689
326,worldpolitics,Petition to make this our new subreddit header.,1588909473.0,"05/08/2020, 03:44:33",126,1,7120,322.2123233866878,0.96,0.017696629213483146
327,worldpolitics,"So girls with huge badonkers get thousends of upvotes, how much can our brave brothers get?",1592059940.0,"06/13/2020, 14:52:20",143,0,7099,975.5964592691162,0.88,0.0201436822087618
328,worldpolitics,Wise and relevant words from an Iranian novelist,1578277725.0,"01/06/2020, 02:28:45",385,2,7070,329.16438698591264,0.96,0.054455445544554455
